DATA,ENTREVISTA,ORDEM,LOCUTOR,FALA
21/10/2008,Baltasar Garzón,44,Baltasar Garzón,"A sua pergunta não é fácil, especialmente pelo contexto, e contém várias partes. Você menciona o caso da pena de morte aplicada no caso chamado Medellín. Este caso Medellín está intimamente ligado a outro caso, o caso Avena. E consiste da denúncia do México perante a Corte Internacional de Haia, que não deve ser confundida com o Tribunal Penal Internacional. O caso era a falta de assistência consular a um total de noventa presos condenados à pena de morte, que eram mexicanos. Porque os Estados Unidos tinham infringido o convênio de assistência consular de Viena. A Corte Internacional de Justiça deu razão ao México e instava os Estados Unidos a cumprir com essa resolução e oferecer assistência consular com a qual se poderia chegar a uma anulação das sentenças. O governo dos Estados Unidos inicialmente decidiu que a resolução deveria ser cumprida. Porém, o estado do Texas declarou que uma decisão de uma Corte Internacional de Justiça não era vinculante para o Texas. Essa decisão foi ratificada pela Corte Suprema do Texas e depois pela Corte Suprema dos Estados Unidos, o que é particularmente grave, já que o caso foi decidido contra o critério do governo dos Estados Unidos, que disseram que, se a Corte Suprema decidiu que o tribunal do Estado do Texas tem prevalência sobre a Corte Internacional, não há nada que eles possam fazer. Eles estão tratando de mudar a lei, o protocolo. Isso me parece uma barbaridade. Pois a prevalência da Corte Internacional de Justiça, que é uma jurisdição voluntária, porém aceita pelos estados, deve ter um critério pelo menos declarativo preferente. Resoluções não foram cumpridas em outros casos, como o do muro de Israel com a Cisjordânia, em que se exigiu que o muro fosse recuado em alguns metros e não o fizeram. Porém, o Supremo Tribunal de Israel depois modificou a situação. Outro tema é a Corte Penal Internacional, em que, para cada um dos casos, os países que tomam parte no Tribunal Penal Internacional têm estabelecido um critério de prevalência: quem intervém primeiro, quem deve intervir, quando o crime pode ser da competência da corte e quando pode ser da competência do país. Existe uma justiça complementar. Quer dizer, primeiro o país tem que atuar. Se não o fizer, porque não quer ou não pode, passa a ser a vez do Tribunal Penal Internacional. E, se ele não o fizer, qualquer país que disponha do princípio de justiça penal universal poderá atuar. Então, vários cenários podem ocorrer nas duas últimas esferas, que são o Tribunal Penal Internacional e a justiça local que aplicar o princípio da justiça penal universal. Na primeira, essa acusação é correta, porque está no sentimento universal de que o Tribunal Penal Internacional aplica justiça para países pouco poderosos e não para os responsáveis de países poderosos. Isso é relativamente certo. Acontece que os Estados Unidos, China, Rússia, Israel, Iraque e muitos outros países não fazem parte desse tribunal. E, portanto, não são regidos pela normativa dele. Com o tempo, eles entrarão no Tribunal. Por outro lado, existem outros países poderosos, os da União Européia, e, portanto, se ocorresse um crime, que precisa ser um crime pessoal, que não seja responsabilidade do Estado e sim de pessoas, poderiam ser submetidos ao Tribunal Penal Internacional, se a sua justiça local não fizesse nada. E, no último caso, no da justiça penal internacional, pelo princípio da justiça penal universal, ao ser justiça entre iguais, de um Estado a outro, não se pode quebrantar o princípio da Carta das Nações Unidas de igualdade entre os Estados. Portanto, se o responsável é uma alta autoridade do Estado, como um chefe de Estado, primeiro ministro, ou ministro de relações exteriores, pela Convenção de Viena protegido por garantias diplomáticas e imunidade diplomática, não pode intervir até que tal autoridade deixe o seu cargo."
21/10/2008,Baltasar Garzón,45,Cláudia Antunes,"Então, no caso do Sudão, ele não poderia ser preso, mesmo que o Tribunal Penal Internacional aceite a denúncia?"
21/10/2008,Baltasar Garzón,46,Baltasar Garzón,"Sim, está no Tribunal Penal Internacional. Mas, pelo fato de que o Sudão não ratificou o estatuto da corte, existe uma norma no estatuto que estabelece as normas de competência que requer que o Estado faça parte, mas também diz que naqueles casos em que o Conselho de Segurança das Nações Unidas, que, como sabemos, possui cinco membros permanentes, que são a Grã-Bretanha, França, Rússia, China e Estados Unidos, estiverem de acordo, porque se um deles exerce o direito de veto, já não existe um acordo, se eles estão de acordo junto com os outros dez membros, é possível realizar uma investigação de um Estado que não faz parte da corte. Nesse caso, o que aconteceu foi que o Conselho de Segurança, com a abstenção da China e dos Estados Unidos, proferiu a ordem de investigação. Portanto, outorgando competência ao promotor do Tribunal Penal Internacional, que iniciou a investigação e que a terminou provisoriamente há aproximadamente um mês com a acusação contra o atual presidente do Sudão."
21/10/2008,Baltasar Garzón,47,Lillian Witte Fibe,"Nós vamos fazer um intervalo e eu volto a lembrar que, como o programa de hoje está sendo gravado, as perguntas dos telespectadores foram enviadas antes por e-mail através do site www.tvcultura.com.br/rodaviva. Até já."
21/10/2008,Baltasar Garzón,48,[...],[intervalo]
21/10/2008,Baltasar Garzón,49,Lillian Witte Fibe,"Este, então, é o último bloco do Roda Viva, que hoje está entrevistando o juiz espanhol Baltasar Garzón, conhecido pelo pedido de prisão do ex-ditador chileno Augusto Pinochet, e presente em muitos casos importantes da justiça na Espanha, onde já mandou prender também grandes traficantes, terroristas e políticos corruptos. Doutor Baltasar Garzón, a julgar pelo o que a gente ouviu da sua resposta à pergunta da Cláudia, antes do intervalo, nem pensar, então, em julgamento internacional do que aconteceu no Iraque durante a guerra declarada pelos Estados Unidos com alguns aliados, que o senhor, aliás, é a favor que seja investigada?"
21/10/2008,Baltasar Garzón,50,Baltasar Garzón,"Para mim, a Guerra do Iraque foi uma guerra ilegal e imoral e, portanto, as conseqüências dessa guerra, em muitos casos, são imputáveis àqueles que a declararam. Não havia nenhuma causa objetiva. E, quando digo nenhuma, quero dizer nenhuma - como foi demonstrado posteriormente - que justificasse a invasão do Iraque. Foram usados argumentos conjunturais, na sua maioria falsificados, para propiciar esse ataque que gerou centenas de milhares de vítimas de cidadãos civis. Portanto, essa possível responsabilidade é que algo que precisa ser discutido em algum momento... Não digo que precisa ser no Tribunal Penal Internacional, porque provavelmente alguns desses responsáveis não poderão ser julgados por ele, mas há respostas nos respectivos países. Houve iniciativas, e temos que ser respeitosos com a ação judicial. Quando uma ação da justiça é postulada, precisamos aceitar também os resultados adversos dessa ação judicial. Não significa que toda ação da Justiça leve a uma condenação. O que é preciso é ter uma resposta judicial e um julgamento com uma condenação ou uma absolvição. Também é verdade que já houve resposta judicial nos EUA em muitos casos relacionados com o Iraque. Apesar de ser uma resposta militar e, portanto, reduzida, nos casos de Abu Ghraib {Abu Ghraib: Abu Ghraib é uma cidade que fica a 32 km de Bagdá, no Iraque. Tornou-se famosa, em 2004, por abrigar uma prisão estadunidense em que prisioneiros de guerra iraquianos foram torturados por membros do exército dos EUA. Anteriormente, durante o regime de Saddam Hussein, a mesma prisão fora usada na tortura e execução de dissidentes políticos.}. Também é verdade que há responsabilidades exigidas no Iraque a respeito daqueles que perpetraram atos de terrorismo em nome de organizações terroristas que não existiam antes da invasão. Até nesse ponto a realidade foi falsificada, porque a única organização terrorista que atuava na época o fazia na faixa sob controle internacional, e não no Iraque dominado por Saddam Hussein {Saddam Hussein: Saddam Hussein Abd al-Majid al-Tikriti (1937-2006) é considerado uma das principais lideranças ditatoriais do mundo árabe, tendo dirigido o Iraque por 24 anos, entre 1979 e 2003. Saddam enfrentou os Estados Unidos em guerras em dois episódios. O primeiro, em 1990, durante a Guerra do Golfo, quando Estados Unidos e países aliados declararam guerra contra o Iraque, que havia invadido o Kwait. Na época, a ação foi liderada pelo presidente americano George Bush. O segundo episódio, em 2003, aconteceu após os ataques terroristas contra os Estados Unidos, em 11 de setembro de 2006, quando aviões se chocaram contra as Torres Gêmeas, que figuravam na lista de construções-símbolo da cidade de Nova Iorque. O presidente George W. Bush [filho] acusou Saddam de produzir armas de destruição em massa e de ser cúmplice dos atentados terroristas. O Iraque foi bombardeado e Saddam tornou-se fugitivo, sendo capturado em dezembro de 2003. O ditador ficou sob custódia americana até ser julgado por um tribunal especial no Iraque, em 2005. Saddam respondeu a acusações de crimes contra a humanidade e acabou condenado à morte. Foi enforcado em dezembro de 2006.}. Estamos de acordo que ele foi um genocida e que foi julgado. Mas não estou de acordo com a pena de morte. E por isso não concordo com essa condenação. Mas houve um julgamento perante o qual ele respondeu. Porém, todas as conseqüências negativas dessa ação militar precisam ser postas na balança da justiça em algum momento."
21/10/2008,Baltasar Garzón,51,Lillian Witte Fibe,"Carmen, vamos a mais uma pergunta de telespectador, por favor."
21/10/2008,Baltasar Garzón,52,Carmen Amorin,"Sim. Uma pergunta de caráter pessoal, aqui, do Jorge Oliveira, de São Paulo. Ele pergunta: “Alguma vez o senhor já sentiu, realmente, que a ameaça de morte fosse verdadeira a ponto de mudar rotinas da sua vida? O que isso interfere na sua vida fora dos tribunais?”."
21/10/2008,Baltasar Garzón,53,Baltasar Garzón,"A segurança e eu somos dois velhos aliados. Porque vivo há mais de vinte anos com segurança permanente. O que altera a sua vida familiar e vida pessoal... todo o sistema familiar está afetado por essas medidas de segurança. Não sou nem a favor nem contra, são os responsáveis pela segurança do Estado que precisam avaliar esse cuidado. Eu faço o que faço porque acredito no que tenho que fazer voluntariamente e, portanto, faria exatamente igual, com segurança ou sem segurança. Tenho recebido ameaças verdadeiras por parte de pessoas dos aparatos do Estado que foram investigadas por ações contra terroristas, assim como por parte dos terroristas, ex-militares argentinos e chilenos, narcotraficantes. Uma história curiosa foi a de um poderoso chefe do tráfico de heroína na Turquia, que, durante mais de seis meses, mandava uma frase dedicada a mim em todos os seus envios de heroína para a Espanha, porque eu tinha desbaratado a sua organização. Quero dizer que as ameaças podem vir de qualquer lado. Mas, concretamente, houve um plano de atentado com disparos a partir de um edifício próximo ao meu escritório, na Audiência Nacional. Mas isso faz parte do trabalho. Estou onde estou porque quero. Acredito que o juiz é um servidor público que deve atuar em defesa da legalidade e servir os cidadãos. É um compromisso pessoal que outros companheiros também fizeram e que perderam a vida dentro da minha organização. Como a promotora do meu tribunal e amiga, Carmen Tagle, que foi assassinada pelo ETA em 12 de setembro de 1989, e alguns juízes que foram alvo de atentados com bomba, e outros companheiros que morreram. Mas cada um de nós assumiu esse risco, e temos que continuar trabalhando"
21/10/2008,Baltasar Garzón,54,Lillian Witte Fibe,Doutor Wálter.
21/10/2008,Baltasar Garzón,55,Wálter Maierovitch,"O senhor exerceu, e muito bem, uma função de contraste ao fenômeno das drogas na Espanha, como secretário de Estado. Todos nós sabemos que a Espanha tem altíssimo consumo de drogas, assim como o Brasil. E tem também aquelas atividades mafiosas em rede. E na Espanha, nós temos muita cocaína colombiana. Pois bem, o senhor escreveu um livro muito interessante, com todo o seu brilho, que esse livro tem... na realidade, o título é uma pergunta. Eu gostaria de lembrar o título desse livro, mas lhe enviar essa pergunta, que é o título do seu livro. O seu livro tem a seguinte pergunta como título: “E se meu filho se droga?”."
21/10/2008,Baltasar Garzón,56,Baltasar Garzón,"É um livro escrito por uma jornalista que colabora comigo e outras pessoas num movimento em benefício da iniciativa Proyecto Hombre, que é uma organização de reabilitação e prevenção da drogadição. Desde 1993, realizamos uma partida de futebol anual contra as drogas, em que envolvemos todos os clubes da primeira divisão da categoria máximo da Espanha. E todos os fundos arrecadados vão para essa organização. E criamos diversos centros de reabilitação e prevenção. Esse livro é um pouco esse resumo. E no prólogo eu fiz uma reflexão sobre os aspectos da prevenção e da educação sobre a saúde pública, espaços de saúde, e como a repressão exagerada do crime de narcotráfico tem se revelado insuficiente e, às vezes, até mesmo inadequada para a erradicação do fenômeno. É um fenômeno muito mais complexo, um fenômeno de educação, de controle da demanda, e não tanto de como sempre foi feito o controle da oferta, através de ações absolutamente sofisticadas que monitoram todas as coordenadas possíveis do Caribe. Eu me lembro que fui convidado em 1993, quando era secretário de Estado, para visitar instalações nos Estados Unidos, e estive em Key West, que é o comando sul do Caribe, e vi todas as instalações que me pareciam ser da Guerra das Estrelas [alusão aos filmes da série Guerra nas Estrelas, escrita por George Lucas, que se passa no espaço e é caracterizado por seus efeitos especiais]. E, no final, perguntei ao general chefe do centro quanta cocaína entra nos Estados Unidos? E ele me respondeu que detectavam apenas cerca de 20%. Ou seja, isso nos dá uma idéia do volume desse tráfico e da ineficiência desse sistema repressivo. Então, a resposta à pergunta seria um sistema educativo, um sistema de prevenção e uma repressão seletiva de algumas das condutas."
21/10/2008,Baltasar Garzón,57,Lillian Witte Fibe,Temos tempo ainda para uma rápida pergunta do Carlos Marchi.
21/10/2008,Baltasar Garzón,58,Carlos Marchi,"O senhor está investigando em sua corte algum caso dos direitos humanos do Brasil? Se sim, como está o andamento dessa investigação? Se não, por que não?"
21/10/2008,Baltasar Garzón,59,Baltasar Garzón,"Não. E a razão é bem clara. Nenhum caso sobre o Brasil foi apresentado ou promovido. É verdade que alguns cidadãos brasileiros aparecem como vítimas dentro da Operação Condor. Mas a investigação é diferente, focada nos possíveis responsáveis chilenos da Operação Condor, apesar de vítimas serem brasileiras. A resposta a essa pergunta deveria vir das próprias autoridades brasileiras. E acredito que não temos que discutir a questão da anistia em relação a esse tema, porque é um tema de estrita cooperação jurídica ou judicial internacional. Portanto, a resposta à petição deveria ocorrer se atualizarmos ou se forem atualizados os pedidos para essa cooperação. Porém, até hoje não houve nenhuma demanda ou denúncia para investigar crimes ocorridos durante a repressão ou ditadura no Brasil e de autores brasileiros. Gostaria de deixar bem claro que a justiça penal, com base no princípio de justiça penal universal, que pode ser aplicada por outro Estado, não é uma justiça de substituição. Trata-se de uma justiça residual, complementar, como o último baluarte para que a impunidade não ocorra. Isso implica que pode e deve haver uma ação interna. E posso lhe dar como exemplo atual o fato de que na Espanha temos diversas investigações sobre casos diferentes, como, por exemplo, o caso Guatemala, o caso do Tibete contra as autoridades chinesas, o do Falun Gong, também contra as autoridades chinesas e o do Saara Espanhol em relação às autoridades marroquinas. Nesses últimos casos, e em particular este último, o que foi feito é perguntar às autoridades marroquinas se estão fazendo algo a respeito, como foi feito com as autoridades argentinas. No momento em que a Argentina começou a investigar através de seus juízes e promotores, o que a justiça espanhola fez foi colaborar, contribuindo com os elementos que dispunha. Em conclusão, trata-se definitivamente de que não haja mais impunidade, que possamos fechar a porta para a impunidade nesses tipos de crimes que têm a natureza de crimes hediondos e de crimes internacionais."
21/10/2008,Baltasar Garzón,60,Lillian Witte Fibe,"Doutor Baltasar Garzón, muito obrigada pela sua presença hoje aqui, no nosso Roda Viva. Gente, obrigada a vocês, nossos entrevistadores. Obrigada, Carmem. Obrigada, Caruso. O Roda Viva volta na semana que vem, e quero agradecer especialmente à presença sua, a presença aqui com a gente do nosso telespectador. Na segunda-feira que vem a gente volta. Até lá."
