DATA,ENTREVISTA,ORDEM,LOCUTOR,FALA
21/10/2008,Baltasar Garzón,22,Baltasar Garzón,"Infelizmente, antes eu podia falar mais sobre o assunto. Mas agora tenho que falar menos, por ser o juiz que investiga esses fatos. Posso dizer que o modelo da transição espanhola, que é reconhecido internacionalmente como um dos modelos exemplares, foi bom nos âmbitos político e social. Conseguiu que o velho regime ou o regime ditatorial e seus representantes se dissolvessem e pedissem a lei da reforma política, que é um caso muito específico, porém deixou uma pendência não resolvida, que foi a questão da ação da justiça em relação aos crimes da ditadura. Isso não quer dizer que não tenha havido respostas judiciais concretas em alguns casos de violação de direitos fundamentais durante o franquismo. O Supremo Tribunal tem se pronunciado, através do chamado recurso de revisão. Porém, não houve uma ação da justiça. E por isso é um capítulo incompleto. E agora se apresentou perante a jurisdição da Audiência Nacional, o meu tribunal, e estamos encarregados de decidir sobre a continuação dessa investigação, se é possível superar os obstáculos legais da passagem do tempo, da falta previsível de responsáveis vivos e, portanto, da extinção da responsabilidade, da qualificação jurídica de crimes de lesa-humanidade ou contra a humanidade, numa época em que essa categoria não existia como crime aceitável internacionalmente, o caráter e a aplicação da anistia decretada em 1986, o caráter de delito permanente ou continuado do desaparecimento de pessoas etc. Podemos transpor essas questões ao Brasil e ver que se parecem bastante com as que estão sendo levantadas atualmente e que continuarão a ser levantadas por aqui. Em relação à Lei da Memória Histórica, esse é o nome pelo qual é conhecida, porque se refere à lei que deveria ter sido a Lei de Reparação e Memória Histórica. Essa lei ficou muito limitada. Acho que é uma pena que todas as políticas não tenham entrado em consenso em relação à lei. Houve duas ausências, por razões opostas: uma do partido conservador, o Partido Popular, que se desvinculou da lei, e outra do partido Esquerra Republicana de Catalunya, que considerou que a lei era muito limitada. No fim das contas, essa lei estabelece a reparação ético-moral das vítimas, a reparação econômica que já vinha sido realizada em seu momento, a possibilidade de recuperação da nacionalidade espanhola por parte dos filhos e netos, nascidos no exterior, de espanhóis que foram exilados da Espanha. A declaração da ilegitimidade dos julgamentos do franquismo não significa a anulação. É importante frisar esse matiz, e também a abolição dos símbolos do franquismo que ainda existirem em ruas, praças, edifícios públicos, a não ser que tenham um conteúdo histórico artístico, que deverá ser decidido pelas autoridades administrativas. E também um tema mais simbólico de criar um espaço de memória coletiva no Valle de los Caídos [memorial franquista erguido entre 1940 e 1958, a cerca de 40 km de Madrid, em memória dos mortos na Guerra Civil Espanhola], onde se reconheçam aqueles que contribuíram para erguer esse monumento, que por mais de quarenta anos foi o símbolo do fascismo e da repressão, e que reconheça que foi dos caídos de ambos os lados. A lei poderia ter ido mais longe, mas não foi o caso."
21/10/2008,Baltasar Garzón,23,Lillian Witte Fibe,"Carmen, quais são as perguntas? O que os nossos telespectadores querem saber?"
21/10/2008,Baltasar Garzón,24,Carmen Amorin,"Então, eu tenho uma pergunta de uma telespectadora do Rio de Janeiro, a Elza Neves Moraes. Ela pergunta o seguinte: “O senhor acha que crimes de torturas e assassinatos de dirigentes políticos, cometidos por agentes do Estado, devem ser considerados imprescritíveis?”."
21/10/2008,Baltasar Garzón,25,Baltasar Garzón,"Teríamos que determinar se é um crime individual, isolado, e responderia como um crime comum cometido por qualquer cidadão. A única diferença seria quando é cometido por uma autoridade do Estado em função da sua categoria, que seria julgado em um tribunal de acordo com o seu foro. No caso de crimes sistemáticos cometidos pelo poder ou com a aquiescência do poder por agentes de corpos militares ou policiais, ou para-policiais ou para-militares, patrocinados, mantidos ou estimulados por um Estado repressor, evidentemente, esses crimes entrariam na categoria de crimes de lesa-humanidade ou crimes contra a humanidade, ou de desaparecimento forçado de pessoas. Em tais casos, temos que estabelecer primeiro se o critério da legislação interna os considera prescritíveis ou não-prescritíveis. Mas, de qualquer jeito, no nível internacional, a comunidade internacional, ou seja, o corpo de convênios de direitos humanos que prevêem e sancionam delitos como genocídio, tortura, desaparecimento forçado de pessoas etc, estabelece claramente a imprescritibilidade desse tipo de crimes. Portanto, a questão seria de estabelecer qual interpretação prevalecerá. Do meu ponto de vista, deve prevalecer a do direito penal internacional, pois é a que mais proteção outorga às vítimas. Nesses tipos de crime, a proteção das vítimas deve primar sobre a impunidade dos perpetradores, o que não significa privá-los de seus direitos. Terão todos os direitos que devam ter, mas nada mais além."
21/10/2008,Baltasar Garzón,26,Carlos Marchi,"Juiz Garzón, no Brasil, agora, nos últimos tempos, tem-se discutido muito essa questão da imprescritibilidade de alguns crimes. E se fala objetivamente nos crimes de ocultação de cadáver. Há cerca de 140 brasileiros, dos quais não se sabe onde estão os seus corpos. Hoje, mais cedo, antes de vir ao programa Roda Viva, o senhor fez uma palestra ao lado do secretário de Direitos Humanos, Paulo Vanucchi, e ele defendeu nessa palestra que esse tipo de crime é um crime continuado, uma vez que as pessoas que determinaram a morte daquele cidadão sabem perfeitamente onde estão seus túmulos, onde eles estão enterrados, seus túmulos clandestinos, e não revelam. Portanto, eles estariam reincidindo no crime. O senhor concorda com essa observação do doutor Paulo Vanucchi?"
21/10/2008,Baltasar Garzón,27,Baltasar Garzón,"Vou um pouco mais longe, no sentido de que, para mim, a denominação de crime continuado não é errônea, é adequada. Porém acredito que se trata mais de um crime permanente. A figura do delito permanente significa que, desde o momento em que ocorreu o evento que motivou o desaparecimento, se foi um desaparecimento forçado e há indícios de que os aparatos do Estado estavam implicados, esse crime está ocorrendo momento a momento e durante o tempo todo, até o exato momento em que se encontra o corpo ou em que o Estado, ou quem tenha propiciado o desaparecimento, ou, se a forma de Estado mudou, os representantes atuais desse Estado digam ou indiquem onde está ou pode estar essa pessoa. Isso envolve facilitar toda a documentação, todos os dados que tenham para encontrar essa pessoa. Até esse momento, o crime continua sendo cometido. A partir desse momento começaria o princípio de prescrição, se for admitida a prescritibilidade. Como disse antes, do meu ponto de vista, tratando-se de crimes internacionais, não seria possível essa prescrição. Porém, em todo caso, até que essa solução de continuidade não ocorra, o crime continua sendo cometido. Portanto, a partir desse momento pode ser investigado e deve ser investigado."
21/10/2008,Baltasar Garzón,28,Carlos Marchi,"Quer dizer, no Brasil, nós tivemos a Lei de Anistia [Lei de Anistia Brasil {Lei de Anistia Brasil: A Lei da Anistia, de n° 6.683, foi assinada pelo último presidente militar, João Batista Figueiredo, no dia 28 de agosto de 1979, após anos de reivindicação da sociedade brasileira. Desde pelo menos 1968, membros da sociedade civil se mobilizaram pela sua promulgação por meio de encontros, passeatas e manifestações, e com a formação de grupos, no Brasil e no exterior, que atuaram utilizando diversas formas de pressão política. Com a Lei, os brasileiros exilados pela ditadura militar puderam regressar ao país e os cassados readquiriram seus direitos à cidadania. Porém, a Lei não cedeu às reivindicações por uma anistia “ampla, geral e irrestrita” e 35 presos políticos foram submetidos a uma análise em separado de seus processos, em função de ações consideradas criminosas. De um modo geral, a anistia foi um instrumento importante na transição para o regime democrático, pois, ao mesmo tempo que fez cessar a perseguição àqueles que combateram a ditadura, impediu a condenação por tortura de militares e civis envolvidos com a repressão. Mais tarde, a Lei de Anistia voltou ao debate, pois setores ligados aos direitos humanos passaram a defender punições aos agentes do regime militar já que ações desses agentes na prática da repressão, tais como estupros, homicídios e outros tipos de violência física e psicológica seriam considerados crimes comuns, não merecendo, portanto, anistia.}]. Então o senhor diria que a Lei de Anistia não cobre esse tipo de crime?"
21/10/2008,Baltasar Garzón,29,Baltasar Garzón,"Não é coberta nessa interpretação dos crimes de lesa-humanidade, por duas razões: uma, sendo um crime internacional, e, portanto, a leis de anistia não vigoram, não são válidas, nem alegáveis, como diz muito claramente a Corte Interamericana de Direito Humanos ao resolver o caso Barrios Altos, no Peru. A sentença de 14 de fevereiro de 2002, se não me engano, estabelece que as anistias e as autoanistias não podem impedir a investigação e sanção de crimes de lesa-humanidade. O caso de Barrios Altos e o da Universidad de La Cantuta, foi em torno da atuação do chamado Grupo Colima [esquadrão da morte que operou no Peru durante o governo de Fujimori no início da década 1990, eliminando suspeitos de pertencerem ao grupo terrorista Sendero Luminoso. Foi responsável por numerosas violações contra os direitos humanos], e está se decidindo neste momento se Alberto Fujimori {Alberto Fujimori: Alberto Fujimori foi presidente do Peru entre 1990 e 2000. Sua vida política iniciou em 1988, quando fundou o Cambio 90, coligação que o lançou presidente, com votação expressiva. Depois da posse, promoveu uma política econômica neoliberal para acabar com a alta inflação e a recessão. Em 1992, promoveu a dissolução do legislativo, suspendeu a Constituição e as atividades políticas. Não conseguiu avanços contra a crescente miséria de grande parte da população. No entanto, nas eleições de 95 e 99, Fujimori foi reeleito diretamente pelo povo, mesmo com muitas denúncias de abuso de poder e autoritarismo. No seu terceiro governo, um escândalo de corrupção entre a polícia e o Congresso culminou na renúncia da presidência. Acuado pela revolta da população e por acusações de formação de quadrilha e participação em esquadrões da morte, foi para o exílio no Japão e no Chile. De volta ao Peru em 2007, foi condenado à prisão por seis anos, a indenizações ao Estado e afastamento de cargos políticos. Em 2009, a Procuradoria Federal do Peru pediu 30 anos de prisão para o ex-presidente.} estimulou essa repressão. Ele está sendo julgado por isso. E o promotor está pedindo muitos anos de prisão por esses fatos. Portanto, é um precedente. Existem muitos mais, mas esse é um precedente claríssimo de que as leis de anistia, quando se referem a crimes de lesa-humanidade, não são aplicáveis. Portanto, trata-se de um argumento. O segundo argumento é que, mesmo se fossem aplicáveis, sendo o delito de caráter permanente, que continua sendo cometido, continua ocorrendo após a lei de anistia. E o terceiro argumento é que a lei de anistia, em princípio, implica ou exige que se aplique a crimes cometidos por pessoas que estão identificadas como tais, mas não como um caráter genérico, aberto, indefinido, para que aqueles que propiciarem essa lei continuem impunes. Seria uma desnaturalização do instituto de direito de graça ou perdão que em nenhum caso pode ser geral nem constitucional, porque iria contra os princípios como o que ninguém pode ser torturado, ninguém pode ser desaparecido, ninguém pode ser objeto de tratamentos desumanos e degradantes. Não podemos esquecer que, por serem esses crimes internacionais, qualquer país que esteja no sistema de direito internacional deve cumprir com os direitos, caso contrário, podem ser aplicados a partir de outras instâncias, em virtude do princípio de justiça universal."
21/10/2008,Baltasar Garzón,30,Jan Rocha,"O senhor ainda tem esperança de que o senhor Henry Kissinger [ex-secretário de Estado norte-americano], no banco dos réus, por sua parte na Operação Condor?"
21/10/2008,Baltasar Garzón,31,Baltasar Garzón,"Tenho que dizer que ele nunca foi acusado, nunca foi objeto de denúncia, nem houve uma querela contra ele. Nunca houve uma iniciativa contra ele pela sua suposta participação na Operação Condor. Estou ciente do que se tem escrito. Cada um de nós temos a nossa opinião a respeito. Seria impossível eu manifestar a minha opinião, pois estaria inabilitado para atuar perante uma eventual petição. Conheci Henry Kissinger nos Estados Unidos, na Universidade de Nova York, falando de outros temas. A opinião pública tem sido bastante crítica em relação à intervenção de Henry Kissinger nesses casos como secretário de Estado. Porém, minha resposta é que, até o dia de hoje, não se produziu uma petição. E tenho por norma, como juiz, não fazer ajuizamentos do futuro. Eu seria um mau juiz - não sei se sou bom ou mau -, mas seria pior se eu fizesse ajuizamento político do que poderia acontecer. Como o termo político implica, está mais para os políticos e os meios de comunicação fazerem esses julgamentos. Nós juízes precisamos atuar com base em fatos, com base em uma petição. E uma vez feita esta, analisar o que temos e continuar."
21/10/2008,Baltasar Garzón,32,Lillian Witte Fibe,"Doutor Wálter, o senhor tem alguma pergunta?"
21/10/2008,Baltasar Garzón,33,Wálter Maierovitch,"Tenho sim. Eu gostaria de saber do senhor o seguinte: nós aqui no Brasil temos a Lei da Anistia, [Lei de Anistia Brasil] que é que 1979, feita, portanto, durante o regime militar {regime militar: Período da história do Brasil que vai de 1964 - quando houve o golpe militar que derrubou o presidente João Goulart - a 1985. Os militares promoveram repressão, exílios políticos, estabelecimento de legislação autoritária, com supressão dos direitos civis, uso da máquina estatal para manipulação da opinião pública, além de benefícios a determinadas empresas e grupos que financiaram o golpe. Censura da imprensa e das artes, torturas, assassinatos de líderes opositores foram outras das ações perpetradas durante a ditadura, que instaurou um Estado policial, parecido com outros da mesma época na América Latina.} ditatorial. Essa lei estabelece, no seu parágrafo, de uma maneira expressa, que não caberia a anistia nos crimes de terrorismo. Isso diz a nossa lei. Eu lhe pergunto: nos regimes ditatoriais não existe terrorismo de Estado?"
21/10/2008,Baltasar Garzón,34,Baltasar Garzón,"Teria que responder que sim, que, se a lei de anistia diz isso, para mim, a solução seria muito fácil, se fosse uma lei espanhola. Porque, para mim, os crimes de terrorismo em determinadas formas e facetas podem adquirir a natureza de crimes de lesa-humanidade. Portanto, se for assim, os crimes de lesa-humanidade poderiam ser incluídos nessa exceção. Porém, acredito que, se essa exclusão for estabelecida, não pode impedir julgamento quando a natureza do crime é ainda de maior gravidade e os crimes de lesa-humanidade, como o genocídio, como a guerra, são conceituados como os crimes mais graves contra a comunidade internacional. Portanto, se uma lei estabelece exceções, essa outra exceção está acima dessas exceções, pois do contrário estaria atuando contra o princípio conhecido como jus cogens, que diz que não se pode ir contra o costume estabelecido no nível internacional, e nos casos de crimes de lesa-humanidade, como já é o caso constante desde 1946, balizado e reconhecido em convênios como um princípio que existe e é inatacável, juridicamente falando."
21/10/2008,Baltasar Garzón,35,Lillian Witte Fibe,"Nós vamos fazer um intervalo, lembrando que a memória do Roda Viva está disponível no nosso site tvcultura.com.br/rodaviva. Ali, você pode pesquisar o conteúdo do nosso arquivo e também mandar e-mails com críticas e sugestões. A gente volta já, já."
21/10/2008,Baltasar Garzón,36,[...],[intervalo]
21/10/2008,Baltasar Garzón,37,Lillian Witte Fibe,"Nós estamos entrevistando o juiz espanhol Baltasar Garzón, conhecido pela postura implacável contra traficantes, corruptos, terroristas e quem quer que seja que viole os direitos humanos. Doutor Garzón, há muitos brasileiros na Europa em situação ilegal ou não regulamentada. Eu li algumas das suas opiniões sobre as leis da imigração na Europa e gostaria de ouvi-lo a respeito."
21/10/2008,Baltasar Garzón,38,Baltasar Garzón,"Daria para opinar durante muito tempo. Mas eu gostaria de fazer uma reflexão. O fenômeno da imigração ilegal é certamente um dos fenômenos mais problemáticos, apesar de os políticos gostarem de dizer que a imigração não é um problema e sim um fenômeno. Acredito que seja um fenômeno problemático para os governos, em particular para os governos europeus. O governo espanhol é provavelmente o governo mais progressista no tratamento dos imigrantes e, em particular, no tratamento da imigração ilegal. Os limites dos períodos temporários em que se podem manter pessoas em detenção não passam de quarenta dias, e se postula até sessenta, enquanto a nova diretiva da União Européia sobre o retorno de imigrantes, que gerou muita polêmica, estabelece um limite de até 18 meses. Parece-me claramente inadequado e pode, inclusive, violar direitos fundamentais. Atitudes como as do atual governo italiano me parecem completamente descabida, xenófobas e até racistas em alguns casos particulares. Foram enormes as ações ocorridas em Roma, também instigadas pelo próprio prefeito de Roma. E em Nápoles, concomitantemente com uma ação da Camorra napolitana [organização mafiosa da Itália, nascida na cidade de Nápoles no início do século XIX, que pratica diversas ações criminosas, como extorsão, agiotagem e tráfico de dorgas] obrigando um estado de força contra o governo na crise do lixo. Além de aproveitar para responsabilizar os imigrantes, especialmente membros da etnia rom, os ciganos, pela insegurança, a reação xenófoba foi cruel. Portanto, isso não é uma boa notícia. Acredito que a política da União Européia deve ser repensada e ir pelo caminho da integração, diversidade e multiculturalismo, com uma análise profunda das causas, com uma política acordada com os países de origem. Porém, eu gostaria que nessa política acordada com certos países, refiro-me a países subsaarianos {países subsaarianos: Países situados abaixo do deserto do Saara. São eles: África do Sul, Angola, Benin, Botswana, Burkina Faso, Burundi, Cabo Verde, Camarões, Chade, Comores, Congo, Costa do Marfim, Djibouti, Eritreia, Etiópia, Gabão, Gâmbia, Gana, Guiné, Guiné Equatorial, Guiné-Bissau, Lesoto, Libéria, Madagáscar, Malawi, Mali, Maurícia, Moçambique, Namíbia, Níger, Nigéria, Quênia, República Centro-Africana, República Democrática do Congo, Ruanda, São Tomé e Príncipe, Senegal, Serra Leoa, Seychelles, Somália, Suazilândia, Sudão, Tanzânia, Togo, Uganda, Zâmbia, Zimbabwe.} onde o nível de corrupção é absoluto. Até o ponto de membros da família presidencial de um desses países controlarem as organizações que estimulam a imigração ilegal e o tráfico de seres humanos, seja exigido que esses países cumpram e não somente afirmem o apoio ao desenvolvimento. O princípio da justiça universal para lutar também contra as máfias é absolutamente fundamental. Na Espanha foi introduzido, em virtude de uma lei aprovada em novembro de 2007, que é um caminho adequado. Eu acho que é preciso estabelecer esse consenso com os países emissores, para que a imigração deixe de ser um fenômeno problemático. A minha opinião, evidentemente não compartilhada por muitos, é que ninguém tem mais direito a um território, a um lugar na terra pelo fato de ter nascido nessa terra."
21/10/2008,Baltasar Garzón,39,Lillian Witte Fibe,"Carmen, vamos fazer uma pergunta de telespectador, por favor."
21/10/2008,Baltasar Garzón,40,Carmen Amorin,"Tem uma pergunta do Gustavo Tostes Gazinelli, que é de Belo Horizonte, Minas Gerais. Ele pergunta o seguinte: “A questão da punição dos torturadores no período militar, no Brasil, veio a público recentemente. O que fazer com relação aos empresários e agentes civis que patrocinaram tais tipos de ações militares ou paramilitares?”."
21/10/2008,Baltasar Garzón,41,Baltasar Garzón,"Acredito que se deve começar uma obra, uma construção, pelos alicerces. E então, após diversos andares, diversos níveis, chegamos à parte final, que é o telhado. Na Espanha, temos um ditado que diz “Não comecemos a obra pelo telhado.”. Podemos avançar iniciativas que compatibilizem as investigações e os fatos delitivos. Na descrição dos fatos delitivos, seja qual for o fato delitivo, sempre há aqueles que induzem, os autores morais, intelectuais, os autores materiais, os cúmplices e os encobridores. Portanto, não é diferente para esse tipo de crimes. O fenômeno já foi observado em outros países, como na Argentina, onde foi excluído da Lei de Obediência Final e da do Ponto Final, hoje anuladas. Na época também foram excluídos os delitos de espólio e de seqüestro de crianças. Agora, o que acontece com aqueles que propiciaram e estimularam essas atividades, dando apoio econômico? Primeiro teríamos que estabelecer que tenha ocorrido assim. Não se pode afirmar sem provas que isso foi assim. Qualquer crime precisa ser provado. E, uma vez provado, deve-se atuar. É uma das críticas feitas, e que eu também tenho feito em âmbito internacional, como por exemplo nos crimes de genocídio que aconteceram na zona central da África: Ruanda e especialmente o caso do Congo. A ONU [Organização das Nações Unidas] emitiu em 2004 um informe que era muito esclarecedor sobre o que você falou, dizendo que Uganda foi considerada como um exemplo por ter eliminado a sua dívida externa como conseqüência da exploração das minas de coltan. O coltan é um mineral que torna possível a existência de celulares. É com ele que se fabricam os microchips. Porém, o problema é que não há minas de coltan na Uganda, e sim no Congo. As explorações por um total de trinta empresas do Primeiro e Segundo Mundos haviam obtido benefícios imediatamente relacionados com os crimes de genocídio e lesa-humanidade. Portanto, é uma obrigação investigar tanto os que propiciam tal situação como os que a executaram. Essa teoria geral é aplicável a qualquer tipo de delito e em qualquer parte do mundo."
21/10/2008,Baltasar Garzón,42,Lillian Witte Fibe,Cláudia.
21/10/2008,Baltasar Garzón,43,Cláudia Antunes,"Eu queria que o senhor falasse um pouco sobre a relação entre a justiça e o poder. Quando tem uma divergência interpretativa entre a justiça internacional e a justiça nacional, determinar se a justiça nacional é que vai prevalecer não é uma questão de poder? Por exemplo, os Estados Unidos executaram na semana passada vários presos condenados à morte, imigrantes - um mexicano, um guatemalteco, um ondurenho -, contra uma decisão da Corte Internacional de Justiça. A justiça americana disse que a lei americana é superior a qualquer legislação internacional. Pela mesma razão, os Estados Unidos não são signatários do Tribunal Penal Internacional, assim como a China não é, Israel não é, vários outros países não são. Eu queria que o senhor falasse um pouco se a perspectiva mundial é realmente só existir a justiça para os vitoriosos. Vitoriosos se impõem à justiça. Mesmo os Tribunais Penais Internacionais julgam pessoas de países que foram as partes derrotadas em conflitos, né? Os vitoriosos raramente são levados a julgamento. Eu queria que o senhor comentasse um pouco isso e aproveitasse e falasse também se é... se o senhor vê a possibilidade de os atuais dirigentes americanos, por exemplo, serem levados a tribunais internacionais por causa do memorando contra a tortura. O senhor sabe que, na interpretação do governo Bush, aquele tipo de tortura de afogamento não é considerado tortura. Então... mas é em outras interpretações. Eu queria que o senhor falasse um pouco sobre a justiça internacional dentro dessa perspectiva de poder no mundo."
