DATA,ENTREVISTA,ORDEM,LOCUTOR,FALA
26/01/1998,Barbara Heliodora,113,Barbara Heliodora,"Não, absolutamente. Eu me lembro sempre de uma conversa com a Fernanda Montenegro {Fernanda Montenegro: Nome artístico de Arlette Pinheiro Monteiro (1929-), consagrada atriz brasileira de teatro e televisão, considerada pelo público e pela crítica uma das melhores de todos os tempos. Começou a trabalhar aos 15 anos como locutora e radioatriz da Rádio Ministério da Educação no Rio de Janeiro. Iniciou, de fato, sua carreira em 1950, com o espetáculo Alegres canções nas montanhas, ao lado do ator Fernando Torres (1927-2008), com quem se casou e teve dois filhos. Ainda na década de 1950, fez parte da Companhia Maria Della Costa e do Teatro Brasileiro de Comédia (TBC). Fez várias peças com o marido e atores como Sérgio Britto, Cacilda Becker, Nathalia Timberg e Ítalo Rossi. Sua estréia no cinema deu-se em 1964 com A falecida, tragédia de Nelson Rodrigues. Colecionando premiações, recebeu cinco vezes o prêmio Molière, três vezes o Prêmio Governador do Estado de São Paulo, Urso de Prata (no Festival de Berlim) de melhor atriz, entre outros. Em 1999, por sua atuação no filme Central do Brasil, de Walter Salles, foi a primeira artista brasileira a ser indicada para o Oscar de melhor atriz. Em televisão, participou de dezenas de teleteatros e novelas nas extintas TV Tupi e TV Excelsior e na Rede Globo. Por sua enorme expressividade, foi qualificada pela crítica como a atriz do “rosto de borracha”, tamanha sua capacidade de mudar a expressão e se adaptar às características do personagem, sempre de forma convincente.} [em que] chegamos à conclusão de que era a mais perfeita conversa de surdos do mundo, porque para mim o grande fenômeno teatral que a mim fascina é o da direção, no sentido da transformação do texto em espetáculo. Isso que eu acho que é a coisa mais deslumbrante do teatro."
26/01/1998,Barbara Heliodora,114,[...],Por que a senhora não dirige mais?
26/01/1998,Barbara Heliodora,115,Barbara Heliodora,"E a Fernanda dizia assim: “Mas, na hora do espetáculo, o diretor não está nem lá”. Então, eu acho isso uma maravilha, não tem que estar lá."
26/01/1998,Barbara Heliodora,116,José Celso Martinez Corrêa,"Mas a [pesquisadora de teatro] Maria Thereza Vargas disse que, quando você [...] Cacilda, as pessoas achavam a Cacilda [Cacilda Becker] péssima e achavam você maravilhosa."
26/01/1998,Barbara Heliodora,117,Barbara Heliodora,"Não é verdade, isso não se usa, não adianta fazer esse tipo de brincadeira, porque..."
26/01/1998,Barbara Heliodora,118,José Celso Martinez Corrêa,"Eu não acho, eu acho você gelada para ser atriz, acho você muito fria."
26/01/1998,Barbara Heliodora,119,Barbara Heliodora,"...eu fiz a rainha [Gertrudes] por menos de uma semana, eu acho, e Cacilda, que tinha tido filho, tinha se afastado do teatro, foi quando ela começou a voltar para o teatro, foi assumindo o papel da rainha no Hamlet . E depois disso é que deslanchou a carreira dela verdadeiramente."
26/01/1998,Barbara Heliodora,120,Rinaldo Gama,"Barbara, sobre isso, duas perguntas, uma sobre a formação do ator. Falou-se aqui, alguém se queixou que a senhora às vezes não dá muita atenção..."
26/01/1998,Barbara Heliodora,121,Gabriel Villela,"Ela é quem mais dá atenção, de todos os críticos, ela é quem mais cita nome por nome [de atores]."
26/01/1998,Barbara Heliodora,122,José Celso Martinez Corrêa,E é quem mais gosta de decapitar nome por nome na guilhotina.
26/01/1998,Barbara Heliodora,123,Gabriel Villela,[Para José Celso] Essa é a sua opinião. Eu estou só dizendo o que é a verdade impressa.
26/01/1998,Barbara Heliodora,124,José Celso Martinez Corrêa,"Não é essa doçura gelada que está aí, não."
26/01/1998,Barbara Heliodora,125,Gabriel Villela,[Para José Celso] Você podia largar mão de ser agressivo.
26/01/1998,Barbara Heliodora,126,Matinas Suzuki,"Gabriel, por favor, vamos deixar o Rinaldo fazer a pergunta."
26/01/1998,Barbara Heliodora,127,Rinaldo Gama,"Qual é sua opinião sobre a formação do ator? A senhora falou sobre a formação do crítico e eu queria que a senhora falasse um pouco sobre a formação do ator hoje no Brasil. E outra, já que se falou aqui no seu passado, por que a senhora não dirige mais peças, assim, em maior quantidade, não tem uma atividade maior...?"
26/01/1998,Barbara Heliodora,128,Barbara Heliodora,"Isso é uma coisa que eventualmente eu gostaria de fazer, mas eu engrenei na crítica, e principalmente eu levei muito tempo só ensinando, eu ensinava na Unirio [Universidade Federal do Estado do Rio de Janeiro], de maneira que fiquei muito presa ao ensino e não me voltei mais para isso. Mas quanto à formação do ator, acho que o problema é o seguinte: gênio não precisa de escola, não é isso? Mas quantos gênios você tem? Aliás, no Brasil, é maravilhoso, você tem em primeira linha umas pessoas maravilhosas, mas você precisa é do talento médio, ter uma formação para você poder ter um bom elenco, não ter dois bons e quatro péssimos, porque [daí] fica um espetáculo capenga. Porque na realidade nós precisaríamos que o teatro tratasse... que o elenco de segundo, de terceiro papel pudesse levar a vida com conforto e respeitabilidade, quer dizer, ter uma vida particular tranqüila, ganhando o seu [salário], mesmo que ele nunca seja um astro, mas é porque ele precisa ser respeitado. Você olha no cinema, você olha no teatro inglês, você tem figuras maravilhosas que nunca foram fazer um primeiro papel na vida, mas isso é o que dá a solidez do teatro."
26/01/1998,Barbara Heliodora,129,Matinas Suzuki,"Barbara, eu não fiz perguntas dos telespectadores ainda, peço desculpas, a gente acabou se envolvendo aqui nas discussões, mas gostaria de fazer algumas. O José Humberto Marçal, de Igarapava, pergunta: “O Shakespeare existiu, não existiu, foi uma mulher, não foi uma mulher, era um grupo que escrevia?”. Será que você poderia explicar um pouco de onde vem essa confusão?"
26/01/1998,Barbara Heliodora,130,Barbara Heliodora,"Shakespeare estava morto fazia 150 anos, mais ou menos, quando pela primeira vez alguém resolveu inventar que ele não era ele. Existem mais de 50 candidatos [a respeito de quem seria o “verdadeiro” Shakespeare] porque, é claro, com uma coisa que fantasia, cada um vai fantasiando para onde quer. Então, o Erich [...] diz assim: “O que querem é que ele seja nobre. Ninguém se conforma de ele não ser nobre e ser apenas um autor”. Então, já têm indícios de que foi a rainha Elizabeth, que foi a [rainha da Escócia] Mary Stuart, que foi, sei lá, [...] tem milhões. Tem um que diz que foram os jesuítas em grupo. Depois disso, [disseram] que foram os rosa-cruzes em grupo. Isso tudo é acesso de loucura; na realidade, ele foi o seu William Shakespeare, que nasceu em Stratford, fez os seus teatros, escreveu suas peças, porque os seus contemporâneos dizem que foi ele. Então, o resto é brincadeira."
26/01/1998,Barbara Heliodora,131,Matinas Suzuki,"Eu vou contar aqui. No e-mail tem a pergunta do James Richard Cook; pelo fax, o Domingos Soares; pelo telefone, o Claudemir Ferreira, de Guarulhos; a Marisa Dias Leite, do Jardim Bonfiglioli; aqui em São Paulo; o Valdir Machado, da Bela Vista, em São Paulo; o Adilson Ribeiro, da Vila Madalena, São Paulo; o Horácio Silva dos Santos, de Salvador, Bahia; e o Péricles Martins, aqui de Itaquera, todos eles perguntam o que você acha do teatro de Gerald Thomas, se é bom, se é ruim..."
26/01/1998,Barbara Heliodora,132,Barbara Heliodora,"Eu acho que ele domina muito bem a gramática do palco; acho que ele já fez algumas direções muito interessantes; acho que, como autor, ele é muito menos satisfatório, e como ele tem feito espetáculos com textos dele, acho que estes têm sido muito menos bem-sucedidos do que quando ele dirigiu o Quatro vezes Beckett, o Quarteto, com a Tônia [Carreiro] e o Sérgio Britto. Enfim, eu acho que é outra coisa, o problema eu acho que está aí."
26/01/1998,Barbara Heliodora,133,Matinas Suzuki,"E a Juliana Martins, do Sumaré, aqui também de São Paulo, [pergunta]: “O que a senhora acha dos textos para teatro de Nelson Rodrigues?” [Nelson Falcão Rodrigues]"
26/01/1998,Barbara Heliodora,134,Barbara Heliodora,"Acho ótimos, quer dizer, é o tal negócio, é como Shakespeare, nem tudo o que o Nelson escreveu é bom, mas basicamente eu tenho a maior admiração pelo Nelson, não só porque várias peças são muito interessantes, mas eu acho que ele prestou um grande serviço trazendo para o palco o linguajar brasileiro. Porque, até então, acontecia freqüentemente... há muito tempo, quando eu era jovem e estava no colégio, ainda se ensinava que você podia falar, entre aspas, “errado”, quer dizer, como se fala no Brasil, mas na hora de escrever tinha que escrever “certo”, quer dizer, como se escreve em Portugal. Então, eu sempre digo: Pavlov dava pulos de alegria na sepultura porque os autores brasileiros, na hora em que sentavam para escrever, escreviam tudo certinho, esquecendo que tudo aquilo ia ser dito. Então, na hora em que dizia, era tremendamente falso, porque nenhum brasileiro falava assim. Então o Nelson, que tinha um ouvido de repórter que era uma coisa extraordinária, trouxe para o palco o linguajar brasileiro, e isso é uma coisa que nós todos devemos a ele..."
26/01/1998,Barbara Heliodora,135,José Celso Martinez Corrêa,"[interrompendo] E por que ele não foi o teu Racine? Por que o Nelson Rodrigues não foi teu Racine? Porque a tua tradução soa acadêmica, não soa Nelson Rodrigues, não soa língua viva, e Nelson é língua viva."
26/01/1998,Barbara Heliodora,136,Barbara Heliodora,Mas eu não estou traduzindo um autor como o Nelson Rodrigues. Nenhuma das minhas traduções parece viva?
26/01/1998,Barbara Heliodora,137,José Celso Martinez Corrêa,"Eu acho muito careta, acho que você encareta o Shakespeare. O Shakespeare tem uma vitalidade elisabetana..."
26/01/1998,Barbara Heliodora,138,Barbara Heliodora,Eu também acho que ele tem uma grande vitalidade.
26/01/1998,Barbara Heliodora,139,José Celso Martinez Corrêa,"...porque realmente ele foi um homem da vida, um homem maluco, um homem que construía teatro, produzia teatro, fazia teatro, atuava. Ele tem uma linguagem viva, e para mim foram o Nelson e o Oswald que me deram a chave da fala e da música popular brasileira, da fala, da fala viva brasileira. Eu acho que, quando você traduz, você vai de “cu de ferro” do Shakespeare, de inglesa ali. Parece uma tradução inglesa, você não soa brasileiro..."
26/01/1998,Barbara Heliodora,140,Barbara Heliodora,"Outras pessoas já me disseram outra coisa. Não posso acreditar que seja assim. Porque eu não estou fazendo [tradução de] um autor popular brasileiro, estou traduzindo William Shakespeare."
26/01/1998,Barbara Heliodora,141,José Celso Martinez Corrêa,"Um autor popular universal [...]. Aliás, um ponto de, por exemplo... Eu acho, não sei, eu conheço mais o Hamlet, eu não conheço todo o Shakespeare como você, mas no Hamlet eu acho que Shakespeare faz o enredo para fazer caber o esgrimista, os bêbados da companhia, as cenas de amor, uma série de coisas. Ele estava totalmente vinculado ao espírito tanto da corte, mas também da marginália, do povo. Eu acho a tua tradução, a tua crítica, teu teatro uma coisa de classe, uma coisa assim de burguesia, uma coisa de cartório, entendeu?"
26/01/1998,Barbara Heliodora,142,Barbara Heliodora,Você tem direito a sua opinião.
26/01/1998,Barbara Heliodora,143,Nelson Sá,"O Décio de Almeida Prado publicou, há uns dez anos, um ensaio, que foi publicado em forma de livro, sobre Procópio Ferreira. Ele fazia muitos elogios ao Procópio Ferreira, que foi um ator... quando ele era crítico atuante no jornal Diário [de São Paulo], ele o combatia muito. O Paulo Francis, nas memórias dele, faz um mea-culpa com relação aos atores dessa geração do Procópio, cita alguns, como Dercy Gonçalves, Jaime Costa etc. Os dois fizeram, de certa maneira, um mea-culpa com relação ao grande combate que eles fizeram aos grandes atores populares daquela época. Você – que escreveu mais ou menos contemporânea, óbvio que mais nova que o Décio, mas com certeza contemporânea ao Francis – faz algum tipo de mea-culpa com relação, digamos, a esse combate que os críticos da nova geração dos anos 50 fizeram...?"
26/01/1998,Barbara Heliodora,144,Barbara Heliodora,"Eu não me lembro de fazer um combate. Bom, eu mal vi o Procópio, eu vi o Procópio fazer uma das últimas encarnações do... como é? Ele fazia sempre..."
26/01/1998,Barbara Heliodora,145,[...],O avarento [peça de Molière].
26/01/1998,Barbara Heliodora,146,Barbara Heliodora,"O avarento. Mas o que eu vi, honestamente, eu não posso dizer que fosse um bom espetáculo, não era. Então, eu não ponho em dúvida que em outras, em encenações anteriores ele tenha feito bem. O que eu vi já era um espetáculo rançoso, não tinha vida. Mas é o tal negócio, foi a única coisa que vi do Procópio... Não, depois eu vi... ele fez um musical [...] em que ele até estava muito engraçado."
26/01/1998,Barbara Heliodora,147,Nelson Sá,"Perfeito, mas você não tinha essa atuação quase engajada com relação ao teatro comercial, que era o que tanto o Décio como o Francis combatiam naquela época."
26/01/1998,Barbara Heliodora,148,Barbara Heliodora,"Pois é, mas o que acontece é que houve uma mudança tão grande no teatro, porque realmente havia uma série de atores que era uma coisa tão artificial, tão distante de qualquer realidade, que não era possível, aquilo ia acabar. Você sabe que todos os movimentos do teatro, desde a Grécia até hoje, sempre se justificaram [dizendo] que o [teatro] anterior já não representava a sociedade contemporânea. Então, houve realmente toda uma geração de atores que ficou presa a um modo de representar que tinha sido ultrapassado."
26/01/1998,Barbara Heliodora,149,Nelson de Sá,"Mas você não faria, como Décio ou como o Francis, um mea-culpa com relação a essa geração, pelo menos aceitando a qualidade de artistas como eles fizeram?"
26/01/1998,Barbara Heliodora,150,Barbara Heliodora,"Eu não posso fazer porque eu não vi, eu só vi o Procópio realmente essas duas vezes, e o Jaime Costa eu só vi em um espetáculo que era um horror, que era o Don Juan Tenorio e foi dirigido por um espanhol que apareceu aí. Era uma coisa hedionda."
26/01/1998,Barbara Heliodora,151,José Celso Martinez Corrêa,"Mas eram maravilhosos, esses atores tinham uma coisa de presença física extraordinária. Houve o corte do TBC [Teatro Brasileiro de Comédia {Teatro Brasileiro de Comédia: Criado em 1948 pelo empresário italiano Franco Zampari, o Teatro Brasileiro de Comédia (TBC) atuou na cena cultural brasileira por 16 anos e trouxe as concepções de teatro moderno para o Brasil. O primeiro diretor renomado que foi contratado pelo TBC foi Adolfo Celi, também italiano, que trouxe uma estética refinada e proporcionou a profissionalização dos atores. Nesta transformação do teatro em uma atividade profissional, e não mais amadora, como até então, o lucro passava a ser um objetivo e até mesmo a idéia de casa de espetáculo e oficina teatral, onde cenários e figurinos eram confeccionados. Dentre os primeiros atores profissionalizados por Celi estavam Cacilda Becker, Paulo Autran, Madalena Nicoll, entre outros. Outros diretores que fizeram parte do TBC foram Ruggero Jacobbi, Luciano Salce e Ziembinski trabalhando em obras que marcaram o teatro brasileiro como as adaptações de textos como os de Oscar Wilde, Luigi Pirandello, Jean-Paul Sartre e Anton Tchekhov. Algumas das 144 peças encenadas pelo TBC foram O mentiroso, Entre quatro paredes, O pagador de promessas e A morte de um caixeiro viajante.}] em relação a esses atores. Eu acho que Cacilda atravessou isso. E depois a minha geração rebuscou isso, rebuscou contato com esse elo perdido e foi chegar até nas coisas muito importantes aqui do Brasil. Por isso que eu gosto do Oswald, que dá réplica para o Hamlet : “tupi, that's is the answer”. O teatro além de [padre José de] Anchieta, o teatro índio, a outra cabeça que você não percebe. Cega, surda, muda."
26/01/1998,Barbara Heliodora,152,Fernando Moreira Salles,"Barbara, esta controvérsia que regurgita aqui de quando em vez no programa me faz lembrar que você disse na sua entrevista ao Alfredo Ribeiro, da Veja, que “a principal virtude do ator deve ser a generosidade”. Eu entendi generosidade como amor pelo seu ofício, pelo espectador e também pelo outro. E me deu vontade de ouvi-la a esse respeito agora."
26/01/1998,Barbara Heliodora,153,Barbara Heliodora,"É, eu acho que o ator generoso é aquele que tem um prazer imenso que o público tenha prazer naquilo, no espetáculo. Porque existem uns atores que ficam só assim: “Será que eu estou bem?”, aquela coisa assim, ou então é uma auto-referência constante."
26/01/1998,Barbara Heliodora,154,Carlos Graieb,Poderia dar alguns nomes para exemplificar?
26/01/1998,Barbara Heliodora,155,Barbara Heliodora,Não. Mas o que acontece é que eu acho...
26/01/1998,Barbara Heliodora,156,Carlos Graieb,"[interrompendo] Dos generosos, pelo menos."
26/01/1998,Barbara Heliodora,157,Barbara Heliodora,"Dos generosos, existem muitos, mas o que eu acho importante... é muito interessante, porque esses generosos chamam gente ao teatro. As pessoas vão ver... há certos atores que são tecnicamente muito bons, têm atuações perfeitamente corretas, interessantes até, às vezes, e no entanto não conseguem estabelecer essa comunicação que faz a pessoa sair de casa para vê-los. Eu acho que os generosos é que conseguem isso."
26/01/1998,Barbara Heliodora,158,Marta Góes,"Barbara, você acha que o teatro brasileiro, o teatro que se faz hoje, exprime o Brasil?"
26/01/1998,Barbara Heliodora,159,Barbara Heliodora,"Eu acho que sim, porque teatro sempre exprime quem está fazendo, quer a pessoa queira, quer não queira. [O teatro exprime] o que se faz, o que se devia fazer e o que não se fez. Isso aparece em todo trabalho, compreende? Você pode dizer: isso aqui está horrível, então é porque aquilo expressa algum aspecto, pode não ser o que a gente quer, mas eu acho que sempre expressa o que está... como toda peça que um autor escreve está expressando muitas vezes o que ele não quer."
26/01/1998,Barbara Heliodora,160,Marta Góes,Mas o que ele disse a respeito de nós?
26/01/1998,Barbara Heliodora,161,Barbara Heliodora,O quê?
26/01/1998,Barbara Heliodora,162,Marta Góes,O que o teatro brasileiro diz a respeito de nós brasileiros? Quem não nos conhecesse...
26/01/1998,Barbara Heliodora,163,Barbara Heliodora,"Eu tenho encontrado nos últimos anos uma preocupação verdadeira, por quem monta teatro, de busca de autor nacional. Porque sabem que esse é um caminho que é interessante, eu acho que isso é fundamental. Há 30, 40 anos, existia uma coisa famigerada chamada “lei do dois por um”. Era uma lei que dizia assim: para cada dois textos estrangeiros, você tem que montar um nacional. É uma ilusão, a pessoa mudava o nome da companhia para estrear de novo e fazia. Então, havia duas coisas que eram, por um lado – uma coisa que ainda existe –, falta de textos nacionais. Acho que nós temos ainda poucos autores, precisamos ter cada vez mais. Por outro [lado], havia pouco interesse do lado do público em saber quem nós somos. Eu acho que, nos últimos 40 anos, tem havido muito mais, cada vez mais essa coisa: “Quem nós somos como brasileiros?”. Então, por isso, nós estamos procurando mais o autor brasileiro. É claro que não estou dizendo que todo mundo está louco para fazer, mas acho que o caminho é de as pessoas se verem, se identificarem, descobrirem quem elas são. Eu acho que isso é uma coisa crucial no teatro brasileiro, e as pessoas têm procurado o autor nacional nesse sentido."
26/01/1998,Barbara Heliodora,164,Gabriel Villela,"Barbara, eu li há pouco tempo um comentário seu, aliás, uma poesia muito bonita em que você diz sobre os anos 60, 70, e que você arremata dizendo que Antunes Filho {Antunes Filho: José Alves Antunes Filho (1929-), dramaturgo, diretor de teatro e cineasta paulista. Sua história confunde-se com a do teatro moderno brasileiro. Ele se destacou em meio à primeira geração dos encenadores modernos do Brasil e criou espetáculos que o projetaram internacionalmente, como Macunaíma (em 1978), adaptação da obra-prima de Mário de Andrade, e que abriu caminhos a grandes intérpretes. Sempre a partir do autor, Antunes Filho procura novas formas estéticas de expressão teatral, ao mesmo tempo brasileiras e universais.}, com [a encenação de] Macunaíma [em 1978], sela, põe um ponto final triste numa..."
26/01/1998,Barbara Heliodora,165,Barbara Heliodora,"Sim, naquela linha de teatro..."
26/01/1998,Barbara Heliodora,166,Gabriel Villela,E agora? O que tem agora?
26/01/1998,Barbara Heliodora,167,Barbara Heliodora,Um caos.
26/01/1998,Barbara Heliodora,168,Gabriel Villela,Um caos? Do qual você faz parte?
26/01/1998,Barbara Heliodora,169,Barbara Heliodora,Mas eu acho que o caos é sempre uma coisa inquietante...
26/01/1998,Barbara Heliodora,170,Gabriel Villela,"Sim, o caos, na verdade, vai produzir provavelmente, sei lá, Fênix. Mas você lamentou, você sentiu muita pela nostalgia. Você disse assim: “O epílogo de uma era”."
26/01/1998,Barbara Heliodora,171,Barbara Heliodora,"Mas acho que é verdade, porque foi aquele tipo de espetáculo. Logo depois, houve aquela época em que se dizia assim: [...] acabar com o texto. Lembra aquela época de “o texto já era”? Então, houve espetáculos de grande vida cênica, houve uma grande quantidade. Mas o teatro brasileiro vive sofrendo crises, uma atrás da outra. É claro que, nos últimos anos, a mais grave foi a da censura, porque tinha aparecido o TBC, o Arena {Arena: Companhia de teatro paulistana que promoveu uma verdadeira revolução no cenário cultural e político das décadas de 1950 e 1960, até ser extinto, já na década de 70, principalmente pelos problemas no enfrentamento com a ditadura militar. Promoveu um teatro voltado para a reflexão, para a crítica social e para a valorização da dramaturgia brasileira. Aglutinou expressivo contingente de artistas comprometidos com o teatro político e social - como Augusto Boal e Gianfrancesco Guarnieri - e formou mais de uma geração de atores brasileiros. O diretor e fundador do grupo, José Renato, propunha nacionalizar o teatro, incentivando peças que abordavam temáticas brasileiras, numa linha de forte crítica política e social, numa época com cenário dominado pelo TBC [Teatro Brasileiro de Comédia] que possuía um repertório mais internacional, com produções sofisticadas, pautadas por modelos europeus e que dialogavam pouco com a realidade nacional. O Arena fazia peças de autores nacionais com baixo custo, com o claro objetivo de incentivar o talento dos diretores brasileiros e sua sede tornou-se a “casa do autor brasileiro”.}, o Oficina {Oficina: O Teatro Oficina foi criado em 1958 por um grupo de estudantes da Escola de Direito do Largo de São Francisco, em São Paulo, entre eles o diretor José Celso Martinez Corrêa, considerado hoje a grande figura do teatro escola. Distinguiu-se de outras companhias teatrais por ousadias cênicas e por ter absorvido várias vertentes das artes cênicas internacionais, dando-lhes um cunho eminentemente brasileiro. A primeira grande realização do elenco ocorreu em 1963, com a peça Pequenos burgueses, de Górki, dirigida por José Celso. Porém, foi a estréia de O rei da vela, em 1967, que elevou a condição da companhia para escola, trazendo as idéias do movimento artístico para o cenário brasileiro, ao incorporar Oswald de Andrade e as idéias da antropofogia, fundando um novo movimento que repercutiu em outras artes, em especial na música e cinema. O Oficina continua inovador e polêmico no início do século XXI.}, ou não-sei-quê, os seminários do Teatro de Arena. Começou a haver todo esse movimento de conscientização do teatro brasileiro em relação a problemas sociais, governo etc. E aí veio a censura e fechou. Isso teve dois resultados: vários autores que já vinham formando um corpo de obra pararam de escrever; e outros não tiveram sequer a chance de começar. Isso é que foi grave, durou muito tempo, de maneira que quando eu digo [que agora é] caos, é porque está tudo recomeçando."
26/01/1998,Barbara Heliodora,172,Gabriel Villela,[O teatro atual] está desinteressante?
26/01/1998,Barbara Heliodora,173,José Celso Martinez Corrêa,"Mas houve uma militância, inclusive depois da ditadura, depois do AI-5, especificamente, que foi ato que foi praticamente em cima da cultura... Se você ler o AI-5, você tem várias referências à palavra cultura, inclusive, a lugares onde a coisa acontece. O teatro estava no seu esplendor; o teatro tinha uma potência extraordinária..."
26/01/1998,Barbara Heliodora,174,Barbara Heliodora,"Pois é, exatamente."
26/01/1998,Barbara Heliodora,175,José Celso Martinez Corrêa,"Houve um corte dessa potência. Muito bem, quando veio a abertura [política, após a ditadura], eu acho que se repôs no teatro uma... Veio o teatro e a televisão comprou o teatro, em certo sentido. E a área do teatro ficou reservada... Eu acho que a tua figura representa uma figura assim de continuidade da repressão num certo sentido. Você, através da tua crítica nos jornais importantes e do teu cargo de primeira crítica brasileira, você passou a fazer um combate..."
26/01/1998,Barbara Heliodora,176,Barbara Heliodora,Eu não tenho esse cargo.
