DATA,ENTREVISTA,ORDEM,LOCUTOR,FALA
28/05/2007,Paulo José,29,Paulo José,"Você não tem o que fazer. O público é que atribui o sentimento daquela imagem. Isso aí é um efeito Kuleshov [Lev Kuleshov, cineasta russo, (1899-1970)], o velho Koleshovi, que fez um exemplo desse efeito de atributo da imagem por justaposição, fazendo o rosto de um ator que não era expressivo, um rosto apenas olhando alguma coisa. Ele justapôs esse rosto em um bebê sorrindo, um prato de sopa quente e uma pessoa morta. Levou para várias audiências para ver que sentimento de expressão havia naquele rosto do ator. Uns viam a fome diante do prato de sopa, outros viam o horror diante da morte e a imagem era absolutamente a mesma. Por isso, tinha que saber trabalhar com os atributos da imagem também: transparência e imagem. Esse era outro aspecto que iria levantar aqui, da transparência, da transposição, da substituição. No teatro, você tem que ter a linha contínua do personagem. No cinema, você vai por substituição. O que se quer do personagem é uma atitude de abstração diante do presente. Está imerso em alguma coisa profunda que o incomoda, que o molesta, um sentimento qualquer. Em O padre e a moça [filme de Joaquim Pedro de Andrade, 1965, cujo roteiro é baseado em um poema de Carlos Drummond de Andrade], de Joaquim, um diretor muito rigoroso, discípulo de Robert Bresson [(1901-1999) um dos maiores e mais influentes cineastas franceses do século XX], ele estudou em Paris e o Bresson foi o professor dele. Ele odiava o altruísmo do ator, odiava atores, porque ator se exibe muito. Eu também odeio ator, os acho exibidos [risos]. Eu, inclusive."
28/05/2007,Paulo José,30,Paulo Markun,"Nós vamos fazer um rápido intervalo e voltamos num instante com Roda Viva que hoje tem na platéia Gláucia Terra, estudante de jornalismo; Fernanda Padilha, atriz e Mário Moura, diretor de teatro. A gente volta já."
28/05/2007,Paulo José,31,[...],[intervalo]
28/05/2007,Paulo José,32,Paulo Markun,"O Roda Viva entrevista esta noite o ator e diretor Paulo José. Ele começou a fazer teatro em Porto Alegre, nos anos 1940. Depois, ao lado de Gianfrancesco Guarnieri, Bayer, Juca de Oliveira e outros, participou do Teatro de Arena, em São Paulo. A TVA, do Rio de Janeiro, ouviu o cineasta Joel Pizzini, que dirigiu o documentário “Paulo José, um auto-retrato brasileiro”. Vamos acompanhar a pergunta dele para o Paulo."
28/05/2007,Paulo José,33,Joel Pizzini,"Paulo, você é uns dos artistas mais completos do país, um dos construtores da imagem da nossa nação, do mito da brasilidade “macunaíma”. Eu queria saber como que você convive com os seus personagens, seus filhos filmes, seus filhos peças? Como que é essa convivência, desde os filhos mais tímidos até os mais exuberantes, é tudo um filme só para você? Você tem carinho por tudo que você faz? Você concorda com o que o Glauber Rocha [cineasta, ícone do Cinema Novo (1939-1981)] dizia, que não existem pequenos papéis e sim pequenos atores?"
28/05/2007,Paulo José,34,Paulo José,"Eu gosto de tudo que eu faço. Porque tudo que eu faço é uma oportunidade de fazer uma coisa que me dá prazer. Eu falo isso para os atores que têm papéis pequenos e se comportam como figurantes. Mesmo em uma pontinha, como para entregar um telegrama. Eu costumo dizer que eu sou protagonista. Eu tenho um personagem que é muito importante, que é uma função antagônica, agora, em outra peça. Nessa aqui, ele só entra para entregar o telegrama, mas ele é um personagem também. Então, você entra com convicção de personagem, não entra vendido. É só entregar um telegrama. Então, é a maneira de eu conseguir, às vezes, conquistar atores. Quando eu dirigia na televisão e tinha que fazer escalações, às vezes, eu tinha o papel de porteiro do prédio, por exemplo. Então, o ator dizia: “Mas o papel é pequeno.”"
28/05/2007,Paulo José,35,Chico de Assis,"Paulo, passando de personagem para pessoa. Tem muita gente que acredita que as várias gerações de uma nação têm vocações. Eu pergunto: você acha que a nossa geração teve uma vocação? Qual foi, se você acha que teve?"
28/05/2007,Paulo José,36,Paulo José,"Claro que teve, uma vocação muito forte, muito evidente, muito obstinadora, muito homogeneizada, que era transformar o mundo. Nós crescemos com essa certeza de que era possível transformar o mundo. Isso nos aglutinava não só aqui, como em outros países ou no mundo todo. Você foi um cara que sempre acreditou nisso. Hoje, depois, com a idade, você assiste com um certo ceticismo, com uma certa tristeza, às vezes, uma ingenuidade. Mas nós não podemos ser culpados da nossa ingenuidade. Nossa vocação, nosso chamado foi exatamente esse: foi o chamado para transformar o mundo. E, depois, isso é uma característica não só brasileira, é uma característica mundial, que começa nos anos 50 e 60. Acaba nos anos 70, os anos de refluxo, quando morre o Kennedy [John Kennedy, jovem, carismático e inovador presidente americano, assassinado em 1963, causando grande comoção mundial], morre o Martin Luther King [ativista político norte-americano, (1929-1968), principal nome da luta pela igualdade racial das décadas de 1950/60]. Há uma série de transformações nos anos 70 que são de refluxos. A geração se encolheu toda e boa parte dela, os mais ativos, foram mortos. Eu fazia teatro no estado de São Paulo, junto com o Teatro de Arena, em 67 e 68. Em 69, fomos convidados para o festival de Nancy, na França. Então, nós fomos com um grupo, já com os projetos de autodissolução do festival de Nancy. Não se voltaria mais, alguns voltaram para a luta armada [contra a ditadura militar] e foram mortos."
28/05/2007,Paulo José,37,Chico de Assis,"Paulo, e a nossa vocação de factótum [pessoa indispensável, com habilidade para tudo]. Por que você acha que na nossa geração não se deixa por menos do que ser ator, diretor, autor, músico, bonequeiro, por que isso?"
28/05/2007,Paulo José,38,Paulo José,"Faz parte do mesmo processo de trabalho. Existe uma especialização que coincide com uma burrice, especialização na ciência, na medicina. No caso, especialização do ouvido esquerdo, porque do direito não entendem nada [risos]."
28/05/2007,Paulo José,39,Mauro Ventura,"Eu estava lendo umas reportagens antigas sobre você, mas sobre você com 40 anos de idade. Aí, virei umas páginas e estava você, já com 40 anos de cinema. Deu para rever a sua vida inteira naquelas páginas. Para você também bateu essa sensação de que a vida passou num instante? Você estava com 40 anos e agora você está com 70. Ou você, com essa vida múltipla, tão intensa, não bate essa coisa de “já estou com 70 anos”?"
28/05/2007,Paulo José,40,Paulo José,"Tem uma peça que eu fiz agora, acabou no fim do ano, que tem uma frase que diz: “A vida passou como um rato correndo pela sala.” Mas não é verdade. Nós vivemos muitas vidas, muitas vidas mesmo. É até incrível a gente pensar, volta e meia eu procuro fazer um relatório, porque as pessoas perguntam, não é? “Está fazendo alguma coisa?” Eu dizia: “estou”. Você começa a dizer o que está fazendo e chega uma hora que as pessoas falam: “Como você consegue fazer tudo isso?” Porque a gente faz de tudo um pouco. No teatro, o teatro é arte do ator, não tem especialista. Quando eu fazia teatro, quando eu comecei a fazer teatro, nós fazíamos “de um tudo”, como se diz. Contra-capa de livro, figurinista, maquiador, cenógrafo, tradutor, produtor, administrador e pessoa com conhecimentos enciclopédicos. Mas é um exagero. “Você fazia tudo isso?” Agora, fazia meio mal, fazia como podia. Eu fazia cenografia no Arena, o figurino, quando o Flávio me enchia o saco: “Não vou fazer essa peça.” Aí, eu ia no lugar dele fazer, mas ele aparecia para me ajudar. Eu ganhei um Prêmio Molière de melhor figurinista, em 1962, e outro em 63. Foi no primeiro Prêmio Molière que houve, com A mandrágora, de Maquiavel. Mas o Flávio Peres, meio escondido, me ajudava, dava os palpites e ganhei o prêmio de melhor cenário e melhor figurinista."
28/05/2007,Paulo José,41,Beth Néspoli,"Só uma mudança um pouco de rumo. Eu entrevistei você em 1996. Você iria fazer o Policarpo [Quaresma]. Você estava muito feliz porque tinha Macunaíma, que é o heróico sem caráter, e Policarpo, um herói com todo caráter. Eu tinha lido o roteiro que era de Alcione Araújo e era muito bonito. Realmente, dava um otimismo em relação a esse contraponto Policarpo e Macunaíma. Mas no Policarpo, pelo menos vendo o filme, eu não senti a beleza do roteiro. Para mim, foi alguma coisa que não atingiu o que prometia na sua entrevista e lendo o roteiro. Eu queria saber a sua avaliação disso e por que é mais difícil fazer o caráter do que o não-caráter? O que deu errado? Se é que você avalia assim também?"
28/05/2007,Paulo José,42,Paulo José,"É difícil de falar do um filme de um amigo, que fizemos juntos, com toda paixão, todo amor, todo carinho, com desejo de acertar, mas não há dúvida que o Policarpo tem uma certa lentidão. Parece que é um pouco... Não vibra muito, embora eu ache que o personagem, eu não tenho nenhum reparo a fazer no personagem Policarpo. Ele é muito íntegro, tem uma visão do futuro. “Estou indo para frente.” Ele acredita que o futuro do Brasil é a agricultura mesmo. Depois eu gostava muito do personagem porque, em certas coisas, de primeira leitura, parece que o Policarpo é um bobo, meio débil mental, meio bobão, quando quer que o tupi-guarani seja a língua oficial do Brasil. Aí, você vai ver que não é. Então, quando eu comecei estudar tupi-guarani para dizer algumas palavras, algumas expressões de nível geral, ingatu, que é a língua que se falava, descobri que ele era um cara realmente com sabedoria. Até 1750, mais ou menos por aí, quando o Marquês de Pombal [Sebastião José de Carvalho e Mello, primeiro-ministro de Portugal, (1699-1782)] proibiu o ingatu, a língua geral no Brasil, que acabou expulsando os jesuítas daqui, falava-se tupi-guarani. O tupi-guarani é o ingatu misturado com tupi-guarani.Misturava-se palavras portuguesas com palavras novas, que não existiam na língua tupi-guarani. Então, a aspiração de Policarpo, a reivindicação do tupi-guarani como a língua do Brasil era legítima, porque era a língua do Brasil sim. Foi por 250 anos a língua do Brasil."
28/05/2007,Paulo José,43,Beth Néspoli,"Já empobreceu por perder esses outros, não é?"
28/05/2007,Paulo José,44,Paulo José,Eu fazia o discurso na câmara com grande exaltação patriótica e verdadeira. Nunca critiquei o personagem. Eu era apaixonado pelo personagem.
28/05/2007,Paulo José,45,Beth Néspoli,"No roteiro tinha uma cena em que ele, literalmente, transava com a terra. Ele fazia amor com a terra e era uma cena muito bonita que, no filme, fica meio patética. Não sei, não teve aquela força, não sei exatamente o porquê. É uma pergunta para você mesmo, que tem uma avaliação por dentro."
28/05/2007,Paulo José,46,Paulo José,"Porque existe uma sobriedade no ato. O plano é feito, o plano geral, o personagem se joga na terra molhada, a chuva caindo e aos poucos começa a sentir calor do sexo e começa a cravar o pau na terra. Mas isso me parece absolutamente visível, não precisava mais do que isso. A minha impressão é que não precisava mais do que isso, porque aquela bolha subia e descia com uma energia na terra."
28/05/2007,Paulo José,47,Rubens Ewald Filho,"Aproveitando um pouquinho, eu queria que você falasse um pouquinho de Joaquim Pedro de Andrade, que foi ele que lançou você. Tem uma história no livro muito divertida que é a do nariz. Conta essa história também?"
28/05/2007,Paulo José,48,Paulo José,"No livro está escrito à maneira de Mário de Andrade [escritor e poeta modernista, (1893-1945)], ou não?"
28/05/2007,Paulo José,49,Rubens Ewald Filho,"Tem a história que ele achou que seu nariz de um lado fotografava de um jeito, não é isso?"
28/05/2007,Paulo José,50,Paulo José,"Porque acontecia o seguinte: eu tinha feito O padre e a moça e, depois, em Macunaíma, eu freqüentava a casa dele e fui acompanhando o trabalho de pré-produção do filme Macunaíma. Então, eu ficava no geral da casa dele vendo Anísio Medeiros [cenógrafo e figurinista, (1922-2003)] e ele trabalhando no roteiro, escalando elenco, fazendo decupagem. E começaram a fechar o elenco. O Macunaíma preto era o Grande Otelo, que nasce no mato. A Ci [personagem de uma guerrilehira], era Dina [Sfat]; o comedor de gente, o Milton Gonçalves; faria o Maanape [irmão de Macunaíma], o Rodolfo Arena. Depois tinha Joana Fomm, a Maria do Rosário, tinha belas mulheres também. “E Macunaíma branco quem será?” E eu lá pensando: “Estou aqui.” E ele nem olhava para mim. Passava assim, ia escolhendo as pessoas e me perguntava: “O que você acha de fulano? O que você acha do Vianinha?” E eu dizia: “Melhor impossível.” Era o Vianinha ou ninguém mais. Ele: “Eu não sei. Vou pensar.” Daí, no outro dia ele vinha: “E o Guarnieri, o que você acha do Guarnieri? É isso, Guarnieri é o Macunaíma.” E eu: “Não sei.” Então, ele ia passando por todos os atores brasileiros entre 35 e 50 anos. Ele pegou o Agildo Ribeiro e começou a trabalhar com Agildo. A gente tinha feito o Auto da compadecida [peça de teatro, de 1957]. Ele começou a ensaiar uns dias e depois: “Não é assim, é diferente, é outra coisa. Não vou fazer com Agildo.” Aí, ficou sem Macunaíma [branco]. O filme já tinha começado, até um dia em que ele olha para mim e diz assim: “Você topa operar o nariz? Opera o nariz, porque você tem um nariz difícil de fotografar. Ele é fino de perfil e largo de frente, são duas pessoas diferentes, são dois rostos diferentes.” E eu falei: “Não vou operar o nariz coisa nenhuma. Um homem de idade operar nariz, já vivi toda a minha vida com esse nariz e não vou trocar agora.” E ele: “Se você operar o nariz você faz Macunaíma”, ”Ah. Então, não vou fazer, porque não vou operar o nariz“, ”Sabe o que mais? Você tem o nariz do personagem: branco de perfil, negro de frente. Aí, tem cafuzo, mulato, vamos fazer o Macunaíma“. Aí, foi a minha grande alegria, foi um momento de extrema felicidade, fazer ”o herói sem nenhum caráter”."
28/05/2007,Paulo José,51,Paulo Markun,"Paulo, vamos fazer mais um rápido intervalo e a gente volta daqui a instantes com o Roda Viva, que é também acompanhado na platéia essa noite por Elizeu Lopes Filho, professor de cinema da Faap [Fundação Armando Alvares Penteado]; Gabriela Nicioli, estudante de jornalismo; Eliana Rodrigues, fotógrafa; e Roberta Bale, atriz. A gente volta já."
28/05/2007,Paulo José,52,[...],[intervalo]
28/05/2007,Paulo José,53,Paulo Markun,"Estamos de volta com o Roda Viva que esta noite recebe o ator e diretor Paulo José. Desde 1992, ele enfrenta o mal de Parkinson, uma doença degenerativa, irreversível e até hoje incurável. Paulo, também tem uma pergunta obrigatória: como que você lida com esse tipo de coisa?"
28/05/2007,Paulo José,54,Paulo José,"Lidando, não tem jeito. Você não pode fugir disso, não é? Você gostaria de não ter, mas você tem, não é? E uma doença degenerativa, quando o médico me falou, que eu fiz os exames, um diagnóstico com as tomografias, e ele falou: “Não tem nada, não tem tumor, não tem coágulo, está perfeito.” Porque é Parkinson, não é? E ele me disse: “Você sofre de uma doença degenerativa, progressiva e irreversível.” [diz com ênfase] Ele tinha um prazer em dizer isso. E eu lembrei que ele também era portador de uma doença da vida, o envelhecimento, progressiva, degenerativa e irreversível. A partir dos 30 anos já começamos entrar no processo de degenerescência progressiva."
28/05/2007,Paulo José,55,Paulo Markun,Estamos já no epílogo.
28/05/2007,Paulo José,56,Paulo José,"E tem gente que, por exemplo, com 30 anos, já entregou, não joga mais. Tem gente que com 50 já se sente velho. O velho Niemeyer [Oscar Niemeyer, arquiteto, que fez 100 anos em 2007], o jovem Niemeyer, está em plena atividade. Tenho um dos antídotos do que você tem que fazer contra isso, que é você ter muita coisa para fazer, muita vontade de fazer as coisas. Há o grau de dificuldade, mas, por outro lado, aprofunda a sua maneira de fazer, você acaba fazendo melhor as coisas, porque o brasileiro tem muito jeitinho, brasileiro é esperto, não é? Vai ali e pá, pim, pum, já fez. E quem tem uma deficiência, uma asa quebrada, qualquer coisa assim, tem que ter uma ajuda para voar, tem que fazer mais esforço, treinar mais o vôo. Agora, quando voa, acaba fazendo melhor. Então, eu sempre tive facilidade para muitas coisas, para música, para desenhar, mas acredito que um anjo veio e me deu um tapão para eu deixar de ser besta, para me botar um pouco no lugar, para eu perder a arrogância, a prepotência, a vaidade. Eu fui obrigado a ficar mais humilde e acreditar mais no trabalho, num esforço para fazer as coisas, desde que você tenha uma aptidão mínima, básica, para fazer as coisas. Eu voltei a tocar piano, me tornei mais interiorizado, passei a escrever, eu não escrevia, tinha a tortura da forma - que comparação estúpida -, mas é a dificuldade de fechar a frase. Sempre ficava trocando as palavras de lugar. Agora, depois do Parkinson, comecei a escrever. Você não sabe dizer de onde vem as coisas, de lugares inesperados, as frases vêm saindo, saindo, saindo, e comecei a escrever. Verdade que eu tinha um repertório, uma vida toda de muita leitura, mas não conseguia aplicar isso e, depois, você fica mais para dentro, fica menos sociável, fica um pouco mais bicho do mato. A acuidade musical aumentou muito também. Então, hoje, quando eu ouço musica, eu não ouço a melodia, eu ouço a harmonia. Quer dizer, eu ouço a estrutura musical sempre. Ontem, fizemos um sarau de música lá em casa até 1h30 da manhã, com amigos tocando vários instrumentos. E eu meto a mão em todos eles, toco mal, mas toco. Tenho a dificuldade de digitação por causa do Parkinson, mas, tocando devagarinho, eu toco direitinho."
28/05/2007,Paulo José,57,Chico de Assis,"Vou falar uma coisa para você. Nós estamos vivendo um momento, principalmente no teatro, em que há uma mudança radical dos projetos, dos grandes projetos anteriores. Aqui, em São Paulo, por exemplo, o teatro se manifesta na Praça Roosevelt, com pequenos teatros e é ali que a coisa se dá com maior intensidade. Não há possibilidade de você montar um Hamlet [de Shakespeare], a não ser aquelas peças pequenininhas, essa coisa toda? Não há possibilidade de você montar um Shakespeare, a não ser o meu amigo que montou um Shakespeare com coragem. O que você acha desse atual momento? Primeiro, do limite da fronteira da irracionalidade de forma geral? E, segundo, do destino que as coisas tomam no teatro?"
28/05/2007,Paulo José,58,Paulo José,"Está difícil, porque fazíamos mais teatro nos anos 60 e ele era importante na sociedade. A imprensa participava disso, era um evento da cidade, da sociedade e foi se tornando cada vez mais da comunidade. Ficou menor, perdeu a relação com a sociedade, se tornou pequenininho, encolhido, e por causa disso você começa a ter idéias pequenas também. É difícil imaginar agora, hoje, montagens como o O canto da cotovia [de Jean Anouilh, uma versão terna e lírica da história de Joana d'Arc], que termina com a Catedral de Chartres [cidade da França] toda iluminada, triunfal. As idéias eram maiores, os teatros maiores e idéias grandes também. Agora, teatros pequenos geram idéias pequenas."
28/05/2007,Paulo José,59,Chico de Assis,Última coisa: queria que você explicasse qual é o sentido verdadeiro de o “Brasil faz o melhor cinema brasileiro do mundo”?
28/05/2007,Paulo José,60,Paulo José,"Porque o Brasil tenta fazer cinema americano e faz mal, mal pra burro, muito mal. Italiano, não tem como fazer uma comédia italiana, pois o italiano faz melhor. Agora, cinema brasileiro, o Brasil faz o melhor cinema brasileiro do mundo, sem dúvida nenhuma. O brasileiro é o melhor do mundo. Walter Salles [cineasta] conheceu isso quando fez A grande arte [filme de 1991]. Era um filme americano, então, como filme americano era muito fraco."
28/05/2007,Paulo José,61,Cunha Jr.,"Paulo, uma coisa engraçada que aconteceu no Festival do Rio [Festival Internacional de Cinema do Rio de Janeiro] e também no Festival de Berlim [Festival Internacional do Filme de Berlim], quando passou o filme O ano que meus pais saíram de férias [de Cao Hamburguer, 2006], diziam assim: “O filme é tão bom que parece filme argentino.” Você acompanha os filmes argentinos e acha que realmente os argentinos fazem filmes melhores do que os brasileiros?"
28/05/2007,Paulo José,62,Paulo José,Estão fazendo.
28/05/2007,Paulo José,63,Cunha Jr.,Estão fazendo?
28/05/2007,Paulo José,64,Paulo José,"Estão fazendo, porque na Argentina, como na Espanha, a televisão não é tão importante. Na Espanha, um público normal de um filme espanhol é de 10 milhões de espectadores. A televisão não tem importância lá. Lá, o cinema que se faz é o programa da televisão que a gente faz aqui. Você discorda, não é? [Dirigindo-se para Beth]"
28/05/2007,Paulo José,65,Beth Néspoli,"Eu acho que neste momento, em São Paulo, tem um movimento muito forte de grupo. Eu acho que, por exemplo, o Galpão do Folias [grupo teatral], que está montando e vai estrear a trilogia do Ésquilo [poeta trágico grego, (525 a.C - 456 a.C)], uma trilogia grega que nunca foi montada no Brasil. Eles fizeram de Shakespeare o Otelo. Você tem os (...) fazendo Os sertões, de Euclides da Cunha. Tem aqueles chats maravihosos, o próprio Grupo Galpão, que você dirigiu duas peças: Inspetor geral e O homem é homem, que teve uma inserção muito forte em Belo Horizonte. Fui no Grupo Galpão 2 vezes, em Belo Horizonte, para um encontro de grupos brasileiros, chamado Redemoinho, com 50 grupos, de Sergipe ao Rio Grande do Sul. Eu acho o contrário, que tem um movimento de grupo muito forte de novo, como aconteceu na época do [Teatro de] Arena e do [Teatro] Oficina {Oficina: O Teatro Oficina foi criado em 1958 por um grupo de estudantes da Escola de Direito do Largo de São Francisco, em São Paulo, entre eles o diretor José Celso Martinez Corrêa, considerado hoje a grande figura do teatro escola. Distinguiu-se de outras companhias teatrais por ousadias cênicas e por ter absorvido várias vertentes das artes cênicas internacionais, dando-lhes um cunho eminentemente brasileiro. A primeira grande realização do elenco ocorreu em 1963, com a peça Pequenos burgueses, de Górki, dirigida por José Celso. Porém, foi a estréia de O rei da vela, em 1967, que elevou a condição da companhia para escola, trazendo as idéias do movimento artístico para o cenário brasileiro, ao incorporar Oswald de Andrade e as idéias da antropofogia, fundando um novo movimento que repercutiu em outras artes, em especial na música e cinema. O Oficina continua inovador e polêmico no início do século XXI.}, lá atrás. Está evidente, fazendo teatro, hip-hop, andando pelos céus, com uma inserção muito forte na sociedade. Me parece, que muitos da geração do Chico e da sua geração, que é uma geração que foi para um outro caminho, se desligaram, talvez não estejam acompanhando. Será que vocês não deixam de fazer o seu papel? Pela potência que têm, poderiam ir lá, ver o que está acontecendo, fazer uma ponte com esses grupos e dar força até com a imagem de vocês?"
28/05/2007,Paulo José,66,Paulo José,"Eu me penitencio pelo que eu disse antes. Foi uma coisa muito parcial. Na realidade, a existência desses grupos pequenos são idéias pequenas. Mas o que acontece também é a multiplicação. Por exemplo: o Grupo Piolim, os grupos regionais, a quantidade de festivais de teatro que existem, cada vez mais e em todo Brasil, a multiplicação de grupos de teatro, que é uma coisa que não é desprezível. Além disso, também me penitenciando um pouco do que disse antes, o teatro não está tendo muita gente não. Ao teatro vai pouca gente. Na televisão, tem 50 milhões no primeiro tempo e você não pode fazer um teatro de 5 mil lugares. Já é outra coisa, é diferente. O [...] que faz teatro há uns 20 anos, ele trabalhou 20 anos e dizia que o alcance máximo da comunicação viva do ator no palco é de 18 fileiras, mais ou menos até a letra R ou S. A partir disso já não tem mais comunicação, começa a se perder a comunicação. Então, é o limite do teatro. Agora, o Arena foi um teatro fundamental na história do teatro brasileiro nos anos 60. Tinha 200 lugares, às vezes 170. Mas é que o teatro não age na massa, age nos formadores de opinião, tem um efeito multiplicador nas pessoas que vão àqueles teatros, àqueles espaços pequenos. Esse é outro lado da questão."
28/05/2007,Paulo José,67,Mauro Ventura,"Você dirigiu 2 espetáculos muito elogiados: A controvérsia [2001] e o Inspetor geral [2004]. Isso recentemente, de 7 anos para cá. Foi muito elogiado lá no Rio. Em seguida, dirigiu Antônio e Cleópatra [2006], que foi, pelo menos no Rio, massacrado pela crítica. Você se importa com a crítica, seja a favor ou contra?"
28/05/2007,Paulo José,68,Paulo José,"Eu me importo. Quando a crítica é a favor, eu acho ótimo [risos], e quando é contra, eu acho péssimo."
28/05/2007,Paulo José,69,Mauro Ventura,Essa dizia que foi um Shakespeare constrangedor. Isso te abateu de alguma forma?
