DATA,ENTREVISTA,ORDEM,LOCUTOR,FALA
28/05/2007,Paulo José,70,Paulo José,"Isso foi opinião da Bárbara Heliodora [crítica teatral], constrangedor. Aliás, ela colocou no título “Shakespeare constrangedor”. É terrível, mas eu me dou bem com a tia Bárbara. Eu gosto dela."
28/05/2007,Paulo José,71,Nelson de Sá,"Você estava falando agora há pouco das idéias pequenas do teatro e do teatro pequeno, digamos assim. Mas, ao mesmo tempo, você não desiste, você persiste, monta e encena peças com grupos teatrais inclusive. Mas dá para sentir um certo desalento com a cena teatral contemporânea? O que você sente em comparação com o teatro que vocês fizeram? Há uma desesperança, uma falta de... Enfim, vocês queriam mudar o mundo e hoje qual a sensação?"
28/05/2007,Paulo José,72,Nelson de Sá,Isso nem está mais em pauta. Como você vê isso no teatro?
28/05/2007,Paulo José,73,Paulo José,"Hoje é menos importante o teatro para a gente se mudar. Parte muito mais da visão da mudança objetiva, da transformação do mundo. Agora, é uma visão mais da nossa transformação. A gente assiste, a gente monta os espetáculos que vão alterar a gente. Primeiro enquanto grupo e depois enquanto pessoas. Conseqüentemente, irradiando para outras pessoas essas alterações. O teatro tem que ser sempre provocativo, tem que ser sempre subversivo, tem que ser sempre, como diria [...] instigante. Não se pode perder de vista isso. E ele tem sido bastante instigante e provocativo. O Grupo Galpão, por exemplo, é um grupo que tem responsabilidade nesse sentido. Não pode montar qualquer peça. Está comprometido com uma coisa mais intensa, mais profunda, não é? O Armazém, de Paulo de Moraes, o grupo do Enrique Diaz, no Rio de Janeiro, a Companhia dos Atores, eles têm um compromisso que é transformador."
28/05/2007,Paulo José,74,Nelson de Sá,"Vou aproveitar, porque eu queria complementar a pergunta. Algum tempo atrás, há uns 2 anos, você comparou o Lula [Luiz Inácio Lula da Silva], o presidente da República, como uma mistura de Macunaíma e Policarpo Quaresma. Enfim, o que existe de perspectiva política hoje? Eu queria a sua opinião sobre o Lula, sobre o governo federal e sobre o caminho da própria esquerda, você que é um artista."
28/05/2007,Paulo José,75,Paulo José,"Hoje ele está mais em “Macunaresma”, não é? “Policaima”, não é? Houve uma certa mistura. Agora, tem coisas que são interessantes e novas. Nas elites de países periféricos como o nosso, a política era exercida pelas pessoas da elite, que não tinham muita identificação popular. Então, o governo era uma coisa mais chique. O Fernando Henrique [Cardoso, presidente da República entre 1995 e 2002] é um diplomata, um gentleman. Ele fala várias línguas. Agora, o que aconteceu na América Latina é interessante. É meio feio de ver [fala de forma cínica], mas, agora, o povo está diretamente representado no poder. Quando a gente olha a Venezuela, a gente olha o Cháves [Hugo Cháves, presidente da Venezuela desde 1999], a gente olha o Morales [Evo Morales, presidente da Bolívia], a gente olha o Lula, isso é uma coisa nova que está acontecendo. Isso é novo, não sei aonde vai dar exatamente, até que ponto os países que se decidem fazedores de preços, países de centro, vão deixar essa brincadeira continuar. Mas tem uma coisa nova acontecendo, diferente. O povo está mais representado no poder e, talvez, isso seja perigoso. O fracasso dessa experiência leva os resultados para os nossos aristocratas. Quando não voltar para os nossos militares, porque já estão voltando. Estão pedindo para botar o exército na rua. No Rio de Janeiro, já estão botando na rua. Isso é interessante. “Meus queridos, pelo amor de Deus, botem o exército na rua.” Mas, e se eles gostarem de ficar na rua? [Risos] Como é que faz?"
28/05/2007,Paulo José,76,Paulo Markun,"Nós vamos fazer mais um rápido intervalo e voltamos com a entrevista desta noite também acompanhada em nossa platéia por Adriana Valejo, cantora e compositora; Renata Fleury, estudante de artes cênicas; José Gossi, coordenador do curso de cinema da Faap; e Paula Beatriz Bragal, que é estudante de jornalismo. A gente volta já."
28/05/2007,Paulo José,77,[...],[intervalo]
28/05/2007,Paulo José,78,Paulo Markun,"Voltamos para o último bloco do Roda Viva. Esta noite entrevistando o ator e diretor Paulo José. Ele já ganhou 3 vezes o troféu Candango de melhor ator, no Festival de Brasília. Em 2000, recebeu o troféu Oscarito, no Festival de Gramado, pelo conjunto de sua obra. Sobre a época do Teatro de Arena, Paulo, a gente tem uma pergunta do dramaturgo e crítico de teatro Alberto Guzik, vamos acompanhar."
28/05/2007,Paulo José,79,[Vídeo com a pergunta de Alberto Guzik],"Boa noite, Paulo. Eu gostaria de dizer que é um grande prazer estar aqui fazendo essa pergunta para você, porque eu sou seu fã há muito tempo, desde que eu vi trabalhos seus no Teatro de Arena, na década de 60. O tempo passa muito depressa, não é? Então, é sobre o Teatro de Arena e sobre aquela época que eu gostaria de falar com você. Você veio para São Paulo, trabalhou no Arena em alguns espetáculos, filmou As amorosas, com Walter Hugo Khoury [1967], e algum tempo depois, já no Rio de Janeiro, você participou de um filme que é um marco na nossa geração, que foi Todas a mulheres do mundo, com a Leila Diniz [1945-1972], maravilhosa, e direção de Domingos de Oliveira. Eu queria que você falasse sobre você como ator naquele período. Que ator você queria ser? Quais eram as suas influências? Que atores você admirava? Qual era o seu filme predileto ou os seus filmes prediletos? Enfim, conta para a gente essas coisas?"
28/05/2007,Paulo José,80,Paulo José,"No teatro eu não me considerava ator. Eu me considerava um cara de teatro, desde Porto Alegre, desde Bagé, no teatro do colégio dos padres, com 10 anos de idade, quando comecei a fazer teatro. Eu me considerava uma pessoa que trabalhava em tudo para que a peça saísse, mas não conseguia me concentrar num personagem. Até achava, mesmo no Teatro de Arena, os atores egoístas, porque o ator pensava “o meu personagem” e eu não conseguia pensar no meu personagem. Eu pensava no espetáculo em conjunto. Como eu fazia produção, fazia às vezes cenografia, figurino, fazia bilheteria, era uma maneira de fugir da responsabilidade de ser ator. Cinema, eu não estava fazendo muito bem, porque não tinha tempo de ensaiar, tem um pouco esse lado. “Enquanto os outros estão ensaiando, ensaiando, ele está na rua comprando pano para fazer uma calça.” Então, isso me isentava um pouco da minha responsabilidade enquanto ator. Eu só fui ser ator mesmo, entender isso, quando fui fazer O padre e a moça, filme de Joaquim Pedro de Andrade. Quando eu cheguei no Rio das Pedras, interior de Minas, para fazer o personagem, cheguei lá e estava tudo pronto, não tinha nada para fazer. Eu só tinha que vestir uma batina e virar personagem. Então, eu me esforcei para tentar ajudar Mário Carneiro na luz, para tentar ajudar o Joaquim, mas ninguém queria nada de mim, todos já tinham passado por esses setores. Eu só tinha que ser ator. Aí, descobri o prazer de ser ator. Além disso, o luxo que é ser ator. Enquanto a equipe de filmagem no sol, no tempo, com as condições precárias de filmagem no cinema brasileiro, de longe ficava o ator, que precisa estar bonitinho. Tinha um guarda-sol para ele, todo mundo no sol, torrando, e o ator embaixo do guarda-sol. Aí, vem um cara trazendo melancia fresquinha, geladinha. Então, o ator é um ser de luxo. Eu achei maravilhoso esse negócio, fiquei encantado com as prerrogativas do ator no cinema."
28/05/2007,Paulo José,81,Paulo Markun,"Mas tem um preço, como não tem almoço grátis, esse luxo todo tem um preço. É o seu rosto, é a sua interpretação que vai estar lá na telona e não exatamente a direção e nem nada disso."
28/05/2007,Paulo José,82,Paulo José,"Na verdade, quer dizer, o cuidado que têm com você, não é por ser ator, é pelo fato de você estar botando a cara lá na frente. Muitas vezes os diretores odeiam os atores, mas têm que trabalhar juntos e são obrigados a agüentá-los, porque precisam deles e quando termina o filme: “Agora vai para puta que o pariu, porra. Terminou, acabou o filme.” Tem a história do Lulu de Barros [Luiz de Barros, cineasta,(1893-1982)], engraçada, que era blackout de um filme chamado Eles não voltaram [1960], sobre os pracinhas na Segunda Guerra Mundial. Eu fazia um soldado e chegou um dia que o Luiz de Barros começou a fazer exigências maiores. E ele dizia: “Amanhã, filmagem às 7 horas da manhã almoçados.” [Risos]"
28/05/2007,Paulo José,83,Cunha Jr.,"Paulo, você trouxe essa coisa de cinema e eu acho importante no cinema brasileiro falar da coisa do mercado. Nós temos, acho, cerca de 2000 mil salas no Brasil. O homem aranha, esse primeiro grande “blockbuster” que estreou agora, entrou em 600 salas, tem shopping que tem 3 salas para O homem aranha. Eu fui assistir um documentário muito interessante, aqui em São Paulo, chamado Em trânsito [de Henri Arraes Gervaiseau], que está em uma sala, em um único horário por dia. Tem saída para isso aí?"
28/05/2007,Paulo José,84,Paulo José,"Difícil, não é? Precisaria de uma política muito rigorosa no sentido de assegurar a reserva de mercado. Porque, na Europa, o problema do cinema é problema de segurança nacional, problema de autonomia, independência, soberania. Quando o Gat [Acordo Geral entre Comércio de Serviços, em inglês, General Agreement on Trade in Sevices, que inclui serviços audiovisuais], aquele acordo de livre comércio, foi feito no mundo todo, os ministérios de cultura da Europa se reuniram no seminário e fecharam que a produção cultural era uma questão de soberania, de autonomia e de identidade que estavam nesses países. Como o acordo do Gat, que era um acordo pleno, principalmente para a indústria fonográfica, para os mega stars entrarem de forma avassaladora no cinema, o grande cinema americano não poderia entrar no acordo do Gat. Eles ficaram de fora. Quer dizer, fica reservado para cada país a produção cultural, a indústria cultural é o privilégio de cada país, que tem direitos sobre sua reserva de mercado. A grande invasão de colonização não é com os marines [tropa de elite das Forças Armadas dos Estados Unidos]. Mais uma vez, eles estão se ferrando lá no Iraque. A grande invasão que se dá é a cultural, onde você entra por baixo e ela vai assumindo, modificando os hábitos, os usos, isso que tem ser cuidado. E o cinema é a forma mais eloqüente, mais extraordinária, de você fixar a cultura na nação. Felizmente, hoje, apesar das restrições de mercado à exibição, o número de documentários está aumentando enormemente. Hoje, existe um cinema documental brasileiro muito significativo. Começou a partir do Joãozinho [João Moreira Salles], do Eduardo Coutinho, mas existe uma quantidade enorme de documentaristas que são voltados para documentário. O João fica irritado quando eu pergunto para ele: “Quando é que você vai fazer seu longa?” Ele diz: “Eu sou um documentarista, não sou diretor de ficção.” Mas isso está acontecendo. Eu fui agora no Festival de João Pessoa e foi muito interessante, porque eu vi a quantidade enorme de documentários de Angola, de Moçambique, de Portugal, de brasileiros que dão uma realidade nova, que te ajudam a entender melhor o país que a gente vive. A língua portuguesa deixa de ser a língua que ninguém fala. Você percebe que é a quinta língua que se fala no mundo e que os países têm uma história para contar, têm o que dizer, e isso está fixado no cinema documental. Então, por um lado, seria reserva de mercado e, por outro, estimular ao máximo a produção de documentário. Porque tem uma produtora, a Infinito, que faz eventos e que vai fazer nos Estados Unidos uma série de eventos no mercado universitário americano de filmes brasileiros, só filmes brasileiros. Entrou no mercado universitário americano com patrocínio da Petrobras."
28/05/2007,Paulo José,85,Mauro Ventura,"Paulo, você é uma espécie de ator fetiche do Domingos Oliveira, foi o alter ego dele em alguns filmes. Mas, nos últimos anos, o próprio Domingos tem feito o papel dele mesmo nos filmes dele. Vocês estão retomando essa parceria, você vai voltar a ser o Domingos de Oliveira?"
28/05/2007,Paulo José,86,Paulo José,Ele percebeu que ele podia ser ele próprio.
28/05/2007,Paulo José,87,Mauro Ventura,Não precisava mais de você...
28/05/2007,Paulo José,88,Paulo José,"Não precisava mais de mim, me jogou fora."
28/05/2007,Paulo José,89,Mauro Ventura,Mas vocês estão fazendo um filme?
28/05/2007,Paulo José,90,Paulo José,"Agora voltamos com o triângulo amoroso: Domingos, Aderbal e eu. Três amigos que fazem o filme que é chamado Centro cardeais e que agora passou a se chamar Juventude. Está pronto, acabou agora. Gravamos ontem as últimas cenas do filme. Agora voltamos juntos, eu e Domingos, eu sou o amigo do Domingos."
28/05/2007,Paulo José,91,Chico de Assis,"Paulo, comédia ou drama, o que você gosta?"
28/05/2007,Paulo José,92,Paulo José,Comédia.
28/05/2007,Paulo José,93,Chico de Assis,Por quê?
28/05/2007,Paulo José,94,Paulo José,"Porque comédia vai mais fundo. A comédia é a intuição do trágico. O drama tem uma dissolução, tem a solução final, porque a função catártica do drama é mais aliviante que a tragédia e a comédia. A comédia expõe ao ridículo, às mazelas, ao grotesco de todos nós. É essa a idéia mouresca da comédia. Era muito mais interessante mulher do que homem, não é?"
28/05/2007,Paulo José,95,Paulo Markun,"Paulo, o nosso tempo está acabando e eu vou fazer uma última pergunta que é a seguinte: lá longe, no sotaque, você ainda guarda referências do Rio Grande do Sul? Você começou a fazer teatro na cidade onde você nasceu, em Lavras. Depois, esteve em Bagé. Porto Alegre, na crise da legalidade, o seu grupo de teatro, em 1961, teve um papel importante."
28/05/2007,Paulo José,96,Paulo José,Eu estava vindo para São Paulo nessa época.
28/05/2007,Paulo José,97,Paulo Markun,"Exatamente. E o Rio Grande do Sul, em um certo sentido, é o estado mais, digamos, consciente da sua peculiaridade. O que sobra do gaúcho no Paulo José de hoje?"
28/05/2007,Paulo José,98,Paulo José,"Eu sou cada vez mais internamente gaúcho, mas não gaúcho da cultura do Rio Grande do Sul, gaúcho do lugar que eu nasci, gaúcho da fazenda da minha família, do campo. “Antes todos os caminhos iam. Agora todos os caminhos vêm” [citando o poeta Mário Quintana]. Estou um pouco nesse recolhimento. Você sai pelo mundo, o mundo é seu, você procura abrir o máximo o seu espaço no mundo. Depois, você vem fechando, fechando, fechando, fechando, os amigos são poucos, os livros convidativos e eu mesmo preparo chimarrão para os meus fantasmas. É mentira, não sou tão solitário assim. Isso é dramático. Mas cada vez eu sinto mais prazer em chegar na minha terra, encontrar aquele chão da minha infância, isso para mim é muito importante. Ascenso Ferreira [poeta pernambucano (1895-1965)] que diz: “Riscando os cavalos. Tinindo as esporas. Através das cochilhas. Sai de meus pagos em louca arrancada. Para quê? Para nada!“ [risos]. [citando o poema ”Gaúchos”]"
28/05/2007,Paulo José,99,Paulo Markun,"Paulo José, muito obrigado pela sua entrevista."
28/05/2007,Paulo José,100,Paulo José,"Imagina, acabei mal pra burro, uma grosseria dessas [risos]."
28/05/2007,Paulo José,101,Paulo Markun,"Prazer ter você aqui. Obrigado aos nossos entrevistadores e você que está em casa. Nós estaremos de volta na próxima segunda-feira, às 10h40, com mais um Roda Viva . Até lá."
