DATA,ENTREVISTA,ORDEM,LOCUTOR,FALA
28/05/2007,Paulo José,1,Paulo Markun,"Boa noite. Ele entra na casa dos brasileiros desde as primeiras telenovelas. Os papéis que interpretou permeiam o imaginário nacional. Ícone da dramaturgia, ícone de verdade, na acepção da palavra, o convidado de hoje do programa Roda Viva tem atuações memoráveis nos palcos de teatro e telas de cinema e televisão. Desde 1992 enfrenta o mal de Parkinson, mas mantém pela profissão o mesmo entusiasmo do começo da carreira. O Roda Viva recebe o premiado ator e diretor Paulo José. A entrevista você vê em instantes."
28/05/2007,Paulo José,2,[...],[intervalo]
28/05/2007,Paulo José,3,Paulo Markun,"Paulo José teve uma vida dividida entre a televisão, o cinema e o teatro. Como autor já interpretou todos os tipos de papéis e, como diretor, comandou vários programas e filmes nos mais de 50 anos de carreira."
28/05/2007,Paulo José,4,[Vídeo narrado pelo próprio entrevistado],"Em 1937, na pequena cidade de Lavras do Sul, perto de Bagé, no Rio Grande do Sul, nasce Paulo José Gomes de Souza. Aos 10 anos foi estudar no colégio dos Padres Salesianos, em Bagé. Eu estou lendo muito rápido? Está me vindo uma certa ansiedade, tanto texto aqui e a primeira pessoa falando de mim mesmo. Meio estranho, não é?"
28/05/2007,Paulo José,5,[Narração continua com Markun],"Paulo José era aluno de arquitetura no Rio Grande do Sul quando entrou para o Teatro Universitário de Porto Alegre. Convidado a trabalhar no Teatro de Arena {Teatro de Arena: Companhia de teatro paulistana que promoveu uma verdadeira revolução no cenário cultural e político das décadas de 1950 e 1960, até ser extinto, já na década de 70, principalmente pelos problemas no enfrentamento com a ditadura militar. Promoveu um teatro voltado para a reflexão, para a crítica social e para a valorização da dramaturgia brasileira. Aglutinou expressivo contingente de artistas comprometidos com o teatro político e social - como Augusto Boal e Gianfrancesco Guarnieri - e formou mais de uma geração de atores brasileiros. O diretor e fundador do grupo, José Renato, propunha nacionalizar o teatro incentivando peças que abordavam temáticas brasileiras, numa linha de forte crítica política e social, numa época com cenário dominado pelo TBC [Teatro Brasileiro de Comédia] que possuía um repertório mais internacional, com produções sofisticadas, pautadas por modelos europeus e que dialogavam pouco com a realidade nacional. O Arena fazia peças de autores nacionais com baixo custo, com o claro objetivo de incentivar o talento dos diretores brasileiros e sua sede tornou-se a casa do autor brasileiro.}, embarcou para São Paulo. No teatro, Paulo José gostava mais dos bastidores do que de atuar, tanto que o primeiro prêmio veio como figurinista na peça Mandrágora, de Maquiavel. Paulo José pegou o gosto mesmo pela encenação quando foi convidado a fazer cinema. Diz que virou galã por acaso e se considerava mais um ator anti-galã, até mesmo pelo seu porte físico. A trajetória do ator Paulo José foi vida dividida entre TV, cinema e teatro. Multifacetado, já interpretou todos os tipos de papéis nos mais de 50 anos de carreira. Em Macunaíma {Macunaíma: Considerada a obra-prima de Mário de Andrade, Macunaíma, “o herói sem nenhum caráter”, de 1928, é um clássico da literatura nacional, sendo um dos principais romances modernistas. Tem como personagem principal um anti-herói, que representa diferentes simbologias do imaginário e das etnias presentes no país, sendo um homem sem nenhum caráter e que, ainda assim, vive a trajetória de um herói. No romance, Macunaíma nasce negro, filho de uma índia e envolve-se com imigrantes em São Paulo, encantando-se com as atrações da cidade grande. A frase característica da personagem é “Ai, que preguiça!”. A parte inicial da obra assim o caracteriza: “No fundo do mato-virgem nasceu Macunaíma, herói de nossa gente. Era preto retinto e filho do medo da noite”. No filme homônimo, de Joaquim Pedro de Andrade, de 1969, ao chegar na cidade, o anti-herói, representado por Grande Otelo e Paulo José, banha-se em uma fonte de água e torna-se um homem branco. A obra transformou-se também em peça de teatro, com adaptação do diretor Antunes Filho, em 1978, com Cacá Carvalho no papel-título, alcançando enorme sucesso.} trabalhou com o ídolo Grande Otelo [1915-1993], onde fez a mãe do “herói sem caráter”, e depois o próprio “Macunaíma branco”. O contraponto de personagens aconteceu quando interpretou o sonhador e nacionalista Policarpo Quaresma, herói do Brasil [filme de 1998, baseado na obra de Lima Barreto]. Paulo José foi um dos atores mais populares do cinema nos anos 60 e, a partir da década seguinte, voltou-se mais para a TV. No começo dos anos 70, fez Shazan, na novela O primeiro amor [Rede Globo, em 1972], e o sucesso do personagem deu início à série Shazan, Xerife & CIA. Na TV Globo ganhou popularidade junto com a ascensão das telenovelas e dirigiu programas como Você decide e mini-séries da emissora. Paulo José também emprestou a voz para documentários de curtas metragens. Desde os 56 anos, Paulo José enfrenta o mal de Parkinson, uma doença degenerativa, irreversível e incurável. A doença não mata, mas cria limitações e desagradáveis movimentos involuntários. Mas o Parkinson não atrapalha os projetos de Paulo José. Atualmente, ele prepara um quadro para o programa Fantástico, da TV Globo. Paulo José foi casado com a atriz Dina Sfat [(1938-1989),o casamento durou 17 anos], com quem trabalhou em vários filmes e peças de teatro, e teve 3 filhas [Isabel, Ana e Clara]. Hoje é casado com a figurinista e diretora Quica Lopes. Ele ganhou 3 vezes o troféu Candango de melhor ator no Festival de Brasília e, em 2000, recebeu o Oscarito, no Festival de Gramado, pelo conjunto de sua obra."
28/05/2007,Paulo José,6,Paulo Markun,"Para entrevistar o ator e diretor Paulo José, nós convidamos: Cunha Junior, apresentador do programa Metrópolis, da TV Cultura; Nelson de Sá, colunista da Folha de S. Paulo; Mauro Ventura, repórter de cultura do jornal O Globo; Beth Néspoli, repórter e crítica de teatro do jornal O Estado de S. Paulo; Chico de Assis, ator e dramaturgo; e Rubens Filho, crítico de cinema. Também temos a participação do cartunista Paulo Caruso, registrando em seus desenhos os principais momentos e flagrantes do programa. O Roda Viva é transmitido em rede nacional de TV, da TV pública para todo o Brasil. Como o programa desta noite está sendo gravado, ele não permite a sua participação direta por telefone. Boa noite, Paulo José."
28/05/2007,Paulo José,7,Paulo José,Boa noite.
28/05/2007,Paulo José,8,Paulo Markun,"Queria começar com uma pergunta que eu já fiz aqui, quando o programa estava sendo gravado, mas ela não foi feita até o final. Vou repetir. Você sempre foi uma pessoa apaixonada pelo que faz. O que lhe apaixona neste momento?"
28/05/2007,Paulo José,9,Paulo José,"Nesse exato momento é uma programação de poesia, que eu estou fazendo para a TV Globo, um projeto para o Fantástico, que é um projeto que eu acalento desde sempre. Minha primeira direção eu fiz em 1958, a primeira direção de poemas encenados, em Porto Alegre, junto com meu amigo Mario de Almeida. De lá para cá sempre andei muito com poesia. Minha mãe é a pessoa que eu conheço que mais sabe poesia de cor. É impressionante! Ela está com 95 anos. São poesias, grandes poemas. “A lágrima"", por exemplo, são páginas e páginas de poesias e aquela velhinha vai e diz aquilo tudo. Então, desde pequeno, desde que me conheço assim, que me lembro de mim, vejo minha mãe dizendo poesia. E eu e meus irmãos também usávamos muito a Biblioteca Internacional de Abracelis, que tem uma coleção de livros muito interessante. Adorávamos ver aquilo e as poesias. Os livros de romanceiro, romanceiro da dona Juliana, que nós encenávamos, começava assim: “Vinha dona Juliana por um corredor acima, tocando uma guitarra que grande estrondo fazia. Acordou seu pai da cama do sono que ele dormia. Que tens tu, filha minha? Três filhas que nós éramos, são casadas, tem família. Eu puxei a mais formosa para o canto ficaria. Só se for com D. Alberto que é casado e tem família”. Então, o rei decide matar a mulher do Alberto para ele poder casar com a Juliana. Então, é uma história extensíssima e tinha uma parte muito comovente. Nas vésperas de ser enforcada, estava dando de mamar para o filho na torre do castelo. Essa parte diz assim: “Bebe, bebe, meu filhinho, esse leite do pai que chama, a mãe por essas horas, está no caixão. Bebe, bebe, meu filhinho, esse leite, a mãe por essas horas está a se enterrar. Bebe, bebe, meu filhinho, esse leite de ternura, de amargura, a mãe por essas horas está na sepultura”. Triste esse pedaço. Depois: “Toca, toca o sino do palácio, quem morreria? Morreu a filha do rei pela traição que fazia. Apartar os bens casados, coisa que Deus não queria, nesse jardim de alegria”. Então, essas coisas, desde pequeno, sempre dizendo..."
28/05/2007,Paulo José,10,Paulo Markun,Você acha que a televisão é um veículo para poesia?
28/05/2007,Paulo José,11,Paulo José,"Estou apostando, apostando que sim. Eu fiz 4 pilotos agora, que já foram aprovados e devem entrar no ar daqui a umas 2 semanas."
28/05/2007,Paulo José,12,Paulo Markun,No Fantástico?
28/05/2007,Paulo José,13,Paulo José,No Fantástico.
28/05/2007,Paulo José,14,Beth Néspoli,E tem participação de atores falando essas poesias? Como é o formato?
28/05/2007,Paulo José,15,Paulo José,"Não tem ator, só tem eu e minha filha Isabel fazendo contraponto comigo. O projeto eu dirijo, interpreto, faço de tudo um pouco."
28/05/2007,Paulo José,16,Cunha Jr.,"Uma das suas paixões, sem dúvida nenhuma, é a televisão. Você já faz televisão muito tempo como ator, dirigiu muita coisa, muitas mini-séries, mas há cerca de 10 anos, mais ou menos, você disse que 15 minutos são suficientes para uma pessoa ficar na frente da televisão, mais do que isso é meio passo para o tédio. Você ainda acha isso? O que você assiste na TV?"
28/05/2007,Paulo José,17,Paulo José,"Futebol dá para ver os 90 minutos com prorrogação e pênalti [risos]. E vejo com muito entusiasmo. Vejo campeonato europeu, campeonato espanhol, eampeonato inglês, campeonato italiano, a UEFA [União das Associações Européias de Futebol]. Campeonato brasileiro é mais penoso de assistir."
28/05/2007,Paulo José,18,Cunha Jr.,"Então, você tem assistido só futebol?"
28/05/2007,Paulo José,19,Paulo José,"Futebol, noticiário e alguns programas especiais, mesmo porque chega uma hora que a gente conhece muito a cozinha. Então, já sabe como é feita aquela comida [risos]. A gente olha para a novela e não consegue ver mais do que 15 minutos mesmo. São previsibilidades absolutas que vão acontecer na novela. Principalmente porque as novelas se tornaram muito redundantes. Nos anos 70, foi a invenção da televisão. Quer dizer, a partir do AI-5 {AI-5: Os Atos Institucionais foram decretos emitidos durante os anos após o golpe militar de 1964 no Brasil. O AI-5, baixado pelo presidente Costa e Silva, em 13 de dezembro de 1968, dentro das ações da ditadura militar no Brasil, estabeleceu o fechamento do Congresso Nacional, das assembléias legislativas e das câmaras de vereadores; decretou intervenção nos territórios, estados e municípios; cassou mandatos eletivos e suspendeu direitos políticos por dez anos; decretou o confisco de bens. Os AI, de maneira geral, serviram como mecanismos de legitimação e legalização das ações políticas dos militares, estabelecendo para eles próprios diversos poderes extra-constitucionais. Sem esse mecanismo, a Constituição de 1946 tornaria inexeqüível o regime militar. De 1964 a 1969 são decretados 17 atos institucionais regulamentados por 104 atos complementares.}, em 13 de dezembro de 1968, quando acabaram os grupos teatrais, o cinema novo etc. Foi um fechamento geral e coincide com uma mudança na televisão muito forte. O Beto Rockfeller [novela produzida pela extinda TV Tupi, em 1960], de São Paulo, era um fenômeno novo, absolutamente novo, inesperado, que trazia uma nova forma de representação, com novos personagens, mais contemporâneos, mais realistas e muito ligados com trabalho de teatro de arena. O Lima Duarte [ator] fazia peça de Chico de Assis e principalmente cangaceiro, fazia o Searin [nome de um personagem]. Então, havia uma ligação muito grande dessa nova televisão com o movimento teatral. Nesse momento, entra na Globo o Boni [José Bonifácio de Oliveira Sobrinho] e percebe essa mudança de rumos. Ele sai da Tupi e entra na Globo. E entra na Globo Janete Clair [nome artístico da escritora e famosa autora de telenovelas Janete Stocco Emmer Dias Gomes, (1925-1983)], Dias Gomes [Alfredo de Freitas Dias Gomes, escritor, autor de telenovelas e marido de Janete Clair, (1922-1999)] e trazem com eles toda a temática do Cinema Novo {Cinema Novo: Denso e produtivo movimento estético e intelectual do cinema brasileiro da década de 1960, bastante influenciado pelo neo-realismo italiano e a nouvelle vague francesa, cujos principais representantes são Glauber Rocha, Ruy Guerra, Cacá Diegues, Paulo Cesar Saraceni, Walter Lima Jr. e Nelson Pereira dos Santos (diretor de Rio 40 graus no início do movimento), que propunham uma estética da fome e filmar apenas com “uma câmera na mão e uma idéia na cabeça”, frase célebre do principal deles, Glauber Rocha, realizador de Deus e o Diabo na terra do sol (1964) e Terra em transe (1967) entre outros. Revolucionário e utópico, o movimento, mesmo combatido pelo poder militar e econômico, pode não ter conseguido atingir o público que pretendia, mas entrou para a história do cinema, brasileiro e mundial, sendo até hoje referência.}, dos elencos, dos atores ligados ao Cinema Novo e ao teatro brasileiro. Então, há uma mudança muito grande. Anos 70 foi o ano da invenção da televisão."
28/05/2007,Paulo José,20,Cunha Jr.,E por que essa invenção não se reinventa periodicamente? Por que caiu na mesmice?
28/05/2007,Paulo José,21,Paulo José,"Porque são crises periódicas. Em 70, a televisão saiu para a rua, saiu do estúdio e foi para a rua. Embora as câmeras ainda fossem as TK60, câmeras pesadíssimas, você botava aquelas câmeras na rua e fazia como se fossem câmeras de mão até. Eu fiz um programa chamado Pérola, de Dias Gomes, em que eu fiz umas padiolas com dois padioleiros, um chapéu alto, com a câmera e o câmera ali do lado [levanta-se e imita o movimento andando em círculos e filmando]. Então, às vezes, andavam com aquelas padiolas e o câmera. Aquilo era com a câmera na mão, o programa todo feito em externa e câmera na mão. Era uma linguagem diferente que aparecia. O Daniel Filho [diretor e ator], na novela Irmãos Coragem [1970], que o Cláudio Marzo [ator] fazia... Estou com boa memória, está vendo? O Cláudio Marzo fazia, o Duda [Carlos Eduardo Dolabella, (1937-2003)], aquele jogador do Flamengo. Estavam no Maracanã, as câmeras TK60, e nós começamos a botar tudo na rua. Lembro-me do Jardel [Jardel Filho, ator, (1927-1983)] numa novela que ele fazia. Tinha uma oficina de automóveis no subúrbio e, ao invés de ser no estúdio, era em Cascadura [bairro de subúrbio carioca], um subúrbio mesmo, numa oficina de verdade, sem nenhuma maquiagem. E ele pediu para trocar as roupas com o mecânico: “Me dá seu macacão, que eu te dou o meu. Me dá seu chapéu que eu te dou o meu.” “Seu Jardel, o do senhor está novo e o meu está velho”, “mas é isso que eu quero”. Então, trocou de roupa, botou o macacão do mecânico. Nesse momento apareceu um personagem novo. Quer dizer, quando a gente começava a trocar roupas nossas por roupas verdadeiras, algo que vinha dos anos 60, o cinema dos anos 60 era o cinema feito em casa. Todas as mulheres do mundo [filme de Domingos de Oliveira, de 1966] foi o filme que eu fiz, eu arrumei as roupas dele, ele usava as roupas dela, a casa era a casa de Domingos de Oliveira, era tudo nessas casas, era feito em casa."
28/05/2007,Paulo José,22,Beth Néspoli,"Até hoje Domingos faz cinema assim. Quer dizer, você pode continuar fazendo a mesma coisa mesmo passando o tempo, ou não?"
28/05/2007,Paulo José,23,Paulo José,"Sim. Pode, claro, não tenho dúvida nenhuma. Mas logo depois apareceu a idéia de um melhoramento do cinema. Apareceram produtores que diziam que: “Vocês de cinema não sabem fazer cinema, não sabem vender filme, é tudo meio pobre e quem gosta de pobre é intelectual.” Os executivos diziam isso. Então, nós tivemos que melhorar o nível dos personagens. O personagem do filme Eu te amo [1981], por exemplo, o filme era do Arnaldo Jabor [jornalista e comentarista que atuou como diretor de filmes nos anos 80], mas Walter Clark [1936-1997] que era o produtor. Ele entrou como produtor para alterar o processo de produção, personalizar o processo de produção. O personagem do Pereio [Paulo Cesar Pereio, ator que interpretou o personagem principal do filme, contracenando com Sônia Braga, que foi filmado no apartamento de Walter Clark, baseado no romance real vivido por Clark e Sônia Braga] era um engenheiro falido, mas ao invés de ter um carro Corcel II, meio furreco, meio velho, tinha um Mercedes vermelho conversível. Então, começava a subir o nível dos personagens. Antes, os personagens iam se esvaziando em seus conteúdos, viravam singularidades. O apartamento do Pereio era o apartamento do Walter Clark. Naquela época ninguém ganhava mais de 1 milhão por mês. Naquela época não eram milhões de dólares. Então, era aquele engenheiro falido com a Soninha Braga. O papel da Soninha era exatamente o de uma putinha. Então, essa mudança muito grande começa na televisão. O cinema realista vai para a televisão e o cinema reage à televisão fazendo o cinema não realista. Teve um filme pornográfico de Neville de Almeida que ganhou dinheiro, A dama do lotação [filme de 1978, baseado em um romance de Nelson Rodrigues]. Ganharam muito dinheiro. Nelson Rodrigues, feito de uma forma mais obscena, porque Nelson Rodrigues é curioso. Ele é moralista, extremamente moralista, e o universo da cena é o universo real. O lado de fora é mítico. Quando a irmã diz para o irmão: “Você pensa que eu não sei que quando eu ficava tomando banho você ficava espiando pelo buraco da fechadura? Então, você se masturbava.” [citando frase da personagem principal, também representada por Sônia Braga]. Você não sabe se ela está dizendo a verdade. Se ele se masturbava observando pelo buraco da fechadura ou se era uma fantasia dela que ele estaria fazendo isso. Você não sabe, isso é uma coisa ambígua. Nelson Rodrigues é sempre ambíguo. Agora, o cinema representava o mítico. Então, botava o filho olhando o buraco da fechadura, olhando pelo buraco da fechadura a mulher pelada lá dentro."
28/05/2007,Paulo José,24,Rubens Ewald Filho,"Paulo, deixa eu lhe perguntar uma coisa. Eu já declarei publicamente que você era meu ator de cinema favorito e também vou declarar publicamente que esse é meu livro favorito, toda Coleção Aplauso [série de 20 livros sobre a história do cinema brasileiro, citando a biografia de vários autores e dramaturgos, entre eles Paulo José]. Acho que você é a pessoa com mais sensibilidade. Mas para mim, acho que ainda falta colocar você como um ator que trouxe uma revolução na arte de interpretar do cinema brasileiro. Para mim, você veio com espontaneidade, com uma verdade, como uma humanidade, que não se tinha, que o rádio-teatro não tinha e que, para mim, é uma coisa a estudar. Mas, uma coisa que eu acho muito interessante que falam de você, é que você é um perfeccionista. O nosso amigo Ney Latorraca [ator] sempre diz que perto de você as pessoas ficam mais inteligentes. Porque você, como quem não quer nada, chega assim e fala: “Oi guri, você vai ler 400 livros para fazer bem o personagem.” Você concorda, você é um perfeccionista?"
28/05/2007,Paulo José,25,Paulo José,"Sou muito exigente. Em relação à interpretação, eu acho que é muito simples: ou é muito fácil de se fazer ou é impossível de você fazer bem. Não tem meio termo. Poesia não se aprende na escola, samba não se aprende no colégio. O cara sem ouvido musicado pode fazer 50 anos de escola de música que não vai ser o maior músico. O ator é aquele que tem uma enorme facilidade para ser outra pessoa. O ator não tem caráter “...é um fingidor, que finge tão completamente que chega a sentir que é dor, a dor que deveras sente.” [citando o poeta Fernando Pessoa] Por isso é muito mais fácil para o ator viver no mundo da fantasia do que no mundo real. A dificuldade do ator é com a realidade, essa que é incômoda. Você não sabe quem você é diante do real. Agora, na fantasia, você é o que você quiser naquele mesmo momento em que você diz: se eu fosse... Você passa a ser. Então é muito fácil. Eu acho que cinema é diferente de teatro. No cinema eu considero o trabalho do ator mais a vivência e não uma representação. Então, eu costumo dizer que no cinema eu não faço nada, não represento nada, não faço absolutamente nada, porque faço só uma interiorização e nenhuma exteriorização. É porque eu vejo o personagem quando acorda, sou capaz de acabar o dia de filmagem, tirar a barba, descolar a barba e ir para casa fazer outra coisa. A barba está colada, eu não deixei crescer a barba para fazer aquele filme. E não pode ser diferente. Eu viro o personagem e eu tenho um prazer enorme em fazer isso, fugindo, talvez, da minha realidade física e pessoal, que é mais desinteressante do que qualquer personagem. É mais interessante do que uma pessoa. Nisso, há uma discussão com o diretor de teatro, em que os personagens querem ser representados, querem ganhar vida no palco. Então, invadem um ensaio e são apenas personagens, ganham vida através dos atores e começa uma discussão entre diretor e ator sobre verdade e realidade. O diretor começa a perder terreno nessa discussão e chega uma hora que ele tem tem gosto por transparência, tem outros que não têm. Tem uns que você olha e diz: ”Mora alguém aí dentro?” Olha no olho. Outros falam: “Não tem ninguém aí, não tem ninguém aí dentro, gente. É só uma casca.” Então, eles têm que trabalhar por dentro, você tem que ter interiorização. É uma coisa engraçada como o olho brilha de maneira diferente, solta luz dentro do olho. Mas isso é uma transparência. Exemplos de transparência, diz assim: “Paulo, você nem real é.” Menos real talvez, porém, mais verdadeiro. Porque qualquer personagem tem muito mais verdade do que uma pessoa. Uma pobre persona que assumiu uma persona atribuída por outros. O ator é fraco enquanto persona é rico enquanto personagem, pois tem muitas vivências, vive muitas vidas em uma vida só. Então, isso é uma coisa muito saborosa, muito especial, essa atitude assim de vivência. E tem outra coisa no cinema que tem a característica que eu também gosto muito de usar: é a transparência. Eu fazia o filme Faca de dois gumes [filme de Murilo Salles, de 1989] e tem uma cena em que o filho é seqüestrado, o pai recebe num estojo de jóias um dedo do filho e o seqüestrador diz que não está de brincadeira. “Hoje vai o dedo e amanhã pode ser a cabeça, se não nos der o que nos deve, o dinheiro que estamos pedindo...” [relembrando o diálogo do filme]. Como que o ator vai representar isso? Recebe o estojo, abre o estojo: “Ah, meu filho.” Ou: “Ai, meu filho”. Abre o estojo e faz aquele estouro: “Meu filho!” [diz com diferentes expressões]. Não tem jeito, qualquer coisa que você fizer vai ser chamada de ridícula e redutora. Então, não faça nada [risos]."
28/05/2007,Paulo José,26,Nelson de Sá,"Isso no cinema e no teatro o que diferencia? Você já declarou até que tem uma paixão intermitente pelo teatro. Você sai e vai para o cinema, vai para a televisão, mas você está sempre presente."
28/05/2007,Paulo José,27,Paulo José,"O teatro que é minha linha de ação. Você constrói o personagem com uma absoluta linha interna de ação. Mesmo quando você está fora de cena, ele continua existindo, é diferente. No cinema você trabalha com fragmentos. Você pode, inclusive, no cinema, trabalhar por substituição. Eu me lembro desse negócio do dedo, porque o que você tem que fazer? Nada. Você abre e fica sem ação nenhuma diante daquilo. É um tempo de inação."
28/05/2007,Paulo José,28,Rubens Ewald Filho,"Você transfere a emoção para você, não é?"
