DATA,ENTREVISTA,ORDEM,LOCUTOR,FALA
15/01/1996,Carlos Heitor Cony,1,Matinas Suzuki,"Boa noite! Há 20 anos, ele jurou nunca mais escrever um romance. Agora, volta às livrarias com um quase romance. No palco do Roda Viva, que começa agora, está o escritor, cronista e jornalista Carlos Heitor Cony. Aos quase 70 anos, Cony publica o romance Quase memória, três anos depois de se reconciliar também com o jornalismo diário, quando reestreou como colunista do jornal Folha de S. Paulo. Quase memória traz Cony de volta ao romance em grande estilo. Aclamado pela crítica, o novo livro foi chamado de antológico e de obra-prima. Para entrevistar o Carlos Heitor Cony, esta noite, aqui no Roda Viva, nós convidamos o escritor e jornalista Ruy Castro. Aliás, Ruy, você receba aqui a solidariedade do Roda Viva, pois você está recebendo um processo injusto e está com um livro que não pode ser vendido nas livrarias e a gente acha que isso é uma forma de censura; o jornalista Marcelo Coelho, articulista da Folha de S. Paulo; a diretora editorial da editora Record, Luciana Villas Boas; o jornalista José Trajano, diretor de esportes da TVA e comentarista do programa Cartão Verde, aqui da Rede Cultura; o escritor e jornalista Humberto Werneck, redator chefe da revista Playboy e o escritor e jornalista Ivan Ângelo, editor executivo do Jornal da Tarde. O Roda Viva é transmitido em rede nacional por 43 outras emissoras de 17 estados brasileiros. Boa noite, Cony."
15/01/1996,Carlos Heitor Cony,2,Carlos Heitor Cony,Boa noite.
15/01/1996,Carlos Heitor Cony,3,Matinas Suzuki,Estou muito honrado em recebê-lo aqui hoje neste programa.
15/01/1996,Carlos Heitor Cony,4,Carlos Heitor Cony,Eu também estou muito honrado de ver você e todos esses entrevistadores.
15/01/1996,Carlos Heitor Cony,5,Matinas Suzuki,"Cony, explica para a gente o que é essa Quase memória, esse quase romance, essa quase ficção que você, depois de 23 anos, praticamente, voltou a fazer."
15/01/1996,Carlos Heitor Cony,6,Carlos Heitor Cony,"Bom, é quase uma sinceridade. Antes de mais nada, é quase um livro e quase uma sinceridade. Eu não pensava em fazer mais um livro, sinceramente E se eu soubesse que eu ia terminar fazendo mais um livro, eu talvez tivesse parado. Ele foi nascendo aos poucos motivado por um motivo pessoal, minha cachorrinha estava morrendo e ela não me deixava dormir à noite. Eu levei o laptop para perto dela e ia escrevendo. Se perceber bem o início, percebe-se que o livro não tinha uma definição, eu não sabia bem o que exatamente eu ia fazer. Estou dando aqui uma... entregando o ouro ao bandido. O livro começa meio sem definição. Minha primeira preocupação era dar assistência à minha cachorra que estava morrendo. Durou 21 dias e foi justamente o tempo em que eu escrevi o livro, em 21 dias. Evidentemente, depois de um certo tempo, quando esquentou as turbinas, eu percebi que meu pai era um grande personagem e fui em frente, colando nele uma porção de outras vivências, outras experiências e, sobretudo, expectativas que eu tive quando criança e ele não me realizou, mas que não era motivo de cobrá-las. Em geral, se cobra muito o pai e não se cobra tanto a mãe. Te dou um exemplo, Matinas: Se você xingar a minha mãe, eu tenho o direito de te matar e posso, num juiz, num júri popular, ser absolvido por legítima defesa da honra. Se você xingar meu pai, não. Eu não posso fazer nada. Eu pergunto a você: Por que essa discriminação? Por que a mãe pode e o pai não pode? Há, então, um ressentimento, não no mundo oriental, mas no Ocidente há um ressentimento em relação ao pai. Os filhos cobram do pai o sucesso que os filhos não têm muitas vezes, que é o caso do Kafka. O Kafka achava, por exemplo... em Carta ao pai, ele reclamava do pai porque era judeu, porque era da língua alemã. Ele não queria escrever em alemão, queria escrever em francês. Não sabia francês, nem para falar. O culpado disso? O pai. Judeu? O pai era culpado. Morava em Praga? Culpado é o pai. Tuberculoso? Culpado é o pai. Então, ele jogou no pai toda o carma dele. Evidentemente, é um escritor primoroso, é uma obra-prima, mas tem um ressentimento patente. Eu não tive, também, essa intenção, mas acontece que, num determinado momento do livro, eu pensei: “Eu estou redimindo...”, não resgatando, que eu não gosto da palavra, “...mas eu estou redimindo a mim próprio. Estou perdoando a meu pai tudo o que ele me fez, toda a vergonha que me fez passar”. Outro dia, eu fui ao programa da Marília Gabriela e ela me contou o seguinte: que também ela, ela começou a ler o livro com uma certa má vontade, mas num dado momento, ela se lembrou que no primeiro dia de aula, ela foi para a aula e o pai dela resolveu esperá-la com medo que ela se perdesse, com medo que alguém fugisse com ela. Então, ela ficou envergonhada e chorou. Chorou de vergonha das colegas porque o pai a estava esperando. Ela, hoje, evidentemente, já passou dessa idade da infância, com a idade que ela está, ela olha esse passado e sente a ternura que o pai teve por ela. Quer dizer, esse truque é um truque meio sentimental, meio sentimentalóide. Eu, às vezes, desconfio muito desse livro, sinceramente."
15/01/1996,Carlos Heitor Cony,7,Ivan Ângelo,"Eu queria fazer duas perguntas, já duas: Primeiro, você parou de escrever quando fez o Pilatos. O que te aborreceu tanto: o livro, ou a crítica ou os leitores, que te fez prometer não escrever mais?"
15/01/1996,Carlos Heitor Cony,8,Carlos Heitor Cony,"Não, quem leu o Pilatos atentamente percebe que o livro já é uma despedida, quer dizer, eu não tenho obrigação de me despedir nem de chegar. Eu não tenho nem a obrigação de ir embora nem de chegar, eu sou um homem livre. Quando eu comecei a fazer o Pilatos, eu realmente senti que era o fim da minha literatura. Eu levei minhas experiências pessoais no Pilatos, que é um romance escatológico, é obsceno, é pornográfico, não tem nada de erótico. Precisa ver que o Pilatos é um livro radical. Envergonhou até pessoas... meu editor ficou envergonhado dele."
15/01/1996,Carlos Heitor Cony,9,Ivan Ângelo,Mas o seu primeiro livro era meio radical e você não ficou assim.
15/01/1996,Carlos Heitor Cony,10,Carlos Heitor Cony,"É diferente porque aí já tinha uma linha sartreana, era muito inspirado na literatura de Sartre, é muito liberté, é um livro muito literário. Pilatos não, é anti-literatura pura. E quando eu terminei o Pilatos, eu achei que tinha terminado toda uma experiência e parti para outra. E vivi muito bem nesse período."
15/01/1996,Carlos Heitor Cony,11,Ivan Ângelo,"A segunda pergunta é: Se você, depois do sucesso aqui do Quase memória, você vai persistir nessa sua birra com a literatura ou vai voltar a escrever?"
15/01/1996,Carlos Heitor Cony,12,Carlos Heitor Cony,"A gente começa a ser cobrado. Eu estou pensando em fazer um livro, mas estou em dúvida se eu devo fazer mais um livro. Eu acho que não tenho mais nada para dizer. Há muito tempo eu desconfio que eu não tenho nada a dizer."
15/01/1996,Carlos Heitor Cony,13,Ivan Ângelo,Mas está dizendo.
15/01/1996,Carlos Heitor Cony,14,Carlos Heitor Cony,"Vou dizendo. À medida que compram, não tenho nada contra. Mas eu penso que... Estão me cobrando, realmente, um livro e eu tenho uma história incubada dentro de mim há muito tempo, é um primo meu que recebia um demônio, foi fulminado por um raio, desapareceu, não deixou vestígio nenhum e depois apareceu num parque de diversão. Eu vi esse primo no parque de diversão depois de ter sido, oficialmente, dado como morto. Essa história é muito boa. Talvez possa. Mas aí eu vou entrar em realismo mágico, vão dizer que eu estou imitando o Garcia Márquez. Não sei, não, a literatura é muito chata neste ponto."
15/01/1996,Carlos Heitor Cony,15,Humberto Werneck,"Eu me lembro de ler você na minha adolescência, portanto já faz muito tempo isso, e de me impressionar muito com a sua contundência. Era uma coisa assim um pouco diferente da paisagem do romance brasileiro da época. Era O ventre, A verdade de cada dia, Matéria de memória. Eu passei um bom tempo sem ler você e te reencontro agora nesse livro, que é um livro muito doce. Eu te pergunto: “O que foi que te adoçou? Foi o tema, o personagem, foi a passagem do tempo?”"
15/01/1996,Carlos Heitor Cony,16,Carlos Heitor Cony,"Eu não chego a considerar um livro doce, neste sentido. Eu tenho um livro anterior, que você não citou, que é o Informação ao crucificado, que é, mais ou menos, um embrião desse livro que não tem, digamos assim, um pouco dessa contundência. A contundência é necessária na falta de firmeza. A pessoa é contundente quando não tem firmeza de nada. Então, todos os meus livros nasceram dessa falta de firmeza nas minhas próprias convicções. Então, a gente apela para as contundências. Em política... Eu nunca tive saco para acompanhar a vida política, mas quando eu entro na política, sou obrigado a entrar porque fui jornalista, militante há muito tempo, eu entro como um panfleto porque o panfleto é simplista, é esquemático e me permite ser contundente. Eu não sei fazer análise. É aquela história do personagem do: “Eu me distraio em silêncio e me aborreço em voz alta”. Então, quando eu escrevo, eu estou me aborrecendo em voz alta. Eu transmito meu aborrecimento para os outros, compra quem quer. Agora, quando eu estou me distraindo mesmo, aí eu fico em silêncio. Daí, talvez, eu não escreva mais."
15/01/1996,Carlos Heitor Cony,17,Ruy Castro,"Cony, será que essa doçura que o Werneck falou talvez se explique por que você teve a idéia do Quase memória num sonho?"
15/01/1996,Carlos Heitor Cony,18,Carlos Heitor Cony,"Bom, é possível."
15/01/1996,Carlos Heitor Cony,19,Ruy Castro,Você podia contar essa história do sonho?
15/01/1996,Carlos Heitor Cony,20,Carlos Heitor Cony,"Eu sonhei um dia, justamente nesse período em que a minha cachorra começou a ficar doente e a exigir que eu ficasse acordado de noite. Ela dormia durante o dia quando eu estava trabalhando, quando eu ia para casa ela, então, não me deixava dormir. E, num desses cochilos, eu sonhei, que é justamente esse o início do romance. Eu estava no hotel, estava almoçando, passei e o porteiro do hotel me deu um embrulho e eu vi a letra do meu pai. Apenas no sonho isso me deu um sentimento de pesadelo. E a impressão que eu tinha era que meu pai queria me dizer alguma coisa. Mas quando eu fui fazer o livro, eu ia fazer uma crônica para a Folha de S. Paulo. O primeiro esboço desse sonho foram 33 linhas exatas, que é o tamanho da crônica na Folha de S. Paulo. Depois, eu vi que tinha um pouquinho mais. Aí eu disse: “Bom, talvez”..."
15/01/1996,Carlos Heitor Cony,21,Matinas Suzuki,"Até seu sonho já tem 33 linhas, Cony?"
15/01/1996,Carlos Heitor Cony,22,Carlos Heitor Cony,"Encompridou mais, aí virou livro, mas foi realmente um sonho. Eu não considero o livro, exatamente, um livro doce. Eu considero um ponto de... é uma tristeza, uma certa amargura muito grande."
15/01/1996,Carlos Heitor Cony,23,Marcelo Coelho,Eu queria saber quais são as vergonhas que o seu pai te fez passar e do que você está se desculpando?
15/01/1996,Carlos Heitor Cony,24,Carlos Heitor Cony,"Várias, várias. Essa que eu conto no livro, da morte do cardeal... A capela do Palácio São Joaquim não era grande, era pequena, menor que esse estúdio. Então, estava o Getúlio Vargas ali, presidente da República, ditador, estavam os bispos todos do Brasil, Dom Bento Aloísio Masella, que depois veio a ser cardeal, e um cardeal morto, ali. Meu pai entrou, cismou que eu estava lá há muito tempo e devia estar com fome. Foi ao botequim e trouxe um prato de comida para mim. Quando ele entrou na capela com aquele prato, eu era seminarista na época, tinha 12 anos. Você imagine um pai penetrar com um prato embrulhado num guardanapo, aquele cheiro de comida de botequim, arroz de botequim, aqueles temperos suspeitos, pimentão, tomate, cebola, gostoso pra burro. Eu me lembro que o Getúlio, foi a única vez que eu vi o Getúlio na minha vida, eu me lembro que o Getúlio fez assim, assustado. Meu pai passou por cima das pernas do pessoal ajoelhado, me chamou e me levou para comer. Eu terminei gostando. Ele ficou me olhando, depois limpou me boca e disse: “Agora, volta”. Quer dizer, ele não podia fazer isso. Uma vergonha. Agora, ao mesmo tempo, se você olhar o outro lado, uma beleza isso. Se todo mundo tivesse um pai assim seria ótimo."
15/01/1996,Carlos Heitor Cony,25,José Trajano,"Cony, para usar um termo mais elegante, você tem pouca paciência com os políticos. Você falou, agora há pouco, que não tem paciência. Apesar de ser biógrafo do Juscelino..."
15/01/1996,Carlos Heitor Cony,26,Carlos Heitor Cony,"Não, peraí, não senhor. Pelo seguinte, ainda agora estou com esse problema. O João Pinheiro Neto está fazendo um livro e publica no prefácio uma carta minha que eu escrevi a ele sobre o livro anterior dele, sobre JK e a Lúcia Pedroso. Eu não sou biógrafo do Juscelino, se eu fosse biógrafo do Juscelino, eu teria que seguir uma linha de pesquisa e de orientação diferente."
15/01/1996,Carlos Heitor Cony,27,José Trajano,E você detesta pesquisa.
15/01/1996,Carlos Heitor Cony,28,Carlos Heitor Cony,"É uma coisa muito pior, eu complementei as memórias dele. Por uma questão editorial, ele deixou comigo milhares de pastas. Ele não queria escrever mais a vida dele, ele terminou as memórias dele, escritas na primeira pessoa, quando da posse do Jânio Quadros. Ele, então, tomou o avião, vai para Paris, e encerra as memórias dele. Viveu 16 anos depois disso. E ele aí foi cassado, foi expulso do banco que ele era presidente, pelo genro, perdeu a eleição para a Academia, perdeu a mãe, foi uma sucessão de perdas. No fim da vida, o Juscelino foi um estorvo ambulante. Muito bem. Ele não quis escrever sobre isso, mas queria que eu escrevesse. E eu dizia: “Não vou escrever porque não sou... Eu não vou poder adotar esse ponto”. “Então, faz as minhas memórias”. Então ficou mais ou menos esse ponto. Ele deixou comigo vários apontamentos e cheguei a fazer alguns capítulos com ele ainda vivo, mas eu tive que adotar os pontos de vista dele e não os meus. Então, eu não pude entrar em vários detalhes da vida dele. Se eu fosse o biógrafo..."
15/01/1996,Carlos Heitor Cony,29,José Trajano,"Mas, parece que o melhor livro dele não foi publicado. As melhores histórias sobre Juscelino parece que o Falcão..."
15/01/1996,Carlos Heitor Cony,30,Carlos Heitor Cony,"Não, o Falcão... Aí é diferente. Você aí está envolvendo o problema do diário de JK. O diário é o seguinte: o JK fazia a partir de 1972... ele morreu em 1976. Em 1972, ele começou a fazer um diário, mas era um diário muito esquemático, muito telegráfico: “Dia 16 de setembro, sexta-feira, comi e passei mal. Vi o fulano. Li o livro tal. O jornal tal me falou mal”. Era isso, registro taquigráfico. Posteriormente ele, de tempos em tempos, ditava para a Elisabete Ramos, secretária dele, na sala que hoje eu ocupo..."
15/01/1996,Carlos Heitor Cony,31,José Trajano,A “sala do embrulho”.
15/01/1996,Carlos Heitor Cony,32,Carlos Heitor Cony,"Exatamente, a “sala do embrulho”. Ele ditava e romanceava alguma coisa motivado por aquelas anotações taquigráficas. Ele saiu do Rio de Janeiro, ele morreu em agosto, 22 de agosto de 1976, ele saiu do Rio de Janeiro em junho, junho de 1976, foi para Luziânia e não voltou mais. Continuou fazendo esses registros telegráficos. Esses registros de junho de 1976 até agosto de 1976 é que estavam no carro com ele, quando houve o acidente na Rio-São Paulo. O Guilherme Romano, a pedido da família, foi a Rezende, arrecadou esse material todo e passou recibo na delegacia de Rezende. O Guilherme Romano, com a consciência que ele tinha, tirou um xerox para ele e deu para o Golbery a outra, quer dizer, num ato só fez duas..."
15/01/1996,Carlos Heitor Cony,33,José Trajano,Uma “lambança” só.
15/01/1996,Carlos Heitor Cony,34,Carlos Heitor Cony,"Duas “lambanças”. Deu para o Golbery o outro. O Golbery, por sua vez, fez a mesma coisa. Tirou um xerox para ele e mandou o outro para o Serviço Nacional de Informações. O SNI tirou “n” xerox e mandou para o Armando Falcão. Então, quando o Armando Falcão diz que tem o diário, não tem o diário. Ele tem as anotações de junho de 1976 até agosto de 1976. O diário completo, desde 1972, está em poder de dona Sara e foi entregue à ela, pessoalmente, por dona Elisabete Ramos, pelo Adolfo Bloch e por mim. O JK deixou na sala, na “sala do embrulho”, deixou um embrulho. Esse embrulho foi entregue à dona Sara."
15/01/1996,Carlos Heitor Cony,35,Matinas Suzuki,"Cony, qual a passagem mais marcante que você tem da convivência com o Juscelino? Antes de você responder, eu gostaria de dizer que está aqui conosco também o jornalista Bráulio Neto, que é repórter do “Caderno B”, do Jornal do Brasil. Bráulio, seja bem vindo."
15/01/1996,Carlos Heitor Cony,36,Carlos Heitor Cony,"Bom, o Juscelino, eu conheci o Juscelino nos escombros, quer dizer, era um homem derrotado. Era um homem que não tinha amargura, ele tinha certas tristezas. Ele tinha, no fim da vida dele... Eu convivi com ele nos sete últimos anos, ele chegou até a voltar a ter um apelo místico. Ele chegou a fazer um cursilho, era uma espécie de retiro espiritual. Ele fez um cursilho tentando buscar uma certa verdade. Ele estava muito descrente, muito amargurado. Além disso, ele tinha duas coisas. Uma profunda esperança de que ainda o iam chamá-lo. Ele esperava que, a qualquer momento, haveria uma convocação nacional para ele voltar. Daí, então, ele nunca comprou briga com o regime militar. Veja que ele se comportou placidamente com relação à cassação dele e a todas as humilhações que sofreu. Evidentemente, nada que ofendesse a dignidade dele. Depois, ele procurou compensações. Procurou compensações na vida social, quis entrar para a Academia e se envolveu emocionalmente com pessoas, entre as quais, uma namorada. Mas ele era uma pessoa doente. É preciso dizer que o JK não tinha mais o chamado... Não estava integralmente neste termo, não estava íntegro, nesse momento. O negócio era mais uma compensação afetiva. Ele esperou muito da Academia, esperou muito do amor, nesse sentido. Mas ele tinha uma noção também bastante aguda de que seria uma espécie de salvação. Tanto que ele aceitou a Frente Ampla, com o Lacerda, com o Jango. Ele aceitou.. Quando houve a crise de petróleo de 1973, ele se entusiasmou muito com o xisto betuminoso. Foi à Santa Catarina, queria fazer estudos, queria fazer um relatório para aproveitar a energia alternativa. Não seria mais a cana nem o petróleo, que estava difícil, ia ser o xisto betuminoso. Ele pensava ainda como estadista. O Juscelino não foi estadista, não foi nada disso. O Juscelino foi um grandíssimo prefeito nacional."
15/01/1996,Carlos Heitor Cony,37,Luciana Villas Boas,"Você fala de imprensa, do jornalismo, no seu livro. Eu queria saber como é que o senhor vê a evolução da imprensa, principalmente no período pós-abertura política, e queria saber se o senhor se diverte, mais ou menos, com o jornalismo hoje?"
15/01/1996,Carlos Heitor Cony,38,Carlos Heitor Cony,"Antes de mais nada, o Matinas me lembrou que quando eu voltei a trabalhar na Folha de S. Paulo, eu disse que assisti duas coisas importantes na minha vida: Uma foi a “inolução do vento encanado” e a outra foi a evolução da imprensa. A “inolução do vento encanado” é o seguinte: no meu tempo, o vento encanado era pior que aids, era pior que o câncer. O vento encanado era a coisa mais letal do mundo. Era um vento encanado. As pessoas temiam o vento encanado. As mães diziam isso."
15/01/1996,Carlos Heitor Cony,39,Ivan Ângelo,Tem até uma crônica saborosa do Rubem Braga sobre isso.
15/01/1996,Carlos Heitor Cony,40,Carlos Heitor Cony,"Muito bem. Então, o vento encanado era uma coisa mortal. Hoje ninguém mais tem medo de vento encanado, em compensação, assistiram a essa evolução da imprensa. Agora, essa evolução em termos. Eu, pelo menos acho que, às vezes, melhorar é piorar. A evolução deixou de ser aquela profissão romântica, boemia, que foi o tempo mais ou menos descrito em meu livro, em que os jornais não eram empresas. Os jornais eram, digamos assim, empreitadas para defender determinados pontos de vista, talvez até para defender pontos de vista pessoais. Fundavam-se jornais para defender ponto de vista de fulano ou atacar fulano. Basta dizer que os Diários Associados, na raiz, estava o quê? Estava o, que era o homem que, afinal de contas, brigou com o Artur Bernardes e foi daí que nasceu... Quer dizer, os jornais eram feitos não para informar, não pensando no público, mas pensando em interesses pessoais de grupos ou de pessoas. Muito bem. Hoje, evidentemente, não há... Porque a imprensa ficou muito cara, o papel é caro, a distribuição é cara, a publicidade é cara, por conseguinte. Então, envolve tantos riscos que não pode mais ter essa boemia, esse lado, digamos assim, leviano da imprensa. No meu tempo, ainda quando eu estreei, a imprensa era muito leviana. Eu me lembro, por exemplo, quando eu tinha l7, l9 anos, subia a escada da Gazeta de Notícias, meu pai cismava que eu devia ser jornalista, então, não podia me arranjar emprego no Jornal do Brasil, que era o sonho dele: “Então você vai trabalhar na Gazeta de Notícias”. A Gazeta de Notícias era um prédio velho, no centro da cidade, tinha tido as suas glórias. A Gazeta de Notícias foi onde José do Patrocínio fez a campanha da abolição. A Gazeta de Notícias teve como crítico literário Olavo Bilac, Emílio de Menezes. Era um jornal ali da rua do Ouvidor, antiga, do Rio de Janeiro. Foi de lá que nasceu o famoso slogan: “O Rio civiliza-se”, de Figueiredo Pimentel. Muito bem, quando eu subi aquelas escadas, sentei numa cadeira e aí o diretor, que era um senhor chamado Manso Teixeira, disse: “Não senta aí que esta cadeira é do Olavo Bilac”. Eu olhei, pensei que o Olavo Bilac ia aparecer de repente, mas, ele estava morto há 50 anos. Eu pensei que o Olavo Bilac ia chegar ali e ia reclamar. Eu levei um susto. A cadeira do Olavo Bilac estava reservada ainda, era o crítico literário do Diário de Notícias. Quer dizer, esse lado boêmio do jornal, acabou. Hoje em dia não se respeita nada. Respeita-se o quê? Respeita-se o lucro, a produção..."
15/01/1996,Carlos Heitor Cony,41,Luciana Villas Boas,"Com relação ao poder, você acha que está mais ou menos independente nos últimos 10 anos? Como você acha que está se encaminhando?"
15/01/1996,Carlos Heitor Cony,42,Carlos Heitor Cony,"Eu não acredito muito em independência. Fala-se muito na independência da imprensa. Hoje, por exemplo, a gente sente que as fontes... Hoje, o jornal se baseia em quê? Se baseia nas fontes. Evidentemente, os jornais têm grandes estruturas para arrecadar, para arrebanhar notícias, para capturar, aquela coisa. No fundo, o que permanece é, se o repórter chegar lá e disser: “Eu vi um disco voador”, alguém vai perguntar a sua fonte, seja o Golbery... Mas vai perguntar seja ao Fernando Henrique, ao Sergio Motta, ao Mario Henrique Simonsen mas vai perguntar a alguém se pode ter visto. Então, de acordo com a fonte, o jornal aceita a notícia, faz o editorial, abre o segundo caderno, faz edição especial, muito bem. A fonte é que manda. Quem são as fontes? Ninguém revela as fontes. A chamada independência do jornalista, hoje, repousa no mistério da fonte que não se pode revelar, é um direito nosso. Então, eu digo, por exemplo, que o Ruy foi na minha casa ontem e roubou. A fonte sou eu. Isso, me parece, está havendo um exagero nesse particular, está havendo uma maxivalorização do colunista, o que me parece, também, um pouco prejudicial. Porque o colunista, o que ele é? Ele é um... eu sou colunista, mas ele uma espécie de destaque. Então, um exemplo que eu dei um outro dia para uma moça que me telefonou da Vip Exame: “O jornal é mais ou menos como uma escola de samba, tem aquela multidão de três mil figurantes e tem os destaques, que vão naqueles carros alegóricos, distribuindo beijos para a multidão. Aí você bota... em cima dos carros, você bota quem? Liliam Ramos, Tony Ramos, dona Neuma. Agora, se não for aquela multidão, aquele arrastão, ninguém vai para a avenida receber beijos do Tom Jobim, do Garrincha ou de quem quer que seja, vai ver aquele espetáculo conjunto"". Então, o jornalismo valorizou demais a profissão do colunista em detrimento desses passistas, dessas alas que compõem a verdadeira imprensa."
15/01/1996,Carlos Heitor Cony,43,Ruy Castro,"Você foi o grande beneficiário desse destaque que se deu ao colunista, numa certa época da história do Brasil, e também da liberdade e da independência do colunismo, quando você, em 1964, no Correio da Manhã, contrariando até a linha editorial do Correio da Manhã, que tinha sido o principal motor, praticamente, da derrubada do João Goulart, você sustentou sozinho, durante algum tempo, a oposição ao regime militar, não foi?"
