DATA,ENTREVISTA,ORDEM,LOCUTOR,FALA
15/01/1996,Carlos Heitor Cony,44,Carlos Heitor Cony,"Sim, mas aí são circunstâncias. Hoje não se repetiria aquilo porque hoje, o domínio da empresa sobre a redação... o domínio, não no sentido de malefício, mas no sentido empresarial, hoje em dia, a empresa tem um controle tão grande sobre a redação que seria impossível, praticamente, isso. Naquele tempo ainda havia muita bagunça e o Correio da Manhã estava muito desarvorado, estava passando por crises. Pouco antes havia morrido o dono do jornal. Não havia, praticamente, um redator-chefe definitivo, havia vários substitutos. Era uma terra de ninguém. E no “abafa”, há um filme do Jerry Lewis que ele diz: “Na confusão, sempre alguém sai ganhando”. Naquela confusão, eu comecei a mandar umas crônicas e não reclamaram nada. Quando a empresa tomou conhecimento e quis me policiar, já era difícil. Ficava ruim voltar atrás."
15/01/1996,Carlos Heitor Cony,45,Matinas Suzuki,"Cony, uma parte interessante da sua biografia, e talvez as gerações mais novas que estejam nos assistindo não conheçam, foi a trajetória zigue-zague que você fez, ou seja, você não era um homem político, você virou uma espécie de personalidade intelectual mais importante, como Ruy se referia, talvez um baluarte da defesa da intelectualidade. A esquerda toda passou a contar com a sua defesa, da sua pena etc e tal, depois segue-se um período, você volta e essa própria esquerda passou a fazer de você um inimigo público. Como é que foi essa trajetória e como é que você revê essa trajetória, hoje em dia?"
15/01/1996,Carlos Heitor Cony,46,Carlos Heitor Cony,"Bom, antes de mais nada, a minha reação em 1964 não teve nada... eu era uma pessoa alienada, como sou hoje, como fui sempre. Eu sempre desprezei o fato político. Sempre. Em 1964 não houve fato político, no meu entender. Houve o seguinte: Eu liguei para o meu amigo Ênio Silveira, estava preso, liguei para o Thiago de Mello, estava foragido, liguei para o Callado, estava se foragindo. Outro estava indo para a Bolívia. Outro estava sendo espancado. Drummond de Andrade foi comigo à rua naquele dia e nós vimos um camarada ser torturado na rua, espancado. Um coronel espancando um operário que tinha dito: “Viva João Goulart”. Eu não estava me importando com o viva João Goulart, eu não queria saber de João Goulart, mas não conseguiu entrar pelas minhas retinas a idéia de um homem, um coronel, classe média, um homem dos seus 55 anos, por aí, cabelos brancos, com um revólver, dando pontapé num operário porque tinha dito: “Viva o João Goulart”. Não sei quem era operário, era um “paraíba” qualquer daqueles da rua Joaquim Nabuco. Foi isso. Então, foi uma reação tipicamente humanística, não tem... Se você ler com atenção O ato e o fato, vai ver que não tem nenhum lado político, é uma relação humanística que eu teria se fosse... Se houvesse uma revolta comunista naquela época e tivesse tomado o poder e tivessem feito os mesmos métodos, tivessem usado a tortura, enfim, a repressão, eu teria tido a mesma atitude que tive contra a direita. Então, esse negócio de esquerda, de direita, para mim, é tão imbecil quanto você discutir marcas de automóvel. Não tem, em nenhum momento nas minhas crônicas é dito: Eu faço uma opção por um lado. Evidentemente, eu tenho um pensamento socialista, pré-comunista. Porque comunismo é uma opção, inclusive, mas o socialismo vem de... Antes do socialismo já havia tentativas socialistas. Então, esse lado humanístico me interessa muito. A esquerda queria o quê? Queria que eu fosse o masturbador geral da nação. Queriam gozar com o pênis alheio, com o meu pênis. Eu quero gozar com o meu pênis, cada um goze com o seu. Então, em determinados momentos, a esquerda começou a fazer umas cobranças e eu não tinha nem saco nem paciência nem vontade para atender. A esquerda, então, achou... Há um fato, também, eu escrevi um romance chamado Travessia, em 1967. Foi interessante. Em 1967, saíram três obras de três presos na mesma prisão. Nós tínhamos sido presos em 1965: Gláuber Rocha, o Callado e eu. Junto com outros: o Flávio Rangel, Thiago de Mello, Marcílio Moreira Alves, Joaquim Pedro, nós estivemos na prisão. Saímos da prisão, o Gláuber fez Terra em transe, o Callado fez Quarup, eu fiz A travessia. Todos as três obras abordam a luta armada, o problema da luta armada, que era uma das questões que estava no ar naquele tempo. Gláuber criou um poeta feito pelo Jardel Filho que morre numa escadaria do municipal com uma metralhadora. O Callado foi o mais esquemático, é um padre que abandona tudo, bota um gibão e vai para a guerrilha. E, no meu caso, é um intelectual frustrado e que não aceita nada, mas que termina, enfim, entrando na confusão e, na base da confusão, ele se compromete e, quando ele quer sair, já não consegue sair mais. Mas não tem nenhuma vocação de guerrilheiro, não acredita na luta armada, nem acredita na luta da esquerda. Nesse meu romance há uma traição. Há um grupo de guerrilheiros que faz uma tentativa de tomar o poder, pelo menos tentativa de rebelião, está tudo pronto, tem apoio externo, tem dinheiro, as famosas “condições objetivas”, que o Partido Comunista sempre dizia que não havia. Muito bem, um grupo conseguiu essas “condições objetivas”, somente na ficção poderia ter sido, mas conseguiu e, de repente, o exército dá em cima e dizima tudo. Há um traidor. Pesquisa-se o traidor: o Partido Comunista. Por que traiu? Porque o Partido Comunista recebeu ordem de que era mais importante fazer uma revista de assuntos gerais do que aceitar mexer na estrutura do governo. Isso pelo seguinte: quando nós estávamos presos, Matinas, em 1965, nenhum de nós era comunista. O único que tinha sido comunista, e não era mais, era o Flávio Rangel que já tinha deixado o Partido Comunista há muito tempo, mais nenhum de nós, éramos nove, nenhum de nós era comunista. A União Soviética emprestou ao governo Castelo Branco 100 milhões de dólares. Estávamos presos. Então, não havia, realmente, por onde o Partido Comunista... E outra coisa, quando nós planejamos aquele protesto contra o Castelo Branco, na porta do Glória, o Partido Comunista, através de três de seus membros da comissão do comitê cultural, prometeu apoio. Prometeu cinco mil operários e 5 mil estudantes, só apareceram nove gatos pingados. O Partido Comunista era “useiro e vezeiro” em trair, é a história dele trair. Não é à toa que o Partido Comunista faliu a Rússia. Agora, isso não tem nada a ver com socialismo. O Partido Comunista não é socialista."
15/01/1996,Carlos Heitor Cony,47,Bráulio Neto,"Você enxerga a esquerda hoje no Brasil? Quem é a esquerda, para você? Já que você falou essa questão de direita, esquerda... É possível haver um sentido progressista neste país partindo da direita ou partindo da esquerda?"
15/01/1996,Carlos Heitor Cony,48,Carlos Heitor Cony,"Não, progressista não. O progresso é feito pelo meio. O progresso será sempre feito pelo meio. A direita jamais fará progresso. Se fosse pela direita, nós estaríamos vivendo na época das cavernas. Eu incluo na direita, o neoliberalismo.... Neoliberalismo botaria o homem mais apto, que seria o homem mais forte da caverna, dominando os mais fracos, tranqüilamente através da meritocracia. Agora tem uma coisa, a esquerda, por negar em conjunto, por negar em bloco a direita, ela comete também exageros opostos. Ela, muitas vezes, luta pela luta, não tem, realmente, uma determinação, um meio, uma finalidade precisa. Tanto isso é verdade que os partidos comunistas, quando tomaram o poder, se transformaram em quê? Se transformaram em conservadores. Tem coisa mais conservadora que o Breshnev? A gravata? Vocês já olharam a gravata do Breshnev? Ele tinha 200 gravatas, todas elas eram altamente conservadoras. O figurino, o visual do comunista, não o comunista latino-americano, que é meio avacalhado, mas o verdadeiro comunista, o ortodoxo, é um conservador que nenhum conservador da direita é assim. O Armando Falcão é mais revolucionário que o Breshnev. As gravatas do Armando Falcão são muito boas, são de boa qualidade. Italianas. Não é pelos opostos. A humanidade sempre vai caminhar pelo meio, ou seja, pela mediocridade. A humanidade é medíocre."
15/01/1996,Carlos Heitor Cony,49,Marcelo Coelho,"A impressão que dá é que você, justamente, está mostrando que não são opostos, ou seja, se o Breshnev estava com essas gravatas, ele era tão de direita quanto um sujeito de direita."
15/01/1996,Carlos Heitor Cony,50,Carlos Heitor Cony,"Um espírito conservador. Espírito conservador. Tanto que eles fizeram uma revolução socialista com o apoio, afinal de contas, apoio alemão. Se a gente for estudar bem a revolução socialista, a gente vê que houve elementos telúricos da própria realidade russa, soviética, daquele tempo, a exploração do campesinato, o domínio do czarismo, mas quem botou o Lenin na União Soviética foram os alemães. Então, já foi uma jogada do capitalismo internacional. Até certo ponto, a revolução socialista de 1917 foi uma jogada do capitalismo internacional. Foi uma espécie... A maior revolução socialista do século, da história talvez, foi já uma caudatária do capitalismo, ou seja, de uma meritocracia qualquer. Uma vez tomado o poder através do Lenine, posteriormente do Stalin, eles viraram conservadores. Conservadores dos mais atrozes, capazes de torturar. Hoje, se sabe, está mais do que... Já no congresso de 1956, no 20º Congresso do Partido Comunista, o relatório do Krushov, já colocou o Stalin como um verdugo. Então, um Gandhi é pior do que Hitler. E o que era isso se não sufocar as liberdades do povo? Em nome de quê?"
15/01/1996,Carlos Heitor Cony,51,Marcelo Coelho,"E quem, no Brasil, estaria no meio, então, dentro dessa perspectiva de um progresso que vá pelo meio?"
15/01/1996,Carlos Heitor Cony,52,Carlos Heitor Cony,"Olha, pessoalmente, eu acho que ninguém. O meio é aquele troço, a escola de samba que anda. É o povo, a gente vai andando, sou eu, você. É o Fernando Henrique."
15/01/1996,Carlos Heitor Cony,53,Luciana Villas Boas,"Mas, Cony, você hoje é uma das grandes vozes dissonantes na imprensa. Você e Veríssimo são, talvez, os principais críticos ao modelo econômico e à classe dirigente. Esse seu trabalho na Folha não é um trabalho pela esquerda? Por que só identificar a esquerda com a extinta, a falida União Soviética? E por que essa, quer dizer, você não reconhece que tem um papel de resistente ao fazer essa crítica ao neoliberalismo?"
15/01/1996,Carlos Heitor Cony,54,Carlos Heitor Cony,"A minha posição continua sendo sempre a de humanista. Eu analiso o neoliberalismo da seguinte maneira, em termos bem diretos: o homem da caverna. O homem da caverna é o quê? Por que o homem criou o Estado? O homem da caverna criou o Estado porque era necessário que os mais fortes pudessem distribuir os seus bens para os mais fracos. Outro dia, eu li uma frase muito boa de um professor da Columbia, me esqueci o nome dele agora. Ele diz que se o pobre se levantar, não só o indivíduo pobre, mas a nação pobre se levantar, é o mesmo que querer levantar alguém do chão puxando pelo próprio cadarço. Tem que haver, então, a ajuda do Estado. O Estado foi criado para isso, para equilibrar as potencialidades dos indivíduos. Muito bem, na medida em que o Estado se baseia na excelência do indivíduo que sendo melhor tem mais direitos, ele evidentemente já nega a criação do Estado. Então, para que o Estado? O Estado será, então, neutro. O Estado será, então, apenas um regulador, um garantidor do mérito dos capazes. Isso gera o quê? Gera uma profunda injustiça social e não é por aí que a humanidade vai caminhar. Eu dou o exemplo, também, da balsa: “Você está num navio, o navio afunda e você está na balsa, nessa balsa tem 17 pessoas. Haverá um que é forte, que saberá alguma coisa de navegação, haverá um doente, uma velha que está batendo pilha, haverá um louco, haverá crianças, haverá... enfim, a humanidade toda estará representada, de uma forma ou de outra, nessa balsa”. Então, se os mais capazes se juntarem e disserem: “Bom, vamos jogar no mar os velhos, os imprestáveis, as crianças e os chatos”. Bom, está tudo bem. Eu sou a favor de jogar os chatos, mas num certo ponto todo mundo é chato. Nessa altura, todo mundo é chato. Então, do que é feito o Estado? O Estado é, justamente, dentro dessa balsa, com os chatos, os lesos, os doentes e os bons, os que sabem navegação, os que têm condições de gerirem alguma coisa, eles se reunirem e fazerem alguma coisa para a balsa chegar a algum porto. No caso da humanidade, eu discordo porque eu acho que a humanidade jamais vai chegar a um porto. Essa balsa, bem administrada ou mal administrada, sempre vai dar com os burros na água. Não vai terminar em porto nenhum, mas de qualquer maneira, para a sobrevivência da balsa... É um bom título, “sobrevivência da balsa”, para a sobrevivência da balsa, nada melhor do que haver um Estado. Estado esse que vai tentar equalizar as potencialidades de cada um e não sair, como diz o neoliberalismo: “Quem é bom se compromete”. Eu me lembro de um empresário que foi ao Collor, isso antes de haver a onda neoliberal do Fernando Henrique, foi ao Collor pedir um financiamento e o Collor disse assim: “ Se o senhor não tem competência para ser empresário, vá abrir um botequim”. Na cabeça do Collor. Quer dizer, não é bem isso. A obrigação do feitor de um Estado seria ver até que ponto esse empresário tinha ou não tinha condições de sair da crise dele, crise provocada pelo próprio Estado, por sinal. Em geral, é preciso que se diga: 90% da crise bancária, da crise das empreiteiras, de todo mundo por aí, é fruto do Estado porque o Estado é o grande devedor. O pessoal fala muito de inadimplência. O Estado brasileiro é inadimplente para com ele mesmo."
15/01/1996,Carlos Heitor Cony,55,Matinas Suzuki,"Cony, nós estamos chegando ao final do primeiro bloco, mas eu gostaria aqui de fazer perguntas dos nossos telespectadores. Estão chegando muitas perguntas, das mais variadas, mas chegaram bastante sobre, como você tocou no tema, da sua cachorra Mila. A Mariane, de Ribeirão Preto, a Marina Ribeiro, de Paraíso, a Miriam Vaio, São José dos Campos e o Hilton Taboada, de Niterói. O Hilton pergunta o seguinte, todos perguntam sobre a Mila e o Hilton pergunta o seguinte: Se você poderia comentar a sua afirmação do Sartre: “Quem ama muito animais e crianças, ama contra os homens”."
15/01/1996,Carlos Heitor Cony,56,Carlos Heitor Cony,"Eu acho que não há dúvida nenhuma. Primeiro, não considero a Mila um animal. Ela é um animal no sentido que eu sou um animal também. Esse negócio de dizer que o homem é um animal racional... os animais raciocinam. A única coisa que o animal homem faz que o animal não faz, e a razão é do animal, é rir. O homem é um animal que ri, coisa que o animal não faz e eu acho que o animal está certo. Não vejo muitos motivos para o homem estar rindo, não. Acho que, mais uma vez, o animal prova que está certo, ele não ri. Agora, que ele tem um raciocínio, tem. Ele tem afeto, tem lembrança, memória. Ele abdicou, eu acredito muito nesse tempo, porque todas as civilizações, de todos os povos, sempre falam de uma época em que os bichos falavam. E os bichos, provavelmente, já foram articulados. Não exatamente como nós somos hoje articulados, mas alguma forma de articulação. Apenas eles abdicaram dessa articulação, porque confundiu-se de tal maneira as palavras, os articulados de tal maneira complicam a história, complicam a vida, que os animais mais sábios, formigas, abelhas, os cães, resolveram abdicar por uma questão de sobrevivência, de viver melhor, qualidade de vida. Eles têm uma qualidade de vida melhor do que a nossa. Então, agora, respondendo a pergunta do rapaz de Niterói, tinha que ser de Niterói, não há dúvida nenhuma que, na experiência pessoal de cada um, a gente ama os animais na medida em que soma determinadas, não vou dizer ressentimentos, mas determinadas carências. É uma carência, não há dúvida nenhuma. A gente busca nos animais aquilo que a gente sabe que os homens não podem dar. Isso eu assumo e daí? É isso mesmo. A Mila me deu o que nenhum ser humano me deu."
15/01/1996,Carlos Heitor Cony,57,Marcelo Coelho,"Sabe, Cony, dá a impressão, às vezes lendo as crônicas e da própria história toda da Mila, de você ser uma pessoa muito solitária. E, nas crônicas, uma pessoa além de solitária rabugenta. E nada indica, a gente vê que nada disso é verdade. Eu queria saber um pouco da sua vida pessoal. Por que essa imagem de cronista..."
15/01/1996,Carlos Heitor Cony,58,Carlos Heitor Cony,"Rabugento. Você já me chamou disso uma vez. É a segunda vez que você diz isso. Não, mas Marcelo, é o seguinte, solitário eu sou, mas solitário cercado de muita gente. Eu gosto muito da solidão. Agora mesmo muita gente admira que eu fui passar uns dias num navio, num cruzeiro, e consegui escrever. Escrevi 2800 caracteres do novo livro, no meio de todo mundo. No meio da piscina, aquelas pessoas, e eu consigo. Sou solitário, realmente, porque eu não me confraternizo muito. O rabugento é um pouco de Machado de Assis. Eu acho que o Machado de Assis me influenciou muito. Eu já nasci rabugento e acho que gosto de ser rabugento. Eu não gosto muito de pessoas, na verdade não é não gostar, eu admiro as pessoas, mas eu acho que o rabugento tem um fundo de verdade. É o caso do Machado de Assis. Todos os personagens do Machado de Assis são altamente rabugentos. Talvez seja um cacoete machadiano esse."
15/01/1996,Carlos Heitor Cony,59,Marcelo Coelho,"Eu estava pensando na pergunta que a Luciana fez sobre a evolução do jornalismo nos últimos tempos e você tendo escrito no seu livro que, tendo tido o pai jornalista, que o seu pai é um jornalista de uma geração muito marcada pela idéia de fim de século, muito ligada a Machado de Assis e a Euclides da Cunha, Anatole France, e há uma espécie de ceticismo e um certo desencanto até estetizante na maneira de escrever e tudo mais. E, agora, não sei, passado todo esse processo de mobilização política e de projetos de mobilização cultural do século inteiro, quer dizer, a gente chega num final de século um pouco também voltados para uma forma semelhante de ceticismo, uma forma semelhante, talvez, de “decadentismo final de século”. Eu queria saber se você encontra nisso uma outra fonte de semelhança com o seu pai?"
15/01/1996,Carlos Heitor Cony,60,Carlos Heitor Cony,"Sim, nós estamos vivendo um outro século. Você falou de decadentismo. É preciso ver o seguinte, a geração do meu pai já era uma geração logo depois do século. Ele ainda herdou, como você citou bem, os atores, eram Anatole France, Machado de Assis, Euclides da Cunha... marcaram toda uma geração, mesmo de jornalistas que nunca os tiverem lido. Era o clima, era o chamado clima de fim de século."
15/01/1996,Carlos Heitor Cony,61,Marcelo Coelho,E a cadeira do Bilac ainda estava ali.
15/01/1996,Carlos Heitor Cony,62,Carlos Heitor Cony,"Mas veja só, eu acredito que esse ceticismo será inerente à profissão de jornalista. Se o jornalista não for cético, ele vai ser panfletário a favor. Eu acho que a pior coisa que há no jornalismo é o panfletário a favor. É o sujeito que... o Fernando Henrique, nesse ponto, até me parece ser um panfletário a favor dele mesmo. Ele, por exemplo, eu não sei se os senhores repararam a maneira dele se expressar. Tem um rapaz que imita o Fernando Henrique na televisão, eu vi, imita um pouco parecido. Mas o pensamento dele é mais ou menos o seguinte, digamos, uma frase assim óbvia: “Não se deve cuspir no chão, que é porcaria”. É uma frase óbvia. O Fernando Henrique jamais vai dizer isso. Ele vai dizer: “Não convém que se coloque a glândula salivar em funcionamento e expelí-la da cavidade bucal porque, pela lei da gravidade. Newton...”, ele diz, “...que a lei da gravidade jogará no chão”. Ele citou Newton, inteligente para burro, culto para burro, mas ele falou o quê? Que não se deve cuspir no chão, que é porcaria. Isso é, talvez, o quê? É o decadencismo."
15/01/1996,Carlos Heitor Cony,63,Matinas Suzuki,"Cony, nós faremos agora um breve intervalo e voltaremos daqui a pouquinho com o segundo tempo da entrevista de Carlos Heitor Cony. Até já."
15/01/1996,Carlos Heitor Cony,64,[...],
15/01/1996,Carlos Heitor Cony,65,Matinas Suzuki,"Nós voltamos com o Roda Viva que entrevista esta noite o escritor e jornalista Carlos Heitor Cony. Cony, a gente estava falando aqui das mudanças de jornal, você já está a algum tempo na imprensa e as mudanças... mas eu gostaria de te perguntar também: Você foi, talvez, o escritor mais conhecido do Brasil nos anos de 1960, chegava a escrever até mais de um romance por ano. Qual é a diferença que você sente agora que você volta ao universo do livro. Qual a diferença? O que houve, o que mudou, na sua concepção ou na sua visão, no livro no Brasil? Melhorou, piorou a situação, era mais gostoso, era mais interessante fazer livro nos anos de 1960 do que agora? E eu queria aproveitar também que o José Roberto Giorgetto, de São João da Boa Vista, pergunta qual foi a importância do Ênio Silveira, que foi um dos seus editores dos anos de 1960 e que, infelizmente, recentemente faleceu?"
15/01/1996,Carlos Heitor Cony,66,Carlos Heitor Cony,"Foi meu editor até bem pouco tempo, né? Eu estreei em 1958. No final dos anos de 1950 surgiu o Guimarães Rosa, com Grande sertão: veredas em 1958, Gabriela, do Jorge Amado, também de 1958, Fernando Sabino, com Encontro marcado, também ali de 1957, 1956, quer dizer, surgiu uma geração muito grande. Os livros tinham tiragens maiores, em princípio, tinham tiragens maiores, mas não havia, digamos assim, uma cobertura da mídia tão grande quanto hoje. Hoje, realmente, a indústria editorial... não só porque as editoras se profissionalizaram, criaram marketing, antigamente não havia marketing. Eu me lembro que quando saiu o meu primeiro livro, o Ênio botou um anúncio no jornal, aí houve quem reclamasse: “Você não é sabonete, não deixe o Ênio fazer isso, ele está te estragando”. Isso foi um editado do Ênio, por exemplo, não foi nem inveja porque foi um acadêmico. Posso dizer o nome porque já está morto: Raimundo Magalhães Júnior. Meu amigo era amigo íntimo, trabalhávamos juntos na mesma mesa. Ele achava que o Ênio estava me prostituindo na medida que me anunciava. Você veja a mentalidade dos anos de 1950. Hoje não, hoje se entende o marketing do livro. Isso faz com que o livro tenha repercussão, mereça ou não mereça. Eu acredito que a produção dos anos de 1960, dessa virada de 1960, tenha sido melhor não porque eu tenha estreado, não foi por causa de mim, eu citei Jorge Amado, Guimarães Rosa, Fernando Sabino, Millôr Fernandes também começou a estourar nessa época. Eu acredito que houve uma espécie de, não vou dizer renascença, mas foi um período muito fértil na literatura. Agora, não tinha, não havia, por exemplo, um programa como o Roda Viva que chama o escritor para falar sobre isso, não havia. O Jorge Amado, por ser Jorge Amado, tinha uma certa cobertura. Mas, não era... Hoje, não, hoje se discute mais o livro, mas tiragens são menores. Há, evidentemente, aqueles que tiram tiragens maiores. Também outra coisa: Apela-se mais para os livros. Antigamente, quando, por exemplo, nessa época, um grande filme, um best-seller da época foi O quarto de despejo, de uma favelada. Vendeu 40, 50 mil. Mas era, foi uma peça que criou um impacto muito grande. Era uma favelada com o, mas foi considerado, muita gente torceu o nariz para os editores: “Vocês não devem fazer isso”. Hoje é diferente. Hoje, se os Mamonas Assassinas escreverem um livro sobre a Teoria do Quanta, não vai faltar editor nem leitor. Vende tranqüilamente 300, 400 mil exemplares. Mamonas Assassinas explicando a Teoria do Quanta. Eu, que não entendo nada da Teoria do Quanta, gostaria de entender através dos Mamonas Assassinas."
15/01/1996,Carlos Heitor Cony,67,Bráulio Neto,"Você se enquadra nesse seguimento aí... Como é voltar para o mercado editorial, num momento em que o Lair Ribeiro vende livros da forma que vende? Paulo Coelho. Como é que você vê esse tipo de fenômeno e eu queria saber o contrário também: Você acha que o Lair Ribeiro teria grande espaço literário nos anos de 1960, por exemplo?"
15/01/1996,Carlos Heitor Cony,68,Carlos Heitor Cony,"Não teria tanto, não teria tanto. Sinceramente, não teria tanto. A indústria do livro era muito elitista, naquela época."
15/01/1996,Carlos Heitor Cony,69,Ivan Ângelo,"Mas, também tinha o Como fazer amigos e influenciar pessoas, que é um livro..."
15/01/1996,Carlos Heitor Cony,70,Carlos Heitor Cony,"Havia, havia. Era um erro, mas o livro era considerado quase um totem. Era uma coisa sagrada. Na verdade, eu acho o Paulo Coelho muito útil porque um homem que vende 2 milhões de exemplares faz o editor ganhar dinheiro e esse editor pode investir em outras coisas."
