DATA,ENTREVISTA,ORDEM,LOCUTOR,FALA
15/01/1996,Carlos Heitor Cony,71,Humberto Werneck,"Cony, eu queria voltar para um momento aqui nesse seu livro, esse quase aqui na capa. Quase memória, quase romance. Isso cria em mim uma curiosidade e me autoriza a te perguntar até que ponto... onde entra aqui a ficção? Onde está a realidade, a memória pura e onde você foi romancista? Eu penso, por exemplo, em alguns episódios, como o episódio do balão. Aquele governador de Minas sendo tentado a se lançar a presidente da República, o seu pai despencando de uma mangueira dentro de um cemitério. Que episódios você criou?"
15/01/1996,Carlos Heitor Cony,72,Carlos Heitor Cony,"É muito misturado. O pai despencando da mangueira no cemitério é real. O episódio do governador já é ficção, totalmente ficção. Eu inventei na prisão, com Joel Silveira. O Joel Silveira resolveu contar uma história, eu disse: “Vamos inventar a história”. Preso, para passar o tempo, faz qualquer miséria. Então, o Joel preso e eu preso, resolvemos inventar. O Joel inventou uma história lá da terra dele, de Lampião, que Lampião não entrou na terra dele porque não tinha nada para roubar também. A terra dele é Lagarto, lá em Sergipe. E disse: “Agora inventa uma história”. Eu inventei essa história. Foi relato oral, que dizer, velho recurso. Foi um relato oral que na hora eu me lembrei. Mas quando você me fala desse troço, se é romance, é o seguinte: É uma questão de linguagem. Eu digo, na abertura, eu fiz questão de botar bem claro porque a linguagem flutua, ela está desgovernada. Eu uso linguagem de reportagem, uso linguagem de crônica e de ficção. Um momentinho só. Há episódios inventados que eu usei linguagem de reportagem e há episódios reais que eu usei linguagem de ficção."
15/01/1996,Carlos Heitor Cony,73,Matinas Suzuki,"Agora, o que diferencia, para você, a reportagem da crônica, do romance e do conto, uma vez que você já faz quase tudo?"
15/01/1996,Carlos Heitor Cony,74,Carlos Heitor Cony,"Bom, a reportagem procura ser objetiva. Você, como chefe de redação, sabe disso. A reportagem tem que ser objetiva, tem que ser factual, tem que ser neutra e a linguagem tem que obedecer isso. A crônica é o contrário, na crônica, o personagem central, nesse ponto o livro é uma crônica, a crônica é um gênero em que o personagem principal é o “eu”: “Abri a janela e não vi nada”, pronto, é uma crônica. Já é uma crônica: “Abri a janela e vi tudo”, pronto, é outra crônica. Desde o momento que seja o “eu”, pronto, você está no ramo da crônica, vale tudo. A ficção é diferente. A ficção, talvez, é uma forma que você já agride a linguagem, digamos assim, gramatical, a sintaxe tradicional."
15/01/1996,Carlos Heitor Cony,75,Matinas Suzuki,Mas há quem agrida no jornal e não faça ficção.
15/01/1996,Carlos Heitor Cony,76,Carlos Heitor Cony,"Às vezes é uma forma de ficção, mas quando você agride propositalmente, você começa a juntar... Por exemplo, a parte final do livro é de ficção, é linguagem de romance. É uma liberdade que..."
15/01/1996,Carlos Heitor Cony,77,Matinas Suzuki,Mas em qual delas você está mais à vontade?
15/01/1996,Carlos Heitor Cony,78,Carlos Heitor Cony,"Matinas, sinceramente, nesse livro daí eu não me policiei, eu me soltei na medida que veio. Eu não pensava em publicar, só publiquei porque um dos presentes aqui na mesa resolveu levar para uma editora e o editor resolveu publicar. Tanto que eu quase me desentendi com o meu editor tradicional, que era o Ênio Silveira, que não gostou, achou que eu tinha apresentado a ele e agora está morto, mas antes disso nos reconciliamos. Não só isso, ele ficou de editar dois livros meus esse ano, agora morreu, não sei como vai ficar isso."
15/01/1996,Carlos Heitor Cony,79,Humberto Werneck,"Seus livros estão em catálogo, ainda? Eles são encontrados?"
15/01/1996,Carlos Heitor Cony,80,Carlos Heitor Cony,"Não, não estão há 20 anos. Também não fiz questão, a verdade seja dita, não fiz nenhuma questão de reeditar meus livros."
15/01/1996,Carlos Heitor Cony,81,Humberto Werneck,"Agora, o sucesso desse livro, de certa forma, você sente que vai puxar reedições? Você tem sentido isso?"
15/01/1996,Carlos Heitor Cony,82,Carlos Heitor Cony,"Sim, mas, sinceramente, não é por aí, não. Eu tenho a impressão que eu não gostaria de ver republicados alguns de meus livros."
15/01/1996,Carlos Heitor Cony,83,Humberto Werneck,Nenhum?
15/01/1996,Carlos Heitor Cony,84,Carlos Heitor Cony,"Nenhum, não, talvez. Eu gostaria de ter tempo de fazer..."
15/01/1996,Carlos Heitor Cony,85,Luciana Villas Boas,O Pilatos você gostaria que fizessem?
15/01/1996,Carlos Heitor Cony,86,Carlos Heitor Cony,"Ah, gostaria. Pilatos é o único livro pronto que eu tenho, é o único livro que eu afirmo que eu acho que nunca será datado. É preciso ver que esse Quase memória, não estou dizendo isso para bajular vocês, mas todos vocês aqui poderiam ter escrito. Isso é uma questão de tema."
15/01/1996,Carlos Heitor Cony,87,Ruy Castro,"As pessoas que têm acesso a você, depois que lêem o Quase memória, chegam para você e dizem: “Olha, adorei o seu livro, chorei pra burro, pensei muito no meu pai” etc. E tem outros, que são minoria, que dizem: “Olha, adorei o seu livro, morri de rir”. Qual das duas reações você prefere?"
15/01/1996,Carlos Heitor Cony,88,Carlos Heitor Cony,"Muito difícil. Acho que os que riem. Acho que, talvez, seja uma reação mais primária. O choro nunca é muito sincero, o riso é. Eu acho que o riso me satisfaz mais. De qualquer maneira, você me cortou um pouco. Eu acho que qualquer pessoa que se volte para si mesmo e relembre a figura paterna ou a materna ou um episódio marcante da sua infância, pode fazer um livro igual, melhor ou um pouco pior, mas pode fazer um livro nesse tipo, nesse gênero. Agora, Pilatos eu acho muito difícil fazer porque precisa ter aquela dose de raiva que eu tive quando escrevi o livro e, ao mesmo tempo, aquela dose de felicidade que eu tinha na época. Eu era muito feliz naquele tempo. Eu fiz o livro em 1972 e vivi um período muito feliz que nunca mais se repetiu na minha vida."
15/01/1996,Carlos Heitor Cony,89,Ivan Ângelo,"Por falar nisso, Cony, até agora você falou das coisas que te aborrecem, principalmente, tirando a cachorra e algumas outras coisas. Eu queria saber o que é que te diverte?"
15/01/1996,Carlos Heitor Cony,90,Carlos Heitor Cony,"Antes de mais nada, a política me diverte muito. A política me diverte. Eu, por exemplo, tive um professor, lá no seminário, que dizia: “Vocês devem preferir morrer a se banalizarem”. Não sejamos medíocres. Havia uma frase latina dos jesuítas, que dizia: “Ad maiorum actus”, que significa: “O homem nasceu para coisas grandes”. Não se pode banalizar. E na aula dele, ele só falava em Xenofonte, Sócrates, poetas, era uma coisa assim altamente não banal. Se esse professor hoje me visse escrevendo sobre o Hargreaves, sobre o Sarney, sobre o Bresser Pereira, se não me engano, que diz: “Na impossibilidade de chorar, eu rio”. O certo seria eu estar chorando, mas eu não tinha canais lacrimais suficientes para chorar a vida toda, então sou obrigado a me divertir. Divirto-me muito com a política. Veja o caso da política brasileira, é uma arrumação eterna. Os personagens voltam, são recorrentes. Não há uma diretriz racional. Eu saí do Brasil para as férias e estavam falando na Pasta Rosa. Quando voltei, não estavam mais falando em Pasta Rosa. Rubem Braga uma vez saiu do Brasil e quando voltou o assunto era Hollywood sem filtro. Quer dizer, a vida pública é uma comédia."
15/01/1996,Carlos Heitor Cony,91,Ivan Ângelo,"Sim, mas fora isso, cinema, viagens?"
15/01/1996,Carlos Heitor Cony,92,Carlos Heitor Cony,"Não, veja, eu já gostei mais de cinema."
15/01/1996,Carlos Heitor Cony,93,Matinas Suzuki,Você gosta dos filmes do Chaplin?
15/01/1996,Carlos Heitor Cony,94,Carlos Heitor Cony,"O Chaplin é outro equívoco, de acharem que eu sou chapliniano, muita gente me acusa de ser chapliniano. Não, eu estudei Chaplin porque no seminário havia um padre que passava o Chaplin quase todo feriado, então, eu fiquei vendo aquilo lá, mas no meio desse Chaplin tinha um clássico que era o Doutor Caligari, que eu vi várias vezes por causa disso, mas eu não gosto do Chaplin. Eu rio muito mais com o Gordo e o Magro, até mesmo com o Buster Keaton, do que com o Chaplin. Ele é um fato importante no cinema, eu fiz um livro dedicado a ele e fiz uma série no Jornal do Brasil, no suplemento dominical do Jornal do Brasil, sobre o Chaplin, que foi o ponto de partida para fazer o livro. Eu acho ele muito importante, mas não no cinema. Ele é importante na história do nosso século, mas não no cinema. Cinematograficamente, ele é nulo."
15/01/1996,Carlos Heitor Cony,95,Bráulio Neto,Você citou o Jerry Lewis e no final do livro você fala em Stanley Kubrick ]. Você acha que esse livro daria um bom filme?
15/01/1996,Carlos Heitor Cony,96,Carlos Heitor Cony,Não.
15/01/1996,Carlos Heitor Cony,97,Bráulio Neto,Não daria um bom filme?
15/01/1996,Carlos Heitor Cony,98,Carlos Heitor Cony,"O Ruy Guerra me ligou de Lisboa, parece, não sei se está em Lisboa, em Paris, Madri. O Ruy Guerra disse que achou similitudes com o pai dele e queria fazer. Eu disse: “Não, então faça sobre o seu pai”. Porque é o caso da Marília Gabriela, ela teve a lembrança do pai dela. Não dá filme porque você, veja, no cinema, um dos erros, um dos equívocos que se formam a respeito de literatura é esse, é achar que um livro sendo bom, necessariamente, dará um filme. Não. Porque os filmes precisam de ação, de trama. E o meu livro não tem trama."
15/01/1996,Carlos Heitor Cony,99,Bráulio Neto,Você gosta de cinema brasileiro?
15/01/1996,Carlos Heitor Cony,100,Carlos Heitor Cony,"Não, em princípio não."
15/01/1996,Carlos Heitor Cony,101,Bráulio Neto,"Não gosta, não apontaria... Bom, você não gostaria de vê-lo filmado porque ele tem grandes histórias..."
15/01/1996,Carlos Heitor Cony,102,Carlos Heitor Cony,"Eu tenho dois romances filmados e escrevi três ou quatro roteiros para cinema. Inclusive um muito bom, aqui, passado em São Paulo, mas eu não posso nem dizer o nome porque é pornochanchada."
15/01/1996,Carlos Heitor Cony,103,José Trajano,"E seu lado jornalista? Nós já falamos do cronista, do escritor, do repórter, antes do programa nós estávamos brincando aqui, falando de Dana de Tefé o, aquele redator de legendas de carnaval da revista Fatos e Fotos... E esse seu lado jornalista?"
15/01/1996,Carlos Heitor Cony,104,Carlos Heitor Cony,"O jornalista é um sujeito aberto ao que acontece. Eu já fiz romance pornográfico e estou, hoje, editando a Bíblia. Vai sair quarta-feira o trabalho de um ano: a Bíblia Sagrada, o Novo Testamento, na Manchete, com o apoio cultural do governo de Minas Gerais, texto da Vozes, de Petrópolis, com a equipe de traduções. Eu fiz ilustrações com a renascença italiana, depois botei o barroco mineiro, quer dizer, passei um ano trabalhando em cima do Novo Testamento. Sou doutor em Novo Testamento, agora, mas se você me pedir um texto sobre, a finada, eu faço sim. O jornalista é isso, atua em todas as posições como jornalista. Eu me orgulho muito de ser jornalista, nesse ponto. Acho que jornalista tem que ter essa disponibilidade para isso. Não acredito que o jornalista seja aquilo que Petrônio seria, o jornalista não é um árbitro, o jornalista é um servo da sociedade."
15/01/1996,Carlos Heitor Cony,105,Matinas Suzuki,"Cony, você com a formação de seminário e agora editando a Bíblia, essa coisa toda, o que você tem achado desta questão religiosa hoje no Brasil, que é uma das questões nacionais, também?"
15/01/1996,Carlos Heitor Cony,106,Carlos Heitor Cony,Eu acho um pouco de exagero você falar que é uma questão religiosa. Uma questão religiosa...
15/01/1996,Carlos Heitor Cony,107,Matinas Suzuki,Fui generoso com o termo.
15/01/1996,Carlos Heitor Cony,108,Carlos Heitor Cony,"Questão religiosa é a reforma de Lutero a questão religiosa que houve no fim do Império que provocou a República, foi uma das causas que provocou a República. Há uma briga por uma fatia. Evidentemente, o bispo Macedo, você deve estar se referindo a ele, ele parece, tudo indica, que deve ser um vigarista, tudo mais, mas se você for analisar as origens de todas as religiões, os fundadores foram considerados vigaristas, foram perseguidos, foram maltratados. São Paulo, por exemplo, foi preso seis vezes, naufragou outras tantas e foi condenado à morte porque alegou, evidentemente, o fato de ser cidadão romano, de ter cidadania romana, e não foi crucificado como os outros, mas, foi decapitado como um bom cidadão romano. E o próprio Cristo, na medida que Cristo contrariou o judaísmo oficial, na medida que o judaísmo colocou Pilatos diante daquela alternativa: “Ele se diz César, ele se diz rei, logo ele é contra César”, então Pilatos diz: “Aqui, eu posso cair”. Era, até então, uma briga política, religiosa entre judeus e não judeus, ou seja, aquela seita nascente que era o cristianismo, mas quando Pilatos viu esse argumento, disse: “Eu vou perder meu emprego” e mandou Cristo para o calvário. Não estou comparando, mas é uma tradição de todo fundador de religião ser perseguido, ser tido como vigarista, de fazer milagres, explorar os pobres, explorar a boa fé e, sobretudo, contrariar o establishment. O establishment político, religioso e econômico. Não quero dizer, com isso, que o bispo Macedo faça tudo isso, mas é uma coisa que não se pode também...O bicho que vai dar, não sei. Perdão agora a minha imodéstia, mas assim como a Mila provocou uma reação de cartas muito grandes, no mês que morreu a Mila eu acho que fui o jornalista que recebeu o maior número de cartas do Brasil porque era impressionante as cartas que eu recebia, fotos, o diabo a quatro. Mostra o quê? Mostra a carência nacional. E, evidentemente, no caso do bispo, numa era de neoliberalismo, em que as pessoas acham que os que podem, podem e os que não podem se sacodem, um camarada que faz milagre, promete curar, tira o demônio, tem um público. Então, ele não é causa, ele é mais efeito."
15/01/1996,Carlos Heitor Cony,109,Matinas Suzuki,"Você tem criticado, também, bastante uma outra religião do Brasil que é a Rede Globo. Qual é sua posição sobre a Rede Globo, o Roberto Marinho, essa coisa toda?"
15/01/1996,Carlos Heitor Cony,110,Carlos Heitor Cony,"Antes de mais nada, o Roberto Marinho é um grande profissional. Eu me lembro, por exemplo, de um depoimento do Adolfo Bloch, sobre o Roberto Marinho. Na época das vacas magras, o Roberto Marinho chegava ao jornal às seis horas da manhã, saía às 10 horas da noite, comia de marmita. Foi assim que ele substituiu o pai. Esse homem não pode se jogar no lixo. Ele substituiu o pai, que fundou O Globo e morreu 27 dias depois. E o Roberto Marinho, ainda um garoto praticamente, ninguém sabia quem era Roberto Marinho, ainda não se tinha inventado Roberto Marinho. Ele, realmente, criou um império. O que se critica na Globo é que ela, por uma questão de gravidade, ela sempre se colocou ao lado do governo, independente de que governo foi. Ela pactuou, ela foi... Não vou dizer que tenha sido inspiradora, mas ela foi cúmplice de todo um regime totalitário, de repressão, que sofremos durante 21 anos, mas eu não posso dizer que é uma culpa pessoal do doutor Roberto Marinho. Ele é um homem que foi levado a isso por uma motivação, talvez, até empresarial, ou seja, neoliberal. Ele é um grande neoliberal. Faz muito boa dupla com o Collor, fez uma dupla muito boa com o Collor no início, não vamos esquecer isso: Do caso da edição do último programa do Lula com o Collor, caso do Collor chegando de uma viagem do exterior, tomando banho na piscina do Roberto Marinho, o Roberto Marinho fotografando o Collor, com crédito na foto: “Foto: Roberto Marinho”, tudo perfeito. E hoje é cúmplice do senhor Fernando Henrique e tudo mais. Se der certo, ótimo, honra e louvor para ele, se der errado, ele muda de lado. Muda de lado em favor do vencedor. Não faz meu gênero, evidentemente."
15/01/1996,Carlos Heitor Cony,111,Luciana Villas Boas,"Você acha que a cultura brasileira está em crise ou está muito vigorosa? Porque a gente está vivendo um período tão estranho, tão ambíguo..."
15/01/1996,Carlos Heitor Cony,112,Carlos Heitor Cony,"Você fala cultura, Luciana, de uma maneira muito radical. A cultura brasileira eu acho muito boa. Hoje em dia a gente encontra, a começar pela imprensa, hoje em dia o nível do elemento da imprensa é a mais inquietação. Antigamente, talvez, existissem mais especialistas. Havia uma cultura geral humanística que está faltando hoje nos colégios, isso, sim. No meu tempo, o camarada ia ser advogado, jornalista ou médico e parava de estudar. Hoje em dia, não, hoje em dia há uma inquietação. Eu tenho a impressão que na classe média, sobretudo, há uma supervalorização da cultura."
15/01/1996,Carlos Heitor Cony,113,Luciana Villas Boas,"E a nossa produção em artes, você acha que está rica? Porque é engraçado, às vezes você encontra pessoas brilhantes com posições totalmente opostas. É um período muito difícil de analisar, este que a gente está vivendo."
15/01/1996,Carlos Heitor Cony,114,Carlos Heitor Cony,"Bom, aí você fala sobre arte. Eu acho que a arte está sempre em decadência. Eu acho que a arte é aquela questão do decadentismo que o Marcelo Coelho falou. É preciso ver que a arte nunca será uma causa, ela é sempre um efeito. Ela é o efeito de uma época contraditória, que tem muita coisa no ar. O século XX está acabando, foi um século que balançou muita coisa, balançou certezas, dúvidas. Tivemos o século do socialismo, do nazismo, da bomba atômica, do computador. Foram coisas muito importantes que aconteceram para bagunçar. Em décadas, nós balançamos séculos. O mundo que eu vivi, que eu nasci, foi completamente diferente do mundo de hoje. Há uma precipitação histórica muito grande. Então, os nossos valores ficam meio embaralhados, mas eu acredito que haja, devido sobretudo à técnica que consegue divulgar os conhecimentos, que há, digamos assim, uma preocupação maior pela arte, pelo fato artístico. Não quer dizer que a qualidade da arte tenha melhorado. Eu não acredito, por exemplo, que tenha aparecido um músico melhor do que Beethoven, até hoje. Não acredito. E não acredito, também, que haja um compositor popular melhor que Ari Barroso, até hoje."
15/01/1996,Carlos Heitor Cony,115,Humberto Werneck,"Que autores brasileiros você lê? Autores brasileiros contemporâneos de ficção ou de poesia? Você costuma ler, o que você destaca?"
15/01/1996,Carlos Heitor Cony,116,Carlos Heitor Cony,"Não, eu sou péssimo leitor de literatura brasileira. Eu só fui ler literatura brasileira quando escrevi o meu primeiro livro. Meu editor disse assim, perguntou: “Você leu o Jorge Amado?”. Eu nunca tinha lido Jorge Amado. Eu tinha lido Machado de Assis, Manoel Antônio de Almeida e Lima Barreto, que é a minha trindade pessoal. Esses três eu tinha lido, mas, nunca tinha lido Jorge Amado, nunca li Graciliano Ramos. Nunca li Graciliano Ramos."
15/01/1996,Carlos Heitor Cony,117,Matinas Suzuki,"Cony, você fala nessa trindade sua e fala numa espécie de romance carioca que você gostaria de seguir. É possível, hoje, do Rio de Janeiro, escrever retratando o Brasil?"
15/01/1996,Carlos Heitor Cony,118,Carlos Heitor Cony,"Até certo ponto, sim. O Rio de Janeiro é um caldeirão que reflete mais o Brasil, nesse ponto, do que São Paulo. São Paulo, nesse ponto, é tudo especial. Para você ter uma idéia, o português chegou em Santos, um Anchieta que era um homem genial, resolveu fazer a capital depois da serra. Já tornou São Paulo diferente do Rio de Janeiro. Rio de Janeiro, não, o Rio foi ali, engatinhando, é o caranguejo que vai explorando as coisas. O Rio de Janeiro é todo errado por causa disso. E, depois, o Rio de Janeiro é um pântano, é o pior lugar para fazer uma cidade. Não era possível fazer. Se houvesse o computador para fazer uma revisão, o Rio de Janeiro receberia uma bomba atômica porque está tudo errado. É muito bonito, mas justamente por isso está tudo errado. São Paulo está mais certo, nesse ponto. Agora, é um caldeirão muito grande, é um caldeirão que representa, talvez, o brasileiro médio. A cabeça do brasileiro ainda é muito condicionada, contra ou a favor, pela mentalidade formada pelo Rio de Janeiro, porque, no fundo, o Rio de Janeiro foi um laboratório, pelo menos durante dois séculos em que ele foi capital da República, o Rio de Janeiro foi um laboratório onde todas as experiências foram feitas e se espalharam por lá. É um exemplo que o Nelson Rodrigues gostava muito de dar, quando o Moreira César morreu em Canudos, houve uma guerra na rua do Ouvidor. O que é que aquilo tem a ver com as calças? Quer dizer, um fato que aconteceu em Canudos repercutiu na rua do Ouvidor. Morreu mais gente na rua do Ouvidor do que em Canudos, nesse dia. Quer dizer, isso é uma coisa típica do Rio de Janeiro e que ainda permanece, até certo ponto. Essa violência do Rio de Janeiro é uma violência nacional que se destaca no Rio de Janeiro porque o Rio é o palco, tem mais luzes, tem mais infra-estrutura para a violência. É preciso ver que o Rio de Janeiro tem uma infra-estrutura para a violência. É a cidade mais violenta do Brasil, mas lá tudo é o Brasil, é o microscópio do Brasil."
15/01/1996,Carlos Heitor Cony,119,Marcelo Coelho,"Cony, vou voltar ao JK. Você acha que Brasília, afinal, fez bem ou fez mal para o país?"
15/01/1996,Carlos Heitor Cony,120,Carlos Heitor Cony,"Eu vou expressar a minha opinião. Eu acho que Brasília, em princípio, fez mal. Não quer dizer que o Rio de Janeiro devesse ser a capital. Eu, como carioca, o fato do Rio de Janeiro ser capital, sempre prejudicou. O governo federal foi um hóspede horrível para o Rio de Janeiro, era um feudo do governo federal. Os melhores cargos, as melhores posições, as melhores casas, isso desde o tempo da Corte de Dom João VI. Quando a Corte chegou ao Rio de Janeiro, expulsou os burgueses cariocas das boas casas para instalar a Corte portuguesa. Então, o vigário brasileiro foi expulso para dar o melhor púlpito da cidade a um padre português. E o oficial, o cortesão e tudo mais. Desde aquela época o Rio de Janeiro foi, digamos assim, a cozinha do governo federal. Então, seria ótimo o Rio de Janeiro perder a condição de capital da República, mas, como estado da Guanabara seria ótimo. O melhor período da história do Rio de Janeiro foi do estado da Guanabara..."
15/01/1996,Carlos Heitor Cony,121,Marcelo Coelho,Você acha que parte da crise atual do Rio se deve ao processo da fusão?
15/01/1996,Carlos Heitor Cony,122,Carlos Heitor Cony,"Isso, Marcelo, no caso do Rio de Janeiro específico. A fusão prejudicou o Rio de Janeiro mortalmente. Agora, a capital me parece que foi feita de forma atabalhoada. Discordo do plano piloto do Lúcio Costa. Respeito muito o Lúcio Costa, uma pessoa admirável, um passarinho, uma das pessoas mais geniais que eu conheci na minha vida, mas eu acho que é uma cidade muito inumana e, sobretudo, ela não correspondeu àquilo que se queria, que era ser uma cidade de qualidade de vida boa e onde os acontecimentos nacionais pudessem ser analisados com calma. Juscelino sempre dizia: “Aqui nós não podemos governar porque tem o Chateaubriand, tem o Roberto Marinho, o Orlando Dantas”. E perto do Rio de Janeiro tinha os Mesquita de São Paulo, o Casper Líbero. Então ele achava, o Juscelino, que indo para o interior, ninguém iria se incomodar. Eu acho que lá eles ficaram até mais reféns de um poder muito mais deletério do que o que estava aqui no Rio de Janeiro. Eu acho que Brasília, nesse ponto, foi mal colocada e mal administrada. Agora, evidentemente, no livro do JK eu fui obrigado a defender Brasília porque eu não estava defendendo o meu ponto de vista, estava defendendo o ponto de vista do JK."
15/01/1996,Carlos Heitor Cony,123,Bráulio Neto,"Cony, eu queria voltar para o aspecto pessoal. Uma coisa que eu fiquei curiosa lendo o livro. Você foi casado quantas vezes?"
15/01/1996,Carlos Heitor Cony,124,Carlos Heitor Cony,"Eu estou casado há 20 anos. Meu último casamento dura 20 anos, mas fui casado várias vezes, realmente."
15/01/1996,Carlos Heitor Cony,125,Bráulio Neto,Você tem filhos?
15/01/1996,Carlos Heitor Cony,126,Carlos Heitor Cony,"Tenho, tenho três."
15/01/1996,Carlos Heitor Cony,127,Bráulio Neto,"Tem uma frase no livro que me chamou muita a atenção, que é a seguinte: “Ninguém é grande em sua casa”. Qual é a imagem que você acha que seus filhos têm de você?"
15/01/1996,Carlos Heitor Cony,128,Carlos Heitor Cony,"Eu acho que é uma imagem péssima. Eu acho que é uma imagem péssima. Não estou falando isso aí para o programa. Não sou um bom pai por diversos fatores,é uma pergunta muito pessoal. Gostaria de ser um pai diferente. Gostaria de ser o pai que meu pai foi."
15/01/1996,Carlos Heitor Cony,129,Luciana Villas Boas,Você acha que o jornalismo está pegando pesado na invasão da vida privada das pessoas?
