DATA,ENTREVISTA,ORDEM,LOCUTOR,FALA
14/02/2005,Ciro Gomes,1,Paulo Markun,"Boa noite. O governo federal está decidido a fazer a transposição das águas do rio São Francisco e espera que até o final de abril as obras sejam iniciadas. O projeto, que divide opiniões em oito estados brasileiros e reacende divergências políticas, foi discutido pelo programa Roda Viva no mês passado em uma entrevista com o governador da Bahia, Paulo Souto, um dos críticos da idéia. Hoje, nós retomamos o tema com um dos mais fervorosos defensores da transposição das águas do São Francisco. Nosso entrevistado é o ministro da Integração Nacional, Ciro Gomes, que esse mês foi desligado da vice-presidência do PPS, o Partido Popular Socialista."
14/02/2005,Ciro Gomes,2,[Comentarista],"Sempre se diz, na história pessoal de Ciro Gomes, que tudo começou muito cedo na vida dele. Paulista de Pindamonhangaba, cresceu e fez carreira política no Ceará, onde formou-se em direito e elegeu-se deputado estadual aos 25 anos, prefeito de Fortaleza aos 29 e governador do estado aos 31. Com 35 anos, foi ministro da Fazenda de Itamar Franco e depois disputou duas vezes a presidência da República pelo PPS, em 1998 e em 2002, quando ficou em quarto lugar no primeiro turno. Apoiou Lula no segundo e foi convidado pelo presidente eleito a assumir o Ministério da Integração Nacional. Desligado da vice-presidência do PPS desde o último dia 31 de janeiro, quando o partido decidiu afastar integrantes que permanecem no governo Lula, Ciro Gomes anda em silêncio quanto ao seu futuro partidário, prefere mais falar dos projetos de sua pasta, com especial atenção agora ao rio São Francisco. O projeto, já aprovado pelo Conselho Nacional de Recursos Hídricos, foi mostrado e discutido numa série de reportagens especiais no Jornal da Cultura, no mês passado. O Velho Chico, como é carinhosamente chamado por mineiros e nordestinos, nasce na Serra da Canastra, em Minas Gerais. Em quase três mil quilômetros, atravessa cinco estados: Minas, Bahia, Pernambuco, depois Sergipe e Alagoas, até desaguar no mar. Forma a terceira maior bacia hidrográfica do país com 168 afluentes. Apesar de poluído, com menos peixes e com margens desmatadas e irregularmente ocupadas nas regiões urbanas que atravessa, o rio é uma espécie de garantia de vida para 15 milhões de pessoas que vivem perto dele e um sonho para 8 milhões de nordestinos que vivem longe, nas terras secas do semi-árido. A idéia do governo é captar 1% da água do rio diariamente e mais 2,5%, sempre que a barragem de Sobradinho estiver cheia. A água será bombeada em dois eixos, interligando bacias da região carente. O eixo leste vai ligar a barragem de Itaparica, no rio São Francisco, com os rios Paraíba, na Parnaíba, e Ipojuca, em Pernambuco. O eixo norte levará água do Velho Chico de Pernambuco até as bacias de rio Jaguaribe, no Ceará, Piranhas-Açú, na Paraíba, e Apodi, no Rio Grande do Norte. A transposição, que terá que enfrentar vales e montanhas, também tem pela frente barreiras críticas. Há quem diga que o rio não tem água para isso, e ambientalistas já decidiram recorrer à Justiça contra o projeto. O governo fez estudos e garante que a água é suficiente. O comitê da bacia do São Francisco quer que a transposição tenha apenas uso humano e animal e não uso econômico, como quer o projeto. Políticos de Sergipe, Alagoas, Minas, como o governador baiano Paulo Souto, que discutiu o projeto aqui no Roda Viva, no mês passado, preferem dar prioridades a antigos projetos de irrigação, paralisados por falta de investimentos."
14/02/2005,Ciro Gomes,3,Paulo Markun,"Para entrevistar o ministro Ciro Gomes nós convidamos: Eduardo Nunomura, editor assistente do jornal O Estado de S. Paulo; Maria Cristina Fernandes, editora de política do jornal Valor Econômico; João Suassuna, engenheiro agrônomo e técnico em recursos hídricos; Apolo Heringer Lisboa, coordenador do projeto Manuelzão de recuperação do rio das Velhas e São Francisco e presidente do comitê da bacia hidrográfica do rio das Velhas; Fernando Rodrigues, colunista e repórter do jornal Folha de S. Paulo e Bernardino Furtado, repórter especial do jornal O Estado de Minas. Acompanham a entrevista aqui em nossa platéia os seguintes convidados: Raquel Bidherman, pesquisadora do Centro de Estudos em Sustentabilidade da Fundação Getúlio Vargas de São Paulo; Frederico Elias, estudante de direito da PUC de São Paulo; Temístocles Marcelus Neto, secretário executivo do Fórum Brasileiro de ONGs e Movimentos Sociais para o Meio Ambiente e coordenador da Comissão de Meio Ambiente da CUT; Rui Mamoura Cureda, da Comissão Nacional do Meio Ambiente da CUT, Beluianês Bueno Monteiro, coordenador do programa de voluntariado da fundação SOS Mata Atlântica; Aldo Rebouças, geólogo, professor da USP e pesquisador na área de hidrologia; Cibili Müller, empresária e diretora da Água Brasilis do Meio Ambiente LTDA; José Saíde de Brito, diretor da Excelência Energética Consultoria e Fernando Furriela, advogado ambientalista. Boa noite, ministro."
14/02/2005,Ciro Gomes,4,Ciro Gomes,Boa noite.
14/02/2005,Ciro Gomes,5,Paulo Markun,"Para começar, queremos saber do senhor se realmente o prazo de abril será cumprido, se as obras da transposição começam?"
14/02/2005,Ciro Gomes,6,Ciro Gomes,"Há um planejamento que não vai comprometer a necessidade de fazer as coisas direito. Direito sob o ponto de vista técnico, direito sob o ponto de vista legal, direito sob o ponto de vista político, direito sob o ponto de vista do respeito que nós estamos tendo, procurando ter, com todos que se levantam com críticas, com incompressões, até que isso esteja realmente maduro. Nós temos esse processo já se desenvolvendo de uma forma muito rica e fecunda há dois anos. No cronograma resta agora, exclusivamente, o licenciamento por parte do Ibama, que é autônomo para, eventualmente, determinar correções, mudanças ou até o cancelamento do projeto, tem autonomia para isso e, de nossa parte, o que resta é apenas a licitação para as obras em si mesmas. É possível que nós possamos ainda cumprir o cronograma originalmente planejado."
14/02/2005,Ciro Gomes,7,Paulo Markun,"E o fato de algumas das audiências públicas não terem se realizado em função de protestos, como é que fica?"
14/02/2005,Ciro Gomes,8,Ciro Gomes,"Na verdade, é o seguinte: a audiência pública tem a finalidade, profundamente democrática, como um avanço da legislação brasileira, exclusivamente de apresentar o que é, de fato, o projeto, porque tem muitas versões, muito terrorismo, muita desinformação, então a audiência pública o que é? O governo vai lá formalmente e diz: “O que eu estou tratando é isso” e, obrigatoriamente, recolhe qualquer crítica que se queira fazer. Quem tiver uma crítica tem que aproveitar esse instante para formalizar essa crítica que é capaz, inclusive, de derrubar o projeto, se tiver mérito. Nós fizemos, apesar da legislação não obrigar, nós achamos por bem, isso é protagonismo do Ministério do Meio Ambiente, convocar audiências públicas em toda região de influência do projeto. Conseguimos fazer algumas, outras tantas tentaram impedir com liminares judiciais que os Tribunais Superiores prontamente rechaçaram, porque completamente descabidas, quer dizer, impediam a população de saber do que se trata e dar a sua sugestão concreta. É uma coisa esquisita, né? Quem fez isso não está vendo que está inferindo numa lei que é importante pra nós, no aperfeiçoamento da democracia, que ela amadureça e não amanhã ela seja revogada porque alguém, mais pragmaticamente, acha que isso é uma impertinência. Em alguns lugares, isso infelizmente não foi possível, aí se tentou impedir fisicamente. Pequenos grupos, mas grupos ruidosos, barulhentos, às vezes ameaçando com intimidação física. De qualquer forma, para fins legais, a audiência foi aberta, registrou-se em ata essa agressão e concluímos o processo, mas o processo de audiência pública está encerrado. Agora, trata-se de licenciá-lo ou não, na autonomia do Ibama."
14/02/2005,Ciro Gomes,9,Paulo Markun,"O senhor não acha que o fato de ter gente, vamos dizer assim, gente qualificada dos dois lados da questão... porque é curioso porque os dois lados, de alguma forma, são tão apaixonados que quem não está nesse jogo fica na dúvida, diz: “Poxa, há argumentos de um lado e do outro e pessoas qualificadas, governadores, técnicos dos dois lados”."
14/02/2005,Ciro Gomes,10,Ciro Gomes,"Nós achamos que não devemos desqualificar quem critica, ao contrário. Quem está acompanhando o processo dará testemunho de que o nosso processo foi oposto. Há dois anos atrás, já há dois anos, quando o presidente Lula me encarregou de sistematizar esse projeto, eu avisei ao presidente que havia uma memória muito ruim, muitos erros, erros de concepção, erros de encaminhamentos, inexplicáveis lacunas técnicas, números que eram chutados completamente, eu expliquei pra ele: “Não é possível pegar daqui”. Então, nós refizemos todo o processo, todo o processo. O próprio vice-presidente da República, José Alencar, eu acompanhei, visitou cada um dos estados, recolhemos todas as críticas que havia, redesenhamos o projeto, incorporamos ao projeto aquelas críticas todas que tinham méritos, empoderamos o comitê de bacias, que estava formalmente instituído, mas não tinha realidade, nós empoderamos o comitê de bacias, passamos a negociar diretamente e claramente com o comitê de bacias. O primeiro pleito do comitê de bacias fez com que nós suspendêssemos todas as providências por seis meses, período no qual eles exigiam como premissa da avançada discussão, que nós desenhássemos o plano de bacias. Nós fizemos o plano de bacias com a participação dos membros do comitê de bacias, foi muito bom que tivéssemos feito isso, porque o plano de bacias esclareceu todos os números. Eu quero ter a oportunidade de esclarecer isso, nós temos hoje segurança, tranqüilidade. O pedido de outorga foi retirado, refizemos o pedido de outorga, condicionamos a outorga em dois pedaços, isso é uma mudança importante. Introduzimos um conceito de sinergia hídrica, introduzimos uma matriz de gestão, para utilizar a água que hoje se desperdiça, introduzimos um projeto de revitalização que não existia, era um consenso oco, todo mundo falava a favor da revitalização e não havia um projeto, não havia orçamento, não havia uma iniciativa concreta no governo federal para se fazer essa grave questão da revitalização sair do palavrório, da promessa ou do consenso oco. Tudo isso foi feito e, uma vez concluído esse processo, nós avançamos, levamos isso ao conselho nacional de recursos hídricos, tivemos uma reunião impedida por uma liminar na hora da reunião, que é outra instância onde todo mundo pode ir, que se o projeto tiver algum defeito é hora de poder dizer: “Tem esse defeito” e, evidentemente alguém de boa fé, como o presidente Lula, está de boa fé ou eu estou de boa fé, nós não vamos fazer coisa alguma errada. Se algum brasileiro do povo ou se alguma pessoa mais qualificada disser: “Esse projeto não pode ser feito por esse argumento aqui”. Se nós não tivermos uma resposta, esse projeto tem que ser cancelado, mas nós estamos seguros que não há razão mais para isso, de que boa parte do protagonismo hoje ainda se sustenta em dois fatores ou três: Um, a memória do passado. Então, a gente boa de Sergipe, por exemplo, nós temos pesquisa de opinião, é o único lugar onde a opinião pública popular é contra, majoritariamente. Quando a gente vai entender porque, a população pensa, parte dela expressiva, de que vai se desviar o rio. Ora, isso, nós temos que explicar para a população que vai tirar é um litro em cada 100 que chega na boca do mar. É um litro em cada 100, isso é o que está, na prática, dimensionado como invasão segura e do remanescente, dois litros e meio a cada 100, só se o Sobradinho estiver vertendo. Quando o rio passa a ter uma pujante cheia, como aconteceu em janeiro do ano passado, Propriá teve uma cheia violenta porque o rio passou com 11 mil metros cúbicos por segundo e aí, se tivesse essa água na boca do mar, não tem nada que a gente não possa levar e guardar onde que falta água, que é grave, é isso que nós temos que discutir."
14/02/2005,Ciro Gomes,11,Bernardino Furtado,"Ministro, recentemente tive a oportunidade de divulgar um estudo do Banco Mundial sobre o projeto da transposição, e o seu chefe de gabinete, o Pedro Brito, que é coordenador geral do projeto, fez algumas afirmações: Primeiro, que o projeto tinha mudado e que o Banco Mundial nunca tinha analisado o projeto do atual governo, disse que tinha mudado e citou algumas coisas que o senhor acabou de citar também. Também o senhor disse que não houve desqualificação. Ele usou a expressão de que o problema do estudo do Banco Mundial é que o técnico que fez o estudo era baiano e os baianos são contra a transposição."
14/02/2005,Ciro Gomes,12,Ciro Gomes,"Bom, isso não desqualifica não, isso apenas agrega uma informação. Não desqualifica ninguém o fato de você ser baiano e ser contra, merece o meu respeito."
14/02/2005,Ciro Gomes,13,Bernardino Furtado,"Sim, mas ele disse que..."
14/02/2005,Ciro Gomes,14,Ciro Gomes,"Por exemplo, o Rui Barbosa, o Rui Barbosa é um grande baiano, desculpa lhe interromper, só pra gente ter... o mesmo carinho que eu tenho por baianos, não é senão a isso. Rui Barbosa, um grande brasileiro que nos encheu de orgulho, fez discurso no parlamento contra campanha de vacinação no Rio de Janeiro."
14/02/2005,Ciro Gomes,15,Bernardinho Furtado,"Eu digo que ele disse que a oposição do Banco Mundial era porque o coordenador do estudo era baiano. O senhor citou duas coisas específicas, a questão da energia hídrica. Eu estou aqui com um resumo, do governo passado, do Ministério da Integração Nacional, por sinal a equipe não mudou muito né, ministro? O João Urbano, que é o gerente do projeto hoje, era gerente no governo Fernando Henrique. Um dos pontos básicos aqui é justamente essa sinergia hídrica que o senhor disse que esse projeto atual incorporou, o que não é verdade; segundo, que não havia revitalização. Eu tenho aqui, e está aqui nesse resumo, está também em uma declaração aqui do então secretário de recursos hídricos do Ministério da Integração, em que ele disse o seguinte: “Em março do ano passado concluímos o estudo chamado plano de revitalização do São Francisco, distribuímos para todos os estados e garantimos verba no orçamento. Pela primeira vez surgiu uma rubrica no orçamento da União chamada revitalização do São Francisco. Essa revitalização é tão ou mais importante do que a transposição, deve ser realizada paralelamente e, se possível, um projeto deve ser atrelado ao outro”. O que eu pergunto, ministro, é o seguinte: o que mudou nesse projeto que ele se tornou bom e não era bom no governo passado que levou o governo Fernando Henrique Cardoso a desistir desse projeto, o que mudou nesse projeto para que a sociedade brasileira acredite que é um projeto bom?"
14/02/2005,Ciro Gomes,16,Ciro Gomes,"Bom, corrigindo alguns encaminhamentos de boa fé que você colocou, que são frutos dessa paixão com que as pessoas que abordam esse problema... e eu sou ministro da Integração Nacional, quer dizer, eu não posso, nessa questão, que é bem qualificadamente prática, deixar de exercitar uma grave função que é buscar a unidade do país, a unidade das regiões mais pobres. Essa questão, por exemplo, acontece dividindo a região agudamente mais pobre do país que é o nordeste brasileiro. O que havia no governo passado era um projeto, contratado na Funcate, que não estava concluído tecnicamente, esse é o primeiro ponto. Na concepção que já estava desenhada havia ali um pleito de uma outorga incondicional de 63 metros cúbicos por segundo, independentemente de como estivesse o rio. O plano de bacias não existia, então a grande questão é: sim, há uma necessidade do Nordeste, do semi-árido do nordeste setentrional que nós temos dimensionado. Isso agora, porque não havia também. Se dizia, também empiricamente, que faltava água porque todo mundo via que faltava. Campina Grande colapsou, o açude Boqueirão teve que ser cercado pela polícia no começo de 2003 porque faltou água. Fortaleza, quando eu era governador, acabou a água, não é que ficou racionada, é que acabou a água de dois milhões e 300 mil habitantes. Por isso, talvez, a gente tem uma visão um pouco mais apressada de dizer: “Caramba, não está vendo que falta água?”. Mas isso tem que ter um número para discutir serenamente. As Nações Unidas diz que a vida passa a se tornar insustentável quando se desce de um nível de 1500 metros cúbicos por habitante/ano. Quando nós olhamos com critérios de vazão, de rios etc etc, no Nordeste, esse miolo, tanto de influência do eixo leste como quanto do eixo norte, está ali rente aos 1500, portanto, crítico já hoje. Só que para o Nordeste brasileiro, dada a seqüência de secas continuadas, a vazão segura é aquela que está retida nas barragens. Aí você já desce para 500 metros cúbicos por habitante/ano, portanto, nós estamos em um terço crítico, a necessidade hoje está dimensionada. A segunda grande questão é: o rio agüenta? Vamos ser honestos, o rio está sendo agredido há 500 anos, quer dizer, nós, do governo Lula, é que vamos dar conteúdo concreto a esse consenso oco. Então, nós afirmamos... o que tinha de errado no governo passado? É que não se discutia a revitalização em termos práticos, era um consenso oco. Era um projeto desse tamaninho, com previsão quase nula de orçamento, estimados em dois anos. Isso está em documentos oficiais. Nós, agora, incluímos no PPA e é um projeto que tem 4 bilhões e meio de reais, incluímos no plano de bacias e dimensionamos cada uma das rubricas. Por exemplo, 86% disso é saneamento básico, saneamento ambiental lato sensu, e nós já contratamos 621 milhões de reais. Então, é uma diferença substantiva nesse aspecto, porque agora nós temos os números protegidos de quem está precisando dramaticamente e pede. Quem está na bacia tem medo de ficar sem a água. Ou está vendo o rio desmantelado e tem medo que uma agressão a mais se pratique contra o rio sem resposta pelas questões, e isso impedia a discussão de prosperar. Agora, nós temos plano de bacias, nós fizemos esse plano de bacias junto com o comitê de bacias. Nós empoderamos o comitê de bacias que não era empoderado no governo passado, não existia na prática, nós adiamos tudo para fazer o plano de bacias em seis meses, paramos tudo. Achei razoável isso, não é fácil, não, fizemos o plano de bacias e hoje nós sabemos que o rio tem uma vazão média de 2850 metros cúbicos. Tudo que tem de uso consultivo, ou seja, tudo que se consome de água do rio São Francisco, em 500 anos de história, não excede 500 metros cúbicos. O rio ainda tem uma disponibilidade, pelo plano de bacias, de 360 metros cúbicos para uso consultivo, pode usar para qualquer tipo de uso, cá ou lá, dentro ou fora da bacia, tem 360 metros cúbicos. Se nós projetarmos tudo no maior cenário, quer dizer, o Brasil cresce a 7 mil hectares por ano de irrigação há 20 anos, nós extrapolamos, simulamos o Brasil crescendo a 10 mil hectares de irrigação por ano e, ao invés de ser no Brasil esses 10 mil hectares, concentramos tudo na bacia. Pois bem, em 2025 o rio estaria consumindo 262 metros cúbicos por segundo, portanto, 98 metros cúbicos ainda estariam sobrando. Então, o que mudou é que nós pedimos uma outorga de volta, ao invés de pedir 63 metros cúbicos por segundo, nós pedimos uma outorga que dividiu, porque tinha uma outra polêmica. “É justo, é justo tirar água da bacia quando há potenciais de irrigação, há meia légua da bacia, para irrigar não sei onde?” Eu achava justo esse argumento e continuo achando justo, o que nós fizemos? Separa. O que é uso humano? São 26 metros cúbicos por segundo, é isso? É isso. Então, isso é outorga segura. Isso porque qualquer cristão vai entender, qualquer pessoa de boa-fé vai entender, qualquer pessoa, que não tenha a doença do egoísmo patológico, vai entender que o primeiro uso da água é o abastecimento das pessoas. Só concluindo, então o que nós fizemos? 26 metros cúbicos é a única outorga agora incondicional, o resto... isso é uma mudança grave, gravíssima, conceitual, o resto só será tirado do rio se Sobradinho estiver vertendo. Caramba, se o Sobradinho estiver vertendo passa um mar de água para o mar."
14/02/2005,Ciro Gomes,17,Bernardino Furtado,Isso é um complicador do projeto.
14/02/2005,Ciro Gomes,18,Ciro Gomes,"Não é um complicador do projeto, apenas diminui a sinergia."
14/02/2005,Ciro Gomes,19,Bernardino Furtado,Se o senhor tivesse uma fazenda no Ceará...
14/02/2005,Ciro Gomes,20,Ciro Gomes,"Desculpe, por favor, desculpe, por favor. Você fez afirmações graves e eu não posso deixá-la sem resposta, porque você tem uma autoridade muito grande. Eu quero, pelo menos, modestamente, esclarecer. A sinergia hídrica é um conceito que vem do seguinte... Havia um crítica, também procedente, o mérito do processo hoje não é nosso e nós abrimos para ouvir toda a crítica e incorporamos a crítica honesta ao projeto, esse é o mérito maior do projeto hoje. O que é a sinergia hídrica? Nós temos um desperdício dramático de água no Nordeste semi-árido e as pessoas diziam: “Como é que vai tirar a água a custo com energia etc etc, se estão desperdiçando a água que tem, mesmo pouca?”. Nós achamos que esse argumento tem que ser respondido. Então, qual é a lógica? Hoje, os açudes do Nordeste setentrional perdem 80% da água guardada por conta de vertimento e evaporação, por quê? Por causa da insegurança hídrica, você não sabe se amanhã vai acontecer uma seca de 3 anos. A sinergia hídrica é isso, você não precisa bombear, você apenas garante que o camarada lá na frente pode usar água até o chão, porque, se vier uma seca continuada, o engenho humano tem condições de suprir aquela insegurança hídrica. Essa é a mudança, não tem nada de mentiroso não, aconteceu mesmo."
14/02/2005,Ciro Gomes,21,Bernardino Furtado,"Ministro, é porque isso aqui..."
14/02/2005,Ciro Gomes,22,Ciro Gomes,"Não é mentira não, que coisa mais desagradável."
14/02/2005,Ciro Gomes,23,Bernardino Furtado,"Eu não disse que é mentira, mas..."
14/02/2005,Ciro Gomes,24,Ciro Gomes,"Eu tenho ouvido, você disse isso mesmo."
14/02/2005,Ciro Gomes,25,Bernardino Furtado,O senhor vai ver lá a sinergia do projeto com todos esses detalhes.
14/02/2005,Ciro Gomes,26,Ciro Gomes,"Não, não, essa sinergia hídrica é um conceito novo."
14/02/2005,Ciro Gomes,27,Bernardino Furtado,Isso aqui foi feito com o Fernando Henrique.
14/02/2005,Ciro Gomes,28,Ciro Gomes,"Sim, você está defendendo o governo Fernando Henrique?"
14/02/2005,Ciro Gomes,29,Bernardino Furtado,"Não estou defendendo, estou dizendo que o projeto é o mesmo."
14/02/2005,Ciro Gomes,30,Ciro Gomes,"Não é o mesmo, não é o mesmo. Se a outorga não é a mesma, o projeto mudou."
14/02/2005,Ciro Gomes,31,Bernardino Furtado,Isso que o senhor falou...
14/02/2005,Ciro Gomes,32,Ciro Gomes,"No projeto anterior, desculpa, Bernardino..."
14/02/2005,Ciro Gomes,33,Bernadino Furtado,É o mesmo.
14/02/2005,Ciro Gomes,34,Ciro Gomes,"Desculpa, Bernardino. No projeto anterior esse negócio nem chegou a ser projetado de forma objetiva. Não havia, por exemplo, intervenção fundiária. Caramba, isso é uma diferença grave, nós decretamos a utilidade pública para fins de desapropriação, uma faixa da influência da água, de dois e meio quilômetros para cada lado, para não permitir que um benefício dessa magnitude fosse concentrado pelas oligarquias nordestinas. Isso é uma mudança grave, não havia isso."
14/02/2005,Ciro Gomes,35,Bernardino Furtado,Não acha que se resolve isso com decreto?
14/02/2005,Ciro Gomes,36,Ciro Gomes,"Não, só se pode desapropriar com decreto, desculpe, mas isso é da Constituição brasileira"
14/02/2005,Ciro Gomes,37,Paulo Markun,"Ministro, Manoel do Bonfim Dias Ribeiro, engenheiro civil, ex-diretor do e da Codevasf pergunta: “Como é que o senhor explica que quatro projetos de irrigação, Jaíba, em Minas; Baixio, na Bahia; Salitre, na Bahia e Pontal, em Pernambuco, todos à beira do São Francisco representando...”, segundo o Manoel, “...mais de 200 mil hectares irrigados, estejam totalmente paralisados, sem recursos e sem dotação orçamentária e seus equipamentos se deteriorem ao tempo, por que tanto desprezo pelo Velho Chico?”, pergunta Manoel do Bonfim de Azevedo. Na mesma direção é a pergunta de Ademir Piroze, aqui da Liberdade, em São Paulo, professor, que pergunta o que será que vai ser feito com os antigos programas de irrigação destinados a acabar com seca no Nordeste. Projetos onde foi investindo dinheiro em grande quantidade e que, em sua maioria, estão paralisados?"
