DATA,ENTREVISTA,ORDEM,LOCUTOR,FALA
14/02/2005,Ciro Gomes,83,Ciro Gomes,"Não, não, espera, opa, não estou falando disso não. Quem é irrigante hoje já está garantido com 91 metros cúbicos por segundo. Nós fizemos a perícia, João, isso é que você não quer entender. Para fazer o plano de bacias, nós fomos lá e mapeamos todo os usos reais da água e ponderamos. Hoje, tudo que se usa no Nilo Coelho para produzir fruta, para exportação, uva, tudo o que se usa no Tourão, em Alagoas, tudo somando dá 91 metros cúbicos por segundo. Em cima disso o rio ainda tem disponíveis, para uso consultivo, 360 metros cúbicos."
14/02/2005,Ciro Gomes,84,João Suassuna,Mas tem 335 outorgantes.
14/02/2005,Ciro Gomes,85,Ciro Gomes,"Sim, meu querido, mas o outorgatário, se eu posso usar essa expressão, é o Ministério da Integração Nacional, é a Codevasf."
14/02/2005,Ciro Gomes,86,João Suassuna,Esqueceu de combinar com o governador.
14/02/2005,Ciro Gomes,87,Ciro Gomes,"Não, não, eu procurei a todos, continuarei procurando, ponderarei com todos. E os governadores, eles têm duas naturezas de argumentos que eu estou procurando, respeitosamente, incorporar. Uma, juízo de conveniência, oportunidade, já perpassou aqui. Porque é que vai fazer o São Francisco se falta o resto do Salitre? Porque alhos não se misturam com bugalhos. O objetivo estratégico é se garantir segurança hídrica para 12 milhões de pessoas, outro objetivo estratégico, quem quiser hierarquizar mais ou menos importante o faça, é concluir projetos de irrigação. Por exemplo, o governador Paulo Souto está me propondo que o projeto Salitre seja usado para cana. Nós vamos ouvir com o maior respeito e se, no fim, for cana, é cana. Pelo amor de Deus, comparar, produzir, ainda que seja importante, é muito importante produzir cana, uva para exportação, é muito importante, mas não hierarquicamente tão importante como garantir segurança para 12 milhões de habitantes que precisam de água para viver no básico, isso é uma clareza. Portanto, não estou desqualificando a justíssima reivindicação de concluir os projetos, por isso que eu não começo nenhum novo, por isso que eu concentrei, no Ministério da Integração Nacional, todos os recursos que eu pude somar. Mesmo nessa batalha por recursos, nós estamos aplicando 140 milhões de reais, é muito pouco? É muito pouco, mas é muito mais do que se fez nos últimos oito anos de forma concentrada. Tentando concluir, e eu vou em cima desses que estão perto de terminar. Estamos elaborando uma nova lei de irrigação para, inclusive, resolver problemas de desperdício, de matriz tecnológica e uma série de coisas."
14/02/2005,Ciro Gomes,88,Paulo Markun,"Pergunta de Marcos Antônio Tavares Coelho, que é jornalista editor da revista do Instituto dos Estudos Superiores da USP. A economista Tânia Bacelar, professora da Universidade Federal de Pernambuco, e até recentemente integrante da sua equipe no Ministério, disse que, diante do projeto de transposição, o mais importante é saber quem será beneficiado. Por isso, antes de fazer essa transposição seria necessário revitalizar o São Francisco e realizar a reforma agrária, caso contrário esse projeto favoreceria a concentração de renda no nordeste. Marco Antônio Tavares Coelho pergunta qual é a opinião do senhor sobre esse pronunciamento da professora Tânia?"
14/02/2005,Ciro Gomes,89,Ciro Gomes,"Eu não dou mais opinião, tenho que prestar conta do que eu estou fazendo. Do programa de revitalização, que era um consenso oco, não tinha substância, hoje está se montando, tem orçamento, tem contratações já feitas, 621 milhões de reais em saneamento básico, 100 milhões de reais, em números redondos, para este ano, para outras atividades de reposição de mata ciliares, assoreamento, unidades de conservações, enfim, todo esse apoio aos pescadores do baixo São Francisco sofreram dramaticamente as conseqüências da cascata de barragens. Antes que essa discussão aflorasse a público, como é orientação do presidente Lula e meu compromisso, nós, ainda quando a geodésica dos canais ainda não estava publicizada, nós decretamos a utilidade pública, para fins de desapropriação, toda faixa que vai desse dois e meio quilômetros para o lado e mais dois e meio quilômetros para o outro. Agora estamos avançando a titulação dos pequenos produtores nas áreas dos rios secos que serão perenizados. Mil quilômetros de rios secos serão perenizados com esse projeto e estamos mapeando o solo para dar prioridade para os solos mais pertinentes a agricultura familiar. No projeto, estão imaginados 400 pontos de acesso de água para assentamento. E populações ribeirinhas aos eixos de influências gratuito, para que o ônus da água seja pago exclusivamente pela população urbana, especialmente pelos grandes centros, pelas indústrias e pelos usos empresariais para uma eventual agricultura. Isto está feito já, foi publicado e está no Diário Oficial."
14/02/2005,Ciro Gomes,90,Apolo Heringer Lisboa,"Já estava preocupado aqui, porque o senhor fala 90% do tempo, não é? E realmente é um direito que o senhor tem, o senhor está sendo entrevistado, mas eu não sou oposição ao governo Lula, eu ajudei a construir o governo Lula, quando o senhor nem apoiava o PT. O senhor nunca apoiou o Lula, então assim, quando o Lula chegou ao governo, o senhor agora é o companheiro Ciro Gomes e nós, que construímos toda essa trajetória, mal temos a oportunidade de conversar. O Ministério do Meio Ambiente não dialoga com a gente. Eu tenho aqui um livro, organizado pela ministra Marina Silva com a posição de pessoas do alto escalão do governo onde eles são contra a transposição. Todos mudaram de opinião por uma disciplina partidária. Eu acredito que a democracia não se constrói dessa forma, desqualificando as pessoas e dizendo: “Vamos fazer na marra a transposição, quem não quer a transposição é porque quer ver o povo morrendo de sede”. Eu acredito, como diz o Zé Teodomiro de Araújo, falecido, ajudou a criar o comitê do São Francisco, é um homem muito franco, muito rude, às vezes eu até me chocava com ele, mas o respeito muito. Faço aqui uma homenagem a ele, ele dizia que dizer que vai levar água para os pobres é a chantagem emocional. Na verdade, é um projeto concentracionista de água, a água vai para os açudes e para rios, ela não vai ser distribuída. A população que sofre com a seca, ela mora dispersa, em toda uma região longa, e ela é atingida pela chuva. Por que os açudes que no Nordeste tem 37 bilhões de metros cúbicos de água não resolvem o problema dos pobres no Nordeste? Eles prometeram que os açudes, como o Orós, resolveriam o problema da seca, o flagelo, seria a redenção do Nordeste. Da mesma forma a Transamazônica. Eu me lembro que o Coronel Andreaza dizia que a Transamazônica iria resolver o problema no Nordeste porque ia estabelecer uma ponte com a Amazônia cheia de água. Então, o povo do Nordeste vive sendo enganado, desculpe, é uma constatação. Eu acredito que a indústria da seca é que está por trás desse projeto de transposição. A indústria da seca não tem nenhum compromisso com a população, os açudes não resolveram os problemas. Por que se esquece a bacia de São Francisco, que tem terras boas e água, para levar água para uma região que tem terras piores, longe, em uma altitude enorme e que tem água suficiente? Todos os estudos que eu tenho mostram que o Nordeste semi-árido tem água suficiente. O problema é que ela não é distribuída, ela está concentrada, e esse projeto de transposição vai levar mais águas para onde já tem. O Rio Grande do Norte não precisa mais de água, é só questão de gestão. Se o senhor diz, por exemplo, que o povo do Nordeste, do semi-árido, passa fome, passa sede, eu concordo com o senhor. Do mesmo jeito, se eu levar água para o Nordeste e ficar nos açudes e naqueles rios, que os proprietários já tomaram conta, as pessoas vão morrer de miséria a cinco quilômetros do rio como morre no rio São Francisco. O problema do Brasil é de inclusão social, eu não posso acreditar que levando supermercado para uma área de miséria eu vou resolver o problema da fome, porque as pessoas não vão ter como comprar aquele alimento. A água é inacessível à população do Nordeste porque a população que mais sofre com a seca está dispersa. Então, eu gostaria de colocar para o senhor o seguinte: por que o senhor não pensou antes na revitalização da bacia de São Francisco para trazer de volta os peixes as condições de vida, despoluir os rios? O projeto de revitalização que o senhor mencionou, ele não é um projeto, por exemplo, para a transposição. Tem um projeto de engenharia, que custou mais de 70 milhões de reais até agora, segundo informação do vice-presidente José Alencar, paga por grupos de consultoria, que têm persistido nisso desde 1982, quando o Andreazza apresentou na convenção do PDS. A proposta de fazer a transposição, ela vem sendo engordada ao longo desse tempo, mas ela realmente não está ligada com irrigação na bacia de São Francisco. Os projetos estão paralisados na bacia de São Francisco. Então, eu acredito que em um programa de televisão como esse, onde a gente tem pouco tempo para falar, eu acredito que o senhor deveria tomar a iniciativa de reunir pessoas do governo com pessoas do comitê. Uma reunião de procurar entender melhor e tentar evoluir numa política de tentar achar uma solução. Porque todos somos a favor de resolver o problema do sertanejo, ninguém está querendo negar água para o Nordeste. É que a água que já foi para lá, com os açudes, a água dos açudes, acumulada, não está resolvendo os problemas do nordestino. O senhor defendeu a transposição do Tocantins na eleição de 1998. Então, é o seguinte, nós estamos em uma questão de deficiência de eletricidade, nós, para fazer essa transposição, vamos gastar mais ou menos uma e meia represa de Três Marias, que é o que nós vamos ter de perda de 300 metros de queda. Essa água retirada não vai produzir eletricidade, como a energia para fazer a transposição. São muitos dados técnicos, eu não quero ficar aqui discutindo vazão e tal, porque a população que está vendo isso aí ela quer saber porque vocês querem fazer a transposição sem pensar na revitalização do rio que está agonizante e por que prioriza transposição e não prioriza irrigação na própria bacia? Então, eu acredito que nós estamos diante de uma discussão muito profunda. O senhor tenta descaracterizar dizendo que não há problemas, que todo mundo quer o bem do país, mas eu acho difícil. O senhor devia perguntar por que há tanta resistência do meio intelectual, dos cientistas, da área técnica. Eu não conheço nenhum grande hidrólogo, geólogo que está a favor da transposição. Eu acho que isso aí deveria levar o senhor a fazer uma reflexão, porque eu acho que o presidente Lula respeita muito o senhor e ele pode estar fazendo uma obra que vai passar para a história como a Transamazônica passou para o governo militar. Eu gostaria de saber, do senhor, se seria possível um entendimento entre governo e o comitê de bacias. O comitê de bacias tem 40% dos empresários da região, 33% de governo municipal, estadual e federal, e 27% da sociedade civil, é o organismo mais indicado para discutir os múltiplos usos da água da bacia. Então, eu não entendo porque o governo Lula quer passar por cima da decisão do comitê. Porque está passando por cima, não tenha dúvida. O comitê se sente desprestigiado, desvalorizado, despudorado, se eu poderia usar essa palavra. Eles estão rompendo com a posição histórica do PT. Então, que o governo tenha com a gente, que é contra a transposição, a mesma paciência e diplomacia que ele está tendo com os grandes empresários, que sempre combateram o Lula, que está tendo com o FMI, que está tendo com agronegócio. Nós queremos ser tratados pelo menos igual ele trata esses setores, e não está tratando, por favor, não diga que está. As audiências públicas foram uma tentativa de farsa para legalizar o ritual da transposição, como é que eles faziam uma apresentação de uma hora e meia e depois dava dois, três minutos para as pessoas falarem alguma coisa? Um estado igual a Minas Gerais, como é que eu vou trazer os interessados na transposição para uma reunião num auditório com 200 pessoas? Não tem condições de fazer uma discussão. O comitê representa as comunidades da bacia do São Francisco, passando por cima do comitê, aí não tem condições. Israel tem 200 mil hectares irrigados, porque eles têm conhecimento, tecnologia e tem gerenciamento. A cultura do Nordeste é de desperdício na distribuição de água pela empresa de saneamento, há um desperdício na irrigação, há falta de conhecimento, é tudo isso que está junto. Nós não estamos querendo reduzir o problema da miséria do Nordeste a um problema de ordem de engenharia, é uma questão social de distribuição de renda, de acesso aos bens."
14/02/2005,Ciro Gomes,91,Ciro Gomes,Se sentiu à vontade para falar o que tinha vontade de tudo? Não lhe interrompi.
14/02/2005,Ciro Gomes,92,Apolo Heringer Lisboa,"Mas é claro, ministro. Não queria voltar para Belo Horizonte sem..."
14/02/2005,Ciro Gomes,93,Ciro Gomes,"Eu não queria que o mérito, claro, eu não queria..."
14/02/2005,Ciro Gomes,94,Bernardino Furtado,"Ministro, o senhor poderia falar lá dos projetos dos assentamentos na área do Castanhão, lá na área..."
14/02/2005,Ciro Gomes,95,Ciro Gomes,Estão andando muito bem.
14/02/2005,Ciro Gomes,96,Bernardino Furtado,"É, eu estive lá, eu vi."
14/02/2005,Ciro Gomes,97,Ciro Gomes,"Está andando muito bem, muito bem. O último problema que teve foi uma pequena invasão de 37 famílias e nós já estamos garantindo acesso para todos, 100%. Conosco é difícil, especialmente comigo."
14/02/2005,Ciro Gomes,98,Bernardino Furtado,Eu estive lá e vi.
14/02/2005,Ciro Gomes,99,Ciro Gomes,"Então você ter visto que o último episódio que foi uma invasão de 37 pessoas, de 37 pessoas, cuja garantia de terra está feita, os decretos publicados. Posso homenagear aqui o nosso velho e querido amigo Apolo. Deixa eu separar um pouco as coisas, e eu não posso deixar algumas, que são impertinentes a mim, mas funcionalmente eu me sinto obrigado a ponderar. Primeiro, eu não sou ministro do PT, eu apoiei o presidente Lula porque fui candidato à Presidência da República e perdi as eleições. O sistema eleitoral brasileiro é de dois turnos, como você sabe, então quando há dois turnos e alguém perde, democraticamente ele tem que tomar uma posição em relação aos dois que ficaram. Como eu queria uma ruptura para encerrar o período desastroso, que eu considero que foi o governo Fernando Henrique, eu apoiei o Lula. De lá para cá, eu, convidado não aceitei, mas o presidente me fez uma convocação muito comovente e eu achei que era minha obrigação, mesmo tendo diferenças, visões diferentes, experiências diferentes, mesmo tendo feito críticas, como eu fiz ao presidente, não a ele pessoalmente, mas a falta de proposta na data que eu considerava, eu hoje me sinto honrado de cooperar com o governo de um homem honesto, bem intencionado, que gosta do Brasil e que está se esforçando, depois de uma herança macabra, para consertar as coisas e há já bons resultados."
14/02/2005,Ciro Gomes,100,Apolo Heringer Lisboa,"Nós não queremos que ele tire o senhor, não, queremos só que o senhor mude de idéia."
14/02/2005,Ciro Gomes,101,Ciro Gomes,"Não, não. Deixa só eu ir ponderando, porque eu não sou ministro do PT."
14/02/2005,Ciro Gomes,102,Apolo Heringer Lisboa,Eu sei.
14/02/2005,Ciro Gomes,103,Ciro Gomes,Eu continuo com a mesma visão fraterna.
14/02/2005,Ciro Gomes,104,Apolo Heringer Lisboa,Nem do PPS.
14/02/2005,Ciro Gomes,105,Ciro Gomes,"Não, o negócio aí anunciou que eu fui desligado do PPS para cair na enganação do Roberto Freire, isso não existe, eu continuo no mesmo lugar onde eu estava."
14/02/2005,Ciro Gomes,106,Paulo Markun,"Só para citar, esta é a informação que está no site do PPS."
14/02/2005,Ciro Gomes,107,Ciro Gomes,"Pois é, isso é mentira, é só ler o artigo 36 do estatuto. Mas isso é uma questão irrelevante, vamos falar de coisa séria. Segunda coisa que eu não posso deixar de ponderar, a ministra Marina Silva se recusa de conversar. Isto é de uma injustiça, de uma injustiça, é de uma maldade..."
14/02/2005,Ciro Gomes,108,Apolo Heringer Lisboa,Mas é verdade.
14/02/2005,Ciro Gomes,109,Ciro Gomes,"Olha, não diga isso, Apolo, você está cometendo uma injustiça contra uma pessoa que tem sofrido as mais violentas pressões, dos interesses mais duros do Brasil, mais poderosos do Brasil. Ela hoje deve estar mergulhada nessa confusão desse assassinato deplorável da freira lá no Pará, ela já esteve com o comitê de bacias. Esse diálogo que você está reclamando, eu convoco em público, marque a hora e o lugar, porque com o comitê de bacias nós já estivemos muita vezes, estamos negociando há dois anos. É evidente que quem recruta as pessoas para ir conversar conosco são eles. Mas pergunta ao doutor Zé Carlos, presidente do comitê de bacias, se alguma vez ele quis conversar conosco."
14/02/2005,Ciro Gomes,110,Apolo Heringer Lisboa,O presidente Lula participaria também?
14/02/2005,Ciro Gomes,111,Ciro Gomes,"O presidente Lula tem o momento de falar e falará com quem necessário for. O presidente Lula nunca se recusou, caramba, espera aí um pouquinho. Nós estamos discutindo aqui e parece que não estamos na frente do povo brasileiro. Aqui quer se empurrar, goela abaixo, que está sobrando água no Nordeste semi-árido. Pelo amor de Deus, Deus nos proteja de uma seca continuada de três anos para a gente não ter que demonstrar de novo, na prática. Isso que é uma evidência científica, a característica do semi-árido, a característica do semi- árido... mas o problema de você ter reservação depois de um ciclo de cheia de 30, 35 bilhões de coisas..."
14/02/2005,Ciro Gomes,112,Apolo Heringer Lisboa,Tem mais do que Israel.
14/02/2005,Ciro Gomes,113,Ciro Gomes,"Não dá segurança, espera um pouquinho, agora quem está interrompendo é você, Apolo. Mas isso não é evidência, pelo amor de Deus, nós podemos discutir cientificamente, mas eu sou de lá. Então, de alguma forma, eu fico indignado, porque isso devia ser pacífico entre os brasileiros que não estão doentes de egoísmo, devia ser pacífica a percepção de que há milhões de brasileiros na miséria mais aguda por mil problemas: concentração fundiária, coronelismo político, corrupção, indústria da seca, mas essencialmente falta de água."
14/02/2005,Ciro Gomes,114,Apolo Heringer Lisboa,Na própria bacia.
14/02/2005,Ciro Gomes,115,Ciro Gomes,"Falta de água, falta de água, isso é uma questão concreta. Evidente que nós podemos dizer: “tem que otimizar”, eu não falei isso aqui? Está se desperdiçando 80% por vertimento e por evaporação, 80%, mas por quê? Porque os açudes são mantidos o mais cheio possível, porque ninguém sabe se o ano que vem será seco ou cheio. Ao manter a barragem o mais cheia possível por insegurança hídrica, a evaporação é de dois mil milímetros por ano. Como chove, ainda que irregularmente, para as culturas é ruim, pode ser uma seca, mas chove alguma coisa, os açudes são meio cheio, chove, verte precocemente. Esse projeto não precisa bombear para produzir os seus efeitos em 100% do tempo, por quê? Porque você elimina essa insegurança hídrica e nós estamos falando de 12 milhões de pessoas. Você, Apolo, você preside comitê de bacias do rio das Velhas, o maior vetor de degradação da bacia do São Francisco é o rio que você dirige. Recolhe afluentes in natura de Belo Horizonte, recolhe afluentes da siderurgia de Belo Horizonte e está em um processo de recuperação agora com a nossa cooperação."
14/02/2005,Ciro Gomes,116,Apolo Heringer Lisboa,Com a meta 2010.
14/02/2005,Ciro Gomes,117,Ciro Gomes,"Com a nossa cooperação. O senhor seja honesto, você esqueceu de dizer isso para as pessoas."
14/02/2005,Ciro Gomes,118,Apolo Heringer Lisboa,Não chegou ainda.
14/02/2005,Ciro Gomes,119,Ciro Gomes,"As pessoas da bacia não têm culpa disso, mas quem desmatou as matas ciliares não foram os potiguares, não foram os paraibanos, não são hoje os paraibanos. Caramba, falta água ou não falta água em Campina Grande? Pelo amor de Deus, cavalheiros, somos todos brasileiros, nós podemos discutir tudo honestamente, honestamente, de boa-fé, porque se tiver algum defeito nesse projeto eu me retiro dele, o presidente Lula manda cancelar. Agora, não dá para ficar: “Porque o presidente Lula tem paciência para falar com os banqueiros e não fala com a gente”. Com quem você quer que ele fale? Com quem você quer? Indica a hora e o local que nós vamos conversar."
14/02/2005,Ciro Gomes,120,Apolo Heiriger Lisboa,Eu gostaria de ter uma conversa com o senhor e o senhor Lula.
14/02/2005,Ciro Gomes,121,Ciro Gomes,"Por que não pede? Eu me ofereci para mediar a conversa que desejarem, a conversa que desejarem."
14/02/2005,Ciro Gomes,122,Apolo Heringer Lisboa,Eu acho importante buscar um diálogo.
14/02/2005,Ciro Gomes,123,Ciro Gomes,"O comitê de bacias, para a gente ter clareza de novo, vou voltar aqui a ter calma, pelo que eu estou me lembrando aqui o drama que eu vivi em Fortaleza sem água. Eu tive que construir um canal, tendo feito uma barragem, a barragem Plínio Pompeu, chamada Pacajus. Eu tinha construído no ano anterior para prevenir o problema da falta de água em Fortaleza. Estava pronta a barragem, três anos seguidos de seca e a barragem ficou lá com a parede sem uma gota, aconteceu agora, há 10 anos atrás, em Fortaleza, por isso que eu sou comovido com esse assunto. Não sou teórico disso não, não sou ideologista, sou bem intencionado, sou honesto, eu tenho respeito por todas as pessoas que estão inseguras em Sergipe, por quê? Porque sofreram a depredação do rio, é verdade, agora chega de conversa fiada sobre esse assunto. Nós vamos agir, nós vamos revitalizar o rio São Francisco, agora, 27 milhões já estão aplicados, 621 milhões já estão contratados."
14/02/2005,Ciro Gomes,124,Apolo Heringer Lisboa,"Apresenta o plano da revitalização, ministro."
14/02/2005,Ciro Gomes,125,Ciro Gomes,"Está pronto: www, por favor, anota aí, por favor. Pára de repetir estes jargões, pára de repetir esses jargões que você não demonstra um centavo de verba distribuída para prefeito e deputado neste assunto, você não demonstrou isso. Por favor, Apolo, vamos voltar calmo aqui e discutir com mais respeito, o respeito e a amizade que nós temos, suas tradições de lutas e de progressismo, não precisa destes argumentos que o desqualificam. Você não demonstra que saiu um centavo do governo Lula da revitalização do rio São Francisco para prefeito e deputado, desculpe, meu companheiro, você preside o rio das Velhas, não está em processo de revitalização? Responda sim ou não."
14/02/2005,Ciro Gomes,126,Apolo Heringer Lisboa,Com que verba?
14/02/2005,Ciro Gomes,127,Ciro Gomes,"Desculpa, sim ou não?"
14/02/2005,Ciro Gomes,128,Apolo Heringer Lisboa,Com que verba?
14/02/2005,Ciro Gomes,129,Ciro Gomes,"Você está querendo falar que é pouco, o dinheiro?"
14/02/2005,Ciro Gomes,130,Apolo Heringer Lisboa,"O que é revitalização, ministro?"
14/02/2005,Ciro Gomes,131,Ciro Gomes,Você quer dizer que é pouco dinheiro?
14/02/2005,Ciro Gomes,132,Apolo Heringer Lisboa,O que é revitalização?
14/02/2005,Ciro Gomes,133,Ciro Gomes,"Revitalização, eu vou lhe dizer o que é, despoluir e o rio das Velhas é o maior vetor de poluição."
14/02/2005,Ciro Gomes,134,Apolo Heringer Lisboa,Tirar esgoto do rio.
14/02/2005,Ciro Gomes,135,Ciro Gomes,Está ou não está sendo executado o projeto do rio das Velhas?
14/02/2005,Ciro Gomes,136,Apolo Heringer Lisboa,Está sendo feita...
14/02/2005,Ciro Gomes,137,Ciro Gomes,"Fale honestamente. O rio das Velhas vai ser o primeiro rio revitalizado na bacia do São Francisco. Você o preside e sabe que há projeto, está sendo executado, está sendo executado o plano diretor. Você pode se queixar, e tem a minha solidariedade, eu só passei 27 milhões e é muito pouco, mas esse ano tem 100."
14/02/2005,Ciro Gomes,138,Apolo Heringer Lisboa,Eu não recebi.
14/02/2005,Ciro Gomes,139,Ciro Gomes,"Não é para você, rapaz, o comitê de bacias não é executivo, você sabe disso, quem é executivo é o governo de Minas."
14/02/2005,Ciro Gomes,140,Apolo Heringer Lisboa,Nós não vemos esse dinheiro para cobrar de ninguém.
14/02/2005,Ciro Gomes,141,Ciro Gomes,"Desculpa, desculpa, mas o comitê de bacias no Brasil é uma experiência muito nova e eu acho que vocês estão trocando um pouco o alho por bugalhos. Você quer o quê, que eu passe o dinheiro para o comitê de bacias? Você sabe que não pode."
14/02/2005,Ciro Gomes,142,Apolo Heringer Lisboa,Não é isso.
14/02/2005,Ciro Gomes,143,Ciro Gomes,"Você sabe que não pode. Você sabe que não pode, sabe que não pode. Sabe que eu não posso passar dinheiro para você."
14/02/2005,Ciro Gomes,144,Apolo Heringer Lisboa,"Eu sei, sim."
14/02/2005,Ciro Gomes,145,Ciro Gomes,"Então, eu passei os 27 milhões, passei os 27 milhões para o governo do estado de Minas."
14/02/2005,Ciro Gomes,146,Apolo Heringer Lisboa,"Com que rubrica, com que projeto?"
14/02/2005,Ciro Gomes,147,Ciro Gomes,Da revitalização do São Francisco.
14/02/2005,Ciro Gomes,148,Apolo Heringer Lisboa,E qual é o plano?
