DATA,ENTREVISTA,ORDEM,LOCUTOR,FALA
14/02/2005,Ciro Gomes,149,Ciro Gomes,"É o começo do projeto, é o começo, porque nós temos que fazer planos, temos que fazer projeto de reposição, tem já viveiro de mudas, aí as pessoas dizem: “Ah, só são 200 mil mudas no primeiro momento”. Humildemente eu reconheço, é muito pouco, mas são só as primeiras 200 mil para repor mata ciliar. Mas esse ano vamos multiplicar por cinco o valor."
14/02/2005,Ciro Gomes,150,Apolo Heringer Lisboa,"É, a gente tem que discutir melhor."
14/02/2005,Ciro Gomes,151,Ciro Gomes,"Cinco o valor, 86% do projeto da revitalização é saneamento básico, já contratamos. O ministro Olívio Dutra, por prioridade do presidente Lula, determinou, para dar conteúdo prático a essa conversa fiada de 100 anos de destruição do São Francisco enquanto se fala em revitalização, né? Clareza, 621 milhões de reais já estão contratados."
14/02/2005,Ciro Gomes,152,Bernardino Furtado,Vocês estão pendurando saneamento básico na revitalização.
14/02/2005,Ciro Gomes,153,Ciro Gomes,"Escuta, você sabe o que é revitalização? Eu vou responder, explica para ele, Apolo, explica para ele o que é 86%..."
14/02/2005,Ciro Gomes,154,Bernardino Furtado,Estão pendurando a verba que já existiu...
14/02/2005,Ciro Gomes,155,Ciro Gomes,"Olha aqui, 86% do projeto de revitalização é saneamento básico, só para a sua informação."
14/02/2005,Ciro Gomes,156,Apolo Heringer Lisboa,"Eles estão canalizando muitos rios lá, estão canalizando córregos."
14/02/2005,Ciro Gomes,157,Ciro Gomes,"Pelo amor de Deus, eu vou explicar para quem está fora. Desculpa, desculpa, espera um pouquinho, desculpa. Revitalização é um projeto complexo que tem a ver com despoluição do rio, que tem a ver com assoreamento, desassoreamento, tem a ver com mata ciliares destruídas para serem repostas, tem a ver com unidade de conservação, tem a ver com proteção de nascente. Cada um desses elementos é uma rubrica do projeto, elas todas somadas fazem o projeto de revitalização. Porém quando a gente vai ler o valor, 86% do que é necessário fazer para revitalizar o rio São Francisco trata-se do saneamento ambiental. Por isso, nós já contratamos 621 milhões de reais, dando prioridade nos contingenciamentos, nas dificuldades de recursos, à bacia do São Francisco."
14/02/2005,Ciro Gomes,158,Apolo Heringer Lisboa,Qual é do projeto?
14/02/2005,Ciro Gomes,159,Ciro Gomes,"Está no Ministério da Integração, você me interrompeu, eu vou te dar agora o endereço, se você quiser eu te mando por carta, mas pode ser qualquer brasileiro: www.integracao.gov.br, lá tem uma janela, São Francisco, e não é um janela passiva, é uma janela ativa, lá você pode esculhambar... o plano de bacia que contempla esse vetor. Esses números são tirados do plano de bacias feito pelo comitê de bacias, meu querido, você precisa se atualizar na sua informação."
14/02/2005,Ciro Gomes,160,Apolo Heringer Lisboa,Eu estou muito bem informado.
14/02/2005,Ciro Gomes,161,Ciro Gomes,"Me desculpe, mas me parece que está devassado com essa informação, com todo respeito."
14/02/2005,Ciro Gomes,162,Apolo Heringer Lisboa,Depende a visão das coisas.
14/02/2005,Ciro Gomes,163,Ciro Gomes,"O comitê de bacias reuniu-se, reuniu-se em diversas reuniões preparatórias, inclusive em Pirapora, lá em Minas Gerais, para discutir plano de bacias. É ou não é verdade, Apolo? Você estava presente, caramba, tu estavas presente, caramba, foi aprovado o plano de bacias com o seu voto, cara, aprovado com o seu voto, cara. Foi aprovado o plano de bacia com o seu voto, cara."
14/02/2005,Ciro Gomes,164,Apolo Heringer Lisboa,O plano diretor não é respeitado pelo governo.
14/02/2005,Ciro Gomes,165,Ciro Gomes,"O plano de bacias é, definitivamente, respeitado pelo governo, não há uma transgressão em absolutamente nada. Nós temos uma divergência, é que o plano de bacias previu a possibilidade de transpor os 26 metros cúbicos, um comitê de bacias aprovou condicionando ao uso humano e à dessedentação animal e, extrapolando as suas atribuições, pretende lançar um veto à outra rubrica. Nós não estamos desrespeitando, aliás, nós levamos o projeto à hierarquia do sistema e ao Conselho Nacional de Recursos Hídricos. Nós levamos e passamos ali discutindo, cada membro com sua cópia, cada membro instado a dizer qualquer coisa que quisesse dizer, cada membro com direito de fazer qualquer ponderação que tivesse que fazer, para que a gente faça disso uma coisa honesta. Aquele teu apelo quero repetir eu, vamos sentar e conversar, diz agora para o povo brasileiro qual é o defeito do projeto, porque o projeto não deve ser feito em uma frase? Diga em uma frase."
14/02/2005,Ciro Gomes,166,Apolo Heringer Lisboa,"Não é prioridade transposição, a gestão..."
14/02/2005,Ciro Gomes,167,Ciro Gomes,"Para você que está em cima do rio das Velhas, para você que está em cima dos rios das Velhas. Para quem está na seca do Nordeste setentrional, isso é uma falta de respeito, e eu sei que você não tem vontade de fazer."
14/02/2005,Ciro Gomes,168,Apolo Heringer Lisboa,"A gestão das águas é que é o problema, não há gerenciamento."
14/02/2005,Ciro Gomes,169,Ciro Gomes,"Agora vai ter, agora vai ter. O projeto contempla uma nova matriz de gestão, porque essa crítica sua não tem razão."
14/02/2005,Ciro Gomes,170,Apolo Heringer Lisboa,As elites nordestinas construíram os açudes na suas terras para usufruir daquilo.
14/02/2005,Ciro Gomes,171,Ciro Gomes,"Desculpe, desculpe. Você está cometendo uma heresia histórica, quem construiu e reconstruiu o Orós foi o grande mineiro Juscelino Kubitschek, que até hoje é venerado no Nordeste e, na área de influência do açude Orós, o rio Jaguaribe está perenizado artificialmente. Ali está uma demonstração de como é possivelmente subverter as dificuldades semi-árido por obra de um homem de grande estatura, brasileiro, antes de ser paroquial, generoso antes de ser egoísta. É seu conterrâneo e, para mim, o maior de todos, Juscelino Kubitschek. Não foi hierarquia nenhuma, foi Juscelino. Fez uma vez, arrombou, porque naquele ano, criticamente, foi uma cheia, e ele foi lá e fez de novo. Como fez também o Araras, lá no estado de Ceará."
14/02/2005,Ciro Gomes,172,Paulo Markun,"Ministro, vamos mudar de assunto neste último bloco, vamos falar de política. Neste momento está acontecendo a votação para a presidência da Câmara dos Deputados. Tem 498 parlamentares presentes, é uma votação muito lenta. Para o telespectador do Roda Viva saber, a apuração só vai acontecer depois do término do nosso programa, ainda não se sabe sequer se vai haver segundo turno. Mas isso é pretexto para falar de política. Eu queria começar, por dever de ofício, em relação a uma notícia publicada em junho do ano passado em que o senhor foi condenado a indenizar a família do ministro Henrique Santillo por danos morais em função de uma declaração aqui no programa Roda Viva em que o senhor disse que o Henrique Santillo era corrupto."
14/02/2005,Ciro Gomes,173,Ciro Gomes,"Vamos só ter clareza, porque isso é grave e ele já morreu. Eu nunca disse que ele era corrupto, só corrigindo. Bom, a frase é outra e nem vou reproduzir aqui. Só tenha clareza a isso por respeito a ele, à família dele, e por alguém que não está mais aqui, mas não foi isso."
14/02/2005,Ciro Gomes,174,Paulo Markun,Eu assisti a fita.
14/02/2005,Ciro Gomes,175,Ciro Gomes,"Tem que ter clareza, porque senão seria uma agressão repetida a quem não pode mais responder."
14/02/2005,Ciro Gomes,176,Paulo Markun,"Perfeito, muito bem, também acho que é prudente, mas de todo modo, quando a notícia foi publicada, o senhor disse que não havia tido conhecimento da sentença definitiva da condenação e, portanto, não poderia comentar. Como eu já sei que o senhor teve a notícia da sentença, eu queria saber..."
14/02/2005,Ciro Gomes,177,Ciro Gomes,"Eu continuo sem razão nenhuma para comentar, porque o Henrique Santillo morreu, e eu tenho profundo respeito pela memória dele, pela memória e pelo sofrimento da sua família e isso não é assunto para tratar."
14/02/2005,Ciro Gomes,178,Paulo Markun,Perfeito.
14/02/2005,Ciro Gomes,179,Maria Cristina Fernandes,"Ministro, quando o senhor assumiu o governo, assumiu o Ministério, o senhor disse que não estava preparado, à época em que o senhor foi candidato, para ser presidente da República. Que experiência o senhor acha que o senhor está tendo agora no Ministério que o credenciará a voltar a disputar esse cargo em 2006, 2010. O que nesse governo estaria credenciando o senhor a pleitear isso?"
14/02/2005,Ciro Gomes,180,Ciro Gomes,"Nada me credencia, a não ser uma vontade que eu tenho, evidentemente, de aprender, de aprender sempre, todo dia, aprender com os meus erros. Não foram poucos os que eu cometi, nenhum deles freqüenta o campo moral, isso eu posso andar com tranqüilidade no Brasil inteiro. Sou tratado com muito respeito no país, mas eu acho que, pelo menos, apresentei uma visão muito tosca da mudança que eu ansiava para o Brasil. Acho que eu calculei mal, e nisso eu fui pouco humilde, eu acredito, e isso foi uma lição que aprendi, foi uma lição para mim. O presidente Lula foi o oposto, absolutamente sábio e humilde, quando percebeu o tamanho do antagonismo, quando escreveu aquela Carta aos Brasileiros, que eu chamei carta aos banqueiros imediatamente porque eu fiquei indignado. Mas eu hoje vejo que a mudança pode ser buscada com um pouco mais de tato, um pouco mais de paciência, às vezes muitas pessoas vêem nisso uma contradição, mas eu não vejo, eu estou aprendendo todo dia."
14/02/2005,Ciro Gomes,181,Maria Cristina Fernandes,O senhor é candidato a que em 2006?
14/02/2005,Ciro Gomes,182,Ciro Gomes,Acho que a nada.
14/02/2005,Ciro Gomes,183,Fernando Rodrigues,"Na sua campanha a presidente, na última vez, uma das suas dificuldades foi..."
14/02/2005,Ciro Gomes,184,Ciro Gomes,A Folha de S. Paulo.
14/02/2005,Ciro Gomes,185,Fernando Rodrigues,"A Folha de S. Paulo nunca é um problema. Um dos problemas que o senhor teve durante a campanha foi a interpretação de certas declarações suas, consideradas muito intempestivas ou brutas por alguns, enfim, o senhor se considera hoje uma pessoa com auto-controle maior, como é que o senhor tem tratado isso pessoalmente?"
14/02/2005,Ciro Gomes,186,Ciro Gomes,"Eu sofri muito no fim daquela campanha. Eu sempre fiz campanha, a minha vida inteira, muito despreocupado com resultado. Fui deputado duas vezes, na primeira tinha 25 anos de idade e já tinha responsabilidade, não andava de bermuda em Fortaleza porque eu tinha que parecer um adulto e tal, fui prefeito com 29 anos de idade na quinta maior cidade brasileira."
14/02/2005,Ciro Gomes,187,Fernando Rodrigues,Mas hoje o senhor se considera uma pessoa mais controlada?
14/02/2005,Ciro Gomes,188,Ciro Gomes,"Eu estou muito mais maduro, vocês reparam, quando a câmera vem de cima, eu estou careca aqui e tal, isso é simbólico, claro, mas eu estou, estou aprendendo, aprendi muito, não foi ruim para mim."
14/02/2005,Ciro Gomes,189,Fernando Rodrigues,"Ministro, de 0 a 10, o senhor fica no PPS, sai e vai para onde?"
14/02/2005,Ciro Gomes,190,Ciro Gomes,"Olha, eu gostaria de ficar, mesmo que correndo risco de parecer imodesto, eu diria que o partido que hoje existe deve boa parte dele à minha militância. Me desagrada muito ver uma burocracia, sem compromisso com o país, praticar uma contradição de levar um partido como o nosso..."
14/02/2005,Ciro Gomes,191,[...],O senhor acha que o senador Roberto Freire foi incoerente?
14/02/2005,Ciro Gomes,192,Ciro Gomes,"Um minuto só, eu acho que brutalmente, mas eu não quero mencionar pessoas, não é o meu caso, eu acho que o papel do Partido Progressista é, mesmo percebendo as contradições do governo, colaborar para que ele funcione. Isso quer dizer tencionar por dentro, denunciar por dentro, como eu faço. Eu tenho toda liberdade para dizer o que eu quero e bem entendo na presença do presidente da República, meus colegas de equipe. Discutimos o destino do Brasil, os rumos, disso, daquilo ou qualquer assunto e, uma vez tomada a posição do governo, meu papel é cooperar para que dê certo, ainda que a minha posição não esteja prevalecendo. Isso que é o papel grave de um militante progressista no país hoje, se não nós vamos ficar com essa pseudo esquerda que, no passado, recusou apoio a Itamar. O PT recusou apoio ao Itamar naquela hora grave, é a mesma coisa, talvez agora com mais dramaticidade, porque é um operário, líder sindical, primeiro presidente da República que não é parido pelas oligarquias do país. Primeiro não, quer dizer, Juscelino tinha sido, eu sou admirador de Juscelino, Juscelino tem uma raiz de classe média pequena, modesta, e o Lula... Se isso não der certo, o povo vai descrer em si próprio, então tem que ajudar, quem gosta da democracia tem que ajudar, o resto é conversa mole. Quem quiser apóia Serra e Kassab, em São Paulo, para dizer que é progressista."
14/02/2005,Ciro Gomes,193,Paulo Markun,"Ministro, muito obrigado pela sua entrevista, agradeço aos nossos entrevistadores, e o Roda Viva continuará discutindo essas e outras questões relevantes do país sempre às segundas-feiras às dez e meia da noite. Uma boa semana e até segunda."
