DATA,ENTREVISTA,ORDEM,LOCUTOR,FALA
14/02/2005,Ciro Gomes,38,Maria Cristina Fernandes,"Sobre irrigação, eu só queria pensar, só para não voltar ao assunto, ministro. A irrigação existe no Nordeste há muitos anos, há décadas, como o senhor sabe, e uma das metas do projeto de transposição é a expansão da fronteira agrícola e também com irrigação. Eu queria saber o que vai mudar nesse projeto, nessa expansão da fronteira agrícola, no uso da irrigação que não foi capaz, nos projetos anteriores, de mudar a situação social, de mudar a situação fundiária e de mudar, substancialmente, a qualidade de vida do morador do sertão?"
14/02/2005,Ciro Gomes,39,Ciro Gomes,"A sua pergunta me permite encaminhar a resposta. Nós não estamos tratando, no projeto de integração de bacias, de irrigação. O projeto de integração de bacias é um projeto que tem, por objetivo estratégico, garantir segurança hídrica para 12 milhões de habitantes para o Nordeste setentrional, do Nordeste semi-árido, que hoje tem um terço do mínimo crítico para sustentabilidade da vida e constituindo-se grande pulso migratório que todo o Brasil conhece. Esse projeto é de segurança hídrica para 12 milhões de brasileiros. Lateralmente, e apenas lateralmente, ele pode permitir que se expanda a irrigação. Isso nos traz à resposta antecedente. Essa denúncia, nós fazemos. Nós, quando assumimos o Ministério da Integração Nacional, encontramos o Dnocs completamente desmantelado, a Codevasf completamente desmantelada e um conjunto de quase 300 mil hectares infra-estruturados para irrigação a um custo de bilhões de reais para a sociedade brasileira, produzindo mal e porcamente na maioria dos hectares. Tem bons exemplos, o projeto Nilo Coelho, por exemplo, em Pernambuco, tem uma boa resposta, mas você tem muitos projetos. Hoje, nós temos uma ficha de cada um desses projetos, mas eles não estão mais paralisados, nós já retomamos e concluímos a primeira etapa do projeto Tabuleiro do Torano, em Piauí; São Bernardo, Tabuleiro de Russas, no Ceará; Baixo Acaraú, também no Ceará, avançamos no Jaíba. Nós vamos colocar em operação, aproximadamente, mais 13 mil hectares no Jaíba, isso é um projeto prioritário lá em Minas Gerais que nós estamos fazendo. Esses 3 grandes projetos que estão inconclusos, eles estão em obra ainda, porque se fazia isso, iniciava um projeto e não concluía, como o Tabuleiro de Russas, faz 12 anos. O Baixo Acaraú faz 15 anos que se arrasta, e imediatamente se começava outro. No governo Lula, por ordem expressa do presidente, está proibido começar um projeto de irrigação, ou qualquer outro projeto, sem concluir aquilo que tem que ser concluído. E esses 3 grandes projetos: Baixio de Irecê, Salitre, na Bahia, e Pontal, em Pernambuco, nós temos um projeto, já orçado, de como retomar. Eles não estão paralisados, mas estão, de fato lento, porque não havia ainda uma equação definitiva para todos esses projetos, mas hoje há. Nós vamos aplicar 140 milhões de reais nesses projetos este ano."
14/02/2005,Ciro Gomes,40,Fernando Elias,"Esses orçamentos para esses projetos, esses aí que o senhor citou, esses 3, não seria o caso, já que eles estão encaminhados, já enfim, existe um projeto pronto, já foram aprovados, são aceitos pelas sociedades locais, investir prioritariamente neles ou pelo menos concomitantemente neles com o mesmo vigor que se faz com esse da transposição? E eu queria colocar um pouco de política nesse negócio todo. Possivelmente, esse projeto - a outra pergunta já junto para o senhor responder as duas - esse projeto são 700 quilômetros de canais, vão ser isso? 700 quilômetros de canais. Talvez seja a obra física mais visível do governo Lula, se ela vier a ser executada, é o caso de inferir ou não que o governo precisa de uma obra física para apresentar como uma marca do governo dele em uma região importante como o Nordeste. É por isso que existe essa insistência nesse projeto?"
14/02/2005,Ciro Gomes,41,Ciro Gomes,"Isso diminui gravemente a percepção, porque se houvesse uma motivação tão subalterna, há dezenas, para não falar em centenas, de possibilidades de grandes obras físicas que poderiam responder esse argumento sem essa delicada, porém respeitável, polêmica. Aliás, eu quero dizer aqui com muita tranqüilidade, porque eu já estudei, pude ver esse fenômeno no mundo, está por detrás de todo os experimentos de transposição que aconteceram no planeta em todas as épocas da história. Aqui está até muito séria, muito moderada e muito equilibrada. No Colorado, chegou-se a tanque nas ruas e eu espero que jamais isso seja necessário no Brasil, mas também lá a proporção de transposição era gigantesca. O rio Tajo, que é o mesmo Tejo quando passa da fronteira da Espanha para Portugal, tem uma transposição, na Espanha, de 60% da vazão. Teve tensões muito graves, enfim, e produz benefícios extraordinários. Então, é normal, não estamos discutindo, então reduzir isso num governo... O país está por fazer obras, o Brasil precisa fazer obras."
14/02/2005,Ciro Gomes,42,Fernando Rodrigues,O senhor quer que seja um cartão de visitas para o governo...
14/02/2005,Ciro Gomes,43,Ciro Gomes,"Cartão de visitas? Eu estou dizendo de novo, eu não posso aceitar, com o maior respeito e carinho, que se reduza uma coisa dessa dramaticidade. O que nós temos que discutir concretamente é o seguinte. Há ou não há milhões de brasileiros que estão sendo expulsos, quebrando sua família, expulsos de sua terra, migrando? Há ou não há um vasto campo do território brasileiro inviável economicamente?... Deixa eu responder, deixa eu responder, porque isso avilta, quer dizer, o governo vai fazer uma obra com essa polêmica, com essa dificuldade política quando podia fazer, sei lá, um viaduto, que ninguém reclama. Tem a Transnordestina, a Transnordestina custa mais do que isso. Nós estamos projetando para o Nordeste o biodiesel, nós estamos projetando a duplicação da 101."
14/02/2005,Ciro Gomes,44,Fernando Rodrigues,Quantas pessoas seriam beneficiadas com segurança hídrica?
14/02/2005,Ciro Gomes,45,Ciro Gomes,"12 milhões, 12 milhões."
14/02/2005,Ciro Gomes,46,Fernando Rodrigues,E esses projetos todos que estão paralisados ou semi paralisados se todos fossem retomados?
14/02/2005,Ciro Gomes,47,Ciro Gomes,"Se você deixasse eu encaminhar a resposta, eu já tinha chegado a isso. São projetos importantes, mas são projetos que beneficiam uma minoria de empresários, do que nada eu tenho contra. Só um pouco de clareza."
14/02/2005,Ciro Gomes,48,Fernando Rodrigues,A população local não vai ser beneficiada?
14/02/2005,Ciro Gomes,49,Ciro Gomes,"Desculpa. Claro que vai, quando você vê o que acontece em Petrolina, em Juazeiro, naquela região, em todos os lugares onde há projeto de irrigação com êxito médio, nem precisa ser um êxito retumbante, a qualidade de vida e o desenvolvimento humano, tudo melhora. Nós vamos continuar perseguindo isso, eu não estou antagônico a isso. A Bahia vai ver, o governador Paulo Souto, que é um homem muito sério, eu tenho por ele uma imensa estima, o máximo respeito, eu elenco o governador Paulo Souto como um dos melhores governadores do país, conheço a prática dele, compreendo o seu argumento contra, mas é um argumento que defasou na proporção em que o projeto, apesar do Bernardino não aceitar, mudou. Se antes não havia resposta e a sociedade imaginava, por média, que o rio não agüentava... por que a sociedade tem essa percepção? Porque o rio foi agredido e a maior agressão está no baixo São Francisco em função da cascata de barragens da Chesf, isso é verdade. Por favor, não me ponha do outro lado, porque eu estou deste lado."
14/02/2005,Ciro Gomes,50,Bernardino Furtado,"Ministro, quem garante que esses projetos de irrigação no Ceará e no Rio Grande do Norte vão atender aos pobres como forma de..."
14/02/2005,Ciro Gomes,51,Ciro Gomes,"Não mistura as coisas, não mistura as coisas, os projetos de irrigação, eles têm clareza."
14/02/2005,Ciro Gomes,52,Bernardino Furtado,70% vão para a irrigação...
14/02/2005,Ciro Gomes,53,Ciro Gomes,"Você vai me desculpar, deixa eu repetir. Projeto de irrigação é uma coisa, o objetivo de um projeto de irrigação é produzir, produzir, às vezes em larga escala, com baixa densidade de emprego. Quando uma cultura permanente como manga ou como graviola, isso é bom para o país, não é ruim. Mas isso é um objetivo que não pode ser colocado aqui, rivalizando com segurança hídrica. Campina Grande, que é uma das maiores cidades do Brasil, não tem água para a população beber. Fortaleza, durante um certo período, isso não faz 10 anos, acabou a água, não só a água. No Rio Grande do Norte, eu não falo de irrigação, explodiu um potencial de carcinicultura, de produção de camarão, e não tem água, isso é um problema concreto. Você tem a imigração acontecendo e a premissa do problema é falta de água, caramba. Agora, vamos falar de irrigação, isso não é uma coisa colidindo com a outra. O meu papel é sistematizar uma intervenção e maximizar os recursos para isso perfeitamente. Vamos aplicar, estou anunciando aqui, nos projetos de irrigação que estão aí inconclusos, 140 milhões de reais com o objetivo de colocar em produção 62 mil hectares, né?, no máximo em 24 meses. Isso tem uma ficha para cada um, é público para quem quer conhecer, eu pessoalmente estou indo ao Jaíba, porque é o primeiro, são 13 mil hectares estruturados..."
14/02/2005,Ciro Gomes,54,Fernando Rodrigues,"Jaíba, que é? Vale do Jequitinhonha?"
14/02/2005,Ciro Gomes,55,Ciro Gomes,"Jaíba é Minas Gerais. Tem 13 mil hectares infra-estruturados, canais principais, 20 bombas no ar, 10 bombas gigantescas contratadas sem produzir, mas nós encontramos isso, por favor, não é o governo Lula que produziu essa aberração, nós estamos tentando corrigir essa aberração."
14/02/2005,Ciro Gomes,56,Eduardo Nunomura,"Ministro, o senhor falou que vocês empoderaram o comitê de bacias. Pois bem, o comitê de bacias já se pronunciou publicamente que é contra a transposição, do projeto de interligação de bacias para fins que não sejam exclusivamente de abastecimento humano. O canal do eixo norte, ele prevê que seja feito para projetos de irrigação. De que adiantou empoderar o comitê de bacias se vocês não estão respeitando uma posição do comitê que é contrário..."
14/02/2005,Ciro Gomes,57,Ciro Gomes,"Vamos devagar com o andor. Primeiro, o comitê de bacias aprovou o plano de bacias. Aliás, foi feito junto. Então, o plano de bacias prevê os números, dá os números e prevê, garante, que tem uma disponibilidade de 360 metros cúbicos e demonstra que até hoje, em 500 anos, só se usaram, para uso consultivo, 91 metros cúbicos. O plano de bacias contém a projeção otimista de toda expansão de uso da água na bacia. Em 2025, essa projeção, no máximo, o plano otimista, estaria usando 262 metros cúbicos. O que quer dizer que o plano de bacia esclarece que, ainda que nós exacerbássemos o uso na bacia, ainda estaria sobrando 98 metros cúbicos, em 2025. O plano de bacias ainda propõe a questão do uso dentro ou fora da bacias, o comitê de bacias aprovou, em princípio. Extrapolado suas atribuições legais, porque quem tem a faculdade de outorgar água e definir os limites dessa outorga não é o comitê de bacias, é a Agência Nacional de Águas. Extrapolando, isso tem uma importância política. Nós estamos tentando mostrar o tempo todo que respeitamos, e respeitamos mesmo, fomos nós que empoderamos, nós que adiamos, nós que fizemos o plano de bacias em atendimento ao pleito do comitê de bacias, nós tivemos reuniões, lá em Penedo, do comitê de bacias, pessoalmente fomos lá."
14/02/2005,Ciro Gomes,58,Eduardo Nonomura,Como o senhor vê a posição do comitê de bacias que já se pronunciou contra essa transposição em termos de irrigação?
14/02/2005,Ciro Gomes,59,Ciro Gomes,"Não, não, eles fizeram a fala a favor."
14/02/2005,Ciro Gomes,60,Eduardo Nonomura,Não.
14/02/2005,Ciro Gomes,61,Ciro Gomes,"Estou falando para você que eles fizeram a fala a favor. Em um ponto eles extrapolam a sua atribuição legal, que isso é da Agencia Nacional de Águas, e aprovam 26 metros cúbicos por segundo. Ora, nós já mudamos a outorga em respeito a essas liberações e a única vazão segura que nós vamos permitir são, na outorga oficial mesmo, os 26 metros cúbicos que o comitê de bacias aprovou. Porém, pelo amor de Deus, pelo amor de Deus, eu falo isso para você e falo para opinião pública brasileira, e é pelo amor de Deus mesmo, porque eu já vi isso na carne o que significa. Se Sobradinho estiver vertendo a água vai ser desperdiçada no mar. É só nessa circunstância que nós queremos tirar o remanescente para guardar nos reservatórios que estão no Nordeste setentrional, para otimizar esse uso da água."
14/02/2005,Ciro Gomes,62,Eduardo Nonomura,"Como o senhor responde à questão, desculpe professor, de que em 40% do tempo Sobradinho verte, ou seja, 60% do tempo ele não vai verter e o projeto não vai funcionar 60% tempo na sua magnitude..."
14/02/2005,Ciro Gomes,63,Ciro Gomes,"Então, agora você passa a entender concretamente, esse não é um projeto de irrigação, é um projeto de segurança hídrica. Não importa se vai funcionar em 10, 20, 30, 100 ou 50%, porque o que nós queremos é que em 100% do tempo as necessidades para o abastecimento humano e dessedentação animal estejam garantidas. Se sobrar água, o que acontece em 40% do tempo, leva o excedente e guarda nos açudes do Castanhão, do Armando Ribeiro Gonçalves, no Boqueirão e aí se otimiza a água, mas evidentemente isso demonstra claramente o que eu estou querendo dizer."
14/02/2005,Ciro Gomes,64,João Suassuna,"Deixa só fazer aqui uma ponderação. Primeiro, o que eu vou falar aqui, vou falar em meu nome, não necessariamente é a posição da Fundação Joaquim Nabuco, que é a minha instituição. Eu quero deixar claro também que eu não faço política partidária. Estou envolvido, ministro, com as questões do São Francisco tem 10 anos. Tenho denunciado, ao longo desse período, a degradação que existe na bacia do São Francisco, que é exacerbada, é a questão do desmatamento, a questão do lançamento dos esgotos sanitários..."
14/02/2005,Ciro Gomes,65,Ciro Gomes,250 comunidades lançam seus esgotos sem tratamento na calha do rio.
14/02/2005,Ciro Gomes,66,João Suassuna,"Tenho levantado as questões e as limitações hídricas do São Francisco. Numa hora, ministro, em que não se falava em racionamento de energia, eu já escrevia sobre os apagões e eles aconteceram. Tenho falado dos riscos hidrológicos, principalmente os conflitos que existem entre gerar energia e irrigar, que são conflitos enormes já na bacia. Antes de tudo isso, ministro, eu tenho me posicionado contrário ao projeto da integração da bacia do São Francisco com as bacias do Nordeste setentrional, que é o nome que ele tem agora. Por que eu tenho me posicionado contrário? Porque eu julgo que o rio não dispõe mais dos volumes que vão ser demandados pelo projeto. Em agosto do ano passado a SBPC, Sociedade Brasileira Para o Progresso da Ciência, promoveu uma reunião em Recife onde reuniu 40 dos principais expoentes da hidrologia nacional. Esse pessoal passou três dias, em Recife, discutindo transferências de águas em grandes bacias com enfoque especial no projeto do governo. O que é que chamou a atenção nesse encontro? A gente... eu participei desse encontro e foi feita uma avaliação criteriosa dos volumes do São Francisco. Os técnicos entenderam que o São Francisco tem uma vazão alocável, hoje, de 360 metros cúbicos por segundo dos quais, pasmem, 335 já estão outorgados, ou seja, já há direito de uso. Significa dizer que o São Francisco só dispõe hoje, para uso consultivo, de 25 metros cúbicos por segundo, para um projeto que vai requerer uma vazão média de 65 metros cúbicos por segundo, podendo chegar, lá na frente, a 127 metros cúbicos por segundo. Então, qual foi a alternativa de quem está dirigindo o projeto? Começar a transposição com os 25, 26 metros cúbicos por segundo e a conta de chegada para os 65 metros cúbicos por segundo, retirar água da represa do Sobradinho, quando Sobradinho estiver com 94% de seu volume preenchido. Nós fomos atrás desse histórico volumétrico de Sobradinho. Sobradinho, em 10 anos, ele está cheio apenas em 4, então é 40% do tempo, né? Então veja, ministro, a pergunta que eu faço para o senhor... outra coisa, a gente tem que desmistificar essa idéia que vão retirar pouca água do rio São Francisco, não vão. Estão falando em 1% da vazão média, mas esse cálculo, ministro, tem que ser feito em cima da vazão alocável, que é a vazão que vai se retirar água para o uso consultivo. Se a gente fizer esse cálculo, isso está no relatório da SBPC, ministro..."
14/02/2005,Ciro Gomes,67,Ciro Gomes,Eu li o relatório.
14/02/2005,Ciro Gomes,68,João Suassuna,"Pois é, o senhor deve ter lido. Veja, se a gente fizer esse cálculo, o que vai retirar do rio pode chegar a 47% do volume alocável."
14/02/2005,Ciro Gomes,69,Ciro Gomes,"Por favor, por favor."
14/02/2005,Ciro Gomes,70,João Suassuna,Claro que é.
14/02/2005,Ciro Gomes,71,Ciro Gomes,Então deixa eu tentar responder...
14/02/2005,Ciro Gomes,72,João Suassuna,"Veja, para terminar, ministro."
14/02/2005,Ciro Gomes,73,Ciro Gomes,"Porque, tenho um profundo respeito por você, mas há alguns equívocos aí que não são compatíveis com o seu nível."
14/02/2005,Ciro Gomes,74,João Suassuna,"Mas veja, isso foi uma coisa discutida com 40 técnicos, hidrólogos desse país, e a gente tem que ter um certo respeito por isso."
14/02/2005,Ciro Gomes,75,Ciro Gomes,Eu tenho um profundo respeito.
14/02/2005,Ciro Gomes,76,João Suassuna,"Muito bem. Então veja, ministro, o senhor não acha que o orçamento do projeto é demasiadamente elevado? São 4,5 bilhões de reais, em uma primeira fase, para ser aplicado em um projeto que só vai operar, em sua plenitude, em apenas 40% dos casos, ministro, o senhor não acha isso uma coisa..."
14/02/2005,Ciro Gomes,77,Ciro Gomes,"Não, não, não. Há uma brutal incompreensão aqui. Primeiro, a reunião em Recife e o relatório, eu acompanhei. Volto a lhe dizer: o presidente Lula está de boa-fé, isso é importante a gente lembrar, quem está tomando essa iniciativa é o presidente Lula. O presidente Lula tem uma história, que permite a alguma pessoa que tem um pouco mais de dificuldade de entender as nossas divergências técnicas, vazão média etc, de só pelo menos por ilações dizer: “Será que o presidente Lula está louco de fazer um projeto maluco, inviável etc etc?” Por favor, isso não razoável, nós estamos dedicados com muita responsabilidade, nós estamos estudando isso há dois anos, nós estamos ouvindo, o que não desqualifica crítica nenhuma, nós estamos pedindo a crítica, porque é essa crítica que vai nos permitir fazer um melhor projeto. Então, não é desqualificação nenhuma, eu tenho um pouco história também, já, e prezo essa história, sou uma pessoa polêmica, andei aí discutindo o Brasil, mas ninguém nunca duvidou da minha seriedade, nem os mais violentos dos meus adversários jamais ponderaram isso. Eu ainda tenho 47 anos, planejo lutar aí pela causa pública brasileira por mais alguns anos, cabe aí pergunta se eu ainda sou candidato à Presidência da República, Fernando Rodrigues se coçou todo, mas só lembrei que fui candidato. Não sou maluco, por favor, isso não vale, vamos discutir o mérito. Aquela reunião da SBPC, eu fui procurar o professor Candotti, que era o presidente da SBPC, e ele me distinguiu com a visita, porque tinha outras pessoas com ele, e eu pedi a ele para discutir o projeto em cima de uma leitura equivocada, respeitável, porque o estudo mais equilibrado que eu vi entre os críticos foi esse que se produziu em Recife. Só para consertar, não foi a SBPC nacional, foi esse grupo aí em Recife que fez isso. E havia algumas leituras que foram reproduzidas aqui, João. Veja bem, quando a gente pondera que nós estamos pensando em transpor, para garantir segurança hídrica ao abastecimento humano, que é por qualquer juízo, mas por ordem constitucional, prevalente, prioridade para o uso da água, todo mundo entende. A água vai ser usada para irrigação, vai ser usada para a fábrica, vai ser usada para isso, aquilo, aquilo outro, para irrigação ou uso humano. Se faltar água, a Constituição brasileira, com muita sabedoria, garante que qualquer outra coisa será sacrificada para que o abastecimento humano se prevaleça. Então, nós separamos, para se garantir o abastecimento humano gasta-se o que for necessário, caramba, vamos ter clareza nisso. Nesse caso, nem é grande coisa não, essa água não será entregue gratuita, nós temos o custo de operação e manutenção, sai por 0,11 centavos o metro cúbico. São Paulo paga mais de um real por metro cúbico de água tratada, só para a gente ter uma proporção. Então, nós estamos seguros disso. Agora, 26 metros cúbicos é para garantir que nós não vamos fazer uma rivalidade, que não seria justa, de tirar a água que faltaria para a bacia irrigar, irrigando mais longe, não é razoável isso. Eu considero essa uma crítica razoável, então, só um minutinho, se não me deixarem responder, nós não vamos ter um argumento honesto e sério, como o Suassuna colocou, e ficaria sem resposta. Por que é 1%? Porque medida a vazão do rio por peritos, não foram do governo, foi do plano de bacia, nós chamamos os maiores experts do país, queremos fazer isso direito, a vazão de média de chegada na foz do rio é de 2850 metros cúbicos por segundo. Se nós vamos tirar 26 metros cúbicos seguro, para a população de Sergipe entender que o rio não vai desviado, porque tem muita gente que pensa isso, pela desonestidade de certos críticos, pensa isso, nem todo mundo é honesto como você. As pessoas dizem para o povo mais simples: “Olha, vão desviar o rio”, e a população fica indignada. Então, é o seguinte, para ter tranqüilidade: daqueles 2850 metros cúbicos médios que passam na foz, nós vamos tirar 1%. Não há como contestar esse argumento, aí você diz: “Mas a vazão alocada é de 360”. Ah, bom, quando nós falamos em 360, nós estamos ponderando, pelo comitê de bacias, pelo estudo, pelo plano de bacias que nós fizemos, de boa fé, está dito lá que o rio até hoje tem, de uso consultivo, até hoje, 91. Aí você tem toda razão, mas já tem outorga de 330. Ora, caramba, sabe quem é o beneficiário dessas outorgas? Veja a maluquice do nosso país quando se trata de política e de governo: o Ministério da Integração Nacional, o empreendedor do projeto da integração. Veja bem, por quê? Porque Salitre pede, Salitre mais Pontal, mais Baixio de Irecê pedem 130 metros cúbicos por segundo e essa outorga está dada. O projeto está lá, nós estávamos falando, há pouco, de inconcluso etc e tal, mas nós temos outorga. Tem um projeto Tourão, lá em Alagoas, que tem 200 pessoas, é pequena, mas é basicamente um grande empreendimento privado, que tem uma outorga de dois e está sacando 20, porque nós estamos fazendo também o controle e o cadastramento dos usuários. Não tinha, era completamente abandonado, anárquico, e vocês sabem, vocês denunciam isso. Ninguém vai me pôr do outro lado, nós vamos agora parar de falar que o rio está agredido, que o rio está sofrido, que o rio etc etc. Nós vamos fazer alguma coisa séria para fazer. Já tem 621 milhões de reais contratos de saneamento básico e 100 milhões reais, este ano, 27 foi o que eu consegui juntar o ano passado e as pessoas dizendo: “Só está produzindo 120 mil mudas"". Mas só dá para fazer uma coisa, mas são as primeiras 200 mil mudas para repor mata ciliar. Hoje ainda estão desmatando mata ciliar em Minas Gerais para fazer carvão, para guza, para siderurgia, nas barbas do meu amigo Zé Carlos, que é o secretário do Meio Ambiente de Minas Gerais e que é uma pessoa honesta e de boa fé, que é o presidente do comitê de bacias. É o secretário, não é o Ministério da Integração que pode ir lá e punir quem ainda está destruindo o restinho de mata que tem. Então, veja bem, essas outorgas malucas vão ser todas revistas, já estão sendo."
14/02/2005,Ciro Gomes,78,João Suassuna,"O senhor acha que isso vai ser possível, ministro?"
14/02/2005,Ciro Gomes,79,Ciro Gomes,"Não, já é possível, porque o outorgatário sou eu, como representante do Ministério da Integração Nacional, eu não preciso dessa água, entenda bem, não é necessário, foram feitos sem plano de bacias, sem estudo, sem nada."
14/02/2005,Ciro Gomes,80,João Suassuna,"Porque veja, ministro."
14/02/2005,Ciro Gomes,81,Ciro Gomes,"João, deixa eu te explicar, funcionava assim: “Eu vou fazer o projeto do Baixio de Irecê, eu quero 20 mil metros cúbicos, eu quero 10 mil metros cúbicos, eu quero 300 metros cúbicos”. Punha lá, pedia e acontecia."
14/02/2005,Ciro Gomes,82,João Suassuna,"Se eu fosse irrigante do vale do São Francisco, se tivesse um papel do governo me dando direito de uso..."
