|DATA|ENTREVISTA|ORDEM|LOCUTOR|FALA
92|02/01/2006|DBC Pierre|93|DBC Pierre|" Existem tipos diferentes de sobriedade. É uma pergunta interessante e não sei se posso responder por todos. No meu caso, eu cheguei ao fundo do poço por volta de 1990 ou 1991. E foi o final de um caminho que comecei por volta de 78, 79, talvez até antes, não sei. Eu fui a uma festa uma noite nos anos 70 e acabei em 1990 sem nada. Eu destruí relacionamentos, é impossível descrever, é um grande vazio. E o maior problema é que, no momento do colapso você ainda está apegado à sensação da intoxicação. É muito duro, a dor é parecida com o sofrimento que você passa quando perde um membro da família. É uma coisa que você tem que digerir durante anos e anos. É uma dor prolongada e você está ciente que tem todo o tempo do mundo, que mais nada pode acontecer com você, porque você já perdeu tudo e está ali sozinho só com a sua dor para despertar e tudo mais. Caipirinha? Isso é uma coisa fantástica, que existam drogas boas e drogas ruins. Eu posso beber muito e não virar alcoólatra. Eu fumo demais. Consegui direcionar toda a minha tendência ao vício para o cigarro, e espero que um dia eu consiga me livrar dele sem despertar outra coisa compulsiva terrível, tipo masturbação.  Se quiser chegar ao ""sujo, porém limpo"", ele não está tão livre das drogas. Ele é uma pessoa limpa. Pode me emprestar R$10 hoje que eu vou devolver rápido. Vou ser um amigo bem melhor do que já fui."
93|02/01/2006|DBC Pierre|94|Silvia Colombo| Peter, você conta que quando você ganhou o prêmio, mudou sua vida do dia para noite. Até outro dia escritores tinham uma vida solitária, não tinham que fazer verdadeiro road showspara promover os seus livros. Como é que você vê essa pressão do mercado hoje para vir até uma bienal do livro no Rio, dar entrevistas para vários cadernos culturais. Como é isso para você? Como você concilia isso com ser escritor?
94|02/01/2006|DBC Pierre|95|DBC Pierre|" Eu levei um tempo e isso faz parte da sua pergunta também. Uma das coisas que descobri quando finalmente tive meu colapso pessoal, que eu chamo de “o final da minha juventude"", uma das lições foi que meus instintos estavam errados. Somos ensinados a seguir os instintos, mas se você está intoxicado seus instintos estão errados. E uma das coisas que aprendi, que tem sido muito útil, é não agir, quando estou absolutamente... a não ser que seja absolutamente necessário, não aja, observe. Siga em frente e veja que acontece, não faça movimentos repentinos, nem vá nesta direção ou naquela. Observe as coisas, seja paciente. É muito recente ainda, meu livro saiu faz menos de um ano e por isso estou observando. Foi uma lição rápida sobre como funciona o mercado editorial. Tem sido uma época de muita excitação - respondendo sua pergunta - não dá para fazer as duas coisas, preciso ficar em casa escrevendo. Estava impossível, eles mandaram helicópteros até minha casa e eu tive que enfrentar uma grande publicidade imediatamente após receber o prêmio, e tenho feito o melhor para observar, respeitar e agradecer minha boa sorte. Fui a vários lugares e agora, exceto o Brasil, que é um caso especial, eu parei de fazer isso. Agora quero ficar em casa escrevendo. Foi uma agradável pausa na minha vida, foi uma ""vírgula"" entre uma fase e outra."
95|02/01/2006|DBC Pierre|96|Maria Elisa Cevasco| Pierre, e você está escrevendo um livro novo, é isso? Você está escrevendo um novo romance?
96|02/01/2006|DBC Pierre|97|DBC Pierre| Sim estou.
97|02/01/2006|DBC Pierre|98|Maria Elisa Cevasco| Ou você está escrevendo uma adaptação para o cinema do Vernon God Little?
98|02/01/2006|DBC Pierre|99|DBC Pierre| Não, estou terminando um segundo romance. Não poderia me envolver com o roteiro de Vernon, levaria uma eternidade. Porque a história, mesmo que você tenha escrito, eles podem mudar em 10 anos, não poderia me envolver com isso. Estou terminando o segundo romance no momento.
99|02/01/2006|DBC Pierre|100|Paulo Markun| Esse segundo livro, se eu li certo – porque depois da informação que você me deu na pergunta anterior, eu fico em dúvida – fala de um americano envolvido com uma russa que conheceu na internet e que discute um pouco o papel dos dólares no mundo e da globalização, é isso ou está tudo errado? 
100|02/01/2006|DBC Pierre|101|DBC Pierre| Não. É um inglês, é bem complicado. Se eu explicar a trama, posso revelar a surpresa. Ele fala de um adulto sossegado da classe média européia. E a metáfora é a globalização, nesse caso. É a história de um homem que arruma uma noiva russa na internet, porque ele é idiota e preguiçoso para transar no país dele, e porque ele acha que o resto do mundo está esperando e implorando que ele venha com dólares comprar uma camiseta do Brasil e os últimos acessórios. Ele acha que o mundo vai cair aos seus pés. Na história ele descobre que a mulher é muito mais durona, inteligente e esperta que ele.
101|02/01/2006|DBC Pierre|102|Paulo Markun| As mulheres vão adorar.
102|02/01/2006|DBC Pierre|103|DBC Pierre| Com certeza. E é a verdade. É uma pequena metáfora do nosso ponto de vista. Nós vivemos achando que vamos consertar o resto do mundo, que vamos fazer isso e aquilo. Mentira. O resto do mundo é muito mais esperto do que imaginamos. Estão lá sentados esperando por nós.
103|02/01/2006|DBC Pierre|104|Cassiano Alec Machado| Pierre, você falou uma vez para mim, quando a gente fez a entrevista, você disse que tinha um plano de também escrever um livro que passava pelo Brasil. Eu queria saber, você já mencionou aqui caipirinha e aqui no intervalo você falou também Kelly Key , que você já conheceu Kelly Key, a cantora, eu sei que você foi ontem no baile funk também. Queria saber se essas coisas todas entrariam nesse seu romance, se você realmente pretende escrever um romance que passe pelo Brasil ou se isso era uma brincadeira?
104|02/01/2006|DBC Pierre|105|DBC Pierre| É a primeira vez que venho ao Brasil. Eu sempre quis vir, por vários motivos. Esses são os meus primeiros dias aqui, tive muita sorte. Principalmente com Ana Lima, que está atrás de você. O pessoal da minha editora providenciou para que eu não visse nada turístico, para que eu visse eventos brasileiros verdadeiros, tem sido fantástico. E eu tinha... Voltando a Vernon, foi um livro que aconteceu espontaneamente, eu nunca tinha pensado nele. No que sempre pensei e gostaria de fazer é um livro que tivesse alguma passagem aqui, porque você nunca... a não ser no filme do James Bond ou algo assim, acho que não foi usado da maneira que eu gostaria de usar. É óbvio que eu não poderia escrever um romance brasileiro, mas poderia trazer um estrangeiro para cá no livro e armar alguma trama. Isso iria ser fantástico, uma excelente desculpa para passar uns meses aqui sentado, vendo como tudo funciona. Há muito interesse pessoal envolvido nisso.
105|02/01/2006|DBC Pierre|106|Jayme Spitzcovsky| Agora, Peter, o próximo livro sobre o qual você está se debruçando, você mencionou a história da noiva russa e do cidadão europeu que a conheceu via internet e quer trazê-la por conta dos dólares. Essa história é baseada numa experiência real sua? 
106|02/01/2006|DBC Pierre|107|DBC Pierre|" Preciso confessar que fui uma noiva na internet  e tentei fazer esse livro bem diferente do Vernon. Eu estava muito ciente de que poderia haver a possibilidade de eu reescrever Vernon como um segundo romance. Alguém me disse que existe esse perigo quando você é um romancista novo, você investe pedaços da sua vida no livro e, quando vai escrever o segundo livro, mesmo subconscientemente, você usa a mesma dinâmica e reescreve a mesma coisa. Eu estava bem consciente disso e tentei escrever uma coisa bem diferente. Este é na terceira pessoa, tem personagens adultos e fala de uma coisa que eu não vivenciei, noivas russas, coisa e tal. Tinha que ir fazer pesquisas nos lugares, achar correspondentes. Em outras palavras, a parte mais fácil de Vernon para mim foi a voz e o personagem, e muita gente na Inglaterra disse que gostou disso no livro. Isso fez com que eu me sentisse levemente como se tivesse deixado algo pelo caminho. Porque achei muito fácil escrever e queria passar pelo exercício de escrever o que chamo de ""livro padrão"": na terceira pessoa, desenvolver um tema que eu decidi escolher e ter a disciplina de colocar tudo isso junto, etc."
107|02/01/2006|DBC Pierre|108|Jayme Spitzcovsky| Agora, você falou que fez pesquisas sobre as noivas na internet, em particular sobre as russas, é isso? Até onde você chegou nessa pesquisa?
108|02/01/2006|DBC Pierre|109|DBC Pierre| Eu fui até a região do Cáucaso recentemente. Estive lá e ainda havia guerras na região do Cáucaso. E fui com a organização Médicos Sem Fronteiras que tem unidades hospitalares e dão apoio psicológico por lá. Foi incrível. Eu não fiz sexo com nenhuma delas, não cheguei a tanto. Mas para entender a dinâmica o suficiente para escrever os detalhes da cultura, se é que me entende, e para ver como essa coisa funciona, é uma grande indústria. Tem muitas noivas russas na internet. E grande parte disso é um golpe, é falso; em grande parte, é verdade. Fui tentar entender isso para detalhar no livro.
109|02/01/2006|DBC Pierre|110|Paulo Markun| Tem muito de ficção na internet obviamente?
110|02/01/2006|DBC Pierre|111|DBC Pierre| Sim, tem.
111|02/01/2006|DBC Pierre|112|Paulo Markun| Para finalizar, a última pergunta. Eu imagino que alguém que escreve o primeiro livro, consegue publicar, ganha o maior prêmio de literatura da Inglaterra, torna-se um sucesso da noite para o dia, deve tremer nas bases quando vai escrever o segundo livro, deve ficar preocupado em saber se vai funcionar. Você está confiante?
112|02/01/2006|DBC Pierre|113|DBC Pierre| Não estou pensando nisso.  Não estou pensando nisso. Claro que há expectativas. Acho muito importante para mim ignorá-las completamente e ficar em casa e dar o melhor de mim. Também estou olhando para a estrada mais longa. Eu quero, depois de 7, 9, 10 ou 15 livros, um Pulitzer . Só preciso aprender a fazer o que posso fazer e absorver isso. Tenho tido muita sorte nos últimos anos. E quero ter sorte todo o dia.
113|02/01/2006|DBC Pierre|114|Paulo Markun| Claro. Muito obrigado, Peter, pela sua entrevista, obrigado aos nossos entrevistadores e a você que está em casa.
