|DATA|ENTREVISTA|ORDEM|LOCUTOR|FALA
48|02/01/2006|DBC Pierre|49|Cassiano Alec Machado|" Pierre, uma das coisas que salta aos olhos do seu livro, que me chama muito a atenção, que chamou atenção dos críticos no mundo inteiro, é que como você não vinha desse métier da literatura, você criou uma linguagem muito fresca, você escreve de uma forma muito original. Embora lembre um pouquinho livros como O apanhador no campo de centeio  do  Salinger  e coisas assim, parece que você criou uma linguagem realmente própria. Eu queria saber como você criou frases como essas, eu queria citar uma frase bem rápida: ""um filme que você já viu com notas de piano elétrico tinindo ao fundo, suaves como ovários caindo em farinha de aveia"". Queria saber de onde você tira frases como essas, o que passa pela sua cabeça quando está escrevendo uma coisa assim?"
49|02/01/2006|DBC Pierre|50|DBC Pierre| Não me pergunte,  só Deus sabe. Um dos motivos é porque eu sou idiota e inútil na vida. Precisa levar em consideração, porque, como Júlio disse, meu pai morreu, eu vim de uma boa família, mas não estudei muito, não fiz faculdade, perdi todo esse tempo tomando drogas e sendo idiota. Além disso, um dos motivos de eu me meter em encrenca e de continuar inútil e incapaz de ter um emprego, é porque sou um sonhador. Eu vejo imagens das coisas, eu sou muito visual e muito musical. Eu adoro o som da linguagem, das palavras que se unem, eu me distraio com isso. Então, tudo isso... Se eu pegar um táxi para ir até o aeroporto, vou ver alguma coisa que me dará uma idéia para escrever. É uma coisa que não ajuda muito na vida que temos que ter hoje. Temos que arrumar um emprego e ficar quietos, ganhar dinheiro e contribuir com a economia, mas é muito útil para esse tipo de coisa. E eu não sabia. Eu me senti mesmo como um idiota completamente inútil durante muitos anos, e até me disseram isso, até que achei uma forma de colocar essas imagens no livro.
50|02/01/2006|DBC Pierre|51|Jayme Spitzcovsky| Agora, há no seu livro alguns posicionamentos e algumas referências que lembram, em certa medida, o cineasta norte-americano Michael Moore . Você acha que poderia ser comparado ao Michael Moore, talvez um Michael Moore não americano e das letras?
51|02/01/2006|DBC Pierre|52|DBC Pierre| Não. É a resposta rápida. Pergunta esperta. Eu o conheço porque vivo numa ilha distante da costa. Temos um cinema móvel que vai até nosso vilarejo todo mês, normalmente com filmes do Exterminador , da Disney... É um caminhão, eles carregam tudo. Uma vez, faz pouco tempo, passaram Tiros em Columbine , eu só assisti ao filme depois que o livro foi publicado. Pelas razões que já expus, eu tentei escrever esse livro como um estrangeiro. Eu o considero um livro estrangeiro, escrito a partir da TV e não a partir das profundezas da cultura americana. Os comentários que faço nele ainda sinto que são frutos do distanciamento de um espectador de TV e não de alguém do lugar. Espero que sejam válidos. Não gostaria de ser visto como um Michael Moore estrangeiro.
52|02/01/2006|DBC Pierre|53|Maria Elisa Cevasco| Pierre, eu queria pegar carona na pergunta do Cassiano, quando ele leu aquele trecho do seu livro e agora quando respondeu que você é uma pessoa fascinada pelo visual e pela música, me ocorreu te perguntar qual é a sua relação com a poesia, que da literatura é o que lida com o visual e com a música? Você gosta de poesia, você curte poesia? Porque tem muitos pedaços que se lêem como pequenos poemas, não sei se era isso que o Cassiano tinha em mente, mas foi isso que me pareceu. Quando li o seu livro, havia momentos de redenção poética ali, que você tentava sair daquele horror, que o Vernon tentava sair daquele horror através da poesia, não sei. Você tem alguma relação com poesia, você gosta de poesia, como é que é?
53|02/01/2006|DBC Pierre|54|DBC Pierre|" Eu gosto. Mas devo ter lido menos poesia do que um aluno seu lê em uma semana. Há coisas da poesia que ficarão na minha mente para sempre. O meu verso favorito é de um poema caribenho; para mim, ele fala da vida, principalmente da dificuldade de escrever. Ele diz: ""Eu adoro isso, como marinheiros afogados adoram o mar"". É assim que eu me sinto em relação a muitas coisas. Conheço poesia porque era obrigado a ler na escola, sempre achei muito chato e guardei isso comigo. E só agora que estou amadurecendo é que estou tentando redescobri-la. Mas não estou lendo muito, no momento, gostaria de ler mais."
54|02/01/2006|DBC Pierre|55|Paulo Markun| Peter, o seu livro fala dessa cultura americana, da violência, enfim, do massacre na pequena cidade do Texas, e, curiosamente, eu acho até engraçado a gente estar falando isso, é bom porque leva os leitores a comprar livro e isso que é importante, porque no Brasil se lê muito pouco e quanto mais as pessoas lerem, melhor será. Mas, enfim, o que me chamou a atenção é que há um personagem do seu livro que é muito pouco descrito, com poucas palavras, aparece muito rapidamente no final, que é um pastor dentro de uma cadeia, no corredor da morte, e esse pastor dá um giro na história, a partir daí que a história muda. Então pergunto se tem nisso algum tipo de convicção sua de que o caminho para se sair dessa sociedade totalmente materialista é algum caminho espiritual?
55|02/01/2006|DBC Pierre|56|DBC Pierre| De certa forma é sim. É também uma referência ao espírito da inteligência. É interessante você ter tocado nesse ponto. Na verdade, a mensagem é passada como espiritual, mas o que o personagem Vernon precisa aprender é usar as ferramentas que tem com inteligência. E isso é aprender a manipular os outros para que façam o que ele quer, encontrando suas fraquezas.
56|02/01/2006|DBC Pierre|57|Paulo Markun| De certo sentido o seu deus que aparece no título, o pequeno deus?
57|02/01/2006|DBC Pierre|58|DBC Pierre|" Exatamente. Até que ele consiga aprender a conquistar para ele o auto-respeito e a arrogância de um deus e manipular e encontrar as fraquezas dos outros para explorá-los, como ele foi explorado, então ele vai morrer na nossa cultura. Essa é mensagem. Ele chega a ele de uma forma espiritual, mas, na verdade, ela tem a ver com a mecânica da inteligência ""Não fique sentado dizendo que é inocente. Levante e faça algo. E faça algo dramático.”"
58|02/01/2006|DBC Pierre|59|Paulo Markun| E isso apareceu ao longo da fase em que você estava comandado pela emoção ou desde o início você tinha essa idéia da história e esse final surpreendente já desenhado?
59|02/01/2006|DBC Pierre|60|DBC Pierre| Não. A história do livro viajou muito e mudou bastante no percurso. Entre o primeiro esboço que escrevi bem rápido, em cinco semanas, e o último, que terminei oito meses depois, após muito sofrimento, muitas coisas mudaram e isso foi muito... Quando escrevi essa seqüência específica, eu estava preocupado em também dar à história o ar de um conto americano como se fosse contado na TV dos Estados Unidos. Muitas coisas contribuíram para esse final, mas ele não existia desde o início, com certeza. Na verdade, sem revelar nada da história, posso dizer que o final do primeiro esboço era quase o oposto do que ficou no último. Simplesmente não estava correto, tive que retomar e reescrever o final.
60|02/01/2006|DBC Pierre|61|Cassiano Alec Machado| Pierre, você disse que o seu livro, de certa forma, era a jovem América encontrando, encarando as promessas que fizera a si mesma, a jovem América encarando as promessas a si mesma. Você acha realmente que a jovem América é tão espirituosa como é o seu livro?
61|02/01/2006|DBC Pierre|62|DBC Pierre| Não é espiritualismo. Você tocou num ponto muito subjetivo. Isso veio da minha impressão pessoal dos Estados Unidos, porque eu cresci à sombra dos Estados Unidos. Meu pai tinha emprego em Nova Iorque, embora morássemos no México. Eu tinha muito contato com americanos e com os Estados Unidos quando eu era bem pequeno e eu amava os Estados Unidos, amava como se ama o maior amor. Era fantástico. Eu morava do outro lado da fronteira e era mais espetacular. Antes do Tratado de Livre Comércio da América do Norte, antes do Nafta, o México não tinha acesso a nenhum desses produtos. Os Estados Unidos eram como uma loja de brinquedos para mim. Eu costumava ficar, eu adorava a idéia do pensamento positivo, eu adorava a idéia da autocapacitação, de que todos deveriam trabalhar para se sentirem poderosos e merecedores da felicidade e capazes de conquistar o mundo e fazer o que quisessem. Todo esse tipo de besteira me impressionava muito quando eu era pequeno. Eu não era uma pessoa muito confiante e segura de si. Aquilo tudo era fantástico, e mesmo com todas essas teorias e jogadas acontecendo, elas aconteciam, me parece, com um tipo de inocência, elas aconteciam com certa suavidade. Em outras palavras, não eram o fim nem o começo do mundo, eram apenas idéias. Você podia comprar pedras de estimação e todo tipo de coisas bizarras. Eram ferramentas cínicas de um mercado desesperadamente competitivo. Eram apenas idéias e tudo era muito amigável. Eu vi isso. Na minha época me parecia mais inocente. Sei que não era um poder global, mas como cultura me parecia muito mais inocente, e muito mais disposta a olhar para si mesma, de certa forma.
62|02/01/2006|DBC Pierre|63|Jayme Spitzcovsky| Peter, o seu livro se passa no Texas e hoje em dia uma associação quase que imediata, pelo menos para muita gente, é entre esse estado com a dinastia Bush, presidente George W. Bush e a sua onda conservadora, a direita fundamentalista cristã cada vez mais forte nos Estados Unidos. O que representa George W. Bush para você?
63|02/01/2006|DBC Pierre|64|DBC Pierre| Fico feliz que tenha perguntado isso. Vou dizer exatamente o que ele representa. Eu vejo – e isso é algo por trás da imagem do todo da obra que Vernon é – eu vi o massacre da escola secundária como um ícone muito trágico, não apenas da cultura americana que é dominada pelo consumo, porque me parece que as crianças são as mais vulneráveis num clima em que você tem de alcançar o sucesso ou morrer. E se você não for o mais inteligente, se não for o mais bonito, se não for o mais instruído, aonde vai chegar? Acho que as crianças caíram no vácuo de uma cultura superaquecida e explodiram. E, para mim, Bush, essa dinastia representa, se usarmos a metáfora de que o mundo é uma sala de aula e que cada país é um aluno da escola, você vai ter os tímidos, os agressivos, os fortes, os ricos e tem um gordinho de 13 anos com uma arma. Para mim, essa é a dinastia, é isso que ele representa.
64|02/01/2006|DBC Pierre|65|Silvia Colombo| Peter, você escreveu seu livro antes do 11 de setembro, mas depois dele muitos autores se viraram para o mundo como está e tentaram fazer uma crítica tanto aos Estados Unidos quanto à situação mundial causada por eles. Está aí o livro do Ian Mcewan, Sábado, dá para mencionar outros autores, Carlos Fuentes,  Saramago . Adianta tudo isso, que diferença faz a literatura para essa discussão?
65|02/01/2006|DBC Pierre|66|DBC Pierre| A literatura deve ser a primeira a se manifestar. Acho que a arte guia a cultura mais que a ciência e a política, porque ela planta idéias. Antes de qualquer coisa ser inventada ou implementada, nós sonhamos com ela, temos que imaginar se ela é possível, um formato é criado. Mas é verdade quando diz que escrevi antes do 11 de setembro, terminei antes do 11 de setembro, não é minha culpa o paradigma ter mudado, é outra ironia o livro falar sobre mudar paradigmas, as coisas mudaram dramaticamente. Quando eu terminei o livro, ele continuaria sendo outra obra da trivialidade americana, como Os Simpsons , um pouco mais crítico, talvez. De repente, o mundo mudou em torno da obra, e ela recebeu muito mais atenção do que receberia na ausência desses acontecimentos. Eu sinto muito por isso, mas está fora do meu controle.
66|02/01/2006|DBC Pierre|67|Silvia Colombo| Você acha que os livros têm o poder de mudar alguma coisa?
67|02/01/2006|DBC Pierre|68|[ocorre falha de comunicação entre tradutor e entrevistado]|
68|02/01/2006|DBC Pierre|69|Paulo Markun| Faça a pergunta novamente, por favor.
69|02/01/2006|DBC Pierre|70|Silvia Colombo| Então, eu queria saber se você acha que a literatura tem força para mudar alguma coisa no mundo hoje?
70|02/01/2006|DBC Pierre|71|DBC Pierre| Não, nada tem poder suficiente, a não ser os instrumentos dotados de poder. É difícil fazer isso. Eu tenho a idéia romântica de que isso é possível, é uma boa razão para tentar escrever melhor o tempo todo. Eu tenho essa idéia adorável de que poderia ser possível mudar mentes com meu trabalho, mas ao dizer isso eu não estou armando nenhum tipo de ação política. Vou acabar escrevendo livros sobre borboletas, ursinhos e coisas assim. Repito, como o paradigma mudou de repente, fiquei parecendo um crítico duro e frio, e não sou tão duro quanto imaginam. Eu como hambúrgueres também, eles fazem sanduíches muito bons nos Estados Unidos.
71|02/01/2006|DBC Pierre|72|Júlio Ludemir| Isso quando você fala, até o que ela falou, me remete a uma fala do  Agualusa, que é um escritor angolano muito lido no Brasil, que ele diz que o povo inglês está perdendo a sua língua, porque como ela é uma língua universal, como ela pertence a todo mundo, ela não pertence a ninguém. Você, quando escreve, do ponto de vista de um estrangeiro, e acho que tem uma fala sua em alguma das entrevistas em que você fala que para ter acesso à cultura americana, qualquer pessoa pode apenas ligar a televisão que entra em contato e, de alguma forma, se apropria dessa cultura americana. Não estaria ocorrendo com essa cultura americana o mesmo que está ocorrendo com a língua, ou seja, é uma cultura minha também, eu posso ligar a televisão e ser influenciado pelo que está passando no Simpsons, do mesmo modo que um garoto texano. Ou seja, aquele garoto texano também não está perdendo essa cultura americana?
72|02/01/2006|DBC Pierre|73|DBC Pierre| Não sei se está. Primeiro, o que é cultura americana? É muito complicado. Esse é outro motivo pelo qual tentei ficar próximo aos estereótipos da TV para o livro. Você precisa ter cuidado. Os Estados Unidos também têm uma fantástica população de descendência africana que nos deu o jazz, e são culturas maravilhosas dentro da cultura. O consumismo e a cultura do ser bem-sucedido ou morrer e a cultura que diz que não há nada mais valioso que o dólar é isso que eu estava atacando especificamente. E ela não vai desaparecer, porque é a cultura do lucro a qualquer custo. É isso que eu vejo quando eu ligo a TV. É por isso que tudo que eu vejo é previsível. E por isso que ela vai ficar mais sensacionalista e trágica até que algo aconteça e ela se autodestrua. E é verdade que isso está aumentando em várias culturas, na cultura de todo o mundo, quer as pessoas gostem ou não. Porque você está cercado, mesmo desligando a TV, haverá algo em volta de você, haverá idéias e as pessoas ao seu redor serão infectadas de certa forma. É como a roda do hamster. A vaidade e cobiça movimentam a engrenagem do consumo.
73|02/01/2006|DBC Pierre|74|Gioconda Bordon| Pierre, você não acha que a expressão “cultura americana” começa a se tornar hoje um símbolo vazio? Vazio no sentido que pode caber qualquer coisa dentro dele? O que nós estamos falando na verdade é uma cultura de mercado que, embora tenha até surgido e  se arrefecido nos Estados Unidos, mas ela é global, é uma imitação de padrão e de desejo de sucesso que está no mundo inteiro. Então quando a gente fala em cultura americana você não acha que a gente está desprezando outras coisas e incluindo só esse aspecto da cultura de mercado numa palavra que é muito mais abrangente do que a gente imagina?
74|02/01/2006|DBC Pierre|75|DBC Pierre|" Sim, você está totalmente certa. Deveríamos dizer ""cultura de mercado"". É exatamente o que eu quis dizer. Há uma frase muito antiga nos Estados Unidos que diz: ""O negócio dos Estados Unidos é o negócio"". A Constituição americana não é tão complicada quanto se imagina. Com todas as suas emendas e supostos direitos, a Constituição americana não passa de um documento comercial. São leis instituídas por uma minoria muito rica, há alguns séculos, e que continua igual. É por isso que quero tomar cuidado para não desprezar coisas culturais de verdade."
75|02/01/2006|DBC Pierre|76|Gioconda Bordon| Até porque muito a parte da crítica contra essa cultura de mercado vem também dos Estados Unidos, embora, claro, de uma forma menos conhecida, mas ela existe lá. Não é que todo mundo esteja feliz e satisfeito e sem o menor senso crítico.
76|02/01/2006|DBC Pierre|77|DBC Pierre|" É claro que sim. Mas os Estados Unidos são o guia. E existe um único homem que foi o maior responsável por essa cultura de consumo. Um homem que era sobrinho de Sigmund Freud  e que decidiu ser o primeiro explorar as idéias de Freud de que nós, humanos, éramos infectados por forças subconscientes perigosas que ele achou que poderia manipular e ter lucro com isso. Até Wall Street  acabou dizendo: ""Precisamos mudar essa cultura de necessidade para uma cultura de desejo"". Existe realmente uma filosofia detectável florescendo de um grupo muito pequeno de pessoas que fizeram essa cultura de mercado surgir e que estão bem à frente de nós. Sei que vão dizer que agora está tudo globalizado, mas se quiserem ver onde isso ocorre hoje, é nos Estados Unidos que está acontecendo isso. Eles estão vendendo frações de frações de frações do futuro, frações potenciais de promessas."
77|02/01/2006|DBC Pierre|78|Cassiano Alec Machado| Pierre, você chegou a mencionar que se fosse escrever uma continuação para o Vernon God Little, que você chegou a pensar a escrever uma continuação, e que provavelmente você o faria até chegar a presidente da república. Você acha que ele seria realmente um bom presidente, o Vernon God Little seria melhor que o George Bush?
78|02/01/2006|DBC Pierre|79|DBC Pierre|" Ele teria sido, se eu tivesse escrito, mas ainda não escrevi esse livro. É verdade, pouca gente sabe, mas originalmente eu ia fazer uma trilogia. Fiz o esboço de três livros e esse foi o único que terminei. Esse mostra a posição bem negra urbana e liberal na cultura de mercado. Eu ia escrever uma oposta, na qual o protagonista era o vilão e a cultura conservadora era saudável, incentivadora e positiva. E queria dar equilíbrio escrevendo um terceiro livro para encontrar a área cinza para balancear os dois. Era nesse que Vernon teria se tornado presidente, mas levei esse ao editor e contei que tinha planejado mais dois e ele disse: ""Não abuse da sorte, esqueça."" E eu esqueci."
79|02/01/2006|DBC Pierre|80|Paulo Markun| Você falou em Freud, e um dos personagens também muito patéticos do livro é a mãe do Vernon. É uma mãe cujo grande barato é uma televisão, televisão não, perdão, uma geladeira bege de duas portas, e é uma viúva americana absolutamente patética na sua relação com os filhos. Isso tem alguma coisa a ver com a sua história real?
80|02/01/2006|DBC Pierre|81|DBC Pierre|"  Não, não tem nada a ver com a minha história pessoal. A mãe, no primeiríssimo esboço desse livro, repito, porque sou principiante, achei que tinha ""colocado ovos demais no pudim"", como dizemos, um pouquinho porque eu tinha colocado várias metáforas religiosas. Eu também tinha a metáfora central que era a adolescência, em que tudo de ruim acontece com o Vernon, porque é assim que achamos que as coisas acontecem conosco. Na adolescência ou as coisas são fantásticas ou terríveis, eu queria passar isso. ""Eu vou ser condenado à morte"". E a mãe, originalmente, ia ser simbolicamente o Estado..."
81|02/01/2006|DBC Pierre|82|Paulo Markun| O Estado americano.
82|02/01/2006|DBC Pierre|83|DBC Pierre| Queria que ela fosse o símbolo do Estado que não estava cuidando do seu povo, estava pensando só nela e estava negligenciado a única coisa inteligente que merecia ter sua atenção, que é a população. Foi isso que a tornou tão vaidosa e gananciosa. Ela se transformou em patética por si mesma, e também tentei dar a ela um pouco do que reconhecemos nas nossas mães na adolescência. Sabe aquela época em que sua mãe era sua pior inimiga? Eu queria colocar um pouco disso, ela dizendo coisas erradas e brigando de forma errada. Ela é, de fato, um amálgama, ela mudou muito. O nome dela mudou umas 12 vezes enquanto eu escrevia. E o personagem foi mudando, mudando, mudando, até que ela mesma acabou se definindo.
83|02/01/2006|DBC Pierre|84|Paulo Markun| Eu li em várias entrevistas suas referências de entrevistadores a influências que você teve, até a história de que você começou a escrever quando tinha nove anos por determinação de uma companhia aérea que queria o diário de bordo dos seus passageiros e você era um passageiro freqüente. Mas de alguma forma, a sensação que me deu o seu livro é que tem muito pouca influência, muito embora, certamente, você não conhece, mas aparece uma semelhança com um livro que circulou no Brasil há muito tempo, não tem nada a ver a história, mas eu digo no relato da primeira pessoa, que é um livro de um escritor brasileiro, Marcelo Rubens Paiva, que escreveu quando era muito jovem. Ou seja, o que mais me surpreende nesse seu trabalho é como você conseguiu registrar essa linguagem jovem sem levar em conta o fato de você tinha 40 anos quando você escreveu o livro, e não 15 ou 16. Como é que você conseguiu isso?
84|02/01/2006|DBC Pierre|85|DBC Pierre| Porque sou retardado.  Não quis dizer que sou doente e que ainda não amadureci, eu continuo com a cabeça de um jovem. Provavelmente há alguma verdade nisso. Eu me interesso, as coisas ficam tediosas. Fiquei surpreso quando cresci, ver pessoas continuando a evoluir. Era fantástico quando eu conhecia pessoas de 60 e 70 anos que continuavam a viver dramas da adolescência, foi uma surpresa para mim. Eu esperava chegar aos 20 anos e depois morrer. Assim, à parte disso, é muito mais divertido. Eu tenho mais interesse em retratar os jovens pensando e falando, e acho que aí está nossa esperança, nosso futuro. Nas ruas, todas as coisas mais divertidas vêm dos mais jovens. Eu sou muito ligado nisso e provavelmente devo ser um pouco atrasado emocionalmente.
85|02/01/2006|DBC Pierre|86|Paulo Markun| Mas você realmente começou a escrever por causa dessa história da companhia aérea? De quando você viajava, tinha que fazer uma espécie de diário de bordo, pelo menos eu li isso em uma entrevista, não sei se procede. Não? Nada a ver?
86|02/01/2006|DBC Pierre|87|DBC Pierre| Nunca ouvi essa história. Nunca ouvi isso. Isso foi um erro terrível de citação ou é mentira.
87|02/01/2006|DBC Pierre|88|Luciano Ribeiro| Pierre, queria saber se para você um grande livro, a grande arte, necessariamente, precisa nascer da culpa, da dor, do desconforto?
88|02/01/2006|DBC Pierre|89|DBC Pierre|" Não, nem sempre. O que eu posso ter aprendido é que essas coisas são combustíveis muito úteis. Se eles alimentavam uma situação, eu me alimentava de várias emoções por um longo tempo. É um combustível muito útil, não apenas para a psicologia por trás da trama do livro, mas também para pressionar você e dar disciplina. Chega um momento na vida em que você diz: ""Preciso fazer alguma coisa. O que estou fazendo aqui?"" Acontece num certo momento. E ter essas opressões é um combustível para isso. Não entendo muito disso, temos que perguntar para a Maria Luisa, que é uma especialista e muito mais lida, literariamente, mas eu acho que deve ser útil para a arte se o artista tiver uma vida caótica e tiver..."
89|02/01/2006|DBC Pierre|90|Júlio Ludemir|" Esse negócio da dor... Eu fiquei muito mal resolvido com essa sua história de droga. A primeira coisa que eu queria entender o seu ""fundo do poço"". Qual foi aquele momento a partir do qual você disse: ""Eu não posso mais me drogar"". E que grande dor é essa? E tem uma outra coisa que eu também não entendo, que, na verdade, é esse Dirty But Clean, que é sujo, mas limpo. Porque a droga é a compulsão; se eu começo a beber um, é mais um, é só mais um, é só mais um e esse mais um nunca acaba. E eu vejo que você gosta de caipirinha..."
90|02/01/2006|DBC Pierre|91|DBC Pierre| Demais. 
91|02/01/2006|DBC Pierre|92|Júlio Ludemir| Como é que você concilia esse barato da caipirinha com a sobriedade?
