|DATA|ENTREVISTA|ORDEM|LOCUTOR|FALA
290|31/08/1987|Hortência|291|Augusto Nunes| Hortência, nós estamos recebendo muitos telefonemas, então eu sou obrigado interromper vocês de vez em quando para fazer a pergunta que os telespectadores desejariam estar fazendo aqui, ao vivo. Maria Donizete, da Vila Maria, pergunta a propósito de alguns comentários feitos por você agora há pouco: “Se você é do interior deve ter recebido uma educação bastante rígida. Você é contra a virgindade ou a favor dela? E sexo para você é uma coisa normal?”.
291|31/08/1987|Hortência|292|Hortência| Eu acho que isso aí é uma pergunta muito difícil de responder, se você é contra ou a favor da virgindade. Acho que isso varia muito de cada pessoa. Eu acho que a mulher... Eu, por exemplo, tenho que saber se eu devo ser virgem ou não, na minha maneira de pensar. Agora, pode ser que as outras pessoas não pensem igual  eu penso. Quer dizer, cada um tem uma maneira de pensar. Então isso de ser contra ou a favor, depende muito de cada menina, de cada mulher. Se ela acha que não tem que ser virgem,  ela já está preparada para isso, então... Tem pessoa que acha que tem que casar virgem... Nós temos que respeitar as duas versões.
292|31/08/1987|Hortência|293|Augusto Nunes| Uma outra pergunta após a qual eu prometo devolver a bola . Você que é um dos ídolos brasileiros hoje. Quais são os teus ídolos nas várias áreas, tanto em esporte, as pessoas que você mais admira no basquete, e fora dele? Vale cantor, vale artista de cinema, vale político...
293|31/08/1987|Hortência|294|Hortência| Eu não tenho um ídolo assim, “ai, eu sou louca por aquela pessoa”. Não. Isso depende muito. Cantores, eu acho que todos têm o seu valor. Eu gosto do Chico Buarque de Hollanda, eu gosto do Milton Nascimento... Eu gosto de todos os cantores. Às vezes, tem um que está numa fase melhor, têm outros que lançam uma música melhor que o outro, então eu ouço todos os cantores. Atletas, sinceramente, eu tenho vários atletas que eu admiro... Admiro, no voleibol, o Renan , eu admiro o Xandó , o Amauri  . No basquetebol, eu admiro o Oscar, que para mim é o único. Admiro o Marcel , admiro... Sabe, em cada esporte eu tenho a pessoa que eu admiro. Se for falar pra você de todos, acaba o programa! 
294|31/08/1987|Hortência|295|Ester Lima| Como você se sentiu, Hortência, quando você foi comparada ao Carlos Dummond de Andrade?
295|31/08/1987|Hortência|296|Hortência| Eu achei que foi exagero, porque não tem nada que compare a ele.
296|31/08/1987|Hortência|297|[risos]|
297|31/08/1987|Hortência|298|[...]| Quem disse isso?
298|31/08/1987|Hortência|299|Ester Lima| Foi Jaime Maria de Sousa, numa crônica.
299|31/08/1987|Hortência|300|Hortência| Realmente, eu acho que foi um exagero, porque nada se compara a ele.
300|31/08/1987|Hortência|301|[...]| Mas é uma admiração profunda, hein?!
301|31/08/1987|Hortência|302|[risos]|
302|31/08/1987|Hortência|303|Juca Kfouri| Eu queria que você me respondesse uma velha curiosidade que eu tenho, que também o Wlamir poderia responder perfeitamente. O que é mais difícil durante o jogo: chutar da zona morta  ou parar para bater dois ou três lances livres? O que é mais difícil de acertar o chute de fora ou o lance livre?
303|31/08/1987|Hortência|304|Hortência| Eu acho que o chute de fora, porque está em movimento. Porque no lance livre você está concentrada, não tem ninguém te marcando, não tem ninguém te perturbando. É você, Deus e a cesta.
304|31/08/1987|Hortência|305|Paulo Planet Buarque| O que você pensa quando você fecha os olhos e inspira ? Isso todo mundo quer saber, o que você pensa?
305|31/08/1987|Hortência|306|[sobreposição de vozes]|
306|31/08/1987|Hortência|307|Ouhydes Fonseca| É que o Kfouri perguntou o que é mais fácil e mais difícil, eu ia perguntar exatamente isso. Quer dizer, nós vimos alguns lances seus aí em que você faz cestas de tudo quanto é forma. E no basquete a cesta é equivalente ao gol no futebol. É o momento da grande explosão, da realização. Quando é que você sente mais prazer, é a cesta arremessada - ou de lance livre ou de uma bola parada - ou após uma finta, uma bandeja, um lance trabalhado?
307|31/08/1987|Hortência|308|Hortência| Eu acho que a cesta que é mais gostosa é aquela que você trabalha muito para fazê-la. O lance livre nem tanto, porque você está ali sozinha. Agora, uma finta, você passa pelo meio das pernas, dá um giro, entra toda desequilibrada e faz... Eu acho que essa é a mais gostosa, que você vibra mais.
308|31/08/1987|Hortência|309|Marcelo Resende| E de tensão? Na hora que pára ali para um lance livre, aquilo é o que dá mais tensão no jogo?
309|31/08/1987|Hortência|310|Ester Lima| O que passa pela sua cabeça quando você dá aquela respirada assim antes do arremesso?
310|31/08/1987|Hortência|311|Hortência| Essa que você fez, acho que essa é a responsabilidade. Então seria assim, a cesta que você sente mais responsabilidade é quando o jogo está acabando você tem que chutar lance livre, e está nas sua mãos, depende de você... essa não é qualquer um que chuta não.
311|31/08/1987|Hortência|312|Marcelo Resende| É o pênalti, né?
312|31/08/1987|Hortência|313|Hortência| É fogo!
313|31/08/1987|Hortência|314|Norminha| Eu vou te perguntar  que faz muito tempo. Alguns anos atrás...
314|31/08/1987|Hortência|315|Hortência| Eu sei até o que você vai perguntar! 
315|31/08/1987|Hortência|316|Norminha| Como é que você sabe? Não sei por quê, porque eu sempre falava da Paula e sempre falava de você e colocava as duas de diferentes condições. Sempre grandes estrelas, mas você com a tua característica e a Paula, sem dúvida alguma, com a característica excepcional de jogadora de um visual periférico fantástico, de passes e de assistências que não aparecem. Porque na realidade a jogadora  não aparece, a Hortência aparece muito mais - não te desvalorizando, não vai entender o que eu falei há anos atrás, veja bem. Então você tem um potencial de arremesso excepcional, de qualidade, com a bola fantástica; e a Paula, com outras qualidades também que são inerentes a qualquer jogador, que é a capacidade de raciocínio, raciocínio momentâneo. Então ela trabalha, como você disse, a combinação, vocês duas combinam. Muito bem! Passaram os anos, teve uma época que você ficou meio brava comigo, aí nós conversamos, e no ano passado eu senti você com dor, solidão e uma péssima fase de basquetebol. O que você me diz?
316|31/08/1987|Hortência|317|Hortência| Toda atleta tem uma fase ruim.
317|31/08/1987|Hortência|318|Norminha| Depois de tanto tempo que eu não a via jogar, você me disse coisas importantes. Por que especificamente, se tinha “n” pessoas lá dentro?
318|31/08/1987|Hortência|319|[...]| Por amor.
319|31/08/1987|Hortência|320|Hortência| O quê?
320|31/08/1987|Hortência|321|[...]| Por amor.
321|31/08/1987|Hortência|322|Hortência| Não, de maneira alguma, eu nunca trago problemas meus de fora da quadra para dentro. Realmente, eu estava tendo problemas, acho que todo atleta tem problemas dento da quadra. Eu não estava bem, não estava conseguindo treinar direito, não tava conseguindo... sabe? Passei por uma fase ruim que, graças a Deus, já passou. E realmente eu vi a Norminha e eu senti... De repente eu me vi, assim, num ombro amigo, porque ela tem uma parcela daquilo que eu jogo, porque ela me ensinou também muita coisa, então de repente eu abracei ela e comecei a conversar com ela, que eu não estava numa fase boa. Ela me deu uma força e realmente foi importante, porque ela fez parte da minha carreira, então eu achei que ela era uma pessoa legal para conversar.
322|31/08/1987|Hortência|323|[sobreposição de vozes]|
323|31/08/1987|Hortência|324|Norminha| Sabe porque eu puxei isso? Porque na realidade é de muitos anos. Porque eu conheci uma Hortência inicial, depois uma adolescente, depois uma estrela em formação. Atualmente talvez agressiva, prepotente, pela própria capacidade técnica dela. E passaram-se os anos e vejo, no ano passado, a Hortência com maior humildade, com maior decisão, com maior necessidade de princípio, trabalhando para a equipe. Então, isso que me chamou a atenção na Hortência, porque esses valores eu tenho que colocar em evidência em você.
324|31/08/1987|Hortência|325|Hortência| A atleta, conforme ela vai crescendo, ela vai ficando mais consciente. Hoje eu tenho 27 anos. Na época que eu treinei com você eu tinha 15, 16 anos. Quer dizer, você vai evoluindo também. Hoje eu corro bem menos do que eu corria antes. Não porque eu não tenho mais condição física, é porque não preciso correr tanto para fazer cesta.
325|31/08/1987|Hortência|326|Norminha| Aprendeu a correr.
326|31/08/1987|Hortência|327|Hortência| Aprendi a correr, aprendi a me mexer... Quer dizer, então você vai tendo malícia, você olha para cara da pessoa e você já sabe a hora que você vai tomar a bola. Não precisa ficar ali “fogosa” em cima dela.
327|31/08/1987|Hortência|328|José Góes| Hortência, você tem algum apelido ou não?
328|31/08/1987|Hortência|329|Hortência| Não....
329|31/08/1987|Hortência|330|[...]| Não é Magrela?
330|31/08/1987|Hortência|331|Hortência| Ah, tenho! Me chamam de “Pur”! É Magrela, Pur... A Vânia Hernandes...
331|31/08/1987|Hortência|332|Entrevistadora| O que é Pur?
332|31/08/1987|Hortência|333|Hortência| Uma brincadeira delas. Não posso contar!
333|31/08/1987|Hortência|334|[risos]|
334|31/08/1987|Hortência|335|José Góes| Qual é o apelido mais interessante entre vocês? Uma companheira que tem um apelido interessante...
335|31/08/1987|Hortência|336|Hortência| O apelido mais interessante?...
336|31/08/1987|Hortência|337|José Góes| Curioso.
337|31/08/1987|Hortência|338|Hortência| Não tem assim...
338|31/08/1987|Hortência|339|Marcelo Resende| O convívio da concentração, como que é o convívio de vocês?
339|31/08/1987|Hortência|340|Hortência| É ótimo.
340|31/08/1987|Hortência|341|Marcelo Resende| Fica cada uma no seu quarto, dormem todas juntas?
341|31/08/1987|Hortência|342|Juca Kfouri| É uma “fofocaiada” terrível!
342|31/08/1987|Hortência|343|Hortência| Onde fica mulher, sempre tem fofoca.
343|31/08/1987|Hortência|344|[risos]|
344|31/08/1987|Hortência|345|Marcelo Resende| Uma pega o shampoo da outra...
345|31/08/1987|Hortência|346|Hortência| Uma sacaneia a outra, uma esconde a coisa da outra, isso é normal! Isso é concentração, você tem que brincar. A Paula é a menina mais criança do time! A que mais brinca, a que mais te perturba, que mais pula, que mais... Se você vê ela quietinha, já sabe que ela está aprontando alguma coisa! E de ficar... Dormem todas juntas? Isso depende, se o hotel é para duas, ficam duas; se o hotel é para três, ficam três. Depende!
346|31/08/1987|Hortência|347|Augusto Nunes| Hortência, alguns telespectadores... Nós comentamos aqui essa questão do uniforme da Seleção Feminina de Basquete e você não foi muito precisa sobre que tipo de uniforme você gostaria de adotar. João Carlos Castilho, de Itaim, São Paulo, certamente impressionado com o teu desempenho, diz assim: “Você não acha que o calção de basquete deveria ser de nylon colante, com blusa do tipo Araquém , mostrando a alegria de vocês?”  Como é que deveria ser o uniforme da Seleção Feminina? Se você fizesse o design dele, como é que seria?
347|31/08/1987|Hortência|348|Hortência| Bom, eu ainda adoto o shorts comprido, porque eu acho muito mais gostoso para jogar, muito mais confortável. Mesmo porque, no basquete, ninguém usa shorts curto, a não ser a Argentina - que não tem expressão internacional nenhuma - e Austrália. O resto, o mundo inteiro usa shorts curto . Eu faria de helanca comprido, bem colado no corpo. E a blusa também. Eu acho mais bonitinho! Podia ser um pouquinho mais curto, mas não aquele cavado, porque esse aí, eu já usei muito... Já gostei muito de usar esse shorts, mas hoje já não tem mais. Depois de seis, sete anos você usando, acho que não teria mais o porquê. E mesmo porque ninguém usa mais, é fora de moda isso!
348|31/08/1987|Hortência|349|José Góes| Outro dia nós fizemos aqui na  Cultura uma reportagem em Sorocaba com seus pais - aliás, figuras muito simpáticas os dois. Sua mãe dizia que se você fosse aos Estados Unidos jogar ela iria junto; e seu pai dizia que não, que ele ficaria aqui. Eles interferem na sua carreira, dão palpite, dão opinião, ajudam? Ou não, ficam quietinhos? Qual é o seu relacionamento, Hortência, com seus pais?
349|31/08/1987|Hortência|350|Hortência| Nossa, é demais! Eles são uma gracinha os dois...
350|31/08/1987|Hortência|351|José Góes| Tanto assim que vocês moram no mesmo prédio, né?
351|31/08/1987|Hortência|352|Hortência| Moro, comprei um apartamento do lado de onde eu moro e pus eles ali, pertinho de mim, porque eu que cuido deles. E a minha não ida aos Estados Unidos, na época que me convidaram, foi justamente por causa deles; porque eu tinha aquele compromisso de cuidar da minha família, porque eles eram de família bem humilde, família pobre e não seria justo eu largar eles aqui e ir embora. Se eu fosse de família rica, eu teria ido com maior prazer jogar nos Estados Unidos, mas como eu tinha que cuidar...
352|31/08/1987|Hortência|353|[...]| 
353|31/08/1987|Hortência|354|Hortência| Partiu desde 1976, foi quando eu fui jogar lá... 1977, e foi até 1983. Depois viram que não dava, viram que eu não ia e desistiram.
354|31/08/1987|Hortência|355|Juca Kfouri| Eu queria que você nos contasse um pouco isso, Hortência. Como é essa sua família, essa sua família pobre... O que o seu pai fazia? E como é que, de repente, numa família pobre uma menina descobre o basquete, que é um esporte - hoje nem tanto, mas 13, 14 anos atrás - bastante elitizado ainda?
355|31/08/1987|Hortência|356|Hortência| Eu acho que  você ser um atleta, Deus dá o dom... Não é porque é rico, porque é pobre. Deus não escolhe dinheiro para dar o dom para alguém, ninguém compra isso. Realmente, a minha família era muito pobre e eu comecei a jogar basquete... Ia parar de jogar basquete porque eu não tinha condições... A minha família não tinha condições de sustentar.
356|31/08/1987|Hortência|357|[...]| Em Potirendaba ou não?
357|31/08/1987|Hortência|358|Hortência| Não, eu comecei no ABC. Comecei em São Caetano. E, quando eu parei de jogar, foram saber porquê, e eu disse que tinha que começar a trabalhar para poder pagar os meus estudos e que eu não tinha condições. Foi quando eu comecei a ter uma ajuda de custo e quando eu entrei no “Adote um atleta”. Eles começaram a me dar uma ajuda de custo, fui adotada pela Caloi , na época; fui ajudando a minha família com esse dinheiro. Então foi por isso que eu não pude largar, porque eles dependiam pouco - não totalmente - de mim, mas um pouco de mim. E hoje eu cuido deles, eles moram do meu lado. Minha mãe é que nem eu, ela é aventureira. O meu pai não, ele já é mais pacato.
358|31/08/1987|Hortência|359|Wlamir Marques| Você estudou até onde, Hortência?
359|31/08/1987|Hortência|360|Hortência| Eu sou professora de educação física.
360|31/08/1987|Hortência|361|Wlamir Marques| Fez educação física?
361|31/08/1987|Hortência|362|Hortência| Fiz o curso completo. Fiz curso técnico de basquete, também.
362|31/08/1987|Hortência|363|José Góes| Vamos supor, se amanhã aparece uma garotinha do interior... 12, 13, 14 anos, simples, humilde, sem recursos e você teria descoberto ali uma possível estrela do basquetebol. Você ajudaria?
363|31/08/1987|Hortência|364|Hortência| Tranqüilamente, nem que fosse para morar comigo!
364|31/08/1987|Hortência|365|Marcelo Resende| Vai ter uma fila na porta da tua casa amanhã!
365|31/08/1987|Hortência|366|[risos]|
366|31/08/1987|Hortência|367|Hortência| Mas eu tenho que sentir que ela vai ser uma grande jogadora, como eles - a Norminha, o Waldir  - sentiram. Porque eu era... Ninguém dava nada para mim! : “Imagina que você vai jogar basquete!”. Eu era totalmente esquelética, eu não tinha nada a ver, e eles acreditaram que eu podia ser uma jogadora.
367|31/08/1987|Hortência|368|Juca Kfouri| Eu só não entendi, Hortência, como é que você pôs na cabeça que você ia jogar basquete. Como é que nasceu o seu namoro com a bola de basquete? Quando foi? Esse é o momento que eu não entendi...
368|31/08/1987|Hortência|369|Hortência| Eu entrei na quinta série do ginásio e aprendi handebol. Já fiquei apaixonada! Porque qualquer coisa que dessem para mim, eu fazia. E fazia bem! Eu acho que eu nasci para ser atleta. Então eu comecei com handebol. Aí eu mudei de escola e a outra professora já dava basquete. Aí eu vi o basquete! Gostei, adorei o basquete também! Mas aí entra aquela história que eu falei para a Norminha, da Marlene ser da Seleção Brasileira de basquete. Me encantou! Porque ela era da seleção, eu via ela na televisão! E aquilo me chamou a atenção. Entrei no meio do basquete e me deram toda a força, me deram toda aquela estrutura e eu...
369|31/08/1987|Hortência|370|Ouhydes Fonseca| Há quem diga que você usa a família como uma espécie de desculpa para não aceitar, não enfrentar esse desafio que é sair do Brasil. Quer dizer... Você é uma pessoa criada no interior, com costumes bem rígidos, a educação bem rígida e tal... E você temeria sair do Brasil, ficar longe da família, dos amigos etc. e se desgastar.
370|31/08/1987|Hortência|371|Hortência| De maneira alguma. Eu acho que quem enfrenta Cuba, Estados Unidos, não vai ter medo de sair do país!
371|31/08/1987|Hortência|372|[risos]|
372|31/08/1987|Hortência|373|Ouhydes Fonseca| Viver fora.
373|31/08/1987|Hortência|374|Hortência| De maneira alguma. Eu gosto de desafios, eu adoro desafios. Quando uma coisa se torna difícil para mim, aí é que eu entro de cabeça naquilo.
374|31/08/1987|Hortência|375|Marcelo Resende| Qual seu signo?
375|31/08/1987|Hortência|376|Hortência| Eu sou de Libra.
376|31/08/1987|Hortência|377|Juca Kfouri| Só podia ser!
377|31/08/1987|Hortência|378|Norminha| Hortência, como professora de educação física que você é, qual o principio básico que você...
378|31/08/1987|Hortência|379|Hortência| Lá vem ela! 
379|31/08/1987|Hortência|380|Norminha| Não, é básico, eu sou professora! Eu estou perguntando para uma outra professora também!
380|31/08/1987|Hortência|381|Hortência| Faz tempo que eu não exerço a minha profissão!  Fala!
381|31/08/1987|Hortência|382|Norminha| Tudo bem, como se chama o magrão que jogou futebol? O Sócrates! Ele está novamente... isso não impede, você está na área.
382|31/08/1987|Hortência|383|Juca Kfouri| Não sei se você dá um filho para ele cuidar hoje! 
383|31/08/1987|Hortência|384|[risos]|
384|31/08/1987|Hortência|385|Norminha| Qual princípio básico você teria para iniciar como professora e como técnica? Em criança, adolescentes... Como que você agiria, qual seria o objetivo primeiro?
385|31/08/1987|Hortência|386|Hortência| Se eu vou ensinar basquete?
386|31/08/1987|Hortência|387|Norminha| Não, educação física. Pressupõe que posteriormente a criança fosse fazer basquete.
387|31/08/1987|Hortência|388|Hortência| Qual o princípio básico?... Primeiro ela tem que saber se ela quer fazer aquilo, se ela gosta daquilo. Porque, às vezes, tem muita criança que não sabe nem porque está ali. Uma criança tem que gostar daquilo que ela está fazendo.
388|31/08/1987|Hortência|389|Norminha| Você não acha que primeiro seria formar o indivíduo, o ser humano?
389|31/08/1987|Hortência|390|Hortência| Também!
390|31/08/1987|Hortência|391|Norminha| Antes de formar um atleta?
391|31/08/1987|Hortência|392|Hortência| Não, eu acho que primeiro... Formam-se os dois juntos. Eu, por exemplo, acho que o esporte que faz a personalidade, que fez a minha personalidade, então eu acho que isso forma junto. Eu acho que você vai formando o atleta e a personalidade dele juntas, não adianta você formar a personalidade dele antes para depois você formar o atleta.
392|31/08/1987|Hortência|393|Norminha| Eu não estou dizendo a personalidade, porque para mim a personalidade é mutável. O caráter não, correto? O caráter você vai levá-lo até o fim da vida. Formar o indivíduo, que eu digo, como professora, estou me referindo à formação dele para que ele tenha sustentação e suporte para ser atleta.
393|31/08/1987|Hortência|394|Hortência| Eu concordo! Eu acho que você, como professora, você tem que formar o homem, o atleta, o indivíduo... Você tem que formar tudo, ensinar tudo. Ensinar que não pode fumar, que não pode beber, que não pode fazer isso... Gradativamente você vai ensinando tudo.
394|31/08/1987|Hortência|395|Norminha| Estou vendo que você não esqueceu tudo da profissão! 
395|31/08/1987|Hortência|396|Hortência| Não!
396|31/08/1987|Hortência|397|Wlamir Marques| Vou te perguntar... Antes de perguntar eu vou justificar a minha pergunta. Eu não conheço nenhum atleta ídolo aqui no Brasil, nenhum... Atletismo, natação, basquete, futebol - futebol, vamos deixar de lado, porque no futebol se forja. Eu não conheço nenhum que tenha sido ídolo... João do Pulo, Nelson Prudêncio, Ademar Ferreira da Silva ...
397|31/08/1987|Hortência|398|[...]| Wlamir Marques!
398|31/08/1987|Hortência|399|Wlamir Marques|  Que não tenha surgido aqui, neste país, acidentalmente. Nada se forja, você não foi forjada. É o tal negócio... Igual à Hortência, outras começaram em São Caetano, achando que a Marlene era o grande ídolo. E porque deu certo a Hortência, que veio lá de uma cidade, de Potirendaba,  os país simples e humildes? A Hortência é mais um dos fenômenos - ela e a Paula -, são mais um dos fenômenos que apareceram nesse país. Nós não vamos forjar nunca outra Hortência. Vai aparecer outra Hortência acidentalmente, vai aparecer outro João do Pulo... Quando a gente for ver a origem, a gente vai dar risada, : “Puxa vida, mas saiu disso daí? Sem recurso nenhum, sem nada...”.
399|31/08/1987|Hortência|400|Augusto Nunes| Uma informação... Você é uma das atrações deste programa, você também começou por acaso?
400|31/08/1987|Hortência|401|Wlamir Marques| Acidentalmente! Eu comecei acidentalmente! Eu comecei praticando natação, joguei voleibol, joguei futebol. Acidentalmente, meus pais mudaram para uma residência onde bastava eu pular o muro da minha casa, eu estava numa quadra de basquete. Se fosse uma piscina, eu seria nadador!
401|31/08/1987|Hortência|402|Hortência| Você também era de família pobre?
402|31/08/1987|Hortência|403|Wlamir Marques| Não seria pobre, mas naquela época não tinha nem pobre e nem rico, porque não havia inflação. Hoje a gente fica pobre de repente.
403|31/08/1987|Hortência|404|[risos]|
404|31/08/1987|Hortência|405|Hortência| Sabe por que eu estou te perguntando isso? Porque, realmente, eu acho que a família quando é pobre, é mais fácil do cara... Porque ele tem tantos ideais, tem tantas coisas que ele quer ter e que ele não pode ter - porque não tem dinheiro... Então eu acho que é importante também. Eu acho que muitos ídolos nasceram de famílias humildes. Eu acho que 90%.
405|31/08/1987|Hortência|406|Marcelo Resende| A necessidade...
406|31/08/1987|Hortência|407|Hortência| A necessidade de agarrar aquilo, porque não tem uma outra coisa para você agarrar. Se você não conseguir aquilo, você não vai ser mais uma outra pessoa, não tem o amanhã. Então eu acho que aquela necessidade de você ser uma jogadora de basquete, de querer ter um carro, de querer ter uma vida decente, faz com que você trabalhe.
407|31/08/1987|Hortência|408|Wlamir Marques| Agora, você veja, o Paulo Planet falou recentemente que os romenos foram para os Estados Unidos para formar ginastas. E é recente. Na nossa época, Nádia Comăneci foi uma menina preparada desde os cinco, seis anos de idade para ser campeã olímpica no ano “x”. E nós aqui, nós não trabalhamos com programas, nós não temos metas. Nós temos o Campeonato Sul Americano que começa no mês que vem, a Olimpíada... Não se fala em Seul. Alguém fala em preparação para Seul aqui nesse país? Alguém forjou alguma coisa para a Seul? Nós vamos com a mesma coisa que nós fomos nesse Panamericano e  torcer para, outra vez, dar certo. Quando dá certo a gente fala assim: “puxa, não é que deu certo?!”. É como esse nosso basquetebol masculino: chegou no fim, houve uma surpresa total, como se a gente tivesse ganho o maior campeonato que já houve na história do esporte nacional! Porque nós conseguimos uma coisa impossível! Por que é impossível? Eu parabenizo você e outros ídolos nossos que conseguiram às custas de vocês, com ajuda de amigos realmente importantes... Mas eu gostaria que, igual a você, outras fossem forjadas; outros Pelés surgissem aqui... Para a gente não ficar na geração sempre assim Pelé, Garrincha; Wlamir, Amauri; Hortência, Paula... Sempre em dupla. Por que sempre em dupla?
408|31/08/1987|Hortência|409|Augusto Nunes| E, aproveitando as observações do Wlamir Marques... O que poderia ser feito para que o surgimento de atletas da tua categoria, num país como o Brasil, fosse uma coisa mais freqüente, mais fluente? Isso é uma política de governo? Ou são as empresas patrocinadoras que deveriam resolver? Qual o caminho?
409|31/08/1987|Hortência|410|Hortência| Acho que tem que ser o conjunto de tudo isso. Eu acho que as empresas têm que entrar, tem que ajudar. Porque sem dinheiro você não consegue formar.
