|DATA|ENTREVISTA|ORDEM|LOCUTOR|FALA
84|31/08/1987|Hortência|85|Roberto Pereira de Souza| Você me disse, lá em Indianápolis, o seguinte: que a Maria Helena tinha mexido em algumas feridas da Seleção e tinha feito bons curativos. Que feridas eram essas?
85|31/08/1987|Hortência|86|Hortência| Eu não lembro de ter falado isso para você.
86|31/08/1987|Hortência|87|Roberto Pereira de Souza| Mas você falou. Até mesmo no aspecto de que poderia haver pequenos ciúmes, coisinhas assim de relacionamento, de ajeitar algumas coisas.
87|31/08/1987|Hortência|88|Hortência| Veja bem, olha a diferença. Eu chego para você e falo assim: “Porque não estou satisfeita com isso, com aquilo”. Aí você fala: “Realmente a Maria Helena é fogo e não sei o quê”. Aí eu pego e falo para uma outra pessoa: “A Maria Helena ela fez...”.  fala: “Não, não é isso! Ela respondeu daquele jeito para você porque ela estava nervosa, mas ela gosta...”. Você vê a diferença? Antigamente tinha isso, hoje não tem mais. Às vezes, alguma menina levanta meio... Não está no dia, aqueles negócios todos, então : “Não agüento mais ficar aqui! Não agüento de saudades não sei do quê”.  fala: “Que nada amanhã a gente vai embora, vamos pensar na medalha!”. Já muda o astral!
88|31/08/1987|Hortência|89|[sobreposição de vozes]|
89|31/08/1987|Hortência|90|Ouhydes Fonseca| Dentro da questão, isso significa que, para uma seleção feminina de basquete, vocês têm que ter uma técnica mulher?
90|31/08/1987|Hortência|91|Hortência| Não. Eu acho que ela é assim não pelo sexo, mas sim pela competência que ela tem. Eu acho que ela não é boa porque ela é mulher. Mas, também, pode ser que pela sensibilidade que ela tem como mulher, e pela convivência que ela teve dentro do esporte, ela tenha essa sensibilidade de pegar logo o fio, bem no começo.
91|31/08/1987|Hortência|92|Norminha| Hortência, voltando a anos atrás, você se lembra  como você iniciou a sua carreira de basquetebol em São Caetano?
92|31/08/1987|Hortência|93|Hortência| Eu lembro. Eu lembro que eu cheguei numa escolinha e que, até, eu fiquei entusiasmada porque era a Marlene  que dava a escolinha. Eu fiquei doida!  “A Marlene da Seleção Brasileira!” . Fiquei louca, queria jogar também. Comecei a jogar e aí já viram que eu tinha jeito para correr, pra pular...
93|31/08/1987|Hortência|94|Norminha| Vou te lembrar mais. Você lembra o problema que houve - porque é interessante para os telespectadores saberem o teu início da carreira do basquetebol -, a briga que a Marlene fez com o Carlos Ventura, que é treinador do João do Pulo , porque ele queria você para o atletismo. A Marlene falou: “Não, eu quero a Hortência para o basquete!”. Foi uma briga porque ele viu o potencial da Hortência. A Hortência, na realidade, teve um início no basquetebol com a Marlene José Bento, que eu gostaria de lembrar, porque ninguém se lembra. Acho que cada parcela é uma parcela. Então, com o passar dos anos, cada um diz: “Eu fiz essa jogadora! Fiz aquela jogadora!”, mas se esquecem da contribuição. E a Hortência nunca, em nenhuma reportagem - de frente estou te falando - nunca você se lembrou de dizer do teu início em São Caetano. Porque, na realidade, aconteceu. Como aconteceu, também, uma fase de Centro Olímpico , que foi muito importante. O que você teve dentro do Centro Olímpico de Treinamento e Pesquisa?
94|31/08/1987|Hortência|95|Hortência| Realmente, foi muito importante. Até, você era a minha técnica lá no Centro Olímpico. Foi muito importante. Toda a fase da minha carreira foi importante, tanto o início - na minha escola, com a minha professora Mitsuko, que foi a minha primeira professora que me deu  primeira vez a bola de basquete - até a minha chegada em São Caetano com a Marlene, a minha ida ao Centro Olímpico que foi com você, Waldir Pagan ... Tudo isso teve grandes... Vocês foram muito importantes na minha carreira. Então quando eles me perguntam, eu falo, mas é tão rápido que não dá tempo de contar tudo com detalhes. Mas eu, aqui dentro , eu jamais vou esquecer.
95|31/08/1987|Hortência|96|Norminha| Não é por isso, é porque eu conheci uma Hortência criança...
96|31/08/1987|Hortência|97|Hortência| Mas eu ainda sou. 
97|31/08/1987|Hortência|98|Norminha| Quando te interessa, tem esse detalhe!  Teve uma Hortência imatura, uma Hortência adolescente... Quais são as críticas que você faz para esse tempo, Hortência?
98|31/08/1987|Hortência|99|Hortência| Eu não faço críticas. Eu acho que cada um tem a sua época, né? Eu acho que tem que ser criança, moleque, adolescente... Até você chegar a ser uma mulher. Sinceramente, eu nunca penso no que já passou, no que eu fui... Eu sempre penso no meu presente, no que eu estou fazendo agora e no que eu tenho que fazer depois. Então, o meu passado está sempre gravado aqui, sempre guardo as coisas boas. E as coisas ruins, eu procuro sempre deixar um pouquinho de lado.
99|31/08/1987|Hortência|100|Augusto Nunes| Hortência, antes de passar para a Ester e completar a roda - e a partir daí a conversa fica solta - desculpa eu ter interrompido o Marcelo. Eu faço com o maior prazer, aqui, mais um esclarecimento que me é cobrado justamente por um telespectador chamado José Ernesto, de Santos.  diz assim: “Wlamir Marques não é apenas um ex-jogador de basquete e sim ex-bicampeão mundial de basquete”. Digo isso com maior prazer! Sou fã, há muito tempo, do Wlamir. Wlamir, como a Norminha, ambos são glórias do esporte brasileiro. As apresentações são um tanto sucintas e a gente deixa de dizer aqui coisas muito importantes a respeito das pessoas. Fica feito esse adendo que eu faço, realmente, com maior prazer. Ester.
100|31/08/1987|Hortência|101|Ester Lima| Hortência, você vem sendo apontada, há alguns anos, como a melhor jogadora do mundo. Você se considera a melhor do mundo?
101|31/08/1987|Hortência|102|Hortência| Não, eu acho que, às vezes, o pessoal exagera um pouco. Eu acho. Eu não... Eu me considero no bloco de algumas jogadoras no mundo, mas não a melhor. Eu acho que não dá para você apontar a melhor, sabe? Porque existem fases. Às vezes eu não estou bem, às vezes tem outra que está bem melhor, então eu não me considero a melhor jogadora do mundo, não.
102|31/08/1987|Hortência|103|Ester Lima| No Pan-Americano, agora, você acha que a sua atuação ficou dentro desse bolo... Entre as melhores?
103|31/08/1987|Hortência|104|Hortência| Eu vou ser sincera para você: eu acho que não foi umas das melhores atuações que eu já fiz, sabe? Mas é que os americanos, desde a Olimpíada de Los Angeles, estavam me esperando. Até, eles vieram aqui no Brasil, fizeram uma reportagem comigo na esperança  que eu, realmente, fosse para as Olimpíadas. Mas o Brasil, infelizmente, não se classificou. Então eles leram sobre a minha vida e, de repente, não me viram jogar nas Olimpíadas. E, de repente, no Pan-Americano... Foi nos Estados Unidos, então eu estava ali. Eles queriam ver se eu realmente era tudo aquilo que eles haviam passado pelo jornal. De repente eu fiquei até com medo. Falei: “Gente, de repente, e se eu não jogo bem? O pessoal vai ficar todo decepcionado”. Então, sinceramente, eu não gosto desse tipo de coisa.
104|31/08/1987|Hortência|105|Ester Lima| Você acha que essa preocupação te atrapalhou um pouco?
105|31/08/1987|Hortência|106|Hortência| Não, não me atrapalhou. Porque eu fiquei totalmente isolada. Veja bem, saiu entrevista minha no New York Times e eu não li. Até hoje eu não li essa reportagem.
106|31/08/1987|Hortência|107|Juca Kfouri| Você sabe inglês, Hortência?
107|31/08/1987|Hortência|108|Hortência| Mais ou menos, muito menos do que mais.
108|31/08/1987|Hortência|109|Juca Kfouri| Porque eu acho que é importante deixar claro para o telespectador que a maior revista de esportes dos Estados Unidos, a Sports Illustrated, às vésperas da Olimpíada, já chamava a Hortência de rainha. Quer dizer, eu imagino que isso... Ao ir para lá, essa coisa devia povoar um pouco o seu sonho: “Como é que vai ser na terra do basquete?”.
109|31/08/1987|Hortência|110|Hortência| Não, eu não fui com a preocupação de ser a rainha, mas eu fiquei preocupada porque quando eu cheguei lá eu levei um susto. Falei: “Nossa, gente!”. De repente, todo mundo queria saber como é que eu era, como eu não era, e eu fiquei preocupada. Falei: “Eu não quero decepcionar esse pessoal, mas também não quero entrar na quadra com a preocupação de ser a melhor. Porque eu quero ajudar a minha equipe, eu não quero aparecer”.
110|31/08/1987|Hortência|111|Paulo Planet Buarque| Por falar em sua equipe, você declarou uma coisa aí que... Realmente, bastante importante. Você disse que vocês não perderam, foi a equipe dos Estados Unidos que ganhou. Eu gostaria de saber por quê.
111|31/08/1987|Hortência|112|Hortência| Porque eu acho que, hoje, a nossa equipe não tinha condições de ganhar deles.
112|31/08/1987|Hortência|113|Paulo Planet Buarque| Por quê? 
113|31/08/1987|Hortência|114|Hortência| Porque nós temos muito  que treinar ainda. Nós temos muito  que fazer ainda em termos de defesa, em termos de ataque... A Maria Helena mesmo, no final - porque nós trabalhamos com Deus do nosso lado sempre, rezamos, sempre pensamos nele, sempre, tanto eu, como Maria Helena, como toda a equipe - ela disse: “Gente, Deus não deu agora, mas ele vai dar ainda. Nós temos que trabalhar, batalhar para isso”. Então, eu acho que nós subimos ao pódio, que foi o que nós queríamos, que era o nosso maior desejo - disputar a final -, nós disputamos. Agora é continuar batalhando para classificação nas Olimpíadas.
114|31/08/1987|Hortência|115|Paulo Planet Buarque| Essa superioridade americana, ela se expressa de que forma? Isso é muito importante. Veja bem, é porque a equipe americana é constituída por maior equilíbrio de qualidade individual ou é porque a equipe americana possui jogadoras de maior altura, várias delas... Por quê?
115|31/08/1987|Hortência|116|Hortência| A altura é uma coisa que influencia muito e elas têm a jogadora Anne Donovan que tem dois metros e cinco, que, realmente, é muito boa. Mas eu acho que elas têm muitas opções. Veja bem: para elas convocarem 12 jogadoras, elas têm mil, mil e quinhentas - jogadoras de nível! - para integrar a Seleção Americana. Já não é o nosso caso. Nós, para tirar 12, você aponta vinte e olhe lá.
116|31/08/1987|Hortência|117|Paulo Planet Buarque| Por quê?
117|31/08/1987|Hortência|118|Hortência| Porque não tem muita jogadora no Brasil. Se tiver quinhentas, seiscentas pessoas hoje praticando basquete de alto nível, é muito. Então, quer dizer, fica difícil. É mais difícil para a Maria Helena trabalhar em cima desses números. Mais difícil do que para eles.
118|31/08/1987|Hortência|119|Marcelo Resende| Já que é a rainha, a rainha será tratada como tal.  Me diga o seguinte: qual é o sonho da mulher Hortência? Como que você vive, o que você gosta de fazer? E qual o seu sonho como mulher, agora, adulta?
119|31/08/1987|Hortência|120|Hortência| O meu sonho realmente é o basquete. Para mim tudo  é o basquete. Agora, fora isso, eu vivo uma vida normal, como qualquer outra mulher.
120|31/08/1987|Hortência|121|Marcelo Resende| O que você gosta de fazer?
121|31/08/1987|Hortência|122|Hortência| Eu gosto de fazer tudo. Eu gosto de ficar em casa, eu gosto de sair, fazer compras, ir ao cinema, ir numa boate, namorar...
122|31/08/1987|Hortência|123|Ester Lima| Você tem tempo de fazer isso?
123|31/08/1987|Hortência|124|Hortência| Tenho.
124|31/08/1987|Hortência|125|Roberto Pereira de Souza| Você gosta de guiar a 150 km/h ou não?
125|31/08/1987|Hortência|126|Hortência| Também.
126|31/08/1987|Hortência|127|Marcelo Resende| Você lê, você tem hábitos de leitura?
127|31/08/1987|Hortência|128|Hortência| Leio!
128|31/08/1987|Hortência|129|Marcelo Resende| Que hábitos de leitura você tem?
129|31/08/1987|Hortência|130|Hortência| Eu gosto de livro best seller... Eu gosto de qualquer  livro, independente se é romance ou...
130|31/08/1987|Hortência|131|Marcelo Resende| Você leu em Indianápolis algum, assim, que tivesse batendo contigo?
131|31/08/1987|Hortência|132|Hortência| Lá em Indianápolis? Lá eu li um livro que chama Um caprichos dos deuses . Levei daqui do Brasil. Mas eu leio livros que me recomendam.
132|31/08/1987|Hortência|133|Augusto Nunes| Hortência, vários telespectadores fizeram essa mesma pergunta, um deles foi o senhor Emilio Carlos, da Moóca: “Você acha que o esporte masculiniza a mulher?” Eu completaria: Você... a tua aparência é crescentemente mais feminina de uns tempos para cá. Você usava um rabo de cavalo... Você mesma declarou numa entrevista que você aparecia sempre de calção, com camisa, rabo de cavalo e  você foi desenvolvendo, digamos assim, esse lado evidentemente feminino que você tem. Você tinha essa preocupação? Essa pergunta freqüentava a sua cabeça, essa imagem  o basquete masculiniza?
133|31/08/1987|Hortência|134|Hortência| Eu sempre tive essa preocupação, porque tinha aquela  “Jogadora de basquete é sapatão”, aquelas coisas todas... Quer dizer, eu sempre tive, porque não é verdade. Eu não me acho masculina, pelo contrário. Agora, na quadra estou pouco me importando se eles estão achando que sou homem ou mulher. Na quadra é diferente. Ali você está defendendo um país, está defendendo uma cidade, defendendo um time, ali não me importa. Saindo daquilo eu não vejo... Eu me acho muito feminina. O único problema é que a imagem que nós temos é dentro da quadra... então é a Hortência de rabinho, suada, com o semblante bem... sabe? Agora, fora é diferente. Eles não estão acostumados a nos ver - jogadoras de basquete feminino - fora da quadra, num baile, numa boate, num restaurante... Quer dizer, o público em geral, né? Porque algum sempre encontra a gente no meio da rua. Então, às vezes... Em programas de televisão, você só aparece depois que você começa a ter uma certa evidência, então aí você começa a mostrar aquele outro lado que você tem  que eles nunca...
134|31/08/1987|Hortência|135|Roberto Pereira de Souza| Você pensa em ter um filho?
135|31/08/1987|Hortência|136|Hortência| Ô! É minha maior loucura.
136|31/08/1987|Hortência|137|Ester Lima| Você acha que dá para conciliar essa vida de mãe de família com vida de jogadora de basquete?
137|31/08/1987|Hortência|138|Hortência| Dá, a Isabel ] não concilia?
138|31/08/1987|Hortência|139|Ester Lima| Mais ou menos.
139|31/08/1987|Hortência|140|Hortência| Por isso que eu não tive até hoje.
140|31/08/1987|Hortência|141|Augusto Nunes| Porque existe essa imagem? A incidência de homossexualismo no esporte feminino é maior do que nos outros setores?
141|31/08/1987|Hortência|142|Hortência| Mas está mudando. Acho que está mudando essa imagem. Eu acho que a mulher está acompanhando a evolução, né?... Os tempos estão mudando, então a cabeça - tanto do homem como da mulher - também está mudando com relação ao esporte. Veja bem, antes não tinham muitas mulheres que praticavam esportes e hoje elas já estão .
142|31/08/1987|Hortência|143|Juca Kfouri| Eu li no Globo, Hortência, uma entrevista sua em que você diz que você aceita melhor o homossexualismo feminino do que o masculino. Por quê?
143|31/08/1987|Hortência|144|Hortência| Não, eu nunca disse isso.
144|31/08/1987|Hortência|145|Marcelo Resende| Você já levou alguma cantada? Já?
145|31/08/1987|Hortência|146|Hortência|  Já. Mas tirei de letra!
146|31/08/1987|Hortência|147|Marcelo Resende| É mesmo! Já levou? Como foi?
147|31/08/1987|Hortência|148|Hortência| Eu recebo tão poucas, porque elas sabem que eu não sou, então elas não...
148|31/08/1987|Hortência|149|Wlamir Marques| Olha, Marcelo, eu queria fazer um testemunho aqui. Veja bem, Hortência, eu acompanho basquetebol feminino há muitos anos, eu fui técnico de basquetebol feminino... O que eu acho é o seguinte: eu acho que o uniforme que se usa hoje do basquetebol feminino, eu acho que ele é terrivelmente masculino. Eu acho que ele é muito feio para as mulheres. Por exemplo, as meninas do voleibol... Vendo voleibol, ninguém diz que no voleibol a menina ali é masculina. Por quê? Ali está aparecendo muitas coisas. No basquetebol feminino esconde-se tudo e, outra coisa:  um calção muito comprido, uniforme também. O uniforme... Eu tenho impressão  que a jogadora do basquetebol, na hora que ela está jogando, ela não é atração além de jogadora. Eu acho que o uniforme é feio.
149|31/08/1987|Hortência|150|Ester Lima| Parece que vai mudar.
150|31/08/1987|Hortência|151|Wlamir Marques| Eu acho que o uniforme dá esse tipo de aspecto...
151|31/08/1987|Hortência|152|Norminha| Esse uniforme com o shorts, com as meias até o joelho, foi depois que entrou o Barbosa, que vocês, inclusive, escolheram. Me parece que as meninas que escolheram o uniforme, porque não se via nada. Era meia de futebol, shorts até o meio da coxa, tá certo? Porque a jogadora de basquetebol já é mais “atarrancadinha”... Quer dizer, na minha época se jogava de sunga. Agora, voltando ao tema que você falou... Todo mundo se preocupa com a opção sexual do ser humano e não por aquilo que ele é, não por aquilo que ele faz, não pela sua intelectualidade, pela sua profissão, pela sua capacidade. Então pergunto à Hortência - porque ela sempre é questionada como qualquer jogadora de basquetebol, de voleibol, de futebol, isso já vem desde milênios - a única pergunta básica, fundamental é se é homossexual ou não é. Pergunto à vocês: o que importa isso na individualidade do ser, Hortência?
152|31/08/1987|Hortência|153|Hortência| Não importa nada, tanto é que esse tipo de assunto não existe na Seleção Brasileira. Porque eu acho que cada um tem a sua vida particular e nós temos que respeitar a maneira delas  quererem viver. Esse é um problema particular delas. Então por isso  que não está tendo problema na Seleção Brasileira. O que você faz dali para fora é um problema seu. Desde que não atrapalhe o seu relacionamento dentro da equipe, não trazendo problemas dentro da equipe...
153|31/08/1987|Hortência|154|Juca Kfouri|  Eu tinha te perguntado e você não completou a resposta. Porque você declarou que te importunava mais o homossexualismo do masculino do que o feminino?
154|31/08/1987|Hortência|155|Hortência| Eu não lembro, eu não sei se eu falei isso. Se eu falei eu realmente me enganei, porque eu acho que - tanto o homem como a mulher - cada um vive a sua vida. Eu acho que o homem, se ele quer sair com homem, é um problema particular dele; e a mulher também. Eu acho que nenhum dos dois fere mais do que o outro. Eu acho que os dois são iguais. Eu acho que isso é uma opção de vida que cada um escolhe. Cada um escolhe aquilo que ele quer.
155|31/08/1987|Hortência|156|Marcelo Resende| Hortência, me diga uma coisa: no futebol, tem sempre aquela história de que o jogador não pode ter relação sexual 48 horas antes do jogo porque atrapalha... Enfim, tem toda uma história ao redor disso. No basquete feminino há também essas coisas, essas limitações? Ou vocês têm liberdade de exercer, como vocês bem entendem, as suas vidas? E você acredita que atrapalha?
156|31/08/1987|Hortência|157|Hortência| Nós não temos . Eu não acredito que atrapalha. Eu acho que cada ser humano é de uma maneira diferente. Para uns pode atrapalhar, para outros pode ser até melhor, se sente mais... Quer dizer, isso depende de cada um. Nós não temos esse problema, porque nós nos concentramos... Cada uma vive na sua casa e só sai duas horas antes do jogo para ir para a quadra.
157|31/08/1987|Hortência|158|Augusto Nunes| Hortência, eu queria chamar agora a pergunta da jornalista Marina Moraes, que fez a cobertura dos X Jogos Pan-Americanos, em Indianápolis, para a TV Cultura, e que vai entrar por um desses monitores.
158|31/08/1987|Hortência|159|Marina Moraes| Hortência, durante um papo em Indianápolis você me disse que estava fazendo aulas de jazz e ginástica rítmica - entre outras coisas - para suavizar os gestos, porque o basquete é um esporte de movimentos muito duros. Eu queria saber se você tem a preocupação, ou já teve, com esse estereótipo  que o basquete carrega de ser um esporte masculino ou - usando uma expressão mais popular - de ser um esporte de mulher-macho.
159|31/08/1987|Hortência|160|Hortência| Eu já respondi metade, né? Eu faço ginástica rítmica porque eu gosto! Eu gosto de dançar, eu gosto de música... E acho que ela trabalha algumas partes do corpo da mulher que o basquetebol não dá muita importância. Então eu gosto de fazer esse tipo de... E é uma coisa diferente... Sem ser bola, sem ser aquele negócio mais...
160|31/08/1987|Hortência|161|Juca Kfouri| Você estava no Morumbi ontem. Você saiu de lá feliz, de cabeça inchada ou é palmeirense? 
161|31/08/1987|Hortência|162|[risos]|
162|31/08/1987|Hortência|163|Hortência| Cabeça inchada.
163|31/08/1987|Hortência|164|Juca Kfouri| Cabeça inchada?
164|31/08/1987|Hortência|165|Hortência| Eu nunca fui assistir uma final. Aquele dia eu fiquei impressionada!
165|31/08/1987|Hortência|166|Augusto Nunes| Você é corinthiana, Hortência?
166|31/08/1987|Hortência|167|Hortência| Sou!
167|31/08/1987|Hortência|168|Ouhydes Fonseca| Esse novo visual, mais feminino... A Maria Helena tem alguma coisa a ver com isso? Porque não é só você que tem aparecido fora das quadras mais elegante, mais bonita, mais feminina. Todas as outras jogadoras... A gente tem comparecido a algumas coletivas e elas sempre se apresentam assim. Faz parte do esquema da técnica ou é alguma coisa que aconteceu por acaso?
168|31/08/1987|Hortência|169|Hortência| Não faz parte do esquema. Como nós falamos, nós não nos preocupamos com o fora da quadra. Cada um faz aquilo que quer. Mas existe um detalhe muito importante: a Maria Helena pega no pé das jogadoras.  “Tem que emagrecer, você está muito gorda! Tem que emagrecer, você está muito gorda!”. Então, de repente - a Paula, não sei se vocês lembram, no mundial de 1983 ela era muito mais gorda do que ela é hoje - elas começaram a emagrecer e começaram a descobrir que são bonitas, que têm um corpo bonito. Então, de repente, resolveram mostrar isso, sabe? Resolveram mostrar que elas também são mulheres, que elas são bonitas e, hoje, se você vê a jogadoras fora da quadra, são altamente produzidas. Como a nossa técnica, que sempre vai impecável. É uma delícia você estar lá fora e você ouvir o outro técnico falar: “Nossa, como ela é bonita!”. Então você fala: “Ela é minha técnica!”. 
169|31/08/1987|Hortência|170|Juca Kfouri| Aquela garota argentina que jogou aqui, aquela era um exagero! Era só bonita e não era jogadora de basquete? Ou eu estou enganado? Era uma boa jogadora de basquete também?
170|31/08/1987|Hortência|171|Hortência| Era só bonita.
171|31/08/1987|Hortência|172|José Góes| Aliás, vocês têm que seguir realmente a Maria Helena! Porque nós mostramos, aqui na Cultura, todos os jogos de Indianápolis. E a cada jogo ela se apresentava de maneira diferente, sempre elegante, simpática...
172|31/08/1987|Hortência|173|Hortência| Não só ela como a Heleninha, também.
173|31/08/1987|Hortência|174|José Góes| Exatamente! Mas ela apareceu mais. Aquela pergunta que foi feita há pouco a você sobre filho, casamento e marido... A seleção de vôlei, voleibol feminino, sentiu muito a ausência de jogadoras excepcionais nesses últimos dois anos.  Problemas de casamento, marido, cuidar de filho e tal. Então, dentro da sua filosofia de jogar basquete, de viver o basquete... Você, pelo menos tão cedo, não vai se casar, não vai ter filho?
174|31/08/1987|Hortência|175|Augusto Nunes| Eu queria incorporar a essa pergunta essa preocupação de muita gente que está telefonando para saber o que houve com o seu noivado. Vários espectadores perguntam se, primeiro, o fato do Maurício  - teu ex-noivo - não ter sido convocado e não ter ido para Indianápolis atrapalhou alguma coisa? E muita gente quer saber se é muito difícil você, com a dedicação plena ao basquete, manter algum tipo de relação sentimental mais duradoura.
175|31/08/1987|Hortência|176|Juca Kfouri| Mas deve ter muita telespectadora perguntando também!
176|31/08/1987|Hortência|177|Augusto Nunes| Tem todo tipo de pergunta!
177|31/08/1987|Hortência|178|[risos]|
