|DATA|ENTREVISTA|ORDEM|LOCUTOR|FALA
178|31/08/1987|Hortência|179|Hortência| Respondendo à sua pergunta, eu acho que você tem uma carreira muito curta. É uma profissão que acaba logo, são 15, vinte anos no máximo. Eu quero aproveitar muito isso. Então eu acho que ter um filho agora vai me atrapalhar, eu posso deixar isso para depois. E casamento... Não tem idade para você casar. Até é bom você casar um pouco mais velha, porque aí você já tem consciência daquilo que você quer. E para ter filhos também... Até os 35, 37 anos eu posso ter filho tranqüilamente, porque eu sou uma pessoa saudável. Então eu vou começar a me preocupar com essa minha vida de mãe, que eu sonho muito em ter, depois que eu parar de jogar basquete. Agora eu queria responder à sua pergunta em relação ao meu noivado, o meu relacionamento com o Maurício não era muito difícil, porque ele sabia entender. Porque ele é um atleta e eu também, sendo uma jogadora de basquete, compreendia muito essa nossa distância. Agora, quanto a ele não ter sido convocado, isso não teve nada a ver. Foi um relacionamento de quatro anos e que poderia ter dado certo ou poderia não dar certo, que foi o que aconteceu. Não deu certo, resolvemos ficar amigos.
179|31/08/1987|Hortência|180|Roberto Pereira de Souza| Você estava falando que você percebe uma evolução na forma de ver da mulher, a mulher evoluiu muito. Você também evoluiu bastante, pelo que você está dizendo. Eu queria saber se, nesse time feminino, vocês discutem outras coisas que não seja exatamente tática de jogo. Se vocês falam de política, se vocês discutem a Constituinte, se vocês discutem votos, políticos, a situação do país em si. Como que é o Brasil para você?
180|31/08/1987|Hortência|181|Hortência| Nós discutimos isso, nós nos preocupamos com isso. Apesar de eu me preocupar mais com o basquete, que é a minha área. Eu não entendo muito de política para chegar para você e comentar sobre política. Eu procuro ler, procuro estar por dentro do que está acontecendo. Eu sei que o Brasil passa por um momento muito difícil. Economicamente o Brasil está numa fase muito difícil e a gente lê jornal e sabe que coisas muito críticas estão acontecendo. Eu acho que a gente tem que dar um voto de confiança para o nosso presidente e deixar ele trabalhar um pouco, para ver se ele consegue tirar o Brasil dessa situação econômica que ele vive hoje. 
181|31/08/1987|Hortência|182|Roberto Pereira de Souza| Você gostaria de eleger um presidente?
182|31/08/1987|Hortência|183|Hortência| Todo brasileiro gostaria de eleger seu presidente.
183|31/08/1987|Hortência|184|Augusto Nunes| Você tem algum partido, Hortência? Algum partido da tua preferência?
184|31/08/1987|Hortência|185|Hortência| Não. Eu não tenho partido, eu tenho candidatos. Porque hoje está uma mistura que você não sabe mais... Antes um era do PMDB, passou para o PDS; do PDS passou para o PFL... Quer dizer, hoje você não sabe mais o que o cara é.
185|31/08/1987|Hortência|186|Marcelo Resende| Você votaria no Sarney?
186|31/08/1987|Hortência|187|Hortência| Não sei, preciso ver. Porque ele não terminou o mandato dele ainda, vamos ver até o fiinal do mandato dele, fazer uma análise de como ele foi.
187|31/08/1987|Hortência|188|Juca Kfouri|  Quércia,  Suplicy, Ermírio  ou  Maluf para governador? Em quem você votou?
188|31/08/1987|Hortência|189|Hortência| Eu acho que o voto é secreto!
189|31/08/1987|Hortência|190|Juca Kfouri| Olha! Olha que você está revelando que votou no Maluf! 
190|31/08/1987|Hortência|191|Hortência| Não! Não tem nada a ver!
191|31/08/1987|Hortência|192|Paulo Planet Buarque| Já que você quer manter o sigilo do voto pelo menos há uma curiosidade: o que você pensa dos homens?
192|31/08/1987|Hortência|193|Hortência| O que eu penso dos homens? Eu penso tanta coisa. 
193|31/08/1987|Hortência|194|Paulo Planet Buarque| Então diga! Diga o que você pensa do homem, faça um retrato bem falado dos homens, segundo a sua opinião.
194|31/08/1987|Hortência|195|Hortência| Eu acho que a mulher procura se espelhar muito no homem, porque antes ela sempre vivia do lado do homem e, de repente, com a evolução do tempo, novas épocas, ela resolveu sair um pouco de perto do homem e batalhar sozinha. Eu acho que o homem teve uma grande contribuição para isso. Eu acho o homem uma pessoa muito interessante. A única coisa que eu acho que o homem tem mais que a mulher é a força, porque o homem realmente é muito mais forte do que a mulher.
195|31/08/1987|Hortência|196|Norminha| Em que nível?
196|31/08/1987|Hortência|197|Hortência| Demais.
197|31/08/1987|Hortência|198|José Góes| Você não é feminista?
198|31/08/1987|Hortência|199|Hortência| Eu não, prefiiro dizer para você que eu sou feminina.
199|31/08/1987|Hortência|200|Norminha| A força é muito relativa... Em que nível?
200|31/08/1987|Hortência|201|Hortência| O quê?
201|31/08/1987|Hortência|202|Norminha| O homem. Você colocou que homem é mais forte. Em que nível?
202|31/08/1987|Hortência|203|Hortência| De força, de massa muscular.
203|31/08/1987|Hortência|204|Paulo Planet Buarque| Força física, só! A Norma já reclamou lá. Ela quase pulou aí!
204|31/08/1987|Hortência|205|[risos]|
205|31/08/1987|Hortência|206|Hortência| Acho que, em termos de inteligência, acho que a mulher é o mesmo nível que o homem. Não tem o porquê, são o mesmo cérebro. Quer dizer, eu acho que a única coisa que o homem... É que ele é o chefe da família.
206|31/08/1987|Hortência|207|Juca Kfouri| Você acha, de fato, que mulher é tão inteligente, Hortência? Mulher gosta de homem!
207|31/08/1987|Hortência|208|[risos]|
208|31/08/1987|Hortência|209|Hortência| Eu acho isso super inteligente, o senhor tá me chamando de burra?!
209|31/08/1987|Hortência|210|Juca Kfouri| Não.
210|31/08/1987|Hortência|211|Hortência| Eu gosto de homem porque eu sou inteligente!
211|31/08/1987|Hortência|212|Wlamir Marques| Hortência, o Paulo Planet, ele pode dizer isso aí bastante, de cátedra, porque ele conheceu... Acho que ele comentou. Existiu um grande jogador de futebol - acho que ele está vivo ainda -, ele é argentino e jogou no Real Madrid, na Espanha. Chamava-se Alfredo di Stéfano  - eu não sei se ele está vivo . Eu me lembro muito bem disso porque... Isso está na minha cabeça gravado, o que aconteceu com ele quando ele parou de jogar. Ele quando parou de jogar, mandou construir de frente aàcasa dele um pedestal. Ele colocou uma bola de futebol em cima, bem grande e ele escreveu assim embaixo: “A ti lo devo todo”. Quer dizer, à bola ele deve tudo o que ele conseguiu na vida dele. Você, quando parar de jogar, Hortência, você vai fazer esse pedestal? Ou você vai mandar fazerem depois que você morrer? Ou seja, quando você parar de jogar, você continuará dentro do basquetebol ou vai fazer como o Alfredo di Stéfano, que no instante  que parou de jogar ele pôs a bola. “A ti eu devo tudo” porque dali... Ele vivia da renda do que ele ganhou com o futebol.
212|31/08/1987|Hortência|213|Marcelo Resende| Ele continuou depois, virou técnico, tem toda uma história.
213|31/08/1987|Hortência|214|Wlamir Marques| Mas como técnico não foi muito longe. Então a minha pergunta é a seguinte: você deve mesmo tudo à bola ou você pretende, depois, continuar ainda dentro da bola? E muito mais tarde, você fazer esse pedestal?
214|31/08/1987|Hortência|215|Hortência| Eu devo, eu devo tudo ao basquete, mas eu pretendo continuar. Eu não sei se vou conseguir ficar longe do basquete, porque eu vivo tão intensamente isso que não sei se vou conseguir largar totalmente. Então, eu quero ser uma técnica. Vou ver se eu vou dar para isso, se não der eu vou fazer jogadora, porque eu posso não ser boa técnica, mas boa treinadora eu sei que eu sou. Eu sei ensinar, eu sei ensinar criança, isso eu vou fazer. Mesmo que eu não precise disso, mesmo que eu tenha dinheiro para viver uma vida...
215|31/08/1987|Hortência|216|Marcelo Resende| E vive-se com o dinheiro do basquete feminino? Hoje, se você parar, você vai ter dependência financeira para continuar vivendo?
216|31/08/1987|Hortência|217|Hortência| Eu tenho.
217|31/08/1987|Hortência|218|Marcelo Resende| Quanto que você ganha no basquete?
218|31/08/1987|Hortência|219|Hortência| Eu não costumo dizer quanto eu ganho.
219|31/08/1987|Hortência|220|Augusto Nunes| Nós precisamos fazer um ligeiro intervalo, depois vamos retomar esse assunto que tem despertado muita curiosidade de quem está nos vendo aqui. O programa Roda Viva volta já, já.
220|31/08/1987|Hortência|221|[intervalo]|
221|31/08/1987|Hortência|222|Augusto Nunes| Eu queria, antes de mais nada, agradecer esta camisa aqui - número 4 - que a Hortência está oferecendo ao programa Roda Viva, que é a camisa da Minercal, de Sorocaba - que vocês certamente conhecem, ou quase todos vocês. Nós vamos voltar a esse assunto que desperta muita curiosidade entre os espectadores. Eles querem saber quanto... Tem uma pergunta aqui que é típica: Sergio Aloy, de Santo Amaro, São Paulo, ele vai perguntando por etapas. Ele começa assim: “O basquete traz bons lucros?”. Depois ele pergunta: “Ganha-se muito no basquete? Para ser mais preciso, quanto é que você ganha por mês?”.  E o Amarildo, que está aqui presente, faz uma pergunta de certa forma ligada a isso. Ele gostaria de saber da Hortência qual a premiação que as jogadoras receberam da Confederação de Basquete pela medalha de prata dos jogos Pan-Americanos; e qual o prêmio que a Minercal, especificamente, ofereceu pelo fato de a Hortência ter sido considerada a rainha do basquete na terra dos gringos. Eu tenho aqui um recorte de jornal onde diz que você teria dito aos jornalistas americanos que você estava ganhando cinco mil dólares, calculados no paralelo. Agora o Juca pode ajudar .
222|31/08/1987|Hortência|223|Juca Kfouri| Se a gente disser que é alguma coisa em torno de quatro e cinco mil dólares, não estará mentindo, ? Por mês?
223|31/08/1987|Hortência|224|Augusto Nunes| Então, sobre o salário e os prêmios.
224|31/08/1987|Hortência|225|Hortência| Realmente, eu nunca disse a ninguém quanto que eu ganho porque eu acho que isso aí só interessa...
225|31/08/1987|Hortência|226|Juca Kfouri|  A todos os telespectadores!!
226|31/08/1987|Hortência|227|[risos]|
227|31/08/1987|Hortência|228|Hortência| Eu realmente nunca revelei, ninguém sabe. Esses cinco mil dólares que o cara deve ter chutado, eu nunca falei para ninguém. Mesmo porque eu acho que isso não é importante, não é interessante. Agora, como o próprio Oscar  disse, não tem preço que pague a medalha de ouro deles  e nem a nossa medalha de prata. Não ganhei nada por ter sido a rainha, por ter ganhado a medalha de prata. Isso para mim não é importante, o importante é que eu ganhei a medalha. Eu não sou uma jogadora profissional nesse aspecto, então nós não ganhamos nada para isso.
228|31/08/1987|Hortência|229|Juca Kfouri| Há quem diga, Hortência, que às vezes é preferível ganhar medalha de bronze, porque você a ganha depois de uma vitória, do que ganhar a medalha de prata, porque ela sempre vem acompanhada de uma derrota. Nesse caso específico, me parece... A prata valeu bem mais do que o bronze, de fato?
229|31/08/1987|Hortência|230|Hortência| Muito mais, quem falou isso para você acho que... Muito melhor você ganhar uma medalha de prata do que você ganhar uma medalha de bronze! Você não tenha nem dúvida! Independente da derrota que você vai ter.
230|31/08/1987|Hortência|231|Ouhydes Fonseca| Você citou o Oscar. Ele também disse, nessa mesma entrevista, que ele achava válido o pessoal do futebol receber cerca de quatro ou cinco mil dólares, que eles receberam de prêmio por conquista de medalha de ouro. E que outros esportes, considerados amadores, têm realidades diferentes e, portanto, eles não teriam a mesma... Não estariam na mesma situação e, portanto, não mereceriam esse prêmio. E você falou aí, também, que você não se considera uma atleta profissional nesse sentido. O que é para você profissional e o que é amadorismo? E você acha que ainda é válido se falar, hoje, em esporte amador?
231|31/08/1987|Hortência|232|Hortência| Não, aqui no Brasil acho que não tem mais esse esporte amador, principalmente no basquete, né? Eu acho que o futebol conseguiu um espaço que nós ainda não conseguimos, então nós estamos muito além daquilo que nós tínhamos há dez anos. Devagar eu acho que a gente vai conseguir esse tipo de coisa. Mas isso... Não adianta você querer passar por cima de todas as coisas. Então eu acho que devagar a gente vai chegar lá e vai conseguir esses mesmo benefícios que o futebol consegue hoje.
232|31/08/1987|Hortência|233|José Góes| Hortência... Divórcio, aborto, infidelidade... Como é que você defiine esses temas?
233|31/08/1987|Hortência|234|Hortência| Divórcio é muito triste. Porque é o final de uma relação que... Realmente, o casamento é uma coisa que quando o padre fala: “Para sempre, até que Deus os separe”... Quer dizer, é uma coisa muito triste. Qual foi a outra que você falou?
234|31/08/1987|Hortência|235|José Góes| Aborto.
235|31/08/1987|Hortência|236|Hortência| Aborto... Eu acho isso péssimo, eu acho que você tem que tomar todas as precauções para que você não fique grávida. Depois que você ficou, eu acho que seria uma injustiça você ir contra uma coisa que não tem como se defender.
236|31/08/1987|Hortência|237|Marcelo Resende| No auge da sua carreira, se você tivesse que fazer um aborto, você faria?
237|31/08/1987|Hortência|238|Hortência| Não. Por isso que eu sempre me preocupei em não ficar grávida, porque se eu ficasse, eu jamais faria isso.
238|31/08/1987|Hortência|239|José Góes| E a infidelidade?
239|31/08/1987|Hortência|240|Hortência| Infidelidade é uma coisa que jamais passou pela minha cabeça. Eu acho que uma pessoa que tem esse tipo de... Sei lá... Infidelidade para mim... Eu acho horrível.
240|31/08/1987|Hortência|241|Roberto Pereira de Souza| Hortência, se você não fosse jogadora de basquete, você seria o quê? Eu sei que você gosta de guiar com pé embaixo,  você veio de Sorocaba a São Paulo em quarenta minutos, não é isso? 150 km/h.
241|31/08/1987|Hortência|242|Juca Kfouri| Já está complicada com o imposto de renda e agora com a Polícia Rodoviária!
242|31/08/1987|Hortência|243|[risos]|
243|31/08/1987|Hortência|244|Roberto Pereira de Souza| Você seria capaz de ser uma pilota, por exemplo, ou não?
244|31/08/1987|Hortência|245|Hortência| Piloto não, mas talvez uma corredora de motocross, quem sabe? 
245|31/08/1987|Hortência|246|Roberto Pereira de Souza| Porque você tem uma moto também, né?
246|31/08/1987|Hortência|247|Hortência| Tenho.
247|31/08/1987|Hortência|248|Roberto Pereira de Souza| Você, uma vez, atropelou seis vacas no interior, é verdade isso?
248|31/08/1987|Hortência|249|Hortência| É verdade! 
249|31/08/1987|Hortência|250|Roberto Pereira de Souza| É mesmo? Conta essa história para gente!
250|31/08/1987|Hortência|251|Hortência| Eu estava voltando dos jogos regionais em Ribeirão Preto, e eu jogava em Catanduva. Eu estava de carro, eu e mais três atletas.
251|31/08/1987|Hortência|252|Roberto Pereira de Souza| Era emprestado o carro, né?
252|31/08/1987|Hortência|253|Hortência| Era do cara que estava do lado. Ele era um velhinho e não gostava de dirigir. À noite ele, geralmente, assistia aos nossos jogos, e eu sempre voltava dirigindo para ele. Durante três anos eu fiz isso. E tinha uma estrada que liga Bebedouro a Catanduva, que chama Rodovia da Laranja, e ali não tinha ninguém, não tinha trânsito, não tinha nada. Tinham seis vacas sentadas no meio da pista!
253|31/08/1987|Hortência|254|Roberto Pereira de Souza| Conversando!
254|31/08/1987|Hortência|255|Hortência| E eu passei e peguei uma delas. 
255|31/08/1987|Hortência|256|Paulo Planet Buarque| Hortência, mudando um pouquinho de assunto. Alguns jornalistas brasileiros - pensando em termos de jogos olímpicos - estão a imaginar que o Brasil, a exemplo de outros países, deveria importar técnicos para aprimorar os nossos esportes. E dão como exemplo o fato de hoje treinar a Seleção Brasileira um coreano; o fato das equipes de ginástica olímpica americanas serem treinadas por um búlgaro...
256|31/08/1987|Hortência|257|Hortência| Romeno!
257|31/08/1987|Hortência|258|Paulo Planet Buarque| Um romeno. Você acha que, se fizéssemos isso aqui, nós teríamos condições de melhorar a parte técnica, a parte tática do nosso esporte em geral e do basquete feminino, em particular?
258|31/08/1987|Hortência|259|Hortência| Eu acho que nós temos valores humanos aqui. Eu acho que ao invés de você trazer o técnico para dirigir uma equipe, eu acho que você poderia trazer o técnico para ensinar os técnicos. E os técnicos brasileiros ensinariam os seus jogadores. Ou pegar os técnicos daqui e levar para o exterior e fazer cursos lá fora. Eu acho que, no basquete, não tem necessidade de trazer lá de fora, porque eu acho que nós sabemos bastante. Tanto é que o basquete foi lá e ganhou dos americanos. Quer dizer, eu acho o que falta é um intercâmbio dos técnicos... Aprender lá fora ou trazer aqui para dentro  ensinar os técnicos. Mas os jogadores... Eu acho que nós temos que dar o valor para o técnico brasileiro.
259|31/08/1987|Hortência|260|Ester Lima| Você acha que é válido trazer jogador estrangeiro?
260|31/08/1987|Hortência|261|Hortência| No basquete eu acho. Principalmente no feminino, que não tem muita jogadora.
261|31/08/1987|Hortência|262|[...]| Principalmente pivô.
262|31/08/1987|Hortência|263|Norminha| Você disse que nós estamos com, mais ou menos, quinhentas jogadoras. Não existe isso, Hortência.
263|31/08/1987|Hortência|264|Hortência| Tem que trabalhar.
264|31/08/1987|Hortência|265|Norminha| Trabalhar infanto-juvenil, pré-mirim... Então, os valores de um Panamericano que vocês conseguiram, será que nós conseguiremos até a Olimpíada pelo menos que o país, que a parte da infra-estrutura, a bendita infra-estrutura de esporte que eu nunca vi na minha vida, vou morrer sem essa tal força - apareça até a Olimpíada? Ou morre? Vai aparecer até a Olimpíada porque é interesse brasileiro um comportamento decente? E, ao mesmo tempo que eu estou te perguntando isso, eu sou totalmente contra a vinda de técnicos estrangeiros. Por quê? Vou dizer porquê e você, depois, vai me responder a tua opinião. Nós vamos para fora aprender, lógico. Nos aprimorar. Só que na volta nós confundimos a realidade de fora com a realidade brasileira. Então, ao invés de nós falarmos: “olha, você faz um bloqueio”,  “faz 2x2, 2x1, box 1”, sabe? Terminologia toda americana quando, na realidade, nós somos brasileiros. E olha que eu sou argentina naturalizada brasileira, e eu não aceito isso. Eu vim para a Seleção, você sabe muito bem. Eu acho a valorização do técnico brasileiro... Porque nós temos pessoas capazes. Simplesmente é que não se dá a oportunidade. Ou seja, existe... Agora... Vamos entrar no problema de cúpula. Você não acha?
265|31/08/1987|Hortência|266|Hortência| Eu acho. Concordo com você, mas eu acho que tem muita coisa que lá fora que você pode, tranqüilamente, trazer para dentro. Como a minha equipe, a Minercal... O meu técnico, o Vendramini, ele trabalha totalmente em cima de jogadas da Iugoslávia, de defesas dos Estados Unidos... A própria Maria Helena utiliza muito, estuda muito... E ela tira aquilo que ela acha que cabe dentro da nossa realidade.
266|31/08/1987|Hortência|267|Norminha| Exatamente.
267|31/08/1987|Hortência|268|Hortência| Mas para ela saber o que cabe ou não, ela tem que aprender as outras coisas.
268|31/08/1987|Hortência|269|Norminha| Eu não disse isso. Estudar tudo bem. Você ter conhecimentos extras de países muito mais desenvolvidos. Porque nós estamos no Brasil... Embora seja um país em desenvolvimento - não vou dizer subdesenvolvido, em desenvolvimento, para ser generosa  - então nós vivemos em um país a nível esportivo  mais de vinte anos, concorda comigo? Estamos atrasados. E assim mesmo nós vamos e fazemos o que podemos na realidade nua e crua, porque vocês fizeram o que puderam.
269|31/08/1987|Hortência|270|Hortência| Por isso que eu não fiquei triste por ter perdido a medalha de ouro. Porque mais do que aquilo, eu acho que não está na hora ainda.
270|31/08/1987|Hortência|271|Ouhydes Fonseca| No caso do basquete - o basquete feminino mais especificamente - a realidade é muito mais dramática. Ou seja, o basquete feminino brasileiro se concentra, fundamentalmente, em São Paulo. A realidade do basquete feminino no Nordeste, por exemplo... Na última convocação a Maria Helena convocou, não me recordo o nome da menina de Fortaleza...
271|31/08/1987|Hortência|272|Hortência| De Recife.
272|31/08/1987|Hortência|273|Ouhydes Fonseca| E ela acabou sendo dispensada porque não conseguia acompanhar o ritmo do treinamento e, até mesmo, a esquematização tática da Seleção. Então eu queria que você dissesse para a gente como você vê essa realidade e se vocês, em conversas, têm alguma proposta... O que poderia o Brasil fazer para desenvolver o basquete feminino em outros estados? Acabar com essa centralização que, de certa forma, é prejudicial.
273|31/08/1987|Hortência|274|Hortência| Primeiramente, nós aqui dentro do Brasil vivemos de resultados. Não só o basquete, como futebol, tudo vive de resultado. E foi muito importante essa medalha que nós trouxemos, porque aí vai agitar um pouco o meio do basquetebol e isso vai fazer com que a criança queira jogar basquete,  “Pai, eu quero jogar basquete”. Então eles começam a procurar.
274|31/08/1987|Hortência|275|Augusto Nunes| Com que idade você começou, Hortência?
275|31/08/1987|Hortência|276|Hortência| Eu comecei com 14 anos. Tinha 13 anos e meio, ia fazer 14 anos. Então, a criança fica entusiasmada para a prática do basquetebol e aí fica mais fácil para a cidade, para o estado, movimentar o basquetebol. E precisa que, também, as federações queiram fazer alguma coisa em prol do basquetebol. Incentivar, promover... Como agora a Minercal vai fazer um amistoso em Brasília. Ali já vai movimentar. Quer dizer, isso é interessante; que se movimente, que leve as jogadoras, a Hortência, a Paula, para mostrar nos outros estados o que é o basquete e dar uma movimentada naquela cidade.
276|31/08/1987|Hortência|277|Ouhydes Fonseca| Seria bom levar alguns técnicos do Sul que ficassem fazendo estágios, clínicas...
277|31/08/1987|Hortência|278|Hortência| É uma coisa muito importante, veja bem: não é fazer o jogador somente, porque, às vezes, tem o atleta mas não tem uma pessoa capacitada para ensinar aquela criança. Precisa ensinar certo, precisa ensinar correto. E precisa se fazer técnicos também. Então não é só o jogador e sim o técnico, também, saber ensinar  crianças a maneira certa.
278|31/08/1987|Hortência|279|Paulo Planet Buarque| A qualidade só vem da quantidade, isso é absolutamente perfeito. E você acabou de citar os Estados Unidos. Nós podíamos citar vários outros países, todos da Cortina de Ferro , Cuba - por se tratar de um país que tem no esporte uma ação do Estado -, mas o que se nota aqui, Hortência, é que a mulher brasileira não é muito adepta da prática esportiva com a intensidade que se poderia desejar. A mulher se cuida um pouco mais, acha que ela se expõe muito... O que fazer para mudar essa mentalidade?
279|31/08/1987|Hortência|280|Hortência| Eu acho que já mudou.
280|31/08/1987|Hortência|281|Paulo Planet Buarque| Já mudou?
281|31/08/1987|Hortência|282|Hortência| Eu acho que já mudou. Você vai em academia, você vê mulher fazendo musculação, você vê mulher dançando, você vê mulher fazendo ginástica aeróbica, você vê menina querendo jogar vôlei. Agora, com essa movimentação do basquete você vai ver um monte de meninas querendo jogar basquete, como já me procuram! : “Como que faço pra jogar? Meu filho quer entrar”. Quer dizer, o pai se empolga também e põe na cabeça do filho. Como o Oscar falou: “Meu filho vai fazer o que ele quiser, mas vai jogar basquete”. Então tem pai que põe na cabeça do filho: “Filho, você vai jogar basquete”.
282|31/08/1987|Hortência|283|Ester Lima| Você não tem vontade de montar uma escolinha de basquete?
283|31/08/1987|Hortência|284|Hortência| Eu tenho. Eu já tive , agora eu não posso porque eu não tenho tempo, porque eu fico tempo integral com o basquete feminino. Mas quando eu parar, eu vou ter escolinha.
284|31/08/1987|Hortência|285|Marcelo Resende| Você acha que o basquete tomou o lugar do vôlei, que era o segundo esporte na preferência? Você acha que desse momento o vôlei passou a um terceiro plano em relação ao basquete?
285|31/08/1987|Hortência|286|Hortência| Eu não acho que o vôlei está em primeiro, segundo ou em terceiro... Eu acho que os dois podem ficar em primeiro tranqüilamente. Eu acho que tem espaço, tem torcedores no Brasil, o suficiente.
286|31/08/1987|Hortência|287|Marcelo Resende| Está tomando o público do futebol, por exemplo, o basquete?
287|31/08/1987|Hortência|288|Hortência| Isso que eu estou falando para você: acho que todo esporte tem o seu público. O futebol... Ninguém tira o público do futebol.
288|31/08/1987|Hortência|289|Marcelo Resende| O Nabi  tira!
289|31/08/1987|Hortência|290|Hortência| E o basquete tem o seu público e o voleibol também tem o seu público.
