DATA,ENTREVISTA,ORDEM,LOCUTOR,FALA
02/03/1998,Inezita Barroso,117,Tom Zé,"Eu queria pedir uma coisa, rapaz; não sei nem se isso é indelicado; mas, enfim, eu estava vendo Inezita aqui, emocionada com o anúncio de um programa no qual ela é o objeto de todas as coisas, de toda a atenção, de todas as perguntas, e um programa que é um pouco, também, uma homenagem, na verdade - não é, Inezita? -, é uma honra estar aí e tal... E eu sinto uma pena da gente não poder conversar como se a gente estivesse na beira de um fogão, na fazenda do seu tio, digamos assim, e puxar coisas desse gênero, ao invés da gente só ficar falando mal de gravadora... Qualquer artista que a gente entrevista, a gente geralmente fala isso, né?"
02/03/1998,Inezita Barroso,118,Inezita Barroso,"Não, vamos falar à beira do fogo!"
02/03/1998,Inezita Barroso,119,Tom Zé,"Pois é, né?"
02/03/1998,Inezita Barroso,120,Matinas Suzuki,Pode começar!
02/03/1998,Inezita Barroso,121,Zuza Homem de Melo,"Inezita, eu queria que você, tendo a experiência de programa de rádio e de TV e uma longa experiência em cada um dos dois casos, desse a sua visão sobre a forma como essas duas maneiras de comunicação atingem o público no Brasil; contasse para a gente como é o seu feedback em relação a esses dois tipos de comunicação."
02/03/1998,Inezita Barroso,122,Inezita Barroso,"É, para o gênero que eu tenho feito, vamos ser justos, de música caipira, de viola e tudo isso, o rádio atinge mais. Eu faço um programa de rádio na Cultura, das cinco da madrugada até às sete, diário, e você não pode imaginar a quantidade de cartas e de público, assim, super-heterogêneo. Criança de sete anos, nove anos, mal sabe escrever, pedindo música de Tonico e Tinoco, Tião Carreiro e Pardinho. E alguns assíduos. Guardo todas, tenho dez, doze cartas, as crianças mandam o retratinho. Então, atinge direto."
02/03/1998,Inezita Barroso,123,Zuza Homem de Melo,Vindos de todos os lugares?
02/03/1998,Inezita Barroso,124,Inezita Barroso,"De todos, do Brasil inteiro. Até do Paraguai já recebi carta e tudo."
02/03/1998,Inezita Barroso,125,Zuza Homem de Melo,"E o fato do programa ser às cinco da manhã, não é uma hora, dentro da cidade..."
02/03/1998,Inezita Barroso,126,Inezita Barroso,Não.
02/03/1998,Inezita Barroso,127,Zuza Homem de Melo,"...imprópria e, ao mesmo tempo, dentro do interior, absolutamente apropriado?"
02/03/1998,Inezita Barroso,128,Inezita Barroso,"Eu pensei que fosse isso, mas engano meu: sabe, tem muita criança que acorda cedo para ir para a escola e fica ouvindo e acaba gostando. Tem muito pai que vai levar o filho para o colégio e ouve no carro. Tem muito motorista de praça que ouve, que trabalha a madrugada inteira. Ouve-se nos hospitais, os enfermeiros, os médicos - os doentes, até. Teve um que levou o radinho enrolado escondido, passando mal à beça, mas ele levou o radinho para não perder o Estrela da manhã, que é uma coisa que emociona muito a gente. E televisão também. Nós temos um público cativo naquele Teatro Cultura que não é fácil."
02/03/1998,Inezita Barroso,129,Zuza Homem de Melo,Há quantos anos?
02/03/1998,Inezita Barroso,130,Inezita Barroso,"18. É, muita gente já morreu daquele grupinho e, aí, crescem outros e vêm vindo, vêm vindo. Naquele auditório dá briga toda semana para entrar."
02/03/1998,Inezita Barroso,131,Tom Zé,"Inezita, eu tenho tendência para achar que você está mentindo quando você diz esse negócio aí. É claro que estou usando a palavra aqui com toda delicadeza possível, embora de todo modo seja indelicado, mas só para esquentar um pouquinho. Isso de que o caipira absolutamente não quer fazer sucesso..."
02/03/1998,Inezita Barroso,132,Inezita Barroso,Não é que não quer fazer sucesso...
02/03/1998,Inezita Barroso,133,Tom Zé,"Sim, sim, sim, desculpe."
02/03/1998,Inezita Barroso,134,Inezita Barroso,"Ele encara a música dele como uma religião, como arte, mesmo. Veja as folias de reis quilométricas. Aquilo não cabe num disco, ninguém vai gravar aquilo. Ele faz por conta própria, para homenagear os Santos Reis, por exemplo. O outro faz uma folia do Divino para homenagear o Divino Espírito Santo; ele também não faz no tamanho certo para caber no disco. É uma manifestação, é uma explosão dele. Ele tem necessidade de pôr isso para fora. E outra coisa bonita: ele torna-se autor anônimo. Ele não diz: “Eu que fiz!” Você nunca ouviu dizer “uma folia de reis do sr. Manuel da Silva do bairro tal”, nunca. Ele mostra para cinco, seis amigos, é aceita na comunidade a música e ele cai fora."
02/03/1998,Inezita Barroso,135,Matinas Suzuki,"Inezita, o Rubens Pereira, que é aqui de São Paulo, ele diz: “Todos sabem que a música 'Ronda' é um verdadeiro hino da música popular brasileira. Você foi a primeira cantora a gravar essa música que, posteriormente, teve centenas de regravações, quase todas com sucesso. Curiosamente, porém, você não faz uso do mérito de ter lançado essa verdadeira obra de arte.” Ele pergunta por quê."
02/03/1998,Inezita Barroso,136,Inezita Barroso,"Porque eu segui a carreira caipira, né? Do outro lado de “Ronda” tinha a “Moda da pinga”, que faz um sucesso brutal até hoje. Não existe recital em que eu não cante e que eles já não comecem pedindo a “Moda da pinga” antes do programa."
02/03/1998,Inezita Barroso,137,Matinas Suzuki,Como é que foi que você gravou? O Vanzolini te mostrou a música como? Como é que chegou a você essa música?
02/03/1998,Inezita Barroso,138,Inezita Barroso,"Nós tínhamos um grupo grande de estudantes que freqüentavam a minha casa. E não tinha ninguém rico assim para fazer grandes programas no sábado, então ia todo mundo lá para casa sábado ou domingo, gente que tocava piano, tocava violão, tocava cavaquinho, pandeiro. E as músicas não eram estritamente folclóricas, era tudo. Por isso que a gente tomou conhecimento de tudo: sambas, desconhecidos até, tinha um pessoal do Rio que ia muito lá em casa. E era uma festa, era o dia inteirinho cantando. E o Paulo mostrou o samba dele. Nós tínhamos um pianista, amigo nosso também, já falecido, Túlio Tavares, e o Túlio se interessou e falou: essa música é linda, só que ela está meio quebrada, vamos pôr no piano, vamos fazer direitinho, escrever uma partitura. E ficou o “Ronda”. E eu tinha ido para o Rio para gravar a “Moda da pinga” e gravei “Ronda” do outro lado."
02/03/1998,Inezita Barroso,139,Tom Zé,"E o episódio do Monteiro Lobato ter feito aqueles maus modos com o Jeca Tatu, teve alguma música sua sobre..."
02/03/1998,Inezita Barroso,140,Inezita Barroso,"Não, não são maus modos, nada, ele estava se defendendo, ele ganhou bem para fazer isso. Ganhou muito bem, era um anúncio de um fortificante. Então, o caipira, coitado, tinha amarelão, tinha maleita e tinha o diabo, todas as doenças, tinha bicho de pé. Aí, como num milagre, ele tomava aquele fortificante e ficava lindo de chapeuzinho e botas."
02/03/1998,Inezita Barroso,141,Tom Zé,"Puxa, eu não sabia disso, não."
02/03/1998,Inezita Barroso,142,Renato Andrade,"O Monteiro Lobato que usou o personagem. Ele é o emblema do caipira brasileiro, o Jeca Tatu. Então, ele quis mostrar o problema socioeconômico, sociocultural. Está no quarto volume..."
02/03/1998,Inezita Barroso,143,Tom Zé,"Mas foi o reductio ad absurdum mais bem feito que eu já vi na história da lógica. Porque, por exemplo, eu li o episódio, li e tomei conhecimento, como se ele tivesse agredido toda a espécie do Jeca..."
02/03/1998,Inezita Barroso,144,Inezita Barroso,Absolutamente!
02/03/1998,Inezita Barroso,145,Tom Zé,...e depois tivesse pedido perdão publicamente e tal.
02/03/1998,Inezita Barroso,146,Inezita Barroso,"Não, não, não."
02/03/1998,Inezita Barroso,147,Renato Andrade,"A propósito - desculpe -, ele está no volume IV de Urupês. É o nome da obra."
02/03/1998,Inezita Barroso,148,Inezita Barroso,É.
02/03/1998,Inezita Barroso,149,Renato Andrade,"Mas ele quis mostrar é o parasita. A palavra “urupês” é o que eles chamam de cogumelo, orelha-de-pau. Preguiçoso. Tanto que, quanto eu faço meus shows, eu falo: “Não sou o Jeca Tatu, não, eu sou o capiau.” Porque o outro é o preguiçoso, é o orelha-de-pau."
02/03/1998,Inezita Barroso,150,Inezita Barroso,"Foi um momento assim talvez, digamos, infeliz, mas foi bom para ele, foi bom para ele, e ele continuou escrevendo coisas de caipira, né? Toda obra infantil dele foi..."
02/03/1998,Inezita Barroso,151,Tom Zé,"E quando o Flávio Cavalcanti quebrava um disco caipira por semana daquela maneira tão... imitando cronista de futebol, vou dizer: “estapafúrdia”."
02/03/1998,Inezita Barroso,152,Inezita Barroso,"Mas não foi só nisso que resultou. Resultou uma coisa muito má, que é homem do interior de São Paulo ter tido vergonha de ser chamado de caipira, por causa da criação do Jeca Tatu."
02/03/1998,Inezita Barroso,153,Assis Ângelo,Inezita...
02/03/1998,Inezita Barroso,154,Tom Zé,"Ah, sim - desculpe -, a Inezita ainda estava falando do outro episódio, do episódio Monteiro Lobato."
02/03/1998,Inezita Barroso,155,Inezita Barroso,"Sim, sim, sim. Então, criou-se uma vergonha, uma coisa. Você dizer “caipira”, era uma mulher mal vestida, era um cara sem dente, todo ruim e todo doente. Então, criou-se um mito assim, que durou muito tempo e está durando ainda em alguns lugares."
02/03/1998,Inezita Barroso,156,Assis Ângelo,"Eu queria, para não ficar muito distante, quando foi abordada “Ronda” - “Ronda”, como se sabe, naturalmente, é um clássico da música brasileira -, também te acompanhou um time da pesadíssima: Menezes, Bola Sete, Garoto, um time realmente muito grande. Mas tem uma curiosidade nessa música, nessa gravação: a princípio, você não ia gravar essa música..."
02/03/1998,Inezita Barroso,157,Inezita Barroso,Não.
02/03/1998,Inezita Barroso,158,Assis Ângelo,"A princípio, era a “Moda da pinga”."
02/03/1998,Inezita Barroso,159,Inezita Barroso,"É, a “Moda da pinga”, eu fui preparada para gravar, mas, como foi o meu primeiro disco, não estava acreditando muito. São Paulo era a província musical..."
02/03/1998,Inezita Barroso,160,Assis Ângelo,Foi gravado no Rio?
02/03/1998,Inezita Barroso,161,Inezita Barroso,"Foi gravado no Rio, nos estúdios da RCA no Rio. E eu cheguei para gravar a “Pinga”. Gravei a “Pinga”, fiquei livre da “Pinga”, e do outro lado? Não tinha o outro lado preparado."
02/03/1998,Inezita Barroso,162,Assis Ângelo,"A Márcia, ela grava a “Ronda”, que você gravou - que você lançou, na verdade, porque a primeira gravação é sua, no dia 23 de agosto de 1953, não é?"
02/03/1998,Inezita Barroso,163,Inezita Barroso,Você sabe mais que eu.
02/03/1998,Inezita Barroso,164,Assis Ângelo,"E, anos depois, a Márcia regrava essa música. Mas falta um verso lá dentro, na sua gravação ou na gravação dela. Porque não é exatamente igual."
02/03/1998,Inezita Barroso,165,Inezita Barroso,"Não, não falta verso nenhum."
02/03/1998,Inezita Barroso,166,Assis Ângelo,Não?
02/03/1998,Inezita Barroso,167,Inezita Barroso,"Não, não."
02/03/1998,Inezita Barroso,168,Assis Ângelo,"E outra curiosidade que eu gostaria que você esclarecesse é com relação à “Moda da pinga”. Parece que existem alguns versos do Paulo Vanzolini, também."
02/03/1998,Inezita Barroso,169,Inezita Barroso,Isso foi uma outra brincadeira que a gente fez. Porque na “Moda da pinga” só faltava sair morte. A música que faz sucesso...
02/03/1998,Inezita Barroso,170,Assis Ângelo,Todo mundo era dono...
02/03/1998,Inezita Barroso,171,Inezita Barroso,"Todo mundo é dono. Todo mundo é dono. “É minha!...” Então, eu ia cantar no interior, tinha... A “Moda da pinga” é de antes de mim; já tinham gravado aos pedaços, nunca aquela versão que eu gravei. Porque são vários pedaços. E o cara bem moço dizia: “Você não pôs o meu nome, eu sou o autor da 'Moda da pinga'”. Então, saiu tanta briga, mas tanta briga, jornal, todo mundo em cima, que o Paulo disse: “Vamos fazer uns versos extras e eu registro esses versos e daí acaba com essa palhaçada, porque todo mundo é autor da ‘Moda da pinga’, o que é isso?“ E fez e muito bem feitos. E eu gravei outra vez. Eu gravei quatro vezes a ”Moda da pinga”, para caber tudo."
02/03/1998,Inezita Barroso,172,[...],Quais são os versos do Paulo?
02/03/1998,Inezita Barroso,173,Inezita Barroso,"Do Paulo, são ótimos, é: “Cada vez que eu caio, caio diferente / Meaço pá trás e caio pá frente”. E mais um... Eu gravei dois dos dele, muito bons."
02/03/1998,Inezita Barroso,174,Assis Ângelo,E apareceu o dono também desses versos?
02/03/1998,Inezita Barroso,175,Inezita Barroso,"Claro, o dobro! Apareceu o dobro de gente."
02/03/1998,Inezita Barroso,176,Moraes Sarmento,"E todos querendo direito autoral, viu?"
02/03/1998,Inezita Barroso,177,Tom Zé,“Pego o garrafão e já balanceio”...
02/03/1998,Inezita Barroso,178,Inezita Barroso,"Esta é dele, esta é dele..."
02/03/1998,Inezita Barroso,179,Tom Zé,"...“que é pá mor de ver se tá memo cheio”. Você sabe continuar? Desculpe, estou só ajudando..."
02/03/1998,Inezita Barroso,180,Inezita Barroso,"Acho que eu não sei, de tanto que eu já cantei."
02/03/1998,Inezita Barroso,181,Matinas Suzuki,"Por falar na “Moda da pinga”, Leila Cordeiro, do Tatuapé, aqui de São Paulo, diz o seguinte: “Sou mãe de uma criança de 13 anos que teve contato com a sua música há duas semanas e ficou encantada com seu trabalho. O que você sente quando vê uma criança de São Paulo, em contato com computadores e vida moderna, encantada com a 'Moda da pinga'?”"
02/03/1998,Inezita Barroso,182,Inezita Barroso,"É aquela chama interna de que a gente já falou. Essas coisas ficam aquecidas e brotam de dentro da criatura. Não é imposto, não é de fora para dentro, é de dentro para fora. Então, uma criança dessa pode sentir essa chama que eu senti, também, eu nasci aqui."
02/03/1998,Inezita Barroso,183,Matinas Suzuki,"O Paulo da Silva, do Tremembé, pergunta: “Como você classifica o cantor e compositor Almir Sater?”"
02/03/1998,Inezita Barroso,184,Inezita Barroso,"Um ótimo violeiro, um ótimo cantor, no estilo dele, Mato Grosso."
02/03/1998,Inezita Barroso,185,Matinas Suzuki,"Marcelino José de Oliveira, do Itaim: “Quais os cantores que você admira na atualidade?”"
02/03/1998,Inezita Barroso,186,Inezita Barroso,"Agora vocês vão levar um susto, porque eu admiro muito um cantor popular, Emílio Santiago."
02/03/1998,Inezita Barroso,187,[...],
02/03/1998,Inezita Barroso,188,Matinas Suzuki,"Original! O Márcio Silva, de Santo André: “Qual o papel que Tonico e Tinoco representaram no início da música sertaneja?”"
02/03/1998,Inezita Barroso,189,Inezita Barroso,"Um papel absoluto, maravilhoso, todo mundo foi no rastro deles. Como dupla caipira, perfeita, não tem defeito. Você não pode apontar um defeito na dupla: escolha de repertório, timbre de voz - aquela voz anasalada e ardida, como o pessoal chama, é uma coisa dos nossos ancestrais. É uma coisa dos índios, porque os índios não permitiam que as mulheres tomassem parte nas festas e aquela voz aguda fazia falta. Então, o homem faz a voz aguda."
02/03/1998,Inezita Barroso,190,Matinas Suzuki,"Daí viria a necessidade da dupla, uma voz mais masculina e uma voz mais aguda?"
02/03/1998,Inezita Barroso,191,Inezita Barroso,"Exato. Uma mais aguda e outra mais grave. E outra coisa: também vem da igreja, dos jesuítas, a mania de cantar em vozes nas missas. Então, isso ficou. O caipira adora duas vozes, três vozes, quatro."
02/03/1998,Inezita Barroso,192,Zuza Homem de Melo,E por que a terça é que domina?
02/03/1998,Inezita Barroso,193,Inezita Barroso,"Porque, você cantar em duas vozes, tem que ser terça."
02/03/1998,Inezita Barroso,194,Zuza Homem de Melo,"Mas porque não há o intervalo de quarta, de quinta, por que terça? É o mais tradicional?"
02/03/1998,Inezita Barroso,195,Inezita Barroso,É o mais tradicional.
02/03/1998,Inezita Barroso,196,Zuza Homem de Melo,É uma questão de tradição e de fidelidade?
02/03/1998,Inezita Barroso,197,Inezita Barroso,"É. No coral, você sempre ensaia a terça. Depois que vêm as outras vozes."
02/03/1998,Inezita Barroso,198,Matinas Suzuki,"É uma peculiaridade brasileira, essa? A dupla cantando terça é uma peculiaridade da música cantada no Brasil, você conhece isso?"
02/03/1998,Inezita Barroso,199,Inezita Barroso,"Não, em Portugal tem muito. Tem muito. A terça, né?"
02/03/1998,Inezita Barroso,200,Renato Andrade,Desculpe...
02/03/1998,Inezita Barroso,201,Inezita Barroso,Diga.
02/03/1998,Inezita Barroso,202,Renato Andrade,"Nós estamos falando em terça aí, né? Geralmente, a música sertaneja, música de viola, é baseada em dois intervalos: terça e sexta, que os eruditos chamam de décima e que chamava ”terça caipira“. Então, os outros intervalos... Outro dia estive observando a música japonesa. Você não sabe se é menor ou maior, dá muita quarta e muita quinta, mas a música sertaneja é terça e sexta. E há quem diga que o ouvido caipira evoluiu, porque, na Idade Média, a sexta era dissonante e eu gosto!"
02/03/1998,Inezita Barroso,203,Assis Ângelo,"E hoje o que impera é o vibrato de cabra, né? Que coisa horrorosa, né?"
02/03/1998,Inezita Barroso,204,Inezita Barroso,"Não, eu chamo de “esquadrilha da maleita”."
02/03/1998,Inezita Barroso,205,Zuza Homem de Melo,De onde que você acha que vem essa tendência para o exagerado vibrato?
02/03/1998,Inezita Barroso,206,Inezita Barroso,"Ah, eu não posso afirmar, pode ser do Chupa-Cabra."
02/03/1998,Inezita Barroso,207,Tom Zé,"Derrotamos o Itaramaty, agora..."
02/03/1998,Inezita Barroso,208,Assis Ângelo,"Ô Inezita, na sua visão, dentro desses... modismos, vamos dizer assim, da sua visão particular como cidadã, vamos dizer assim - não como artista, propriamente -, você salvaria alguma dessas duplas, desses meninos aí novos?"
02/03/1998,Inezita Barroso,209,Inezita Barroso,Eu já disse que eles têm vozes lindas...
02/03/1998,Inezita Barroso,210,Assis Ângelo,"Mas, é pouca gente, também..."
02/03/1998,Inezita Barroso,211,Inezita Barroso,"...agora, eles estão exagerando nas letras, aquilo... fica meio feio, meio ruim, né?"
02/03/1998,Inezita Barroso,212,Assis Ângelo,"Agora, mudando um pouquinho, você também andou alguns anos por Minas Gerais e algumas cidades lá, especialmente quando Juscelino Kubitschek, estava aí vivo, naturalmente... Você fez seresta com ele também, né? É um lado pouco conhecido da sua carreira."
02/03/1998,Inezita Barroso,213,Inezita Barroso,"Fiz, fiz. Porque nesse tempo, nessa década de 50, eu trabalhei muito com Hervé Cordovil, um grande maestro, um grande músico, infelizmente não tão reconhecido como deveria. E ele era muito amigo dos mineiros todos, do Juscelino principalmente, que ainda era governador de Minas, não era, nem pensava em ser presidente. E os amigos dele que incensaram e tal. E o Hervé disse: “Ah, vou levar você para conhecer uma turma maravilhosa em Belo Horizonte.” E lá fomos nós, conhecemos toda essa turma e, inclusive o Juscelino."
02/03/1998,Inezita Barroso,214,Assis Ângelo,"E saía à noite com o violão, aquele monte de...?"
02/03/1998,Inezita Barroso,215,Inezita Barroso,"Saía, em Ouro Preto..."
02/03/1998,Inezita Barroso,216,Assis Ângelo,"Você, inclusive?"
02/03/1998,Inezita Barroso,217,Inezita Barroso,"Juscelino no meio do bando, aquelas ladeiras todas, violão, aquela estudantada toda..."
02/03/1998,Inezita Barroso,218,Moraes Sarmento,"Inezita, um instantinho só, por favor. Inezita, Juscelino cantava seresta?"
02/03/1998,Inezita Barroso,219,Inezita Barroso,Cantava.
02/03/1998,Inezita Barroso,220,Moraes Sarmento,"Chegou até a gravar, não é verdade?"
02/03/1998,Inezita Barroso,221,Inezita Barroso,Gravou.
02/03/1998,Inezita Barroso,222,Assis Ângelo,"O Téo Azevedo produziu um disco muito bonito de serestas dele. Ele no estúdio. Inclusive, tem uma história, a repressão na hora, ele queria todo mundo lá. E é um disco muito bonito, ele falando e declamando e depois cantando. Ele canta duas músicas."
02/03/1998,Inezita Barroso,223,[...],Moraes Sarmento. É verdade.
02/03/1998,Inezita Barroso,224,Inezita Barroso,"E tocava bem violão, ele foi aluno do Dilermando Reis. Chegou a tocar bem. Agora, ele amava esse estilo de música. E uma vez até eu dei um fora e vou contar para vocês. Eu estava em casa e ligaram para mim: “É Inezita?” Falei: “É.” “Aqui é o Jussa” – era o apelido dele, Juscelino era “Jussa” ou “Nonô”, os mineiros sabem – “Aqui é o Jussa.” E eu falei: “Ah, você é um vagabundo! Você não tem o que fazer? Vá caçar sapo!” E bati o telefone. Ligou de novo: “Escuta, estou dizendo que aqui é o Juscelino.” Aí eu já comecei a amansar. “Não fica brava não, eu estou ligando porque eu queria dar uma reunião aqui no Palácio” – já era presidente – “e queria chamar o conjunto Madrigal e você para a gente fazer uma noitada aqui.” Aí, a tonta aqui comprou o maior vestido a rigor, um saltão, me arrumei e, quando eu chego no Palácio, começaram a abrir as portas, assim, e não tinha ninguém. Aí - aqueles guardas perfilados -, eu disse: “Onde é que está o presidente?” “Ah, lá pra dentro”. Eu fui entrando, né, me arrumando para entrar num salão cheio de gente chiquíssima. E ele estava sem sapato, de meia, com os pés cruzados, assim, numa mesinha; falou: “Vai entrando, minha filha, pode tirar o sapato, que eu sei que você morre de dor no pé, também.” Foi uma noite ma-ra-vi-lho-sa! O conjunto Madrigal veio de avião de Belo Horizonte. Só eles, eu e o Juscelino. Dona Sara deu uma olhadinha lá numa hora... Foi até às três da manhã, todo mundo cantando e tocando, foi muito bom."
02/03/1998,Inezita Barroso,225,Matinas Suzuki,"Inezita, nós vamos fazer um pequeno intervalo e a gente volta daqui a pouco com a segunda parte da entrevista com Inezita Barroso. Até já."
02/03/1998,Inezita Barroso,226,[...],
02/03/1998,Inezita Barroso,227,Matinas Suzuki,"Nós voltamos com Roda Viva, que entrevista a cantora, compositora, pesquisadora - o que mais, Inezita? - Inezita Barroso. Você pode participar deste programa fazendo perguntas pelo telefone (011) 252-6525. (011) 252-6525. O número de nosso fax é (011) 3874-3454. 3874-3454. E o nosso endereço na Internet é rodaviva@tvcultura.com.br. rodaviva@tvcultura.com.br. Zuza queria fazer uma pergunta."
02/03/1998,Inezita Barroso,228,Zuza Homem de Melo,"É, queria dar uma virada de assunto e saber da sua... O Matinas falou várias coisas e não citou que você também trabalhou em cinema. Eu queria que você falasse um pouco dessa fase em que o cinema brasileiro tinha, vamos dizer, várias peculiaridades, da qual você participou."
02/03/1998,Inezita Barroso,229,Matinas Suzuki,"Ô Zuza, teve um telespectador que mandou uma pergunta sobre isso, sobre o cinema e sobre o TBC, só que eu não vou encontrar aqui agora, então peço desculpas. Mas está feita a pergunta."
02/03/1998,Inezita Barroso,230,Zuza Homem de Melo,Está certo.
02/03/1998,Inezita Barroso,231,Inezita Barroso,"Bom, o TBC era um centro de artes espetacular. Franco Zampari - o nome do Teatro Cultura era Franco Zampari - era um idealista, ele trabalhou muito pelo teatro paulista, principalmente. E inventaram - eu vi nascer o Vera Cruz -, inventaram ele, o Abílio Pereira de Almeida e outros. Eu vi a planta dos estúdios da Vera Cruz no papel, ainda! “Vamos fazer cinema!” - era uma coisa incrível, incrível, era uma loucura! “Vamos fazer um cinema sério!” - porque eles achavam que cinema tipo teatro de revista, só com música, como se fazia no Rio, era uma coisa leve demais; eles queriam argumentos, assunto, queriam fazer um cinema de verdade. Então, eu vi nascer tudo isso. E conseguiram até um certo ponto. Aí, tudo encalha no dinheiro, né? Encalha no dinheiro e encalhou na distribuição também: é um filme caríssimo, cuidadíssimo, com elenco enorme, artistas bons; aí, apresenta cinco dias no cinema e entra um de caubói no lugar. Então..."
02/03/1998,Inezita Barroso,232,Zuza Homem de Melo,"E você recebeu, teve alguma percepção na sua carreira de que alguma coisa mudou durante esse período em que você atuou no cinema?"
02/03/1998,Inezita Barroso,233,Inezita Barroso,"Bastante, bastante. Sabe o que foi muito bom? A gente ter contato com técnicos estrangeiros. Eram ingleses, franceses, alemães, vinham todos para trabalhar na Vera Cruz. Então, era muito sério o trabalho, o deles e o da gente. Eles eram muito exigentes, principalmente os ingleses. E grandes diretores, como o Cavalcanti, que veio para o Brasil especialmente para se fixar aqui, apesar de ser brasileiro. Fez sucesso demais lá na Europa e veio dar uma mãozinha. E eu cheguei a filmar com ele Mulher de verdade, com o qual ganhei o Prêmio Saci de cinema como melhor atriz."
02/03/1998,Inezita Barroso,234,Zuza Homem de Melo,E você era atriz?
02/03/1998,Inezita Barroso,235,Inezita Barroso,Eu sou a atriz principal do filme.
02/03/1998,Inezita Barroso,236,Zuza Homem de Melo,"Não, antes disso, eu digo. Você tinha experiência como atriz?"
02/03/1998,Inezita Barroso,237,Inezita Barroso,"Não. Tinha sabe o quê? Teatro infantil. A gente fazia muito, porque aqueles estudantes que freqüentavam a minha casa, como eu contei, nos sábados, a coroação desses sábados era uma bela pizza para vinte pessoas com guaraná."
02/03/1998,Inezita Barroso,238,Zuza Homem de Melo,"Como até hoje, né?"
