DATA,ENTREVISTA,ORDEM,LOCUTOR,FALA
02/03/1998,Inezita Barroso,239,Inezita Barroso,"É, até hoje. Então, criou-se uma amizade muito grande. Quem freqüentava essa turma? Na maioria estudantes de direito. Era o Paulo Autran, era o Clóvis Garcia, era o Renato Consorte..."
02/03/1998,Inezita Barroso,240,Zuza Homem de Melo,Estava o teatro todo lá.
02/03/1998,Inezita Barroso,241,Inezita Barroso,"Todos, estava o teatro inteiro lá."
02/03/1998,Inezita Barroso,242,Tom Zé,"Maurício Barroso, também?"
02/03/1998,Inezita Barroso,243,Inezita Barroso,"Maurício, meu cunhado! Maurício incentivava muito, ele foi um grande ator do TBC. Todos dessa época. Quem adorou a gente foi o Vittorio Gassman, essa gentinha."
02/03/1998,Inezita Barroso,244,Assis Ângelo,"Nessas reuniões surgiram muitas músicas inéditas que eram cantadas lá com você. Tinha o Zé do Norte, o próprio Paulo Vanzolini"
02/03/1998,Inezita Barroso,245,Inezita Barroso,"O Zé do Norte foi muito, muito. Eu tenho até gravado em gravador de fio as coisas do Zé do Norte. Tenho até hoje, foi passando."
02/03/1998,Inezita Barroso,246,Assis Ângelo,"E músicas do Paulo Vanzolini, até hoje também inéditas, que você gravou naquela época, não é isso?"
02/03/1998,Inezita Barroso,247,Inezita Barroso,"Não, não gravei, tem muitas inéditas ainda, dele."
02/03/1998,Inezita Barroso,248,Assis Ângelo,"Que, certamente, ele nem lembra."
02/03/1998,Inezita Barroso,249,Inezita Barroso,O Lupcínio Rodrigues. Então muita gente freqüentou...
02/03/1998,Inezita Barroso,250,Assis Ângelo,"Agora, Inezita, tem uma coisa curiosa, que é o seguinte: mulher no disco, principalmente fazendo jingle político, é uma raridade - hoje, inclusive, até hoje -, mas você, nos anos 60, você fez algumas coisas, até junto com Luiz Gonzaga. Tem um disco em que você..."
02/03/1998,Inezita Barroso,251,Inezita Barroso,Eu?!
02/03/1998,Inezita Barroso,252,Assis Ângelo,É! Você cantando “Eu vou votar em JB”. Lembra disso?
02/03/1998,Inezita Barroso,253,Inezita Barroso,Não.
02/03/1998,Inezita Barroso,254,Assis Ângelo,"É um disco com Jorge Veiga, são quatro artistas participando. Então, vou lhe mostrar esse disco!"
02/03/1998,Inezita Barroso,255,Inezita Barroso,"Eu quero, faço questão. JB para mim é uísque!"
02/03/1998,Inezita Barroso,256,Moraes Sarmento,"Eu quero aproveitar esta oportunidade e comunicar a todos os companheiros aqui da mesa que, antecipadamente, eu quero parabenizar você, porque no dia 4 de março você estará soprando mais uma velinha. Quantos aninhos? Mostra os dedinhos!"
02/03/1998,Inezita Barroso,257,Matinas Suzuki,"Seu amigo, hein, Inezita?"
02/03/1998,Inezita Barroso,258,Inezita Barroso,37; é só você inverter.
02/03/1998,Inezita Barroso,259,Moraes Sarmento,"O que eu quero dizer e desejar de coração a você: muitas felicidades e que você seja feliz diariamente, inclusive domingos, feriados, dias santos, pontos facultativos, dias de folga e que tenha muita saúde. Não é uma sugestão, é uma intimação. Um abração para você."
02/03/1998,Inezita Barroso,260,Inezita Barroso,Obrigada!
02/03/1998,Inezita Barroso,261,Matinas Suzuki,"Inezita, o Elias Rodrigues, da Paraíba, pergunta o seguinte: por que o seu programa não toca mais a viola repentista nordestina?"
02/03/1998,Inezita Barroso,262,Inezita Barroso,"Bom, eu não sei."
02/03/1998,Inezita Barroso,263,Matinas Suzuki,Não sabe?
02/03/1998,Inezita Barroso,264,Inezita Barroso,"Não, não. A gente gosta muito de música nordestina, também, e tem levado muita coisa; mas, na maioria, forró. Agora, eu não sou produtora do programa, eu não interfiro na produção. Muita gente pensa que eu que convido e eu que levo; não sou eu. Então, às vezes, eu encaminho alguém, digo: “Olha, este aqui é bom.” Mas não passo disso, não sou xereta, de jeito nenhum."
02/03/1998,Inezita Barroso,265,Luiz Antônio Giron,"Inezita, pegando o gancho do Matinas, eu me lembro de uma coisa: você tem contato não só com o folclore paulista, do interior de São Paulo; você fez pesquisas por todo interior do Brasil, né?"
02/03/1998,Inezita Barroso,266,Inezita Barroso,Foi.
02/03/1998,Inezita Barroso,267,Luiz Antônio Giron,"Queria que você contasse um pouquinho disso, também. Sobre esse teu contato com outros folclores: nordestinos... Você gravou um disco muito importante de danças gaúchas e até hoje é um disco muito importante no Rio Grande do Sul."
02/03/1998,Inezita Barroso,268,Assis Ângelo,Nunca relançado.
02/03/1998,Inezita Barroso,269,Luiz Antônio Giron,Nunca relançado e muito bonito.
02/03/1998,Inezita Barroso,270,Assis Ângelo,Dez polegadas.
02/03/1998,Inezita Barroso,271,Inezita Barroso,Dez e doze. Doze foi com uma orquestra.
02/03/1998,Inezita Barroso,272,Luiz Antônio Giron,E até hoje muito executado no Rio Grande do Sul.
02/03/1998,Inezita Barroso,273,Inezita Barroso,"É. Ele foi adotado até, pelo governo, como material de ensino de colégio, centros de tradição."
02/03/1998,Inezita Barroso,274,Luiz Antônio Giron,"E eu ia te perguntar isso: nessas pesquisas que você fez em todo o Brasil, você percebe um ponto de ligação entre esses folclores regionais? Existe uma identidade realmente brasileira em tudo isso?"
02/03/1998,Inezita Barroso,275,Inezita Barroso,Existe.
02/03/1998,Inezita Barroso,276,Luiz Antônio Giron,Por que isso? Queria que você falasse um pouco dessa...
02/03/1998,Inezita Barroso,277,Inezita Barroso,"Existe, é uma coisa muito séria. Locais, assim, que você nem imagina, você encontra uma coisa deslumbrante, maravilhosa, séria, sabe? Outras manifestações que ninguém cita em livros ou revistas e tal... “Mas o que é isso? É uma coisa muito linda!” O Nordeste, para mim, foi o paraíso. Eu fui para ficar uns três dias, para fazer uma pesquisa em Pernambuco, e fiquei dois meses. E acabei cantando pela primeira vez como profissional em Recife."
02/03/1998,Inezita Barroso,278,Assis Ângelo,"Agora, por outro lado, você... Quer dizer, das coisas da terra, das músicas, do folclore, você, naturalmente, é uma das principais ou, talvez, a maior representante do Brasil. Você também esteve sempre junto com poetas, com escritores, com Clarice Lispector, por exemplo. Até hoje você participa de uma tertúlia aqui em São Paulo, a Pensão Jundiaí, da Mariazinha Congilio. Quer dizer, você está sempre junto, também, de intelectuais. Eu queria que você falasse também da Clarice Lispector, do Ascenso Ferreira..."
02/03/1998,Inezita Barroso,279,Inezita Barroso,"Exatamente. A Clarice eu não conheci, assim, muito de perto. É uma coisa, assim, meio ruim para mim, porque a Mariazinha Congilio dá essas reuniões maravilhosas às terças-feiras e terça-feira é dia que eu dou aula na faculdade lá na Mooca; então, quando eu chego, o jantar já acabou. Mas, às vezes, a gente conversa bastante por telefone, me apresenta a outros poetas e recebo livros de todos eles, escritores, poetas."
02/03/1998,Inezita Barroso,280,Assis Ângelo,"Ascenso Ferreira, por exemplo. Esses poetas, você..."
02/03/1998,Inezita Barroso,281,Inezita Barroso,"Ah, esse eu conheci bem de perto em Pernambuco. Nessa época."
02/03/1998,Inezita Barroso,282,Assis Ângelo,"E aqui também em São Paulo, no Teatro Cultura Artística..."
02/03/1998,Inezita Barroso,283,Inezita Barroso,"É, eu fiz até um show com ele..."
02/03/1998,Inezita Barroso,284,Assis Ângelo,"Olha, que beleza..."
02/03/1998,Inezita Barroso,285,Inezita Barroso,"É verdade, no pequeno auditório do Teatro Cultura Artística, da Nestor Pestana. Fiz um show com ele e um outro que foi João Villaret, eu e a Tônia Carrero."
02/03/1998,Inezita Barroso,286,Assis Ângelo,"Grande declamador português, não é? Aliás, você uma vez você me contou que um dos seus grandes sonhos era ir em Portugal, cantar em Portugal. Já foi?"
02/03/1998,Inezita Barroso,287,Inezita Barroso,"Já, já, este eu já realizei. Muito bom, muito bom! O público conhece tudo desse repertório brasileiro. De cantigas, toadas, canções, eles respondem tudo, sabem o estribilho de tudo. criança... Eu cantei quase um mês numa feira luso-brasileira, patrocinada aqui pelo Ministério do Trabalho. Me mandaram para essa feira; eu me apresentava toda noite lá. No primeiro dia, eu estava morrendo de medo. “Mas o que eu vou cantar aqui em Portugal?” Aí cantei a “Colcha de retalhos”, do Raul Torres, e veio abaixo, aquilo lá! No dia seguinte, eles começaram a chegar mais e a pedir outras coisas... “Maringá”, eles sabiam inteira, “De papo pro ar”, “Fiz a cama na varanda”... Coisas do Brasil inteiro. E um dia eu fiquei surpreendida, mesmo: uma menininha de uns dez anos veio com um embrulhinho, assim, abriu e eram uns cinco discos meus, cinco LP. “Eu trouxe para a senhora autografar.” Foi uma emoção..."
02/03/1998,Inezita Barroso,288,Renato Andrade,"Eu não vou seguir a ordem, não, porque eu não gosto de roteiro. Vou falar é outra coisa, já. Falar do Viola, minha viola, vamos?"
02/03/1998,Inezita Barroso,289,Inezita Barroso,"Vamos! Eu não acabei a pergunta dele, mas oportunamente a gente vai..."
02/03/1998,Inezita Barroso,290,[...],
02/03/1998,Inezita Barroso,291,Tom Zé,"...sobre esse negócio que ele perguntou, mas tudo bem. Me desculpe querido, continue."
02/03/1998,Inezita Barroso,292,Renato Andrade,"Tinha um vereador lá da minha região que falava: “O senhor tem a palavra”; eu: “Não, eu engulo a palavra, o senhor pode falar.” Então, vamos falar de Viola, minha viola... Você, eu considero um patrimônio; nos países socialistas, seria tombada, né?"
02/03/1998,Inezita Barroso,293,Inezita Barroso,
02/03/1998,Inezita Barroso,294,Renato Andrade,"Que, a propósito, esse programa já esteve até... em Marselha ou na França?"
02/03/1998,Inezita Barroso,295,Inezita Barroso,Na França.
02/03/1998,Inezita Barroso,296,Renato Andrade,"Pois é. Foi exibido lá na Fundação Pompidou, não é isso?"
02/03/1998,Inezita Barroso,297,Inezita Barroso,É.
02/03/1998,Inezita Barroso,298,Renato Andrade,"E fale sobre ele, um pouquinho do Viola, minha viola."
02/03/1998,Inezita Barroso,299,Inezita Barroso,O Sarmento sabe bem.
02/03/1998,Inezita Barroso,300,Renato Andrade,Quantos anos...
02/03/1998,Inezita Barroso,301,Inezita Barroso,Nós fizemos um programa inteiro em francês. Foi uma tourada.
02/03/1998,Inezita Barroso,302,Renato Andrade,"Certo. passou apertada lá, de tanto fazer biquinho, “oui, oui, oui”..."
02/03/1998,Inezita Barroso,303,Inezita Barroso,Horas e horas gravando em francês. O filme que ia representar o Brasil e sua música regional.
02/03/1998,Inezita Barroso,304,Matinas Suzuki,"E vocês fizeram o programa também em francês, é isso?"
02/03/1998,Inezita Barroso,305,Inezita Barroso,Fizemos o programa inteiro em francês.
02/03/1998,Inezita Barroso,306,Matinas Suzuki,Inteirinho em francês.
02/03/1998,Inezita Barroso,307,Inezita Barroso,Porque era para ser exibido lá.
02/03/1998,Inezita Barroso,308,Renato Andrade,"Inezita, o famoso Teatro Solis, em Montevidéu..."
02/03/1998,Inezita Barroso,309,Inezita Barroso,Montevidéu...
02/03/1998,Inezita Barroso,310,Renato Andrade,...em que você esteve...
02/03/1998,Inezita Barroso,311,Inezita Barroso,Eu estive.
02/03/1998,Inezita Barroso,312,Renato Andrade,"...e ganhou, também... Eu faço de araque, eu não tenho roteiro, agora eu tiro da cabeça. E o Disco de Ouro da Globo..."
02/03/1998,Inezita Barroso,313,Inezita Barroso,"Ganhei, eu tenho quase 200 prêmios."
02/03/1998,Inezita Barroso,314,Zuza Homem de Melo,"Falando em prêmios, conta um pouco da história dos momentos que você viveu num dos prêmios que, durante a época em que você trabalhou na TV Record, era o mais ambicionado, que era o Roquette Pinto, e todos aqueles programas com a participação, com a presença do público. Foi uma fase, para você..."
02/03/1998,Inezita Barroso,315,Inezita Barroso,"O Roquette Pinto foi um prêmio muito importante. A gente ganhava sete vezes, sete anos e depois tinha que sair. Na sétima vez era de ouro, era diferente o papagaio."
02/03/1998,Inezita Barroso,316,Zuza Homem de Melo,"Você participava quase sempre como a estrela da apoteose do Roquette Pinto. Eu me lembro, porque eu fazia o programa."
02/03/1998,Inezita Barroso,317,Inezita Barroso,"Exatamente. Com aquelas grandes orquestras, Gabriel Migliore, Hervé Cordovil, vários maestros, Ciro Pereira, uma porção de gente muita boa. E as festas do Roquette Pinto eram faraônicas, era uma coisa linda, você se sentia muito bem. Muito bonito. E valeu, viu?"
02/03/1998,Inezita Barroso,318,Zuza Homem de Melo,E para a música brasileira...
02/03/1998,Inezita Barroso,319,Inezita Barroso,Era muito importante.
02/03/1998,Inezita Barroso,320,Zuza Homem de Melo,Você sente falta de coisas assim na televisão?
02/03/1998,Inezita Barroso,321,Inezita Barroso,"Sinto muita falta, principalmente das orquestras. Como é que você pode cantar um “Funeral do Rei Nagô” com violão, né? Um “Banzo”, um tema afro-brasileiro pesado, daqueles lindos... com violão ou com conjuntinho de guitarra e tecladinho? Não dá, né?"
02/03/1998,Inezita Barroso,322,Matinas Suzuki,"Inezita, o Sérvulo Esmeraldo, de Fortaleza, manda um abraço para você, está com saudades e manda um abraço para o Zuza."
02/03/1998,Inezita Barroso,323,Zuza Homem de Melo,"Um abraço, Sérvulo."
02/03/1998,Inezita Barroso,324,Matinas Suzuki,E pergunta se o Jararaca e Ratinho e o Manezinho Araújo não seriam referências para você também.
02/03/1998,Inezita Barroso,325,Inezita Barroso,"Ah, foram, foram sim. Jararaca e Ratinho eu toco até hoje na rádio. Tem muitos pedidos no programa de rádio da Cultura, na AM. E o Manezinho Araújo, eu conheci bem, era uma criatura linda, linda, doce, maravilhosa. Convivi bastante com ele aqui em São Paulo e no Rio."
02/03/1998,Inezita Barroso,326,Tom Zé,"Também é nordestino, né?"
02/03/1998,Inezita Barroso,327,Inezita Barroso,É.
02/03/1998,Inezita Barroso,328,Assis Ângelo,Pernambucano.
02/03/1998,Inezita Barroso,329,Tom Zé,E já que Jararaca e Ratinho também são do Norte - eu estou tão curioso daquela pergunta do Giron de que aparências têm os folclores das regiões diversas do Brasil... Desculpe...
02/03/1998,Inezita Barroso,330,Inezita Barroso,"Certo. Olha, cada um tem a sua peculiaridade, cada região do Brasil é um mundo, isso daqui é imenso, e é difícil você dizer que um xote, por exemplo, nordestino é igual a um xote gaúcho, cada um tem as suas influências. Não deixa de ser um xote, mas tocado de maneira diferente, o andamento diferente, as letras diferentes. Tem uma relação, mas não é igual, porque não está massificado."
02/03/1998,Inezita Barroso,331,Tom Zé,"É nesse sentido, Giron, que você estava perguntando?"
02/03/1998,Inezita Barroso,332,Luiz Antônio Giron,"É, eu queria saber se, nessas suas viagens pelo Brasil, como você via essas diferenças e como é que você recolheu esse material, se foi gravando, se for cantando e aprendendo a tocar, aprendendo a cantar, como foi essa experiência do Sul ao Norte?"
02/03/1998,Inezita Barroso,333,Inezita Barroso,"Vou te dar um exemplo, porque nesse tempo não tinha gravador de pilha, não existia ainda, isso foi em 56, 57, por aí. Não existia, nem pequenininho. Era deste tamanho, ligado a uma bateria ou numa tomada. Quando era dentro de casa, era... Eu perdi muita coisa por causa disso. Mas eu escrevo música na pauta e tal, e eu saía com o livrinho de música atrás do camarada e escrevendo, porque não tinha jeito de guardar, só escrevendo. E eu estava numa ocasião no interior da Bahia, perto de Jequié, e tinha um camarada varrendo o terreiro assim, como se fosse vassoura de palha, espalhando uma poeirada. Era um posto de gasolina e eu parei para abastecer o jipe. Eu fiz 7.200 km de jipe recolhendo coisas. E o cara cantando um negócio maravilhoso e eu atrás dele e ele jogando poeira e eu escrevendo quase de joelhos e consegui pegar quase inteira. E era, se não me engano, um tema de capoeira, mas era no interior da Bahia, onde... A capoeira é mais querida em Salvador, na capital. Então, numa região onde não havia quase influência afro e o cara cantando um tema de capoeira! Então, era assim... “Se a piaba nada, eu quero nadar / se a andorinha voa, eu também quero avoar / Menina diga a seu pai que faça as conta comigo / e se não tiver dinheiro, que pague a conta contigo”. E eu lá, quase de quatro atrás dele, e ele não acabou de cantar a música, porque parou um Fenemê, que era um... - FNM, na Bahia é Fenemê."
02/03/1998,Inezita Barroso,334,[...],No Brasil todo.
02/03/1998,Inezita Barroso,335,Inezita Barroso,"E parou um bicho desse - tcháá, tchááá! - e o cara ficou meio assustado com a vassourinha dele e ele me viu lá atrás... E o motorista desceu, o caminhoneiro: “Que é que a senhora está ouvindo aí?? Isso é porcaria!” E pegou a antena e ligou na Rádio Nacional do Rio de Janeiro e me cortou o barato. É difícil recolher. Agora, com gravador, assim, tudo combinadinho, é muito bom."
02/03/1998,Inezita Barroso,336,Matinas Suzuki,"Você tem um grande arquivo, Inezita?"
02/03/1998,Inezita Barroso,337,Inezita Barroso,"Tenho, tenho. Muita coisa ainda que não foi adaptada: pregões, cantigas de ninar, cantigas de roda. Aquela música que apareceu na novela, que a Elba canta, eu recolhi aquilo em 55 no interior da Bahia."
02/03/1998,Inezita Barroso,338,Matinas Suzuki,Mas você vem fazendo um trabalho de re-sistematização desses arquivos; como é?
02/03/1998,Inezita Barroso,339,Inezita Barroso,"É, eu tenho tudo organizadíssimo, mas, para adaptar... não sei, precisa ser bom, tipo Babi de Oliveira, gente assim. E, para fazer uma coisa que não condiz com a força do estribilho, eu prefiro guardar o tema puro, curtinho, talvez algum dia saia alguma coisa."
02/03/1998,Inezita Barroso,340,Assis Ângelo,"Inezita, você falou a respeito de “Ronda”, contou a história de “Ronda”, como foi gravada e tal, quatro vezes você gravou..."
02/03/1998,Inezita Barroso,341,Inezita Barroso,"Não, a “Pinga” eu gravei quatro vezes."
02/03/1998,Inezita Barroso,342,Assis Ângelo,"Ah, perdão. “Lampião de gás”, como é que surgiu? Que é outro clássico, é outra música que você emplacou, como se diz. gora, a a mim me parece também que é um tema popular."
02/03/1998,Inezita Barroso,343,Inezita Barroso,"É......com a orquestra do Hervé Cordovil, foi o meu primeiro LP grande, de doze polegadas, e tinha..."
02/03/1998,Inezita Barroso,344,Assis Ângelo,1958?
02/03/1998,Inezita Barroso,345,Inezita Barroso,"Cinqüenta e se... é, começo de 1958. E apareceu uma senhora muito elegante, muito bonitona, muito chique, assim: “Olha, eu fiz uma música para você.” E eu olhei, achei estranho, porque, geralmente, compositora era de outro tipo... Aí, ela abriu um papel assim, uma letra deste tamanho, e falou: “Ah, falando do lampião de gás, que eu morro de saudade dele e tal. Você lê aí a letra e está aí a partitura.” Aí o Hervé falou: “Me dá aqui, deixa eu ver.” E passaram-se uns dez dias e eu estava gravando no estúdio da Record o meu primeiro LP de doze polegadas e, como era o de doze polegadas, faltou uma música. E eu estava péssima, com febre de 39, gripada, com nariz fanhoso, daí Hervé disse: “Falta uma música! Eu tenho que entregar isso! Como é que vai ser?” “Olha, eu não sei, eu não sei, estou me sentindo mal.” “Não! Vai gravar a música daquela senhora! 'Lampião de gás'.” “Hervé, eu não sei nem se cor a coisa...” “Não, vai cantar lendo.” E tinha um coralzinho, o Coral de Ouro da Record, e falou: “E vocês vão fazer um contracanto assim, ó:” “Lá-rá-rá-rá”. E o coral ensaiou ali na hora e foi praticamente de ouvido, a gravação do “Lampião de gás”."
02/03/1998,Inezita Barroso,346,Assis Ângelo,"Aliás, como “Ronda”, né? Não teve ensaio."
02/03/1998,Inezita Barroso,347,Inezita Barroso,"Não, só o regional, que era de cobra, só cobra, que ensaiou direitinho."
02/03/1998,Inezita Barroso,348,Tom Zé,"Mas que sorte dessa criatura, hein? Como é o nome dessa autora?"
02/03/1998,Inezita Barroso,349,Inezita Barroso,Zica Bergami.
02/03/1998,Inezita Barroso,350,Tom Zé,"Puxa, que santo bom!"
02/03/1998,Inezita Barroso,351,Inezita Barroso,Ela é uma boa compositora!
02/03/1998,Inezita Barroso,352,Tom Zé,"Eu estou precisando do seu sangue, viu?"
02/03/1998,Inezita Barroso,353,Assis Ângelo,"Agora, essa música, portanto, quase que você não gravava, né? E teve uma que você não gravou e também fez um sucesso e virou também um clássico, que, coincidentemente, é do Paulo Vansolini, que é a “Volta por cima”. A você foi oferecida essa música, pela primeira vez... Não?"
02/03/1998,Inezita Barroso,354,Inezita Barroso,Eu não me lembro que tivesse sido oferecida a mim. São detalhes que a gente não se lembra.
02/03/1998,Inezita Barroso,355,Moraes Sarmento,A letra não cabia na interpretação de mulher. Não era para mulher.
02/03/1998,Inezita Barroso,356,Inezita Barroso,"É, não era, mesmo..."
02/03/1998,Inezita Barroso,357,Assis Ângelo,"Era um samba, também."
02/03/1998,Inezita Barroso,358,Inezita Barroso,Não estava gravando na época...
02/03/1998,Inezita Barroso,359,Moraes Sarmento,Quem criou esse samba foi o Noite Ilustrada em 1963.
02/03/1998,Inezita Barroso,360,Inezita Barroso,Muito bem!
02/03/1998,Inezita Barroso,361,Moraes Sarmento,O maior sucesso do Noite Ilustrada até hoje. 63.
02/03/1998,Inezita Barroso,362,Renato Andrade,"Ô Inezita, eu lembro aqui de perguntar: Eu noto que, na minha região, cada cidade tem uma folia de reis, ali é uma coisa, ali é outra. Inclusive em literatura: Guimarães Rosa fez em Sagarana. Mas é regional, é coisa dali. Se você fizer uma pergunta de folclore no país, você fica louco."
02/03/1998,Inezita Barroso,363,Inezita Barroso,Fica.
02/03/1998,Inezita Barroso,364,Renato Andrade,"Porque o folclore vai desde Vitalina até o Brejão, você fica doido."
02/03/1998,Inezita Barroso,365,Inezita Barroso,"E da folia de reis tem muita coisa, dentro..."
02/03/1998,Inezita Barroso,366,Renato Andrade,Reisados e congados...
02/03/1998,Inezita Barroso,367,Inezita Barroso,Jeito de tocar a viola...
02/03/1998,Inezita Barroso,368,Renato Andrade,Jeito de tocar a viola...
02/03/1998,Inezita Barroso,369,Inezita Barroso,Uma porção de coisas.
02/03/1998,Inezita Barroso,370,Renato Andrade,"Você veja no Nordeste. No Nordeste, a propósito, a viola não é usada para solo, não é?"
02/03/1998,Inezita Barroso,371,Inezita Barroso,Não.
02/03/1998,Inezita Barroso,372,Renato Andrade,"É usada para acompanhar os repentistas, que Guerra-Peixe chamava de uma “réplica do jogral”."
02/03/1998,Inezita Barroso,373,Assis Ângelo,"Pois é, e é medieval, isso."
02/03/1998,Inezita Barroso,374,Renato Andrade,É.
02/03/1998,Inezita Barroso,375,Assis Ângelo,Do tempo antigo.
02/03/1998,Inezita Barroso,376,Inezita Barroso,"Agora, esses repentistas, eu conheci muitos no interior de Pernambuco, eles eram verdadeiros gênios."
02/03/1998,Inezita Barroso,377,Assis Ângelo,"São, né..."
02/03/1998,Inezita Barroso,378,Inezita Barroso,São.
02/03/1998,Inezita Barroso,379,Assis Ângelo,O Cego Aderaldo é inesquecível.
02/03/1998,Inezita Barroso,380,Inezita Barroso,Cego Aderaldo...
02/03/1998,Inezita Barroso,381,Renato Andrade,...inspirou muito no Cego Aderaldo.
02/03/1998,Inezita Barroso,382,[...],
02/03/1998,Inezita Barroso,383,Renato Andrade,Guerra-Peixe...
02/03/1998,Inezita Barroso,384,Inezita Barroso,"Então, tinha gente que me chamava para ver a mulher paulista - a “mulé paulista”. Pegava meu violão lá e tocava para eles e tal. Aí, não sei que cidadão lá, isso numa cidade minúscula, falou: “Canta, canta alguma coisa de Noel Rosa”. E eu cantei uma música que foi pouquíssimo gravada do Noel Rosa, que se chama “Nuvem que passou”."
02/03/1998,Inezita Barroso,385,Zuza Homem de Melo,"É lindo, Francisco Alves"
02/03/1998,Inezita Barroso,386,Inezita Barroso,Não é lindo? Pouquíssimo regravada.
02/03/1998,Inezita Barroso,387,Zuza Homem de Melo,"Lindíssima, essa música, lindíssima."
02/03/1998,Inezita Barroso,388,Inezita Barroso,"A música, maravilhosa. No fim, ele diz assim: “O amor é um pecado e quem não ama é pecador.” Eu estava: “O amor é um pecado...” e o cidadão pulou por cima da mesa: “E quem não ama é um pecador!!!”. Ele nunca tinha ouvido a música e eu achei sensacional, aquilo apareceu assim, de repente."
02/03/1998,Inezita Barroso,389,Assis Ângelo,E não era repentista...
02/03/1998,Inezita Barroso,390,Inezita Barroso,"Era, era repentista."
02/03/1998,Inezita Barroso,391,Renato Andrade,"Nós estamos falando em repentista... Lá em Ipanema, tinha dois lá batendo viola e cantando. Tom Jobim entrou no meio com a flautinha - “fififi...” - e ele falou: “Se o senhor fosse afinado, o senhor vinha com nóis!”"
02/03/1998,Inezita Barroso,392,Inezita Barroso,Ótimo!
02/03/1998,Inezita Barroso,393,Zuza Homem de Melo,"Inezita, como é o seu dia-a-dia? Outro dia você estava me contando que você dá aulas e tal. E tem um... Enfim, valeria a pena você contar todas as suas atividades, ou pelo menos as principais."
02/03/1998,Inezita Barroso,394,Inezita Barroso,"É uma loucura, realmente é uma loucura."
02/03/1998,Inezita Barroso,395,Zuza Homem de Melo,Eu fiquei impressionado.
