DATA,ENTREVISTA,ORDEM,LOCUTOR,FALA
02/03/1998,Inezita Barroso,396,Inezita Barroso,"Eu só não tenho tempo para viver, o resto está tudo por aí. Não, não, segunda eu gravo rádio de manhã, dois programas, de duas horas cada um. Depois, à tardezinha, eu tenho o coral da faculdade, que estou formando, já. Está bem bonzinho, já estão cantando em três vozes, está chique à beça. Depois, na terça, eu tenho rádio outra vez de manhã e tenho faculdade à noite - e aí é aula levada a sério e tal até às onze da noite."
02/03/1998,Inezita Barroso,397,Zuza Homem de Melo,Você dá aula para onde?
02/03/1998,Inezita Barroso,398,Inezita Barroso,"Aula de folclore brasileiro no turismo. E quarta-feira é o dia de gravar a TV. Então, é aquele negócio de embonecar, pentear cabelo, fazer maquiagem, escolher a roupa; aí, eu vou para lá às duas horas e fico até a hora que Deus quiser, acabar de gravar e tal. E, na quinta-feira, agora a gente tem gravado duas vezes por semana e na outra não tem. É a mesma dança, só que, aí, é de manhã e tem dois programas de rádio para gravar. E por aí vai. E sexta-feira eu vou para o interior, tem show, tem palestras, muitas patrocinadas pela Secretaria de Cultura."
02/03/1998,Inezita Barroso,399,Zuza Homem de Melo,Você faz muitos shows?
02/03/1998,Inezita Barroso,400,Inezita Barroso,"Muito, muito. Shows e aulas, série de aulas, 25 horas de aula e você fala, fala, fala... E vou fazer este ano muito, já está tratado."
02/03/1998,Inezita Barroso,401,Zuza Homem de Melo,Já está programado?
02/03/1998,Inezita Barroso,402,Inezita Barroso,Já está programado.
02/03/1998,Inezita Barroso,403,Matinas Suzuki,"Inezita, Míriam Nascimento pergunta se você exerceu a função de bibliotecária."
02/03/1998,Inezita Barroso,404,Inezita Barroso,"Eu fui uma bibliotecária muito malandra, porque todo o estágio do curso - a USP funcionava na Praça da República; filosofia, no terceiro andar, e tinha uma biblioteca sensacional - e eu passei todo o estágio: chegava lá adiantada, batia fichinha na máquina que nem louca e ia ler tudo aquilo que eu não tinha em casa, que era o Mário de Andrade, todo esse pessoal. Eu lia o dia inteiro e aprendi muito. E, aí, aprendi a gostar de muita gente que eu não conhecia. Depois, eu trabalhei um mês só como bibliotecária. Achei horrível, porque, você ficar trancado sem querer num lugar, para mim não dá, eu adoro sol, praia, ar livre."
02/03/1998,Inezita Barroso,405,Matinas Suzuki,E a Geysa Maria Pavan de pergunta se alguma das suas netas tem tendência a continuar sua carreira.
02/03/1998,Inezita Barroso,406,Inezita Barroso,"Por enquanto eu não senti. Eu gostaria muito e quis que a mais velha aprendesse piano, mas não queria, queria arquitetura e está se formando em arquitetura. Na segunda, também dei uma forçadinha, dei um violão de presente, mas o violão rolando lá às traças; está estudando medicina, está no segundo ano de medicina. E a terceira, eu ainda não dei o bote nesta..."
02/03/1998,Inezita Barroso,407,Matinas Suzuki,Não?
02/03/1998,Inezita Barroso,408,Inezita Barroso,"Não. Esta, pode ser que aceite, porque ela quer estudar direito, gosta de poesia, gosta de ler. De repente, pega no breu."
02/03/1998,Inezita Barroso,409,Matinas Suzuki,"Moraes Sarmento, por favor."
02/03/1998,Inezita Barroso,410,Moraes Sarmento,"Inezita, uma pergunta talvez até tola, mas, já que você leciona em várias faculdades folclore, naturalmente você deve ter uma classe constituída de tantas e tantas jovens, - portanto, jovens. Como é o comportamento desse pessoal no decorrer da aula que você dá?"
02/03/1998,Inezita Barroso,411,Inezita Barroso,"A primeira aula é uma tragédia, porque elas querem entender como é que uma artista é uma professora de faculdade. Aí, elas ficam assim meio bobas, meio apavoradas. Mas daí, na segunda aula, já vai maneirando; na terceira; e daí eu arrebanho a classe toda para uma pesquisa e, aí, vira folia. Aí, elas amam. Agora, em maio, nós temos a Festa de Santa Cruz, tradicional, em Carapicuíba. Então, elas se dividem em vários carros, elas e eles, e vai todo mundo para Carapicuíba. Dançam a dança de Santa Cruz e eu exijo trabalho de tudo isso, fotografam, uma beleza. No fim do ano, está todo mundo amando a matéria."
02/03/1998,Inezita Barroso,412,Moraes Sarmento,Que bom!
02/03/1998,Inezita Barroso,413,Assis Ângelo,"Inezita, você não tem nenhuma música de sua autoria. Você gravou muita coisa com muita gente, tem gravado e continua gravando; se Deus quiser, vai continuar durante cinqüenta mil anos ainda. Mas você nunca compôs nada, não é isso?"
02/03/1998,Inezita Barroso,414,Inezita Barroso,Para quê? Tem tanta coisa linda! Tanta coisa linda no folclore para a gente cantar e ainda faltam tantos para gravar e cantar!
02/03/1998,Inezita Barroso,415,Assis Ângelo,"Você é como a Elis Regina, aliás: vocês duas nunca compuseram nada, mas o que gravaram de coisa dos outros...!"
02/03/1998,Inezita Barroso,416,Inezita Barroso,"Mas é ótimo! É ótimo, dos outros."
02/03/1998,Inezita Barroso,417,Assis Ângelo,"Ou seja, você é cantora, mesmo!"
02/03/1998,Inezita Barroso,418,Inezita Barroso,"Cantora, mesmo."
02/03/1998,Inezita Barroso,419,Renato Andrade,"Não sei se você sabe, judeu não compõe, não, ele toca o que o outro compôs. O Raves, ele fala: “Eu não! Não vou arrumar trabalho com isso, não!”"
02/03/1998,Inezita Barroso,420,Assis Ângelo,"Dá trabalho, né?"
02/03/1998,Inezita Barroso,421,Inezita Barroso,"Eu gostaria de gravar, sim, alguma coisa bonita que está por aí - dos outros - e gostaria que a RGE me desse essa chance novamente, através do Pelão, né, que fez uma força danada e conseguiu. Fazia muitos anos que não gravava, mas achei uma beleza a atitude dele e da RGE, também."
02/03/1998,Inezita Barroso,422,Assis Ângelo,"Artisticamente, você conseguiu, até hoje, já realizar todos os seus projetos, sonhos, vontades? Alguma coisa que você deixou de fazer na música, por exemplo, conhecer algum... ou cantar junto com alguém, com Tom Zé, por exemplo..."
02/03/1998,Inezita Barroso,423,Tom Zé,"Ô, querido, já que você falou o meu nome, eu queria entrar numa pergunta dele."
02/03/1998,Inezita Barroso,424,Inezita Barroso,"Vamos fazer uma dupla, Tom Zé?"
02/03/1998,Inezita Barroso,425,Tom Zé,"Tá certo! Ô, meu Jesus, já pensou, eu chegando em Irará dizendo: “Cantei com Inezita Barroso!” Ah, minha filha, aí eu vou ser nome de rua. Mas veja, Inezita, ele estava perguntando se você tinha realizado um sonho e alguma coisa nessa direção. Aí, eu emendo e boto a minha pergunta no seu carro de boi. E pergunto assim: se sua mãe e seus avós, a família Ayres..."
02/03/1998,Inezita Barroso,426,Inezita Barroso,Aranha e Ayres.
02/03/1998,Inezita Barroso,427,Tom Zé,"Isso, Almeida e Ayres de Lima e tal. Se eles hoje voltassem a protestar com você de você tomar essa carreira - ou melhor, você diria a eles o quê sobre o tempo em que eles protestavam por você entrar nessa carreira?"
02/03/1998,Inezita Barroso,428,Inezita Barroso,"“Vocês não sabiam o que estavam perdendo!” Não, no final, eles já aderiram a tudo. O meu pai amava. Só que ele chorava muito, ele era muito emotivo; então, ele ia assistir e acabava chorando. Minha mãe também, só que a família da minha mãe não tinha jeito: aprenderam de tudo, bandolim, harpa, piano, violino, bandola, um monte de coisa, e ninguém tocou e ninguém cantou. E eu aprendi a cantar e a tocar, música urbana, principalmente, escondida atrás de um sofá, enquanto a minha tia madrinha tomava aulas de violão, seriíssimo, por música. Porque tinha que ser por música - de ouvido, era profissão de vagabundo. Aí, ela largava o violão lá, não estudava e eu chegava lá e tocava tudo, por cima de violão. Um dia, me pegaram e não deu outra."
02/03/1998,Inezita Barroso,429,Moraes Sarmento,Você começou a tocar violão com que idade?
02/03/1998,Inezita Barroso,430,Inezita Barroso,Sete anos.
02/03/1998,Inezita Barroso,431,Moraes Sarmento,Com sete anos você tocava violão?
02/03/1998,Inezita Barroso,432,Inezita Barroso,"É. E viola, escondida na fazenda, porque menina não tocava viola."
02/03/1998,Inezita Barroso,433,Moraes Sarmento,E piano?
02/03/1998,Inezita Barroso,434,Inezita Barroso,"Piano, com nove. Comecei com nove, fiz três cursos de piano. Não foi inútil, porque eu faço os arranjos com música e depois eu passo para o violão de ouvido."
02/03/1998,Inezita Barroso,435,Zuza Homem de Melo,E os sonhos não realizados de que o Assis falou?
02/03/1998,Inezita Barroso,436,Inezita Barroso,"Ah, os sonhos. Eu não sou de sonhar muito, não. Eu já sonhei muito tempo atrás. Numa ocasião, esteve aqui um conjunto de dança e de canto, uma coisa linda, italiano, folclórico, chamava-se Carosello Napolitano."
02/03/1998,Inezita Barroso,437,Zuza Homem de Melo,Eu me lembro disso.
02/03/1998,Inezita Barroso,438,Inezita Barroso,Não é do seu tempo...
02/03/1998,Inezita Barroso,439,Zuza Homem de Melo,Já ouvi falar disso.
02/03/1998,Inezita Barroso,440,Inezita Barroso,"Olha, foi um sucesso, foi uma coisa brutal no Teatro Municipal. Eu fui todas as noites. E o meu sonho dourado era fazer uma coisa dessa com as danças e músicas brasileiras. Mas nunca consegui."
02/03/1998,Inezita Barroso,441,Assis Ângelo,"Como o Moraes tomou iniciativa de lhe fazer uma pergunta indiscreta, perguntar a sua idade..."
02/03/1998,Inezita Barroso,442,Moraes Sarmento,"Não, não perguntei, não... Eu falei aquela hora..."
02/03/1998,Inezita Barroso,443,Assis Ângelo,"Sutilmente, né..."
02/03/1998,Inezita Barroso,444,Inezita Barroso,"Quê, gente, a Folha publica todo dia. E certo!"
02/03/1998,Inezita Barroso,445,Moraes Sarmento,"Naquela hora, quando eu disse: “Mostra os dedinhos”, não era para ela dizer a idade dela."
02/03/1998,Inezita Barroso,446,Assis Ângelo,"Bom, então, pegando esse carro de boi aí, montando em cima dele, você separou-se do seu marido porque ele não queria que você fosse artista, que optasse por seguir a carreira de artista?"
02/03/1998,Inezita Barroso,447,Inezita Barroso,"Não, foi o contrário! Foi o contrário!"
02/03/1998,Inezita Barroso,448,Moraes Sarmento,Essa é pior...!
02/03/1998,Inezita Barroso,449,Inezita Barroso,Eu só comecei a cantar e tocar profissionalmente por causa dele. Depois de casada.
02/03/1998,Inezita Barroso,450,Assis Ângelo,Está vendo como dizem besteira por aí? Só para esclarecer...
02/03/1998,Inezita Barroso,451,Inezita Barroso,"Não, ele apoiou muitíssimo, muitíssimo. Era uma família cearense, de Fortaleza, e muitos músicos na família, muita gente interessada. E, aí, eu levei um susto, porque... Ceará e Pernambuco, quando eu vi que você podia trabalhar em teatro, cantar em rádio, eu falei: “Ai, pode, que beleza!” Aí, comecei a cantar profissionalmente, coisa que aqui foi difícil de a família aceitar. Mas, como eu estava casada, não tinha que dar satisfação."
02/03/1998,Inezita Barroso,452,Assis Ângelo,"Nunca ninguém te impôs nada, na verdade? Seja artisticamente, tipo gravadora, nenhuma gravadora impôs: “Eu quero que você grave isso...” “Não quero e não gravo”, nunca você abriu nenhuma concessão?"
02/03/1998,Inezita Barroso,453,Inezita Barroso,Nunca.
02/03/1998,Inezita Barroso,454,Moraes Sarmento,Fora Hervé Cordovil com o “Lampião de gás”.
02/03/1998,Inezita Barroso,455,Inezita Barroso,"É, mas tinha que acabar o disco e era interesse nosso, pelo amor de Deus...!"
02/03/1998,Inezita Barroso,456,Moraes Sarmento,"Aliás, bendita hora em que você gravou “Lampião de gás”. Você é a única cantora que tem direito de interpretar essa valsa. A única!"
02/03/1998,Inezita Barroso,457,Assis Ângelo,"Aliás, essa música foi gravada em japonês em disco de 78 rotações, não foi?"
02/03/1998,Inezita Barroso,458,Inezita Barroso,Foi. Em japonês.
02/03/1998,Inezita Barroso,459,Assis Ângelo,"Pelo menos isso aí, você conhece, né? O seu disco, você não conhece..."
02/03/1998,Inezita Barroso,460,Inezita Barroso,"É, mas essas coisas são ótimas, são passagens muito boas da vida da gente."
02/03/1998,Inezita Barroso,461,Assis Ângelo,"E Luiz Gonzaga, Inezita? Você teve uma vivência também muito boa com ele, vocês cantaram juntos..."
02/03/1998,Inezita Barroso,462,Inezita Barroso,"Cantamos juntos, fizemos duas, três vezes o Teatro das Seis e Meia no Rio. Uma coisa de louco! De louco! Porque são dois extremos e o pessoal queria ver como é que funcionava. Norte e Sul no palco, assim. Numa das vezes, o Gonzaguinha entrou também e cantou umas duas ou três músicas com ele. Na outra vez, foi com a Banda de Pífanos."
02/03/1998,Inezita Barroso,463,Assis Ângelo,"Ele era realmente muito grande, né, Inezita... Inclusive, eu estive agora lá em Assaré, no Ceará, estive conversando com Patativa, e a primeira coisa que o Patativa me disse, quando cheguei e entrei na casa dele e fui conversar, a primeira coisa: “Assis, como era grande o Luiz Gonzaga, né, e nem sabiam, e olha o tamanho da grandeza.”"
02/03/1998,Inezita Barroso,464,Matinas Suzuki,"Por falar em Patativa, o Sérgio Ribeiro, do Crato, pergunta o que você acha do Patativa do Assaré."
02/03/1998,Inezita Barroso,465,Inezita Barroso,"Amo de paixão. Amo de paixão. Acho grande, grande poeta popular, uma pessoa maravilhosa. Eu tive oportunidade de entrevistá-lo por três vezes, ele esteve São Paulo. O Assis está fazendo um trabalho sobre isso."
02/03/1998,Inezita Barroso,466,Assis Ângelo,"Patativa do Assaré, o poeta do povo, esse é um livrão."
02/03/1998,Inezita Barroso,467,Inezita Barroso,"Deve mesmo, vai ser uma beleza."
02/03/1998,Inezita Barroso,468,Matinas Suzuki,"Eu vou aproveitar, olha, fui reunindo um monte de perguntas aqui sobre o que você acha de fulano e cicrano, vamos fazer um... Está bom?"
02/03/1998,Inezita Barroso,469,Inezita Barroso,Está bom!
02/03/1998,Inezita Barroso,470,Inezita Barroso,"O Márcio, de Santo André, pergunta qual o papel de Tonico e Tinoco na música sertaneja."
02/03/1998,Inezita Barroso,471,Inezita Barroso,"Ah, já falei, foram os pioneiros, maravilhosos, imortais."
02/03/1998,Inezita Barroso,472,Matinas Suzuki,"O Jurandir Seraglim: que você falasse “dos meus maiores ídolos”, parará... de José Fortuna e Goiás."
02/03/1998,Inezita Barroso,473,Inezita Barroso,"Excelentes, excelentes, o José Fortuna foi um grande poeta, também."
02/03/1998,Inezita Barroso,474,Matinas Suzuki,"O José Carlos Matias, da Bela Vista, diz que vê seu programas e tal, e pergunta por que você nunca citou o Elomar."
02/03/1998,Inezita Barroso,475,Inezita Barroso,"Não sou eu que não cito, a gente cita. Agora, o Elomar vive numa concha, ele é um caramujo. Você diz: “Vem aqui!” e ele põe a cabecinha de fora e volta pra dentro. Ele não vem. Ele esteve aqui no teatro, no Sesc Pompéia; a gente fez o diabo para levar pro Viola e tudo, mas não conseguiu."
02/03/1998,Inezita Barroso,476,Matinas Suzuki,"O Osvaldo Machado, de Belo Horizonte, pergunta: “Em que gênero você encaixaria Rolando Boldrin?”"
02/03/1998,Inezita Barroso,477,Inezita Barroso,"É, é... caipira. Caipira."
02/03/1998,Inezita Barroso,478,Matinas Suzuki,"A Neide Matsumoto, aqui de São Paulo: se você conhece o Antônio Nóbrega e o que você acha do trabalho dele?"
02/03/1998,Inezita Barroso,479,Inezita Barroso,"Eu vi o Antônio Nóbrega na entrega do Prêmio Sharp, gostei muito."
02/03/1998,Inezita Barroso,480,Matinas Suzuki,"O Luís Pereira, do Parque Anhanguera: o que você acha do José Fortuna e o que você achou, também, da dupla Chitãozinho e Xororó ter gravado as músicas dele?"
02/03/1998,Inezita Barroso,481,Inezita Barroso,"Olha, Chitãozinho e Xororó, quando tinham dez, onze anos de idade, eram excelentes, gravavam só isso. Não tinham tremedeira e não tinha nada. Eram ótimos, eu fui muito fã deles, de “Fogão de lenha” e de outros sucessos deles. Muito bonito."
02/03/1998,Inezita Barroso,482,Matinas Suzuki,"O Urupécio Bezerra, de Recife: “Qual a influência do Waldemar Henrique na sua música?”"
02/03/1998,Inezita Barroso,483,Inezita Barroso,"Ah, esse é outro deus para mim, ao lado de Hekel Tavares, dois deuses da música folclórica adaptada, dos temas folclóricos adaptados. Muito bons, muitos bons, cada um no seu gênero."
02/03/1998,Inezita Barroso,484,Matinas Suzuki,O Vagner Bossi pergunta se você acha que o sucesso da Helena Meirelles pode estimular as gravadoras a investirem em artistas regionais?
02/03/1998,Inezita Barroso,485,Inezita Barroso,"Acho. Também é uma coisa muito séria, Helena Meireles, muito séria, muito pura, muito espontânea, toca um estilo de viola que é tocado só naquela região, onde ela é mestra. É um tipo de viola que... Não se pode comparar estilos, é uma coisa muito difícil, muito... Você dizer que um toca com palheta, “está errado”, outros tocam com os dedos... Não é errado, é o jeito da região, e acho que ela executa isso com maestria."
02/03/1998,Inezita Barroso,486,Matinas Suzuki,"O Jeferson Barroso, ele faz uma pergunta aqui que é a seguinte: “Em que álbum que você interpreta a canção ‘Serra da Mantiqueira’? Porque eu preciso achar muito esse disco.”"
02/03/1998,Inezita Barroso,487,Inezita Barroso,"Olha, acho que eu vou cantar qualquer hora no Viola, minha viola e ele grava, porque esse disco está esgotado há muito tempo. Chamava-se Eu me agarro na viola, é um disco da década de 50. 59, por aí."
02/03/1998,Inezita Barroso,488,Matinas Suzuki,"Falando nisso, você está fazendo algum trabalho para pegar seus velhos discos e passar tudo para CD e esse tipo de coisa, para quem não... No caso do nosso amigo, que não tem como...?"
02/03/1998,Inezita Barroso,489,Inezita Barroso,Posso ser indiscreta?
02/03/1998,Inezita Barroso,490,Matinas Suzuki,Pode.
02/03/1998,Inezita Barroso,491,Inezita Barroso,"Estão fazendo por mim. Só que a escolha do repertório não é minha. Então, outro dia, eu estava passando na rua e tinha uma loja de discos; e olhei e falei: “Nossa, que moça parecida com a minha filha!” E fui chegando perto e era eu! Faz uns 20 anos que eu tirei aquela foto. “Ué, CD? Não gravei CD nenhum...” E olhei o repertório e estava tudo lá. O mais interessante é que já saíram uns quatro nessa base e não recebi um tostão por isso. Salvando a RGE, estou recebendo direitinho; pretendo ficar lá."
02/03/1998,Inezita Barroso,492,Matinas Suzuki,"Está certo. O José Zantarello, de Osasco, faz uma pergunta... “Por que a maioria das letras das músicas sertanejas são tão tristes?”"
02/03/1998,Inezita Barroso,493,Inezita Barroso,"Porque o sertanejo é um triste. É um triste há muitos séculos. As músicas são recatadas, tristes, são fatos autênticos, verídicos e acontecidos na região. Porque eram um tipo de jogral ambulante, os primeiros sertanejos. Então, pegava a viola, pendurava no arreio do cavalo e ia embora, nômade. Parava numa aldeinha e ele cantava um fato acontecido na região dele, e aquilo juntava gente... Era sempre um fato triste, porque alegre, mesmo, não acontecia nada, a não ser as danças, que são jocosas, são alegres, são rápidas. Mas era sempre uma tragédia, um caso de ciúme, uma moça que tomou veneno porque os pais não queriam deixar casar com aquele rapaz... São todas assim, trágicas. E a melodia já se adapta do mesmo jeito, porque elas são muito suaves; quase pobre, a melodia da moda de viola, para dar chance da letra ressaltar, dele contar cantando o que ele quer contar."
02/03/1998,Inezita Barroso,494,Matinas Suzuki,"Inezita, nós chegamos ao final do nosso programa, infelizmente. Eu queria te agradecer muito a sua presença hoje à noite aqui no Roda Viva e queria dizer que eu recebi, aqui, dezenas de manifestações através de fax, da internet e de telefonemas de pessoas congratulando você e parabenizando pela entrevista e por seu trabalho. Então, eu não pude ler todas as manifestações enviadas, mas todas serão entregues para a Inezita, está bom? Gostaria de agradecer a nossa bancada de entrevistadores, agradecer a presença do Moraes Sarmento aqui no nosso programa, agradecer a sua atenção e lembrar que o Roda Viva volta na próxima segunda-feira às dez e meia da noite. Até lá! uma boa semana para todos e uma boa noite!"
02/03/1998,Inezita Barroso,495,Inezita Barroso,"Quero me despedir convidando todo mundo para comparecer ao Teatro do Sesc Pompéia. Dia 13, 14 e 15, estarei lançando este CD mais novo, Caipira de fato. Aqui no Sesc Pompéia."
02/03/1998,Inezita Barroso,496,Matinas Suzuki,Então todo mundo no show da Inezita...
02/03/1998,Inezita Barroso,497,Inezita Barroso,"Dias 13, 14 e 15 de março."
02/03/1998,Inezita Barroso,498,Matinas Suzuki,E uma boa noite para todos!
