DATA,ENTREVISTA,ORDEM,LOCUTOR,FALA
22/11/2004,Luís Mir,33,Luís Mir,"O problema é o seguinte. Nós tivemos o papel da colônia. Todos os outros países latino-americanos foram para via republicana - Argentina, Chile - por que nós fomos para o império? O império é anterior ao Estado. Quer dizer, a única maneira de manter uma maré reformista revolucionária, mas reformista, no vácuo da desvantagem do poder colonial, seria o quê? Seria o império, que é anterior ao Estado. Nós sabemos disso. O Estado imperial mantém não só os mecanismos de administração colonial, o modelo de produção, mas, inclusive, a organização social. Então, veja bem. Ela pode ter mudado de formas, obviamente mudou de intensidade e graus, e até de localizações, dentro das articulações sociais. Mas nós não podemos falar nesse país que a causa de determinada fosse o povoamento. Foi sempre o território. Veja bem. O que eu quero dizer é o seguinte: o nosso povoamento sempre foi ocasional. A ocupação do Nordeste é uma ocupação de monocultura do açúcar, não um projeto de desenvolvimento, de ocupação do território baseada no fator humano, o fator natural. A mesma coisa com o sul. O que eu quero deixar claro para você é a “desafricanização” do país ela começa em 1850, tem a imigração indo-européia. Na verdade, nós estamos falando de 38 anos antes da abolição. Porque se você pegar... Veja bem. Existem dois conjuntos... Esse é um dado, enfim... São dois conjuntos de genes, ok? Existe o cromossomo Y, que os filhos herdam do pai, e existe o DNA mitocondrial que os filhos homens herdam da mãe. Esses dois conjuntos de genes definem as matrilinhagens e as patrilinhagens. Em 1850, 50% da população desse país tinha mãe índia ou africana. Depois de 1850, veio a imigração européia, são aqueles cinco milhões que você sabe muito bem. E o que acontece? Baixa o índice da descendência da população africana... Nós temos, na época, 45 milhões de habitantes, e baixa por quê? Porque vieram os europeus, vieram as populações indo-européias e baixaram, digamos, a africanidade nesse país. Mas eu não quero fugir do conceito que você fala de guerra civil. Nós temos o seguinte: o conceito de guerra civil clássico, ortodoxo, contemporâneo, fala de insurgência, rebelião e depois fala no enfrentamento do Estado com um setor da população. Acho que mais grave que o conflito clássico que nós temos é o conflito multiétnico. A segregação nesse país foi uma política de Estado. A população foi mantida longe do mercado de trabalho, das distribuições das riquezas nacionais. Quando falo “fatiar o bolo” é simplesmente dizer o seguinte: o Estado não precisaria despejar esta massa, essa carga de violência que ele despeja sempre que se sente ameaçado, se houvesse uma nação minimamente integrada; eu não estou falando de paraíso, ok? Eu não estou falando de 90% de classe média, um país equilibrado e justo. Este país nunca teve um mínimo de equilíbrio social..."
22/11/2004,Luís Mir,34,Nely Caixeta,"Luís, uma coisa que eu acho que as pessoas que estão em casa nos assistindo, certamente estão pensando: “meu Deus, será que a gente vai ter que esperar para resolver o problema da violência, nós temos que fazer alguma coisa, já que nós não fizemos em todos os nossos séculos de história no Brasil?”. Eu acho que todo mundo que pega o seu carro de manhã na garagem, aqui em São Paulo, a sensação de insegurança, o pensamento recorrente é: “será que eu vou voltar?”. Eu acho que, eu gostaria que você mostrasse para nós qual o peso que você dá ao fato de que, na verdade, há uma falta de autoridade, de que as pessoas se sentem intranqüilas, existe todo o problema social que nós temos... Você tem a sua proposta, daqui a vinte anos nós podemos até resolver, mas de qualquer forma, eu queria, o peso que você dá para esse estado de caos na ação da polícia e da Justiça que não faz justiça e nem polícia direito."
22/11/2004,Luís Mir,35,Luís Mir,"Nely, essa pessoa que sai com insegurança, e essa insegurança pode, em determinado momento, até se transformar em um pânico, com possíveis estranhos na rua etc. É quanto da população? É 20%, Nely. 80% da população desse país não tem bens materiais para sofrer ataque de pânico..."
22/11/2004,Luís Mir,36,Renato Lombardi,"Não, se você estiver na periferia você vai ver que é igual, rouba-se um real, um par de tênis de qualquer um."
22/11/2004,Luís Mir,37,Luís Mir,"Mas isso é ao vivo, rouba-se de tudo, até tênis usado, rouba-se... O que eu quero dizer é o seguinte: esse pânico social, essa insegurança são das pessoas detentoras de um determinado patrimônio."
22/11/2004,Luís Mir,38,Nely Caixeta,"Não, eu acho que na favela eles são apavorados, eles são grandes vítimas."
22/11/2004,Luís Mir,39,Luís Mir,"Na favela eles têm medo de policial. Porque, veja bem, existe uma coisa em medicina que se chama situação virótica, quer dizer, o vírus da Aids é um vírus que mata o hospedeiro. Até os epidemiologistas dizem que a médio e longo prazo, ele tem tomar uma decisão, matar menos do que ele está matando. Então, dentro da favela, nós temos uma situação seguinte: a população fica entre a violência policial e a violência da micro. Aí concordo contigo, da micro e da macro criminalidade, ela está no meio do fogo cruzado. Ela não toma partido Nely."
22/11/2004,Luís Mir,40,Nely Caixeta,"Do chefe, do chefe da quadrilha que está lá..."
22/11/2004,Luís Mir,41,Renato Lombardi,"O traficante que manda na favela obedece ordens. Tem regras, tem tudo."
22/11/2004,Luís Mir,42,Luís Mir,"Agora nós vamos tocar em outro ponto. Veja bem. A Nely saiu em um carro, um carro normal, não estou falando de um carro importado e nada disso. Ela saiu, foi trabalhar, é uma cidadã - digamos - classe média, tem um rendimento razoável, e recebe um tiro na cabeça em um semáforo. Ok? Bom, primeiro o seguinte: esse jovem está usando uma 38, que é uma arma, digamos, padrão da guerra civil brasileira. Dois, se ele atirou em você, foi por pânico. Não estou dizendo que não queria te matar, é diferente. Agora, outra coisa. O fato desse jovem de 16, 18, 20, 25 anos estar ali armado, isso tem uma origem."
22/11/2004,Luís Mir,43,Nely Caixeta,E a origem não poderia ser porque ele fez um cálculo entre o risco de ser pego e o risco de se sair bem com o roubo? Alguém poderia me roubar e absolutamente nada vai acontecer. Qual o peso que você dá para isso? Se ele está agindo assim é porque ele sabe que ele não vai ser punido. Ele tem grande chance de se safar bem dessa situação.
22/11/2004,Luís Mir,44,Luís Mir,"Ele não vai ser punido, mas o problema é o seguinte: não existe nesse país bandido velho, ele está morrendo muito cedo. A faixa etária dos bandidos hoje é 17, 18 e 19 anos. Nas penitenciárias a população carcerária vai de 21 a 29 anos."
22/11/2004,Luís Mir,45,Renato Lombardi,21 a 26.
22/11/2004,Luís Mir,46,Luís Mir,"21 a 26, exato. Deixe-me só dar um dado para você. Eu, em absoluto estou questionando a insegurança. Eu só estou questionando a origem dessa insegurança. Nós sabemos muito bem que esse jovem, que pode dar um tiro, pode matar uma pessoa inocente, um trabalhador, como aquela pesquisa da Ruth, que foi em Campinas, isto está no livro, quem está morrendo em Campinas são os jovens trabalhadores e estudantes em direção ao trabalho. Não estou falando outra coisa. Mas, voltando. Quanto ele ganha por esse carro roubado, Nely? Esse carro que vale 35 mil, 40 mil reais, ele não ganha mais do que trezentos, quatrocentos reais por esse carro."
22/11/2004,Luís Mir,47,Alberto Kanamura,"Luís, esta situação que você está colocando, esse determinismo histórico, não é, “nós somos o que somos porque fomos o que fomos”. É muito diferente dos outros países da América Latina, ou isso só acontece aqui no Brasil? Na Colômbia, na Venezuela, na vizinha Argentina, tem alguma coisa parecida? Na Bolívia? No Paraguai?"
22/11/2004,Luís Mir,48,Luís Mir,"Olha, os dados estão no livro, eu só quero chamar a atenção para vocês, porque a gente não pode ver os dados isoladamente. Paraguai tem 94,7% da população carcerária presa sem condenação. El Salvador tem 94% e a Bolívia tem 97% da população presa sem condenação. Ou seja, não tem justiça. Agora, você pergunta se isso acontece no Brasil. Em 1999 a grande São Paulo matou mais do que a Colômbia - é conflito. Há 45 anos, com os paramilitares, dois exércitos guerrilheiros - Farcs e ELN - e hoje um exército treinado e assessoria direta, pois bem, a grande São Paulo matou mais. A taxa crescente de homicídios, em 1999 na Colômbia, se não me engano foi, 45, 55. São Paulo chegou a - eu não quero citar um dado errado - eu acho que foi 70, 72."
22/11/2004,Luís Mir,49,Sérgio Adorno,"Você está fazendo uma comparação... Quer dizer, se eu comparar a taxa de homicídios hoje em São Paulo com a taxa de homicídios nos Estados Unidos, é evidente que a taxa do município de São Paulo é muito maior do que dos Estados Unidos."
22/11/2004,Luís Mir,50,Renato Lombardi,Com a taxa da população de São Paulo.
22/11/2004,Luís Mir,51,Luís Mir,"Eu estou falando proporcionalmente, Sérgio. São Paulo matou mais, proporcionalmente, em 1999 do que a Colômbia. Proporcionalmente. Espera, eu não estou tirando isso da taxa de cem mil habitantes, São Paulo matou proporcionalmente..."
22/11/2004,Luís Mir,52,Sérgio Adorno,"Eu tenho dúvidas quanto a esse seu dado, que eu saiba Bogotá e Medellin e Cali têm taxas muito mais altas que o município de São Paulo."
22/11/2004,Luís Mir,53,Renato Lombardi,"Eu tenho os números aqui. São Paulo tem uma taxa de 62 homicídios por cem mil habitantes. O Rio tem sessenta homicídios por cem mil habitantes. E aí você pega a Holanda, quinze homicídios por cem mil. EUA dez homicídios. Japão 1,6. Espanha 1,9. Quer dizer, claro, nós temos um número muito alto. E tem um outro detalhe…"
22/11/2004,Luís Mir,54,Luís Mir,"E esses dados não são de jovens, porque jovens vai a duzentos, ou acima de duzentos por cem mil."
22/11/2004,Luís Mir,55,Renato Lombardi,"Eu gostaria que você dissesse se esses números da violência nos homicídios, se isso caminha para a impunidade?, caminha exatamente para quê? A falta de uma atitude rápida da polícia, da Justiça e do Ministério Público."
22/11/2004,Luís Mir,56,Paulo Markun,"Aí eu queria entrar. Onde o livro é mais polêmico não é no diagnóstico é na proposta de alternativa. Então o que ele diz aqui com todas as letras. Diz assim: “precisamos negociar o armistício. O Estado brasileiro teria que suspender as hostilidades por certo tempo”. A proposta é claramente a seguinte: não se atue mais nas favelas, que a polícia não mate mais ninguém, como é isso?"
22/11/2004,Luís Mir,57,Luís Mir,"Não. Em todos os países onde nós tivemos grandes surtos de violência, violência de todas as formas, se negocia da seguinte maneira: o Estado brasileiro tem que negociar, por exemplo, com o Paraguai. Quer dizer, chega de roubo de carros e chega de tráfico de armas. “Quanto vocês querem?”. “Bom, para substituir a exportação de armas e roubos de carros nós queremos cento e cinqüenta milhões de reais, e que vocês acertem a conta de Itaipu, que é de trezentos milhões de dólares”, e a gente nunca paga a conta de Itaipu. Isso é uma negociação de Estado. Quem de vocês já não viu uma blitz, uma invasão de favela? O que é aquilo? Aquilo é terrorismo policial. Porque o detalhe é o seguinte. Fala-se muito nas favelas, no exército do narcotráfico, onde estão os milhões de dólares do narcotráfico? Nos colchões dos barracos?"
22/11/2004,Luís Mir,58,Renato Lombardi,"Isso é outra história. Você falou em arrematar, quer zerar, zera. Entrevistei uma vez um assaltante que tinha trinta seqüestros, ele tinha dez assassinatos. Eu perguntei “você não vai mudar de vida?”. E ele disse: “Eu mudo de vida doutor. Zera tudo. Minha ficha limpa e eu mudo de vida”."
22/11/2004,Luís Mir,59,Luís Mir,"Eu não estou falando isso. Eu não estou falando em impunidade judicial, nem impunidade e nem anistia para todo e qualquer tipo de crime. Eu estou falando em negociações entre Estados, que é a negociação do Estado brasileiro com a sociedade brasileira. Um projeto de proposta de pacificação. A primeira coisa que o Estado brasileiro tem que fazer é eliminar a licença da polícia brasileira de matar. Porque veja bem..."
22/11/2004,Luís Mir,60,Vannildo,"Isso basta, Luís?"
22/11/2004,Luís Mir,61,Luís Mir,"Isso é o primeiro passo. Vou fazer um paralelo, um exemplo do absurdo, para efeito de demonstração. Quando eu falo em trégua é o seguinte: de repente, estavam decapitando no Iraque os estrangeiros, os terroristas fundamentalistas..."
22/11/2004,Luís Mir,62,Renato Lombardi,"Decapitaram aqui em Guarulhos, né?"
22/11/2004,Luís Mir,63,Luís Mir,"Isso. Aí vem um mariner norte-americano e fuzila, dá um tiro na cabeça de um ferido dentro da mesquita. Aquele tiro justificou? Eu não estou avaliando quem estava na mesquita., quero dizer que, a partir do momento que o Estado brasileiro... A polícia mata porque tem o consentimento, o policial chega, faz uma blitz, mata um inocente etc. Ele perde o distintivo, entra em um processo, dá a arma etc. Agora, o que acontece quando eu falo da violência policial? O Estado não pode matar uma pessoa. Por quê? Porque é o primar da vida."
22/11/2004,Luís Mir,64,Nely Caixeta,Aí você combina com o bandido? Só o bandido pode matar?
22/11/2004,Luís Mir,65,Luís Mir,"O bandido joga a polícia em cima dela... A responsável pela prisão, julgamento... Esse bandido tem que ser preso, julgado e tem que ser condenado, etc. Para isso existe civilização, instituições. Agora, o seguinte, há determinados setores da sociedade brasileira que querem “olho por olho”."
22/11/2004,Luís Mir,66,Nely Caixeta,Aí volta aquela pergunta que lhe fiz. Qual é o peso que você dá ao fato de que as instituições não funcionam no Brasil?
22/11/2004,Luís Mir,67,Luís Mir,"As instituições não funcionam porque não querem, porque não têm vontade política. A polícia é apenas um corpo funcional comandado pelo Estado. A polícia não é um bando de maníacos, entendeu? De enfermos mentais que resolvem em determinado momento matar um grupo de pessoas em uma favela, em uma periferia. A polícia é um corpo do Estado."
22/11/2004,Luís Mir,68,Gilberto Nascimento,"Eu acho interessante ver um dado no seu livro o bairro de Moema, que é um bairro de classe média alta em São Paulo. O índice de homicídios caiu de 14,84% para 4,11, é o menor da capital nos últimos quatro anos. E a possibilidade de alguém ser assassinado lá em Moema é de 96,5% menor do que no Jardim Ângela, que é um bairro da periferia de São Paulo. Agora, apesar disso, como você mostra aqui no livro, as vítimas são os pobres, os negros e os marginalizados. Mas todas as vezes que alguém de classe média, ou em uma situação mais privilegiada, é vítima também da violência, começa a se pedir mais repressão, mais armas etc. E de dois dias para cá, com esse livro na mão e discutindo esses números que você apresenta aqui, a reação é absolutamente a mesma, o que se discute e o medo, é a insegurança, mais armas. O que você acha disso e como se muda esse parâmetro aí?"
22/11/2004,Luís Mir,69,Luís Mir,"Pegando a sua indagação, mas pegando também a Nely e o Renato, na verdade, se você reparar, Moema é um bairro paramilitarizado. Eles têm, inclusive, seguranças privados nas calçadas, é um bairro completamente paramilitarizado em defesa do patrimônio, etc - todos têm o direito a defender a sua vida. Agora, veja só um detalhe. Primeiro, utiliza a linguagem militar: ocupar o morro, você vai combater um exército inimigo, vão ocupar o morro, fazer uma incursão, pressão, que é uma linguagem militar. Por que quando se fala em prevenção à violência, coerção, só vem polícia e só vem carro? Por que não entram nas favelas as escolas profissionalizadas, por que não entra a ocupação urbana do solo? Por que não entram os projetos? Eu até estava brincando com a Vera Leon “é tamborzinho para cá, tamborzinho para lá, capoeira para cá, capoeira para lá”. Eu quero que entre renda, quero que entre emprego, tem que entrar saúde, tem que entrar a propriedade da casa. Outra coisa, por que a polícia só entra depois que aconteceu algum evento violento? A polícia tem que ficar lá. Mas para ficar lá tem que urbanizar, para urbanizar custa caro. Voltando, digamos, à questão da Nely, se a pessoa ganha uma casinha, TV a cabo, depois um carrinho, melhores roupas, em algum momento, ela vai querer viajar. Você não pode condenar a pessoa a uma expectativa de vida programada: você vai até quinhentos reais e aí você pára. Você não vai fazer isso. Agora, eu nunca vi, digamos, quer dizer, polícia por exemplo... Quando falavam no rearmamento da polícia que é o colete à prova de bala, carro e pistola. Agora, não são laboratórios de investigação, laboratórios de treinamento, polícia científica de altíssimo padrão, etc. E, além do mais, o seguinte: eu só quero falar uma última coisa em relação a padrões policiais. É interessante Polícia Federal bem equipada. A Polícia Federal passou por uma reciclagem importante no governo Lula e sempre ela atua, são meses de investigação, sempre aparece o dinheiro. Por quê? É gozado que a Polícia Federal atue em grandes casos - sorte nossa - e sempre estão envolvidos em rendas do Estado. pegou sonegação fiscal, dinheiro oficial, precisão e eficiência total. Agora, gozado, quando apreendem o dinheiro do narcotráfico uma trouxinha aqui, outra lá, o dinheiro do narcotráfico nunca aparece. Além do mais, eu questiono uma coisa, só terminando, traficante não mora em favela. Quem mora em favela é distribuidor."
22/11/2004,Luís Mir,70,Renato Lombardi,Mora o preposto dele.
22/11/2004,Luís Mir,71,Luís Mir,"Mora o preposto, o traficante não mora. O traficante não enfrenta polícia."
22/11/2004,Luís Mir,72,Paulo Markun,"Luís, vamos fazer mais um rápido intervalo e voltamos daqui a pouco."
22/11/2004,Luís Mir,73,[...],
22/11/2004,Luís Mir,74,Paulo Markun,"Nós estamos de volta com o Roda Viva esta noite entrevistando Luís Mir, pesquisador que publicou Guerra civil: Estado e trauma, uma obra em que se analisa a violência no Brasil Eu vou mencionar duas perguntas aqui de telespectadores. Mas, a princípio, citar o fato que você defende, por exemplo, duas coisas: noções básicas de primeiros socorros e urgências deveriam ser apresentadas nas escolas públicas. E cita, inclusive, uma experiência específica…"
22/11/2004,Luís Mir,75,Luís Mir [interrompendo],José da Silva Rodrigues fez uma experiência fantástica.
22/11/2004,Luís Mir,76,Paulo Markun,"Isso. E disse que “a pacificação da sociedade brasileira”, segundo você diz, “tem na escola a sua base principal e prioritária"". E é nesse sentido a pergunta de Afonso Silva Lopez, de Morro Doce: “em relação à violência, existe algum tipo de programa de prevenção? Temos a campanha do desarmamento. Por que não proibir a fabricação de armas? Antiviolência, educação no trânsito e também assistência à família”. E, Paulo Treviane, de Curitiba, estudante: “qual seria o papel da educação para resolver a violência e outros problemas sociais?”"
22/11/2004,Luís Mir,77,Luís Mir,"Bom, eu vou usar mais uma vez o exemplo do absurdo. Você pegar uma pessoa de cinqüenta anos, com revólver na cintura - faz vinte anos que ele usa aquele revólver, que está pronto para matar o seu semelhante por qualquer provocação de trânsito etc - isso, digamos, é de difícil solução. Convencê-lo de que ele não tem o direito de matar o seu semelhante... faz vinte anos que ele leva um revólver, quer matar uma pessoa, ou há trinta anos que ele vive, enfim, em um ambiente violento. Agora, a educação, quando eu falo da educação e da prevenção, e José Mauro da Silva Rodrigues fez isso, fez um questionário dos primeiros socorros e, eu até digo no livro, que é o que todo mundo quer saber o que fazer, quando vê um atropelado, quando vê uma pessoa em convulsão, quando vê uma pessoa necessitando de primeiros socorros, até que chegue o Resgate e pessoa receba a assistência de vida, o suporte básico de vida. Na escola começa tudo, porque se a pessoa não respeitar o seu semelhante, não respeitar a faixa de pedestre, não aprender que ela não deve empurrar a pessoa para cair na calçada e se machucar, isso começa na tenra idade, quando começa o processo de formação. Segundo os cânones clássicos da psiquiatria, nós somos o que somos formados aos seis anos. O que nós seremos já está formado aos seis anos. Então, quando se fala de prevenção, é isso. Você pode tentar diminuir o dano físico e o dolo provocado por uma pessoa de cinqüenta, sessenta anos. Agora, com uma criança de seis anos, você pode torná-la sociável e não inimiga ou estrangeira diante do seu semelhante."
22/11/2004,Luís Mir,78,Sérgio Adorno,"Eu só quero voltar um pouco nesse tema, que eu acho que é um dos temas fortes do seu trabalho, que é a questão do custo dessa violência, do ponto de vista do sistema de saúde. Eu não sei se, por exemplo, nesse cálculo que você faz, se entra… O teu cálculo, pelo que eu estou entendendo, os argumentos são muito econômicos. Existe outro argumento que é muito importante: os anos potenciais de vida perdida; que é, enfim, um critério que também se calcula. Queria primeiro saber se no teu custo entrou este componente?"
22/11/2004,Luís Mir,79,Luís Mir,Não.
22/11/2004,Luís Mir,80,Sérgio Adorno,"Segundo. Se eu considerar, além dos custos da saúde, todos os custos judiciais, prisionais, etc, vai se chegar em um ponto que essa dívida é impagável, se eu comparasse com a da Previdência, talvez a Previdência seja mais razoável de ser resolvida do que a da violência. A minha pergunta é basicamente a seguinte: como a sociedade brasileira consegue conviver em “guerra civil”, segundo você, com este custo impagável, que uma hora vai estourar em algum lugar. Onde vai estourar isso? Como nós vamos sair dessa e o que vai acontecer com a sociedade brasileira? Estou insistindo um pouco no seu argumento, que é um argumento, vamos dizer, forte - exagerado em certo sentido da guerra civil - e que, no limite, estou chegando à seguinte conclusão: bom, não tem saída. O sistema policial não vai ser reformado, a Justiça não tem solução, o custo é impagável, então… Não sei… Estamos caminhando para o quê? A solução é uma guerra civil?"
22/11/2004,Luís Mir,81,Renato Lombardi,Entrega pro bandido…
22/11/2004,Luís Mir,82,Alberto Kanamura,"Emendando um pouquinho na pergunta do Sérgio... Eu tenho a impressão que fica impagável isso. A pergunta é: nós estamos desperdiçando dinheiro nessa...? Está implícito que tratar a vítima da violência, de alguma forma, isso é um desperdício de dinheiro?"
22/11/2004,Luís Mir,83,Luís Mir,"Duas coisas: fala-se muito no Estado brasileiro que perdeu sua capacidade de investimentos. Eu vou apenas fazer uma pequena referência histórica do que eu considero, digamos, um custo impagável. O Muro de Berlim caiu em 1999, fez quinze anos agora, em 2004 – Bonn, a capital da República Federal da Alemanha deixou de ser a capital da Alemanha unificada, voltou a ser Berlim. Feito o prazo de transição, havia em Bonn trezentos e cinqüenta mil funcionários. O prazo de transição - até Berlim assumir a condição plena de capital - foram trinta anos. A transição, você não pode retirar trezentos e cinqüenta mil empregos de uma cidade sem dar... Você sabe que a natureza detesta o vácuo, você tem que criar uma alternativa, não só de serviços, mas de renda, de emprego, mercado de trabalho, etc. Pois bem. O Rio de Janeiro era a capital federal desse país. Tinha a função agregadora, política, cultural, era a capital federal. Depois, o senhor Juscelino Kubitschek em um ano e 11 meses plantou um palácio inacabado, dois ministérios inacabados, uma coisa chamada Esplanada dos Ministérios, uma igreja e fundou a capital. Em um ano e um mês o Rio de Janeiro perdeu um milhão e duzentos mil empregos. O Rio de Janeiro dormiu capital federal e acordou balneário. Essa crise do Rio de Janeiro, essa falência do Rio de Janeiro tem quarenta anos. Então, insisto a você, quando você falou da questão da desigualdade. A desigualdade pode ser um fator de agravamento, mas não é o fator indutor e não é o fator principal. Agora, o Rio de Janeiro estar de pé é um milagre. Porque o que foi feito com a cidade do Rio de Janeiro é um crime contra a humanidade. Quebraram a cidade, tiraram um milhão e duzentos mil empregos dela e não deram nenhuma alternativa. Teria que se dizer o seguinte: “Bom, o Rio de Janeiro ficará a capital política do país por mais vinte ou trinta anos, até a reciclagem do setor de serviços, do centro turístico...”. Vocês imaginam o que seria do Rio de Janeiro se não fosse o petróleo. Seria hoje..."
