DATA,ENTREVISTA,ORDEM,LOCUTOR,FALA
22/11/2004,Luís Mir,140,Renato Lombardi,"Dou exemplos de grupos que roubam aqui e vendem no Nordeste, roubam aqui e vendem no Sul, no Centro-Oeste… Desencadeou uma…"
22/11/2004,Luís Mir,141,Luís Mir,A venda não é apropriação. São duas coisas diferentes.
22/11/2004,Luís Mir,142,Renato Lombardi,"Não, mas é o final da história."
22/11/2004,Luís Mir,143,Luís Mir,"Sim, mas o final da história é um final comercial, não da quadrilha… Não é a quadrilha que vende."
22/11/2004,Luís Mir,144,Sérgio Adorno,É a cadeia produtiva.
22/11/2004,Luís Mir,145,[...],
22/11/2004,Luís Mir,146,Luís Mir,"A cadeia produtiva não se mescla com a quadrilha, porque a quadrilha tem métodos violentos, armas etc. O que eles querem é o produto no estoque, eles não querem envolvimento com as quadrilhas, tanto que as quadrilhas são alugadas. As quadrilhas são alugadas…"
22/11/2004,Luís Mir,147,Renato Lombardi,"É organização isso, é organização…"
22/11/2004,Luís Mir,148,Nely Caixeta,"Comprar sem nota é crime. Quem compra sem nota - eu como consumidora, estou comprando sem nota, participando da criminalidade, é tudo uma cadeia… Um elo da mesma cadeia."
22/11/2004,Luís Mir,149,Renato Lombardi,"Tem uma ponta de quem rouba e uma ponta de quem vende. Nesse meio aqui, o grupo está bem montado."
22/11/2004,Luís Mir,150,Luís Mir,Renato deixe-me só lhe fazer a seguinte pergunta: quais são os maiores traficantes de drogas de São Paulo - você que conhece a área?
22/11/2004,Luís Mir,151,Renato Lombardi,"São vários. Aqui é disperso, aqui é bem disperso, é diferente…"
22/11/2004,Luís Mir,152,Luís Mir,Quanto você acha que o tráfico movimenta em São Paulo?
22/11/2004,Luís Mir,153,Renato Lombardi,"Muito dinheiro. Eu não sei, mas muito dinheiro…"
22/11/2004,Luís Mir,154,Luís Mir,Onde está esse dinheiro?
22/11/2004,Luís Mir,155,Renato Lombardi,"Ué, deve estar… Tem gente que está vendendo propriedades para entrar no narcotráfico. Você vê que toda semana fazendeiros são presos, empresários são presos…"
22/11/2004,Luís Mir,156,Luís Mir,"Voltando ao que o Sérgio levantou, é o seguinte: primeiro, então, o tráfico é um problema comercial, antes de ser criminal, porque as pessoas querem entrar num negócio antes de entrar no crime. Os usuários são um problema de saúde pública. O que eu estou querendo apenas discutir com vocês é que nós não podemos falar, nesse país, de crime organizado nas lavanderias, crime organizado dos restaurantes, crime organizado nas ocupações territoriais, de determinadas coisas e o crime organizado no seguinte sentido, por exemplo, para mim, a contradição do crime organizado é o mesmo caso para entender…"
22/11/2004,Luís Mir,157,Paulo Markun,"Luís, nosso tempo está acabando. Temos menos de um minuto. Eu queria entender, como é que você, depois de todo esse diagnóstico sombrio, consegue terminar o livro com uma citação de Kant, dizendo que “ninguém pode ou deve decidir qual vai ser o grau mais alto a partir do qual o homem deixaria de progredir”. Qual é a distância entre idéia e execução, ou seja, o papel da liberdade? Como é que você… Onde é que você ancora otimismo, se é que você tem otimismo, em relação a essa possibilidade?"
22/11/2004,Luís Mir,158,Luís Mir,"O dia que eu acordar amanhã, que meus filhos forem para a escola, em que eu botar o pé pra fora e a pessoa que estiver passando na calçada for o meu inimigo e eu me sentir tentado a colocar a mão sobre a pistola e me defender… Não quero viver nessa sociedade. Eu não quero viver, eu estou fora. Não me coloquem nessa sociedade, não me chamem pra essa festa e também não vou culpar ninguém por não me convidar para essa festa, mas eu não quero… No momento que eu olhar o meu semelhante, que compartilha o mesmo espaço urbano, o mesmo espaço cultural, que pode ter a intenção de me dizer… No momento que eu não puder ser igual a ele, não quero viver mais."
22/11/2004,Luís Mir,159,Paulo Markun,"Luís, muito obrigado pela sua entrevista, muito obrigado aos nossos entrevistadores, à nossa platéia e a você que está em casa e nós voltaremos na próxima segunda-feira com mais um Roda Viva. Uma ótima noite e até segunda."
