DATA,ENTREVISTA,ORDEM,LOCUTOR,FALA
22/11/2004,Luís Mir,84,Nely Caixeta [interrompendo],"Eu queria acrescentar o seguinte: o Rio de Janeiro ganha por ano 4,3 bilhões de reais com o turismo. O que se está vendo no Rio de Janeiro nas últimas semanas é uma coisa assombrosa, você vê os turistas sendo assaltados, mortos e imagina que, se 10% dos turistas do Rio de Janeiro decidissem não mais visitar a cidade, seria uma perda de quatrocentos e trinta milhões de reais. A cidade não agüenta isso. Os custos que a falta de um policiamento, a falta da ação firme das autoridades para impedir esse tipo de criminalidade, vai chegar um momento que não vai ter o que roubar no Rio de Janeiro, se continuar nesse passo."
22/11/2004,Luís Mir,85,Luís Mir,"Eu quero te responder Nely, mas eu só quero, depois Sérgio, voltar à questão, digamos, que a gente deixou em suspenso sobre a conta impagável e para onde vamos. Nely, a questão é a seguinte: mesmo com a campanha de violência do Rio de Janeiro, o turismo, segundo o dado oficial da situação do Rio de Janeiro subiu 13% de 2003 a 2004, dentro deste período. Dois, o turismo no Rio de Janeiro é concentrado em uma faixa litorânea “privilegiada” por um bom policiamento, etc. Nely, você tem visto quem tem assaltado? Quer dizer, 95, 97% dos assaltos do Rio de Janeiro são o quê? São arrastões sem armas, com 14, 15, 16 anos… Tanto é que o turista espanhol… Por que chamou a atenção o turista espanhol com um tiro na cabeça? Porque essa molecada não usa armas. Quando pegaram... A barbárie, a violência que fizeram com aquele casal de argentinos, lembra? Que chutaram a mulher na areia... Eles não têm armas. Eles não têm armas."
22/11/2004,Luís Mir,86,Nely Caixeta,"Mas afugenta, está nas primeiras páginas dos jornais, o The independent faz aquela matéria e disse que o Rio de Janeiro é uma cidade da barbárie."
22/11/2004,Luís Mir,87,Luís Mir,"Isso. Agora deixe-me dizer o seguinte: se você pegar, aí que vem o detalhe, se você pegar a violência do Rio de Janeiro contra turistas, são 27 casos no período..."
22/11/2004,Luís Mir,88,Renato Lombardi,"481 pessoas assaltadas de janeiro a agosto deste ano. 481, estatística dada hoje pela Secretaria de Segurança Pública do Rio de Janeiro. Só turistas."
22/11/2004,Luís Mir,89,Luís Mir,"Perfeito. Eu vou te dar um dado da Scotland Yard que está acessível no site. Você sabe quantos turistas foram assaltados em Londres, nos últimos seis meses? 18 mil turistas. Então, veja bem…"
22/11/2004,Luís Mir,90,Renato Lombardi,E Londres é uma cidade policiadíssima...
22/11/2004,Luís Mir,91,Luís Mir,"Veja bem, não vamos confundir um tiro na cabeça contra aquele casal espanhol e outra coisa, você veja bem. A nossa crise é muito triste. É trágico o que nós estamos fazendo. Aqueles guris que assaltaram movidos, cheirados com cola... Aqueles que assaltaram aqueles argentinos, chutaram os argentinos para roubar o quê na praia? Uma bolsa? E tinha quanto na bolsa daquela argentina? Dez dólares? Vinte dólares? Quanto era aquele relógio? Eu estou pensando o seguinte: o grau de violência interpessoal em relação ao ganho econômico não existe, Nely. Agora, se você disser, aquela senhora argentina... Uruguaios, não é? Aqueles senhores uruguaios estavam na praia e ela tinha um colar de brilhantes no valor de vinte mil dólares e ele estava com um piaget de 25 mil dólares, e a filha..."
22/11/2004,Luís Mir,92,Nely Caixeta,Mas é a banalização do crime. É banal…
22/11/2004,Luís Mir,93,Renato Lombardi,"Só para acrescentar com dados. Eu estou com um levantamento da ONU que diz o seguinte: das cidades do Brasil com os melhores indicadores, em termos de violência na região sul são Santa Catarina, Paraná e Rio Grande do Sul. Isso não justifica. A violência lá é baixa em relação ao resto do país."
22/11/2004,Luís Mir,94,Luís Mir,"Aí vem o que o Sérgio levantou. Por exemplo, no Piauí, os índices de violência são os menores em todas as faixas, em todas as formas, não tem o que roubar ali, de miserável que é. Santa Catarina, Rio Grande do Sul e Paraná, o estado de Santa Catarina desses três é o que melhor tem de índice de desenvolvimento, por quê? Porque tem uma poderosíssima classe média e um grau de distribuição de renda muito alto. Não se esqueça que Santa Catarina é algo como 2% da população brasileira, não sei, eram cinco milhões de habitantes, ou sete milhões de habitantes, enfim. Santa Catarina é o quinto exportador do país, com menos de 2% da população. E um detalhe, tem duas cidades: Joinvile e Blumenau. O PIB de Joinvile e Blumenau, eu estou dando o dado que eu tenho..."
22/11/2004,Luís Mir,95,Renato Lombardi,"Por que ninguém migra para essas cidades? Não existe migração para essas cidades, a migração é muito pequena em relação ao Rio e São Paulo?"
22/11/2004,Luís Mir,96,Luís Mir,"Mande um afro-brasileiro migrar para Blumenau... Ele não chega, não entra na porta da cidade."
22/11/2004,Luís Mir,97,Vannildo Mendes,"Eu queria retomar um ponto do seu livro que é exatamente a questão da ação policial. Pelo que gente viu no seu livro, digamos, essa filosofia de ação policial violenta, militarista, belicista, foi cristalizada no período do Regime Militar. veio a democracia e os índices de violência não retrocederam. Pelo contrário, se acerbaram, como você diz no capítulo “A década da Morte"", a década de 1990. Vem a questão: A polícia tem conserto? É possível consertar essa polícia? Ou não seria melhor extingui-la e começar um novo modelo de segurança pública em outras bases a partir do zero?"
22/11/2004,Luís Mir,98,Luís Mir,"Vannildo, eu acompanhei três processos de revitalização, como estudante e também como profissional. Era um jovem estudante, quando fui para Portugal, Espanha para estudar e Grécia, na fase final com as primeiras eleições. A primeira providência a Constituição - Assembléia Nacional Constituinte. A segunda: dissolver os corpos repressivos. A polícia que está aí, a polícia que nós temos não sofreu nenhuma mudança funcional de treinamento - estou falando em termos estruturais. A polícia é um produto, digamos, herdado da ditadura. Para a ditadura ela serviu. Eu não estou questionando que na ditadura ela não tenha servido. Mas essa polícia não serve, ela não é democrática, não tem formação democrática, e ela não tem prática democrática. Então, na Espanha se chegou ao requinte de mudar o uniforme, quer dizer, a polícia tinha um uniforme cinza, horroroso, militarizado. Agora ela tem um uniforme azul, bonito. Por quê? Porque queriam dar a exata idéia à população de que era uma nova polícia. Nesse país se falsifica tudo, destruíram o Carandiru para não provar que aquilo foi a maior penitenciária da América Latina. Quer dizer, aquilo deveria ter ficado em pé até hoje. Se você vai a São Petersburgo, à antiga Leningrado, você entra na prisão de São Petersburgo, e até os instrumentos de tortura que o czar desenhava estão lá guardados... As celas onde eram torturados… Aqui, e só não transformaram o Dops em jardim de infância, o resto eles fizeram. Tinha que deixar as salas de tortura, os instrumentos de tortura e dizer: “aqui se torturou, agora, não se tortura mais”. Esse processo de falsificação da história... Agora, eu só queria deixar uma coisa, pelo respeito que eu tenho ao Sérgio e ao Núcleo de Estudos da Violência da USP. A questão é a seguinte, Sérgio: quando eu digo que a conta está impagável, é que se você pegar, quer dizer, eu vou dar dois extremos: Uma vez eu fiz uma conta, uma soma, uma adição básica, porque ouvia “o país perde não sei quanto com o turismo, o país não faz isso por causa disso”. E deu um trilhão de reais. Ou seja, os chutes são numéricos… A única coisa que eu quero entender é o seguinte. Um paciente grave de trauma custa duzentos e cinqüenta mil reais, em vinte dias. Um dia de UTI custa de três mil e quinhentos reais a cinco mil reais. Quando digo que a conta é impagável é porque a capacidade do Estado brasileiro... O Estado brasileiro está enxugando cada vez mais a sua base econômica e social. E hoje, tem 45 milhões de pessoas sem habitação, sem saúde, não tem nada."
22/11/2004,Luís Mir,99,Paulo Markun,Luís fica a pergunta do Kanamura. Isso significa que não se deve tratar o paciente de trauma?
22/11/2004,Luís Mir,100,Luís Mir,"O primado da vida. O paciente, ele pode ser ladrão, marginal, assaltante, bandido, juiz, presidente da República, até chegar à porta do hospital é um processo social, ok? A pessoa recebeu um tiro, foi assaltado, assaltaram a casa dele. No momento que o policial, que acabou de torturar uma pessoa e levou lá, enfim. No momento que ele chega na porta do hospital é um processo social. Mas, adentrou a porta do hospital, é um processo biológico. É um ser humano que precisa de assistência, ele vai receber o melhor tratamento possível, os médicos vão dar a ele, vão assegurar a ele, não só a sobrevivência, mas o máximo de qualidade possível, etc, etc. Uma vez feito o atendimento médico, o que vai acontecer, Paulo? Se ele for um criminoso, vai ter a polícia na porta, ele vai ser preso, julgado e condenado. Não compete ao médico utilizar a medicina, o atendimento como forma de punição ou absolvição. Para isso existem as instituições. Agora, o que eu queria deixar claro, e a mim me incomoda o seguinte: a partir do momento que você fala, digamos, por exemplo, das zonas periféricas, das favelas. O abandono das favelas, das zonas periféricas é programado. O Estado quer atender só determinadas faixas da população e o aparelho econômico está salvaguardado, o poder de coerção, de repressão dos quinhentos mil homens das polícias brasileiras, mais um milhão e duzentos mil... Está completamente assegurado. Não há uma crise do Estado."
22/11/2004,Luís Mir,101,Sérgio Adorno,"Luís, você já esteve em uma favela?"
22/11/2004,Luís Mir,102,Luís Mir,"Já, várias vezes."
22/11/2004,Luís Mir,103,Sérgio Adorno,"Porque no seu livro, você faz uma qualificação da favela inteiramente no negativo. Você diz que é um lugar da segregação, o lugar do cercamento, tem uma frase muito forte. Vamos dizer que isso seja parte da vida. Agora, o que incomoda é que não é só isso na favela, tá certo? Têm vários estudos mostrando que na favela têm trabalhadores, tem lazer, de uma maneira absolutamente não programada, com condições não muito adequadas, mas tem. Existe vida sociável, embora com muitas dificuldades. Existe trabalho dos movimentos de defesa do direito à vida, vários movimentos, quer dizer, uma quantidade de movimentos, há também uma vida que pulsa. Há também uma vida dinâmica. Então, como é que você explica que esta coisa, quer dizer, lá é só o lugar negativo, como é que também a favela é o lugar que..."
22/11/2004,Luís Mir,104,Luís Mir,"Primeiro, o conceito negativo é teu. Meu conceito é segregação. Para mim, a favela é um campo de concentração. Ali, a perspectiva de vida, a perspectiva econômica, a perspectiva social das pessoas não existe. Ali, quando as pessoas saem, ou elas saem para serviços mal remunerados junto à cidade, junto, digamos, ao aparelho econômico, são garçons, são cozinheiros, são vigilantes... Você não vai dizer que há uma massa de profissionais liberais, que moram dentro da favela. Não existe. Você não vai dizer que existem estruturas profissionais e estruturas de mercado, estruturas industriais ou comerciais dentro da favela. Eu quero lhe dizer, muito claramente, o seguinte: aquela população está condenada por um projeto econômico existente. Não é que ela optou em viver na favela. Sempre que a favela..."
22/11/2004,Luís Mir,105,Sérgio Adorno,"Essa favela que você está falando não existe mais. Na verdade, se você vai aos bairros da periferia hoje, a favela virou cidade. Você tem as casas de alvenaria, você tem as casas, de um modo geral, você vai ter eletrodomésticos, etc - não têm várias outras coisas, talvez você não tenha acesso à educação de qualidade, não tem mesmo. Mas eu acho que essa imagem que você está fazendo da favela é uma imagem antiga. Hoje não dá mais para fazer. Antropólogos que trabalharam com a vida na favela disseram pra mim: “eu estou voltando e começando do zero, porque o que acontecia há dez anos atrás é outra coisa”. Eu estou falando isso por quê? Porque eu acho que você está interpretando um pouco a questão da violência muito pela visão das raízes e do passado. Eu acho que você está com dificuldade de entender o presente. Inclusive, entender o impacto dessa violência sobre o sistema de justiça, que eu acho que é um pouco a questão que as pessoas estão colocando aqui. Tem a ver com o problema da impunidade, tem a ver com o problema das instituições, de fato, estão muito aquém do que deveria ser um mínimo de controle social, um mínimo de lei e ordem. Então, eu queria que você pensasse um pouco sobre isso. Eu acho que tem um tom conservador no seu livro, ainda que eu reconheça muito os méritos, o esforço que você fez, que é extremamente meritório, mas por outro lado, ele dá uma visão de “sem saída”. Quer dizer, eu não sei, eu, como sociólogo que acredito em mudança social, acredito em criação, em saídas possíveis...Eu não posso… Quer dizer, eu vou ler o seu livro e vou dizer: “bom, fecho o…”"
22/11/2004,Luís Mir,106,Gilberto Nascimento,"... só complementando a fala do Sérgio Adorno, tem favelas, como a favela de Heliópolis em São Paulo, que é pulsante, é muito viva, um exemplo de projetos, de inovações também, de laboratórios sociais, de certa maneira. E tem muitas ONGs mais sérias que não estão só fazendo o “tamborzinho”. Estão muito preocupadas com a geração de renda e estão desenvolvendo experiências inovadoras, positivas… Que a gente acredita e torce para que o Estado consiga reproduzir essas coisas em larga escala, porque as experiências dos movimentos sociais são super positivas, mas o problema é de ser localizado. O Estado atende no geral, mas atende mal e não consegue resultados."
22/11/2004,Luís Mir,107,Luís Mir [interrompendo],"Sérgio, nós estamos falando de dois países diferentes. A tua favela não é a minha favela. Eu troco televisão e liquidificador por dente e educação, sapato roupa…"
22/11/2004,Luís Mir,108,Sérgio Adorno,Eu não estou negando a desigualdade…
22/11/2004,Luís Mir,109,Luís Mir [interrompendo],"A segunda questão que eu digo é a seguinte: eu quero que sejam apresentados dados da atuação das ONGs, dos movimentos da sociedade civil, etc. Eu quero que sejam apresentados em termos de renda. Se você chegar e disser assim: “veja bem, vamos ser muito claros, vamos ser muito honestos, ainda bem que nós temos determinadas organizações sociais amenizando determinadas crises sociais”. Eu não estou questionando o papel dessas instituições. Agora, na favela de Heliópolis, eu li que tem vinte anos de trabalho… Quais são os índices de renda que melhoraram? Qual foi a redistribuição de renda que houve lá? Quais são as escolas que foram instaladas? Qual é o mercado de serviços que se criou lá? Porque nós sabemos muito bem - você que é sociólogo, Sérgio - que o principal problema da miséria é quebrar a corrente. É quebrar a corrente da miséria. É que o filho do segregado não seja segregado, que o filho do analfabeto não seja analfabeto… Agora, esse discurso, digamos, “ah, mas esse é um discurso velho”. É um discurso velho, porque a miséria brasileira é velha. Nós temos problemas… A casa de alvenaria… A casa de alvenaria tem trinta metros quadrados. Ela tem uma laje, quatro paredes e pronto. Eu não estou querendo dizer que, mesmo que algumas migalhas do banquete... Não estou dizendo que não foram redistribuídas. Foram. Nós estamos vivendo uma catástrofe humanitária nas periferias brasileiras. Eu não estou preocupado se a casa tem laje, se tem um liquidificador e um televisor. Acho ótimo. O que estou questionando é o seguinte: está se matando, está se condenando essa população a um grau belicista de cerco, por quê? Porque as raias sociais, as raias da miséria e da pobreza estão encostando nas fronteiras da elite dominante. Tem um conflito."
22/11/2004,Luís Mir,110,Paulo Markun,"Luís, vamos fazer mais um intervalo e voltamos em seguida."
22/11/2004,Luís Mir,111,[...],
22/11/2004,Luís Mir,112,Paulo Markun,"Estamos de volta com o Roda Viva, esta noite entrevistando Luís Mir, autor do livro Guerra civil: Estado e trauma, que analisa e discute a questão da violência no Brasil. Luís, a pergunta mais recorrente aqui, dos nossos telespectadores - eu vou ler os nomes de todos: Rui Fulgêncio, de Belo Horizonte, Minas Gerais; Domingos Sales, de Brasília, bancário aposentado; Paulo Naner, de Vila Clementino, São Paulo, administrador; e também Adelaide Moura, da Vila Gustavo; e, finalmente, o arquiteto Mário Renato Maina, de Porto Alegre. Querem saber o seguinte: por que não se fala em controle de natalidade? Qual é o número de filhos que os pobres têm que ter? Como se pode reduzir a quantidade de miseráveis deste país?"
22/11/2004,Luís Mir,113,Luís Mir,"Bom, nós temos a questão do controle da natalidade… Nós temos o exemplo mais flagrante, em termos internacionais, que é o da China, que decidiu um filho casal. Bom, enfim... Em 1970 o Brasil tinha noventa milhões de habitantes. Vocês lembram o “hinozinho” - “noventa milhões em ação”. Esses noventa milhões em ação viraram cento e oitenta em 25 anos. Não tem emprego, não tem casa… Não tem nem país… Quer dizer, o país precisaria ter crescido a 1000% ao ano para dar casa, emprego, saúde, etc, condições mínimas de vida. Sobre o controle da natalidade: o controle da natalidade nesse país é visto como arma social. Por quê? Voltando ao que eu tinha conversado, Sérgio, quando digo que existe uma pirâmide de programação social, quero dizer o seguinte: se nós pegarmos a educação, são milhares de professores que vão educar milhões de alunos e esses milhões de alunos vão ter que ter mercado de trabalho. Mercado de trabalho representa bilhões de renda transferida, etc. Chamo isso de programação social. Não vou chegar e dizer que sou contra o controle de natalidade. Sou contra o controle de natalidade a ponto, inclusive, de defender a desocupação gradativa humana do planeta. Nós estamos matando o planeta com a ocupação humana. Acho que nós temos que diminuir. Chegar a um bilhão e “tchau”. Agora, voltando, digamos, ao controle da natalidade. Chega uma pessoa e diz: “não, você não vai ter filhos”. A pessoa mora na favela…"
22/11/2004,Luís Mir,114,Renato Lombardi [interrompendo],Vou te contar depois a história do traficante que proibiu os filhos na favela…
22/11/2004,Luís Mir,115,Luís Mir,"Isso. O controle da natalidade é uma questão básica de projeto estratégico de país. Em 1973, vocês conhecem muito bem, o estudo de Langoni sobre a desigualdade no país. Voltando à questão, você conhece o estudo de Langoni, Carlos Langoni…?"
22/11/2004,Luís Mir,116,Paulo Markun,"Aliás, o principal adversário dele foi, depois, o ministro Pedro Malan."
22/11/2004,Luís Mir,117,Luís Mir,"Isso. Então, Langoni já alertava em 1973 - nesse clássico estudo da desigualdade - o que está por vir. Nada do que está acontecendo, Nely, é coisa de um ano, dois anos. “A serpente colocou esses ovos” há muito tempo. Há muito tempo que a serpente vem colocando ovos neste país. Há muito tempo que o fascismo vem matando, trucidando este país, das mais variadas formas, às vezes sob discursos muito modernos… Porque se existe uma coisa que a elite brasileira tem é a capacidade de adaptação. Eles conseguiram fazer a transição da Colônia para a independência com valores aparentemente vindos da Ilustração, do Romantismo e até da Modernidade para perpetuar a escravidão…"
22/11/2004,Luís Mir,118,Renato Lombardi,"Olha, deixe-me contar uma coisa…"
22/11/2004,Luís Mir,119,Luís Mir,Só terminando. Sobre o controle da natalidade - voltando à pergunta do telespectador - sou favorável.
22/11/2004,Luís Mir,120,Renato Lombardi,"Olha, o controle da natalidade tem uma favela em São Paulo, chama-se favela do Buraco Quente, que fica no aeroporto…"
22/11/2004,Luís Mir,121,Luis Mir,Já ouvi falar…
22/11/2004,Luís Mir,122,Renato Lombardi,"...Tem um traficante lá que mandava na favela. O traficante deu uma ordem: a mulher que tivesse filho na favela seria expulsa porque… Tinha mulher que tinha três, quatro filhos e cada um tinha um pai diferente. E ele deu ordem. Ele determinou, porque ele que comprava a cesta básica e o remédio, ele decretou o controle da natalidade. E aí, um dia, esse sujeito foi preso, foi quando eu o entrevistei e aí o governo resolveu tomar conta da favela e instalou uma série de outras coisas na favela. Quer dizer, o traficante decidiu decretar o controle da natalidade numa favela. Isso é um absurdo."
22/11/2004,Luís Mir,123,Luís Mir,"Isso porque era um custo para ele. Deixe-me dizer o seguinte: nós não podemos perder uma coisa, esse traficante pagava a cesta básica e “protegia” os moradores por quê? Porque é o escudo dele, é o escudo dele contra a polícia, contra olheiros, contra… O problema é o seguinte: há determinados setores das populações faveladas que não tomam partidos nem pela criminalidade e nem pela polícia."
22/11/2004,Luís Mir,124,Paulo Markun,Por que você diz que não há crime organizado no Brasil?
22/11/2004,Luís Mir,125,Renato Lombardi,A droga não é um crime organizado? O contrabando não é organizado? O roubo de carga não é organizado?
22/11/2004,Luís Mir,126,Paulo Markun,"Isto está textual no seu livro. Você diz o seguinte: “Temos a macro criminalidade econômica, que é contrabando, crimes econômicos, financeiros, apropriação do patrimônio público, corrupção. Mas não há crime organizado no Brasil, como nos Estados Unidos e na Itália”. E vai mais: “o berço da nossa criminalidade pública e privada é um conjunto de oportunidades materiais negadas à maioria da população, conflitos étnicos e sociais seculares e uma máquina governamental corrompida”. Quer dizer, não há crime organizado?"
22/11/2004,Luís Mir,127,Luís Mir,"Não, no sentido clássico. Se nós pegarmos o discurso latino, o norte-americano, o italiano são duas coisas bastante caracterizadas de crime organizado. Primeiro: não existem no Brasil sociedades criminosas, e sim quadrilhas. Dois: essas quadrilhas são específicas. As quadrilhas não podem mais assaltar os bancos, os bancos estão com um sistema de vigilância - satélite, helicóptero, armas maravilhosas... E eles partiram, ou para o crime personalizado, individual, o seqüestro relâmpago. Porque não dá mais para roubar com pistola, nem o gerente, nem o caixa. Ou eles partiram para o roubo de cargas. São sempre encomendas. Veja bem, se uma quadrilha, por mais organizada e poderosa que seja - Nely, você que cobre a área econômica - rouba uma carreta com dois mil televisores, vai para onde isso? Vai para o quintal dele? Vai distribuir entre os vizinhos?"
22/11/2004,Luís Mir,128,Renato Lombardi,"Por isso é organizado. Ele tem quem rouba, quem levante, apanhe, entregue, até quem venda. Isso, pra mim, é organização."
22/11/2004,Luís Mir,129,Nely Caixeta,E quem compre.
22/11/2004,Luís Mir,130,Renato Lombardi,Isso é organização.
22/11/2004,Luís Mir,131,Luís Mir,"A grande diferença… Crime organizado é quando você controla desde o roubo até a venda final. O crime organizado brasileiro não é esse, eles vão lá, eles pegam, assaltam, entregam para aquele comerciante que esquenta a nota. Aí o comerciante que esquenta a nota vende aquela mercadoria legal… O que eu quero dizer é o seguinte: se você pegar o crime organizado em Nova York, eles controlam o quê? Eles controlam os sindicatos, eles controlam as lavanderias…"
22/11/2004,Luís Mir,132,Sérgio Adorno,"Você leu, por acaso, a CPI do narcotráfico?"
22/11/2004,Luís Mir,133,Luís Mir,Li.
22/11/2004,Luís Mir,134,Sérgio Adorno,"A CPI do Narcotráfico é muito clara. Ela deu do que deve ser a rede de corrupção e do narcotráfico do país, ali você vê claro. Tem um encadeamento, começo, meio e fim. Há divisão de trabalho, hierarquia de poder, responsabilidades definidas. É mais do que organizado… Você está dizendo assim: “bom, não é a mesma coisa…” Máfia não houve aqui mesmo. Nós não estamos discutindo aqui. Temos crime organizado… Você pode até dizer que o crime organizado não se generalizou. A gente pode entrar numa discussão dessa natureza. Mas, dizer que não há crime organizado no Brasil, eu acho que é uma afirmação um pouco discutível."
22/11/2004,Luís Mir,135,Luís Mir,"Não, pelo seguinte… Eu estou aberto à discussão. Eu acho que o crime organizado - lato sensu - a exemplo do italiano, a exemplo do norte-americano não existe. Dois, essas quadrilhas, elas não têm inserção nacional…"
22/11/2004,Luís Mir,136,Paulo Markun [interrompendo],"Mas você diz mais, Luís."
22/11/2004,Luís Mir,137,Luís Mir,"Espera aí, deixe só eu terminar… Essas quadrilhas não têm inserção nacional, Sérgio. A quadrilha que rouba cargas em São Paulo, o máximo que ela vai é até Belo Horizonte. Agora, ela é incapaz de fazer Recife, Salvador…"
22/11/2004,Luís Mir,138,Renato Lombardi,"Não, ela vai, ela vai."
22/11/2004,Luís Mir,139,Luís Mir,Não vai.
