DATA,ENTREVISTA,ORDEM,LOCUTOR,FALA
06/12/2004,Márcio Thomaz Bastos,1,Paulo Markun,"Boa noite. Justiça lenta, de difícil acesso, sensação de impunidade, insegurança, crime organizado, desvio de dinheiro público, corrupção de todos os tipos e em todos os níveis. Problemas que atrapalham muito a agenda brasileira, atrasam a vida do país, deixando claro que não existe caminho a percorrer sem que esses pontos sejam combatidos e superados. Para discutir a reforma da Justiça, o combate ao crime e à corrupção, o Roda Viva entrevista essa noite o jurista Márcio Thomaz Bastos, ministro da Justiça, responsável por uma área que é uma espécie de pára-raios dos conflitos que conturbam a vida brasileira."
06/12/2004,Márcio Thomaz Bastos,2,[Comentarista],"Márcio Thomaz Bastos assumiu o Ministério da Justiça em janeiro de 2003 anunciando duas prioridades: combater a violência e promover uma profunda reforma judiciária. Tinha como retaguarda o apoio do presidente Lula nessa direção e também a reputação de ser um dos mais conhecidos e respeitados criminalistas do país. Construiu um currículo onde constam 800 vitórias em tribunais de júri em 45 anos de carreira jurídica. Também construiu fama de serenidade e conciliação, habilidades que já permitiram comparar o ministro a uma espécie de bombeiro de todas as horas, tanto são os incêndios que ele precisa apagar em tantas áreas de conflitos no país. Rebeliões em presídios, disputas em terras indígenas, confrontos entre fazendeiros e trabalhadores sem-terra, violência urbana e crime organizado em todos os níveis, muitas vezes envolvendo o poder público. A toda essa agitação, juntaram-se as mega operações da Polícia Federal, com desmantelamentos de quadrilhas e prisões em vários pontos do país. A agenda da Justiça começa a se ampliar ainda mais agora, com as mudanças decorrentes da reforma do judiciário, aprovada no mês passado no Congresso. A proposta se arrastou pela Câmara Federal e Senado durante 13 anos. Um de seus principais pontos é o controle externo do judiciário e do Ministério Público. Polêmica como qualquer reforma, ela foi considerada insuficiente pelo ministro Márcio Thomaz Bastos, mas é vista como o ponto de partida para a construção de uma nova Justiça no Brasil."
06/12/2004,Márcio Thomaz Bastos,3,Paulo Markun,"Para entrevistar o ministro da Justiça, nós convidamos Eliane Cantanhêde, colunista do jornal Folha de S, Paulo; Eumano Silva, jornalista licenciado do jornal Correio Brasiliense; Merval Pereira, colunista do jornal O Globo; Maria Teresa Sadek, cientista política e professora do Departamento de Ciência Política da Universidade de São Paulo; Renato Lombardi, comentarista do Jornal da Cultura e Sílvio Bressan, repórter especial de política do jornal O Estado de S.Paulo. Boa noite, ministro."
06/12/2004,Márcio Thomaz Bastos,4,Márcio Thomaz Bastos,Boa noite.
06/12/2004,Márcio Thomaz Bastos,5,Paulo Markun,"O Tribunal Regional Federal de Brasília, da primeira região, confirmou hoje, ou determinou hoje, que o governo deve abrir os arquivos da guerrilha do Araguaia, informando onde foram enterrados os corpos dos guerrilheiros desaparecidos e providenciando o translado e o enterro dos restos mortais. Os desembargadores também resolveram convidar o vice-presidente, ministro da Defesa, José Alencar, o senhor e os comandantes das três forças e outras autoridades, para que até o dia 15 se reúnam e definam estratégias que tornem possível o cumprimento dessa decisão. A primeira reação do governo, através do ministro Nilmário Miranda, foi de dizer que ia aguardar comunicação oficial desse fato para o senhor para saber se o governo ia reagir recorrendo dessa decisão. Como eu sei que o senhor não é de usar dos chamados prolegômenos jurídicos para escapar da pergunta, eu questiono. O governo vai recorrer dessa decisão?"
06/12/2004,Márcio Thomaz Bastos,6,Márcio Thomaz Bastos,"Markun, eu não tenho idéia. Já manifestei a minha opinião reiterada de que eu sou a favor da abertura dos arquivos, eu acho que os arquivos têm que ser abertos dentro dos padrões e das balizas necessárias à preservação da Constituição Federal e daquelas coisas que dizem respeito à segurança do Estado. Nesse caso, o governo teve uma decisão de primeira instância e agora teve uma decisão de segunda instância do Tribunal Regional Federal. Essa decisão começa a vigorar quando o acórdão for publicado, quando se tiver notícia e possibilidade de apreender todo seu alcance, a sua densidade e a sua espessura e aí fazer avaliação. Quem faz essa avaliação, basicamente, primordialmente, não é o Ministério da Justiça, é a Advocacia Geral da União. Mas a minha posição pessoal é de não recorrer. A minha posição pessoal é de que se deve respeitar, até porque nós estamos agora enviando ao Congresso Nacional, ainda este mês, um projeto de reformulação da regra do jogo do sistema processual civil brasileiro, onde se estabelece como norma aquele padrão de que as decisões devem obedecer ao duplo grau, elas são julgadas na primeira instância e tem um segundo grau. Nesse caso, foi uma decisão por dois votos a um, mas eu acredito que quem vai fazer essa avaliação técnica, para que depois se tome a decisão política, é a Advocacia Geral da União."
06/12/2004,Márcio Thomaz Bastos,7,Eumano Silva,"Ministro, uma das razões, que se diz, para não se abrir os documentos, os arquivos... que aliás, há uma contradição, o ministro Viegas dizia que os arquivos haviam sido queimados, mas há vários indícios de que há muitos documentos ainda de posse do próprio governo. Nesse final de semana, o presidente da Abin, o chefe da Abin, voltou a dizer que há documentos. Duas coisas. Uma, há ou não há documentos? O ministro Viégas dizia que não havia e, ao mesmo tempo, há uma movimentação no governo para a busca desses documentos. A segunda coisa. Uma das razões, que se imagina, para que não haja abertura dos documentos seria o medo de revanchismo por parte dos militares, ou seja, de que houvesse punição aos que cometeram algum ato no passado. O senhor identifica alguma possibilidade de revanchismo, o senhor crê nisso?"
06/12/2004,Márcio Thomaz Bastos,8,Márcio Thomaz Bastos,"Não, eu não acredito nisso, sou de opinião, reitero aqui de novo, de que os arquivos devem ser abertos, imagino que eles vão ser abertos. Essa é uma decisão que cabe ao presidente tomar, é preciso revogar um decreto assinado pelo presidente Fernando Henrique Cardoso no apagar das luzes do seu governo. É preciso, por outro lado, um projeto de lei ou uma medida provisória que regulamente a última parte do inciso 33, do artigo 5º da Constituição Federal que definiu isso, mas ficou faltando a lei da regulamentação. Eu sou favorável e acredito que se deva abrir, acredito que se deva fazer essa reconciliação do Estado com a sociedade dentro do ritmo do governo, dentro das cautelas que precisam ser tomadas."
06/12/2004,Márcio Thomaz Bastos,9,Eumano Silva,Então há documentos?
06/12/2004,Márcio Thomaz Bastos,10,Márcio Thomaz Bastos,"Há documentos, seguramente, há documentos lato sensu, eu não estou dizendo que só dos documentos do Araguaia, as notícias que eu tenho é que existem documentos xerox, documentos copiados. Agora, em relação a documentos do período da ditadura, existem seguramente."
06/12/2004,Márcio Thomaz Bastos,11,Sílvio Bressan,"Ministro, neste fim de semana saiu uma nota, já que o senhor falou agora no decreto do presidente Fernando Henrique, saiu uma nota na revista Veja, eu acho, dando conta de que o governo Lula apenas modificaria o decreto baixando de 35 para 30 anos, é isso mesmo?"
06/12/2004,Márcio Thomaz Bastos,12,Márcio Thomaz Bastos,"Não, não, nós estamos estudando uma revogação do decreto, uma substituição do decreto por um outro, mas isso não está decidido ainda, está numa fase de estudos no Ministério da Justiça, na AGU e na Casa Civil."
06/12/2004,Márcio Thomaz Bastos,13,Sílvio Bressan,"Porque levou tanto tempo, ministro, dois anos?"
06/12/2004,Márcio Thomaz Bastos,14,Márcio Thomaz Bastos,"Olha, não levou tanto tempo, é que dentro da agenda do governo existem muitas prioridades, existem muitas perspectivas, existem assuntos que são mais fáceis e assuntos que são mais difíceis."
06/12/2004,Márcio Thomaz Bastos,15,Sílvio Bressan,"Mas se esperava do governo Lula uma outra postura. O presidente da OAB declarou hoje que ele acha que, no momento em que a população coloca um partido como o PT no governo, elege um presidente como Lula, com seu passado e sua tradição de luta pelo Estado democrático de direito, essa resistência em abrir os arquivos, segundo ele, causa perplexidade e, segundo ele, o brasileiro vê com uma certa frustração isso."
06/12/2004,Márcio Thomaz Bastos,16,[...],Que tipo de cautela o senhor disse que governo tem que adotar quanto a isso?
06/12/2004,Márcio Thomaz Bastos,17,Márcio Thomaz Bastos,"São as cautelas normais. Se você olhar o artigo 33 da Constituição, você vai ver que... o artigo quinto da Constituição, no seu inciso 33, você vê que existem lá ressalvas em relação aqueles documentos que envolvam a segurança do Estado. Há documentos que não podem ser abertos sem um exame, sem uma cautela, documentos principalmente que dizem respeito a negociações diplomáticas."
06/12/2004,Márcio Thomaz Bastos,18,Renato Lombardi,"Existe uma legislação internacional, não existe um padrão internacional?"
06/12/2004,Márcio Thomaz Bastos,19,Márcio Thomaz Bastos,"Existe, existe um padrão internacional."
06/12/2004,Márcio Thomaz Bastos,20,Renato Lombardi,Não seria mais fácil?
06/12/2004,Márcio Thomaz Bastos,21,Márcio Thomaz Bastos,"Nós vamos adotar, no Brasil, exatamente dentro dessa linha, revogando o decreto do Fernando Henrique."
06/12/2004,Márcio Thomaz Bastos,22,Eliana Catanhêde,"Agora, ministro, até agora, a posição do governo tem sido assim: Oficialmente não existem documentos do Araguaia, o ministro da Defesa, que era o Viegas, repetiu isso e os comandantes militares todos estão na mesma linha. Quanto aos outros documentos, tanto o general Félix, que é o chefe do Gabinete de Segurança Institucional, quanto o chefe da Abin, que é o delegado Mauro Marcelo, todos dois dizem que tem três tipos de documentos: um da comissão que cassava, um era, a outra do SNI, que fazia aquela coisa do “consta aqui, era fofoca” e não sei o que, a terceira das cassações por corrupção, né?, dos inquéritos por corrupção. Nos três casos, se saírem esses documentos, são os documentos contra as vítimas, são os documentos em que você vai expor as vítimas. Tanto o general Félix quanto Marcelo falaram isso. Os documentos que mostravam quem atuava no Doi-Codi, quem estava na rua Tutóia, quem é que mandava nessa gente toda, o documento que vai expor os torturadores?"
06/12/2004,Márcio Thomaz Bastos,23,Márcio Thomaz Bastos,"Eu acho que por isso é que demora essa solução. O presidente da OAB faz um pouco de retórica em relação a isso, mas por isso que demora, porque o caso, como disse o Merval, tem balizas internacionais de comportamento, mas essas balizas variam muito de país para país, de situação para situação. De modo que nós estamos fazendo aqui no Brasil, com o máximo de cuidado, vamos fazer, estamos fazendo. Existe uma comissão interministerial trabalhando na questão do Araguaia há muito tempo, ela já venceu o prazo dela, esse prazo foi prorrogado, ela está trabalhando sob sigilo. Esse trabalho de regulamentação do inciso 33 do artigo 5º da Constituição, que nunca foi feito no Brasil, vai ser feito agora, o decreto do Fernando Henrique vai ser revogado e nós vamos dar um rumo a essa questão."
06/12/2004,Márcio Thomaz Bastos,24,Renato Lombardi,"E a viagem que foi feita de um coronel aviador, aposentado hoje, que teria levado, inclusive, um grupo de oficiais das Forças Armadas até o Araguaia no local onde os corpos, 40 corpos, tinham sido enterrados, o senhor sabe disso?"
06/12/2004,Márcio Thomaz Bastos,25,Márcio Thomaz Bastos,"Existem algumas diligências que foram feitas, mas elas estão sigilosas ainda, Renato, a gente pretende apresentar, não sei se essa que você está se referindo é a mesma que eu estou mencionando, mas a gente pretende apresentar isso num relatório ao presidente da República."
06/12/2004,Márcio Thomaz Bastos,26,Paulo Markun,"Ministro, só um pouquinho, só não queria escapar da questão. Este episódio dos documentos, ele ganhou notoriedade, em função das fotos que, supostamente, seriam do jornalista Vladimir Herzog, morto no cárcere. A causa oficial de sua morte foi suicídio por enforcamento, porém, há consenso na sociedade brasileira de que Herzog tenha sido torturado e estrangulado. Dado o impacto de sua morte e a forte reação da sociedade, sua morte pode ser vista como o início da abertura política no país], que era diretor de jornalismo aqui da TV Cultura, que foi morto no Doi-Codi, e que apareceram no jornal Correio Brasiliense há poucas semanas atrás, um mês atrás mais ou menos, e que ao final das contas se descobriu que não eram as fotos de Vladimir Herzog. O que aconteceu, eu estou historiando o fato para poder chegar à pergunta, havia três fotos que não identificavam a pessoa, davam clara semelhança entre a figura e o Vladimir Herzog, a ponto da viúva ter reconhecido uma delas como sendo do seu marido, a Clarice Herzog. Mas outras pessoas como eu, que fui colega do Vlado, subordinado dele, fui preso antes, fiquei em dúvida desde o início e outros acharam que não havia. Muito bem, a pergunta é: a quem interessava, ministro, criar esta confusão, porque havia 30 fotos, apenas três apareceram? As três apareceram numa documentação que a imprensa teve acesso, né? E em seguida sai uma nota do Exército, que depois modificou um pouco o seu ponto de vista, mas ao que tudo que indica, autorizada pelo comandante do Exercício, absolutamente fora de tom e de época. A quem o senhor acha que interessava criar essa confusão? Porque a confusão foi criada."
06/12/2004,Márcio Thomaz Bastos,27,Márcio Thomaz Bastos,"A confusão foi criada, eu não sei se havia uma intencionalidade nisso. A nota, aquela primeira nota, realmente, não podia representar, de maneira nenhuma, o tempo atual nem o governo atual. Tanto que ela foi retificada, ela foi modificada, por uma outra nota num outro padrão mais compatível, assinada pelo general comandante do Exército. Mas eu acredito muito que não tenha havido uma intencionalidade naquilo, acredito que não tenha havido. Aquelas fotografias se encontravam nos arquivos da Câmara dos Deputados, há muito tempo estavam lá, e foi um acaso, na minha opinião, aquilo foi retirado desses arquivos, foram publicados."
06/12/2004,Márcio Thomaz Bastos,28,Paulo Markun,"Quer dizer, um acaso de três fotos que eram claramente passíveis de confundir o Vladimir Herzog estavam lá, as outras 27 que não estavam, estavam debaixo do colchão do governo, e apareceram para justificar isto."
06/12/2004,Márcio Thomaz Bastos,29,Márcio Thomaz Bastos,"O governo correu. O Gabinete de Segurança Institucional e a Secretaria Especial de Direitos Humanos correram, procurou as outras fotos para colocá-las em seqüência e mostrou aquilo até para dissipar a confusão e o mal entendido, mas não acredito numa intencionalidade."
06/12/2004,Márcio Thomaz Bastos,30,Eumano Silva,"Os problemas que têm... é que essa documentação, de um modo geral, ela foi produzida por serviços secretos, sob serviços secretos do tempo da ditadura, mas serviços secretos. Se são secretos, quem garante que, mesmo existindo documentos, que esses documentos vão aparecer? Há uma legislação que força que eles mostrem essa documentação ou isso pode ficar ali numa espécie de, vamos dizer, de caixa dois, ali?"
06/12/2004,Márcio Thomaz Bastos,31,Márcio Thomaz Bastos,"Não, eu não acredito que fique num caixa dois, acho que há condições de se fazer um bom trabalho, um trabalho, assim, no padrão que os países têm usado, que outros países têm usado em matéria de classificação de documentos, revogando o decreto do Fernando Henrique que, realmente, não tem sentido aquela duplicação daqueles prazos. E fazer um trabalho legislativo sério que, realmente, faça a coisa da melhor maneira possível."
06/12/2004,Márcio Thomaz Bastos,32,Sílvio Bressan,"Ministro, se eu entendi bem, voltando àquela questão inicial, o senhor é contra, então, que o governo recorra dessa decisão da sexta turma?"
06/12/2004,Márcio Thomaz Bastos,33,Márcio Thomaz Bastos,"Do ponto de vista absolutamente pessoal, sou, eu não conversei com o presidente sobre isso."
06/12/2004,Márcio Thomaz Bastos,34,Sílvio Bressan,Se dependesse do senhor o governo não...
06/12/2004,Márcio Thomaz Bastos,35,Márcio Thomaz Bastos,"Nem conversei com o ministro Álvaro, que é o titular da representação judicial da União, mas eu pessoalmente, não tenho nenhuma dúvida de dizer isso, que sou contra."
06/12/2004,Márcio Thomaz Bastos,36,Maria Teresa Sadek,"Ministro, eu queria mudar de assunto agora e falar da reforma do judiciário. Dentre as medidas aprovadas, nós temos o Conselho Nacional de Justiça, conhecido popularmente como Conselho Externo da Magistratura."
06/12/2004,Márcio Thomaz Bastos,37,Márcio Thomaz Bastos,Controle Externo.
06/12/2004,Márcio Thomaz Bastos,38,Maria Teresa Sadek,"É, Controle Externo da Magistratura. Nós sabemos que parte significativa da magistratura é contrária a esse conselho, inclusive, órgãos representativos como a AMB. O senhor acredita que é possível se produzir algum efeito a curto prazo sabendo-se, em primeiro lugar, que parte da magistratura é contrária, em segundo lugar, que esse conselho é composto majoritariamente por magistrados. O senhor acha que é possível que isso produza algum efeito no funcionamento do judiciário a curto prazo?"
06/12/2004,Márcio Thomaz Bastos,39,Márcio Thomaz Bastos,"Olha, professora Maria Tereza, eu acredito que sim, por quê? Porque eu acho que esse conselho, ele vai ser uma pedra de toque, ele vai ser um símbolo de uma passagem. A senhora sabe que essa luta pela criação do Conselho Nacional de Justiça vem da Constituinte, de 1987, quando a OAB apresentou esse projeto através do deputado, do então deputado constituinte Nelson Jobim. Nós fomos derrotados, naquele momento, por muito pouco. Naquele tempo havia uma resistência muito grande ao Conselho Nacional de Justiça. Essa resistência continuou ao longo do tempo, tanto assim que nós ficamos 13 anos tentando aprovar essa reforma, principalmente porque havia dentro dela a criação desse órgão, do Conselho Nacional de Justiça, que é o órgão de controle externo e órgão de planejamento. Essas resistências, que eram muito fortes, nós estávamos saindo de ditadura, não tinha ainda massa crítica de discussão suficiente, essas resistências, que eram muito fortes, foram se esbatendo, foram diminuindo através do tempo. Hoje, nós temos muito menos resistência, algumas associações são contra o conselho, mas o presidente do Supremo Tribunal Federal, o ministro Nelson Jobim, é a favor, o presidente do STJ, é a favor e muitos juízes são a favor e estão dispostos a instalação desse conselho. Por que eu acho esse conselho importante? Tanto pelo poder de corregedor que ele tem, de punir juízes, de fiscalizar juízes, de olhar o cumprimento dos deveres funcionais dos juízes, mas também porque ele pode ser um grande órgão de planejamento do poder judiciário. Nós temos muitas justiças no Brasil, você tem a trabalhista, a criminal, a civil, a federal, a estadual."
06/12/2004,Márcio Thomaz Bastos,40,Merval Pereira,A militar.
06/12/2004,Márcio Thomaz Bastos,41,Márcio Thomaz Bastos,"A de primeira instância, de segunda instância. A militar e cada uma trabalhando na sua faixa, no seu planejamento, no seu esquema. De modo que você tem um órgão em condições, a senhora tem um órgão em condições de ser, efetivamente, um grande planejador estratégico, orçamentário e financeiro da atividade do poder judiciário, prevendo greves, prevendo grandes atrasos, procurando fazer mutirões. Eu acredito que ele seja uma pedra de toque, por isso eu acho importante, fundamental essa reforma constitucional. Não acredito que essa reforma por si só resolva o problema do poder judiciário, não resolve, nós sabemos disso. A reforma do poder judiciário, ela tem que se fazer em três níveis, pelo menos. O presidente Lula, é preciso fazer justiça a ele, não sendo advogado, ele é um homem muito sensível a isso, tanto que logo no começo do seu governo ele discutiu isso, ele colocou isso como uma prioridade. Eu me lembro que nas primeiras vezes que eu falava em reforma do judiciário, o que as pessoas me diziam era: “Não, mas isso não está na agenda, isso não é uma prioridade”. Acabou se tornando uma prioridade, acabamos votando isso e começamos uma série de mudanças. Na parte constitucional já tivemos uma reforma respeitável que estabelece, além do Conselho Nacional, estabelece a autonomia das defensorias públicas, que num país de exclusão como o Brasil, num país onde as pessoas têm dificuldade financeira de ter acesso à Justiça, é um grande passo. Mas temos também que cuidar da reforma infra-constitucional, da reforma das regras do jogo, da reforma do processo civil e do processo penal. O presidente vai mandar para o Congresso, agora, ainda neste fim de ano, 14 projetos de lei reformando a sistemática do código de processo civil."
06/12/2004,Márcio Thomaz Bastos,42,Sílvio Bressan,"Ministro, mas se a constitucional levou 13 anos, quanto tempo vai levar o processual?"
06/12/2004,Márcio Thomaz Bastos,43,Márcio Thomaz Bastos,"Essa, eu acredito que vá levar muito menos tempo que isso. Agora existe a questão..."
06/12/2004,Márcio Thomaz Bastos,44,Sílvio Bressan,Para este mandato ainda?
06/12/2004,Márcio Thomaz Bastos,45,Márcio Thomaz Bastos,"Ah, com certeza. A questão foi colocada na agenda, viu Sílvio, a questão foi colocada na agenda. Aquilo que era um tema que vinha vindo devagar, que vinha vindo assim, dançando de uma casa congressual para outra, agora ganhou urgência. As pessoas estão sentindo cada vez mais, até pela discussão do tema, que isso é importante. Nós criamos, no Ministério da Justiça, uma Secretaria de Reforma do Poder Judiciário e, além dessa reforma infra-constitucional, dessa reforma processual, que exige mudança de lei, nós estamos trabalhando muito na parte extra legal, porque o que o poder judiciário precisa muito é de gestão, de experiências novas, de um choque de informática, por exemplo."
06/12/2004,Márcio Thomaz Bastos,46,Merval Pereira,"Ministro, eu queria falar especificamente sobre crimes hediondos. O senhor sugeriu, recentemente, que deveria ser mudada a legislação sobre crime hediondo alegando que não havia prisões para tantos crimes. Não seria melhor fazer prisões, em vez de mudar ou reduzir penas?"
06/12/2004,Márcio Thomaz Bastos,47,Renato Lombardi,"Aliviar né, vai aliviar a vida de um estuprador, de um seqüestrador."
06/12/2004,Márcio Thomaz Bastos,48,Merval Pereira,"A reação foi muito grande da opinião pública, né?"
06/12/2004,Márcio Thomaz Bastos,49,Márcio Thomaz Bastos,"Espera aí, espera aí, nós precisamos nos entender aqui. Em primeiro lugar, eu não disse que a gente tinha que revogar a lei dos crimes hediondos para limpar as prisões, não disse isso. Nós estamos construindo prisões. O governo federal, através do departamento penitenciário..."
06/12/2004,Márcio Thomaz Bastos,50,Merval Pereira,"Está difícil para sair, hein, ministro?"
06/12/2004,Márcio Thomaz Bastos,51,Márcio Thomaz Bastos,"Através do fundo penitenciário, está ajudando os estados a construirem prisões, nós estamos construindo prisões federais. Eu quero falar sobre isso se vocês me derem uma chance. Em relação aos crimes hediondos, o que eu disse, numa reunião do conselho nacional de política criminal e penitenciária, que é uma coisa que eu penso há muito tempo, foi o seguinte. A lei de crimes hediondos já tem 14 anos, é preciso verificar agora, neste momento, depois de 14 anos, quais foram os efeitos dessa lei, quais foram os efeitos dela dentro do sistema penitenciário, não para abrir vaga, mas dentro do sistema penitenciário na construção de quadrilhas. Porque essas grandes quadrilhas que hoje existem, PCC, Comando Vermelho, comando não sei lá mais o quê, essas grandes quadrilhas são contemporâneas no fortalecimento delas, Renato, o fortalecimento delas e a estruturação delas é contemporâneo à lei dos crimes hediondos, onde se joga o sujeito lá dentro sem progressão. É preciso verificar isso, verificar qual é o alcance, qual foi o efeito da lei e, por outro lado, qual foi o efeito concreto e real da lei em relação à diminuição daqueles crimes que estão elencados nela, porque uma lei punitiva, da dureza da lei dos crimes hediondos, que desorganizou o sistema penal brasileiro..."
06/12/2004,Márcio Thomaz Bastos,52,Paulo Markun,"O senhor acha que ela não teve efeito, o senhor tem essa impressão?"
06/12/2004,Márcio Thomaz Bastos,53,Márcio Thomaz Bastos,"Não, eu não sei."
06/12/2004,Márcio Thomaz Bastos,54,Paulo Markun,"O senhor desconfia que não, desconfia?"
06/12/2004,Márcio Thomaz Bastos,55,Márcio Thomaz Bastos,"É, eu desconfio, eu desconfio e..."
06/12/2004,Márcio Thomaz Bastos,56,[...],"Mas é uma punição, né?"
