DATA,ENTREVISTA,ORDEM,LOCUTOR,FALA
06/12/2004,Márcio Thomaz Bastos,123,Renato Lombardi,Muito modesto.
06/12/2004,Márcio Thomaz Bastos,124,Sílvio Bressan,Não seja modesto.
06/12/2004,Márcio Thomaz Bastos,125,Márcio Thomaz Bastos,"O que eu vi de sujeito jogado lá dentro da cadeia, de entrar só porque..."
06/12/2004,Márcio Thomaz Bastos,126,Renato Lombardi,Entra usuário e sai traficante.
06/12/2004,Márcio Thomaz Bastos,127,Márcio Thomaz Bastos,Entra usuário e sai traficante.
06/12/2004,Márcio Thomaz Bastos,128,Renato Lombardi,É verdade.
06/12/2004,Márcio Thomaz Bastos,129,Mércio Thomaz Bastos,"Ou coisa pior, não é verdade? Eu sou a favor."
06/12/2004,Márcio Thomaz Bastos,130,Paulo Markun,Mas há uma política de governo sobre isso?
06/12/2004,Márcio Thomaz Bastos,131,Márcio Thomaz Bastos,"Há uma política de governo. A Secretaria Nacional Sobre Drogas, ela agora não se chama mais Anti-drogas, ela chama Secretaria Nacional Sobre Drogas, que está no Gabinete de Segurança Institucional, tem trabalhado muito nisso fazendo campanhas. Agora ela abriu um seminário, ao qual o presidente compareceu, para discutir essas novas, essa nova perspectiva da questão, que é a perspectiva vencedora na ONU e vencedora no mundo inteiro."
06/12/2004,Márcio Thomaz Bastos,132,Maria Teresa Sadek,"Ministro, o senhor falava da necessidade de um judiciário mais ágil e, segundo diagnóstico elaborado pelo próprio Ministério da Justiça, o grande problema da Justiça está no primeiro grau, na primeira instância. No entanto, nenhuma das medidas até agora aprovadas se dirigem à primeira instância, mas muito mais para os Tribunais Superiores ou mais precisamente para o Supremo. O que é que pode ser feito, em direção à primeira instância, sobretudo, por que? Com essa legislação que nós temos, o que nós vemos cada vez mais é a desvalorização das decisões tomadas no primeiro grau."
06/12/2004,Márcio Thomaz Bastos,133,Márcio Thomaz Bastos,"É verdade, professora. A decisão de primeiro grau no Brasil, ela de tal maneira o sistema se deformou, se distorceu, que ela é um lugar de passagem, as pessoas esperam a decisão para recorrer. Elas pedem que a decisão saia logo, porque elas querem recorrer, porque sabem que não é ali que se decide. O que se pretende fazer com essa proposta de reforma processual é estabelecer aquele padrão de todos os países civilizados, o duplo grau de jurisdição, e valorizar a primeira instância. Agora, quais são as providências práticas? Eu não acredito que sejam providências de ordem condicional, acho que tem que ser providências de ordem infra-condicional, para valorizar a primeira instância, para torná-la assim, em vez de um lugar de passagem, um lugar de decisão, um lugar respeitado onde as pessoas saibam que precisam dar o melhor e, também, as medidas extra-legais, quais são as medidas extra legais? São os choques de gestão, são as medidas de identificar as boas práticas. Nós vamos dar agora, nesse fim de ano, o nosso prêmio inovário, o que é o inovário? É um prêmio criado pelo Ministério da Justiça, em cooperação com a iniciativa privada, que visa a identificar, premiar e depois difundir boas práticas judiciárias. Quando nós estruturamos o plano, estruturamos o prêmio, nós esperávamos que fôssemos receber 40 inscrições do Brasil inteiro, 40 a 50, aí montamos um júri compatível com isso. Na verdade, recebemos 450 inscrições. Algumas maravilhosas, de juizado sem papel, como aqui em São Paulo, como em Brasília, de juizados itinerantes, como alguns no Norte e no Nordeste, de modo que essas experiências são importantes, elas estão sendo feitas no Brasil. O que é preciso é sistematizá-las, é difundi-las e apoiá-las. O Conselho Nacional de Justiça pode fazer esse papel."
06/12/2004,Márcio Thomaz Bastos,134,Sílvio Bressan,"A súmula vinculante não vai contra isso, com a valorização da primeira instância?"
06/12/2004,Márcio Thomaz Bastos,135,Márcio Thomaz Bastos,"Não necessariamente, viu, Sílvio?"
06/12/2004,Márcio Thomaz Bastos,136,Sílvio Bressan,"Não há uma, não há uma contradição aí?"
06/12/2004,Márcio Thomaz Bastos,137,Márcio Thomaz Bastos,"Não necessariamente. Eu sou contra a súmula vinculante, fui contra, trabalhei contra, tive o meu ponto de vista derrotado pelo Senado da República, respeito o Congresso, o Congresso é a fonte do poder constituinte, principalmente derivado, mas não vai contra não vai contra, porque..."
06/12/2004,Márcio Thomaz Bastos,138,Maria Teresa Sadek,"O senhor falou do Conselho Nacional de Justiça, eu tenho mais uma pergunta a fazer em relação ao Conselho Nacional de Justiça. Quem controla o controlador? Essa experiência com o Tribunal de Contas da União, que teve atuação da Polícia Federal, mostrou que um tribunal que foi feito para controlar os gastos do executivo, enfim, dos governantes, também pode cometer abusos. Então, a minha pergunta é: Quem controla o controlador ou se trata de mais uma instância burocrática que vai estar associada ao judiciário?"
06/12/2004,Márcio Thomaz Bastos,139,Márcio Thomaz Bastos,"Deus nos livre disso. Eu acredito que o Conselho Nacional de Justiça seja um ponto de esperança para o futuro. Realmente, se ele funcionar, se ele se apropriar de tudo aquilo que está se fazendo no Brasil de bom, do diagnóstico que o Ministério da Justiça fez, de um diagnóstico que o Ministro Nelson Jobim está fazendo, daquele estudo que a senhora coordenou sobre defensorias públicas no Brasil, que mostra que São Paulo não tem defensoria pública, que é um verdadeiro absurdo, levando em conta..."
06/12/2004,Márcio Thomaz Bastos,140,Paulo Markun,"São Paulo, Santa Catarina e Goiás, né?"
06/12/2004,Márcio Thomaz Bastos,141,Márcio Thomaz Bastos,"São Paulo, Santa Catarina e Goiás."
06/12/2004,Márcio Thomaz Bastos,142,Paulo Markun,Exatamente.
06/12/2004,Márcio Thomaz Bastos,143,Márcio Thomaz Bastos,"Então, todas essas experiências integradas e incorporadas, metabolizadas pelo Conselho Nacional de Justiça, que é um organismo, assim, de uma composição bem variada, elas terão condições, todas essas experiências, de produzirem frutos. Frutos, por exemplo, que redundem num planejamento estratégico das justiças estaduais para impedir greves, para prever greves, para informatizar, porque na nossa profissão, no nosso trabalho, no trabalho da advocacia, reengenharia significa informatização. Quanto mais a gente informatiza, treina as pessoas, motiva as pessoas, melhor funcionam os cartórios, melhor funcionam os juizados, é isso que precisa ser feito. E existem experiências maravilhosas já feitas no Brasil. Eu acredito que, catalisadas pelo Conselho Nacional de Justiça, nós tenhamos condição de dar o salto de qualidade que está faltando. Não vai acontecer um milagre, mas vai começar a um caminho na direção dos bons resultados."
06/12/2004,Márcio Thomaz Bastos,144,Renato Lombardi,"A Justiça já colocou duas pessoas em liberdade, do Tribunal de Contas da União, a presidente permanente das licitações, ela foi colocada em liberdade, Vera Lúcia Pinto Borges, e o chefe da segurança do Tribunal também foi colocado em liberdade, continuam presas outras duas pessoas, quer dizer, isso que eu queria falar da Polícia Federal. O senhor falou que a Polícia Federal, ela, nos últimos dois anos, quase dois anos, tem aqui uma série de coisas assim: Operação Perceu, o Sentinela, Pororoca, Cataratas, Anaconda e vai por aí à fora."
06/12/2004,Márcio Thomaz Bastos,145,Márcio Thomaz Bastos,Não sou eu que dou esses nomes.
06/12/2004,Márcio Thomaz Bastos,146,Renato Lombardi,"Faraó, Poeira no Asfalto, Cavalo de Tróia, Esteira Livre, Urso Branco, Albatroz... Aí vem o vice-presidente da Federação Nacional dos Policiais Federais, João Valderi Souza, e diz o seguinte: “A Polícia Federal está sucateada, não tem carros, não tem gasolina, não tem telefones, não tem material de comunicações. Há mais de um ano, ela não compra armas...”, e tem outra, ele critica a associação, critica o grampo, dizendo que na Polícia Federal hoje existem dois tipos de policiais: os agentes com grampo e os sem grampo. Como é que fica isso, ministro?"
06/12/2004,Márcio Thomaz Bastos,147,Márcio Thomaz Bastos,"Olha, absolutamente equivocado esse diagnóstico, com todo o respeito que eu tenho pela Fenapefe, da qual o Valderi é vice-presidente. Nós temos negociação com eles, temos o máximo de boa vontade, eles querem uma Lei Orgânica da Polícia Federal, a gente já preparou um projeto no Ministério da Justiça, inclusive com a audiência deles, mas o fato é que a Polícia Federal não está sucateada. Vou te dar um dado, você sabe quanto aumentou em despesa de custeio da Polícia Federal de 2002 para 2004? 140%, só despesa de custeio, então, aumentou muito. Por isso, inclusive, a polícia está mais equipada para trabalhar, ela tem mais dinheiro para viajar, para fazer operações de inteligência, para investigar e tal. Mesmo num ano duro, como foi o ano de 2003, nós aumentamos em 75% em relação ao ano de 2002. O presidente assinou uma medida provisória, que agora está dando frutos, criando cinco mil cargos na Polícia Federal, criamos os cargos de guarda penitenciário federal, de modo que a Polícia Federal tem tido um tratamento muito melhor do que ela tinha antes, agora, essa questão que você colocou aí, que eu quero responder também, é o seguinte: Nós vivemos num Estado de direito democrático."
06/12/2004,Márcio Thomaz Bastos,148,Renato Lombardi,Com grampo e sem grampo?
06/12/2004,Márcio Thomaz Bastos,149,Márcio Thomaz Bastos,"Não, grampo e sem grampo não. Hoje, o grampo ao monitoramento da Polícia Federal é absolutamente impessoal. Os sistemas implantados ali não admitem e não permitem, o sujeito tirar um pedaço de fita para fazer extorsão contra alguém, não permitem, porque a entrada é com senha, com hora marcada, você fica sabendo quem entrou, quem copiou e tudo. A Polícia Federal hoje é um motivo de orgulho para nós, ela sempre teve um grande conceito no Brasil."
06/12/2004,Márcio Thomaz Bastos,150,Eliane Cantanhêde,"Mas, ministro, os seus próprios colegas advogados, eu leio na Folha todo dia, estão reclamando muito dos excessos da Polícia Federal, foram 52 operações, 300 presos, sei lá, 260 presos, e eles acham que isso tem muita pirotecnia, que isso é perigoso, porque esse embalo pode atropelar a legalidade."
06/12/2004,Márcio Thomaz Bastos,151,Márcio Thomaz Bastos,"Não, eles estão falando no adjetivo, haverá excessos, pode haver excessos, pode ter havido excessos. A Polícia Federal se preocupa com isso, a diretoria geral se preocupa com isso, tem havido reuniões para estabelecer padrões, mas isso são coisas adjetivas, e coisas que podem ser consertadas, já que nós estamos no Estado de direito, que podem ser consertadas."
06/12/2004,Márcio Thomaz Bastos,152,Sílvio Bressan,"Só queria entrar no substantivo então, está falando de 52 operações, realmente o senhor disse que nunca se investigou tanto nesse país, já se atingiu ministro com essas operações, governador, senador, enfim, porque o Waldomiro Diniz, com tudo isso, continua solto?"
06/12/2004,Márcio Thomaz Bastos,153,Márcio Thomaz Bastos,"Olha, quem prende é o poder judiciário. O Waldomiro Diniz, tão logo estourou aquele escândalo, foi aberto um inquérito policial, o mais rigoroso possível, pela Polícia Federal. Eu determinei pessoalmente isso, até porque eu percebia o significado que tinha aquilo. Veio uma denúncia do Ministério Público Federal e essa denúncia acabou com a investigação, porque ela requisitou o inquérito e foi tudo para o juiz decidir. Aí passou muito tempo, o juiz não aceitou essa denúncia, depois de passados, envolvidos, alguns meses, e aí o processo voltou para o Ministério Público e o Ministério Público pediu novas diligências, e a questão está sendo investigada ainda hoje, está sendo investigada ainda hoje."
06/12/2004,Márcio Thomaz Bastos,154,Sílvio Bressan,"Ministro, as operações, principalmente da semana passada, ela surpreendeu bastante, porque envolveu TCU, envolveu o ministro do governo, e aí surge uma curiosidade. Este tipo de operação, como..."
06/12/2004,Márcio Thomaz Bastos,155,Paulo Markun,"E complicou a vida do líder do PT, que disse uma coisa e depois desdisse o que disse rapidinho."
06/12/2004,Márcio Thomaz Bastos,156,Sílvio Bressan,"Esse tipo de operação, como é que ela é feita, qual o grau de sigilo dela, a pergunta é mais específica. O senhor sabe, por antemão, quem são as pessoas que estão sendo investigadas, o presidente da República sabe quando o ministro dele vai ser atingido por uma investigação?"
06/12/2004,Márcio Thomaz Bastos,157,Márcio Thomaz Bastos,Olha...
06/12/2004,Márcio Thomaz Bastos,158,Paulo Markun,E o marqueteiro do partido também.
06/12/2004,Márcio Thomaz Bastos,159,Márcio Thomaz Bastos,"Deixa eu dizer para você. Quando, antes da posse, quando nós convidamos, eu convidei o doutor Paulo Lacerda e comuniquei o presidente, nós combinamos, eu e o presidente, isso. Eu expliquei para ele, ele conhece a Polícia Federal, o presidente tem muitos amigos, tem muitas relações na Polícia Federal, eu expliquei para ele que a idéia era fazer uma polícia impessoal, uma Polícia Federal republicana. Eu recebo muitas vezes essa pergunta: “Mas o senhor não controla a Polícia Federal?” Eu falo: “Deus me livre, eu não quero controlar a Polícia Federal, eu não quero aparelhar a Polícia Federal. A Polícia Federal, o que eu quero é que ela tenha um rumo, o que eu quero é que ela tenha uma direção”. Essa é a direção da impessoalidade e do apreço aos valores republicanos, ou seja, não persegue e não protege."
06/12/2004,Márcio Thomaz Bastos,160,Sílvio Bressan,Mas fica sabendo?
06/12/2004,Márcio Thomaz Bastos,161,Márcio Thomaz Bastos,Eu fico.
06/12/2004,Márcio Thomaz Bastos,162,Sílvio Bressan,Porque os dois policiais envolvidos na prisão do Duda Mendonça foram transferidos?
06/12/2004,Márcio Thomaz Bastos,163,Márcio Thomaz Bastos,"Eles não foram transferidos, eles estão em missão."
06/12/2004,Márcio Thomaz Bastos,164,Sílvio Bressan,"Um foi para Macaé, o outro foi para não sei onde."
06/12/2004,Márcio Thomaz Bastos,165,Márcio Thomaz Bastos,"Pois então, foi trabalhar em missão."
06/12/2004,Márcio Thomaz Bastos,166,Sílvio Bressan,"Ah, bom."
06/12/2004,Márcio Thomaz Bastos,167,Márcio Thomaz Bastos,"Ele foi trabalhar em missão, eles não foram removidos, não foram perseguidos."
06/12/2004,Márcio Thomaz Bastos,168,Eumano Silva,"Desculpa, ministro, o presidente ficou sabendo que o ministro dele estava sendo investigado?"
06/12/2004,Márcio Thomaz Bastos,169,Márcio Thomaz Bastos,"Não tem ministro dele investigado, não."
06/12/2004,Márcio Thomaz Bastos,170,Eumano Silva,"A empresa do ministro dele, sim."
06/12/2004,Márcio Thomaz Bastos,171,Márcio Thomaz Bastos,Eu não sei se o presidente soube.
06/12/2004,Márcio Thomaz Bastos,172,Paulo Markun,"Ministro, nessa questão da Justiça Federal, eu sou jornalista há 33 anos, e há 20 na televisão, mais de 20, 24 anos na televisão, então eu conheço bem como é que funciona o lado de cá, a imprensa. Por conhecer, acho que os colegas que estão aqui, que também conhecem, sabem que boa parte das imagens que movimentam a televisão, e que dão aquela sensação para o telespectador, de que ele está acompanhando o processo, são o que a gente chama de armações, ou seja, vai se abrir uma porta, mas só se chuta aquela porta depois de saber que do lado de lá não tem um bandido com três rifles disposto a disparar. E assim se obtém uma bela imagem para a televisão que demonstra toda competência da Polícia Federal, todo empenho nela, que eu acho absolutamente meritório, diga-se de passagem, não é essa a questão, a pergunta é: Não se está estabelecendo um casamento um pouco preocupante de emissoras de televisão, jornais, fotógrafos e companhia em busca de belos flagrantes, e a Polícia Federal disposta a mostrar que agora ela é diferente?"
06/12/2004,Márcio Thomaz Bastos,173,Márcio Thomaz Bastos,"Olha, eu admito que pode haver. Admitido que pode haver... mas isso é combatido, isso não é orientação da diretoria geral da Polícia Federal, ao contrário disso, a direção da Polícia Federal, o que ela propugna é comedimento, é discrição. É claro que algumas operações têm um efeito pedagógico, é importante, outras é impossível esconder da impressa, outras a vaidade humana leva as pessoas a fazerem concessões, mas nós estamos alertas a isso, sabemos que isso é uma coisa que precisa ser olhada com muito cuidado para que não haja exageros, tanto que fazemos questão de deixar clara sempre a posição da Polícia Federal, ela é meramente uma produtora de provas de ilícitos, provas legais e legítimas, que vão ser mandadas para o poder judiciário, porque é o poder judiciário que diz. Agora, o trabalho da Polícia Federal neste ano e oito meses não é brincadeira, viu, Markun? É um trabalho sério, é um trabalho importante, um trabalho abrangente, um trabalho aberto, um trabalho em que a gente não olha quem vai atingir, não persegue, não protege. É uma polícia que... quando conversamos isso antes da posse, eu dizia ao presidente: “Nós precisamos ter uma política de segurança de Estado e não uma política de segurança só de governo, uma política de país, uma política que paire acima dos entre choques partidários, eleitorais e políticos”."
06/12/2004,Márcio Thomaz Bastos,174,Merval Pereira,"Ministro, já há algum dado que mostre que as investigações da Polícia Federal estão sendo mais eficientes do que eram antes? Quer dizer, as provas vão à Justiça, são provas que permitem condenar a pessoa?"
06/12/2004,Márcio Thomaz Bastos,175,Paulo Markun,"E quantas pessoas ficaram, estão presas, né?"
06/12/2004,Márcio Thomaz Bastos,176,Merval Pereira,"Porque o que acontece aqui no Brasil é sempre isso, né, você faz, faz, faz, aí, chega na Justiça, todas as provas não valem, todas as provas não..."
06/12/2004,Márcio Thomaz Bastos,177,Márcio Thomaz Bastos,"Olha, as provas colhidas pela Polícia Federal, nessa fase em que ela... ela privilegiou duas coisas. Planejamento das operações - tanto que não deu um tiro, ela não vai meter o pé na porta para invadir e trocar tiros com o sujeito ou para matar o sujeito, ela vai lá e prende e ela já prendeu pessoas que tinham um verdadeiro arsenal no Rio, num sítio lá do Rio, em vários outros lugares, em Manaus em todos os lugares, ela não disparou um tiro. É planejamento e inteligência, ela privilegia o trabalho de inteligência, um trabalho feito de coleta de informações, de levantamento dessas situações, de modo que saia uma prova boa."
06/12/2004,Márcio Thomaz Bastos,178,[...],E a atuação do Ministério Público Federal?
06/12/2004,Márcio Thomaz Bastos,179,Márcio Thomaz Bastos,"O Ministério Público Federal tem cooperado, tem participado dessas operações, assim como a Justiça Federal também. Agora, nós vamos ter, por exemplo, aqui em São Paulo, na semana que vem, um julgamento de uma dessas operações, uma operação grande, uma operação rumorosa que a Polícia Federal fez, que foi a Anaconda vai ser julgado pelo Tribunal Federal..."
06/12/2004,Márcio Thomaz Bastos,180,Renato Lombardi,"Juiz, três delegados, dois agentes, dois advogados."
06/12/2004,Márcio Thomaz Bastos,181,Márcio Thomaz Bastos,"...que vai dizer se as provas estão bem colhidas, se as provas não estão bem colhidas. A impressão que eu tenho, do exame que eu fiz de alguns inquéritos, é que os inquéritos são muito bem feitos, os inquéritos são bem feitos, eles têm uma lógica interna, sim, os depoimentos são fundamentados em prova técnica. Esse é um outro tema fundamental, que o Renato Lombardi é do ramo e a professora Maria Tereza também conhecem isso, é a gente subir de paradigma em matéria de investigação criminal, isso é uma coisa fundamental no Brasil. Hoje, como é que se descobre a autoria no Brasil? Meio forçando."
06/12/2004,Márcio Thomaz Bastos,182,Renato Lombardi,"Que é a história do crime para o criminoso, né."
06/12/2004,Márcio Thomaz Bastos,183,Márcio Thomaz Bastos,Exatamente.
06/12/2004,Márcio Thomaz Bastos,184,Renato Lombardi,"Antigamente era o criminoso para o crime, hoje não, já é do crime para o criminoso."
06/12/2004,Márcio Thomaz Bastos,185,Márcio Thomaz Bastos,"E hoje você tem, você tem a possibilidade, por exemplo, nós estamos implantando laboratórios de DNA no Brasil inteiro, são dez laboratórios de DNA, dois em cada região do país. Com esses laboratórios, você muda o padrão de investigação, não precisa extrair a confissão do sujeito, assim um fio de cabelo, uma ponta de cigarro, uma pele na unha da vítima, isso mostra quem é o autor de uma maneira irretorquível e incontestável, com 99,9% disso. Por outro lado, nós estamos fazendo a implantação do sistema de identificação datiloscópica centralizado, de modo que alguns milhões de fichas datiloscópicas vão ficar na Polícia Federal e, até o fim do ano que vem, isso já está pronto, estarão disponibilizadas para todas as Secretarias de Segurança Pública, o que facilita demais o combate à criminalidade. São essas medidas, esse tipo, esse padrão de trabalho de investigação, que a Polícia Federal vem fazendo e que a Secretaria Nacional de Justiça se empenha em disseminar por todo o sistema de segurança do Brasil."
06/12/2004,Márcio Thomaz Bastos,186,Paulo Markun,"Ministro, nós vamos fazer mais um rápido intervalo, e o Roda Viva volta daqui em instantes."
06/12/2004,Márcio Thomaz Bastos,187,[...],
06/12/2004,Márcio Thomaz Bastos,188,Paulo Markun,"Estamos de volta com Roda Viva, para o último bloco de entrevista com o ministro da Justiça Márcio Thomaz Bastos. Ministro, o governo se empenhou, e vem se empenhando, numa campanha de desarmamento, de compra de armas. Qual tem sido o resultado disso e até onde vai essa campanha?"
06/12/2004,Márcio Thomaz Bastos,189,Márcio Thomaz Bastos,"Essa campanha surgiu do Estatuto do Desarmamento votado pelo Congresso Nacional. Começamos a campanha para desarmar os homens de bem. A primeira argumentação foi a seguinte: “Mas os bandidos vão entregar as armas?” Aí a gente respondia: “Lógico que não, bandido é a polícia que toma, bandido é a repressão que toma”. Essas armas, o nosso objetivo, é tirar as armas dos homens de bem, para quê? Para evitar o marido que, numa discussão, dá um tiro na mulher, para evitar a briga de trânsito, que o sujeito em vez de discutir fortemente, tira o revólver e atira no outro, a briga no campo de futebol, a briga de moleque, como aconteceu em Brasília na semana passada, que um menino de 16 anos trocou tapa com outro e aí lembrou que o pai tinha um revólver no criado-mudo, foi lá, pegou o revólver e matou o menino. É para acabar com isso. Esse tipo de crime, esse crime do homem de bem, da pessoa de bem, representou para o Sistema Único de Saúde no ano passado uma despesa de 400 milhões de reais. Essa é a maior epidemia brasileira, é o sujeito que morre por tiro assim meio acidental, por tiro que não é de bandido. Então, o nosso objetivo era tirar 80 mil armas de circulação. Conseguimos, até 23 de dezembro, chegar a 200 mil armas. Montamos.. eu fiz um tour aí de 55 mil quilômetros, conseguimos montar um comitê de desarmamento em cada estado no Brasil. Esses comitês estão trabalhando ativamente, de modo que agora a gente vai prorrogar por mais seis meses e estamos liberando a sociedade civil para recolher as armas. Nós vamos prorrogar por mais seis meses o prazo de entregar as armas. Isso está representando claramente, uma diminuição nesse tipo de crime. Aqui em São Paulo, uma pesquisa da USP mostrou que houve uma queda de 18% dos homicídios. No Paraná, em algumas cidades médias, onde foi medido, como Londrina, como Maringá, desceu 30% o crime. Então, essa é uma campanha que tem, além desse efeito de tomar as armas, mas ela tem um efeito oculto, que é o efeito das pessoas mostrarem que estão cansadas disso, estão cansadas, querem construir uma cultura de paz."
06/12/2004,Márcio Thomaz Bastos,190,Renato Lombardi,"E o lobby do fabricante de arma, ministro?"
06/12/2004,Márcio Thomaz Bastos,191,Márcio Thomaz Bastos,"Pois é, está sendo vencido, né, o lobby do fabricante de arma está sendo vencido. No ano que vem, nós vamos ter a oportunidade de colocar em plebiscito, está marcado, pelo estatuto, para 2005, outubro de 2005, para saber se continua comercializando arma no Brasil ou se não continua."
06/12/2004,Márcio Thomaz Bastos,192,Eumano Silva,O senhor é contra a ou a favor?
06/12/2004,Márcio Thomaz Bastos,193,Márcio Thomaz Bastos,"Eu sou contra, eu sou a favor da proibição."
06/12/2004,Márcio Thomaz Bastos,194,Eumano Silva,Proibição da fabricação?
06/12/2004,Márcio Thomaz Bastos,195,Renato Lombardi,Do fabrico da arma?
06/12/2004,Márcio Thomaz Bastos,196,Márcio Thomaz Bastos,Do fabrico da arma. Da comercialização da arma.
