DATA,ENTREVISTA,ORDEM,LOCUTOR,FALA
06/12/2004,Márcio Thomaz Bastos,57,Márcio Thomaz Bastos,"Para não ficar no achismo e na desconfiança, porque aí fica assim, digamos, aquilo que se diz brincalhonamente, a direita penal dizendo: “Não, precisa endurecer”. E ficam os advogados, o pessoal garantista dizendo: “Não, não precisa endurecer”. Então, o que tem que fazer? É apurar, realmente, com base em fatos concretos e em pesquisa, o que aconteceu com a lei dos crimes hediondos."
06/12/2004,Márcio Thomaz Bastos,58,Renato Lombardi,"Mas, para determinados crimes é preciso endurecer, ministro."
06/12/2004,Márcio Thomaz Bastos,59,Márcio Thomaz Bastos,"Eu sei, a própria Constituição diz isso."
06/12/2004,Márcio Thomaz Bastos,60,Renato Lombardi,"Olha, o senhor pega o latrocínio..."
06/12/2004,Márcio Thomaz Bastos,61,Márcio Thomaz Bastos,"Eu sei, a própria Constituição diz isso e eu sou a favor disso."
06/12/2004,Márcio Thomaz Bastos,62,Renato Lombardi,"O estuprador, o seqüestrador."
06/12/2004,Márcio Thomaz Bastos,63,Márcio Thomaz Bastos,"Claro, com certeza, com certeza."
06/12/2004,Márcio Thomaz Bastos,64,Renato Lombardi,"Esse precisa ir para a cadeia mesmo. Os crimes hediondos fazem o que? Um sujeito que é condenado por crime hediondo, ele perde todas as benesses, do sistema..."
06/12/2004,Márcio Thomaz Bastos,65,Márcio Thomaz Bastos,"O chefe de quadrilha tem que ter uma cadeia dura, tanto assim... Deixa eu terminar o meu raciocínio e depois eu vou falar sobre isso aí. O que nós fizemos? Pegamos o Ilanud, que é um organismo da ONU, um organismo internacional que tem sede aqui em São Paulo, e encomendamos, fizemos um convênio com eles e encomendamos uma pesquisa sobre o efeito dos crimes hediondos no Brasil inteiro: no Rio, em São Paulo, no Norte, Nordeste, Sul e Sudeste para saber nas duas coisas. No sistema penitenciário de um lado e, por outro lado, na diminuição daqueles crimes elencados, para saber qual foi o efeito da lei dos crimes hediondos. Com base nisso, eu conversei com o presidente da Comissão de Justiça e Cidadania da Câmara, deputado Maurício Rands, nós vamos, assim que essa pesquisa estiver pronta, nós vamos levar essa pesquisa ao Congresso Nacional onde tramitam dezenas de processos a respeito dos crimes hediondos. Alguns, incluindo mais coisas, outros excluindo algumas coisas, e vamos discutir isso numa maneira racional, numa maneira lógica. O problema disso, Merval, é a gente se deixar levar pela paixão, as pessoas assim: “Olha, está querendo tirar todo mundo da cadeia, precisamos botar todo mundo na cadeia”. E quanto menos a pessoa entende, mais indignada, às vezes, ela fica. Então, o que é preciso? É preciso ter fatos, é preciso ter pesquisa, é preciso ter apuração para a gente discutir os crimes hediondos. Dizer para você que eu acho fundamental que certo tipo de criminoso, o seqüestrador, o latrocida, o estuprador de criança, os chefes de quadrilha, que tenham uma cana dura, uma prisão mais pesada. O governo do presidente Lula, logo no começo, através de uma emenda aglutinativa no Congresso Nacional, aprovou um projeto de lei que estabelece, legaliza o regime disciplinar diferençado. O que é o regime disciplinar diferençado? É um regime mais duro, é um regime quase que de solitária."
06/12/2004,Márcio Thomaz Bastos,66,Merval Pereira,"Fernandinho Beira-Mar está nesse sistema, né?"
06/12/2004,Márcio Thomaz Bastos,67,Renato Lombardi,"Mas tem que ser assim mesmo, né, ministro? Para determinados crimes tem...."
06/12/2004,Márcio Thomaz Bastos,68,Márcio Thomaz Bastos,"Agora, isso não era assim, isso era feito ilegalmente pelos estados sem uma normatização. O que a gente fez foi aprovar uma lei no Congresso estabelecendo isso."
06/12/2004,Márcio Thomaz Bastos,69,Paulo Markun,"Ministro, aqui tem uma lei que a gente tem um intervalinho de tempos em tempos. Nós vamos praticá-la e voltamos daqui a instantes."
06/12/2004,Márcio Thomaz Bastos,70,[...],
06/12/2004,Márcio Thomaz Bastos,71,Paulo Markun,"Voltamos com Roda Viva que esta noite entrevista o ministro da Justiça, Márcio Thomaz Bastos. Ministro, há evidentemente uma questão predominante nas perguntas de telespectador, e eu vou citar algumas, apenas, e que eu relaciono com um outro dado. Recentemente, o senhor esteve no Rio de Janeiro assinando uma série de convênios e não disse uma palavra sobre a situação do Rio de Janeiro naquela ocasião, né? A situação era dramática, como continua sendo, e as perguntas são todas nessa direção. José Vilmar da Silva...."
06/12/2004,Márcio Thomaz Bastos,72,Márcio Thomaz Bastos,Que eu não disse uma palavra é você que está dizendo ou são os telespectadores?
06/12/2004,Márcio Thomaz Bastos,73,Paulo Markun,"Não, a imprensa disse que, na ocasião, o senhor não disse, não mencionou nada."
06/12/2004,Márcio Thomaz Bastos,74,Márcio Thomaz Bastos,"Não, não. Foi só uma questão de assessoria de imprensa. Como eu ia fazer duas sessões, a gente ia fazer uma assinatura de convênios com a governadora e, em seguida, uma sessão da campanha do desarmamento, ficou deliberado que eu falasse na campanha do desarmamento, mas no convênio com a governadora Rosinha Garotinho o secretário nacional de Segurança Pública falou. Eu falei depois, na campanha do desarmamento, para não falar duas vezes num lugar só. Mas falei, sim."
06/12/2004,Márcio Thomaz Bastos,75,Paulo Markun,"Muito bem, mas de toda maneira, as perguntas dos telespectadores são na seguinte linha: José Vilmar de Silva, de São Caetano, advogado, quer saber quantos presídios foram construídos pelo governo Lula até hoje e quantos mais se pretende construir? Aldo de Souza, do Rio de Janeiro, estudante, diz o seguinte: “Das duas prioridades que o senhor tinha quando assumiu o Ministério, uma delas era a questão da violência urbana, que simplesmente não avançou...”, segundo o Aldo, “...a sensação de insegurança nas grandes metrópoles atinge níveis insuportáveis. O que falta para o governo federal entrar de cabeça nessa questão?”, Fábio Martins Fontes, de Pinheiros, economista aqui de São Paulo, bairro aqui de São Paulo, pergunta se o senhor acha aceitável o índice de violência no Brasil e quais as medidas efetivas que o governo federal tem para ajudar os secretários estaduais de Segurança Pública? E, finalmente, pergunta formulada pelo professor doutor Fernando Araújo Moreira: “Quando o governo federal vai, de fato, parar de se preocupar com o custo político de suas ações e passar a atuar com profissionalismo e sem medo na questão da segurança pública?”"
06/12/2004,Márcio Thomaz Bastos,76,Merval Pereira,"Ministro, eu queria complementar para perguntar o seguinte: Por que o Exército entrou em ação no Espírito Santo e não entra no Rio?"
06/12/2004,Márcio Thomaz Bastos,77,Márcio Thomaz Bastos,"Vamos fazer por partes, como dizia..."
06/12/2004,Márcio Thomaz Bastos,78,Merval Pereira,O esquartejador...
06/12/2004,Márcio Thomaz Bastos,79,Márcio Thomaz Bastos,"Então, as perguntas formuladas ali pelo Markun, elas dizem respeito à segurança pública. Segurança pública, realmente, é uma prioridade do governo como é uma prioridade do Brasil. A segurança pública, basicamente, é de responsabilidade dos estados. O governo federal do presidente Lula tem uma determinação de ser parceiro de todos os estados. Ali tem uma pergunta que diz que a criminalidade está subindo no Brasil, não está. Todos os dados mostram, aqui em São Paulo, Rio e Espírito Santo, todos os dados mostram que a criminalidade, em certos crimes, vem diminuindo. Por exemplo, aqui no estado de São Paulo, a estatística de homicídios caiu 18% contemporaneamente à campanha do desarmamento. Então, existem muitos crimes que estão caindo. Isso se deve, como é em todos os estados do Brasil no Norte, no Nordeste, no Sul, no Sudeste, há uma pequena, não é uma grande queda, uma pequena queda da criminalidade. Isso se deve muito, na nossa opinião, à implantação da gestão integrada da segurança pública. Esse famoso sistema único de segurança pública que fazia parte do programa de governo do presidente e que está sendo implantado desde o primeiro dia de governo. Nós, no ano passado, assinamos convênio com os 27 estados, de implantação onde a gente faz uma série de exigências para que os governos assinem convênios, recebam dinheiro. E fazendo parcerias, fazendo conjuntos, fazendo trabalho de rede. Por que é isso que define, Merval, no século XXI, o conceito de rede é que define as coisas, não existem mais atividades isoladas. Então, nós tínhamos, no começo do governo, a prioridade de combater a segurança, de combater a violência, o crime organizado e lutar pela segurança pública. Isso nós só podemos fazer por indução. Eu usei uma imagem uma vez, que eu acho que é do Golbery: “Nós não podemos fazer chover, o que nós podemos fazer é construir as nuvens”, nós, governo federal. Então, a gente cria um plano bem claro, um plano que tinha começo, meio e fim e está sendo implantado no Brasil. A reforma do judiciário é uma parte fundamental disso, a implantação do sistema único de segurança pública é uma parte fundamental disso, o combate à lavagem de dinheiro, que não existia no Brasil seriamente e que hoje existe, estamos criando uma cultura de combate à lavagem de dinheiro, todos os órgãos do governo federal estão mobilizados nisso, nós estamos fazendo cursos, inclusive, ensinando os governos estaduais e algumas categorias a trabalhar com a lavagem de dinheiro, porque a lavagem de dinheiro é causa final do crime organizado. Espera aí, que eu vou responder isso no fim."
06/12/2004,Márcio Thomaz Bastos,80,Eliane Cantanhêde,"Ministro, eu queria perguntar, nós, esta bancada aqui, está querendo saber um pouco dessa questão do Exército, pegando um pouco da carona. Os ministros da Defesa das três américas se reuniram agora em Quito, e o vice-presidente José Alencar estava lá, e houve uma discussão conceitual muito importante que são os Estados Unidos, o Canadá e a Colômbia, defendendo o seguinte. O crime hoje, o conceito de defesa hoje, evoluiu muito porque você tem o crime organizado e o terrorismo como as questões principais do novo século. E o Brasil, Argentina e o Chile, eles defenderam ainda que o papel das forças armadas tem que ficar restrito a antigo conceito de defesa, que é soberania de território e fronteiras. Essa discussão, no Brasil, fica meio sem sentido, porque os Estados Unidos têm razão numa coisa, quer dizer, como é que você tem exércitos que não fazem nada, enquanto as populações civis estão morrendo nas grandes cidades? Quer dizer, o conceito de segurança como policial e o conceito de defesa como militar, como aproximar os dois conceitos, segurança e defesa, policial e militar?"
06/12/2004,Márcio Thomaz Bastos,81,Márcio Thomaz Bastos,"É uma resposta longa que eu vou ter que dar, não é?"
06/12/2004,Márcio Thomaz Bastos,82,Eliane Cantanhêde,"Não é tão longa, será que é longa?"
06/12/2004,Márcio Thomaz Bastos,83,Márcio Thomaz Bastos,Porque a pergunta foi longa.
06/12/2004,Márcio Thomaz Bastos,84,[...],Se for proporcional...
06/12/2004,Márcio Thomaz Bastos,85,Márcio Thomaz Bastos,"E levantou muitos aspectos nessa questão. Aqui no Brasil, isso tem avançado. Recentemente, o Congresso Nacional aprovou uma lei dando poder de polícia ao Exército nas áreas de fronteira. Nas áreas de fronteira, é uma coisa importante a presença do Exército, nós temos experiências na fronteira com a Colômbia, na fronteira com a Venezuela e na fronteira com Peru de operações combinadas da Polícia Federal e do Exército que são muito importantes e que têm dado grandes resultados, a combinação do poder de polícia da Polícia Federal e da presença do Exército. Em relação à presença do Exército nos centros urbanos, eu sou muito cético em relação a isso do jeito que as coisas existem nesse momento. As forças armadas brasileiras, elas não estão preparadas para esse tipo de atividade policial em centros urbanos."
06/12/2004,Márcio Thomaz Bastos,86,Renato Lombardi,"Sim, mas para policiar grandes avenidas pode."
06/12/2004,Márcio Thomaz Bastos,87,Márcio Thomaz Bastos,"Nós já tivemos, algumas vezes, essa experiência no governo do presidente Lula, logo no começo do governo do Rio, do governo da governadora Garotinho, naquele carnaval, quando havia lá uma crise, nós pusemos o Exército na rua advertindo que o Exército colocado na rua como alvo fixo é uma coisa perigosíssima para todo mundo. Retiramos de lá aquele prisioneiro que se dizia que era o articulador de todos os males do Rio de Janeiro. Depois disso, retiramos o Exército o mais rapidamente que foi possível antes que começassem a acontecer os efeitos indesejáveis da presença do Exército no patrulhamento urbano das ruas, porque não dá certo, Renato, não dá certo fazer isso desse jeito. O que fizemos mais? Depois, quando houve a outra crise da Rocinha, mas antes da crise da Rocinha, nós começamos a investir no Rio de Janeiro em matéria de segurança, nós, governo federal. Está montada no Rio de Janeiro uma operação chamada suporte, que é um trabalho de inteligência, Merval, que é muito difícil você encontrar um melhor no mundo inteiro. É um trabalho com 50 homens de elite da Polícia Federal, trabalhando com os melhores equipamentos que existem, de monitoramento, de mapeamento, de geo-referenciamento fazendo levantamento de quadrilhas. Tanto assim que quem identificou aquela tomada da Rocinha, que foi aquela crise que teve lá na Rocinha, quem identificou isso, foi a operação suporte."
06/12/2004,Márcio Thomaz Bastos,88,Merval Pereira,E trabalham em conjunto com a polícia do Rio?
06/12/2004,Márcio Thomaz Bastos,89,Márcio Thomaz Bastos,"A gente tem trabalhado, montamos lá naquela ocasião, daquela crise... A governadora veio para cá, conversou com o presidente, conversou comigo, nós fomos ao Rio, fizemos uma reunião lá e temos trabalhado ativamente nesse sentido, em parceria com o Rio de Janeiro, temos trabalhado. Agora mesmo, na semana passada, eu fui lá para assinar esses convênios, quando eu falei a respeito dessas coisas, a gente teve uma longa reunião entre o diretor geral da Polícia Federal, o secretário nacional de Segurança Pública e o novo secretário de Segurança, Marcelo Itagiba, e eles conversaram uma manhã inteira traçando planos de trabalho para organizar, para fazer uma sintonia mais fina nessa cooperação."
06/12/2004,Márcio Thomaz Bastos,90,Sílvio Bressan,"Ministro, mas o senhor ainda não respondeu à questão dele. Por que mandar uma força para Vitória e não para o Rio de Janeiro, é uma questão política?"
06/12/2004,Márcio Thomaz Bastos,91,Márcio Thomaz Bastos,"Não, não é uma questão política, absolutamente"
06/12/2004,Márcio Thomaz Bastos,92,Renato Lombardi,"Ou então, uma força especial, essa força especial que a Polícia Federal... que a Polícia Militar montou."
06/12/2004,Márcio Thomaz Bastos,93,Márcio Thomaz Bastos,"Não, não é uma questão política, absolutamente."
06/12/2004,Márcio Thomaz Bastos,94,Sílvio Bressan,O que é então?
06/12/2004,Márcio Thomaz Bastos,95,Márcio Thomaz Bastos,"Pode perguntar para a governadora, nós temos dado toda a assistência."
06/12/2004,Márcio Thomaz Bastos,96,Merval Pereira,"Mas é uma questão política da parte dela, que não pede?"
06/12/2004,Márcio Thomaz Bastos,97,Márcoio Thomaz Bastos,"Não, não é uma questão política da parte dela. Eu acredito que a gente vai avançar. Essas coisas têm um ritmo, Merval. Por exemplo, no Espírito Santo, a situação, tirando a diferença de escala, a situação era muito mais grave que lá no Rio de Janeiro, porque no Espírito Santo estava contaminado pelo crime organizado também os estamentos legislativo, judiciário executivo, estava tudo infiltrado pelo crime organizado. Houve um trabalho lá de cooperação, de parceria com a Polícia Federal. O secretário de Segurança Pública é um delegado de Polícia Federal e acabou diminuindo muito isso. Agora teve esse surto que nasceu do endurecimento do sistema penitenciário, nós estamos convencidos disso. O surto lá no Espírito Santo surgiu disso, das exigências da população carcerária, das quadrilhas que não estão suportando a pressão e a impessoalidade com que o governo está tratando as populações carcerárias. Então, eles começaram a botar fogo em ônibus e tudo. O governador, que é nosso amigo, é nosso parceiro, o governador me ligou, nós conversamos com o vice-presidente José Alencar e, imediatamente, mandamos o Exército numa missão de emergência, para policiar a rua, como já mandamos para o Rio também e mandaremos de novo em qualquer emergência. E aí começamos a fazer a primeira experiência no Brasil de uma idéia que é brilhante, na minha opinião, e que eu espero que venha a dar certo, que é essa Força Nacional de Segurança Pública. Essa Força Nacional, ela não é uma panacéia."
06/12/2004,Márcio Thomaz Bastos,98,Paulo Markun,"É o que a gente espera né, ministro."
06/12/2004,Márcio Thomaz Bastos,99,Márcio Thomaz Bastos,"Não é uma coisa que vai resolver tudo, mas o fato é que, dentro do planejamento dela, como um programa de cooperação republicana e federativa entre os estados, em que não cria um organismo burocrático, não cria cargos, não cria hierarquias, não cria estruturas, mas simplesmente coordena e treina policiais militares do Brasil inteiro, as polícias militares estaduais, leva eles lá para a academia da Polícia Federal, deixa eles treinando lá, fazendo uma reciclagem, uma homogeneização, depois devolve eles para os seus estados já para difundir também essa cultura que um pouco eles adquirem lá, e também o que eles trazem de bom. Nós pretendemos, até o fim do mandato do presidente ter, treinados, 10.500 homens."
06/12/2004,Márcio Thomaz Bastos,100,Sílvio Bressan,"Não tem conflito jurídico aí, entre a autonomia de cada estado? Se o governador, por exemplo, não quiser?"
06/12/2004,Márcio Thomaz Bastos,101,Márcio Thomaz Bastos,"Claro, se o governador não quiser, se o governador não quiser, não faz. Aí é um trabalho de consenso, de cooperação. Felizmente todos os estados estão apoiando, estão mandando seus militares, porque eles vêem que é bom para eles, isso lembra um pouco..."
06/12/2004,Márcio Thomaz Bastos,102,Paulo Markun,Ministro.
06/12/2004,Márcio Thomaz Bastos,103,Márcio Thomaz Bastos,É intervalo?
06/12/2004,Márcio Thomaz Bastos,104,Paulo Markun,"Não, não."
06/12/2004,Márcio Thomaz Bastos,105,Márcio Thomaz Bastos,"Isso lembra um pouco, essas forças da ONU, espero que no bom sentido."
06/12/2004,Márcio Thomaz Bastos,106,Renato Lombardi,"Que é o que o Exercício brasileiro fez no Haiti, foi lá atrás, entrou procurando traficante, procurando ladrão."
06/12/2004,Márcio Thomaz Bastos,107,Márcio Thomaz Bastos,"É, mas aqui nós não vamos fazer isso, aqui."
06/12/2004,Márcio Thomaz Bastos,108,Renato Lombardi,"Ora, se o Exército, se o nosso Exército, vai lá atrás de traficante, de ladrão, por que não pode ser aqui, ministro?"
06/12/2004,Márcio Thomaz Bastos,109,Márcio Thomaz Bastos,"Aqui, nós só fazemos isso por consenso. A presença, o funcionamento desse programa republicano cooperativo federativo, que é a Força Nacional de Segurança Pública, é um passo intermediário antes da presença do Exército. Porque você sabe que a Constituição prevê a entrada do Exército para garantir a lei e a ordem, quando a lei e a ordem estiverem..."
06/12/2004,Márcio Thomaz Bastos,110,Renato Lombardi,"Quando ficam na mão do traficante, fica na mão do crime organizado, como está acontecendo no Rio de Janeiro."
06/12/2004,Márcio Thomaz Bastos,111,Márcio Thomaz Bastos,"...correndo o risco de desaparecerem, então é esse um trabalho que está sendo feito. O Exército já entrou no Rio, se for o caso entrará no Rio. A Força Nacional de Segurança Pública, nós colocamo-la, perdão, à disposição, do governo do estado do Rio, mas a gente tem trabalhado em cooperação."
06/12/2004,Márcio Thomaz Bastos,112,Renato Lombardi,"Olha que o morador do Rio vai gostar muito do que o senhor está falando, porque está precisando mesmo, viu, ministro?"
06/12/2004,Márcio Thomaz Bastos,113,Márcio Thomaz Bastos,"Eu sinto isso, deixa eu só falar mais uma coisa. Eu sinto, eu sinto isso realmente, em relação à população do Rio, a população do Rio se sente abandonada, abandonada pelo governo estadual, pelo governo federal, pelo governo municipal. A gente percebe isso, essa sensação é muito forte. Então, tem que trabalhar, tem que fazer as coisas certas e fazer as coisas que dêem resultado e que funcionem, mas isso exige muito um trabalho de estrutura, não é só... eu toda vez que eu falo isso no Ministério, as pessoas riem e ficam marcando quantas vezes eu já falei, mas não existe tiro de canhão em matéria de segurança pública."
06/12/2004,Márcio Thomaz Bastos,114,Paulo Markun,"Exatamente, a pergunta que eu ia fazer era essa. O senhor tem reiterado isso desde o início, e eu considero que é bom que seja assim, porque todo mundo que diz que tem tiro de canhão é porque não tem canhão nenhum, só quer fazer uma declaração para a gente, jornalisticamente, colocar nas manchetes e está tudo resolvido. Nós adoramos fazer isso. A pergunta é a seguinte. Como é que o senhor acha que será combatida a sensação da população de que a impunidade continua grande, de que a insegurança aumenta, de que a criminalidade é cada dia maior, e até daqueles que assistem os programas de final de tarde na televisão, aquela é a realidade que a gente assiste, né? Cidades tomadas pelo medo, violência na porta de todo mundo e assim por adiante."
06/12/2004,Márcio Thomaz Bastos,115,Márcio Thomaz Bastos,"São muitas medidas, não é uma só, não é um tiro de canhão e não é um passe de mágica, são muitas medidas, tem as medidas da repressão que tem um limite, você pode reprimir até um certo ponto, essas exigem o quê? Exigem polícias integradas, polícias trabalhando com inteligência e com informação. Só para fazer um parêntese, você veja uma coisa, a Polícia Federal, nesses dois anos, nesse ano e oito meses de governo do presidente Lula, sob a direção das mãos honradas e fortes do delegado Paulo Lacerda ela fez centenas de prisões, prendeu gente fortemente armada e não disparou um tiro. Então, a polícia hoje é cada vez mais inteligência, cada vez mais informação, cada vez mais geo-referenciamento, mapeamento e outros paradigmas de investigação. Essa é uma medida. A outra medida é um judiciário mais ágil, é um judiciário mais de respostas prontas, um judiciário que faça jus àquela lembrança do Beccaria, de que o que diminui a criminalidade não é tamanho da pena, mas é a certeza da punição; o combate à lavagem de dinheiro, por outro lado. Essas são medidas dentro do campo da repressão, mas existem outras medidas. O país, em 2003, cresceu pouco, agora que foi retificado que você viu que cresceu 0,5%, mas esse ano, felizmente, o país está crescendo mais, o país está gerando emprego, o país gerou um milhão e 800 mil postos com carteira assinada já este ano, até outubro. Então, essas coisas, as medidas que não são de repressão, mas que são de prevenção, são muito importantes, são fundamentais para que, através da inclusão, através dos problemas sociais, você diminua a criminalidade."
06/12/2004,Márcio Thomaz Bastos,116,Paulo Markun,"Só um minutinho, nós vamos para o nosso intervalo e voltamos já já."
06/12/2004,Márcio Thomaz Bastos,117,[...],
06/12/2004,Márcio Thomaz Bastos,118,Paulo Markun,"Voltamos com Roda Viva que esta noite entrevista o ministro da Justiça Márcio Thomaz Bastos. Carlos Alexandre Ribeiro, do bairro de Pinheiros, aqui de São Paulo, ministro, diz que o senhor, como advogado, deu uma entrevista para o Jornal do Advogado dizendo que era a favor da descriminalização da maconha. Como ministro, ele pergunta, o senhor mudou de idéia, ou se não mudou, quais as medidas que estão sendo tomadas nesse sentido?"
06/12/2004,Márcio Thomaz Bastos,119,Márcio Thomaz Bastos,"Não, eu não mudei, eu sou a favor da descriminação do uso da maconha. Acho que essa é uma tendência universal hoje, tanto que hoje não se fala mais em política anti-drogas, não por tráfico. O tráfico tem que ser combatido numa guerra, mas para o uso, se fala em diminuição de danos e políticas sobre drogas, de modo que eu sou a favor da descriminação."
06/12/2004,Márcio Thomaz Bastos,120,Sílvio Bressan,Mas dá para dissociar o tráfico do uso?
06/12/2004,Márcio Thomaz Bastos,121,Márcio Thomaz Bastos,"Dá, perfeitamente, porque tentar combater o uso de drogas é uma experiência que já foi feita em muitos lugares, nos Estados Unidos mesmo, na Colômbia, nunca deu certo, fazer a war drugs, a guerra contra as drogas, nunca deu certo. Essa assimilação que às vezes você vê em propagandas aí: “Quando você está fumando maconha você está armando um traficante”, são coisas completamente diferentes, são coisas completamente diferentes. O traficante de droga, esse é um bandido no limite, é o bandido que tem que ser combatido com todas as amas, com a violência legal do Estado, com a inteligência, com a informação e tudo. Agora, o usuário, ele tem muito mais que ser tratado do que ser reprimido e ser jogado na cadeia, principalmente. Porque, o que eu já vi nesses meus 45 anos de advocacia criminal intensa, embora obscura, o que eu vi..."
06/12/2004,Márcio Thomaz Bastos,122,Sílvio Bressan,O que é isso...?
