DATA,ENTREVISTA,ORDEM,LOCUTOR,FALA
03/11/1986,Pietro Maria Bardi,375,Pietro Maria Bardi,"Veja, o Masp funciona não como uma rotina pré-estabelecida. O Masp cada dia, tem sempre, uma proposta nova, uma idéia, uma possibilidade de fazer uma nova exposição, de fazer um curso, de ir ao auditório, apresentar música,até popular. Cinema, dar cursos, isso é uma... E conduzir, o Masp não é como conduzir um museu de caráter geral, é um museu onde precisa cada dia inventar alguma coisa, ser sempre, vamos dizer, um pouco para frente."
03/11/1986,Pietro Maria Bardi,376,Tereza Cristina de Barros,O senhor acha que os museus de uma forma geral tem feito isso?
03/11/1986,Pietro Maria Bardi,377,Pietro Maria Bardi,"Bom, eu vejo que os outros museus de São Paulo, até a Pinacoteca, imitaram de nós o sistema de fazer exposições temporárias, nós chegamos a fazer quatro, cinco, exposições temporárias, cada mês. Então, só que leva uma certa atividade e leva também um certo público, um certo público que, pouco a pouco, vamos formando. Mas, devo declarar que o Museu de Arte de São Paulo, ainda não tem a visitação que deveria ter. Tem a visitação quando eu faço uma exposição das gravuras de Picasso, eu esperava cinqüenta mil visitas, às vezes, já foram 150 mil, porque o nome de Picasso repercutiu de tal jeito que todo o mundo foi fazer fila pagando 15 cruzeiros para ver a exposição."
03/11/1986,Pietro Maria Bardi,378,Rodolpho Gamberini,"Senhor Bardi. O senhor aqui já respondeu a várias perguntas, não respondeu a pelo menos uma que eu lhe fiz duas vezes, algumas outras pessoas aqui também fizeram. Está ali um dos seus desenhos, eu gostaria que o senhor falasse do seu trabalho como artista?"
03/11/1986,Pietro Maria Bardi,379,Pietro Maria Bardi,Como?
03/11/1986,Pietro Maria Bardi,380,Rodolpho Gamberini,"O seu desenho está ali, nós vamos mostrar agora o seu desenho, gostaria que o senhor falasse do seu trabalho como artista, como desenhista. O que senhor acha do seu trabalho? Nós estamos mostrando agora, neste momento."
03/11/1986,Pietro Maria Bardi,381,Pietro Maria Bardi,Eu não sou um artista. Ele é o...
03/11/1986,Pietro Maria Bardi,382,Olney Krüse,"Isso foi uma homenagem para o senhor, não foi uma coisa pública, editada, as pessoas conhecem pouco. Eu achei..."
03/11/1986,Pietro Maria Bardi,383,Pietro Maria Bardi,"Veja, eu em juventude, aos vinte anos fiz muitas coisas, fiz muitas coisas, até fiz um jornal humorístico na cidade de Bérgamo. Então, fazia até sua caricatura, fazia caricatura, depois..."
03/11/1986,Pietro Maria Bardi,384,Rodolpho Gamberini,Deixou isso?
03/11/1986,Pietro Maria Bardi,385,Pietro Maria Bardi,"Perdi esse jornal, me transferi para Milão, fui redator de Il Secolo di Milano, do Corriere Della Sera e não fiz mais nada, depois, muitos anos depois, encontro um diretor do Corriere Della Sera com o qual eu briguei, fiz uma caricatura dele que fiz volta em vários jornais italianos. Bom..."
03/11/1986,Pietro Maria Bardi,386,[...],Professor...
03/11/1986,Pietro Maria Bardi,387,Pietro Maria Bardi,"Mas isso não é ser artista, artista é quando... o artista faz o dia todo, possivelmente a noite toda, mas não quando faz um desenho assim, qualquer... Foi a Sabina que há certa altura fez este álbum, que o Olney levou aqui, improvisadamente."
03/11/1986,Pietro Maria Bardi,388,Olney Krüse,Mas o senhor fez colagens também professor...
03/11/1986,Pietro Maria Bardi,389,Pietro Maria Bardi,Para me xingar.
03/11/1986,Pietro Maria Bardi,390,Olney Krüse,As colagens da época do Mussolini.
03/11/1986,Pietro Maria Bardi,391,Pietro Maria Bardi,Como?
03/11/1986,Pietro Maria Bardi,392,Olney Krüse,Colagens da época do Mussolini.
03/11/1986,Pietro Maria Bardi,393,Pietro Maria Bardi,Bom...
03/11/1986,Pietro Maria Bardi,394,Olney Krüse,"Tem uma foto, está no livro dele! Ele mostrando a colagem para o Mussolini."
03/11/1986,Pietro Maria Bardi,395,Pietro Maria Bardi,"Veja, aqui eu deveria contar tudo da minha vida, entende."
03/11/1986,Pietro Maria Bardi,396,Olney Krüse,"O senhor fez colagens, fez desenho, fez pintura."
03/11/1986,Pietro Maria Bardi,397,Pietro Maria Bardi,"A minha vida começou aos 17 anos, aos 17 anos eu publico, em uma grande editora de Milão, Avante, o meu primeiro livro. Estava com 17 anos, tenho vergonha, até este momento, de evocar esse livro, que é dedicado a um filósofo inglês, Jeremy Bentham, o qual eu, menino, adorava ler esse tal e me espelhava muito nesse filósofo inglês que aos três anos falava correntemente o inglês, aos onze anos era comentarista das obras de Fenelon, e no fim dos anos de 1700 era a personagem mais importante da Inglaterra. Eu, namorando esse filósofo, descobri que um autor italiano da mesma época, Giandomenico Romagnosi, tinha publicado as suas obras em italiano, li um famoso ensaio dele sobre as colônias, era um inglês contra o colonialismo. Então, eu publiquei, esse meu primeiro trabalho. De lá para cá, fiz muitas coisas, e a última justamente é esse livro, 40 anos de Masp, que é uma reportagem sobre todo esse trabalho, que fiz unicamente com o Chateaubriand, até que o Chateaubriand foi vivo, e depois me botei nos ombros este museu, que ainda hoje está ainda, de vez em quando publico algum livro, nunca perdi o vício, a mania de ser jornalista... e na revista Senhor, depois de anos, eu faço cada semana uma página."
03/11/1986,Pietro Maria Bardi,398,[...],Eu queria falar uma coisa sobre isso.
03/11/1986,Pietro Maria Bardi,399,Rodolpho Gamberini,"Só um lembrete, só um lembrete Petit, eu gostaria que você fosse extremamente breve porque nós estamos terminando o programa."
03/11/1986,Pietro Maria Bardi,400,Francesc Petit,Uma perguntinha rápida e do momento.
03/11/1986,Pietro Maria Bardi,401,Pietro Maria Bardi,Sim.
03/11/1986,Pietro Maria Bardi,402,Francesc Petit,"Dos candidatos para governador de São Paulo, qual o senhor gostaria que ganhasse para ajudar o museu?"
03/11/1986,Pietro Maria Bardi,403,Pietro Maria Bardi,"Veja, eu não penso que um governador deva ajudar o museu, penso que um governador deva cuidar do estado."
03/11/1986,Pietro Maria Bardi,404,Milton Mesquita,"Professor Bardi em quem o senhor gostaria de dar o próximo golpe, o senhor já deu um golpe no Adhemar o senhor quer dar em quem agora?"
03/11/1986,Pietro Maria Bardi,405,Pietro Maria Bardi,Obviamente eu vou votar o dia quinze para...
03/11/1986,Pietro Maria Bardi,406,Aldemir Martins,"Não professor Bardi, eu quero saber o próximo golpe. Não o voto, o golpe, o senhor deu um golpe no Adhemar para conseguir o Masp e, agora, o próximo golpe, qual seria que o senhor gostaria de dar?"
03/11/1986,Pietro Maria Bardi,407,Pietro Maria Bardi,"Veja, é de encontrar um Chateaubriand."
03/11/1986,Pietro Maria Bardi,408,Rodolpho Gamberini,Ele não vai então.
03/11/1986,Pietro Maria Bardi,409,Aldemir Martins,"Fica difícil porque não existe mais jagunço, o único jagunço ficou beato, que era o Julião, o Julião lá no Recife. Não tem mais jagunço, acabou o jagunço, acabou o Chateaubriand."
03/11/1986,Pietro Maria Bardi,410,Pietro Maria Bardi,Encontro...
03/11/1986,Pietro Maria Bardi,411,Maria Bonomi,"Professor posso perguntar uma coisa, desculpe, o senhor publicou um artigo onde o senhor sugere ao senhor Roberto Marinho, não estou sugerindo que seja o novo Chateaubriand..."
03/11/1986,Pietro Maria Bardi,412,[...],É melhor o filho dele que é mais moço.
03/11/1986,Pietro Maria Bardi,413,Maria Bonomi,"Sugeriu a ele que fizesse esse horário Globo cultural etc, etc. Achei um artigo da maior importância. Alguém percebeu, alguém lhe falou sobre esse artigo, houve alguma resposta, é um apelo belíssimo, é uma consideração, uma indagação?"
03/11/1986,Pietro Maria Bardi,414,Aldemir Martins,"Não existe, a Globo tem ódio de cultura, o pessoal que dirige, o Boni, esse pessoal todo que dirige a Globo..."
03/11/1986,Pietro Maria Bardi,415,Maria Bonomi,"Mas veja bem, o Chateaubriand era um homem que ficou e permaneceu por causa do museu, será que toda essa gente não está sentindo a possibilidade? Quer dizer, essa expressão cultural que é o museu é permanência do Chateaubriand no tempo."
03/11/1986,Pietro Maria Bardi,416,Aldemir Martins,"Maria você sempre teve dinheiro, nunca se preocupou com dinheiro, mas esse pessoal que trabalha na Globo foram todos muitos pobres, todos eles querem dinheiro, querem dinheiro. Eu vou contar uma história do Chateaubriand. O professor Bardi está contando muita história eu vou contar uma."
03/11/1986,Pietro Maria Bardi,417,Pietro Maria Bardi,Maria...
03/11/1986,Pietro Maria Bardi,418,Rodolpho Gamberini,Deixa o professor responder.
03/11/1986,Pietro Maria Bardi,419,Pietro Maria Bardi,"Veja, você falou do Marinho. Quando existia o Chateaubriand não se batizava quadro na casa do..."
03/11/1986,Pietro Maria Bardi,420,Aldemir Martins,Roberto Marinho.
03/11/1986,Pietro Maria Bardi,421,Pietro Maria Bardi,"Do Marinho, no Rio. Eu tentei várias vezes escrever a ele, se podia dar uma mão, vamos dizer, com a TV Globo, não? Para o nosso museu, nunca recebi resposta. Se vê que a carta da gente é importante, acaba com um secretário, o secretário decide se informa o padrão."
03/11/1986,Pietro Maria Bardi,422,Aldemir Martins,Exatamente. É o secretário que decide.
03/11/1986,Pietro Maria Bardi,423,Pietro Maria Bardi,"Então, se vê que esse secretário nunca informou o patrão e nunca tive mais também..."
03/11/1986,Pietro Maria Bardi,424,Maria Bonomi,"No seu artigo, falou da maior importância."
03/11/1986,Pietro Maria Bardi,425,[...],Eu já ouvi falar dessa história do Marinho.
03/11/1986,Pietro Maria Bardi,426,Pietro Maria Bardi,"Que ajuda inúmeras instituições, não?"
03/11/1986,Pietro Maria Bardi,427,Rodolpho Gamberini,"Senhor Bardi, eu agradeço muito a sua entrevista, mas infelizmente nosso tempo está esgotado."
03/11/1986,Pietro Maria Bardi,428,Pietro Maria Bardi,Mas eu não falei nada.
03/11/1986,Pietro Maria Bardi,429,Rodolpho Gamberini,"Falou bastante, falou bastante."
03/11/1986,Pietro Maria Bardi,430,Aldemir Martins,"Mais dez minutos, mais dez minutos! Não vale a pena?"
03/11/1986,Pietro Maria Bardi,431,Rodolpho Gamberini,Mais dez minutos a nossa programação estará em outro. Eu quero...
03/11/1986,Pietro Maria Bardi,432,Aldemir Martins,"Cultura, mas quando se fala em cultura..."
03/11/1986,Pietro Maria Bardi,433,Rodolpho Gamberini,"Durante uma hora e vinte minutos ou mais, nós começamos às dez e vinte, nós falamos de cultura."
03/11/1986,Pietro Maria Bardi,434,Aldemir Martins,"Imagina se você trabalhasse, se fosse funcionário público."
03/11/1986,Pietro Maria Bardi,435,Rodolpho Gamberini,Eu agradeço muito a presença de todos vocês neste programa. O senhor quer falar?
03/11/1986,Pietro Maria Bardi,436,Pietro Maria Bardi,"Corte muitas coisas, ah!"
03/11/1986,Pietro Maria Bardi,437,Rodolpho Gamberini,Como?
03/11/1986,Pietro Maria Bardi,438,Pietro Maria Bardi,Corte muitas coisas!
03/11/1986,Pietro Maria Bardi,439,Rodolpho Gamberini,Não é possível cortar está tudo no ar. O programa é ao vivo.
03/11/1986,Pietro Maria Bardi,440,Pietro Maria Bardi,Eu disse também alguma besteira?
03/11/1986,Pietro Maria Bardi,441,Rodolpho Gamberini,"Não disse besteira nenhuma. Como eu disse então, está terminado aqui o Roda Viva de hoje!"
03/11/1986,Pietro Maria Bardi,442,[...],
03/11/1986,Pietro Maria Bardi,443,Rodolpho Gamberini,"Nós voltamos segunda-feira que vem às dez e vinte da noite. Boa noite, obrigado."
03/11/1986,Pietro Maria Bardi,444,[...],"Em 1992, Pietro Maria Bardi publicou seu 50º e último livro. No mesmo ano, perdeu a mulher, Lina Bo Bardi, arquiteta com projetos famosos, inclusive o do Masp. Em 1996, afastou-se do comando do museu, onde ficou por 43 anos. Morreu em 1999 pouco antes de completar um século de existência, deixando os bens acumulados pelo casal para duas fundações."
