DATA,ENTREVISTA,ORDEM,LOCUTOR,FALA
03/11/1986,Pietro Maria Bardi,108,Rodolpho Gamberini,"Nos principais museus do mundo, nos museus de Nova Iorque, nos museus de Paris, nos museus de Tóquio, os quadros também não têm seguro? É desnecessário ter o seguro?"
03/11/1986,Pietro Maria Bardi,109,Pietro Maria Bardi,"O senhor fala dos Estados Unidos, os Estados Unidos é outra coisa. Quando pensa que tem um único museu que pode gastar a custo de obras, aquisição de obras setenta milhões de dólares, em um ano, quando pensa que o Metropolitan tem cada ano seis milhões de visitantes. Lá..."
03/11/1986,Pietro Maria Bardi,110,Rodolpho Gamberini,Os números são outros.
03/11/1986,Pietro Maria Bardi,111,Pietro Maria Bardi,... lá é um fato completamente fora do nosso círculo.
03/11/1986,Pietro Maria Bardi,112,Carlos Von Schmidt,"Professor, mesmo assim, no Museu de Arte Moderna de Nova Iorque, foi queimado um Portinari que nunca se tomou conhecimento no Brasil e que até hoje não foi reposto."
03/11/1986,Pietro Maria Bardi,113,Pietro Maria Bardi,"Bom, este é um fato que eu ignoro, eu não sei, entende?"
03/11/1986,Pietro Maria Bardi,114,Rodolpho Gamberini,Professor...
03/11/1986,Pietro Maria Bardi,115,Radha Abramo,"Eu gostaria de levantar um problema que é o seguinte: o senhor disse que, quando o senhor chegou aqui, a população não tinha hábito de ver obra de arte. Entretanto, as casas de inúmeras famílias que tinham status econômico melhor tinham esses quadros, tanto é que esses quadros, muitos deles foram para o Museu de Arte de São Paulo. Agora, eu queria também lembrar que na Pinacoteca... existia a Pinacoteca do estado com obras de artistas brasileiros esplêndidos que depois o senhor, inclusive, há muitos deles, o senhor conseguiu comprar para o Museu de Arte. Então, o problema que eu queria levantar é o seguinte: eu tenho a impressão - aliás, eu não quero afirmar-, mas eu tenho a impressão que o que o senhor trouxe para o Brasil, para São Paulo, com o Museu de Arte, foi mais uma mudança de comportamento, que fez com que as pessoas prestassem mais atenção e pudessem estudar, porque foram os cursos do museu, exatamente, os vários cursos que o senhor fez, que despertou à população mais jovem a respeito da importância da obra de arte, da cultura. O que o senhor me diz disso?"
03/11/1986,Pietro Maria Bardi,116,Pietro Maria Bardi,"Veja Radha, para você ver, em 1947, quando nós abrimos o museu - era menina e não pode lembrar-, mas o nosso museu foi aberto com uma sala mais importante dedicada à exposição didática de história de arte."
03/11/1986,Pietro Maria Bardi,117,Radha Abramo,"Pois é, mas isso é que eu quero dizer."
03/11/1986,Pietro Maria Bardi,118,Pietro Maria Bardi,Fizemos de tudo para...
03/11/1986,Pietro Maria Bardi,119,Aldemir Martins,"O curso de fotografia, o curso de design, tinha sessão de pintura..."
03/11/1986,Pietro Maria Bardi,120,Maria Bonomi,"Os critérios de formação da coleção foram didáticos, professor? O senhor percebeu que o Brasil era um país doente de ausência de arte clássica, então o senhor terminou..."
03/11/1986,Pietro Maria Bardi,121,Pietro Maria Bardi,"O Brasil era um país novo, novo a esse tipo de problema, apesar de que existiam duas instituições, aliás, três instituições muito importantes: o Liceu de Artes e Ofícios, que funcionava muito bem ainda no seu tempo - e hoje sei que funciona ainda muito bem-; a Pinacoteca do Estado, que finalmente agora instituiu também as exposições periódicas; existia também o Museu do Ipiranga, do ponto de vista histórico, um museu muito importante, especialmente para a história de São Paulo."
03/11/1986,Pietro Maria Bardi,122,Maria Bonomi,A pergunta é o critério da formação da coleção.
03/11/1986,Pietro Maria Bardi,123,Pietro Maria Bardi,"Chegava-se com um novo museu de tipo completamente diferente, que além de apresentar obra, instituía a escola. Nós começamos com escolas, escolas e em três anos, nos primeiros três anos nós recrutamos cerca de mil alunos, tinha escola de música, nós fizemos a primeira orquestra juvenil que tocou..."
03/11/1986,Pietro Maria Bardi,124,Maria Bonomi,Minha primeira exposição foi em uma coletiva no Museu de Arte em 1952.
03/11/1986,Pietro Maria Bardi,125,Pietro Maria Bardi,"Nós instituímos a primeira escola no Brasil de design, fizemos a primeira escola no Brasil de propaganda, que é atual escola que se chama de Superior de Propaganda e Marketing."
03/11/1986,Pietro Maria Bardi,126,[...],Os cursos de gravura.
03/11/1986,Pietro Maria Bardi,127,Pietro Maria Bardi,"Nós fizemos de tudo, mas eram todas coisas feitas para formar uma mentalidade."
03/11/1986,Pietro Maria Bardi,128,Maria Bonomi,"Perceber as obras que o senhor estava trazendo, no fundo foi um preparatório para conseguir consumir e divulgar as obras que seriam um acervo do museu, havia um critério assim."
03/11/1986,Pietro Maria Bardi,129,Carlos Von Schmidt,"Professor o senhor disse que foi um mero ajudante do Chateaubriand, eu não concordo com isso porque o Chateaubriand teve um olho incrível para encontrar o senhor. Como isso aconteceu?"
03/11/1986,Pietro Maria Bardi,130,Pietro Maria Bardi,"Veja, neste livro que é de agora, 40 anos de Masp, eu conto como eu encontrei o Chateaubriand, porque o Chateaubriand pela verdade me deu carta branca porque disse: “Eu não entendo de mercado”. Pode ser que o Chateaubriand me escolheu, porque eu sei ver se uma obra é de tal autor, ou se não é de tal autor, mas repito, eu não sou um professor de nada, não sou um crítico de arte, então, é verdade que eu não sou nem inscrito na Associação de Críticos de Arte."
03/11/1986,Pietro Maria Bardi,131,[...],Ele sempre diz isso.
03/11/1986,Pietro Maria Bardi,132,Radha Abramo,"Mas professor o primeiro curso de história da arte que eu fiz, foi com o senhor."
03/11/1986,Pietro Maria Bardi,133,[...],Que nós fizemos.
03/11/1986,Pietro Maria Bardi,134,Radha Abramo,Nós todos fizemos.
03/11/1986,Pietro Maria Bardi,135,[...],
03/11/1986,Pietro Maria Bardi,136,Pietro Maria Bardi,Naturalmente.
03/11/1986,Pietro Maria Bardi,137,Radha Abramo,E vou lhe dizer uma coisa...
03/11/1986,Pietro Maria Bardi,138,[...],O senhor é responsável por parte de todos que estão aqui.
03/11/1986,Pietro Maria Bardi,139,Pietro Maria Bardi,"Eu aproveitei, aproveitei de ser um professor, mas eu não sou um professor de nada! Juro que não sou professor de nada! Eu fiz a primeira classe primária, a segunda classe primária, foi a terceira classe primária, repeti a terceira, repeti mais uma vez pela terceira vez! E depois me deram um pontapé, eu sai da escola e praticamente me engenhei a ser um..."
03/11/1986,Pietro Maria Bardi,140,Radha Abramo,Um grande jornalista.
03/11/1986,Pietro Maria Bardi,141,Pietro Maria Bardi,Um autodidata.
03/11/1986,Pietro Maria Bardi,142,Radha Abramo,O senhor exerceu a profissão de jornalista durante muito tempo.
03/11/1986,Pietro Maria Bardi,143,Pietro Maria Bardi,Naturalmente...
03/11/1986,Pietro Maria Bardi,144,Radha Abramo,"E foi um dos maiores experts naquela ocasião em arquitetura, porque o senhor trabalhava muito com arquitetura."
03/11/1986,Pietro Maria Bardi,145,Pietro Maria Bardi,Eu fico... De juventude...
03/11/1986,Pietro Maria Bardi,146,Maria Bonomi,A gente sabe tudo do senhor!
03/11/1986,Pietro Maria Bardi,147,Radha Abramo,Eu conheço a sua vida professor!
03/11/1986,Pietro Maria Bardi,148,Rodolpho Gamberini,"Senhor Bardi, entre as várias pessoas que gostariam de fazer perguntas para o senhor, nós gravamos algumas perguntas, eu gostaria que o senhor respondesse agora uma pergunta gravada do artista plástico Aguilar, a pergunta entra por ali, naqueles monitores ali em cima, vamos ver, ele vai fazer a pergunta para o senhor."
03/11/1986,Pietro Maria Bardi,149,[VT de José Roberto Aguilar ],"A pergunta é mais ou menos a seguinte, a gente conseguiu fazer várias bienais, muitas bienais aconteceram, mas o poder, o poder de levar a arte brasileira para fora, o poder de barganhar influências, de fixar uma dignidade artística, um intercâmbio maior não aconteceu até agora. Talvez esta mentalidade de receber tudo e dar tudo e não ter a suficiente dignidade, ou a suficiente segurança de impor um intercâmbio artístico. O que o senhor acha disso?"
03/11/1986,Pietro Maria Bardi,150,Pietro Maria Bardi,"Bom, naturalmente eu fiz o que pude fazer para projetar o nosso museu no exterior. E consegui, como eu disse, em 1953, com uma série de exposições que deram a volta na Europa e nos Estados Unidos. Hoje, nós já fizemos grandes exposições no Japão, nós fomos muito bem aceitos para a exposição e, neste momento, nossa coleção, que é a coleção de todos os bronze de Edgar Degas, que temos a coleção completa, está sendo apresentada no Campidoglio em Roma, na sala em honra dos Orazi e Curiazi. Já foi exposta em palácios, agora vai para Milão, é pedido para o museu de, é pedida para o museu de Munique, é pedido nada menos, senhor tribunal, para o museu Marmottan, de Paris, porque a coleção que nós temos de todos os bronze de Degas nunca foi vista em Paris, completa, e nós temos a coleção competa! Isso aqui foi, que chamam os italianos, de alzata dispare, porque eu, em 1947, sempre com Chateaubriand, porque sempre dizia a ele que eu queria comprar para o museu, nós compramos a preço de banana a coleção completa dos bronze de Degas, como compramos essa grande coleção Imbert de porcelana e de cerâmica italiana da Renascença, que está na Pinacoteca, como conseguimos comprar muitas obras que, com o tempo, se valorizaram. Naturalmente, esse arquivo, o jeito nosso era de mostrar que o país tinha uma posição em museologia não indiferente, tanto aqui como na Pinacoteca, de como o fato de instrução, como o fato de difusão cultural, nós conseguimos fazer essa escola, fazer o primeiro desfile de moda."
03/11/1986,Pietro Maria Bardi,151,[...],Brasileira?
03/11/1986,Pietro Maria Bardi,152,[...],De moda brasileira.
03/11/1986,Pietro Maria Bardi,153,Pietro Maria Bardi,"O primeiro foi de Christian Dior. Foi quando eu pedi, através de Christian Dior, para obter um traje desenhado pelo Salvador Dali, que ainda está na nossa coleção, depois."
03/11/1986,Pietro Maria Bardi,154,[...],"O manequim preto, não é?"
03/11/1986,Pietro Maria Bardi,155,Pietro Maria Bardi,"Depois, tentei ingenuamente lançar a moda brasileira."
03/11/1986,Pietro Maria Bardi,156,Aldemir Martins,Com manequim negro.
03/11/1986,Pietro Maria Bardi,157,Pietro Maria Bardi,Como?
03/11/1986,Pietro Maria Bardi,158,Aldemir Martins,"Com manequim negro, que não tinha acontecido."
03/11/1986,Pietro Maria Bardi,159,Pietro Maria Bardi,"As coisas que nós fizemos no nosso museu foram numerosas, foram várias, foram... Pode ser mais não de um museólogo, porque não sou absolutamente museólogo, mas de um jornalista que aproveitava de ver várias manifestações e, inclusive, quando mais se via um museu de faz exposição de um jornal, nós fizemos a exposição do Jornal da Tarde, uma das exposições mais importantes que nós tivemos como adesão de público, entende? E neste momento eu estou projetando as exposições do próximo ano, que são projeções muito importantes porque a primeira será uma exposição que eu tive da IBM de todos os desenhos de Leonardo para máquina transformados em maquete, em maquete funcional. E nós, no próximo ano vamos fazer grandes exposições, espero poder fazer o centenário da imigração italiana, porque eu me sinto um tal de imigrado, será uma exposição muito importante, vamos fazer uma grande exposição de design, vamos fazer uma exposição da propaganda juntamente com a Escola Superior de Propaganda e Marketing, vamos fazer uma série de exposições que consagraria um pouco todo o trabalho que nós fizemos, seja na Sete de Abril, em um andar, depois num segundo andar, depois no terceiro andar, depois num quarto andar, até dar o golpe que nós demos no Adhemar de Barros, que quando eu vi que ia destruir o clube lá do Trianon, eu disse para doutor Assis: “Doutor Assis, nós vamos fazer o museu lá”. “Mas como assim?”. “Veja, o senhor consiga o território, depois nós vamos saber”."
03/11/1986,Pietro Maria Bardi,160,Rodolpho Gamberini,"Senhor Bardi, aproveitando..."
03/11/1986,Pietro Maria Bardi,161,Pietro Maria Bardi,"Com o Chateaubriand, nós fomos lá."
03/11/1986,Pietro Maria Bardi,162,Rodolpho Gamberini,"Senhor Bardi, aproveitando, eu queria o senhor continuasse nessa linha, mas tem uma pergunta de um telespectador, o senhor Carlos Alberto Soares, do Tucuruvi, que entra exatamente nessa linha, o senhor disse que o senhor Assis Chateaubriand conseguia doações das pessoas mais ricas da sociedade em dinheiro. Como ele conseguia isso, será por causa do poder que ele tinha por causa da imprensa que ele tinha na mão, a imprensa mais importante na época? Como é que foi ests caso mais específico do Adhemar e como ele trabalhava os ricos para dar dinheiro ao museu?"
03/11/1986,Pietro Maria Bardi,163,Pietro Maria Bardi,"Veja, o Chateaubriand era um prepotente."
03/11/1986,Pietro Maria Bardi,164,Maria Bonomi,Os fins justificam os meios.
03/11/1986,Pietro Maria Bardi,165,Rodolpho Gamberini,Deixa ele responder.
03/11/1986,Pietro Maria Bardi,166,Pietro Maria Bardi,"Ele era um prepotente. Nós fomos com o Edmundo Monteiro, que era do Diários Associados, que hoje é o atual presidente do museu, Adhemar de Barros para pedir ao Adhemar de Barros não só o Trianon, não, mas que o próprio município construísse um museu para nós com dona Lina. Feito lá o projeto, nós apresentamos ao Adhemar de Barros. O Adhemar de Barros se vê que não entendia muito de arquitetura, pensava que era um projeto do Oscar Niemeyer, com dona Lina presente, entende?"
03/11/1986,Pietro Maria Bardi,167,Rodolpho Gamberini,Nem explicando ele não entendeu?
03/11/1986,Pietro Maria Bardi,168,Pietro Maria Bardi,"Bem ou mal, sendo secretário de obra dele o José de Figueiredo Ferraz, que foi um extraordinário engenheiro que deu vida, que deu a situação estática do nosso museu, sendo secretário de Finanças - esse, que agora é o chefão do Bradesco-, Amador Aguiar..."
03/11/1986,Pietro Maria Bardi,169,Rodolpho Gamberini,Amador Aguiar?
03/11/1986,Pietro Maria Bardi,170,Pietro Maria Bardi,"... conseguiu começar a fazer esse museu, que durou para três, três “eras prefeito”, finalmente o último prefeito, que foi o Faria Lima. Nós tivemos a idéia de convidar a rainha Elisabeth para inaugurar o prédio. As obras foram muito..."
03/11/1986,Pietro Maria Bardi,171,[...],Aceleradas?
03/11/1986,Pietro Maria Bardi,172,Pietro Maria Bardi,"Acabadas. A rainha Elisabeth veio para inaugurar o prédio, sempre merecimento do senhor Chateaubriand, porque o Chateaubriand foi embaixador em Londres e a rainha tinha muita simpatia por ele, que era um brasileiro muito culto, muito inteligente e muito espirituoso."
03/11/1986,Pietro Maria Bardi,173,Radha Abramo,"Professor, qual o projeto que o senhor não conseguiu realizar ainda?"
03/11/1986,Pietro Maria Bardi,174,Pietro Maria Bardi,"Bom, naturalmente, os projetos que eu não consegui fazer são inúmeros, porque de vez em quando vem na cabeça “Vamos fazer isso!”, mas nós, para fazermos coisas, precisamos sempre de um patrocinador, porque sem o patrocinador nós não podemos fazer nada em nosso museu."
03/11/1986,Pietro Maria Bardi,175,Rodolpho Gamberini,"Senhor Bardi, eu vou pedir sua licença e todos que estão participando do Roda Viva para a gente fazer um intervalo pequenininho e daqui a pouquinho a gente volta e continua a conversa. Até já."
03/11/1986,Pietro Maria Bardi,176,[...],
03/11/1986,Pietro Maria Bardi,177,Rodolpho Gamberini,"Nós voltamos então com o Roda Viva, programa de entrevistas da TV Cultura. Pietro Maria Bardi, diretor do Masp, nosso entrevistado desta noite. Senhor Bardi, a próxima pergunta eu gostaria que o senhor respondesse ao Olney Krüse, crítico de arte, por favor."
03/11/1986,Pietro Maria Bardi,178,Olney Krüse,"Num país como o Brasil, onde nem mesmo uma simples..."
03/11/1986,Pietro Maria Bardi,179,Pietro Maria Bardi,"Antes de tudo a minha homenagem, que você veio de gravatinha, todo vestidinho muito bem! Bravo, bravo!"
03/11/1986,Pietro Maria Bardi,180,Olney Krüse,"Professor, eu tenho dificuldade em falar, em organizar meu pensamento verbalmente. Então, fiz minha pergunta por escrito, mas antes tem uma pequena introdução, é a seguinte: num país como o Brasil, onde nem mesmo uma simples atriz popular, eu falo de Fernanda Montenegro, quis ocupar o cargo de ministro da Cultura, o último a ser preenchido no governo da Nova República do presidente José Sarney, é muito confortador saber na origem da festa de hoje estão dois grandes jornalistas: Assis Chateaubriand e Pietro Maria Bardi. O senhor, aos setenta, jornalista, ainda hoje, começou com 17 anos. Tenho muito respeito por esse lado do senhor também! Foram eles que criaram o Masp, sem nenhum medo de assumir os problemas da cultura num país onde ela não é valorizada, digo festa porque estamos aqui reunidos em torno da celebração dos quarenta anos do Museu de Arte de São Paulo, o nosso querido Masp, o museu de arte ocidental mais importante da América Latina e a festa é dupla não apenas para lembrar que foram dois jornalistas que o fundaram, um fato sempre pouco lembrado ou intencionalmente omitido e porque somos nós, jornalistas, quase a maioria aqui nesta noite. Isto posto, peço licença a todos os companheiros para também agradecer ao professor Bardi antes de lhe fazer três perguntas, a inclusão no seu livro de 40 anos do Masp de dois fatos marcantes da história do museu nos quais eu estou envolvido como jornalista e dos quais eu muito me orgulho: os vinte anos do Jornal da Tarde. Pela primeira vez no mundo se fez isso, e a mostra de 1984, porque nem a culta Alemanha que é muito mais culta do que nós, de onde vem esta palavra com este significado, tem um museu com oitocentas peças catalogadas como tem o senhor. Primeira pergunta: Em 18 anos de amizade, convívio profissional com o senhor eu nunca o ouvi falar de Deus em nossas inúmeras entrevistas. Como é que o senhor vê Deus? O senhor nunca falou de Deus. Eu queria saber o que o senhor pensa de Deus, porque o resto eu já sei demais."
03/11/1986,Pietro Maria Bardi,181,Pietro Maria Bardi,"Veja, é um fato tão, tão imenso, tão histórico, tão novo, tão futuro, que praticamente não seria, não saberia o que pensar, entende?"
03/11/1986,Pietro Maria Bardi,182,[...],
03/11/1986,Pietro Maria Bardi,183,Olney Krüse,O senhor é um homem religioso?
03/11/1986,Pietro Maria Bardi,184,[...],
03/11/1986,Pietro Maria Bardi,185,[...],É uma pessoa modesta.
03/11/1986,Pietro Maria Bardi,186,Olney Krüse,"O senhor é um homem religioso? Nós nunca falamos sobre isso, o senhor é um homem religioso, professor?"
03/11/1986,Pietro Maria Bardi,187,Pietro Maria Bardi,"Veja, eu me casei duas vezes, não me casei na igreja. Aqui, ser religioso ou não, não sei. Porque nasci e repito, fui autodidata, me formei sozinho, me formei sozinho e, na verdade, nunca tive tempo de pensar no além de lá. Só, e já dei dois “alô” ao Chateaubriand, porque eu penso que..."
03/11/1986,Pietro Maria Bardi,188,[...],Está ouvindo...
03/11/1986,Pietro Maria Bardi,189,Pietro Maria Bardi,"Alguma coisa deve estar em cima de nós, não é?"
03/11/1986,Pietro Maria Bardi,190,Olney Krüse,"Segunda pergunta professor, eu nunca vi o senhor doente, o senhor tem 87 anos e o senhor nunca ficou mais de uma semana longe do Masp, eu queria que o senhor contasse para gente o segredo dessa vitalidade do senhor?"
03/11/1986,Pietro Maria Bardi,191,Pietro Maria Bardi,"Bom, eu naturalmente tive a sorte de não ter nunca um resfriado, uma dor de cabeça."
03/11/1986,Pietro Maria Bardi,192,Olney Krüse,Sim.
03/11/1986,Pietro Maria Bardi,193,Pietro Maria Bardi,"Essas coisas que parecem que são tão comuns, pode ser que seja um jeito de vida,que eu faço muito regular, que não fumo, não bebo, durmo cedo, me levanto cedo, trabalho o dia todo, bom, naturalmente penso que isso aqui seja, também, uma compensação de ter feito sempre coisas regulares."
03/11/1986,Pietro Maria Bardi,194,Olney Kruse,"Terceira e última pergunta, esta é provocadora, quem é o maior pintor brasileiro vivo? O paulista José Antônio da Silva ou o italiano Alfredo Volpi."
03/11/1986,Pietro Maria Bardi,195,Pietro Maria Bardi,"Veja, eu tenho grandíssimo respeito para o Volpi, segui o Volpi depois de quarenta anos da escola que tinha do grupo de Santa Helena a sua transformação que chamam de geométrica, mas que eu absolutamente não posso definir geométrica, tenho grande respeito para isso, menino."
03/11/1986,Pietro Maria Bardi,196,Olney Krüse,José Antônio da Silva?
03/11/1986,Pietro Maria Bardi,197,Pietro Maria Bardi,"José Antônio da Silva que eu mesmo descobri, perto..."
03/11/1986,Pietro Maria Bardi,198,Olney Krüse,"Porque uma vez o senhor me disse... Há cerca de oito anos atrás o senhor me disse que ele era o maior pintor brasileiro vivo. É uma perguntinha boba esse negócio de maior ou melhor, mas existe e eu queria..."
03/11/1986,Pietro Maria Bardi,199,Pietro Maria Bardi,"Eu digo tantas coisas, não é, quando eu digo..."
03/11/1986,Pietro Maria Bardi,200,Olney Krüse,"Entre os dois, professor Bardi, bem objetivo, entre os dois, o Volpi ou José Antônio da Silva?"
03/11/1986,Pietro Maria Bardi,201,Pietro Maria Bardi,"Bom, a minha..."
03/11/1986,Pietro Maria Bardi,202,Olney Krüse,É a resposta do senhor.
03/11/1986,Pietro Maria Bardi,203,Pietro Maria Bardi,"A minha preferência é para o José Antônio da Silva, porque..."
03/11/1986,Pietro Maria Bardi,204,Olney Krüse,Muito obrigado.
03/11/1986,Pietro Maria Bardi,205,Pietro Maria Bardi,... porque ele é uma expressão popular.
03/11/1986,Pietro Maria Bardi,206,Olney Krüse,"Se a produção me permite, Rodolpho, eu acho que o Masp está fazendo quarenta anos e a gente está aqui também por isso, mas eu trouxe uma surpresa para o professor, não sei como ele vai reagir, e acho... O presente seria para o telespectador. Há alguns anos atrás, não sei se quatro ou cinco, a Sabina de Libman, amiga comum nossa que dirige arte aplicada, editou, sob a forma de gravuras, um álbum de desenho do professor Bardi. Está aqui, se você quiser mostrar, presente para o telespectador durante o nosso..."
03/11/1986,Pietro Maria Bardi,207,Rodolpho Gamberini,"Camargo, cadê o Camargo."
03/11/1986,Pietro Maria Bardi,208,Pietro Maria Bardi,Já esqueci.
03/11/1986,Pietro Maria Bardi,209,Olney Krüse,"Mas eu acho que seria simpático mostrar o lado desenhista do professor, durante o nosso encontro, debate aqui."
03/11/1986,Pietro Maria Bardi,210,Rodolpho Gamberini,Vamos mostrar.
03/11/1986,Pietro Maria Bardi,211,[...],Por favor.
03/11/1986,Pietro Maria Bardi,212,[...],"Vamos mostrar, então!"
03/11/1986,Pietro Maria Bardi,213,Olney Krüse,"Muito obrigado, sobretudo pela última resposta que o senhor me deu."
03/11/1986,Pietro Maria Bardi,214,Pietro Maria Bardi,Me envergonho de ter desenhado...
03/11/1986,Pietro Maria Bardi,215,Rodolpho Gamberini,"Por favor, abra professor, enquanto o senhor vai abrindo... O Camargo abre para o senhor, em seguida a gente mostra. O Darcy tem uma pergunta para fazer para o senhor."
03/11/1986,Pietro Maria Bardi,216,Darcy Penteado,"Bardi, a minha pergunta mais ou menos completa a do Olney. É o seguinte: eu acho que você é uma pessoa que não tem idade, eu também acho que eu não tenho, como nenhum de nós, a idade é apenas um registro civil. A imagem que o espelho nos mostra, às vezes, é meio contundente, mas é uma imagem que o espelho está dizendo que nós temos, nós não somos obrigados a acreditar, não que seja por vaidade, mesmo caso seu, eu sinto isso. Eu, por exemplo, sinto que a minha idade é a idade de um menino que eu sempre fui, pode ser de um menino milenar. Bom, agora, você realmente, você se fixa numa idade sua dentro de você, não àquilo que o espelho te diz, ou você tem uma idade determinada que você considerou sua idade ideal e parou ali, ou você prefere não ter idade? É um pouco teórica, um pouco vaga."
03/11/1986,Pietro Maria Bardi,217,Pietro Maria Bardi,"Eu penso que a idade nunca se pára, quando continua trabalhando o dia todo e vai para frente, não tem idade."
03/11/1986,Pietro Maria Bardi,218,Darcy Penteado,"Mas você, por dentro, tem qual idade: 18 anos, cinco, vinte, 35 ou a idade do seu registro civil?"
03/11/1986,Pietro Maria Bardi,219,Pietro Maria Bardi,"Veja, eu tenho oficialmente 87 anos. Tenho 87 anos, vivi bastante, com vida muito difícil no começo, porque eu venho de uma família pobre. Quando eu fiz a Primeira Guerra Mundial e me nobilitei, eu fiquei vestido de militar ao longo de um mês, porque não tinha o dinheiro para me fazer um traje de burguês, entende? Então, comecei a trabalhar. Hoje, dizem que eu sou uma pessoa não rica, mas..."
03/11/1986,Pietro Maria Bardi,220,[...],Riquíssimo!
03/11/1986,Pietro Maria Bardi,221,Pietro Maria Bardi,"Com algum dinheiro que tenho, justamente porque fiz o mercado de arte, porque eu tenho, ainda, essa possibilidade de ver se um quadro é de tal autor ou se não é. Justamente como aconteceu com o Rafael, eu tive a idéia de comprar o Rafael completamente inédito e de mostrar eu mesmo que se tratava de Rafael. Hoje, o nosso Rafael está em todas as monografias de..."
03/11/1986,Pietro Maria Bardi,222,[...],
03/11/1986,Pietro Maria Bardi,223,[...],"Professor Bardi, estão mostrando seus desenho."
03/11/1986,Pietro Maria Bardi,224,Rodolpho Gamberini,Vamos mostrar o desenho do professor.
03/11/1986,Pietro Maria Bardi,225,Pietro Maria Bardi,É uma...
