DATA,ENTREVISTA,ORDEM,LOCUTOR,FALA
03/11/1986,Pietro Maria Bardi,226,[...],"Professor, qual a avaliação que o senhor faz deste desenho seu que o senhor está vendo aí."
03/11/1986,Pietro Maria Bardi,227,Rodolpho Gamberini,O senhor se acha um bom desenhista?
03/11/1986,Pietro Maria Bardi,228,Pietro Maria Bardi,Estão mostrando esse negócio? Por quê?
03/11/1986,Pietro Maria Bardi,229,[...],Tinha labirintite.
03/11/1986,Pietro Maria Bardi,230,[...],
03/11/1986,Pietro Maria Bardi,231,Pietro Maria Bardi,Porque devo até declarar...
03/11/1986,Pietro Maria Bardi,232,Rodolpho Gamberini,Deve declarar...
03/11/1986,Pietro Maria Bardi,233,Pietro Maria Bardi,"... que a primeira representação de TV neste país foi feita por este sujeito com o Chateaubriand, que chegou de Nova Iorque com um implante de televisão e, nós montamos no nosso museu, na rua Sete de Abril, um gabinete de televisão com um televisor no saguão do Diário, naturalmente em branco e preto. E nós encontramos o frei mexicano Mojica, que cantou alguma canção. Esse foi o primeiro espetáculo de televisão."
03/11/1986,Pietro Maria Bardi,234,Milton Mesquita,"É verdade que Chateaubriand... tinha três câmeras, o Chateaubriand pegou uma garrafa de champagne e chegou numa câmera e “pum”: “Declaro inaugurada a televisão brasileira”, e começou com duas? É verdade que ele quebrou uma câmera na inauguração com uma champagne? Esta história eu vi contada pelo Lima Duarte."
03/11/1986,Pietro Maria Bardi,235,Pietro Maria Bardi,"Não, não..."
03/11/1986,Pietro Maria Bardi,236,Milton Mesquita,O senhor não entendeu?
03/11/1986,Pietro Maria Bardi,237,Pietro Maria Bardi,"Veja, eu já disse que sou meio surdo."
03/11/1986,Pietro Maria Bardi,238,[...],Já meio manco.
03/11/1986,Pietro Maria Bardi,239,Milton Mesquita,"Eu falo um pouco rápido. Quando inauguraram a televisão brasileira, tinham três câmeras e o Chateaubriand, ao inaugurá-la, pegou uma garrafa de champagne e bateu numa das câmaras e começou... Quem contou isso foi o Lima Duarte."
03/11/1986,Pietro Maria Bardi,240,Pietro Maria Bardi,Veja...
03/11/1986,Pietro Maria Bardi,241,[...],Tudo fofoca!
03/11/1986,Pietro Maria Bardi,242,[...],"Boato, boato."
03/11/1986,Pietro Maria Bardi,243,Milton Mesquita,Será que estava fora de foco?
03/11/1986,Pietro Maria Bardi,244,Pietro Maria Bardi,"Porque não se vai fazer uma deste show, dedicado ao senhor Chateaubriand. Eu, veja, eu posso dar dados inéditos sobre o Chateaubriand, o único que sabe bem a vida do Chateaubriand, entende?"
03/11/1986,Pietro Maria Bardi,245,Milton Mesquita,E o Lima Duarte também.
03/11/1986,Pietro Maria Bardi,246,Pietro Maria Bardi,"Naturalmente, o Chateaubriand era um homem único, pense em um tal que chega com um implante de televisão, lança televisão e vira dono dos primeiros dois canais que operaram no Brasil!"
03/11/1986,Pietro Maria Bardi,247,Francesc Petit,"Professor, uma pergunta, o Aguilar fez uma pergunta aqui, hoje à noite, eu acredito que não foi respondida. É sobre a projeção do artista brasileiro no exterior. Por que não houve, ou por que não há uma projeção da arte brasileira no exterior? Então, eu queria lhe fazer uma pergunta baseada na pergunta do Aguilar. O senhor não acha que outro conterrâneo seu, muito importante também, acredito que seu amigo, o Ciccillo Matarazzo fez esta função de projetar o artista brasileiro no exterior?"
03/11/1986,Pietro Maria Bardi,248,Pietro Maria Bardi,"Veja, eu tive grande respeito e grande amizade com o Ciccillo Matarazzo, somente que quando o Ciccillo Matarazzo me disse que lançava uma bienal de arte internacional, eu disse: “Mas como o senhor pode lançar?”. “Ah sim, eu fui em Veneza, peguei o regulamento de Veneza e aplico o regulamento de Veneza.” Eu disse: “Mas veja, o regulamento de Veneza é 1895, faça uma outra coisa, faça uma coisa diferente, faça uma coisa errada mas que seja uma coisa original, uma coisa brasileira.” E ele continuou a fazer essas bienais, aliás, eu dei um dos meus golpes ao Ciccillo, porque quem deveria fazer o museu no Trianon era o Ciccillo, então, é verdade que mandou fazer um projeto por um arquiteto carioca. Mas o Ciccillo não sabia o que eu por acaso sabia, que o território do Trianon era um belvedere e, na doação que alguém fez para o município, do território, era implícito de fazer, de manter o belvedere, então, que eu secretamente disse à dona Lina: “Faça uma coisa no alto e salve o belvedere”. E o Ciccillo dessa coisa, adoeceu. E nós conseguimos, do município, de fazer."
03/11/1986,Pietro Maria Bardi,249,Francesc Petit,"Mas uma pergunta professor, aqui nós estamos diante de alguns premiados da Bienal de São Paulo. E eles melhor do que ninguém poderiam dizer como são respeitados no mundo inteiro por serem premiados da Bienal de São Paulo, ou seja, foi um grande movimento que projetou o pintor brasileiro no exterior, não foi?"
03/11/1986,Pietro Maria Bardi,250,Pietro Maria Bardi,"Bom, naturalmente a Bienal, na minha idéia, tem um erro fundamental, porque é feita com um regulamento de 1895. Eu pensava que poderia ser feita uma bienal com um regulamento, até errado, mas que fosse paulista de 1948, 49, quando ele começou com as bienais. As bienais foram, em certos anos, muito importantes, muito inteligentes e deram a possibilidade a São Paulo de ver o que se fazia no exterior. Vários artistas nossos foram premiados lá, parabéns para esses artistas, o Ciccillo fez um fato muito importante para São Paulo e São Paulo hoje é conhecida fora, não só pelo Museu de Arte em São Paulo, mas também pela Bienal Internacional, em São Paulo, que se faz de dois anos em dois anos. Repito, pela terceira vez, com um regulamento copiado da Bienal de Veneza, de 1895. Felizmente agora vejo que a Sheila Lerner em vez de copiar Veneza, copia um pouco Veneza, porque o fundamento é de Veneza: de pegar, de pedir a cada nação que mande as coisas que acham melhores e um pouco é de Kassel. Kassel é um exposição que é de quatro anos em quatro anos."
03/11/1986,Pietro Maria Bardi,251,[...],"É pesquisa, é outra coisa!"
03/11/1986,Pietro Maria Bardi,252,Pietro Maria Bardi,"Na minha opinião, a Bienal de São Paulo é tudo dinheiro jogado fora!"
03/11/1986,Pietro Maria Bardi,253,Radha Abramo,"Professor, sou eu, o senhor..."
03/11/1986,Pietro Maria Bardi,254,[...],Deixa o Aldemir falar um pouco.
03/11/1986,Pietro Maria Bardi,255,Aldemir Martins,"Agora chegou a minha vez. O Petit falou dos premiados. A projeção que nós temos como premiados de São Paulo é na premiação de Veneza, porque toda premiação na América do Sul e na América do Norte que não passar pela Europa, esta premiação tem só valor de 50%, o meu prêmio e o prêmio da Maria são prêmios dados pela Bienal de Veneza, também, que dá uma triagem ao exterior para ser considerado também um grande artista. A Bienal de São Paulo é o caminho, foi uma escada que foi usada por nós para chegarmos até Veneza, chegar até Veneza, chegar à Europa e chegar possivelmente ao mundo, porque se não fosse a Bienal de Veneza, nós continuaríamos pintores paulistas, verdade ou não?"
03/11/1986,Pietro Maria Bardi,256,Maria Bonomi,"São enfoques diferentes professor, porque o museu Masp trouxe, digamos, toda arte de peso, trouxe toda a tradição para o Brasil e a Bienal trazia o que era experimental no momento. E ela tentou fazer, está tentando fazer, tanto assim que Guernica não veio para o Masp, mas veio para a Bienal. Então, houve muita arte, não tão consagrada como a que está no Masp e isso ficou muito claro, o Masp entrou, digamos, na importância cultural do país pelo peso das obras que aqui estão, que são obras indiscutíveis."
03/11/1986,Pietro Maria Bardi,257,Francesc Petit,"O que eu quis falar não era sobre o que a Bienal trouxe que é muito importante, mas eu queria responder ao que o Aguilar perguntava que foi a projeção que a Bienal deu para vocês, para você e para o Aldemir, o senhor Tàpies tem o maior orgulho do mundo de dizer que é premiado da Bienal de São Paulo. O Pontes tinha o maior orgulho do mundo de dizer..."
03/11/1986,Pietro Maria Bardi,258,Maria Bonomi,"Ele respondeu, o Aldemir respondeu, quer dizer, foi um trampolim para a gente, realmente, o Masp nunca visou este tipo de situação."
03/11/1986,Pietro Maria Bardi,259,[...],"Eu estou com Maria Bonomi, porque eu acho..."
03/11/1986,Pietro Maria Bardi,260,Aldemir Martins,"Perguntaram tanto ao senhor qual o melhor pintor, qual o melhor isso e aquilo, eu vou ser advogado do diabo, qual é o pior pintor brasileiro?"
03/11/1986,Pietro Maria Bardi,261,Pietro Maria Bardi,"Pior? Um tanto assim, assim!"
03/11/1986,Pietro Maria Bardi,262,[...],
03/11/1986,Pietro Maria Bardi,263,Pietro Maria Bardi,"Tem, tem! Tem, hoje, eu penso que só em São Paulo existam dois mil pintores."
03/11/1986,Pietro Maria Bardi,264,Aldemir Martins,Maus?
03/11/1986,Pietro Maria Bardi,265,Pietro Maria Bardi,Péssimos! Naturalmente são todos...
03/11/1986,Pietro Maria Bardi,266,[...],E os críticos de arte professor!
03/11/1986,Pietro Maria Bardi,267,Rodolpho Gamberini,"Professor, o senhor está falando dos maus pintores de São Paulo, o senhor disse que não gosta dos seus trabalhos, eu queria mostrar mais um pouquinho. A gente tem possibilidade de mostrar mais um pouquinho para ver a sua opinião sobre seu trabalho, vamos mostrar um pouquinho. Mostra."
03/11/1986,Pietro Maria Bardi,268,Maria Bonomi,"Dos mortos ou dos vivos, quem foi o que mais entendeu e apoiou o Masp, professor? Mesmo dos críticos mortos, ou críticos vivos, quais os que mais apoiaram e perceberam?"
03/11/1986,Pietro Maria Bardi,269,Pietro Maria Bardi,"Veja, eu não critico os meus colegas, são todos muito bons..."
03/11/1986,Pietro Maria Bardi,270,Maria Bonomi,"Mas quem lhe estendeu a mão e quem jogou pedra? Vamos lavar a roupa professor, quem estendeu a mão e quem lhe jogou pedra. Teve muitos que jogaram pedra por causa de dor de cotovelo, todo mundo queria ser o professor Bardi naquele momento e quem foi que ajudou o senhor, no fundo? Quais foram os críticos que perceberam a importância cultural do Masp, que puseram isso na imprensa?"
03/11/1986,Pietro Maria Bardi,271,Pietro Maria Bardi,"Veja eu costumo não criticar meus colegas, entende?"
03/11/1986,Pietro Maria Bardi,272,Maria Bonomi,"Não é criticar, agradecer."
03/11/1986,Pietro Maria Bardi,273,Pietro Maria Bardi,"Tem crítico de arte em São Paulo, acho excelente, muito bom, aqui nós temos nossa Radha, que um tempo se pegava a Folha de S. Paulo para ver os seus artigos, depois há uma certa altura desapareceu."
03/11/1986,Pietro Maria Bardi,274,Radha Abramo,"Está no Diário Popular, professor."
03/11/1986,Pietro Maria Bardi,275,[...],Quem?
03/11/1986,Pietro Maria Bardi,276,Pietro Maria Bardi,Desapareceu!
03/11/1986,Pietro Maria Bardi,277,Pietro Maria Bardi,"E hoje vejo na Folha de S. Paulo artigo que, publicamente digo, que não me interessa nada. Então, é verdade que na própria Folha, na terceira página nos debates da Folha, eu fiz uma bronca, uma bronca, justamente para quanto se faz de fato de arte nesse importante jornal."
03/11/1986,Pietro Maria Bardi,278,Rodolpho Gamberini,O Milton Mesquita.
03/11/1986,Pietro Maria Bardi,279,Milton Mesquita,"Professor, falando em dar bronca, o senhor lembra aquela vez na outra eleição que o senhor deixou recado no meio do Masp?"
03/11/1986,Pietro Maria Bardi,280,Pietro Maria Bardi,Quê?
03/11/1986,Pietro Maria Bardi,281,Milton Mesquita,"Na outra eleição, na eleição anterior o senhor escreveu uma coisa no Masp, este ano valeu, não estão pichando tanto o Masp."
03/11/1986,Pietro Maria Bardi,282,Pietro Maria Bardi,"Naturalmente, isso aqui são, alzata de gênio, como é que se diz, a alzata de gênio? Como é que se traduz? A alzata de gênio em italiano."
03/11/1986,Pietro Maria Bardi,283,Maria Bonomi,Em italiano é... Em português...
03/11/1986,Pietro Maria Bardi,284,[...],Professor Bardi...
03/11/1986,Pietro Maria Bardi,285,Pietro Maria Bardi,Explosão.
03/11/1986,Pietro Maria Bardi,286,Maria Bonomi,É uma explosão.
03/11/1986,Pietro Maria Bardi,287,Aldemir Martins,Professor Bardi...
03/11/1986,Pietro Maria Bardi,288,Maria Bonomi,Um desabafo.
03/11/1986,Pietro Maria Bardi,289,Aldemir Martins,"O senhor que está tão jovem e lutando tanto ainda em favor do museu, existe um murmúrio que tem dois candidatos a sua substituição, o senhor já preparou esses candidatos ou não?"
03/11/1986,Pietro Maria Bardi,290,Pietro Maria Bardi,"Veja, em uma entrevista que dei ontem que saiu ontem, domingo..."
03/11/1986,Pietro Maria Bardi,291,[...],No Caderno Dois do Estadão.
03/11/1986,Pietro Maria Bardi,292,Pietro Maria Bardi,"No Caderno Dois, disse que São Paulo é uma cidade de onze milhões de habitantes, obviamente deve ter um que será o meu sucessor, não?"
03/11/1986,Pietro Maria Bardi,293,Rodolpho Gamberini,Quem o senhor gostaria que fosse?
03/11/1986,Pietro Maria Bardi,294,Pietro Maria Bardi,"Ainda não encontrei, ainda não."
03/11/1986,Pietro Maria Bardi,295,[...],Por quê?
03/11/1986,Pietro Maria Bardi,296,Rodolpho Gamberini,Quem o senhor gostaria que fosse?
03/11/1986,Pietro Maria Bardi,297,Pietro Maria Bardi,Quê?
03/11/1986,Pietro Maria Bardi,298,Rodolpho Gamberini,Quem o senhor gostaria que fosse o seu sucessor?
03/11/1986,Pietro Maria Bardi,299,[...],Não sabe?
03/11/1986,Pietro Maria Bardi,300,Pietro Maria Bardi,"Veja, a direção de um museu, como o Museu de Arte em São Paulo não é uma direção só qualquer. Precisa ficar lá dez horas por dia, precisa se interessar pela limpeza, precisa se interessar pela parte administrativa, pela parte, vamos dizer, museológica, da conservação, são muitos problemas que precisam de ter uma certa experiência. Não só, depois o cargo de diretor do Museu em São Paulo não é retribuído. Então, acho que precisa se encontrar um voluntário que diga: “Eu faço isso de graça.”"
03/11/1986,Pietro Maria Bardi,301,Rodolpho Gamberini,"Se o senhor pudesse escolher seu sucessor, ou eleger o seu sucessor, usando o jargão de política, o senhor escolheria quem?"
03/11/1986,Pietro Maria Bardi,302,Pietro Maria Bardi,"Veja, neste momento não escolheria ninguém, deixaria ao meu primeiro assistente que é o Luiz Adarqui, que está comigo depois de 35 anos, de continuar a rotina do museu."
03/11/1986,Pietro Maria Bardi,303,Rodolpho Gamberini,"Professor, outra..."
03/11/1986,Pietro Maria Bardi,304,Milton Mesquita,"Continuaria a rotina, ele continuaria a rotina, mas quem seria o novo Bardi, quem traria um sangue novo, quem acharia outro Assis Chateaubriand?"
03/11/1986,Pietro Maria Bardi,305,Pietro Maria Bardi,"Bom, naturalmente eu sempre digo, eu espero de encontrar um outro senhor Assis Chateaubriand, não?"
03/11/1986,Pietro Maria Bardi,306,Aldemir Martins,Mas o senhor está usando o mesmo método que o Assis usou para acabar com o Diários Associados.
03/11/1986,Pietro Maria Bardi,307,Pietro Maria Bardi,"Você sabe, eu muito me espelho no doutor Assis Chateaubriand."
03/11/1986,Pietro Maria Bardi,308,Aldemir Martins,"Pois é, ele não deixou o sucessor e liquidaram o Diários Associados."
03/11/1986,Pietro Maria Bardi,309,Pietro Maria Bardi,Quê?
03/11/1986,Pietro Maria Bardi,310,Aldemir Martins,"Ele não deixou um sucessor e liquidaram o Diários Associados em quatro anos. O medo que eu tenho, eu estou falando essas coisas, porque eu tenho a preocupação que o museu persista, que o museu continue."
03/11/1986,Pietro Maria Bardi,311,Pietro Maria Bardi,"Veja Ademir, eu amanhã, que é terça-feira, terça-feira amanhã?"
03/11/1986,Pietro Maria Bardi,312,Aldemir Martins,Terça-feira.
03/11/1986,Pietro Maria Bardi,313,Pietro Maria Bardi,Vou pensar nisso e vou inventar um sucessor.
03/11/1986,Pietro Maria Bardi,314,Aldemir Martins,"Invente um sucessor, mas o sucessor inventado é melhor do que nenhum."
03/11/1986,Pietro Maria Bardi,315,Maria Bonomi,"Eu sugiro três para substituir o senhor, tem que pôr três pessoas para ocupar o seu espaço."
03/11/1986,Pietro Maria Bardi,316,Aldemir Martins,Tudo solteiro não é?
03/11/1986,Pietro Maria Bardi,317,Pietro Maria Bardi,Como?
03/11/1986,Pietro Maria Bardi,318,Radha Abramo,"Solteiro, solteiro..."
03/11/1986,Pietro Maria Bardi,319,Maria Bonomi,Por quê?
03/11/1986,Pietro Maria Bardi,320,Aldemir Martins,"Tudo solteiro, porque doze horas no museu, não há mulher que resista, não agüenta mulher nenhuma!"
03/11/1986,Pietro Maria Bardi,321,Pietro Maria Bardi,"Veja, sucessor..."
03/11/1986,Pietro Maria Bardi,322,Maria Bonomi,Tem as musas do museu.
03/11/1986,Pietro Maria Bardi,323,Aldemir Martins,As musas do museu.
03/11/1986,Pietro Maria Bardi,324,Pietro Maria Bardi,A sucessora do cargo de diretor do museu pode ser também uma mulher.
03/11/1986,Pietro Maria Bardi,325,[...],Claro.
03/11/1986,Pietro Maria Bardi,326,[...],"Eu não sou machista não, eu adoro mulher!"
03/11/1986,Pietro Maria Bardi,327,Pietro Maria Bardi,"Veja, eu não tenho nada contra as mulheres, aliás, são minhas aliadas."
03/11/1986,Pietro Maria Bardi,328,Maria Bonomi,"O problema de capacidade professor, aquilo o que senhor cobre e preenche, precisaria realmente de três pessoas, um grande museólogo, depois precisaria um grande político, que o professor é muito político também e um homem de muitos contatos que ele tem, porque a credibilidade dele internacional é a mesma de certos ministros que chegam em certos países e os bancos se abrem, os museus se abrem para o professor. Isso é coisa..."
03/11/1986,Pietro Maria Bardi,329,[...],E as editoras.
03/11/1986,Pietro Maria Bardi,330,[...],"Os ministros ficam quatro anos, o professor está há quarenta, não se trata de bajular, é verdade, quarenta anos!"
03/11/1986,Pietro Maria Bardi,331,Maria Bonomi,"Então, eu acho que..."
03/11/1986,Pietro Maria Bardi,332,Aldemir Martins,"Eu também gosto dele, para bajular."
03/11/1986,Pietro Maria Bardi,333,Pietro Maria Bardi,Mas nós vamos encontrar uma mulher bacana que pega tudo nas mãos.
03/11/1986,Pietro Maria Bardi,334,Maria Bonomi,"Não, um triunvirato professor, tem que ser três."
03/11/1986,Pietro Maria Bardi,335,Radha Abramo,Tem que ser três.
03/11/1986,Pietro Maria Bardi,336,[...],"Tem que ser 11, um goleiro e dez!"
03/11/1986,Pietro Maria Bardi,337,Pietro Maria Bardi,Como?
03/11/1986,Pietro Maria Bardi,338,Aldemir Martins,Um goleiro e dez para jogar.
03/11/1986,Pietro Maria Bardi,339,Rodolpho Gamberini,"Professor, entre nós temos mais uma pergunta gravada entre as muitas pessoas que gostariam de fazer perguntas para o senhor, dessa vez a pergunta é do artista plástico, também, Gregório Gruber. E entra mais uma vez por ali a pergunta, eu gostaria que o senhor respondesse, vai entrar por ali."
03/11/1986,Pietro Maria Bardi,340,[VT de Gregório Gruber],"Professor Bardi eu gostaria de saber, na sua visão, quais são os fatores positivos de ser um artista jovem no Brasil hoje e fazer uma comparação com a época que o senhor chegou no Brasil?"
03/11/1986,Pietro Maria Bardi,341,Pietro Maria Bardi,"Bom, naturalmente em quarenta anos, eu acho que eu fiz um passo muito forte, um passo muito importante. Seja para o trabalho que nós fizemos no Masp e seja também, devo reconhecer, pelo trabalho que se fez nas bienais, não? Para dizer, confirmar publicamente, que eu e o Ciccillo éramos bons amigos, quando Ciccillo quis fazer o Museu de Arte Moderna, que era antigamente uma cópia do nosso museu, ele veio e me disse: “O senhor pensa que eu posso pedir os locais ao Chateaubriand?”"
03/11/1986,Pietro Maria Bardi,342,[...],O espaço para...
03/11/1986,Pietro Maria Bardi,343,Pietro Maria Bardi,"Muito bem, eu aprovei. Então, se viu que no mesmo prédio da rua Sete de Abril, 230, existia o Masp e atrás, no fundo, o Museu de Arte Moderna."
03/11/1986,Pietro Maria Bardi,344,[...],E o barzinho.
03/11/1986,Pietro Maria Bardi,345,[...],O barzinho.
03/11/1986,Pietro Maria Bardi,346,[...],Com o Artur.
03/11/1986,Pietro Maria Bardi,347,[...],Com Artur.
03/11/1986,Pietro Maria Bardi,348,[...],E o barzinho com o Artur.
03/11/1986,Pietro Maria Bardi,349,Pietro Maria Bardi,Não soube? Chamava: o museu do Bardi e o museu do bar!
03/11/1986,Pietro Maria Bardi,350,[...],
03/11/1986,Pietro Maria Bardi,351,Rodolpho Gamberini,"Professor Bardi tem uma pergunta de uma telespectadora, Mônica Martins, da cidade de São Roque, aqui em São Paulo, ela se refere a um tema que o senhor tocou rapidamente em uma das perguntas anteriores, eu acho que é um tema, é uma coisa importante para o senhor esclarecer. O senhor mesmo comparou a freqüência de público dos museus de Nova Iorque com os museus de São Paulo, a freqüência nossa é irrisória como o senhor mesmo disse, baseado nisso porque o Masp não funciona mais tempo, por que não fica aberto mais tempo, se ele funciona no horário comercial, praticamente hoje, porque ele não fica aberto mais tempo para que mais pessoas possam vê-lo?"
03/11/1986,Pietro Maria Bardi,352,Pietro Maria Bardi,"Bom, o Masp funciona muito a seu modo, que é um modo muito curioso, entende? Não é bem, eu sempre digo que não se trata de um museu, mas se trata de um museu num museu. Porque se faz, nesse museu, tantas coisas que fogem da praxe da museologia. E naturalmente se faz o que se pode fazer com os recursos que nós temos, com uma economia absoluta, porque todo esse prédio enorme funciona com quarenta funcionários em tudo, guardas, contínuos, limpadores, assistentes, quando temos na nossa São Paulo um museu, um centro de tipo, o centro que estava na Vergueiro, não?"
03/11/1986,Pietro Maria Bardi,353,Rodolpho Gamberini,Centro Cultural.
03/11/1986,Pietro Maria Bardi,354,Pietro Maria Bardi,"Que tem 560 funcionários, entende? Isso aqui aprendi em um artigo do Jornal da Tarde."
03/11/1986,Pietro Maria Bardi,355,Tereza Cristina de Barros,"Professor Bardi, para o grande público, professor Bardi."
03/11/1986,Pietro Maria Bardi,356,Pietro Maria Bardi,"Tem, tem entidade que tem muito dinheiro e entidade que tem nada de dinheiro: Nós!"
03/11/1986,Pietro Maria Bardi,357,Darcy Penteado,"Eu gostaria de acrescentar só uma coisa, porque a Mônica Martins é minha conterrânea lá de São Roque..."
03/11/1986,Pietro Maria Bardi,358,Rodolpho Gamberini,Você a conhece?
03/11/1986,Pietro Maria Bardi,359,Darcy Penteado,"Claro. Ela talvez não, mas eu conheço todo mundo de lá. Mas eu acho o seguinte, então Mônica, o problema também não é questão de horário, porque em todos os museus tem horários, nenhum museu fica aberto até onze, meia-noite, quer dizer, os horários são realmente restritos, agora o problema é que os museus do mundo todo cobram entradas e existe principalmente isso, um interesse muito grande, muito maior do que existe em São Paulo, em visitar museus. E isso, infelizmente, é nosso problema cultural. Quer dizer, na Europa as pessoas freqüentam museus também. Aqui, considerando a população de São Paulo, este gigante, a visitação do museu teria que ser muito maior e não é, eu acho que o problema é justamente cultural, quer dizer, não existe esta..."
03/11/1986,Pietro Maria Bardi,360,[...],Aquela moça tem uma pergunta lá em cima.
03/11/1986,Pietro Maria Bardi,361,[...],Tem uma pergunta lá em cima.
03/11/1986,Pietro Maria Bardi,362,[...],Aquela moça tem uma pergunta.
03/11/1986,Pietro Maria Bardi,363,[...],Tem uma moça desesperada lá em cima.
03/11/1986,Pietro Maria Bardi,364,[...],
03/11/1986,Pietro Maria Bardi,365,Radha Abramo,"Eu acho, eu conheço a maioria dos grandes museus do mundo. E conheço a população que vai nessa grande maioria e, sinceramente, eu acho que o Museu de Arte de São Paulo é um dos museus que tem uma grande visitação. E acontece que o Masp tem a característica de abrigar jovens, então, é uma população jovem muito grande que em geral a pessoa que trabalha e tal, não vai ao sábado e domingo etc. Encontra muita gente, mas que não pode perceber a massa de juventude que é a característica do Masp e que é, na minha opinião, a matéria-prima que fez com que o Masp se tornasse essa grande instituição que é pelo apoio, pela necessidade e a presença do jovem dentro do museu. O Masp é um dos museus mais visitados que eu conheço e eu conheço muitos."
03/11/1986,Pietro Maria Bardi,366,Rodolpho Gamberini,Professor Bardi.
03/11/1986,Pietro Maria Bardi,367,[...],Aquela moça tem uma pergunta.
03/11/1986,Pietro Maria Bardi,368,Rodolpho Gamberini,Professor Bardi a Tereza Cristina gostaria de fazer uma pergunta.
03/11/1986,Pietro Maria Bardi,369,Tereza Cristina de Barros,"Professor Bardi. Aqui, eu queria fazer a seguinte..."
03/11/1986,Pietro Maria Bardi,370,Pietro Maria Bardi,Mais alto!
03/11/1986,Pietro Maria Bardi,371,Tereza Cristina de Barros,Bem mais alto. O senhor acha que para o grande público continua aquela imagem de que o museu é coisa chata e de elite? Ou isso já foi quebrado?
03/11/1986,Pietro Maria Bardi,372,Pietro Maria Bardi,Me traduza.
03/11/1986,Pietro Maria Bardi,373,Rodolpho Gamberini,"Por favor, Tereza repita a pergunta."
03/11/1986,Pietro Maria Bardi,374,Tereza Cristina de Barros,"Vou ver se eu consigo ir alto. Professor eu queria saber se o senhor acha que para o grande público continua aquela imagem de que museu é uma coisa chata e de elite? Ou se essa imagem já foi quebrada, na prática, pelos museus?"
