DATA,ENTREVISTA,ORDEM,LOCUTOR,FALA
12/04/1999,Roger Abdelmassih,73,Roger Abdelmassih,"Muito bem. Eu quero lhe dizer, Eduardo, que realmente a clonagem é uma coisa que ainda demora um pouco para ser possível de ser aplicada, porque nós temos alguma possibilidade de resultados a nível animal, mas o encaminhamento a nível humano ainda vai gerar uma dificuldade natural e com o tempo ainda, e os resultados não seriam tão eficazes. Mas, admitindo a possibilidade do uso da clonagem a nível humano - e que chegará, sem dúvida alguma, a um determinado momento -, ela pode ter as vantagens de uma série de outras situações que não a simples gestação e gerar um outro ser, mas também ajudar em outras áreas da medicina, de saúde efetivamente. Mas, dentro da reprodução, eu poderia lhe dizer que, e eu sempre digo, que a ciência faz a ética e a lei. Porque o desenvolvimento da ciência provoca a necessidade de se avaliarem alguns aspectos éticos e alguns aspectos legais. Muito bem. No que tange ao problema da clonagem propriamente dita, e naquela ocasião talvez eu disse à IstoÉ sobre o problema da clonagem, é que eu estava sensibilizado por um caso que eu havia tratado 20 anos atrás e o casal havia conseguido um filho depois de um tratamento, de certa forma, difícil. Na época, não tinha fertilização in vitro. O menino, aos 19 anos de idade, estudando direito, um menino maravilhoso, saindo da casa da namorada, isso no Sul, no Rio Grande do Sul, ele saindo da casa da namorada, ele foi assaltado, foi baleado e foi morto. E eu perguntava ao jornalista naquela ocasião: “será que os pais...?” - porque os pais vieram a São Paulo um tempo depois querendo ter um filho, ela não tinha mais óvulos e ela não aceitou óvulos doados, a mãe. E eu perguntei ao jornalista na época - e quero lhe dizer que a pergunta inicial foi a um jornalista de um outro jornal de São Paulo, O Estado de S. Paulo, que foi o Moisés Rabinovich, que me entrevistava naquela ocasião, e depois à IstoÉ -, eu fazia a mesma pergunta, e eu disse: “será que não seria válido esse casal buscar desse filho que estivesse morrendo na UTI e pudesse, se tivesse a técnica, fazer a clonagem e fazer um filho?”. Esse jornalista procurou a família, que eu entrei em contato e perguntei se ele aceitaria falar com o jornalista, o jornalista entrou em contato com o casal, especialmente com o pai, e ele, de pronto, disse que ele faria a clonagem se assim pudesse ser feito na época, porque ele perdeu realmente o filho dele e poderia ter um filho gêmeo. Então, talvez num caso como esse, a clonagem poderia..."
12/04/1999,Roger Abdelmassih,74,Paulo Markun,"Mas doutor Roger, o senhor, se não me engano, foi o senhor mesmo que mencionou numa outra entrevista, a possibilidade que já existe do ponto de vista técnico, do ponto de vista cientifico, de, num processo de maturação, se eu não estou enganado, de um óvulo, de se separar em duas células e se fazer, vamos dizer assim, dois “moldes”, vai. Eu vou usar uma expressão, eu não sou especialista no assunto. Dois moldes, de tal modo que um fosse uma espécie de backup do outro."
12/04/1999,Roger Abdelmassih,75,Roger Abdelmassih,"Existe hoje - o que também é uma clonagem, de certa forma, na verdade é uma divisão celular - que o embrião, quando ele começa a se dividir, você tem a oportunidade de tirar - porque ele se divide em duas, quatro, oito, e assim vai se dividindo -, você pode tirar células desse embrião e fazer um embrião igual ao outro."
12/04/1999,Roger Abdelmassih,76,Paulo Markun,Sim. Idêntico. É.
12/04/1999,Roger Abdelmassih,77,Roger Abdelmassih,Então você vai fazer irmãos gêmeos univitelínicos idênticos.
12/04/1999,Roger Abdelmassih,78,Paulo Markun,Gêmeos univitelinos. Sim.
12/04/1999,Roger Abdelmassih,79,Roger Abdelmassih,"Mas não uma clonagem, absolutamente, tirando de um ser e fazendo um indivíduo igual."
12/04/1999,Roger Abdelmassih,80,Paulo Markun,"Mas a pergunta que eu queria fazer é a seguinte: todo pai e toda mãe, certamente a última coisa que ele deseja ver é que o filho dele morra antes dele."
12/04/1999,Roger Abdelmassih,81,Roger Abdelmassih,Sem dúvida.
12/04/1999,Roger Abdelmassih,82,Paulo Markun,"Essa é uma regra da humanidade, não se trata de A, B ou. E não se trata de se o filho é fertilizado in vitro ou não, ou se foi difícil de fazer ou fácil de fazer."
12/04/1999,Roger Abdelmassih,83,Roger Abdelmassih,Certo.
12/04/1999,Roger Abdelmassih,84,Paulo Markun,"Então, a minha pergunta é a seguinte: se esse raciocínio é válido, então nós deveríamos estabelecer um banco de filhos, que todo filho tivesse um backup, quer dizer, que todo filho tivesse uma cópia que, na medida em que o meu morre, eu posso ter um segundo."
12/04/1999,Roger Abdelmassih,85,Roger Abdelmassih,"Markun, nem todas as pessoas que perdem um filho querem fazer um outro filho."
12/04/1999,Roger Abdelmassih,86,[...],Um filho igual...
12/04/1999,Roger Abdelmassih,87,Roger Abdelmassih,"Eu perdi um irmão, eu perdi um irmão em acidente de automóvel e, com certeza, naquela ocasião eu tenho certeza que os meus pais não iriam querer um outro filho, apesar de já terem filhos. Eu acho que cabe a cada casal uma solução."
12/04/1999,Roger Abdelmassih,88,Malcolm Montgomery,"Roger,..."
12/04/1999,Roger Abdelmassih,89,Roger Abdelmassih,"Deixa eu só acabar essa resposta, Malcolm. Cabe a cada casal a sua decisão. E dentro dessa decisão, eu acho que nós estamos um pouco distantes de ficarmos fazendo clonagem, porque pensar em clonagem parece que ela está aqui na porta da casa podendo fazer. Se nós entendermos que, em 20 anos, com muitos centros de fertilização in vitro, nós temos 200 mil crianças nascidas para uma população mundial que nós sabemos qual é, nós tivemos 200 mil crianças por uma tecnologia muito, mas muito mais simples, que é a fertilização in vitro, do que a tecnologia de uma clonagem, por exemplo, mesmo essa divisão celular que é dominada a nível animal e que não é tão fácil a fazer, eu acho que nós não teríamos tanta facilidade como essa de fazer um backup, e ficarmos fazendo backups, como assim pudesse ser feito."
12/04/1999,Roger Abdelmassih,90,Eduardo Marini,"Mas, tecnicamente, a clonagem, ela não está tão... tão... está muito mais reprimida sobre o aspecto ético do que um caminho tecnológico possa apresentar..."
12/04/1999,Roger Abdelmassih,91,Roger Abdelmassih,"Ela não está sendo... no aspecto talvez humano, mas não animal, não animal. Só que não se consegue reproduzir facilmente essas condições que foram feitas na Dolly. Essa é a grande realidade. A Universidade de São Paulo, Eduardo, tentou fazer isso com um profissional brilhante aqui da Universidade de São Paulo, na área de veterinária e ele não conseguiu fazer isso, como em outros tantos centros, não conseguiu efetivamente reproduzir aquilo que aconteceu com a Dolly. Eu acho que era..."
12/04/1999,Roger Abdelmassih,92,Paulo Markun,"Doutor Roger, eu vou pedir só para a gente fazer um rápido intervalo e o Roda Viva volta daqui a instantes."
12/04/1999,Roger Abdelmassih,93,[...],
12/04/1999,Roger Abdelmassih,94,Paulo Markun,"Bem, nós estamos de volta com o Roda Viva, esta noite entrevistando o especialista em reprodução humana doutor Roger Adbelmassih. Você pode fazer a sua pergunta pelo telefone 011 252-6525, pelo fax 011 3874-3454 ou ainda pelo endereço do programa na internet, que é rodaviva@tvcultura.com.br. Doutor Roger, eu vou começar com duas perguntas de telespectador que acho que situam a coisa... nós começamos a discutir lá no fundo e não falamos do comecinho. A pergunta de Júlio Rocha Júnior, de Foz do Iguaçu, no Paraná, é a seguinte: “Quais são as características que definem um casal infértil?”. E Gil Vicente de Toledo Piza, aqui de São Paulo, pergunta: “Por que que a incidência de infertilidade está aumentando?”."
12/04/1999,Roger Abdelmassih,95,Roger Abdelmassih,"Bom, o que define um casal infértil é aquele casal que, depois de dois anos, não consegue engravidar tendo uma vida sexual normal, ativa, e... porque a chance de gravidez de um casal normal é de 15 a 18% de chance de gravidez por mês, que ao longo de um ano são 85 a 90% e, completando o segundo ano, obrigatoriamente, um casal normal deveria engravidar. Então, esse casal que não engravida ao longo de dois anos sem dúvida deve ter algum problema que esteja dificultando a chance de engravidar. E o outro..."
12/04/1999,Roger Abdelmassih,96,Paulo Markun,A outra pergunta é: por que a incidência de infertilidade está aumentando?
12/04/1999,Roger Abdelmassih,97,Roger Abdelmassih,"Na verdade, os conhecimentos diagnósticos talvez estejam, e a abertura dos casais em procurar e se revelar esteja mais clara. Mas essa taxa de 20% a nível mundial, a própria Organização Mundial de Saúde a tem há alguns anos. E isso tem aumentado, algumas razões de estresse ou até de tipo de vida, que podem atrapalhar. Por outro lado, tem países onde continua a causa principal, por exemplo, a trompa, por infecções, obstrução de trompa. Na África, por exemplo, onde tem muita infecção, tem alguns países da África que a incidência, o fator causal de esterilidade, é coisa de 80 a 90% fator de trompa, por causa de infecções. Então, dependendo das condições, aumenta um tipo de problema ou outro, mas, em média, 20% é a chance de nós encontrarmos casais sem filhos."
12/04/1999,Roger Abdelmassih,98,Paulo Markun,"Para não perder o embalo, a idéia que existe, acho que hoje em dia menos, mas de que a infertilidade é normalmente um problema da mulher está errada?"
12/04/1999,Roger Abdelmassih,99,Roger Abdelmassih,"Totalmente. Hoje é sabido que a participação do homem é absolutamente igual à da mulher. Aproximadamente 40% dos casais, sem filhos, o problema é do casal, e os outros 60% estariam repartidos entre o fator masculino e o fato feminino."
12/04/1999,Roger Abdelmassih,100,Paulo Markun,"Quando o senhor fala que o problema é do casal, quer dizer que se esse..."
12/04/1999,Roger Abdelmassih,101,Roger Abdelmassih,Ambos.
12/04/1999,Roger Abdelmassih,102,Paulo Markun,... se essas pessoas tivessem relacionamentos com outros talvez não tivessem nenhum problema?
12/04/1999,Roger Abdelmassih,103,Roger Abdelmassih,"Talvez, aquele que tivesse menos problema talvez pudesse engravidar com um pouco mais de facilidade."
12/04/1999,Roger Abdelmassih,104,Celso Arnaldo Araújo,"Doutor Roger, nesse caso inusitado que o senhor citou, nesses dois homossexuais femininos, haveria, se fosse feito o procedimento, doação de óvulos e doação de sêmen. Entre os casais ditos normais a doação de óvulos sempre foi muito mais bem aceita do que a doação de sêmen. O homem sempre teve uma grande resistência a aceitar um sêmen de doador para se produzir um filho que seria dela mas não seria dele, não teria características genéticas dele. Com essas técnicas novas, que conseguem beneficiar o sêmen a ponto de permitir que um homem que praticamente não ejacula espermatozóides consiga ser pai, os bancos de sêmen tendem a desaparecer?"
12/04/1999,Roger Abdelmassih,105,Roger Abdelmassih,"Olha, diminuiu muito e tem diminuído muito. Realmente a sua pergunta é muito interessante, porque, em cada 100 homens da população mundial, nós encontramos 96 que, quando ejaculam, sai o seu líquido, saem espermatozóides. Que sejam pouquíssimos, muitos, milhares, mas tem espermatozóides. Mesmo aqueles que têm poucos espermatozóides ou de má qualidade, existe a técnica da fertilização in vitro chamada ICSI, que injeta o espermatozóide dentro do óvulo, e as chances de fertilização e de gravidez são bastante grandes. Por outro lado, quatro desses 100 homens, quando ejaculam, não têm espermatozóides no ejaculado, mas três deles têm espermatozóides dentro do testículo, que tirados por uma agulha de insulina, por exemplo, podemos usar esse material e injetar dentro do óvulo da mulher, e, com isso, fazermos também um embrião. Essa técnica, inclusive, é uma técnica que - eu já vou me adiantar, Malcolm -, que nós vamos apresentar e fomos convidados pelo Congresso Mundial de Reprodução Humana que vai ter na Bahia, em Salvador, de 4 a 8 de maio, que nós fomos convidados exatamente para falar sobre essa injeção de espermatozóides dentro de óvulos."
12/04/1999,Roger Abdelmassih,106,Celso Arnaldo Araújo,Só para completar...
12/04/1999,Roger Abdelmassih,107,Roger Abdelmassih,"E um daqueles que quando ejaculam não têm espermatozóides, metade deles tem células pré-espermatozóides que hoje podem ser maturadas em laboratório e terem condições de serem injetadas dentro do óvulo e ter um embrião. Por isso, 99,5% dos homens hoje podem ter filhos por essas técnicas de fertilização. Não obstante, o fator de tratamento masculino é o pior para ser recuperado. Você falou em óvulos doados... por que a aceitação maior da mulher de óvulos doados do que o homem em relação ao sêmen de doador? Porque a mulher gesta, porque a mulher pare e, mais ainda, e aí eu entro numa discussão talvez ética, o problema... Dentro da minha concepção eu entendo que a vida não começa quando o espermatozóide entra dentro do óvulo, doutor. Para mim, a vida começa quando o embrião gruda dentro do útero e ali começa a vida."
12/04/1999,Roger Abdelmassih,108,Marco Segre,É aí que eu quero me manifestar.
12/04/1999,Roger Abdelmassih,109,[...],Roger.
12/04/1999,Roger Abdelmassih,110,Marco Segre,É aí que eu gostaria de me manifestar.
12/04/1999,Roger Abdelmassih,111,Roger Abdelmassih,"Por isso... Por isso... Eu vou dar a pergunta para os dois, mas eu só... Eu vou dar para o Malcolm primeiro, senão ele tem um colapso aqui, porque eu nunca dou a pergunta a ele. Mas ali começa a vida. Então, por isso, a mulher que gesta um óvulo doado, é filho dela, vai nascer dela. Então ela vai transferir todas as suas emoções, inclusive toda a sua condição imunológica. Por isso a mulher aceita muito mais facilmente o óvulo do que o homem, que participa muito pouco. Talvez seja essa a razão de o homem, talvez, reagir um pouquinho mais, do que qualquer outra coisa. Malcolm, por favor."
12/04/1999,Roger Abdelmassih,112,Marco Segre,"Roger, eu só quero que você não esqueça depois a palavra, porque eu tenho um comentário que eu acho..."
12/04/1999,Roger Abdelmassih,113,Roger Abdelmassih,"Não, eu passo para você, porque senão..."
12/04/1999,Roger Abdelmassih,114,Malcolm Montgomery,"No popular, é o “corno genético” que não quer? No popular?"
12/04/1999,Roger Abdelmassih,115,Roger Adbelmassih,"Absolutamente, absolutamente. Isso não é verdade, porque os pais de sêmen doados também são verdadeiramente pais."
12/04/1999,Roger Abdelmassih,116,Malcolm Montgomery,"Eu já ouvi essa frase de um paciente pobre uma vez: “Ô doutor, eu não quero ser 'corno genético' não!”."
12/04/1999,Roger Abdelmassih,117,[...],
12/04/1999,Roger Abdelmassih,118,Malcolm Montgomery,"Então, deixa eu te dizer uma coisa, perguntar uma coisa para você. O que tem de mais atual em termos de reprodução humana, e mais polêmico no mundo, seria essa troca de espermatozóides entre um óvulo de uma mulher jovem e um óvulo de uma mulher mais madura – certo? -, baseado no fato de que o citoplasma é um material que pode colaborar muito..."
12/04/1999,Roger Abdelmassih,119,Roger Abdelmassih,"Essa técnica... essa técnica é nova e eu vou falar sobre ela, mas para não fugir desse aspecto ético podemos voltar primeiro a pergunta dele? Depois eu volto..."
12/04/1999,Roger Abdelmassih,120,Malcolm Montgomery,Eu vou chegar à ética. Pode. Quer passar pra lá?
12/04/1999,Roger Abdelmassih,121,Roger Abdelmassih,Tudo bem. Sobre o aspecto ético que acho que você queria perguntar.
12/04/1999,Roger Abdelmassih,122,Marco Segre,Porque eu gostaria de fazer um comentário sobre o aspecto...
12/04/1999,Roger Abdelmassih,123,Roger Abdelmassih,Sobre o problema da vida.
12/04/1999,Roger Abdelmassih,124,Marco Segre,"É, sobre o problema da vida. Quando você disse que a vida começa no momento da nidação do embrião no útero, eu disse, eu pensei, e eu tenho a convicção, que a vida começa quando a comunidade entende que ela começa. A igreja católica conservadora entende que na penetração do espermatozóide no óvulo..."
12/04/1999,Roger Abdelmassih,125,Roger Abdelmassih,Exatamente.
12/04/1999,Roger Abdelmassih,126,Marco Segre,"A gente poderia aceitar que a vida começa da pulsação do coração fetal ou na formação da notocorda. Esses parâmetros nós médicos, nós cientistas, podemos oferecer em termos de dizer o que acontece com o embrião nesse momento, mas quem adota ou não esses parâmetros é a sociedade. Então, eu estou querendo fazer o comentário no seguinte sentido: que, por um lado, você está mostrando uma faceta extremamente encantadora. Eu acho que, quando você vai pegar uma espermatogônia para obter a reprodução num casal infértil, você está fazendo uma coisa fantástica. Você não está se preocupando com, a assim chamada, Lei da Natureza, pela qual o filho só poderia ser produzido da maneira habitual. Agora, por outro lado, quando você diz que a vida começa na nidação, eu acho que você está procurando um parâmetro para justificar, que eu também acho que deve acontecer, que os embriões não implantados possam ser descartados."
12/04/1999,Roger Abdelmassih,127,Roger Abdelmassih,Mas é lógico...
12/04/1999,Roger Abdelmassih,128,Marco Segre,Não é verdade?
12/04/1999,Roger Abdelmassih,129,Roger Abdelmassih,... E verdadeiramente nós temos que acabar com essa... sabe? Com essa fantasia...
12/04/1999,Roger Abdelmassih,130,Marco Segre,"Embriolatria, embiolatria."
12/04/1999,Roger Abdelmassih,131,Roger Abdelmassih,"Fantasia desses embriões, porque esses embriões não vão viver se não tiver útero e às vezes são embriões ruins, que hoje cada vez mais nós estamos encontrando essa verdade, porque quando nós fazemos a transferência em cinco dias em blastocisto nós estamos vendo que muitos embriões nem chegaram lá, porque eles não eram bons mesmo logo de saída. Além do mais, se eu congelo um embrião e guardo, um dia esse embrião vai ter que ser colocado em algum lugar, e, se ele não tiver um útero para grudar, ele não vai viver, ele não vai existir. Eu acho que é dentro desta hipótese e colocação..."
12/04/1999,Roger Abdelmassih,132,Marco Segre,"Pois é, é isso..."
12/04/1999,Roger Abdelmassih,133,Cláudia Collucci,"O senhor já conseguiu, doutor, alguma gravidez com embrião congelado?"
12/04/1999,Roger Abdelmassih,134,Roger Abdelmassih,"Já. Mas o embrião congelado, quando ele é descongelado, você tem que colocar em algum lugar. E ele só vai continuar... se eu não colocar dentro de um útero e ele grudar dentro de um útero ele também acaba."
12/04/1999,Roger Abdelmassih,135,Paulo Markun,"Pois é, mas não há uma discussão..."
12/04/1999,Roger Abdelmassih,136,Cláudia Collucci,O que fazer com esses milhões de embriões congelados?
12/04/1999,Roger Abdelmassih,137,[...],
12/04/1999,Roger Abdelmassih,138,Roger Abdelmassih,"Agora... agora eu vou só pedir para o Malcolm completar aquela pergunta e vamos voltar para os embriões congelados, porque senão ele não fala do citoplasma aqui."
12/04/1999,Roger Abdelmassih,139,Malcolm Montgomery,"Não, a minha pergunta é exatamente essa, quer dizer, esse é um processo novo – né? -, onde você tira citoplasma de uma célula jovem para uma célula mais madura, baseado no fato de que você teria mais possibilidades de que, com o citoplasma jovem, você teria então maiores possibilidades de esse ovo vingar de uma forma melhor. Mas o que entraria na ética, professor, é o seguinte: o citoplasma tem mitocôndrias que têm DNA - certo? -, e que vai ser misturado com o núcleo de uma outra célula, ou seja, teoricamente, Roger, teoricamente, você teria então dois DNAs de duas mães diferentes. Como é que fica isso se...?"
12/04/1999,Roger Abdelmassih,140,Roger Abdelmassih,"Então vamos lá. Primeiro que existem duas situações. Uma, existe a possibilidade de troca... nós trouxemos essa técnica do citoplasma para o Brasil junto com o doutor Peter Nagy que volta ao Brasil para, definitivamente, ficar no Brasil, que é um pesquisador."
12/04/1999,Roger Abdelmassih,141,Paulo Markun,"Doutor Roger, eu só pediria o seguinte, que o senhor esclarecesse um pouco melhor, porque eu acho que ficou um pouco nebulosa a história de citoplasma, DNA etc."
12/04/1999,Roger Abdelmassih,142,Roger Abdelmassih,Esse citoplasma? Está bom. Então é importante eu dizer o seguinte: o que é troca de citoplasma e isso daí? A célula é constituída por uma estrutura que é...
12/04/1999,Roger Abdelmassih,143,Celso Arnaldo Araújo,A célula do óvulo.
12/04/1999,Roger Abdelmassih,144,Roger Abdelmassih,"A célula do óvulo, o óvulo, ou qualquer célula, ela tem uma área que é gelatinosa, digamos assim, e que tem, e que é chamada de citoplasma. E tem uma outra parte que é muito menor, que é o núcleo, que carrega efetivamente toda a parte cromossômica dessa célula. Porém, é evidente que esse citoplasma, ele tem essa área, digamos, alimentadora da estrutura, do núcleo ou a estrutura da célula, e, no caso do óvulo, ela carrega alguns aspectos de mitocôndrias, que pode estar carregando uma quantidade talvez muito menor, evidentemente, do que o núcleo estaria carregando. Então o que esse... consiste é que os óvulos que nascem junto com a mulher... a mulher, quando nasce, ela tem um carimbo de aproximadamente dois milhões de células possíveis de serem óvulos; quando ela entra na puberdade, ela tem 500 mil, somente, dessas células, e perde aproximadamente 800 a mil dessas células por mês, mas essas células, todas elas, têm a idade da mulher. Diferente do homem, que vai dividindo as suas gônadas em uma e em outra, e vão se formando efetivamente novos espermatozóides e novas células. E essas células vão envelhecendo, digamos assim, e a característica delas vai se alterando. As alterações de agrupamento dos cromossomos... vai se alterando também: uma mulher com 25 anos tem uma alteração desse agrupamento em 15% aproximadamente, ou 17% - acho que o Walter está aqui como geneticista, também, podendo falar claramente sobre esses índices -, e a mulher com 40 anos apresenta 87% dos seus óvulos com essas alterações. Porém, uma das idéias dentro das pesquisas foi tomar um pedacinho, um pouquinho, desse citoplasma, 10% de uma célula, desse gel, digamos assim, da célula, de um outro óvulo jovem e colocar dentro de um óvulo com mais idade, para que ativasse esse óvulo com mais idade e ele pudesse responder a um espermatozóide penetrado ali dentro em melhores condições de uma divisão celular e de uma gravidez. É uma tentativa para melhorar aquelas mulheres que obrigatoriamente estariam fadadas a ter quase que uma impossibilidade de uma gravidez. É uma tentativa de melhorar. Então, estas mulheres teriam uma indicação de óvulos doados, da qual já dissemos que eu sou francamente favorável, mas tem muitas pessoas que não estão dispostas a aceitar o óvulo doado, mas aceitariam, aceitariam..."
12/04/1999,Roger Abdelmassih,145,Eduardo Marini,Mas isso caracterizaria a duplicidade de DNA.
12/04/1999,Roger Abdelmassih,146,Roger Abdelmassih,"... aceitariam, entretanto, a possibilidade do uso de 10% de um citoplasma de um óvulo jovem, do qual a grande proporção da sua história cromossômica, digamos assim, estaria garantida e, talvez, somente em algumas circunstâncias, muito de detalhe, poderia se ter alguma complexidade do citoplasma do outro óvulo. Por isso, a essas mulheres, cabe a elas escolherem essa possibilidade e aumentar um pouco a sua chance. Entretanto, Malcolm, essa técnica que nós estamos trabalhando já há algum tempo, ela não tem trazido os resultados tão fantasmagóricos que nós gostaríamos que trouxesse. Então ela... por exemplo, uma mulher... foi dito aqui sobre os índices de gravidez que podem ser obtidos, nós sabemos que nós podemos obter, como temos obtido, taxas fantásticas até 35 anos, em torno de, aproximadamente, até 45. Tem grupos de até 35 anos com blastocisto, hoje, que nós chegamos a atingir 54% de gravidez por tentativa, mas, infelizmente, uma mulher com mais de 41 anos de idade nós vamos atingir 8, 10% talvez, de chance de gravidez entre 41,42. E, 43, praticamente esse óvulo já não responde mais."
12/04/1999,Roger Abdelmassih,147,[...],Doutor Roger.
12/04/1999,Roger Abdelmassih,148,Roger Abdelmassih,"Então, a essas mulheres que eu acho que nós podemos tentar ajudar."
12/04/1999,Roger Abdelmassih,149,Walter Pinto,"Doutor Roger, aí tem um ponto de vista ético muito importante. Tem doenças que são chamadas doenças mitocondriais."
12/04/1999,Roger Abdelmassih,150,Roger Abdelmassih,Sim.
12/04/1999,Roger Abdelmassih,151,Walter Pinto,"Essa seria a maior indicação desse plano do Roger, trocando quase todas as mitocôndrias e colocando mitocôndrias... pegando só o núcleo da célula e colocando em um núcleo de uma pessoa normal. Mitocôndrias é só transmitida para mulher. Então, nesses casos vai poder ser feito com a maior facilidade do mundo. Eu não acredito também... O Roger parece que não está obtendo muitos bons resultados, mas também eu não acredito nisso por causa da idade dessas mulheres. Já tinha falado, 85%... é muito grande."
