DATA,ENTREVISTA,ORDEM,LOCUTOR,FALA
12/04/1999,Roger Abdelmassih,152,Roger Abdelmassih,"Porque a alteração dos cromossomos, o desparelhamento dos cromossomos, assim como nós estamos também trabalhando em troca de núcleos, que é uma tentativa heróica, mas nós vamos também trabalhar com essas alterações tais que os índices poderão melhorar, mas também não serão tão fantásticos."
12/04/1999,Roger Abdelmassih,153,[...],Doutor Roger.
12/04/1999,Roger Abdelmassih,154,Cláudia Collucci,Isso tudo ainda são experimentos. Já tem comprovação científica?
12/04/1999,Roger Abdelmassih,155,Roger Abdelmassih,"Por exemplo, esse doutor Peter Nagy acaba de revelar... Não, gravidez em troca de citoplasmas, mas nós mesmos já tivemos, logo que começamos, algumas gravidezes, mas não que melhorou o índice fantasticamente..."
12/04/1999,Roger Abdelmassih,156,Paulo Markun,"Turbinou, mas não funcionou?"
12/04/1999,Roger Abdelmassih,157,Roger Abdelmassih,Hein?
12/04/1999,Roger Abdelmassih,158,Paulo Markun,"Turbinou o óvulo, mas não..."
12/04/1999,Roger Abdelmassih,159,Roger Abdelmassih,"Funciona um pouquinho, mas turbina, mas ele tem um tempinho, ele acaba logo. Por outro lado, a troca de núcleos... O doutor Peter Nagy me revela agora, da Europa, que ele conseguiu o primeiro embrião chegando a blastocisto com troca de núcleos. Isso é um passo, de adianto, razoavelmente importante."
12/04/1999,Roger Abdelmassih,160,Eduardo Marini,Doutor Roger.
12/04/1999,Roger Abdelmassih,161,Roger Abdelmassih,"Pois não, doutor Eduardo."
12/04/1999,Roger Abdelmassih,162,Eduardo Marini,"Eu queria... perdão, eu queria..."
12/04/1999,Roger Abdelmassih,163,Roger Abdelmassih,"Eu já volto para você, Malcolm."
12/04/1999,Roger Abdelmassih,164,Eduardo Marini,"Eu estou um pouco preocupado no que a técnica já produz de realidade sob o ponto de vista do telespectador que está observando a gente. Eu acho que teve alguns aspectos das conversas que nós estabelecemos aqui que eu acho que a gente poderia ressaltar – né? -, dar um pouco mais de destaque. Bom, eu acho que ainda existe grande parte dos casais, das pessoas interessadas em conhecer gravidez assistida, que ainda pensam que inseminação artificial é algo que é feito necessariamente com espermatozóides ou com óvulos alheios. É importante que o senhor comente isso. Quer dizer, eu acho que um outro lado, um aspecto que eu acho interessante, é que também, quando você junta esse dado com a realidade cultural brasileira, o dado de que 40% dos problemas relacionados à infertilidade do casal são exclusivos do homem e os outros 20% divididos entre o homem e a mulher, eu acho que isso pode combinar, fazer uma combinação com a cultura brasileira e impedir que as pessoas tenham acesso a esse tipo de tratamento por alguma repressão cultural, achar que homem que vai se cuidar ou tentar uma gravidez assistida é um homem que não consegue ser viril a ponto de – né? - conseguir estabelecer uma gravidez com sua parceira naturalmente. Bom, existem outros limites éticos que a gente estava discutindo, são questões que eu acho que interessam ao público e eu gostaria que a gente conversasse com um pouco mais de clareza também, estou colocando para que o senhor as discuta. A questão das mães avós que... a questão dos filhos na menopausa..."
12/04/1999,Roger Abdelmassih,165,Paulo Markun,"Eduardo, vamos propor uma coisa, senão, se você fizer 20 perguntas para o doutor Roger, ele não vai responder todas. Vamos limitar por aí senão não dá."
12/04/1999,Roger Abdelmassih,166,Eduardo Marini,"Eu gostaria que o senhor falasse sobre essa questão cultural e também sobre esse espaço dos homens, quer dizer..."
12/04/1999,Roger Abdelmassih,167,Roger Abdelmassih,"Muito bem, primeiro, existem muitos tabus na reprodução, e da fertilização então nem se diga. A preocupação de que fertilização in vitro, ou bebê de proveta, advém de óvulos ou espermatozóides obrigatoriamente de outros, isso é uma falha de informação e efetivamente eu acho que não seria... precisa haver mais informação à população. Se o Markun me permitir, eu vou fazer uma pequena propaganda do meu livro. Se ele me permitir."
12/04/1999,Roger Abdelmassih,168,Paulo Markun,Claro.
12/04/1999,Roger Abdelmassih,169,Roger Abdelmassih,"Nós estamos lançando, no dia 6 de maio, novamente um outro livro de esclarecimento à comunidade em geral e ao... Tudo por um bebê, lançado pela Editora Globo, agora. Nós tínhamos um outro livro, lançado por outra editora, que nós vamos lançar no dia 6 de maio, sobre todas essas condições. Segunda coisa, é sobre o problema do homem. O homem, por essas possibilidades, como nós estamos aqui, ele tem tido uma consciência muito maior da participação dele, não obstante a própria medicina, no passado, ter cometido o erro de avançar muito mais nas mulheres, porque facilitava mais o uso da... o trabalho... sobre o diagnóstico e as... as partes terapêuticas na mulher..."
12/04/1999,Roger Abdelmassih,170,Malcolm Montgomery,"Era ignorância mesmo, não é, Roger? Fala a verdade. Era ignorância médica, realmente."
12/04/1999,Roger Abdelmassih,171,Roger Abdelmassih,"Aí havia uma ignorância, e que depois foi crescendo com o aparecimento da andrologia. E aí conheceu-se muito mais que o fator masculino participava. E sobre as mães avós que você coloca, por que não uma mulher? - e aí... aqui está o Malcolm, que trabalha com essas mulheres na idade de climatério e menopausa, fazendo essas mulheres ficarem jovens -, por que essas mulheres, muitas vezes fantásticas, não têm o direito de ser mãe, casando novamente? Elas têm o direito, só que elas não produzem mais óvulos. Mas são mulheres fantásticas, bonitas, plenas, na plenitude, elas, aos 45, 50 anos, plenas, elas podem ter um filho, e vão amar esse filho. Eu tenho um caso, Eduardo, onde a mulher teve o filho aos 58 anos. É uma baiana, hoje ela deve ter 62 anos, porque a criança tem quatro anos já. É uma criança maravilhosa. E há um ano e meio eu tive contato com essa mãe. Esta mãe rejuvenesceu com essa gravidez, ela está plena, está feliz, e a comunicação que nós temos com ela, ela se mantém absolutamente plena. Por quê?"
12/04/1999,Roger Abdelmassih,172,Eduardo Marini,"E com relação aos argumentos de quem acredita que esse filho pode ficar órfão dessa mãe mais cedo do que devia ou que essa criação, pelo fato de a mãe já ter uma idade avançada, pode ter sido, ser diferenciada da relação que se tem normalmente? Quer dizer, como o senhor encara essas discussões?"
12/04/1999,Roger Abdelmassih,173,Roger Abdelmassih,"Quantos órfãos têm, ou crianças absolutamente não participantes com os seus pais jovens – não é? -, que não participam e nem vivem o seu filho?"
12/04/1999,Roger Abdelmassih,174,Eduardo Marini,Órfão de pai vivo.
12/04/1999,Roger Abdelmassih,175,Roger Abdelmassih,"E essas mulheres talvez, Eduardo, sejam muito mais participantes na vida do filho..."
12/04/1999,Roger Abdelmassih,176,Eduardo Marini,"É o amor que está em jogo, não é? Eu acho isso..."
12/04/1999,Roger Abdelmassih,177,Roger Abdelmassih,É o amor e ela está dedicando tudo isso.
12/04/1999,Roger Abdelmassih,178,Paulo Markun,Doutor Roger.
12/04/1999,Roger Abdelmassih,179,Cláudio Collucci,"Agora, doutor Roger, existe um grande temor... uma mulher que quer ter um filho hoje e procura uma clínica, da gravidez múltipla. Que garantia eu tenho? Eu quero ter um filho apenas."
12/04/1999,Roger Abdelmassih,180,Roger Abdelmassih,"Muito bem, veja só. No passado, no passado relativamente curto, quando se fazia a transferência do embrião, voltava o embrião, se transferia com 24 horas depois de tirados os óvulos, feita a fertilização. Nem tinha embrião ainda, era um estado que nós chamamos de pró-núcleo, que tinha os dois núcleos só e se colocavam alguns embriões para ver se um ficava. Mais tarde, passou-se a 48 horas, dois dias, e aí tinham quatro células em divisão e se colocavam, mas ainda não sabia quais eram os embriões bons. Aí se deu um grande passo para 72 horas, três dias. E aí esse passo foi dando condição de uma avaliação melhor da divisão celular, fragmentos que se formavam nos embriões, tudo isso. E aí se escolhiam alguns, mas, mesmo assim, se colocavam os quatro permitidos pelo Conselho Federal de Medicina, porque não se sabia quais poderiam ser os bons e isso aconteciam as gravidezes múltiplas em um índice ainda de aproximadamente 20 a 25% de gêmeos, e 8%, mais ou menos, de trigêmeos. Entretanto, apareceu a possibilidade de se transferirem os embriões com cinco dias após a retirada dos óvulos, em estágios que nós chamamos de blastocisto, onde já existe uma... um grande... esse embrião está praticamente pronto para grudar no útero. E isso fica em laboratório, e você vai escolher efetivamente aqueles que chegarem a blastocisto, porque os outros, ainda um pouco mais retardados, não chegam. E você tem muito menos desses embriões que chegam nesse estágio, e você vai escolher então um ou dois, porque eles estão praticamente prontos, e os dois melhores, por exemplo, porque os outros não são bons. E aí se colocam dentro e você vai ter um número de gêmeos de, aproximadamente, hoje, não passando de 10 a 11%, e de trigêmeos, quando você coloca três, ainda existe uma chance de 2 a 3%. Mas o índice de sucesso de gravidez aumentou muito nesse quadro de cinco dias. Então, essa foi a vantagem que a medicina reprodutiva teve contra a diminuição dos gêmeos e trigêmeos."
12/04/1999,Roger Abdelmassih,181,Malcolm Montgomery,"E a redução, Roger, e a redução?"
12/04/1999,Roger Abdelmassih,182,Roger Abdelmassih,Muito bem. A redução foi um fato muito existente no passado.
12/04/1999,Roger Abdelmassih,183,[...],
12/04/1999,Roger Abdelmassih,184,[...],explicar o que é a redução?
12/04/1999,Roger Abdelmassih,185,Roger Abdelmassih,"Primeiro vamos explicar o que é a redução, desculpe. Redução significa: a mulher que gesta... foram colocados quatro embriões e os quatro grudaram, ou cinco..."
12/04/1999,Roger Abdelmassih,186,Malcolm Montgomery,"Roger, todo mundo faz isso: colocam quatro ou se colocam mais?"
12/04/1999,Roger Abdelmassih,187,Roger Abdelmassih,"Se colocavam mais, Malcolm."
12/04/1999,Roger Abdelmassih,188,Malcolm Montgomery,"Porque esse é um problema também complicado, porque a gente sabe quanto mais embriões estiverem se desenvolvendo, maior o risco materno."
12/04/1999,Roger Abdelmassih,189,[...],Mais chance...
12/04/1999,Roger Abdelmassih,190,Roger Abdelmassih,Exatamente.
12/04/1999,Roger Abdelmassih,191,Malcolm Montgomery,E maior o risco também fetal.
12/04/1999,Roger Abdelmassih,192,Roger Abdelmassih,"Exatamente. Mas o que ocorre é que, às vezes, há uma paciente que está fazendo uma segunda tentativa ou uma terceira tentativa e apareceram lá, quando ainda era em 72 horas ou 48 horas, essa mulher via que tinha cinco ou seis embriões, ela falava, o sujeito falava: “Olha, eu tenho quatro, ou cinco, ou seis embriões.”;: “Ah, põe todos.”. “Mas olha, olha o risco.”;: “Não...”. E aí, doutor, ela é soberana, porque a dona dos embriões é a paciente, nós temos que seguir o Conselho a quatro, mas ela é soberana, desde que nós a informemos."
12/04/1999,Roger Abdelmassih,193,Eduardo Marini,Nesse caso ela assina um documento de responsabilidade?
12/04/1999,Roger Abdelmassih,194,Roger Abdelmassih,"Ela normalmente assina os documentos, porque existem documentos, nas boas clínicas tem que ter documento sempre."
12/04/1999,Roger Abdelmassih,195,Paulo Markun,"E provavelmente, nessas circunstâncias, ela assina qualquer coisa, não é? É um ser bastante..."
12/04/1999,Roger Abdelmassih,196,Roger Abdelmassih,"Não, nem sempre, Markun. Você tem que dar, inclusive, essa documentação até um pouco antes, para ela verificar se ela está de acordo com isso ou não. E, obviamente, nem sempre você tem uma condição de oportunidade de ela assinar bem antes, mas normalmente você faz ela assinar antes."
12/04/1999,Roger Abdelmassih,197,Paulo Markun,"Mas vamos voltar à redução, porque não se..."
12/04/1999,Roger Abdelmassih,198,Roger Abdelmassih,"Tudo bem. Então, no que tange à redução, a paciente engravidou de quatro ou cinco e o risco de ela abortar todos é muito grande. E existia - aí entra um problema de ordem ética, de ordem moral e religiosa, do aspecto da redução - é reduzir, por exemplo, quatro embriões para dois embriões. Então, cabe ao médico e cabe ao profissional indicar, mesmo que ele não esteja afeito a indicações desse tipo, ele tem a obrigação de dar a informação científica de que essa mulher pode, por um procedimento absolutamente simples, interromper dois fetos e seguir com dois, para que salve aqueles dois. Essa era..."
12/04/1999,Roger Abdelmassih,199,Cláudia Collucci,"Simples, entre aspas..."
12/04/1999,Roger Abdelmassih,200,Roger Abdelmassih,"Um minutinho, Cláudia."
12/04/1999,Roger Abdelmassih,201,Cláudia Collucci,"É traumático, né?"
12/04/1999,Roger Abdelmassih,202,Roger Abdelmassih,"Exatamente. Por isso mesmo que esse traumatismo vem sendo evitado com blastocisto. Esse traumatismo, hoje, você quase que não tem mais a chance de ocorrer. Por quê? Porque você normalmente trabalha com dois a no máximo três blastocistos. Se você me perguntar se eventualmente é colocado o quarto blastocisto: talvez, depende do tempo de gravidez, do tempo da idade da mulher, tudo isso. Mas normalmente são dois, não mais do que dois, e às vezes três. Então, essa chance de reduções, a interrupção de alguma parte dos fetos que a mulher está gestando, graças a Deus, praticamente tende ao desaparecimento... e diminuiu muito."
12/04/1999,Roger Abdelmassih,203,Paulo Markun,"Roger,..."
12/04/1999,Roger Abdelmassih,204,Roger Abdelmassih,Porque isso é um problema muito sério para a decisão do médico e da paciente.
12/04/1999,Roger Abdelmassih,205,Paulo Markun,"Nós vamos fazer um rápido intervalo e voltamos já, já com o Roda Viva com o doutor Roger Abdelmassih."
12/04/1999,Roger Abdelmassih,206,[...],
12/04/1999,Roger Abdelmassih,207,Paulo Markun,"Estamos de volta com o Roda Viva, que não pára aqui no intervalo."
12/04/1999,Roger Abdelmassih,208,[...],
12/04/1999,Roger Abdelmassih,209,Paulo Markun,"Por favor, nós estamos no ar gente. Estamos de volta com o Roda Viva, transmitido ao vivo para todos os estados brasileiros e também para Brasília. E você pode participar do programa fazendo perguntas, o telefone é o 011 252-6525, o fax 011 3874-3454 e o nosso endereço na internet é rodaviva@tvcultura.com.br. Doutor Roger, há uma porção de perguntas aqui, eu vou juntá-las, eu, toda vez que faço isso, eu morro de medo, porque às vezes a pergunta não é exatamente aquela que o telespectador fez, mas o assunto é exatamente o mesmo. João Batista Silva, de Jacareí, São Paulo, aborda esse assunto; também Cristina Meirelles, que manda pela internet; Cláudia Savaia, do Morumbi; Silvana, de Moema, São Paulo; Élcia Freire, de Taubaté, São Paulo. Tem mais uma outra pergunta de Fábio Mansur e Cássia Mansur, de Volta Redonda, no Rio de Janeiro; de Nívia Maria dos Santos Mendonça, de São Bernardo, e de Cláudia, aqui de São Paulo, que perguntam o seguinte: “Por que é tão caro?”. As perguntas são nessa linha: por que é tão caro, quanto custa e quantas tentativas é necessário fazer para que alguém obtenha o sucesso nesse tipo de tratamento?"
12/04/1999,Roger Abdelmassih,210,Roger Abdelmassih,"Bom, eu vou começar pelo fim. O número de tentativas é o necessário para se conseguir um projeto de ter o filho. É evidente que nós estamos trabalhando com chances e não com uma certeza absoluta. Por isso, quando nós trabalhamos com um casal onde a mulher é jovem e as condições efetivamente de produção de óvulos dela seriam condições bastante favoráveis, a chance dessa mulher é muito boa, muito alta, mas na média, entre mulheres mais jovens, mulheres mais de idade, com problemas maiores ou menores na produção de óvulos - e veja que eu falo muito em óvulos, porque o problema do espermatozóide está praticamente dominado -, os resultados em média hoje são de aproximadamente 35 a 36% de chance de gravidez por tentativa, seja nas mais variadas situações, por tentativa de ter um filho nascido. Ora, essa taxa ainda é muito boa, mas é uma taxa percentual que não é 100%. Então o casal tem que se propor a buscar esse filho e tentar algumas tentativas que possam trazer a felicidade e a resolução desse casal. Insistir. Então, “n” tentativas. Aquilo que for suportável na caminhada desse casal. Sobre o problema de custo, evidentemente os custos não são baratos, porque essa tecnologia é uma tecnologia onde tem um material importado. Para você ter uma idéia, Markun, os meios de cultura que nós usamos, eles são trazidos de fora por centros especializados que desenvolvem esses meios de cultura de melhor qualidade, não obstante poder ser feito aqui. Mas os meios de cultura já tradicionalmente comprovados, com ótimos resultados, são importados e nós não temos uma condição legal de importação, não por causa da importação, mas até a chegada dele, porque ele tem um tempo de validade curto e às vezes fica parado para uma legalização. E as condições pioram, da qualidade desse material. Então, tudo isso acaba acarretando custos que vão fazendo com que esse material chegue rapidamente, as coisas todas importadas e, mais ainda, a pesquisa, porque o centro que não pesquisa, ele não... ele não está produzindo nada."
12/04/1999,Roger Abdelmassih,211,Paulo Markun,Quanto que custa?
12/04/1999,Roger Abdelmassih,212,Roger Abdelmassih,"Não, eu já vou chegar lá. Então o valor, não é um procedimento efetivamente barato dependendo daquilo que você faz. Na nossa clínica, por exemplo - eu faço questão de aproveitar este momento - nós estamos inaugurando um centro de pesquisa básica trazendo esse indivíduo que eu acabei de citar umas duas vezes, para viver no Brasil para pesquisar, para nós exportarmos tecnologia e não só mais ficarmos importando tecnologia. Exportarmos técnica. Muito bem, e o custo disso vai na variável... Na nossa clínica vai variar - é óbvio, eu estou falando em fertilização in vitro, e não em técnicas mais simples, fertilização in vitro -, vai variar entre 6 mil a 9 mil o custo por procedimento."
12/04/1999,Roger Abdelmassih,213,Paulo Markun,"Por procedimento significa por tentativa ou existe, existe..."
12/04/1999,Roger Abdelmassih,214,Roger Abdelmassih,Por tentativa.
12/04/1999,Roger Abdelmassih,215,Paulo Markun,"Quer dizer, se..."
12/04/1999,Roger Abdelmassih,216,Roger Abdelmassih,Se não der certo tem que fazer novamente. Vai variar entre 6 a 9 mil.
12/04/1999,Roger Abdelmassih,217,Paulo Markun,"E essa tentativa envolve mais de uma experiência ou uma só? Quer dizer, uma tentativa é um óvulo..."
12/04/1999,Roger Abdelmassih,218,Roger Abdelmassih,"Não, se não der certo vai ter que tentar novamente. Se caiu nos 60..."
12/04/1999,Roger Abdelmassih,219,[...],É um ciclo.
12/04/1999,Roger Abdelmassih,220,Paulo Markun,É um ciclo menstrual.
12/04/1999,Roger Abdelmassih,221,Roger Abdelmassih,"É um ciclo. Chamam isso de “ciclo de tentativa de fertilização in vitro”. Então é um procedimento relativamente custoso, mas eu não sei se é tão custoso dentro de um contexto de uma resolução como é essa do filho. Porém, porém, quando nós vamos para uma população média brasileira para baixo, isso que é a judiação, os nossos planos de saúde não atendem o casal sem filho, porque a esterilidade não é paga pelos planos de saúde."
12/04/1999,Roger Abdelmassih,222,Paulo Markun,Mas a bem da verdade os planos de saúde não querem nem que tenha filho.
12/04/1999,Roger Abdelmassih,223,Roger Abdelmassih,E desgraçadamente os nossos deputados votaram o ano passado...
12/04/1999,Roger Abdelmassih,224,Paulo Markun,"O plano de saúde não quer nem que as pessoas tenham filhos, o que torna a coisa mais complicada."
12/04/1999,Roger Abdelmassih,225,Roger Abdelmassih,"Exatamente, talvez nem isso."
12/04/1999,Roger Abdelmassih,226,[...],
12/04/1999,Roger Abdelmassih,227,Roger Abdelmassih,"Porque os nossos deputados, recentemente, quando aprovaram esse último plano de saúde, não incluíram a esterilidade como possibilidade de tratamento nos planos de saúde. Isso, para um país como o nosso, que é pobre, ele não tem isso, e os países ricos têm essas condições de apoio para o casal sem filho."
12/04/1999,Roger Abdelmassih,228,Paulo Markun,"Agora, existem algumas faculdades e alguns institutos públicos que fazem esse trabalho."
12/04/1999,Roger Abdelmassih,229,Roger Abdemassih,"Existem, existem. Infelizmente, Markun, essas faculdades heróicas - não é? -, tentando fazer os procedimentos... Nós vimos agora, recentemente, tinha o Pérola Byington que estava indo razoalvelmente bem, mas mas com uma mudança talvez política, circunstancial, acabou praticamente, acabou o projeto de feritilização in vitro lá, e era um centro que trabalhava mais adequadamente. Porque os outros centros, nas universidades, se esforçam muito, mas o custo é tão caro e tão difícil, que muitas vezes não tem condição de mantê-los numa condição normal e exeqüível para um resultado favorável."
12/04/1999,Roger Abdelmassih,230,Paulo Markun,Ainda falando da coisa básica. Que passos o casal deve ter antes de chegar a desembolsar essa quantia e ir para a fertilização in vitro?
12/04/1999,Roger Abdelmassih,231,Roger Abdelmassih,"Veja, o casal deve passar por uma investigação. Só que, veja só, nós temos que considerar o casal em idade. Um casal que tenha... a mulher tenha 35 anos, casada com três, quatro anos e sem filhos, e com 35, 36 anos, ela tem que estar direcionada talvez para procurar uma orientação mais específica de busca de filho, porque o tempo dela está passando. Se é uma mulher mais jovem e com o tempo de casamento de três anos, mas bem mais jovem, ela deve fazer um procedimento de busca de um filho talvez naturalmente, e não por fertilização in vitro. Ela tem o caminho da investigação. Agora, dependendo do tempo de casamento, da idade da paciente, ela tem obrigação de procurar uma solução que traga chances melhores para ela, porque se eu tenho de 15 a 18% de chances de gravidez por mês num casal normal, o casal que não é normal, que tem problemas, estará entre 0 e 10, 12% de chances de gravidez..."
12/04/1999,Roger Abdelmassih,232,Malcolm Montgomery,"Mas Roger,..."
12/04/1999,Roger Abdelmassih,233,Roger Abdelmassih,"... e talvez a resolução seja um pouco mais demorada, e depende da idade da mulher."
12/04/1999,Roger Abdelmassih,234,Malcolm Montgomery,"A Sociedade Brasileira de Reprodução Humana, ela tem lá um tipo de cronograma – né? - que deve ser seguido por todos os..."
12/04/1999,Roger Abdelmassih,235,Roger Abdelmassih,"É, veja só: eu, como presidente da regional de São Paulo da Sociedade Brasileira de Reprodução Humana, tenho procurado implantar aqui... como nós temos procurado e você sabe muito bem que nós procuramos fazer um controle, inclusive, de qualidade dos centros de fertilização in vitro..."
12/04/1999,Roger Abdelmassih,236,Malcolm Montgomery,"Das clínicas, não é?"
12/04/1999,Roger Abdelmassih,237,Roger Abdelmassih,"... com uma dificuldade que acaba não andando e, por isso, eu fiz questão de rapidamente fazer o meu ISO 9002 internacional para qualificar e fazer uma avaliação de qualidade do nosso laboratório, e isso é uma obrigação da Sociedade Brasileira de Reprodução Humana, é uma obrigação do Conselho, talvez, Federal de Medicina, avaliar os centros que trabalham com fertilização in vitro e os laboratórios. Porque o que importa é resultado. Se eu tenho um laboratório que não tem um bom resultado - e existe -, ele está dando ilusões a um casal sem filho talvez até menores do que um tratamento convencional que poderia ser feito."
12/04/1999,Roger Abdelmassih,238,Cláudia Collucci,Os Estados Unidos criou recentemente uma comissão para investigar.
12/04/1999,Roger Abdelmassih,239,Roger Abdelmassih,"Foi. Essa comissão... depois de um longo tempo. Mas essa comissão funcionou, mas antes dessa comissão, dos 500 ou 600 centros que tinha nos Estados Unidos, foram reduzidos, antes de aparecer a comissão, já tinha somente 200, porque tinham muitos centros que não tinham resultados. E com essa comissão, ainda se reduziu mais os centros de fertilização in vitro nos Estados Unidos."
12/04/1999,Roger Abdelmassih,240,Walter Pinto,"Roger, eu queria fazer uma perguntinha bem simples para você. É que o pessoal..."
12/04/1999,Roger Abdelmassih,241,Roger Abdelmassih,Você não conseguiu fazer uma pergunta.
12/04/1999,Roger Abdelmassih,242,Walter Pinto,"Estou conseguindo fazer uma pergunta, me deixaram."
12/04/1999,Roger Abdelmassih,243,[...],
12/04/1999,Roger Abdelmassih,244,Walter Pinto,"É uma pergunta bem interessante. A população não sabe bem disso, mas eu sei que com a fertilização assistida, com o ICSI e com essa evolução para o blastocisto jovem, você pode pegar a célula de dentro e estudar aquela célula, com uma série de doenças genéticas, que é o que eu faço, então pode estudar uma série de doenças ali dentro, mas também pode determinar o sexo. Então, você tem na mão uma arma que você pode fazer o sexo, você pode determinar se a criança vai ser normal, pode excluir aquelas crianças com as aberrações cromossômicas, você pode fazer um monte de coisas. Você acha que isso... sexo... aparecem muitos casais pedindo isso para você? Eu gostaria de ter uma..."
