|DATA|ENTREVISTA|ORDEM|LOCUTOR|FALA
47|21/02/2005|Simão Jatene|48|Paulo Markun| Governador, eu gostaria o que senhor explicasse um pouco mais detidamente o que é esse zoneamento para quem não conhece, mas queria introduzir a pergunta da Sociedade Paraense de Defesa dos Direitos Humanos, que diz que esse zoneamento foi apresentado no dia 19 agora de fevereiro na Assembléia, e que ele deveria ser, segundo a Sociedade Paraense de Defesa dos Direitos Humanos, um processo de negociação com a sociedade. E eles afirmam que isso não tem sido debatido com a sociedade, porque em 14 de fevereiro o Conselho Estadual do Meio Ambiente, que é um órgão que tem representação de várias organizações não-governamentais, aprovou um requerimento para que tal projeto fosse apresentado, e que estaria restrito ao conhecimento de poucas pessoas. E eles perguntam o seguinte: “O zoneamento econômico e ecológico tem sido requisitado para a concessão de empréstimos pelo Banco Mundial. O governo do estado está verdadeiramente interessado nesse projeto ou mais interessado no financiamento do Banco Mundial? Quando o governo do estado pretende envolver a sociedade nessa discussão?”
48|21/02/2005|Simão Jatene|49|Simão Jatene| Bom, eu só posso, de alguma forma, estranhar o fato de alegar desconhecimento, quando ainda há pouco, nós tivemos... isso está no site do governo do estado. Então se desconhece o que está no site, que sem dúvida é um dos mecanismos bastante democráticos da difusão da informação. É questão do site. Isso está lá. Então eu tenho um pouco de dúvida disso. Segundo, essa discussão sobre se isso está sendo feito para tomar operação de crédito, não tem absolutamente nada. O que nós temos é claramente o seguinte: é óbvio que o zoneamento precisa de um financiamento. Por quê? Como é que está tratado o zoneamento? Nós temos o macro-zoneamento que define grandes áreas, grandes manchas no estado: áreas de preservação integral, áreas de uso restrito, áreas de uso intensivo e áreas de recuperação. Esse é o macro-zoneamento. A partir daí, é absolutamente fundamental que se avance no detalhamento das áreas de uso intensivo. Por quê? Porque aí é que as coisas acontecem. Aí que a atividade econômica está posta. Porém ele traz – e eu sempre digo, não é panacéia – ele tem, primeiro, a possibilidade de reduzir a expectativa de direito de determinadas áreas. Porque ele traz de pronto o seguinte: no mínimo, 65% das terras do estado estarão sob algum tipo de proteção. No mínimo, 65. E no máximo, 35% das terras do estado serão utilizadas para consolidar o que nós chamamos a “fronteira aberta”, que são exatamente as áreas que já estão antropizadas, são áreas que já são objeto de uma ação mais intensa da própria sociedade. Com isso, ele tem também uma outra coisa que eu acho que é extremamente importante. Hoje você pode desmatar 20%, por exemplo, na região nordeste do estado do Pará, e tem que manter 80% de reserva; a mesma coisa você pode fazer na margem esquerda do Amazonas.
49|21/02/2005|Simão Jatene|50|Teresa Cruvinel| Isso em cada propriedade?
50|21/02/2005|Simão Jatene|51|Simão Jatene| Em cada propriedade. O que é verdade é que não tem nenhuma chance em determinadas regiões; 20% são um absurdo, porque não tem que mexer é nada. Por exemplo, na margem esquerda do Amazonas não tem que mexer nada, tem que manter 100% como área de proteção integral. Em compensação, limitar a 20% o uso da terra na região nordeste do estado é você estar mantendo como reserva , o Acre, a vassoura-de-botão , juquira , enfim, não tem mais a floresta. Então o zoneamento vem e traz a possibilidade de compensação de áreas, o que é uma coisa importante. Que é exatamente o quê? Diz o seguinte: bom, se você tem uma propriedade de mil hectares na região nordeste do estado, e você pode usar 20%, ou seja, duzentos hectares. Você tem que manter oitocentos hectares. Mas não tem mais floresta nesses oitocentos hectares. E você pode utilizar uma parte, desde que compre o que nós estamos chamando de “cota de preservação”, e pague para manter uma área de reserva, numa área já definida como área de preservação permanente.
51|21/02/2005|Simão Jatene|52|Paulo Markun| Governador, desculpe interromper o senhor, mas a sensação que me dá é que parece aquela história do Mané Garrincha*. O senhor lembra do jogo de futebol quando tinha que combinar com os russos?
52|21/02/2005|Simão Jatene|53|[*Na Copa de 1958, às vésperas do jogo do Brasil contra a ex-União Soviética, a preocupação do técnico Feola era o lateral do time russo, Tsarev, cuja missão era segurar Mané. O treinador, então, orientava o craque| “Quando o Tsarev vier em disparada, passe a bola. Quando o outro beque vier pela direita, drible pela esquerda...”. Mané Garrincha, que não gostava de esquemas táticos no futebol, pergunta: “O senhor já combinou tudo isso com os russos?”]
53|21/02/2005|Simão Jatene|54|Simão Jatene| Foram dois anos combinando com...
54|21/02/2005|Simão Jatene|55|Paulo Markun| Eu quero entender o seguinte: como combina com gente como essas pessoas que mataram a freira e que tem uma lista de assassinatos?
55|21/02/2005|Simão Jatene|56|Simão Jatene| Espere um pouquinho. A primeira coisa que eu acho importante é o seguinte: na hora em que o zoneamento estiver aprovado, determinadas áreas como, por exemplo, a Terra do Meio, vai ser mostrado para o país inteiro que aquilo é uma de preservação integral. Então o grileiro que quiser vender um pedaço de terra ali, por suposto, ele não vai encontrar, pelo menos nas pessoas de boa-fé, a expectativa de direito de ter aquele pedaço de terra.
56|21/02/2005|Simão Jatene|57|Adriana Ramos| Mas, veja bem, essas áreas foram criadas como unidades de conservação pelo governo. Então para além do planejamento da destinação, é preciso ter instrumentos que efetivem o que se quer fazer daquela área.
57|21/02/2005|Simão Jatene|58|Simão Jatene| É por isso que nós estamos trabalhando em cotas de preservação.
58|21/02/2005|Simão Jatene|59|Adriana Ramos| Não adianta o senhor ter o zoneamento e apontar para uso intensivo se o senhor não tem os instrumentos que vão fazer com que os diversos títulos que se sobrepõem a uma mesma área sejam invalidados. Quais são os instrumentos concretos para trabalhar com a questão da grilagem?
59|21/02/2005|Simão Jatene|60|Simão Jatene| Nós estamos falando de quantos milhões de quilômetros quadrados, quando a gente fala do Pará? Estamos falando de 1,25 milhão de quilômetros quadrados. É Alemanha, França, Inglaterra, tudo junto. Imaginar que você vai operar com o mesmo grau de detalhe em 1,25 milhão de quilômetros quadrados é ou ingenuidade ou, sem dúvida alguma, má-fé. O que o zoneamento vem dizendo? Que, na verdade, nas áreas de preservação integral, não tem que discutir titulação ali dentro. Como aquilo é preservação integral, então ali dentro está, por suposto, por princípio, de plano, de pronto, esgotado.
60|21/02/2005|Simão Jatene|61|Adriana Ramos| Não é zoneamento que faz isso, é o decreto que cria as unidades de conservação. É um instrumento que vem depois.
61|21/02/2005|Simão Jatene|62|Simão Jatene| Mas o zoneamento vem e evita que a gente faça uma coisa que eu chamo de “ação por soluço”. Quando você tem uma pressão, cria uma; tem outra pressão e cria outra. Então ele vem e já define claramente determinados maciços onde serão as áreas de preservação. Qual é nossa idéia? E foi isso que discutimos recentemente há uns 15 dias atrás...
62|21/02/2005|Simão Jatene|63|Teresa Cruvinel| Como vão tirar os grileiros que já estão dentro dessas áreas? 
63|21/02/2005|Simão Jatene|64|Simão Jatene| Desculpe?
64|21/02/2005|Simão Jatene|65|Teresa Cruvinel| Uma vez demarcado e decidido institucionalmente que aquilo é área intocável, como se vão tirar – os chamados instrumentos a que a Adriana se refere – os grileiros, madeireiros?
65|21/02/2005|Simão Jatene|66|Simão Jatene| Por que levou dois anos para fazer o zoneamento?
66|21/02/2005|Simão Jatene|67|Teresa Cruvinel| Como o estado vai agir, seja o estado unidade federada, ou seja, o estado central?
67|21/02/2005|Simão Jatene|68|Simão Jatene| O estado nacional através dos seus vários entes. Mas o que nós fizemos nesse período todo? Tivemos um enorme cuidado de trabalhar efetivamente as zonas antropizadas e procurar transferi-las para áreas de uso intensivo. Então, esse foi um cuidado sim.
68|21/02/2005|Simão Jatene|69|Maria Zulmira de Souza| Mas governador, como o senhor explica, então, o que está acontecendo, por exemplo, na região próxima a São Félix do Xingu, na Vila Taboca. Estivemos lá no ano passado, a TV Cultura fez um documentário lá; inclusive mostramos o projeto-piloto do zoneamento ecológico econômico. Vila Taboca é um típico caso onde os grileiros continuam agindo, invadindo áreas que seriam áreas indígenas, e está todo mundo sabendo e não há uma ação. Como é que, de repente, esse zoneamento aprovado vai acabar com essa situação?
69|21/02/2005|Simão Jatene|70|Simão Jatene| Mas eu já disse que ele não é panacéia. Agora, sem dúvida alguma, ao disciplinar, ele reduz expectativas de direito, o que é importante para reduzir grilagem. Porque as pessoas de boa-fé estão muito mais protegidas na hora em que elas sabem que ali é uma área de preservação. Ele precisa ter uma divulgação nacional intensa para evitar que pessoas do sul possam ser iludidas. Porque o que o grileiro faz? Ele se apropria de um pedaço de terra e vende essa expectativa de direito. O que nós estamos discutindo inclusive com o próprio Incra e com o Ministério do Meio Ambiente, que é absolutamente fundamental. Por isso que diziam que não pode ser um zoneamento do governo do Pará, tem que ser um zoneamento do Pará. Então, temos que partir daí para fazer um programa intenso de regularização fundiária nas áreas de uso intensivo...
70|21/02/2005|Simão Jatene|71|Júlio Veríssimo| Governador, desculpe interromper.
71|21/02/2005|Simão Jatene|72|Simão Jatene| Claro.
72|21/02/2005|Simão Jatene|73|Júlio Veríssimo| Mas, por favor, então eu posso chamar de ZEE  o projeto? Eu não sei se é o nome que inclusive tem lá. Mas como o senhor aplicaria essa ZEE, em Novo Progresso, por exemplo, onde os madeireiros dominam a cidade a tal ponto em que o poder público está junto com os madeireiros. Os trabalhadores da cidade preferem pegar uma motosserra para ganhar oitocentos reais por mês, do que necessariamente trabalhar no extrativismo ou em outra área onde inclusive depois eles vão ser expulsos pelos grileiros. Eu não consigo entender, desculpe, como uma zona como essa, esse projeto que o senhor pretende implantar, ele vai mudar a vida, por exemplo, de Novo Progresso? Porque a população chega a barrar a BR 163, a tacar fogo em ônibus e destruir pontes. Como é que vai fazer isso?
73|21/02/2005|Simão Jatene|74|Simão Jatene| Pois é, então, veja uma coisa.
74|21/02/2005|Simão Jatene|75|Júlio Veríssimo| Como é que vai fazer isso? Como é que vai mudar a  da cidade?
75|21/02/2005|Simão Jatene|76|Simão Jatene| Ao longo da BR 163, quando a gente vê no projeto de zoneamento, tem um corredor de uso intensivo, a partir do que, está blindado por uma área de uso restrito, e finalmente uma área de preservação integral. O zoneamento tem exatamente essa característica. O que é que ele vem? Ele vem ao encontro da realidade. Na verdade o que hoje você imaginar... a BR 163 está aberta, isso não depende da nossa vontade, ela já está posta lá. A Transamazônica, que é o que eu tenho dito claramente, por que a gente discute o conceito de consolidar a fronteira aberta? Porque eu estou convencido de que talvez um dos poucos mecanismos para se evitar o avanço sobre a floresta é melhorar a qualidade de vida das populações onde você já tem a fronteira aberta, ao invés de abrir novas áreas. Na Transamazônica, há uma tradição de cem quilômetros. E eu confesso aos senhores que quando eu vejo discutir se seria importante ou não asfaltar a Transamazônica porque provocaria impacto, eu tendo a ver com profunda tristeza esse tipo de avaliação. Por quê? Porque quando se discute a questão da apuração de um caso como esse em que nós estamos agora... Tem trecho da Transamazônica que, para andar 140 ou 150 quilômetros, leva-se oito horas, muito mais tempo empurrando do que dentro do próprio carro. Então, quando a gente está discutindo é importante... não tem nenhum instrumento que vai ter o condão para resolver uma questão para a qual já se escreveu os quatro séculos de latifúndio. Eu acho que poderemos escrever os cinco séculos de latifúndio neste país. Nenhuma medida isolada vai ter essa possibilidade. Porém acredito que um conjunto de instrumentos, como nós estamos discutindo agora, eu tenho dito claramente o seguinte: preocupo-me muito com o depois que os holofotes se apagam. Como é que ficam as coisas? Por quê? Porque eu estou convencido de que nós precisamos ter uma ação clara e exemplar de identificação dos criminosos, dos mandantes, etc, no caso da irmã Dorothy. Mas nós não podemos ficar aí; a ação policial tem que continuar como uma larga ação de desarmamento em determinados bolsões do estado. Tem sim.
76|21/02/2005|Simão Jatene|77|Roldão Arruda| Governador, eu vou voltar a insistir numa coisa.
77|21/02/2005|Simão Jatene|78|Simão Jatene| Claro.
78|21/02/2005|Simão Jatene|79|Roldão Arruda| Por que nós não discutimos esse plano de zoneamento antes da irmã Dorothy morrer? Antes desse assassinato? O senhor começou dando sua entrevista com uma coisa muito interessante, mostrando a sua preocupação em sanear as contas do estado, a questão de folha de pessoal, equilíbrio nas contas. A minha dúvida é a seguinte: não é questão de ênfase política? Não é questão de vontade política? Ou seja, o senhor faz parte de um governo, de um grupo político que está há oito anos no poder. O senhor está há dois anos no poder. Agora, com seu estado com uma espécie de intervenção branca, com o exército lá no fundo, o senhor está nos levando a discutir esse plano de zoneamento. A minha pergunta é: é ou não uma questão de vontade política? Ou então, perguntando talvez com ele: será que no estado – talvez o senhor possa nos esclarecer – o poder econômico, o poder político desses grupos que atuam nessas regiões é tão forte que leva o governo a ter medo de enfrentar? É tão forte que leva o estado a se mobilizar e deixar tudo por conta deles? Porque tem que ter uma explicação, governador, tem que ter uma explicação?
79|21/02/2005|Simão Jatene|80|Simão Jatene|  Claro que tem que ter uma explicação! Por que este país não fez a reforma agrária? Isso não é uma questão particular do estado do Pará não, vamos parar e colocar as coisas nos devidos lugares. Este país não enfrentou a questão urbana, por quê? Este país não enfrentou a questão agrária, por quê? Isso é uma questão particular do estado do Pará? Não me consta. Rigorosamente, não me consta. A questão agrária tem manifestações no estado do Pará, mas ela tem uma dimensão nacional. E, efetivamente, nós não a enfrentamos até hoje. Então, não se trata o que é... Aí quando você diz: “Bom, por que agora você está apresentando o zoneamento?”. Nós estamos há dois anos discutindo o zoneamento porque queremos que ele venha exatamente com a consistência e com a chancela para não ser um documento de prateleira, para ser efetivamente assumido pela sociedade. E, não tenho dúvida, insisto, não é panacéia, não acredito em panacéia. Mas eu não tenho nenhuma dúvida de que ele vai ser um instrumento fundamental, até para a ação fundiária. Ele vai ser fundamental para que a gente desmistifique algumas coisas. Tenho dito claramente o seguinte: a Amazônia tem sido sempre muito fértil na produção de mitos. Nós transitamos de “inferno verde” para “celeiro do mundo”, dependendo do humor de quem nos olha. Nós transitamos de “almoxarifado” para “santuário”, dependendo da lente que colocam para nos olhar. Na verdade não somos nem inferno verde nem celeiro do mundo; não somos nem almoxarifado e nem santuário. Não somos o Brasil escondido não, porque senão você tem que olhar para a favela e encontrar um Brasil escondido na favela, aqui, a poucos quilômetros daqui. Agora, sem dúvida, o seguinte: criou-se uma expectativa da terra livre na Amazônia, se incentivou a ida para lá de agentes com interesses muito distintos, e depois se passou a discutir o seguinte: asfaltamos ou não? Levamos água ou não? Levamos energia ou não? E essa população, como fica?
80|21/02/2005|Simão Jatene|81|Paulo Markun| Governador, desculpe. Na época da ditadura militar, que o senhor certamente combateu, está no seu currículo inclusive – e acho que a gente que esteve nessa situação tem que reconhecer que fez isso alguma vez – ocupar a Amazônia era um projeto nacional...
81|21/02/2005|Simão Jatene|82|Simão Jatene| Sim.
82|21/02/2005|Simão Jatene|83|Paulo Markun| Quem fosse falar contra isso era  subversivo, maluco ou era interessado nos grandes trustes internacionais de manter a Amazônia, coisa que até hoje na internet, volta e meia aparece essa lenda de que aquilo está nos mapas norte-americanos. Acontece que no governo democrata, da democracia para cá, não houve uma proposta regular de ação em relação à Amazônia. Hoje o governo do Mato Grosso do Sul tem um tipo de política, o governo do Mato Grosso tem outra, do Pará tem outra, e o Brasil não tem uma definição clara em relação a isso.
83|21/02/2005|Simão Jatene|84|Simão Jatene| Na verdade nós não temos, não é só com a Amazônia não. Acho que a questão regional neste país tem sido objeto de atenção cíclica. Em determinados momentos, então, você vem, aí a questão regional assume algumas cores, de repente aí... Você imaginar que um país da dimensão do Brasil pode ser tratado de forma homogênea é sem dúvida não querer encontrar o caminho. Eu digo que o nosso desafio é como a gente usa nossa diversidade para reduzir as desigualdades.
84|21/02/2005|Simão Jatene|85|Paulo Markun| Mas a dúvida é saber, governador, se esse projeto de zoneamento ou qualquer outro projeto, por mais bem intencionado que seja, substituiu a presença do Estado, no que ele tem de mais elementar.
85|21/02/2005|Simão Jatene|86|Simão Jatene| Eu diria que ele facilita a presença do Estado.
86|21/02/2005|Simão Jatene|87|Paulo Markun| Mas como vai fazer? Num santuário. O santuário vai ficar lá porque a gente botou no zoneamento que é santuário, não precisa ninguém fiscalizar, não precisa ter fiscal, não precisa ter cerca, não precisa ter nada?
87|21/02/2005|Simão Jatene|88|[sobreposição de vozes]|
88|21/02/2005|Simão Jatene|89|Simão Jatene| Não, não, mas a sociedade toda vai saber que aquilo é um santuário.
89|21/02/2005|Simão Jatene|90|[sobreposição de vozes]|
90|21/02/2005|Simão Jatene|91|Simão Jatene| Deixem eu dar para vocês um dado. Basta pegar as informações de 1996 para cá e acompanhar a evolução do desmatamento, vocês vão ver uma coisa: as áreas declaradas como reserva, mesmo sem os instrumentos de fiscalização, têm um condão inibidor. E é fácil ver isso no mapa, basta pegar o mapa. Se pegar as imagens de satélites, você vai ver nessa região que estou chamando de região nordeste ou na região leste do estado, nós vamos encontrar determinadas reservas em que você vê como o processo de ocupação as envolve, e elas de alguma forma se mantêm.
91|21/02/2005|Simão Jatene|92|Adriana Ramos| Sim, governador, mas de qualquer maneira, o zoneamento dá um indicativo, mas precisa, em algum momento, o Estado, o governo fazer a sua decisão. Quer dizer, acho que a crítica em relação ao zoneamento do governo do Pará é que ele foi bastante divulgado, mas o processo de negociação que faz com que o zoneamento possa ter esse poder por si, porque ele foi negociado e acordado com todos, não foi um processo ainda concluído. E há situações em que algum momento isso vai ter que se decidir. Por exemplo, na região onde há o Projeto de Desenvolvimento Sustentável Esperança, onde trabalhava a irmã Dorothy, em Anapu, a previsão do zoneamento do estado, pelo menos na versão de dezembro de 2004, é que é uma área de consolidação de atividades produtivas. Então ali nós temos os trabalhadores rurais do assentamento e temos uma série de outros atores sociais, grileiros, madeireiros, muitos deles que já tiveram projetos apoiados pela Sudam , foram inclusive incriminados por corrupção na Sudam, e estão soltos, continuam atuando lá. Em algum momento, quais vão ser atividades produtivas consolidadas nessa região? Essa opção de qual vai ser o desenvolvimento, mesmo intensivo, nas regiões onde está definido como intensivo, o governo do estado vai ter que fazer...
92|21/02/2005|Simão Jatene|93|Simão Jatene| Com certeza.
93|21/02/2005|Simão Jatene|94|Adriana Ramos| E vai ter que ter instrumentos para poder deliberar a quem vai dar o direito da terra.
94|21/02/2005|Simão Jatene|95|Simão Jatene| É por isso que nós chamamos a este estágio agora de macro-zoneamento. O detalhamento vai ter que acontecer.
95|21/02/2005|Simão Jatene|96|Adriana Ramos| Como é que vai ser feito o detalhamento?
96|21/02/2005|Simão Jatene|97|Simão Jatene| Só que ao invés de você fazer um detalhamento de 1,25 milhão de quilômetros quadrados, você vai detalhar 1/5 disso. Aí nós caímos, na verdade, num mundo real, de poder financiar e fazer o...
97|21/02/2005|Simão Jatene|98|Rui Nogueira| Então o senhor tocou no ponto. Se o senhor tivesse a possibilidade de asfaltar esse pedaço da Transamazônica, o senhor teria dinheiro para fazer isso? Ou o seu estado investiria nisso que o senhor pode considerar positivo asfaltar?
98|21/02/2005|Simão Jatene|99|Simão Jatene| Com certeza.
99|21/02/2005|Simão Jatene|100|Rui Nogueira| Com certeza?
100|21/02/2005|Simão Jatene|101|Simão Jatene| Com certeza.
101|21/02/2005|Simão Jatene|102|Rui Nogueira| Governador, eu tenho aqui uma lista da revista Veja que publicou um quadro com: “O que queria a irmã Dorothy” e “O que querem os seus inimigos”. O que queria a irmã Dorothy: desapropriação de terra pública controlada por grileiros, assentamento de seiscentas famílias, ação da polícia na intermediação, programas de recuperação das áreas e financiamento. Isso é o que queria a irmã Dorothy, ou o quer o Estado ou qualquer cidadão brasileiro. Por que isso não foi feito até hoje?
102|21/02/2005|Simão Jatene|103|Simão Jatene| Veja, eu acho que é exatamente... por que isso não foi feito até hoje? Porque este país ainda não assumiu...
103|21/02/2005|Simão Jatene|104|Rui Nogueira| Não, governador, mas...
104|21/02/2005|Simão Jatene|105|Simão Jatene| Senão vamos cair numa coisa... é o seguinte. Nós voltamos para o caso... a minha questão é muito mais larga do que isso. Nós temos que saber claramente o seguinte: nós queremos iniciar, e já iniciamos, um novo século e um novo milênio com a estrutura fundiária que nós temos? Nós acreditamos... A questão agrária, vamos pegar isso porque acho que é uma coisa importante. Muita gente achava que a questão agrária já era uma questão do passado. O país se urbanizou, então a discussão agora é urbana, não se tem mais a questão agrária. Tem sim! Nós não temos uma política de desenvolvimento regional, nós precisamos ter uma política de desenvolvimento regional que seja capaz de compreender este país na sua diversidade, está certo.
105|21/02/2005|Simão Jatene|106|Rui Nogueira| Eu entendo isso, é uma coisa macro, mas o senhor foi um homem da Secretaria de Planejamento.
106|21/02/2005|Simão Jatene|107|Simão Jatene|  Como é que se age no micro? Desculpe, mas deixe eu lhe dizer: sabe quantos nós gastamos no passado na área de defesa social? Uma questão de quase 12% do orçamento do estado.
107|21/02/2005|Simão Jatene|108|Adriana Ramos| Em quê exatamente?
108|21/02/2005|Simão Jatene|109|Teresa Cruvinel| O que o senhor chama de defesa social?
109|21/02/2005|Simão Jatene|110|Simão Jatene| Toda área de segurança pública e área de justiça. Isso é mais ou menos o que nós gastamos em saúde. Eu acho particularmente isso um absurdo.
110|21/02/2005|Simão Jatene|111|Teresa Cruvinel| No entanto eu seria leviana, governador, se fizesse apreciações sobre sua polícia, vivendo tão longe e conhecendo tão pouco o Pará, fiquei muito impressionada com um dado também que saiu nessas reportagens recentes sobre seu estado, que a polícia lá tem dez mil mandados de prisão não cumpridos.
111|21/02/2005|Simão Jatene|112|Simão Jatene| Deixe eu dizer, eu acho que é importante a gente trabalhar no tempo, porque toda vez que a gente agrupa as coisas e não procura ver no tempo, a gente corre o risco de cair numa armadilha.
112|21/02/2005|Simão Jatene|113|Teresa Cruvinel| Tem uma prefeita, acho que de uma cidade em homenagem ao ditador , a Medicilândia, né? Eu ouvi uma prefeita falar no rádio esses dias que ela prefere que a polícia não apareça lá, porque a polícia é envolvida também com os grileiros, com essa coisa. 
113|21/02/2005|Simão Jatene|114|Simão Jatene| Vamos lá. Acho que de novo é uma questão importante que a gente esclareça. Para a senhora ter uma idéia, hoje, nós temos no estado alguma coisa em torno de doze mil policiais militares e...
114|21/02/2005|Simão Jatene|115|Teresa Cruvinel| Doze mil?
