|DATA|ENTREVISTA|ORDEM|LOCUTOR|FALA
115|21/02/2005|Simão Jatene|116|Simão Jatene| ... 2600 policiais civis. Só no ano passado e este ano, devemos ter de processos, de algum procedimento administrativo, algo em torno de 2500.
116|21/02/2005|Simão Jatene|117|[...]| Dentro da polícia?
117|21/02/2005|Simão Jatene|118|Simão Jatene| Dentro da polícia. Contra a própria polícia no sentido interno.
118|21/02/2005|Simão Jatene|119|Teresa Cruvinel| Como assim?
119|21/02/2005|Simão Jatene|120|Simão Jatene| Disso aí, no ano passado e este ano foram desligados em torno de 350 policiais. O que eu acho que é importante é o seguinte...
120|21/02/2005|Simão Jatene|121|Teresa Cruvinel| Sofreram processo disciplinar, foram processados?
121|21/02/2005|Simão Jatene|122|Simão Jatene| Claro, e foram desligados. E tem mais trezentos aguardando...
122|21/02/2005|Simão Jatene|123|Teresa Cruvinel| Então por que a polícia é tão corrompida no Pará?
123|21/02/2005|Simão Jatene|124|Simão Jatene| Mas não é no Pará que ela é corrompida. Senão de novo a gente cai na história... Olha o preconceito! Não é no Pará. A polícia é corrompida, na verdade....
124|21/02/2005|Simão Jatene|125|Teresa Cruvinel| Mas também nós não estamos discutindo o Brasil aqui, governador, nós estamos discutindo o Pará.
125|21/02/2005|Simão Jatene|126|Simão Jatene| A polícia tem problemas neste país inteiro, vamos ser francos.
126|21/02/2005|Simão Jatene|127|Teresa Cruvinel| Tem, mas cada caso...
127|21/02/2005|Simão Jatene|128|Simão Jatene|  Cada um está tentando equacionar na verdade. O que eu diria...
128|21/02/2005|Simão Jatene|129|Teresa Cruvinel| Por exemplo, no Rio de Janeiro, tem lá tráfico, corrupção, tem envolvimento... No seu Pará, eu quero saber.
129|21/02/2005|Simão Jatene|130|Simão Jatene| Ano retrasado e ano passado nós capacitamos alguma coisa em torno de dois mil policiais. Eu diria à senhora o seguinte: provavelmente, oito anos atrás ou dez anos atrás, a polícia não tinha um carro. Os carros que a gente vê nas reportagens, todos eles, se os senhores prestarem atenção, são carros da polícia civil do estado do Pará, todos os carros que estão lá. Então, veja, eu não estou fugindo da responsabilidade não, porque acho que inclusive eu não tenho perfil e nem caráter para isso.
130|21/02/2005|Simão Jatene|131|Teresa Cruvinel|  Não, é porque também não adianta nós discutirmos o Brasil todo.
131|21/02/2005|Simão Jatene|132|Simão Jatene| Estou careca, de barba branca, nem tenho idade para ser ingênuo e nem caráter para ser hipócrita. Agora o que é verdade? O que é verdade é que se a gente não tomar essa coisa no tempo, a gente corre o risco de cair em algumas armadilhas. Eu tenho dito claramente que pior do que a resposta errada é a pergunta errada.
132|21/02/2005|Simão Jatene|133|Paulo Markun| Pergunta errada não tem, governador, o senhor desculpe.
133|21/02/2005|Simão Jatene|134|[Risos]|
134|21/02/2005|Simão Jatene|135|Simão Jatene| Você vai ter que começar... Quero dizer o seguinte.  Smith  e  Ricardo  passaram algum tempo perguntando o que era o valor e não responderam.
135|21/02/2005|Simão Jatene|136|Paulo Markun| Pode haver é repórter, resposta impertinente, pergunta não.
136|21/02/2005|Simão Jatene|137|Simão Jatene| Não, não. Olha, na A riqueza das nações , Smith e Ricardo passaram uma vida discutindo o que era valor. Marx chegou depois e disse: “Não, a discussão não é essa não, a pergunta está errada. Nós temos tem que mudar a pergunta”. Então tem sim, mas vamos embora!
137|21/02/2005|Simão Jatene|138|Paulo Markun| Fernando Manosso, de Apucarana, no Paraná, diz o seguinte: “Poucas dezenas de guerrilheiros escondidos no interior da mata nos confins do Araguaia foram capturados um a um na época por infringirem leis na época do regime militar”. Ele pergunta: “Por que as autoridades não utilizam os instrumentos do Estado para capturarem e prenderem os responsáveis por todos os assassinatos de trabalhadores no campo? E eu emendo com a pergunta de Nabhan Garcia, presidente da UDR  de Presidente Prudente, aqui em São Paulo, que diz o seguinte: “Em oito anos de governo, o estado ainda não fez um levantamento de quem é fazendeiro legal e ilegal, grileiro legal e ilegal, madeireiro legal e ilegal? Existe esse levantamento?”
138|21/02/2005|Simão Jatene|139|Simão Jatene| Não, não existe esse levantamento, e é importante o seguinte. Isso não é uma coisa tão simples quanto possa parecer. No momento em que houve a transferência de terras e em que se tem uma superposição inclusive, durante um longo tempo, de competências de gerenciamento das terras públicas no estado, é claro que isso cria uma grande complicação de saber quem emitiu o título sobre o quê. Porque eu defendo a questão do cadastro único? Eu não acho que o Instituto de Terras do Estado tenha que ter um cadastro e o Incra tenha que ter um cadastro não. Eu acho que o cadastro tem que ser de terras do Pará; independentemente se é governo estadual ou governo federal, você tem que ter um cadastro único. Insisto: onde é que o zoneamento pode ajudar nisso? Imaginar que você vai fazer o cadastramento de 1,25 milhão de hectares ou 125 milhões de quilômetros quadrados, é bobagem.
139|21/02/2005|Simão Jatene|140|Paulo Markun| Mesmo com satélite?
140|21/02/2005|Simão Jatene|141|Simão Jatene| É muito complicado, por causa do custo disso inclusive. Porque não basta você simplesmente identificar... o satélite identifica, mas você tem que fazer...
141|21/02/2005|Simão Jatene|142|Paulo Markun| Eu fico pensando, complicado é ter que fazer a favela, que é uma do lado da outra.
142|21/02/2005|Simão Jatene|143|Simão Jatene| Não, mas você tem que ir para cima e fazer o que a gente chama de discriminatória. E aí a discriminatória só tem um caminho, que é na terra mesmo, indo lá e identificando. Então qual é nossa proposição? Vamos trabalhar na área de uso intensivo, e aí trabalhar em conjunto mesmo.
143|21/02/2005|Simão Jatene|144|Roldão Arruda| Governador, o senhor falou agora há pouco da necessidade de se juntarem os esforços; não se pode resolver problemas ou só o prefeito, ou só o governo estadual ou o federal...
144|21/02/2005|Simão Jatene|145|Simão Jatene| Isso não é discurso, não, isso é uma crença. Posso até não conseguir, mas é uma crença.
145|21/02/2005|Simão Jatene|146|Roldão Arruda| Mas o seu Instituto de Terras lá está meio fraco, não está, governador? Inclusive está sem presidente no momento?
146|21/02/2005|Simão Jatene|147|Simão Jatene| Mas, para mim, não é essa a questão. O que nós estamos... voltamos a mesma história.
147|21/02/2005|Simão Jatene|148|Roldão Arruda| Mas o Instituto de Terras é muito importante para a questão de cadastramento, essas coisas.
148|21/02/2005|Simão Jatene|149|Simão Jatene| Para trabalhar o quê? Para trabalhar 20% das terras do estado que estão, na primeira e na melhor das hipóteses, a mais de cem quilômetros das rodovias federais? Então o que nós estamos discutindo? Fazendo uma outra coisa. Não esqueça disso, o  1164 fez o seguinte: “o que estava a cem quilômetros à esquerda e à direita de qualquer rodovia federal existente ou planejada é domínio da União”. Então essa questão do Instituto de Terra é fundamental. No projeto que nós estamos discutindo tem o redesenho do Instituto de Terra, que eu insisto: só vai poder acontecer de forma efetiva se nós contarmos com a participação do Incra. Não tem nenhuma chance. Qual foi o orçamento de Incra em 2000 e quanto foi ano passado? Os senhores têm idéia? Eu vou dar dois dados para os senhores, a preços constantes, orçamento do Incra em 2000 foi 2,8 bilhões aproximadamente. E no ano passado, foi 1,5 bilhão.
149|21/02/2005|Simão Jatene|150|Rui Nogueira| O senhor está dizendo que, no fundo, 72% da terra do Pará é da União, criou-se essa lei que fez esse esquartejamento aí ...
150|21/02/2005|Simão Jatene|151|Simão Jatene| Eu preferia  zoneamento do que esquartejamento, mas em todo caso, vamos lá.
151|21/02/2005|Simão Jatene|152|Rui Nogueira| Foi feito na ditadura daquele jeito, enfim. O senhor está dizendo que há uma responsabilidade federal muito específica...
152|21/02/2005|Simão Jatene|153|Simão Jatene|  Eu diria que existe uma responsabilidade conjunta. E talvez essa experiência lamentável que nós estamos vivendo tenha até ensinado uma coisa. Normalmente quando acontece um fato como esse – é por isso que eu digo que se tende a valorizar o caso e não a causa – o que a gente tem assistido historicamente? É o governo federal dizendo o seguinte: “A questão de polícia é segurança pública, é responsabilidade do estado”. E os estados dizendo o seguinte: “A questão agrária, ou a questão urbana, de um modo geral, é competência de União”. Eu acho que esse tipo de coisa não leva a coisa nenhuma.
153|21/02/2005|Simão Jatene|154|Rui Nogueira| Esse caso do projeto da irmã Dorothy, do projeto daquele dos TDS lá, isso pertence à União?
154|21/02/2005|Simão Jatene|155|Simão Jatene| Isso.
155|21/02/2005|Simão Jatene|156|Rui Nogueira| O senhor está dizendo que a União deveria ter feito esse assentamento em  de resolver esse problema?
156|21/02/2005|Simão Jatene|157|Simão Jatene| Acho que não precisa dizer esse assentamento. O assentamento de seiscentas pessoas não tem o condão de resolver – vamos ter isso claro – o conflito de terras...
157|21/02/2005|Simão Jatene|158|Rui Nogueira| Se não tem o condão, mas se fossem assentadas seiscentas famílias do projeto, o grileiro não estaria lá torrando a paciência de todo mundo na região.
158|21/02/2005|Simão Jatene|159|Simão Jatene| Mas a primeira coisa que nós precisamos deixar claro, e é por isso que eu insisto...
159|21/02/2005|Simão Jatene|160|Rui Nogueira| Se as pessoa são assentadas, como o senhor mesmo disse, cria-se o condão de afastar, já não cria a expectativa de direito do outro; a terra pertence à pessoa que está assentada, não pertence a mais ninguém.
160|21/02/2005|Simão Jatene|161|Simão Jatene| Mas não precisava nem estar assentado. Bastava que claramente a União definisse isso como área dela. Como se desapropria a área da União? A União desapropria a área da União?
161|21/02/2005|Simão Jatene|162|Rui Nogueira| Sim, mas então assenta, é mais fácil ainda. Já devia ter assentado! O senhor agora já tem tropa, depois da tropa tem, pelo que eu li, a Guarda Nacional, vão ficar uns quatrocentos lá...
162|21/02/2005|Simão Jatene|163|Simão Jatene| Não sei. Nós não tínhamos discutido isso. Mas tudo bem.
163|21/02/2005|Simão Jatene|164|Rui Nogueira| Está no jornal. Vamos discutir. Por que o senhor teme que se apague o holofote e volte tudo ao mesmo... Falta de dinheiro?
164|21/02/2005|Simão Jatene|165|Simão Jatene| Porque isso tem sido a história.
165|21/02/2005|Simão Jatene|166|Rui Nogueira| Sim, mas o que leva... apaga-se o holofote e some tudo. É falta de dinheiro?
166|21/02/2005|Simão Jatene|167|Simão Jatene| Eu acho que é uma discussão de prioridade mesmo?
167|21/02/2005|Simão Jatene|168|Adriana Ramos| Prioridade nacional, governador?
168|21/02/2005|Simão Jatene|169|Simão Jatene| Também. E eu lhe dei o dado do Incra.
169|21/02/2005|Simão Jatene|170|Adriana Ramos| Eu queria que o senhor colocasse uma coisa. Como o senhor pretende conseguir o apoio do governo federal ao seu plano de zoneamento ecológico econômico, se um dos principais pontos o que senhor defende nesse plano é a flexibilização nos 80% de reserva legal? Como o senhor pretende que o governo federal apóie esse plano com este item, flexibilização?
170|21/02/2005|Simão Jatene|171|Simão Jatene| Não, não, pelo contrário, veja. O que se conseguiu, na minha avaliação, foi um processo interessante que evita que se caia nessa discussão, que para mim é estéril, de 80%, ou 60%, ou 70%. Esse número cabalístico, porque...
171|21/02/2005|Simão Jatene|172|Adriana Ramos| Mas a legislação diz 80%.
172|21/02/2005|Simão Jatene|173|Simão Jatene| Espera um pouquinho. Por quê? O que o zoneamento traz de proposta é a possibilidade de compensação de área de reservas. Significa dizer que em uma área de uso intensivo, você pode usar mais de 20%, desde que você compre cotas de preservação de uma área de uso integral. E aí você está criando mecanismo de financiamento, que é sempre um grande desafio, para manutenção efetivamente dessas terras.
173|21/02/2005|Simão Jatene|174|Maria Zulmira de Souza| Como o senhor pretende controlar isso, por exemplo, num estado onde de 1980 a 1996, segundo dados do Museu  Goeldi, o número de municípios subiu de 83 para 143. Sendo que esses municípios que foram criados legalizaram atividades ilegais, na maior parte deles, a exploração ilegal de madeira. Isso são dados de um dos estudos do...
174|21/02/2005|Simão Jatene|175|Simão Jatene| Como assim “eles legalizaram”? Eles não têm poder de...
175|21/02/2005|Simão Jatene|176|Maria Zulmira de Souza| Como é que o senhor... como é que vai...
176|21/02/2005|Simão Jatene|177|Júlio Veríssimo| Governador, Novo Progresso vive da exploração de madeira ilegal.
177|21/02/2005|Simão Jatene|178|Simão Jatene| Espera um pouquinho, como é que eles legalizaram terra ilegal? O município não tem nenhum poder para isso.
178|21/02/2005|Simão Jatene|179|Júlio Veríssimo| Mas não é questão de legalizar. Tem cidades no Pará, em que as populações locais vivem da extração ilegal de madeira. E elas fazem isso não porque são ruins, é porque o madeireiro foi lá, se instalou, fez um acordo muito grande inclusive com muitos órgãos públicos. Muitas prefeituras e prefeitos inclusive são eleitos por esses madeireiros, e mantidos por esses madeireiros e a população não tem outro recurso. Então acho que nesse ponto a Maria Zulmira tem razão. Como vamos tirar dessa zona de influência? Será que só com o projeto tira-se dessa zona de influência?
179|21/02/2005|Simão Jatene|180|Teresa Cruvinel| Qual é a sua proposta para essa situação concreta dos madeireiros?
180|21/02/2005|Simão Jatene|181|Simão Jatene| Oferecer claramente uma alternativa.
181|21/02/2005|Simão Jatene|182|Teresa Cruvinel| Alternativa econômica?
182|21/02/2005|Simão Jatene|183|Simão Jatene| Claro, e não só para os madeireiros. Vamos ter claro o seguinte: nós colocamos todo mundo e terminou-se criando – o que para mim também é outro equívoco –  de que quem mexe com a exploração florestal é, por princípio, bandido. Eu acho que não. Eu acho que é possível identificar na exploração florestal gente correta. E daí volta de novo à palavra mágica: zoneamento.
183|21/02/2005|Simão Jatene|184|Teresa Cruvinel| Pois é, mas eu lhe pergunto: mesmo sendo honesto...
184|21/02/2005|Simão Jatene|185|Simão Jatene| Ele vem permitir exatamente isso, porque ele vem caracterizar quem estiver em áreas de uso restrito e que seja definida a utilização para exploração florestal. Então eles saem da ilegalidade. O grande problema hoje é que se botou na ilegalidade todo mundo. Vamos ser claros, uma região nordeste do estado...
185|21/02/2005|Simão Jatene|186|Teresa Cruvinel| Qual a sua proposta? O senhor concorda ou discorda dessa proposta do Ministério do Meio Ambiente, que é de um manejo controlado – tira tantas árvores, mas tem que plantar não sei quantas – ou o senhor é favor de uma legalização dessa operação que ocorre? O sujeito pode não ser bandido, mas ele está cometendo delito ecológico. Então ele pode não mandar matar, mas ele...
186|21/02/2005|Simão Jatene|187|Simão Jatene| Ele só está cometendo um delito ecológico, por quê? Porque ele não tem nada que discipline onde ele pode usar ou não.
187|21/02/2005|Simão Jatene|188|Teresa Cruvinel| Então qual é sua proposta?
188|21/02/2005|Simão Jatene|189|Simão Jatene| O zoneamento, exatamente isso. Na hora em que o zoneamento vem e define áreas para uso...
189|21/02/2005|Simão Jatene|190|Teresa Cruvinel| Mas o que quer dizer, vamos falar para as pessoas entenderem o que significa isso. O senhor vai permitir, vai legalizar a atividade de derrubar a floresta, é isso?
190|21/02/2005|Simão Jatene|191|Simão Jatene| Não é legalizar. Nas áreas de uso intensivo, você pode ter uma utilização mais intensa da floresta. Nas áreas de uso intensivo pode sim. Nas áreas de uso restrito, você pode ter sob determinadas condições. Na área de preservação integral, você não pode ter nada.
191|21/02/2005|Simão Jatene|192|Adriana Ramos| Governador, o senhor falou da questão de utilizar a compensação com o pagamento de áreas dentro de unidades de conservação? Quer dizer, o proprietário, ao invés de manter sua reserva legal – isso é uma figura prevista no Código Florestal – paga pela regularização fundiária dentro de uma unidade de conservação. Entretanto no zoneamento e nas áreas criadas pelo governo federal, só tem previstas unidades de proteção integral em áreas que já são do estado. E o governo federal já incluiu nos decretos de criação da Estação Ecológica da Terra do Meio e do Parque Nacional da Serra do Pardo, a previsão de que as terras do estado do Pará que estão dentro dessas áreas vão poder ser utilizadas como áreas de compensação de reserva legal. O estado vai doar aos proprietários privados a flexibilização? Como vai fazer isso?
192|21/02/2005|Simão Jatene|193|Simão Jatene| Não, o estado vai ter o quê? Na hora em que o proprietário quer explorar uma área um pouco maior que os 20%, ele apresenta sua proposta e evidentemente, a partir daí, se define uma área que vai ser garantida ou mantida por ele pelas cotas de preservação.
193|21/02/2005|Simão Jatene|194|Adriana Ramos| Ele paga ao estado?
194|21/02/2005|Simão Jatene|195|Simão Jatene| Ele vai pagar.
195|21/02/2005|Simão Jatene|196|Júlio Veríssimo| O estado tem como controlar isso, governador?
196|21/02/2005|Simão Jatene|197|Simão Jatene| Acho que sim, acho que sim. Porque isso não significa discriminatória, aí você pode controlar por satélite.
197|21/02/2005|Simão Jatene|198|Adriana Ramos| E qual é a responsabilidade do estado no controle da área que é federal?
198|21/02/2005|Simão Jatene|199|Júlio Veríssimo|  E como o madeireiro inclusive faz hoje. O madeireiro, por GPS, identifica a área para derrubada, vai lá e derruba, coisa que o poder público não tem. Por isso que eu estou questionando o seguinte. Hoje o governo Lula vai lá, inclusive o pacote passou a vigorar hoje, esse pacote, digamos, entre crise, e criou santuários ecológicos dentro do Pará. Desculpe-me a expressão, mas o senhor não teme ser um síndico desse santuário onde do ponto de vista de marketing é muito bonito, até para o exterior, mas a confusão lá dentro, latente, está acontecendo.
199|21/02/2005|Simão Jatene|200|Simão Jatene| Por isso, por que eu estou colocando? Veja, 35% no máximo, do estado do Pará, como área de consolidação, é uma área gigantesca em qualquer lugar do mundo. Então não é preciso avançar mais sobre a floresta se você tem isso posto. Agora eu insisto numa coisa: para isso nós precisamos ter a coragem de assumir que Transamazônica precisa ser consolidada sim; que não vai ser deixando essas populações lá, fora de um processo produtivo, que nós vamos ter a presença do Estado. Não vai. Nós precisamos ter a coragem de assumir que a BR 163 precisa ser consolidada no que ela já está aberta.
200|21/02/2005|Simão Jatene|201|Maria Zulmira de Souza| Como seria então esse Pará que o senhor desenha? Que papel teria, por exemplo, a pecuária, que papel teria a soja, quanto seria?
201|21/02/2005|Simão Jatene|202|Simão Jatene| A pecuária e a soja só poderiam ser utilizadas, no máximo, em 35% do estado.
202|21/02/2005|Simão Jatene|203|Júlio Veríssimo| 35% do estado?
203|21/02/2005|Simão Jatene|204|Simão Jatene| Claro, porque sãos as áreas que não sofrem algum tipo de restrição.
204|21/02/2005|Simão Jatene|205|Roldão Arruda| Governador, o senhor falou agora há pouco dos problemas com a sua polícia. Existe uma entidade de direitos humanos que está levantando questionamento a respeito da lisura desse inquérito que o senhor tem junto com o da polícia federal. Esse delegado, Pedro Monteiro, superintendente da Polícia Civil, era um delegado que tinha atritos com a irmã Dorothy, e ele é o cara hoje que preside; ele que levantou, por exemplo, um procedimento contra ela, acusando-a de fornecer arma para os trabalhadores da região. O senhor acha que ele tem isenção para apurar esse caso?
205|21/02/2005|Simão Jatene|206|Simão Jatene| Estão apurando juntos, em conjunto.
206|21/02/2005|Simão Jatene|207|Roldão Arruda| Em conjunto com a polícia?
207|21/02/2005|Simão Jatene|208|Simão Jatene| Polícia Federal, polícia do estado, estão apurando em conjunto. Na verdade, o fato de terem dois inquéritos não significa... E acho que vamos ter a possibilidade de ver, ao final dos relatórios, a coincidência ou não.
208|21/02/2005|Simão Jatene|209|Roldão Arruda| Por que não só um inquérito, governador?
209|21/02/2005|Simão Jatene|210|Simão Jatene| Porque eu acho que a história não dá saltos.
210|21/02/2005|Simão Jatene|211|Júlio Veríssimo| A própria PF acolheu o inquérito da polícia civil, ela nem fez o depoimento.
211|21/02/2005|Simão Jatene|212|Simão Jatene| Acho que história não dá saltos. Nós temos uma histórica tradição de transferência de responsabilidade – eu já disse isso – para esconder fragilidades, e que eu acho que a gente precisa ter a coragem de superar, independentemente do partido. É por isso que eu acho que, ainda, lamentavelmente, estamos trabalhando com dois inquéritos.
212|21/02/2005|Simão Jatene|213|Teresa Cruvinel| Pois é, no caso do Pará é interessante porque já li, todo mundo já leu isso, talvez nos livros, na história do Brasil, logo depois da Revolução de 1930, o doutor Getúlio Vargas mandou um interventor cuja principal missão era demarcar as terras federais, as terras da União e pôr ordem na questão agrária no Pará. E isso acabou levando à derrubada do interventor pelas forças políticas locais, e acabou acho que não sendo feito. Então, é um problema muito antigo lá, que a elite paraense não consegue também resolver; e o governo federal central, por sua vez, como o senhor diz, também não teve um plano de ocupação da Amazônia democrático, transparente e discutido. A ditadura arrombou a Amazônia com suas rodovias, e na democracia nós não fomos capazes de discutir isso. Mas queria lhe perguntar, ainda na área dos direitos humanos, a área do ministro Nilmário  que andou reclamando que o senhor estava demorando a indicar os membros da comissão que ia tratar da proteção às testemunhas, aquelas 45 pessoas ameaçadas lá... O senhor indicou?
213|21/02/2005|Simão Jatene|214|Simão Jatene| Deixe eu lhe dizer. A área do ministro Nilmário. Porque minha conversa com o ministro – é bom que isso esteja claro – existe um programa chamado Provita, do estado, que tem um conselho, que evidentemente avalia a necessidade ou não de inclusão das pessoas no programa e que tem como órgão mais importante a SDTH. E não estou falando de um projeto não, estou falando de um fato.
214|21/02/2005|Simão Jatene|215|Teresa Cruvinel| Mas e nesse caso recente, das pessoas ameaçadas.
215|21/02/2005|Simão Jatene|216|Simão Jatene| De fato, isso está lá. É o Provita, um programa que já existe, tem um orçamento em que o governo do estado e governo federal aportam recursos, tem um conselho que define isso. E insisto: existem pessoas hoje incluídas no Provita. O estado não sabe onde essas pessoas estão sendo protegidas, mas estão sendo protegidas. A STDH é que define isso. E eu acho que é um dos belos programas que a gente tem. Ainda que também, eu sei que isso incomoda alguns, mas não posso deixar de dizer, acho que qualquer sistema de proteção pessoal é sempre limitado, particularmente nesses casos. Até porque, vamos ser francos numa coisa, o que essas pessoas estão fazendo? Essas pessoas têm ameaçadas as suas vidas por defenderem causas? A primeira ação desses programas todos de proteção pessoal é retirar as pessoas de onde elas estão. Ora, mas se a razão da vida delas e da luta delas está ali! Então é importante que a gente trate... Por isso que eu tenho dito claramente o seguinte: temos certos bolsões violência neste país – no Pontal de Paranapanema, nas favelas do Rio, na Amazônia, na Zona da Mata, e particularmente Pernambuco, naquela região. E nós precisamos, definitivamente, numa federação frágil como a nossa – e essa é uma discussão importante –, deixar os pruridos e unir no sentido de saber o seguinte: isso está cada vez mais se transformando num desafio para o Estado brasileiro na suas várias instâncias.
