|DATA|ENTREVISTA|ORDEM|LOCUTOR|FALA
0|21/02/2005|Simão Jatene|1|[Programa ao vivo, permitindo a participação de telespectadores]|
1|21/02/2005|Simão Jatene|2|Paulo Markun| Boa noite. O assassinato da freira americana e de mais quatro pessoas no Pará chamou a atenção do Brasil e, em boa medida, do mundo, para a violência sem limites na luta pela posse da terra. Uma luta que assusta não só pelo seu caráter sangrento, mas pela afronta ao estado de direito, ao poder público. Pistoleiros, posseiros, grileiros, fazendeiros, invasores de terra se misturam e se enfrentam numa aventura que revela um outro Brasil, comandado pelo crime e pela exploração irresponsável de recursos naturais. Este é o tema do Roda Viva desta noite que entrevista Simão Jatene, governador do Pará, o estado que tem vivido de maneira mais aguda a devastação de florestas e os problemas da violência no campo.
2|21/02/2005|Simão Jatene|3|[Comentarista]| Economista, 53 anos, Simão Jatene elegeu-se governador do Pará, pelo PSDB, em 2002, sucedendo o governador Almir Gabriel  de quem foi secretário da Produção. Especialista em desenvolvimento regional, tem participado desde o governo anterior dos principais programas de desenvolvimento do turismo, da mineração e da agricultura no Pará. Segundo maior estado brasileiro, só perde para a Amazônia, o Pará também tem uma história econômica montada no extrativismo. Começou com a exploração da borracha no começo do século XX; mais tarde veio a mineração de ferro em Carajás, ouro em Serra Pelada e, mais recentemente, a exploração da madeira. O Pará tornou-se líder da atividade madeireira no país, respondendo por dois terços da produção nacional. A atividade que cresceu de maneira desordenada e em grande parte de forma clandestina atraiu exploradores de todos os lados, da mesma forma que o sonho de encontrar emprego ou terra barata e recursos naturais para explorar, atraindo gente de todos os cantos. A disputa pela terra e a busca de riqueza criaram enfrentamentos entre esses novos personagens da floresta: madeireiros, grileiros, fazendeiros e posseiros. Os madeireiros agem em geral em terras que não pertencem a eles; os grileiros ocupam terras da União e com o tempo vendem as terras como se eles fossem os donos. Os posseiros agem para defender as terras que compraram de grileiros ou que tomaram posse para um dia reivindicar a propriedade. E os fazendeiros, com títulos legais ou não de terras, procuram se defender dos invasores. Em 2002, o Instituto da Terra do Pará calculou que quase a metade do estado já estava grilada, e o Ministério Público Estadual já investigava o envolvimento de autoridades e cartórios na emissão de títulos de posse fraudulentos. Confusão, disputa, conflito, corrupção, ausência do Estado e impunidade. A violência na floresta, como em outras áreas rurais do país, cresceu e ganhou destaque internacional a cada episódio de maior repercussão. Foi assim com o assassinato do líder seringueiro Chico Mendes em 1988, a morte de 19 trabalhadores sem-terra em conflito com a polícia em Eldorado dos Carajás em 1996, e agora com o assassinato da freira norte-americana Dorothy Stang em Anapu . Nascida nos Estados Unidos e naturalizada brasileira, a freira trabalhava na região há mais de trinta anos. Participava do PDS, Projeto de Desenvolvimento Sustentável, criado pelo movimento social e ambiental para apoiar a agricultura familiar. Dorothy Stang já havia alertado o governo federal sobre as tensões e ameaças de morte na região. O PDS Esperança, onde ela atuava, era uma área reconhecida pelo Incra , e ocupada por quatrocentas famílias. O assassinato da freira, seguido da morte de um trabalhador e três sindicalistas, reabriu o velho debate da violência e da impunidade no campo. Parlamentares da CPI da Terra denunciaram ao vice-presidente José Alencar o descontrole no Pará que, segundo a comissão, vive uma situação de guerra civil rural, e onde a indústria da pistolagem atingiu níveis alarmantes. A Comissão Pastoral da Terra acusou o governo de omissão e divulgou que há uma lista de mais de 150 pessoas ameaçadas de morte nas áreas de conflito no Pará. O governo federal reagiu com um pacote de medidas. Enviou dois mil soldados do Exército para ajudar a expulsar grileiros e madeireiros ilegais e controlar a ordem pública na região. Também decidiu montar um gabinete de crise no Pará, investigar as ameaças de morte e criar novas reservas ambientais: uma área extrativista e duas florestas nacionais. Na região onde a missionária foi assassinada, criou uma estação ecológica e um parque nacional; e interditou, por seis meses, oito milhões de hectares às margens da BR 163. Também planeja assentar imediatamente quinhentas famílias para reduzir a tensão em Anapu e na chamada Terra do Meio, outra área que tem projetos de proteção e pode se tornar alvo de novos conflitos. De seu lado, o governador Simão Jatene quer aprovar na Assembléia o Plano de Zoneamento Ecológico Econômico para pacificar os bolsões de violência. O zoneamento acaba com a expectativa de direito futuro, que hoje alimenta a grilagem e a violência.
3|21/02/2005|Simão Jatene|4|Paulo Markun| Para entrevistar o governador Simão Jatene, nós convidamos Roldão Arruda, repórter da editoria de política do jornal O Estado de S. Paulo; Rui Nogueira, diretor do site e da revista Primeira Leitura; Tereza Cruvinel, colunista de política do jornal O Globo; Adriana Ramos, coordenadora de políticas do Instituto Socioambiental e representante nacional das entidades ambientalistas no Conama, Conselho Nacional do Meio Ambiente; Júlio Veríssimo, coordenador da agência Folha, do jornal Folha de S.Paulo; e Maria Zulmira de Souza, coordenadora do quadro Biodiversidade Brasil do programa Repórter Eco da TV Cultura. Aqui no nosso estúdio acompanham a entrevista em nossa platéia os seguintes convidados: Inês Zanchetta, jornalista do Instituto Socioambiental; Bruno Konder Comparato, doutorando em ciência política pela USP; Juana Kweitel, advogada e coordenadora do projeto da ONG Conectas Direitos Humanos; Cristina Bodas, assessora de imprensa da ONG Greenpeace; Frank Guggenheim, diretor executivo da Greenpeace Brasil; Euclides Farias, assessor de imprensa do gabinete de governo do estado do Pará, e Orly Bezerra, assessor especial do governador Simão Jatene. Como sempre, todas as perguntas que não forem formuladas serão encaminhadas para o governador para que ele possa respondê-las posteriormente se assim o desejar. Boa noite, governador.
4|21/02/2005|Simão Jatene|5|Simão Jatene| Boa noite.
5|21/02/2005|Simão Jatene|6|Paulo Markun| Eu queria comentar com o senhor uma notícia que está, agora neste momento, nas agências de notícias e que diz o seguinte: “O juiz Lauro Alexandrino, da Comarca de Pacajá, no sudoeste do Pará, revogou nesta noite de segunda-feira o decreto que transformava em segredo de Justiça o inquérito policial sobre o assassinato da missionária. Esse decreto, que estabelecia segredo de Justiça foi feito a pedido do promotor de justiça Fábio Brabo de Araújo, do Ministério Público Estadual”. E a notícia comenta que a partir de agora, a polícia tem ainda prerrogativa de manter o segredo de Justiça, mas não tem mais a desculpa ou a justificativa de que isso foi feito por decisão judicial. Como ele tinha tomado essa decisão hoje e voltou atrás, eu queria perguntar, em primeiro lugar, como o senhor encara essa decisão e se o senhor acha que a polícia vai manter o segredo de Justiça e por que segredo de Justiça num processo como esse?
6|21/02/2005|Simão Jatene|7|Simão Jatene| Boa noite. Eu acho que antes de tudo é importante recuperar um fato. O Pará, mais uma vez, sofre com o fato deste país, nos seus cinco séculos, não ter enfrentado algumas questões básicas como, por exemplo, a questão agrária. O importante, que é uma questão do segredo de Justiça, é que as informações que se dispunham terminavam contribuindo muito mais para tumultuar o cenário do que para ajudar. Em função disso, nós tivemos ainda hoje de manhã, uma reunião com a Polícia Federal, uma reunião com o comandante do Exército lá no estado, onde a decisão foi conjunta diante das informações que se dispunham. E que, inclusive, o elemento que foi preso por identificação de ser o pistoleiro estava falando coisas que não pareciam ter consistência, mas que tinham sim o poder de complicar ou de tumultuar a investigação. Foi exatamente em função disso que, por uma decisão conjunta, e eu insisto nisso, o governo do estado, o governo federal através da Polícia Federal, através do Exército Brasileiro, se julgou que era conveniente manter, até que se esclarecesse um pouco mais a declaração desse senhor, sob segredo de Justiça. Foi exatamente isso.
7|21/02/2005|Simão Jatene|8|Paulo Markun| Ou seja, se eu entendi, o senhor acha que a polícia vai manter o segredo de Justiça?
8|21/02/2005|Simão Jatene|9|Simão Jatene| A não ser que se tenham fatos novos, com as informações de que dispunham, eu acho que sim. E insisto nisto: não é uma decisão da polícia do Pará. É uma decisão tomada em conjunto com a Polícia Federal e em conjunto com o Exército Brasileiro que, sem dúvida alguma, poderia levar muito mais a dificultar a investigação do que efetivamente apurá-la. O que é importante nesse período? Foi preso já o elemento conhecido como Fogoió, que é exatamente quem está dando essas declarações e que aí foi identificado como quem atirou na irmã . E tem também já preso o Tato , que é considerado um dos mandantes. Ele trouxe uma outra história que, aparentemente, pela avaliação tanto da Polícia Federal quanto das polícias Civil e Militar do estado, não tinha consistência, mas teria o objetivo de dificultar a investigação. Tanto que, inclusive antes de sair para cá, eu tive a informação de que ele já estava mudando sua declaração. Ele inicialmente chegou falando de envolvimento de movimentos sociais e tudo mais, como se ele estivesse inclusive a serviço de determinados grupos sociais. Então é exatamente isso que, na nossa avaliação, a esta altura, não ajuda.
9|21/02/2005|Simão Jatene|10|Paulo Markun| Há uma declaração, inclusive, governador, da Folha Online, uma reportagem de Tathiana Barbar, dizendo que o Fogoió, que é Raifran das Neves Sales, teria incluído entre os mandantes do crime, ou citado como um mandante do crime, um candidato a vice-prefeito derrotado nas últimas eleições. E a fonte que essa jornalista apresenta é a assessoria do governo do estado. O senhor tem essa informação?
10|21/02/2005|Simão Jatene|11|Simão Jatene| Não, não, e pelo contrário. A assessoria não teve nenhuma orientação nessa direção. Até porque insisto nisto: acho que, a esta altura, o que precisamos todos nós é ter atitudes que contribuam para esclarecer, e não para tumultuar um caso dessa natureza, que eu acho que tem que ser tratado de forma exemplar, sim.
11|21/02/2005|Simão Jatene|12|Rui Nogueira| Eu não consigo entender a utilidade objetiva de manter o caso sob sigilo, por quê? A grilagem é a céu aberto, o pistoleiro funciona e age ali claramente, na frente de todo mundo. Enfim, todo esse ambiente de violência e de confronto, as pessoas tropeçam nele – jornalistas, autoridades, tudo mais. E quando acontece um caso como a morte da freira Dorothy Stang, ok, tem uma investigação, tem um sujeito que é preso e supostamente parece não dizer coisa com coisa. Mas as autoridades têm alguma forma de... Ele está dando depoimento, é um depoimento para o Estado constituído...
12|21/02/2005|Simão Jatene|13|Simão Jatene| Perfeito.
13|21/02/2005|Simão Jatene|14|Rui Nogueira| ... há formas de contrapor esse depoimento, há formas de investigação para ver o que há de contraditório nele e formas de o aparelho de Estado, da Justiça, da polícia para provar para o público que há contradições. Por que o segredo? O segredo é assim... eu acho que esta platéia inteira aqui e o Brasil dizem assim: “Por que investigar alguma coisa em segredo?
14|21/02/2005|Simão Jatene|15|Simão Jatene| Mas veja, o segredo foi uma coisa definida parcialmente diante do momento específico de algumas declarações que ele veio fazendo. Porque sem dúvida nenhuma, na nossa avaliação e na avaliação dos outros órgãos, com os quais discutimos, ele terminaria dificultando a efetiva apuração. Nós precisamos saber que estamos tratando de uma coisa, sem dúvida alguma, muito séria. Imagine alguém que é identificado como pistoleiro e que chega dizendo que está a mando de fulano, de beltrano, sem que tenha qualquer consistência o que ele está dizendo, inclusive envolvendo pessoas do próprio movimento social, coisas desse tipo. Isso num cenário desse pode terminar muito mais criando um tumulto e escondendo a realidade do que ajudando. Não se trata de manter isso. A nossa hipótese é que se for esclarecido, como a informação que eu tive, é que ele já havia mudado o depoimento inicial e já tinha se aproximado de alguma coisa mais consistente com todo o conjunto das investigações, aí eu acho que o segredo perde sentido.
15|21/02/2005|Simão Jatene|16|Rui Nogueira| Agora, me desculpe interrompê-lo. Aí é que está o problema. A versão inicial que ele tinha ao acusar alguém ligado aos movimentos sociais gerou segredo de Justiça. A versão que ele passou a desmentir, agora, o senhor acabou de dizer, parece ser mais consistente. Por quê?
16|21/02/2005|Simão Jatene|17|Simão Jatene| Por quê? Porque na verdade tem outros depoimentos que apontam na mesma direção. O depoimento que ele trouxe novo, e que ele chegou já de pronto falando, é que não fazia muito sentido. Uma investigação na verdade não se pauta num depoimento, ela tem um conjunto de depoimentos. Esses depoimentos mantêm uma certa lógica que precisa ser percebida, os especialistas o fazem. Então o que acontece? É que, sem dúvida alguma, na hora em que se teve uma primeira manifestação que apontava numa direção, não tinha absolutamente nada, de outras informações, que dessem consistência, a nossa avaliação era que tornar isso público poderia incriminar pessoas de forma absolutamente irresponsável, e nós precisávamos ter muito cuidado com isso. Não significa nenhum sigilo no sentido de esconder da sociedade as coisas não; significa ter um pouco mais de consistência no que está sendo ouvido e no que está sendo dito para que efetivamente não se termine complicando mais do que ajudando. Porque eu acho que é desejo de todos nós.
17|21/02/2005|Simão Jatene|18|Júlio Veríssimo| Governador, o senhor não acha que o fato de existirem dois inquéritos correndo – um da Polícia Civil, outro da Polícia Federal – já contribui para esse tipo de confusão? Porque pela apuração que a gente acompanha, inclusive dos correspondentes, é que existem declarações, as mais variadas possíveis, de agentes da Polícia Federal, de agentes da Polícia Civil, de delegados inclusive . O senhor não acha inclusive que esse crime deveria ser federalizado, ou seja, ficar a critério da Polícia Federal, única e exclusivamente?
18|21/02/2005|Simão Jatene|19|Simão Jatene| Deixe eu dizer uma coisa. Primeiro, todas as informações que eu tenho é que os dois inquéritos têm uma profunda semelhança na coleta das informações. E quero dizer que, hoje de manhã, a reunião que fizemos reforçou isto: essa identidade dos dois inquéritos. O fato da discussão da federalização, eu tenho dito claramente uma coisa: tudo o que vier para contribuir para que se esclareça com rapidez, ajuda e é bem recebido pelo Estado. Eu não tenho nenhum prurido com essa discussão. Agora, o que é verdade? Eu tenho minhas dúvidas de que qualquer esfera de governo – e eu vou repetir isso – qualquer esfera de governo, isolada, tenha condições de enfrentar o que está vivendo particularmente o Pará, no que eu chamo de bolsões de violência que se instalaram neste país. Eu acho que, mais do que nunca, só a cooperação, só a ação integrada das várias esferas pode nos levar a algum sucesso nesse embate, nessa luta.
19|21/02/2005|Simão Jatene|20|Teresa Cruvinel| Governador, antes de passar a esse futuro que o senhor está apontando aí de cooperação, olhando um pouco para o passado do Pará, para os anos recentes, o estado do Pará, a conflagração, esse ambiente de violência, de luta pela terra, o desmatamento, todos esses elementos dessa crise do momento que gerou até a formação de um gabinete de crise, todos esses fatos vêm sendo apontados nos últimos anos. O governo federal, ao lançar o pacote, essas medidas, foi muito criticado por ter agido tarde. Foi tarde. Agora, eu pergunto: da parte do governo estadual, o senhor integra um grupo político que está no governo, no poder do Pará há dez anos...
20|21/02/2005|Simão Jatene|21|Simão Jatene| Sim.
21|21/02/2005|Simão Jatene|22|Teresa Cruvinel| Nos últimos dez anos, não foi possível diagnosticar, não foi possível agir? Aliás, o governador Almir Gabriel era um aliado, dileto aliado do ex-presidente Fernando Henrique. Não foi possível agir nos últimos anos, antes que as coisas chegassem a esse ponto?
22|21/02/2005|Simão Jatene|23|Simão Jatene| Eu diria que se agiu e se agiu muito. Não podemos esquecer de que há dez anos, quando se assumiu o estado do Pará, o estado devia duas folhas de pessoal, era entre os estados brasileiros o que apresentava um dos piores índices de equilíbrio nas suas contas e passava pelo que eu chamo a pior das crises, que é a crise dos “des”: do descrédito e da descrença. Sem dúvida alguma, nesses dez anos se avançou e se avançou muito. E insisto, longe, e não acredito que qualquer unidade federativa na qual existam esses bolsões de violência tenha condição de enfrentá-los isolado. Até porque o problema acontece no Pará, mas ele não é do Pará, a rigor, e acho que a reportagem que nos antecedeu mostra claramente isso. A partir dos anos 70, o Pará virou palco de agentes sociais com interesses distintos, muitas vezes conflitantes. E, sem dúvida alguma, o que nós assistimos de lá para cá é uma permanente reprodução e valorização dos casos e não das causas, que é exatamente o que nós estamos propondo a discussão. Eu acho que mais do que nunca, o governo do estado avançou? Avançou sim. Eu não tenho nenhuma dúvida de afirmar aos senhores que se compararmos a nossa polícia de hoje com a nossa polícia de dez anos atrás, ela pode estar longe de ser a polícia que queremos, mas sem dúvida, ela avançou e avançou muito. Avançou em equipamento, e basta ver a reportagem toda.
23|21/02/2005|Simão Jatene|24|Paulo Markun| O senhor acha que há mais presença do Estado nesses que o senhor chama de “bolsões de violência” hoje do que há dez anos?
24|21/02/2005|Simão Jatene|25|Simão Jatene| Com absoluta convicção. Posso lhe dar alguns dados, é claro. Só ano passado nós criamos duas companhias da Polícia Militar: uma em Novo Progresso e a outra em São Félix do Xingu; uma próxima à Terra do Meio e outra na BR 163.
25|21/02/2005|Simão Jatene|26|Paulo Markun| O senhor disse próxima à Terra do Meio...
26|21/02/2005|Simão Jatene|27|Simão Jatene| Como? Próximo à Terra do Meio, porque São Félix do Xingu é uma das pontas da Terra do Meio. Na Terra do Meio, particularmente, eu acho que tem determinadas áreas onde não se deve criar nada mesmo, deve ser mantido como reserva de proteção integral. 
27|21/02/2005|Simão Jatene|28|Roldão Arruda| O senhor, além desses dez anos, que ela  estava falando, de governo, participou do , do antigo Ministério da Reforma Agrária.
28|21/02/2005|Simão Jatene|29|Simão Jatene| Sim.
29|21/02/2005|Simão Jatene|30|Roldão Arruda| Quando vi isso, fiquei muito surpreso porque o senhor, mais do que outras pessoas, deve ter tido acesso a esse quadro de conflito. A minha pergunta é: se o senhor assumir num estado que vem de uma tradição de conflitos, onde a CPT  vem denunciando trabalho escravo há pelo menos trinta anos; onde o Jader Barbalho , acho que em 1985, quando ele estava nesse ministério, assinou um acordo para acabar com o trabalho escravo lá, que iria unir a Contag , CNA  e tudo mais, e nunca se fez nada. O senhor tem essa realidade toda. Por que, assim que o senhor assumiu, o senhor não apresentou um plano, alguma ação que levasse a uma solução desses conflitos e esperou acontecer essas coisas?
30|21/02/2005|Simão Jatene|31|Simão Jatene| Ah não, aí não.
31|21/02/2005|Simão Jatene|32|Roldão Arruda| Queria saber também como o senhor reage a essa afirmação de que senhor tinha sido alertado sobre esse conflito especialmente ali e não teria reagido?
32|21/02/2005|Simão Jatene|33|Simão Jatene| Uma coisa de cada vez. Primeiro a questão do plano. Eu não acredito em panacéia, não acredito em nada mágico diante dessa discussão...
33|21/02/2005|Simão Jatene|34|Roldão Arruda| A ação...
34|21/02/2005|Simão Jatene|35|Simão Jatene| O que é verdade - espere um pouquinho  – o que é verdade é que há dois anos, estamos trabalhando na elaboração do zoneamento econômico ecológico do estado do Pará...
35|21/02/2005|Simão Jatene|36|Roldão Arruda| Tem um plano mais antigo do que dois anos. Não tem uma discussão mais antiga que isso?
36|21/02/2005|Simão Jatene|37|Teresa Cruvinel| Ele já vem do governo de Almir Gabriel, não é?
37|21/02/2005|Simão Jatene|38|Simão Jatene| Não, não... Como projeto para ser implementado, eu participei desde o momento primeiro dessa discussão. E obviamente com a compreensão clara de que o zoneamento precisa, primeiro, ter legitimidade. Então não basta ele apenas ser um zoneamento do governo do Pará; ele necessariamente tem que ser o zoneamento do estado do Pará. E não foi por acaso que nesses dois anos nós discutimos com a federação da agricultura, a federação da indústria, a federação dos exploradores da floresta... Na verdade, organizações de trabalhadores, universidades e institutos de ciência, a classe política e o governo federal.
38|21/02/2005|Simão Jatene|39|Teresa Cruvinel| Teria sido a classe política, grupos organizados, partidos, em suma, que construíram resistências na Assembléia para que seu governo e o governo anterior tivessem aprovado antes o plano de zoneamento? 
39|21/02/2005|Simão Jatene|40|Simão Jatene| Eu diria o seguinte, na verdade não se tinha formatado um projeto de zoneamento.
40|21/02/2005|Simão Jatene|41|Teresa Cruvinel| Não chegou a ser apresentado?
41|21/02/2005|Simão Jatene|42|Simão Jatene| Não, o projeto foi apresentado à Assembléia agora, e acho que sem dúvida alguma...
42|21/02/2005|Simão Jatene|43|[sobreposição de vozes]|
43|21/02/2005|Simão Jatene|44|Paulo Markun| Não era para ter sido votado até o dia 20 de dezembro?
44|21/02/2005|Simão Jatene|45|Simão Jatene| Acho que não, até porque eu conheço boas dezenas de planos neste país que não saíram das prateleiras, nem tão pouco das gavetas. E acho o seguinte...
45|21/02/2005|Simão Jatene|46|Roldão Arruda|  Seu vizinho no Amazonas está fazendo coisas mais rapidamente nessa direção...
46|21/02/2005|Simão Jatene|47|Simão Jatene| Isso é uma avaliação sua. O que eu quero dizer é o seguinte: estou convencido de que a matéria-prima da grilagem é exatamente o quê? A expectativa de direito. O senhor não pode esquecer uma coisa: o Pará é talvez, dos estados brasileiros, que sofreu durante o período militar, a maior intervenção federal. O Decreto 1164 definia que 100% ao longo de cada rodovia existente ou planejada seria terra federal. A partir disso aí, a revogação do 1164, no momento em que não houve uma discriminatória para identificar o que teria sido disponibilizado para a sociedade organizada, dessas terras que eram públicas, então, de fato, você não teve o retorno. Hoje 72% das terras do estado são terras de domínio da União. Então o que nos interessa? Esse período todo, essa discussão e essa reflexão da questão do zoneamento é importante, por quê? Porque tem o condão de independentemente se a terra é da União, se a terra é do estado, se a terra é do município, ele vem e diz o seguinte: “Isto é uma área de preservação integral”. Outro: “Isto é área de uso restrito, isto é uma área de uso intensivo”. O que é fundamental? Que se tenha um grande concerto em torno disso. E acho que chegamos, sim, a um projeto que expressa, de certa forma, fortemente essa idéia de que é possível, e que a pior regra é não ter a regra.
