|DATA|ENTREVISTA|ORDEM|LOCUTOR|FALA
200|30/05/1988|Thomas Skidmore|201|Luciano Ornellas| Professor, como estudioso das coisas brasileiras, relembrando o passado recente e o presente, o senhor vê alguma diferença entre o PDS do regime militar e o PMDB da Nova República?
201|30/05/1988|Thomas Skidmore|202|Thomas Skidmore|  Acho que sim. Espero que sim. O PDS era sustentado, completamente, pelos militares, e sem o apoio militar não teria sido possível, realmente,  eleger. A prova disso foi a eleição de 70. Na eleição de 70, o governo ganhou muito bem no Brasil. Aconteceu que, na véspera da eleição de 70, houve, pelo menos, cinco mil prisões. De modo que saiu tudo bem. Aqui no Brasil, também, alguns diplomatas estrangeiros diziam: “Não. O Médici, o presidente Médici , tem tudo aqui na mão, não tem problema nenhum.” Em 74, quando o Geisel  deixou o pessoal da oposição chegar à televisão, foi o contrário, completamente. De modo que eu acho que realmente o PMDB é o herdeiro desse papel da oposição. O problema é que fica agora na ambigüidade: está no poder ou não está no poder.
202|30/05/1988|Thomas Skidmore|203|Paulo Sérgio Pinheiro|  Só insistindo nessa pergunta do Luciano. Você acha que o procedimento do PMDB no governo, por exemplo, no governo federal, você acha que o fisiologismo do PMDB foi diferente do fisiologismo do PDS?
203|30/05/1988|Thomas Skidmore|204|Thomas Skidmore| São políticos pegando dinheiro dentro , favores, influências. Isso é...
204|30/05/1988|Thomas Skidmore|205|Pedro Del Picchia| Fisiologismo de esquerda.
205|30/05/1988|Thomas Skidmore|206|[Sobreposição de vozes e risos]|
206|30/05/1988|Thomas Skidmore|207|Thomas Skidmore| O problema é que com a democracia todo mundo sabe, e com o regime militar ninguém sabe, porque tem censura.
207|30/05/1988|Thomas Skidmore|208|Augusto Nunes|  Desculpe-me, professor, antes de passar ao Pedro Del Picchia, por falar em pegar dinheiro, já se sabe hoje, com as revelações ligadas à época, que muitos políticos brasileiros receberam dinheiro da CIA. Hoje, o senhor acredita que essas contribuições continuam?
208|30/05/1988|Thomas Skidmore|209|Thomas Skidmore| Não sei. É bem possível.
209|30/05/1988|Thomas Skidmore|210|Augusto Nunes| Pedro Del Picchia.
210|30/05/1988|Thomas Skidmore|211|Pedro Del Picchia| Queria voltar...
211|30/05/1988|Thomas Skidmore|212|Thomas Skidmore|  Só um minuto. Houve aqui um empresário americano, muito famoso, que construiu a estrada de ferro na Amazônia:  Farquhar , o nome dele, muito famoso. Ele se queixou que aqui no Brasil você dá dinheiro para o político brasileiro e ele não entrega, quer dizer, ele trai. 
212|30/05/1988|Thomas Skidmore|213|Thomas Skidmore| Muitas vezes, o político não é honesto.
213|30/05/1988|Thomas Skidmore|214|Augusto Nunes|  É que eles são independentes.  Nem sempre é dando que se recebe, às vezes, só recebe e não dá.
214|30/05/1988|Thomas Skidmore|215|[Sobreposição de vozes e risos gerais]|
215|30/05/1988|Thomas Skidmore|216|Thomas Skidmore| O corrupto não tem, quer dizer, ele fica lá sem graça...
216|30/05/1988|Thomas Skidmore|217|Pedro Del Picchia| O senhor me permite, eu queria voltar um pouquinho para trás. O senhor estava falando aí do período da revolução, do movimento de 1964, que teve apoio popular, em sua opinião.
217|30/05/1988|Thomas Skidmore|218|Thomas Skidmore| Apoio civil.
218|30/05/1988|Thomas Skidmore|219|Pedro Del Picchia| Apoio civil. Teve apoio civil. E que os Estados Unidos não tiveram uma participação direta. O argumento que se usou, a justificativa que foi usada na ocasião é que o governo João Goulart estava conduzindo o Brasil para o comunismo. Pergunto ao senhor: o senhor acha que se não tivesse havido o golpe de 64 e João Goulart, se ele tivesse concluído o seu mandato, nós teríamos ido para um regime comunista?
219|30/05/1988|Thomas Skidmore|220|Thomas Skidmore|  Ah... isso eu duvido.
220|30/05/1988|Thomas Skidmore|221|Pedro Del Picchia| Seria a eleição?
221|30/05/1988|Thomas Skidmore|222|Thomas Skidmore| A política não. Ninguém estava preparado para isso, nem o Partidão . Ninguém.
222|30/05/1988|Thomas Skidmore|223|Pedro Del Picchia| Haveria eleição, portanto?
223|30/05/1988|Thomas Skidmore|224|Thomas Skidmore| Bom, isso é especulação. Mas o comunismo era quase ridículo, na época, com as divisões tremendas. Inclusive o Partidão não estava em condições, era muito cauteloso com o governo Goulart. Houve aquela euforia na esquerda: os populistas, o pessoal da Igreja . Mas não... acho que não houve... Para o americano, para o governo americano é outra coisa; falar em comunismo quer dizer um governo que vai escapar do controle ou vai criar núcleos de resistência na América Latina às políticas norte-americanas. Mas a fumaça  é sempre sobre o comunismo.
224|30/05/1988|Thomas Skidmore|225|[Sobreposição de vozes chamando o professor Thomas Skidmore]|
225|30/05/1988|Thomas Skidmore|226|Augusto Nunes|" Professor, o João Luis Batista, do Ipiranga, relembra uma velha bandeira das esquerdas brasileiras, hoje um tanto em desuso, mas que fez muito barulho há alguns anos, que é do imperialismo americano. E ele pergunta ao senhor: ""De que forma o imperialismo americano atinge, se manifestou ou se manifesta no Brasil?"". Faz sentido essa bandeira do ponto de vista da esquerda?"
226|30/05/1988|Thomas Skidmore|227|Thomas Skidmore| Bom, isso foi, para muitos brasileiros, sinônimo de presença econômica. Você vai para o Citibank... Houve aquele panfleto muito famoso, faz vinte e cinco anos, Um dia na vida do brasileiro: que acorda e pega a...
227|30/05/1988|Thomas Skidmore|228|Augusto Nunes| Um dia na vida do brasileiro.
228|30/05/1988|Thomas Skidmore|229|Thomas Skidmore| ... pasta dental, que é a Colgate, depois come flocos Kellogs's, e depois anda no Volkswagen, aquela coisa toda que é a presença estrangeira na economia. Bom, tem que analisar isso: o que é e o que dá conseqüências boas para o Brasil, e não o que não dá, nao é? Tem que analisar friamente. Outra coisa é a pressão americana ou de outro país na política externa, e o Brasil já sofreu isso muitas vezes. Neste assunto o Brasil está em melhores condições agora de articular uma política externa que não seja subordinada aos Estados Unidos. Um país muito mais maduro, inclusive quanto às condições econômicas. A política externa é muito mais diversificada agora e, muitas vezes, simplesmente não responde aos Estados Unidos.
229|30/05/1988|Thomas Skidmore|230|André Singer|" Professor, voltando, ainda, a 64, eu me surpreendi que no seu livro o senhor trata o movimento militar por revolução, que é o nome que esse movimento se ""auto-deu"". As revoluções, normalmente, são entendidas como processos de mudanças culturais..."
230|30/05/1988|Thomas Skidmore|231|Thomas Skidmore|  Mudanças sociais.
231|30/05/1988|Thomas Skidmore|232|André Singer| Mudanças culturais na sociedade. O senhor acha que, de fato, o movimento militar de 1964 foi  uma revolução?
232|30/05/1988|Thomas Skidmore|233|Thomas Skidmore| Não, em termos de mudanças sociais obviamente não. Obviamente não. Mas não houve simplesmente um golpe de um grupo de oficiais, aquilo foi articulado lá atrás. O movimento militar era um movimento de uma grande parte da burguesia. Mostrou isso no livro o René Dreyfuss , que realizou a articulação. Eu tive uma entrevista, foi no ano passado - eu acho - com o Golbery. Ele falou sobre a rede de legalidade de 61, a tentativa de evitar a sucessão de Jango, mas com aquela mobilização com o Brizola que montou muito bem aquela coisa toda, o Terceiro Exército, não foi possível. O Golbery disse: “Bom, nós tínhamos aprendido muito com isso”. Exatamente a mobilização civil para apoiar. Mas não foi uma revolução em termos sociais, como em Cuba, e mesmo, obviamente, como na Rússia ou na China.
233|30/05/1988|Thomas Skidmore|234|André Singer| O senhor distingue o movimento militar de 64, aqui no Brasil, dos outros golpes militares na América Latina, professor? O senhor acha que tem um caráter inteiramente diferente do que houve na Argentina, no Uruguai e do que houve no Chile?
234|30/05/1988|Thomas Skidmore|235|Thomas Skidmore|" Não inteiramente, mas tem algumas semelhanças entre... Tem semelhanças. Tem uma onda aqui  de golpes: na Argentina, no Uruguai... No Chile foi o mais dramático, o país mais democrático da América Latina foi o último a sair do sistema autoritário. O Brasil, em certo sentido, conseguiu alguma coisa. Em termos, vamos dizer, da tecnocracia. Diversificaram as exportações, por exemplo. A coisa do ""leão"" no Brasil: em 1961, o imposto de renda foi uma piada aqui no Brasil. Ninguém ligava, como na Itália, na França, não é?  ""A Gina Lollobrigida , ela não paga a multa."", aquela coisa toda. Mas uma coisa que funciona aqui no Brasil, é impressionante, é o ""leão""."
235|30/05/1988|Thomas Skidmore|236|Pedro Del Picchia|  Professor, amanhã, nós vamos...
236|30/05/1988|Thomas Skidmore|237|[Sobreposição de vozes]|
237|30/05/1988|Thomas Skidmore|238|Thomas Skidmore| Pois é, pois é. Isso é a coisa menos brasileira que eu vi. Isso é conseqüência, pelo menos, do governo tecnocrata.
238|30/05/1988|Thomas Skidmore|239|Rodolfo Konder| Só uma caroninha na pergunta do André.
239|30/05/1988|Thomas Skidmore|240|Augusto Nunes| Em seguinda, Ricardo Noblat. Rodolfo Konder.
240|30/05/1988|Thomas Skidmore|241|Rodolfo Konder| O senhor falou das semelhanças entre esses golpes: no Brasil, Argentina, Chile, e todos eles se dão na década de 60 e começo da década de 70, talvez como uma resposta à Revolução Cubana de 1959 .
241|30/05/1988|Thomas Skidmore|242|Thomas Skidmore| Sem dúvidas. Sem dúvida nenhuma.
242|30/05/1988|Thomas Skidmore|243|Paulo Sérgio Pinheiro| Só uma notinha de rodapé. Outra personagem muito querida nesse período é o atual embaixador na ONU, o general Vernon Walters .
243|30/05/1988|Thomas Skidmore|244|Thomas Skidmore|  O nosso amigo. 
244|30/05/1988|Thomas Skidmore|245|Paulo Sérgio Pinheiro| É, o nosso amigo.
245|30/05/1988|Thomas Skidmore|246|Thomas Skidmore| Tem que aparecer.
246|30/05/1988|Thomas Skidmore|247|Paulo Sérgio Pinheiro| Ele escreveu as memórias, que você conhece, As missões silenciosas, imagina o falastrão.
247|30/05/1988|Thomas Skidmore|248|Thomas Skidmore| Fala demais.
248|30/05/1988|Thomas Skidmore|249|Paulo Sérgio Pinheiro| Você acha que ele fala demais ou que, efetivamente, ele teve um papel importante na articulação, na interligação entre os golpistas de 64?
249|30/05/1988|Thomas Skidmore|250|Thomas Skidmore|" Tem a ver. Não há duvidas que ele estava articulando isso. Ele já conhecia o general Castelo Branco da Itália, e o papel dele era exatamente o de informar o governo americano sobre isso. Mas ele não mandou. Não tenho a menor dúvida de quem mandou foi o grupo de conspiradores militares brasileiros. Mas ele alertou o Gordon. O Gordon tinha um problema para viajar, naquela época, e ele tinha dito para o Walters: ""I dont want any surprises."", “Não quero nenhuma surpresa!” "
250|30/05/1988|Thomas Skidmore|251|Paulo Sérgio Pinheiro|  Não é pra já! O golpe não é logo.
251|30/05/1988|Thomas Skidmore|252|[Risos]|
252|30/05/1988|Thomas Skidmore|253|Thomas Skidmore| “Você fala para mim”, ele falou. De modo que ele foi muito bem informado, e isso eu falei lá. Obviamente a indicação era a tremenda ajuda econômica dos Estados Unidos, que veio logo do USAID .  100 milhões de dólares no primeiro ano. Sustentou muito o governo.
253|30/05/1988|Thomas Skidmore|254|[Sobreposição de vozes]|
254|30/05/1988|Thomas Skidmore|255|Augusto Nunes| Depois, eu queria assegurar a palavra, aqui, do...
255|30/05/1988|Thomas Skidmore|256|Rodolfo Konder| O senhor estava falando do Citibank e interrompeu. O Citibank teve, também, um papel nisso?
256|30/05/1988|Thomas Skidmore|257|Thomas Skidmore| O Citibank? No golpe?
257|30/05/1988|Thomas Skidmore|258|Rodolfo Konder| Nessa ajuda financeira aos elementos que conspiraram.
258|30/05/1988|Thomas Skidmore|259|Thomas Skidmore| Não. Eu acho muito pouco para a época. Os bancos comerciais, naquela época, não tinham nada para . Isso é uma coisa posterior. Muito posterior.
259|30/05/1988|Thomas Skidmore|260|Ricardo Noblat| Professor, em resposta à uma pergunta anterior, o senhor descartou, praticamente, o risco de que caminhávamos para um regime comunista ou quase isso...
260|30/05/1988|Thomas Skidmore|261|Thomas Skidmore| Em 64.
261|30/05/1988|Thomas Skidmore|262|Ricardo Noblat| É. Em 64. A seu ver, quais as verdadeiras causas do golpe militar de 1964?
262|30/05/1988|Thomas Skidmore|263|Thomas Skidmore| Falou muito bem...
263|30/05/1988|Thomas Skidmore|264|Augusto Nunes|  Aliás, desculpe professor, ...
264|30/05/1988|Thomas Skidmore|265|Thomas Skidmore| Pois não.
265|30/05/1988|Thomas Skidmore|266|Augusto Nunes| Só para incorporar à pergunta do Noblat, a preocupação do José Antônio Rodrigues, do Ipiranga, que diz o seguinte: “O senhor afirma que os americanos não tiveram influência direta no movimento militar de 64. Então, como é que o senhor explica a seqüência de movimentos semelhantes em outros países como Uruguai, Argentina, Chile?”. O senhor identifica as origens às quais se referem o Noblat, e em seguida responde a essa pergunta.
266|30/05/1988|Thomas Skidmore|267|Thomas Skidmore| Sim. Bom, o que houve? Depois da Revolução Cubana houve uma preocupação muito grande nos Estados Unidos com a possibilidade de uma onda comunista na América Latina. Todo mundo falava: “A revolução vem aí”, aquela coisa toda. Então, os exércitos latino-americanos notaram que a primeira instituição liquidada em Cuba foi o exército, não é? E, também, o governo americano começou a dar ajuda no treinamento. O Brasil já tinha ligações antigas vindas desde a Segunda Guerra Mundial. Treinamento no Panamá. Inclusive, um programa chamado de segurança pública. A idéia era, na época do Kennedy, “vamos com a Aliança para o Progresso”  quer dizer: crescimento econômico, reforma social, democracia. Só isso. Se não der certo, nós temos aqui as boininhas verdes , que é outra resposta ao problema, quer dizer, contra a insurgência. O que predominou nos exércitos latino-americanos e em alguns setores civis, também, era a preocupação com a necessidade de  uma resposta militar, de modo que os reacionários trabalharam muito bem com isso, em todos os países. De modo que o golpe militar era a resposta às crises econômicas.
267|30/05/1988|Thomas Skidmore|268|Ricardo Carvalho| Mas o senhor acha que se os Estados Unidos não tivessem dado o apoio, talvez não muito explícito, mas implícito, aos golpistas, os golpes existiriam?
268|30/05/1988|Thomas Skidmore|269|Thomas Skidmore| Não. Isso tinha um papel importante.
269|30/05/1988|Thomas Skidmore|270|Ricardo Carvalho| O apoio dos Estados Unidos.
270|30/05/1988|Thomas Skidmore|271|Thomas Skidmore| O apoio. O apoio implícito que era financeiro. Tremendo. E também técnico. Eles mandaram para cá, por exemplo, o  Mitrioni , que foi morto no Uruguai. Toda a tecnologia, a segurança pública .
271|30/05/1988|Thomas Skidmore|272|Ricardo Carvalho| Quer dizer, os Estados Unidos não colocaram os marines aqui, mas o apoio houve, com certeza, em todos os países. E sem o apoio não haveria golpe?
272|30/05/1988|Thomas Skidmore|273|Thomas Skidmore| Não. Ironicamente não houve nenhum  movimento guerrilheiro no Brasil. Precisava criar depois.
273|30/05/1988|Thomas Skidmore|274|Ricardo Carvalho| Mas eu digo do Cone Sul: Chile, Argentina, Uruguai e Brasil.
274|30/05/1988|Thomas Skidmore|275|Thomas Skidmore| É, mas foi necessário justificar depois,  o golpe no Brasil foi o primeiro, o precedente da América Latina e, os Estados Unidos apoiando, obviamente, era a indicação para os outros. Eu acho que houve, depois, uma certa desilusão. A Revolução Cubana não espalhou. Tem a Nicarágua, que não é uma coisa muito parecida. O fato é que os comunistas não estão aqui batendo às portas. A coisa é muito mais complicada. O general agora, que era o capitão, o major antigamente, ele não acha mais que o pessoal do PC do B vai tomar conta do país, que é coisa de louco. Mas é uma visão um pouco mais sofisticada da democracia. De modo que  outro momento. Mas a orientação anticomunista era conseqüência, também, da influência americana que marchava com a idéia da “Aliança para o Progresso”.
275|30/05/1988|Thomas Skidmore|276|Augusto Nunes| Pedro Del Pichia.
276|30/05/1988|Thomas Skidmore|277|Pedro Del Picchia| Quando o senhor falou que não havia guerrilha antes de 64, depois o senhor...
277|30/05/1988|Thomas Skidmore|278|Thomas Skidmore| Aqui, no Brasil.
278|30/05/1988|Thomas Skidmore|279|Pedro Del Picchia| ... foi necessário justificar depois. O que quer dizer exatamente isso? O senhor acha que, de alguma forma, a extrema direita contribuiu para que se instaurasse a guerrilha no Brasil, depois?
279|30/05/1988|Thomas Skidmore|280|Thomas Skidmore|" Não. Estou dizendo que a segunda seção do exército, que é uma coisa de inteligência... eles fizeram ""batidas"", e não houve nenhum...  Eram muito poucas armas no Brasil. No Nordeste tem ligas camponesas, mas não armadas. Tem pouca coisa. Foi difícil para eles justificar a coisa. Quer dizer, tinha que superestimar o movimento... Inclusive, todo mundo na época esperava pelos IPMs  Eu tenho os IPMs que foram publicados, pouca coisa. E começaram a falar em corrupção. Outra coisa é o Juscelino, de modo que foi difícil. Veio depois o movimento guerrilheiro que justifica a repressão, mas a repressão chegou primeiro."
280|30/05/1988|Thomas Skidmore|281|André Singer| Professor, eu queria perguntar ainda sobre esse período - é rápido. Se na sua interpretação desse período o presidente João Goulart estava disposto a alimentar a idéia de um golpe militar, não de uma sublevação civil, não de uma sublevação social, mas de um golpe militar com os eventuais apoios que ele tivesse. Essa é uma das versões que o golpe de 64 teria sido um golpe preventivo contra um golpe em andamento do próprio João Goulart.
281|30/05/1988|Thomas Skidmore|282|Thomas Skidmore| Sim, sim.
282|30/05/1988|Thomas Skidmore|283|André Singer| Qual é o seu entendimento desse episódio?
283|30/05/1988|Thomas Skidmore|284|Thomas Skidmore|" Eu acho que ele tinha razão, porque o presidente Goulart estava promovendo generais fora do lugar. Ele estava tentando criar um ""generalato"" favorável à política dele. Isso foi bem notado no Exército, de modo que, também, houve o incidente de novembro de 63, uma mobilizaçãozinha, a tentativa de um golpe, talvez, do governo contra... quer dizer, criar um tipo de regime militar com o Jango como presidente. Eu acho que entra aqui também a ameaça à hierarquia das Forças Armadas. É que tem, talvez..."
284|30/05/1988|Thomas Skidmore|285|Fernando Mitre|  A própria rebelião dos marinheiros.
285|30/05/1988|Thomas Skidmore|286|Thomas Skidmore| Talvez a pessoa mais interessante do que os outros seja o próprio cabo Anselmo .
286|30/05/1988|Thomas Skidmore|287|Fernando Mitre| Não sei se o senhor leu tudo, mas esta semana saiu uma crítica numa revista de São Paulo, a Veja, dizendo que o senhor não tratou adequadamente a questão da revolta dos marinheiros.
287|30/05/1988|Thomas Skidmore|288|Thomas Skidmore| Sim.
288|30/05/1988|Thomas Skidmore|289|[Sobreposição de vozes]|
289|30/05/1988|Thomas Skidmore|290|Fernando Mitre| O senhor passou ao largo daquela questão como causa desencadeante, mas não fundamentou.
290|30/05/1988|Thomas Skidmore|291|Augusto Nunes|  E mais ainda, professor, desculpe: como é que o senhor vê a figura do cabo Anselmo? Respondendo ao Mitre.
291|30/05/1988|Thomas Skidmore|292|Thomas Skidmore| Pois não. Primeiro, sobre a crítica na Veja, o problema é que eu já tinha publicado um livro sobre isso, , que é outro livro. Não é justo pedir ao resenhista ler o outro livro. Mas o fato é que eu tratei muito do assunto naquele outro livro. Deixei ali por acidente. Um capítulo da introdução para explicar a origem. O cabo Anselmo: que caso curioso. Como é que um cabo vai chegar lá e vai montar o ? Como é? Aquela película da Revolução Russa?  Um cabo arranjou isso? Não tinha vídeo, na época, como é que ele vai arranjar toda a película? Que coisa louca.
292|30/05/1988|Thomas Skidmore|293|Fernando Mitre| E depois, ele surgiu como um elemento ligado a CIA.
293|30/05/1988|Thomas Skidmore|294|Thomas Skidmore|  E  tem dois livros sobre ele. Que coisas incríveis! Eu acho que ele estava exagerando também...
294|30/05/1988|Thomas Skidmore|295|Fernando Mitre|  Mas ele era um agente provocador, ou não?
295|30/05/1988|Thomas Skidmore|296|Thomas Skidmore| Pois é. Ele denunciou toda aquela gente em Pernambuco... liquidou a resistência. Ficou sinistro.
296|30/05/1988|Thomas Skidmore|297|Fernando Mitre| Ele era um agente provocador, professor?
297|30/05/1988|Thomas Skidmore|298|Thomas Skidmore| Em 64? Eu acho que talvez foi.
298|30/05/1988|Thomas Skidmore|299|Fernando Mitre| Quando ele levantou os marinheiros, ele estava a serviço de quem?
299|30/05/1988|Thomas Skidmore|300|Thomas Skidmore| Exatamente. Eu acho que...
300|30/05/1988|Thomas Skidmore|301|Rodolfo Konder|  Ele diz que se tornou um agente depois.
301|30/05/1988|Thomas Skidmore|302|Thomas Skidmore| Depois. Em Cuba, em Cuba.
302|30/05/1988|Thomas Skidmore|303|Rodolfo Konder| Eu estive com o cabo Anselmo em 1964 na embaixada no México, e ele já tinha todas as características de um agente provocador.
303|30/05/1988|Thomas Skidmore|304|Fernando Mitre|  Ele já estava envolvido com o...
304|30/05/1988|Thomas Skidmore|305|Thomas Skidmore| É. Exatamente.
305|30/05/1988|Thomas Skidmore|306|Augusto Nunes| Ricardo Carvalho.
306|30/05/1988|Thomas Skidmore|307|Ricardo Carvalho| Eu tenho uma curiosidade a respeito do papel do brasilianista. Durante um bom tempo os brasilianistas eram vistos como agentes infiltrados, se falava muito isso neste país. O senhor, como brasilianista, o senhor encontra dificuldades nas suas pesquisas? Já encontrou mais? O senhor, por acaso, não seria consultado pelo governo norte-americano que, todos sabemos, é muito cioso na coleta de informações sobre os países, particularmente, da América Latina. Além do Departamento do Estado, tem subsecretarias e todos aqueles outros departamentos. Como é o papel do brasilianista, e o que leva um... ?
307|30/05/1988|Thomas Skidmore|308|[Risos]|
308|30/05/1988|Thomas Skidmore|309|Augusto Nunes|  Aliás, professor, até antes de responder ao Ricardo, eu pediria que o senhor explicasse por que é que o senhor começou a se interessar pelo Brasil.
309|30/05/1988|Thomas Skidmore|310|Ricardo Carvalho| Exatamente. O que levou o professor a se interessar pelo Brasil e pela América Latina?
310|30/05/1988|Thomas Skidmore|311|Thomas Skidmore| Essa é uma velha história que eu contei várias vezes, inclusive a Veja não gostou.
311|30/05/1988|Thomas Skidmore|312|[Risos]|
312|30/05/1988|Thomas Skidmore|313|Thomas Skidmore| Eu fiz uma conferência na UNB , eu acho que foi em 74, saiu uma reportagem na Veja: “Música na Unb”, porque era lá numa aula de música. Eu não sabia na época, mas era a primeira conferência geral permitida pelo reitor José Azevedo. Eu  contei essa história. Toda a minha orientação e formação era orientada para a Europa.  me formei em uma universidade em Ohio, que é meu estado natural, depois eu fui para a Inglaterra, para Oxford, obviamente tem aqui a , que é aquele charme, aquela atração. Fiquei lá estudando filosofia, que  nada a ver com nada. Eu me interessei pela Alemanha. Eu achava a Alemanha um país fascinante, porque você tem os altos e os baixos: você tem aqui o  e o . Como enigma histórico é fascinante. Eu voltei para Harvard e fiz o meu doutoramento lá. Escrevi uma tese sobre um chanceller  que veio depois de Bismark . É um homem que ninguém conhece o nome dele. Ele merece ser completamente esquecido.
313|30/05/1988|Thomas Skidmore|314|Augusto Nunes|  O senhor gosta de temas complicados.
314|30/05/1988|Thomas Skidmore|315|Thomas Skidmore| O nome dele é Caprivi  É. Essa tese fica lá numa estante em Harvard e ninguém a tocou.  Nunca.  Eu mesmo nunca reli a tese. Tudo bem. Mas era a formação indicada. Eu comecei a dar aulas em 1960. Acontece que houve um mau entendimento em Cuba. O Fidel , estava tomando conta de tudo, inclusive do Jardim Botânico de Harvard. Isso é demais: um revolucionário vai pegar o nosso jardim?! Em Harvard tinha poucos professores na época fazendo especialidade na área da América Latina. Eles acharam que era necessário criar mais elementos. Mas como? Houve excedente  aqui da Alemanha e mudo para a América Latina, e eles me ofereceram uma bolsa de três anos.
315|30/05/1988|Thomas Skidmore|316|Ricardo Carvalho| Quem ofereceu?
316|30/05/1988|Thomas Skidmore|317|Thomas Skidmore| Harvard, na época. Salário e viagens. Eu não conhecia nada, nem português, nem espanhol, nada da América Latina. América Latina era o México, aquela coisa do bang-bang.
317|30/05/1988|Thomas Skidmore|318|Ricardo Carvalho| Mas o senhor sabia onde era o Brasil?
318|30/05/1988|Thomas Skidmore|319|Thomas Skidmore| Mais ou menos. Vagamente.  Quer dizer,  ao sul do México .
319|30/05/1988|Thomas Skidmore|320|Ricardo Noblat| Como capital Buenos Aires.
320|30/05/1988|Thomas Skidmore|321|[Risos]|
