|DATA|ENTREVISTA|ORDEM|LOCUTOR|FALA
108|30/05/1988|Thomas Skidmore|109|Ricardo Carvalho| Mas no segundo turno ele não ganharia, professor? Ou disputando com quem?
109|30/05/1988|Thomas Skidmore|110|Augusto Nunes| Contra qualquer candidato, presumo.
110|30/05/1988|Thomas Skidmore|111|Thomas Skidmore| Quércia.
111|30/05/1988|Thomas Skidmore|112|Ricardo Nunes| Quércia?
112|30/05/1988|Thomas Skidmore|113|Thomas Skidmore|  Não sei. Mas eu estou dizendo que o Brizola tem a fortaleza dele no Rio Grande do Sul e Rio. Só. Foi muito votado como deputado federal nas eleições de 72, no Rio, não é? Duvido que o apoio dele...
113|30/05/1988|Thomas Skidmore|114|Augusto Nunes|  62.
114|30/05/1988|Thomas Skidmore|115|Thomas Skidmore| ... aqui em São Paulo é tão grande. Ele vem para cá a cada oportunidade para estimular a coisa. Em Minas Gerais, não tem...
115|30/05/1988|Thomas Skidmore|116|Augusto Nunes|  Professor, vamos completar a roda. Luciano Ornellas, do jornal O Estado de S. Paulo.
116|30/05/1988|Thomas Skidmore|117|Luciano Ornellas| Professor, por analogia, para que o telespectador faça uma diferença entre o seu país e o nosso. O senhor não acha que se o caso de Watergate  tivesse acontecido no Brasil, os jornalistas já estariam presos? 
117|30/05/1988|Thomas Skidmore|118|Thomas Skidmore| Como é?
118|30/05/1988|Thomas Skidmore|119|Luciano Ornellas| Os jornalistas aqui  já não estariam presos?
119|30/05/1988|Thomas Skidmore|120|Augusto Nunes| Se o caso... repete, acho que ele não ouviu a primeira parte.
120|30/05/1988|Thomas Skidmore|121|Luciano Ornellas| Se o caso de Watergate tivesse acontecido no Brasil, o senhor não acha que os jornalistas iriam pra cadeia?
121|30/05/1988|Thomas Skidmore|122|Augusto Nunes| Os jornalistas.
122|30/05/1988|Thomas Skidmore|123|Thomas Skidmore| Aqui no Brasil?
123|30/05/1988|Thomas Skidmore|124|Augusto Nunes| É.
124|30/05/1988|Thomas Skidmore|125|Thomas Skidmore|  Está com medo?
125|30/05/1988|Thomas Skidmore|126|[Risos e sobreposição de vozes]|
126|30/05/1988|Thomas Skidmore|127|Augusto Nunes| Acho que vale a pena até a gente se estender sobre essa pergunta. O que existe, professor, é uma sensação de profundo desencanto em relação à disposição da máquina judiciária, ou da máquina do executivo em apurar casos de corrupção. Um caso desse tamanho - presumo que seja isso - envolvendo o governo brasileiro , o senhor acha que geraria as conseqüências que o caso Watergate gerou ou o tiro sairia pela culatra?
127|30/05/1988|Thomas Skidmore|128|Thomas Skidmore| Mas o jornalista dos Estados Unidos não foram para a cadeia.
128|30/05/1988|Thomas Skidmore|129|Augusto Nunes| Pois é, mas o Luciano está dizendo é que aqui o tiro sairia pela culatra, como dizem os brasileiros, os jornalistas é que iriam para a cadeia.
129|30/05/1988|Thomas Skidmore|130|Thomas Skidmore| Não sei. A tradição jornalística no Brasil é muito forte, tem muitos anos. Eu acho que mesmo durante o governo militar, essa tradição continuava. A minha impressão atual é que não tem essa tendência. Se houver emergência, alguém vai chamar para estado de sítio , aquela coisa toda, é possível, claro. Inclusive gringos...  Me chamaram  para a polícia uma vez...
130|30/05/1988|Thomas Skidmore|131|Augusto Nunes| Professor, eu vou insistir nesse filão que o Luciano Ornellas descobriu agora. O senhor certamente deve estar ouvindo muitos relatos sobre... envolvendo casos de corrupção, quase todos ligados a funcionários do governo. São casos de corrupção que envolvem grandes cifras, sobretudo para os padrões brasileiros. O senhor acha que, primeiro, o nível de corrupção é semelhante nos Estados Unidos e no Brasil? Segundo, a corrupção nos Estados Unidos é tão impune quanto parece ser aqui no Brasil?
131|30/05/1988|Thomas Skidmore|132|Thomas Skidmore| Isso é difícil de dizer. Eu não fiz pesquisa sobre isso, não é? Mas a impressão que eu tenho é que no Brasil as instituições não funcionam no mesmo nível do que nos Estados Unidos. Por exemplo, nós temos o General Accounting Office , que é, realmente, o centro onde eles fazem a contabilidade de todo o governo. É independente, subordinado ao Congresso e tem independência. E ninguém vai subornar o General Accounting Office. Tenho a impressão  que no Brasil isso não existe. Quer dizer, ainda tem muito para fazer nesse assunto.
132|30/05/1988|Thomas Skidmore|133|Augusto Nunes| Professor, antes de... Desculpe. Em seguida, Paulo Sérgio Pinheiro. Alguns telespectadores, entre os quais Vicente Bianchi, do Campo Limpo e César Brigante, desculpe, Sérgio Pinto Dias, de Alphaville, eles querem saber se o senhor acha que o Brasil...
133|30/05/1988|Thomas Skidmore|134|Thomas Skidmore|  Só para fazer uma... Nós  temos também corrupção . Bastante.
134|30/05/1988|Thomas Skidmore|135|Augusto Nunes| Perfeito. Se o senhor acha que o Brasil, visto à distância, é um país sério? O senhor certamente sabe da frase que foi atribuída, parece, a Charles De Gaulle , segundo a qual o Brasil não seria um país sério. É?
135|30/05/1988|Thomas Skidmore|136|Thomas Skidmore| Eu acho que sim. Inclusive, nos meus cursos nos Estados Unidos, quando eu vou fazer conferência lá, tem muito interesse no Brasil. Geralmente começa com a música brasileira. Todo mundo conhece. Depois disso tem outras coisas, tem sobre a Amazônia, sobre o sistema político, sobre futebol, sobre samba, sobre... e depois a gente fica aqui com outras coisas. Mas eu acho que o Brasil é um país sério. Às vezes, o nosso país é sério demais.
136|30/05/1988|Thomas Skidmore|137|Paulo Sérgio Pinheiro| Voltando ainda a essa questão da corrupção. Graças ao que o Luciano lembrava, talvez a visibilidade da transição, nunca a corrupção foi tão explícita no país. Você, que conhece a longa duração republicana, por que essa resistência? Você já deu uma explicação, o problema das instituições.
137|30/05/1988|Thomas Skidmore|138|Thomas Skidmore| Sim.
138|30/05/1988|Thomas Skidmore|139|Paulo Sérgio Pinheiro| Mas você não acha que, numa transição política, esses temas da corrupção, que, evidentemente, interessam à população e aos eleitores, por que é que eles não têm uma conseqüência ao nível dos governantes?
139|30/05/1988|Thomas Skidmore|140|Thomas Skidmore|" Eu acho que entra aqui também o sistema partidário. O sistema partidário, que está funcionando bem, quem controla, em certo sentido, é a oposição. Com esse sistema que não funciona bem, que alguém que está no governo não tem oposição realmente para criticar, isso só deixa a imprensa para fazer controle, para fazer investigação. Eu acho que isso seria melhor com um sistema partidário melhor organizado. Inclusive, muitas vezes, tem corrupção que é disciplinada pelos partidos. Corrupção é inevitável, muitas vezes. Porque o que um chama de corrupção, para outro é renda, porque, talvez, o salário dele seja muito baixo, e funciona, nessa base. Mas, precisa de um sistema que discipline. Quando não tem sistema partidário bem organizado, bem montado, eu acho que isso é maior. E também tem a mentalidade que ""Vamos pegar o 'nosso' rapidamente, porque não tem mais chance."". É a nossa única oportunidade."
140|30/05/1988|Thomas Skidmore|141|André Singer| Professor, eu gostaria de perguntar justamente sobre o sistema partidário, que o senhor levantou. O regime militar instaurou um bipartidarismo seguindo o modelo norte-americano. Esse bipartidarismo...
141|30/05/1988|Thomas Skidmore|142|Thomas Skidmore|  Pensando que foi.
142|30/05/1988|Thomas Skidmore|143|André Singer| Pois é. Mas esse bipartidarismo sobreviveu durante algum tempo e depois se desfez numa certa etapa da transição. Hoje o senhor está assinalando que há um sistema partidário pouco estruturado. Eu gostaria de saber a sua opinião. Se num país como o Brasil a tendência é o sistema partidário se estruturar ao redor de dois grandes partidos - um do governo e outro da oposição - ou o multipartidarismo e esse certo esfacelamento partidário que está ocorrendo hoje é a tendência natural? E, gostaria, também, de agregar a isso a observação feita pelo próprio presidente Sarney, de que não existem partidos nacionais, nós temos partidos por Estado. E mencionar que a Assembléia Constituinte aprovou novamente o voto proporcional e não o voto distrital. Quer dizer, o senhor acha que o sistema partidário brasileiro tende a se estruturar por onde? Qual é o modelo que o senhor enxerga?
143|30/05/1988|Thomas Skidmore|144|Thomas Skidmore| Bom, o experimento com o bipartidarismo, a meu ver, foi ingenuidade do presidente Castelo Branco. Ele achava que o segredo da democracia americana, e também a inglesa, era o bipartidarismo. O fato é que bipartidarismo é um mito. No nosso país sempre houve alguns outros partidos. Também na Inglaterra. Agora, por exemplo, a Tatcher  tem a maioria tremenda, mas a votação dela, popular, é menos do que 50%. De modo que não é verdade que eles precisam... a verdade histórica é que sempre houve mais partidos, conosco também.
144|30/05/1988|Thomas Skidmore|145|André Singer| Mas nos Estados Unidos, predominantemente, há dois partidos, não é?
145|30/05/1988|Thomas Skidmore|146|Thomas Skidmore| Predominante, é. Às vezes tem variações. Ao meu ver, seria melhor para o Brasil - especulação minha - ter o sistema de voto distrital em termos de fortalecer os partidos e com isso articular partidos nacionais, que precisam, que vai distribuir. Quer dizer, tem a máquina governamental que cresceu tremendamente durante o governo militar, não é? É um monstro que fica lá dividindo as coisas, seguindo a opinião dos tecnocratas, sem a influência ou pouca influência dos políticos. O que precisa é articular os partidos com o poder, com o governo central e também descentralizar bastante, para os estados. E eu acho que isso estimularia muito o sistema político brasileiro. O fato é que você vai ter conflitos setoriais, ou de classe, isso é inevitável. Mas com partidos bem articulados, nacionais, tem a possibilidade de negociar, negociar o acordo, coisa que agora não tem.
146|30/05/1988|Thomas Skidmore|147|Fernando Mitre| Professor, o senhor se refere no seu livro ao enorme talento que as nossas elites têm para passar ao largo das questões fundamentais relativas à justiça social e econômica, como o senhor diz. E ainda com relação ao quadro partidário, o nosso quadro partidário não é nitidamente ideológico. Então, o eleitor quando vota não sabe muito bem em que programa ele está votando. Agora, o senhor acha possível, num país com as diferenças sociais do Brasil, se aplicar eficientemente uma democracia política sem cuidar da democracia social? Quer dizer, com essas disparidades?
147|30/05/1988|Thomas Skidmore|148|Thomas Skidmore|  Eu acho que não. Eu acho que não é possível.
148|30/05/1988|Thomas Skidmore|149|Fernando Mitre| Não é possível. Então, podemos concluir que nós estamos ainda praticamente na estaca zero na construção da democracia. Porque estamos cuidando de problemas institucionais ainda. E o problema social, este está distante, muito longe ainda. Seria isso? Estamos tão longe assim então de uma democracia plena?
149|30/05/1988|Thomas Skidmore|150|Thomas Skidmore| Bastante distante. Bom, primeiro, os fatos políticos ainda são fatos vindos do sistema militar, do governo militar. O que houve durante o governo militar? Dois partidos: um partido do governo, que tinha que ganhar, e a oposição, que não podia ganhar. E o governo militar manipulou o sistema. O que aconteceu? O MDB  se tornou o grande partido do Brasil. E a bandeira era, exatamente, liberdade contra a repressão e também justiça social. Isso fica muito claro nos manifestos. Em 82, nas campanhas para governadores, foi muito bem articulado lá, e também quando o presidente Sarney convidou o Hélio Jaguaribe , sociólogo, para fazer aquele estudo sobre o Brasil democrático e os seus problemas, estava tudo lá, uma radiografia do problema social no Brasil, sem dúvida nenhuma.
150|30/05/1988|Thomas Skidmore|151|Paulo Sérgio Pinheiro| Mas o presidente não fez nada, ele preferiu jogar no lixo. 
151|30/05/1988|Thomas Skidmore|152|[...]| Professor, ...
152|30/05/1988|Thomas Skidmore|153|Thomas Skidmore| Mas eu acho que é essencial fazer isso. Não tenho a menor dúvida. O Brasil tem essa divisão que é muito grande. É a preocupação com mudanças institucionais...
153|30/05/1988|Thomas Skidmore|154|Fernando Mitre|  O senhor acha que a Nova República não caminhou nessa direção por enquanto?
154|30/05/1988|Thomas Skidmore|155|Thomas Skidmore| Muito pouco.
155|30/05/1988|Thomas Skidmore|156|Fernando Mitre| Quer dizer, o “tudo pelo social” do Sarney é mais uma frase?
156|30/05/1988|Thomas Skidmore|157|Thomas Skidmore| Eu não conheço profundamente o orçamento, mas duvido .
157|30/05/1988|Thomas Skidmore|158|Fernando Mitre| Então quer dizer que o PMDB...
158|30/05/1988|Thomas Skidmore|159|Augusto Nunes| Cláudio, ...
159|30/05/1988|Thomas Skidmore|160|Thomas Skidmore| Houve uma coisa que era o Plano Cruzado... quando começou o Plano Cruzado
160|30/05/1988|Thomas Skidmore|161|Fernando Mitre| Mas que não era também para distribuir renda. Aquilo foi...
161|30/05/1988|Thomas Skidmore|162|Thomas Skidmore|"  Foi no começo. Eles aumentaram os salários, houve um rush, uma euforia de prosperidade, muita gente de baixo... Lembro-me muito bem o Pazzianotto  dizendo: ""Mal dá para o operário aqui comprar um par de sapatos""."
162|30/05/1988|Thomas Skidmore|163|Fernando Mitre| Naquele momento, trinta milhões de brasileiros que não conheciam o mercado de consumo chegaram lá, mas parece que já voltaram.
163|30/05/1988|Thomas Skidmore|164|[Sobreposição de vozes]|
164|30/05/1988|Thomas Skidmore|165|Augusto Nunes| Professor, só pra estabelecer um pouco de ordem...
165|30/05/1988|Thomas Skidmore|166|Thomas Skidmore| Pois não.
166|30/05/1988|Thomas Skidmore|167|Augusto Nunes| É o Paulo Sérgio, depois o Rodolfo, depois o Luciano Ornellas.
167|30/05/1988|Thomas Skidmore|168|Thomas Skidmore| Ok.
168|30/05/1988|Thomas Skidmore|169|Paulo Sérgio Pinheiro| Voltando a essa questão dos partidos, você acha que o poder fez mal ao PMDB, quer dizer, essa degenerescência que hoje nós assistimos ocorrer no PMDB, você acredita que, mal ou bem, eles estiveram no poder, apesar dessa Nova República vir sendo governada por decreto-lei?  Você sabe, o presidente Sarney só governa por decreto-lei. Você acha que o poder fez mal ao PMDB, a todas essas bandeiras que você se referia: da liberdade, da democracia, do projeto social?
169|30/05/1988|Thomas Skidmore|170|Thomas Skidmore| O problema é que o Tancredo teria sido a ponte entre o sistema antigo e os problemas atuais, não é?
170|30/05/1988|Thomas Skidmore|171|Augusto Nunes|  Aliás, professor...
171|30/05/1988|Thomas Skidmore|172|Thomas Skidmore| Pois não.
172|30/05/1988|Thomas Skidmore|173|Augusto Nunes| Desculpe interromper, eu quero aproveitar esse assunto levantado pelo Paulo Sérgio para dizer o seguinte: vários telespectadores têm muita curiosidade em saber que tipo de paralelo o senhor estabelece entre o Sarney e o Tancredo. Então, por exemplo, o Rui Santana, que é meu conterrâneo, de Taquaritinga, pergunta se, levando em conta que o Tancredo sequer tomou posse, se é legal ou legítima a situação do presidente José Sarney. O José Augusto de Vasconcelos, de Campinas, ele entende que a maior obra do governo Sarney, até agora, foi a própria consolidação do seu governo, porque ele acha que isso configura uma guinada conservadora, na medida em que provocou um desvencilhamento progressivo dos compromissos que Tancredo Neves havia assumido com setores progressistas. Ele pergunta como é que o senhor vê esse período do governo Sarney. César Brigante, de São Carlos, interior de São Paulo, ele acha que com o Tancredo no governo a transição estaria encerrada... aliás, ele pergunta ao senhor se com o Tancredo no governo a transição estaria encerrada em quatro anos e se o PMDB estaria no poder. Eu queria que o senhor juntasse a pergunta do Paulo Sérgio, que fala do PMDB, também, e essas perguntas dos telespectadores que estão curiosos quanto a uma comparação entre o Tancredo e o Sarney, que o senhor falasse desse assunto.
173|30/05/1988|Thomas Skidmore|174|André Singer| Augusto, eu poderia tomar uma carona e acrescentar só mais uma coisinha? O senhor, no seu livro, se refere ao Tancredo como um peessedista.
174|30/05/1988|Thomas Skidmore|175|Thomas Skidmore| Mas, você já leu o livro? 
175|30/05/1988|Thomas Skidmore|176|André Singer|  Eu li partes do livro. O senhor se refere ao Tancredo Neves como um peessedista de centro-esquerda.
176|30/05/1988|Thomas Skidmore|177|Thomas Skidmore|  Em 85.
177|30/05/1988|Thomas Skidmore|178|André Singer| Eu gostaria de perguntar se o senhor acha que realmente esse era o perfil dele, porque muitos o vêem como um homem de centro e até como um conservador e, também, num outro momento do seu livro, o senhor diz que o presidente Tancredo eleito era o presidente que teve maior legitimidade de todos os presidentes  eleitos. Eu lhe pergunto se isso não é um pouco contraditório com o fato de que, apesar de ele ter sido eleito com certo apoio popular, ele foi eleito por um colégio eleitoral limitado, que era determinado pela constituição militar, do regime militar . Enquanto houve na história do país alguns presidentes eleitos diretamente pelo voto. Essa atribuição de presidente com maior legitimidade de todos os presidentes eleitos no país, não seria contraditória com esse fato?
178|30/05/1988|Thomas Skidmore|179|Thomas Skidmore| É possível. É possível, mas a votação foi espantosa. Bom, o Tancredo tinha uma posição contraditória, porque o primeiro ministro da Fazenda que ele escolheu era o Dornelles , que é um homem da política bastante ortodoxa, não muita coisa de justiça social. Aconteceu que houve, durante os dois primeiros anos do governo Sarney, que o crescimento econômico foi bastante bom, cresceu bastante a economia, coisa que o governo não notou quando começou em março, de modo que houve muitas contribuições nas posições do Tancredo. Mas naquele momento, o espírito, o apoio, o alívio emocional foi uma coisa incrível! Quando ele morreu o luto foi uma coisa incrível. Em certo sentido, ele também tinha a vantagem da reação contra o outro candidato presidencial naquela época, que era o governador Paulo Maluf, uma reação tremenda contra ele. A meu ver, um pouco da reação contra o Maluf era um pouco contra as Forças Armadas, mas ele era o bode expiatório, em certo sentido. De modo que o Sarney está enfrentando as dificuldades que também o Tancredo teria encontrado, sem a menor dúvida. O problema é que o Sarney representa outra tradição, que é a do Nordeste, que é a do bastião  do eleitorado durante o governo militar.  O Tancredo tinha outras ligações, por isso que foi mais difícil para o Sarney. Mas também o Tancredo é do PMDB, e se tornou o representante do partido que era de grande oposição ao governo.
179|30/05/1988|Thomas Skidmore|180|[Sobreposição de vozes]|
180|30/05/1988|Thomas Skidmore|181|Augusto Nunes| Rodolfo Konder.
181|30/05/1988|Thomas Skidmore|182|Rodolfo Konder|" É sempre bom lembrar, professor, que, apesar de todos esses rótulos - isso é só para deixar um registro -, o Tancredo nunca esteve do lado do ""cabo do chicote"", em mais de cinqüenta anos de vida pública. Isso eu sempre gosto de recordar."
182|30/05/1988|Thomas Skidmore|183|Thomas Skidmore| Sim.
183|30/05/1988|Thomas Skidmore|184|Rodolfo Konder| Inclusive, a alguns amigos meus de esquerda que gostavam de criticar o Tancredo, eu sempre gosto de lembrar que o Tancredo nunca esteve do lado da repressão. Agora, a minha... eu queria também trazer o senhor para uma questão que nos envolve mais diretamente aqui em São Paulo. O senhor disse que todo historiador é um mau profeta, então eu gostaria de aproveitar o seu conhecimento na avaliação do passado, já que em relação ao futuro o senhor é muito cauteloso...
184|30/05/1988|Thomas Skidmore|185|[Risos gerais]|
185|30/05/1988|Thomas Skidmore|186|Rodolfo Konder| ... mesmo com essa sua irreverência.  A idéia... veja bem... O senhor falou da candidatura Jânio Quadros e esse é um problema que nos aturde a todos. Eu gostaria que o senhor relembrasse um pouco para este país, para os nossos telespectadores que vivem num país de memória curta, quem é o senhor Jânio Quadros e o episódio da renúncia. Que papel ele desempenhou no episódio da renúncia, que é uma coisa que as pessoas parecem que já se esqueceram.
186|30/05/1988|Thomas Skidmore|187|Thomas Skidmore| É... Não, eu me lembro muito bem. Eu cheguei no Brasil, a primeira vez foi em 61, dois meses depois da renúncia de Jânio. Era uma desilusão tremenda, um desalento, um repúdio aos políticos, em geral. Entre 61 e 64, muitas vezes, eu encontrei pessoas e conversávamos sobre o golpe de 64, e “o culpado”, muitas vezes o brasileiro diz: “Foi o Jânio”, porque ele renunciou ao mandato que não foi cumprido. Houve aqui falta de compreensão,  o Jânio tinha prometido explicar toda a coisa. Muitas vezes. Eu tenho em casa milhares de recortes sobre as explicações, que nunca chegaram.
187|30/05/1988|Thomas Skidmore|188|Rodolfo Konder| Era o grande mudo, como o senhor lembrou.
188|30/05/1988|Thomas Skidmore|189|Thomas Skidmore| É. O grande mudo. De modo que é um sinal, talvez, da falta de memória. Também a situação aqui era partidária, quer dizer, houve uma divisão entre os candidatos e ele se elegeu com 33%. Mas a renúncia foi um soco  no estômago do brasileiro.
189|30/05/1988|Thomas Skidmore|190|André Singer| Professor, eu gostaria de saber se o senhor concorda com a tese de que a renúncia do Jânio era a tentativa de um golpe, pelo menos de um golpe que daria poderes, ao estilo De Gaulle para fazer a Quinta República na França. Eu queria saber o que o senhor acha dessa tese que, em seu livro, o senhor passa por ela, mas não deixa muito claro qual é o seu entendimento desse episódio.
190|30/05/1988|Thomas Skidmore|191|Thomas Skidmore| Ninguém sabe. O fato é que ninguém sabe, porque ele viajou imediatamente de Brasília e não deixou contatos. Quer dizer, foi impossível, logo depois da renúncia, entrar em contato com ele, praticamente. Falava-se na época disso: que ele queria mais poderes. Decreto-lei, coisa a que ele chegou. 
191|30/05/1988|Thomas Skidmore|192|André Singer| É o precursor.
192|30/05/1988|Thomas Skidmore|193|Thomas Skidmore|  É o precursor.
193|30/05/1988|Thomas Skidmore|194|Augusto Nunes| Professor, nós vamos fazer agora um pequeno intervalo. O programa Roda Viva com o brasilianista Thomas Skidmore volta já, já.
194|30/05/1988|Thomas Skidmore|195|[intervalo]|
195|30/05/1988|Thomas Skidmore|196|Augusto Nunes| Retomamos aqui nossa conversa com o brasilianista Thomas Skidmore. Skidmore é professor de história do Brasil e história da América Latina na Universidade de Wisconsin, e autor de dois livros: Brasil: de Getúlio a Castelo, e outro que está sendo lançado agora Brasil: de Castelo a Tancredo. Professor Thomas Skidmore, a Francisca de Castro Moura, da cidade de Rio Claro, interior de São Paulo, gostaria de saber do senhor se é verdade que os Estados Unidos teriam patrocinado o golpe militar de 64. O Roberto Soares, de Pinheiros, que leu o seu livro  de Getúlio a Castelo, disse que nesse livro o senhor nega a participação dos Estados Unidos no golpe de 64. Ele pergunta se, diante das revelações contidas em arquivos americanos recentemente divulgados, o senhor manteria a sua opinião. Em seguida, a pergunta do Luciano Ornellas. Professor Skidmore .
196|30/05/1988|Thomas Skidmore|197|Thomas Skidmore| Pois não. Eu acho que... eu pus um apêndice no meu livro: “o papel dos agentes nos arquivos João Goulart ”. No primeiro livro, Brasil: de Getúlio a Castelo. Naquela época não houve a documentação do arquivo do Johnson , em Texas. O que foi revelado naquela documentação e foi publicado em livro aqui no Brasil, também, de Phyllis Parker , mostra que houve uma preocupação grande do governo americano. Além disso, houve... o governo americano tinha mandado uma frota para o Brasil de dois petroleiros, com a idéia de que, com as forças rebeldes, ia faltar petróleo para eles.
197|30/05/1988|Thomas Skidmore|198|Augusto Nunes| Iam decretar um território livre.
198|30/05/1988|Thomas Skidmore|199|Thomas Skidmore| Exatamente. Exatamente. Os Estados Unidos iriam fornecer petróleo, combustível para eles. Aconteceu que a resistência contra o golpe foi muito fraca, quase não houve. De modo que não houve necessidade de pedir aos americanos para fornecerem combustível. Nesse aspecto, não houve participação. Mas o fato é que a posição do governo americano foi claríssima. Não tenho a menor dúvida de que o papel do embaixador americano Lincoln Gordon  era o de apoiar os governadores da oposição, como, por exemplo, o governador Lacerda, que foi muito bem financiado para as obras públicas do estado de Guanabara. Além disso, houve... provavelmente houve financiamento para políticos brasileiros, que é muito comum com a CIA  Já foi feito... O Gordon, ele confessou isso nas eleições de 62. Financiamento americano. Mas eu acho que participação direta não houve. O importante é reconhecer que houve um golpe militar brasileiro  com o apoio civil. Muito importante. Quer dizer, muito bem preparado.
199|30/05/1988|Thomas Skidmore|200|Augusto Nunes| Luciano Ornellas.
