|DATA|ENTREVISTA|ORDEM|LOCUTOR|FALA
321|30/05/1988|Thomas Skidmore|322|Thomas Skidmore| Não. O problema era como começar. Na época, um professor de português, muito bom, ele me pegou e disse: “Skidmore, se você começar com o espanhol, o seu português vai ser ruim. Começando com o português, o espanhol depois vai ser razoável”. Tudo bem. Eu tinha que fazer um curso de verão em 61. A aula de espanhol era às oito  da manhã; a aula de português, às onze. A combinação da teoria com a prática, obviamente, era em português. Na época, houve poucos especialistas no Brasil. Eu fiz uma viagem ao Brasil por dois meses, gostei tremendamente, e achava um país interessante...
322|30/05/1988|Thomas Skidmore|323|Augusto Nunes|  Sobre a pergunta do Ricardo. Por favor, Pedro.
323|30/05/1988|Thomas Skidmore|324|[Sobreposição de vozes]|
324|30/05/1988|Thomas Skidmore|325|Ricardo Carvalho| Só complementando. Durante um bom tempo os brasilianistas foram muito mal vistos, até pelos intelectuais brasileiros, particularmente pela esquerda, obviamente.
325|30/05/1988|Thomas Skidmore|326|Thomas Skidmore| Sim, sim.
326|30/05/1988|Thomas Skidmore|327|Ricardo Carvalho| O senhor se sentiu, durante algum tempo  as suas pesquisas, olhado de soslaio, com desconfiança em relação ao senhor? E  se o governo norte-americano do Departamento de Estado chega a consultar brasilianistas ou especialistas em América Latina?
327|30/05/1988|Thomas Skidmore|328|Thomas Skidmore| Muito pouco. Muito pouco. Eu tinha boas relações com o embaixador  Clement  . Na época, ele é que estava aqui e tinha boas relações com os brasilianistas. Mas, em geral, o governo americano não liga muito para os que estão fora. Muito pouco. Nessa pergunta sobre a situação de pesquisa no Brasil, não. Naquela época, o brasilianista tinha uma vantagem tremenda que era financiado e também era livre, mais ou menos, para fazer o que quisesse. Se eu falasse uma gafe, iria viajar para a América do Norte. O brasileiro não, ele tem que ficar. Houve uma certa rivalidade: “Você tem dinheiro, você tem acesso, você tem tudo isso”. E eu acho isso completamente compreensível. Apesar disso, eu tinha, e tenho ainda, muitos amigos brasileiros que me ajudaram naquele tempo.
328|30/05/1988|Thomas Skidmore|329|Ricardo Carvalho| E na relação dos governos militares com as suas pesquisas, o senhor chegou a ser pressionado, houve algum fato : “Até logo, vou para os Estados Unidos”, alguma coisa?
329|30/05/1988|Thomas Skidmore|330|Thomas Skidmore| Não. Mas houve um caso: Caio Prado Junior  ficou preso em 70, e eu assinei um manifesto, um protesto contra isso, que saiu no New York Review Books. No mesmo ano, a Unicamp  tinha me convidado para dar um seminário e o visto foi negado pelo governo brasileiro, sem explicação. Eu fiquei muito bem na minha  porque os alunos da esquerda diziam: “O Skidmore é perigoso. Que coisa! Nós achávamos que ele era um liberal, não é que não tem nada, deve ser outra coisa.”. Mas no ano seguinte, em 71, me convidaram para participar de um seminário em São Paulo, o governo de confissões. Obviamente eu fui seguido por aqui, aquela coisa toda, telefonemas e...
330|30/05/1988|Thomas Skidmore|331|Ricardo Carvalho| Ah! O senhor foi seguido?
331|30/05/1988|Thomas Skidmore|332|Thomas Skidmore| Sem dúvida nenhuma.
332|30/05/1988|Thomas Skidmore|333|Fernando Mitre| Professor, a verdade é que o senhor é uma obra do Fidel Castro, porque se não houvesse a revolução.
333|30/05/1988|Thomas Skidmore|334|Thomas Skidmore| Pois é! Eu sou filho .
334|30/05/1988|Thomas Skidmore|335|[Risos]|
335|30/05/1988|Thomas Skidmore|336|Fernando Mitre| Professor, o senhor se refere, nesse último livro, quando fala da questão agrária, sobre aquela teia de relações que existe... o senhor localizou nessa questão do campo - mas eu imagino que está em toda a sociedade brasileira - aquilo que amortece os conflitos de classe, quer dizer, o patrão é padrinho do empregado etc. O senhor diz até que esse retardamento de um movimento coletivista no campo se deve em parte a isso. Aqui na cidade, nas relações de classe entre... fora o ABC  que é uma exceção no Brasil, mas o senhor não acha que esse tipo de amortecimento tende a diminuir? Ou ele vai permear ainda essas relações...
336|30/05/1988|Thomas Skidmore|337|Thomas Skidmore|  Existe ainda, mas eu acho que está atenuando nas grandes cidades. Isso é uma mudança importante. Mesmo durante o governo militar, essa mobilização da sociedade civil é importante. Não é uma coisa que vai dominar tudo, mas os CEBs , o novo sindicalismo, quer dizer, uma dinâmica que é mais autônoma.
337|30/05/1988|Thomas Skidmore|338|Fernando Mitre| Mas essa teia de relações tem ainda uma função por muito tempo?
338|30/05/1988|Thomas Skidmore|339|Thomas Skidmore| Tem. Eu acho, sem dúvida nenhuma.
339|30/05/1988|Thomas Skidmore|340|Augusto Nunes| Professor Skidmore, o Eduardo Cajias, da Chácara Santo Antonio e vários telespectadores fazem duas perguntas ao senhor: “Em quem o senhor votaria para presidente da República no Brasil, quem o senhor acha que seria um bom presidente para o Brasil? E em quem o senhor vai votar para presidente dos Estados Unidos, caso se mantenham as candidaturas do Bush  e do Michael Dukakis ?”. 
340|30/05/1988|Thomas Skidmore|341|Thomas Skidmore| Tudo bem. No caso do Brasil não sou eleitor, não tenho cartão de eleitor. Nos Estados Unidos eu sou, nos nossos termos, um professor que é liberal, que é aquela coisa aqui do centro, um pouquinho para a esquerda. Um pouquinho. Para Dukakis, obviamente. Não tenho dúvida nenhuma.
341|30/05/1988|Thomas Skidmore|342|Paulo Sérgio Pinheiro| Professor, eu li o seu livro, e Rodolfo e eu estávamos conversando sobre isso. Você mostra um traço importante dessa nossa transição que é, apesar da tortura aos presos políticos ter terminado, mas a tortura e a violência - você mostra isso muito claramente - continuam em plena transição democrática. Na semana passada mesmo, o relatório do Americas Watch mostrava que em São Paulo e no Rio de Janeiro a tortura é uma prática endêmica nos distritos policiais do Rio e de São Paulo.
342|30/05/1988|Thomas Skidmore|343|Thomas Skidmore| Sim.
343|30/05/1988|Thomas Skidmore|344|Paulo Sérgio Pinheiro| Você acha que - nessa linha que o Mitre colocava - tanta violência é necessária por quê? Para manter esses 70% de miseráveis, pobres e indigentes ou porque a classe dominante, mesmo democrática, só sabe lidar através da violência com as classes populares? Como é que você explica esse traço que você mostra?
344|30/05/1988|Thomas Skidmore|345|Thomas Skidmore| Você aqui vai até o coração, quer dizer, até a essência da sociedade, falando sobre isso.
345|30/05/1988|Thomas Skidmore|346|Fernando Mitre| E, ao mesmo tempo, existe aquele mito da não-violência. Uma contradição.
346|30/05/1988|Thomas Skidmore|347|Thomas Skidmore|" Pois é. Isso combina, isso é muito poderoso, Mitre. Primeiro, você tem em todos os países, inclusive no meu país, você tem sadistas que gostam de torturar. Aqueles que dizem: “Nós estamos ganhando muito pouco, mas, outra renda emocional é a oportunidade de bater no outro"". Isso existe. Bom, a questão é o controle sobre isso, quem vai ser contratado. Sabe que eu não sei. Essa coisa da sociedade patriarcal: “sim senhor”, “não senhor”, isso é uma coisa que não temos. Hoje, falando com o presidente, eu não consegui falar ""o senhor"" , falei você, e depois eu fiquei chateado. Não pode,  é com o presidente. Mesmo na linguagem tem todo esse sistema nas esferas."
347|30/05/1988|Thomas Skidmore|348|Fernando Mitre| O professor Roberto Da Mata , que o senhor cita no começo do livro, ele cita esse tipo de relação...
348|30/05/1988|Thomas Skidmore|349|Thomas Skidmore|  É. “Você sabe com quem está falando?”.
349|30/05/1988|Thomas Skidmore|350|Fernando Mitre| É. Exatamente.
350|30/05/1988|Thomas Skidmore|351|Thomas Skidmore| Provavelmente a violência ajuda. Porque todos nós sabemos, com a experiência do regime militar, sobre o medo que você pode impor... não reprimindo todo mundo, não é? Os torturados, quantos foram? Cinco, dez mil? E a população é de 120 milhões. O autocontrole é a coisa. Não sei se a violência é necessária para isso. Duvido. Mas o problema é democratizar a sociedade, incentivar a participação. Mas isso é muito conveniente para as classes dominantes.
351|30/05/1988|Thomas Skidmore|352|Rodolfo Konder| O senhor faz uma referência à experiência do José Carlos Dias , aqui da Secretaria da Justiça. Quais, em sua opinião, são os principais obstáculos que, no caso, levaram ao fracasso da tentativa do secretário José Carlos Dias de impor uma política mais humana ao pessoal do...
352|30/05/1988|Thomas Skidmore|353|Thomas Skidmore|  Eu não conheço de perto a história, mas me parece que, primeiro: o José Carlos Dias era um dos poucos advogados que defendeu os presos políticos. Era um homem corajoso, e muito, porque na época foi muito perigoso; segundo: tem essa citação dentro das forças de segurança que é “Nós contra todo mundo”. Qualquer advogado que chega e vai mexer: “Ah! Isso não pode. Isso é nosso campo.”. Eles ficam acima da violência. Também, na repressão, é um tipo de uma tribo, quase, primitivo. Você tem o athos de iniciar, que é matar, bater, ou qualquer coisa. Fica aqui uma fraternidade e, quando entra o outro, especialmente um político que tem um passado de liberar os presos políticos, já é uma dificuldade muito grande. Também a sociedade não gosta de pensar sobre isso. Nós  também. Temos casos tremendos sobre Attica : rebelião de prisão, o Tom Wicker  estava lá, os jornalistas, e eles não conseguiram evitar a invasão da polícia, e mataram muita gente. Por quê? Porque a pressão social foi grande. “Eles merecem ser esmagados, pois são os perdidos. Vamos!”. Essa reação, com a resistência das forças de segurança, é difícil. Houve rebelião, talvez, incentivada pelos guardas.
353|30/05/1988|Thomas Skidmore|354|Augusto Nunes| Professor, o Ismael Pfifer, do Butantã, depois de lembrar que o senhor admite que o movimento militar de 14 foi apoiado pelo governo norte-americano, pergunta se uma suposta eleição... de uma hipotética eleição do ex-governador Leonel Brizola, causaria alguma inquietação ao governo americano, hoje. O senhor acha que isso ocorreria?
354|30/05/1988|Thomas Skidmore|355|Thomas Skidmore| Ah, acho, sem a menor dúvida. Já deve ter alguns trabalhos no Departamento de Estado sobre isso. Por exemplo, o fato de o deputado Fernando Lyra  estar trabalhando, fazendo a articulação para o Brizola, é interessante, isso vai mudar um pouco o entendimento do Departamento de Estado, porque o Fernando Lyra é o ex-ministro da Justiça. Como pode?
355|30/05/1988|Thomas Skidmore|356|Fernando Mitre| Está procurando um tancredista para ser vice do Brizola.
356|30/05/1988|Thomas Skidmore|357|Thomas Skidmore| Pois é. Vai criar preocupações, sem a menor dúvida.
357|30/05/1988|Thomas Skidmore|358|Ricardo Carvalho| O senhor disse que já deve existir trabalhos no Departamento de Estado sobre isso. O que quer dizer isso? 
358|30/05/1988|Thomas Skidmore|359|Thomas Skidmore| Estou especulando.
359|30/05/1988|Thomas Skidmore|360|Ricardo Carvalho| Um tipo de estudo sobre isso?
360|30/05/1988|Thomas Skidmore|361|Thomas Skidmore| Claro.
361|30/05/1988|Thomas Skidmore|362|Ricardo Carvalho| E eles correspondem à realidade?
362|30/05/1988|Thomas Skidmore|363|Thomas Skidmore| Não sei. Não li. 
363|30/05/1988|Thomas Skidmore|364|Ricardo Noblat|  Por que essa preocupação com o Brizola, o que ele representa, visto de lá?
364|30/05/1988|Thomas Skidmore|365|Thomas Skidmore|" A preocupação é aqui no Brasil, porque a preocupação é da imprensa com o Brizola, ou das classes dominantes com o Brizola. É a mesma coisa. É o ""homem"" que parece que é um líder. O único que é carismático, que tem a capacidade, no momento, de realmente de falar. Eu estive aqui no ano passado, participei aqui do Roda Viva com o Leonel Brizola, e foi impressionante a capacidade de se comunicar que ele tem. Em termos comparativos é impressionante."
365|30/05/1988|Thomas Skidmore|366|Paulo Sérgio Pinheiro| Mas  todo o período que ele passou lá no Hotel Roosvelt, ele pareceu tão bonzinho, era uma pessoa tão simpática. Ele não virou social-democrata?
366|30/05/1988|Thomas Skidmore|367|Thomas Skidmore| Eu acho que essa é a posição dele.
367|30/05/1988|Thomas Skidmore|368|Paulo Sérgio Pinheiro| Mas isso ainda inquieta? Um social-democrata brasileiro ainda inquietará o Departamento de Estado, hoje, da administração de hoje?
368|30/05/1988|Thomas Skidmore|369|Thomas Skidmore| Mas tem aqui também o passado, a ficha dele.
369|30/05/1988|Thomas Skidmore|370|Paulo Sérgio Pinheiro| E o passado condena?
370|30/05/1988|Thomas Skidmore|371|Thomas Skidmore| Não, não. Eu estou explicando. Não sou um membro do Departamento de Estado.  Não escrevi nada sobre isso, mas eu estou tentando explicar. 
371|30/05/1988|Thomas Skidmore|372|Paulo Sérgio Pinheiro| Você acha que o passado dele o condena?
372|30/05/1988|Thomas Skidmore|373|Thomas Skidmore| Não, condenar não, mas porque ele era...
373|30/05/1988|Thomas Skidmore|374|Paulo Sérgio Pinheiro|  Na perspectiva do governo americano?
374|30/05/1988|Thomas Skidmore|375|Thomas Skidmore| Vai provocar preocupações, sem dúvida nenhuma. E também ele era um nacionalista. Isso já... O que ele vai nacionalizar? No Rio Grande do Sul ele nacionalizou o Bond & Share .
375|30/05/1988|Thomas Skidmore|376|Thomas Skidmore| Pois é.
376|30/05/1988|Thomas Skidmore|377|Ricardo Carvalho| Que políticos brasileiros na presidência da República não preocupariam o Departamento de Estado?
377|30/05/1988|Thomas Skidmore|378|Augusto Nunes| Que políticos espalhariam a tranqüilidade?
378|30/05/1988|Thomas Skidmore|379|[Risos]|
379|30/05/1988|Thomas Skidmore|380|Ricardo Carvalho| A boa vizinhança...
380|30/05/1988|Thomas Skidmore|381|Thomas Skidmore| Eu acho que outros são considerados melhores. Aqui no Brasil todo mundo fala sobre isso. O que são...
381|30/05/1988|Thomas Skidmore|382|Ricardo Carvalho|  Mário Covas...
382|30/05/1988|Thomas Skidmore|383|Thomas Skidmore| Não, quer dizer, ninguém... A impressão que você tem aqui com a imprensa é que não tem candidato forte.
383|30/05/1988|Thomas Skidmore|384|[Sobreposição de vozes]|
384|30/05/1988|Thomas Skidmore|385|Fernando Mitre| O partido que está nascendo dentro do PMDB, que perspectiva que o senhor vê para ele?
385|30/05/1988|Thomas Skidmore|386|Thomas Skidmore| Que não tem nome ainda?
386|30/05/1988|Thomas Skidmore|387|Fernando Mitre| É, que não tem nome ainda, mas tem: o José Richa, Mario Covas, Fernando Henrique, Montoro, Euclides Scalco e tantos outros. São nomes nacionais. Seria um Partido Social Democrata. Essa linha do social-democrata, do...
387|30/05/1988|Thomas Skidmore|388|Thomas Skidmore|  A meu ver, você tem um aspecto ideológico. Eles estão pensando em criar um partido com mais coerência saindo da maior máquina partidária do Brasil, que é a máquina do PMDB aqui em São Paulo. Dividindo São Paulo? É difícil; é muito difícil. Quer dizer, se houver a candidatura do Quércia, a dissidência vai ficar aqui fora. É difícil. Provavelmente precise  fazer isso, já se falava há muito tempo. Você se lembra sobre a divisão do PMDB: uma ala da esquerda, uma ala da... O Partido Popular em certo sentido foi a tentativa de... Quer dizer, o Brasil não tem partidos que são coerentes agora , e precisa. Mas, pensando na eleição presidencial, ...
388|30/05/1988|Thomas Skidmore|389|Augusto Nunes| Luciano Ornellas, professor.
389|30/05/1988|Thomas Skidmore|390|Luciano Ornellas| O senhor já foi assessorado no Brasil em 84, se eu não me engano, disseram que o senhor não podia falar sobre os nossos problemas políticos por causa da lei dos estrangeiros. Como é que o senhor vê essa sua experiência fantástica? 
390|30/05/1988|Thomas Skidmore|391|Thomas Skidmore| Assim, não tem problema . Meu problema é que, naquela época, eu falei uma coisa na televisão, e é mais perigosa a televisão. Porque falando com jornalista aqui, se ele publicar alguma coisa, eu posso dizer: “eu não disse isso.”.
391|30/05/1988|Thomas Skidmore|392|[Risos]|
392|30/05/1988|Thomas Skidmore|393|Augusto Nunes| Aqui está gravado. Mas a culpa é da imprensa, né? 
393|30/05/1988|Thomas Skidmore|394|Thomas Skidmore|  “Aquele lá é um alucinado, não entendeu meu português mal mastigado.”.  Na televisão não pode, porque está na fita.
394|30/05/1988|Thomas Skidmore|395|Augusto Nunes| Professor, para que o senhor não deixe nenhuma resposta incompleta, o Antonio Carlos, de Campinas, ele pede mais explicações sobre dois assuntos: primeiro, ele quer saber por que o senhor diz... mais exatamente, por que o senhor qualifica o Tancredo Neves como uma ponte entre os dois governos; depois, ele pergunta com que objetivos a CIA enviou ou envia dinheiro para os políticos brasileiros.
395|30/05/1988|Thomas Skidmore|396|Thomas Skidmore| No caso do Tancredo, ponte no sentido de que houve o partido da oposição, o grande PMDB, e também os elementos de dentro, quer dizer: os militares, o pessoal, também, do PDS. Ele tinha a capacidade de dialogar com todo mundo. Era a forma dele. Foi isso, esse aspecto, né? Segundo, sobre a CIA...
396|30/05/1988|Thomas Skidmore|397|Augusto Nunes|  Com quais objetivos a CIA enviou e envia dinheiro aos políticos brasileiros?
397|30/05/1988|Thomas Skidmore|398|Paulo Sérgio Pinheiro|  Augusto, eu poderia pegar uma caroninha nessa sua pergunta...
398|30/05/1988|Thomas Skidmore|399|Augusto Nunes| Última pergunta do programa, então.
399|30/05/1988|Thomas Skidmore|400|Paulo Sérgio Pinheiro| Nessa sua rica metáfora, se o presidente Tancredo era uma ponte, o presidente Sarney seria o quê? O fosso?
400|30/05/1988|Thomas Skidmore|401|[Risos]|
401|30/05/1988|Thomas Skidmore|402|Thomas Skidmore| Não sei. 
402|30/05/1988|Thomas Skidmore|403|Paulo Sérgio Pinheiro| Um buraco negro.
403|30/05/1988|Thomas Skidmore|404|Thomas Skidmore| Não sei. Essa é especulação minha. Quer dizer, agora você tem...
404|30/05/1988|Thomas Skidmore|405|Augusto Nunes|  Não, especulação não. Com certeza enviou-se dinheiro. Comprovadamente. Com quais objetivos?
405|30/05/1988|Thomas Skidmore|406|Thomas Skidmore| Às vezes, estão pagando por informações. Por exemplo, o general Noriega , no Panamá, era pago pela CIA. Provavelmente, para dar informações e também para ficar ao lado dos Estados Unidos. Por isso que tem problemas tão grandes agora.  Ele está criando problemas.
406|30/05/1988|Thomas Skidmore|407|Ricardo Noblat| O Noriega não foi correto, não foi honesto?
407|30/05/1988|Thomas Skidmore|408|Thomas Skidmore| Não foi correto. O corrupto tem que...
408|30/05/1988|Thomas Skidmore|409|Ricardo Noblat| Tem que ser correto nessas coisas.
409|30/05/1988|Thomas Skidmore|410|Thomas Skidmore| Ser correto e bem comportado.
410|30/05/1988|Thomas Skidmore|411|Pedro Del Pecchia| O senhor falou em político, depois o senhor falou em general.
411|30/05/1988|Thomas Skidmore|412|Augusto Nunes| Pedro, então, você faça a última pergunta.
412|30/05/1988|Thomas Skidmore|413|Pedro Del Pecchia| No Brasil, o senhor tem notícias de algum general que tenha recebido algum dinheiro da CIA?
413|30/05/1988|Thomas Skidmore|414|Thomas Skidmore| Não. Graças a Deus.  Senão, eu teria que viajar imediatamente.
414|30/05/1988|Thomas Skidmore|415|Augusto Nunes| Professor, nós agradecemos a sua presença aqui no programa Roda Viva, a paciência e a clareza com que o senhor respondeu às nossas perguntas durante uma hora e meia.
415|30/05/1988|Thomas Skidmore|416|Thomas Skidmore|  Eu também quero...
416|30/05/1988|Thomas Skidmore|417|Augusto Nunes| Principalmente as perguntas relacionadas com o passado.
417|30/05/1988|Thomas Skidmore|418|Thomas Skidmore| Pois é. Eu quero também agradecer a paciência dos telespectadores que mais uma vez escutaram um brasilianista falando tanto sobre o Brasil.
418|30/05/1988|Thomas Skidmore|419|Augusto Nunes| Muito obrigado . Muito obrigado aos entrevistadores que colaboraram na entrevista com o professor Thomas Skidmore, que é autor de Brasil: de Getúlio a Castelo, e Brasil: de Castelo a Tancredo, livro que está sendo lançado nestes dias no Rio de Janeiro e em São Paulo. Agradecemos, também, aos telespectadores que nos telefonaram, encaminhando perguntas ao professor Skidmore, e também à presença dos convidados da produção. O Programa Roda Viva volta na próxima segunda-feira, às 9h25min. Boa noite.
419|30/05/1988|Thomas Skidmore|420|[Thomas Skidmore voltou ao Roda Viva nos anos de 1992, 1997 e 2005]|
