DATA,ENTREVISTA,ORDEM,LOCUTOR,FALA
04/04/2005,Tom Zé,1,Paulo Markun,"Boa noite! Ele se decidiu pela carreira musical depois de descobrir que não conseguia fazer música bonita para a namorada e, também, de abandonar a carreira de repórter. Um dos fundadores da Tropicália, certamente o mais irônico, irreverente e provocador, ele faz uma música nem sempre fácil de ouvir, mas é um dos mais criativos, originais e surpreendentes músicos do Brasil - que se tornou, também, referência da cultura brasileira no exterior. No centro do Roda Viva, esta noite, o compositor e cantor baiano Tom Zé, que, aos 68 - e 45 de carreira -, está estudando o pagode e reconquistando jovens."
04/04/2005,Tom Zé,2,[...],
04/04/2005,Tom Zé,3,Valéria Grillo,"Antônio José Santana Martins chegou a São Paulo na fervura cultural dos anos 60. Tinha saído de Irará, no sertão da Bahia, onde nasceu, e, mais tarde, trabalhou na loja de tecidos do pai. Vinha de Salvador, da Faculdade de Música da Universidade Federal da Bahia, onde teve uma formação musical erudita que extrapolava a baianidade. Talvez por isso fosse o mais cosmopolita do grupo baiano encabeçado por Gil e Caetano, além de ser o mais velho deles. Sua primeira música, primeiro lugar no Festival da Record de 1968, foi uma declaração de amor à cidade que ele adotou logo que chegou."
04/04/2005,Tom Zé,4,Tom Zé,"“São São Paulo meu amor / são oito milhões de habitantes / De todo o canto e nação / Que se agridem cortesmente / Correndo a todo vapor / Porém, com todo o defeito / Te carrego no meu peito.”"
04/04/2005,Tom Zé,5,Valéria Grillo,"Com São Paulo no peito e pouco dinheiro no bolso, foi morar na pensão do seu Freitas, na rua Conselheiro Botero, 1057, entre a Barra Funda e Santa Cecília. Um quartinho do fundo, o mais barato, com uma janela que só tinha vista para um telhado sem graça, acanhadinho, né, Tom Zé?"
04/04/2005,Tom Zé,6,Tom Zé,"Era uma paisagem acanhada, mas eu fazia de conta que era um telhado bonito."
04/04/2005,Tom Zé,7,Valéria Grillo,"Bonito, mesmo, ficou o jardim do prédio onde foi morar depois, durante trinta anos, no bairro de Perdizes. Ele mesmo cuidava da grama e das plantas, de comum acordo com o condomínio: uma terapia e um pouco de volta às origens de Irará, onde a vida sempre foi ligada à terra. Mesmo depois de se mudar para um prédio vizinho, Tom Zé continuou a cuidar do jardim, jardim alheio, gastando do bolso mais do que o salário mínimo que recebia do síndico para manter as plantas e comprar novas mudas. A atividade de jardineiro e as apresentações em universidades ajudaram Tom Zé a enfrentar os 15 anos de ostracismo que viveu entre 1973 e 1988. Na fase inicial da carreira, chegou a produzir quatro discos. Com alguns trabalhos mal recebidos pelo público e pela crítica, perdeu espaço no mercado e acabou esquecido pela Tropicália. Chegou a pensar em voltar a Irará e trabalhar com um primo em um posto de gasolina. Mas foi descoberto pelo astro do rock David Byrne, do Talking Heads. Em 1986, em uma viagem ao Rio de Janeiro, o roqueiro Byrne comprou um pacote de discos de samba em uma liquidação e entre eles, acidentalmente, tinha um do Tom Zé. A sorte bateu na porta. Chamado a Nova Iorque, o esquecido tropicalista acabou mostrando nos Estados Unidos a música inventiva e irrequieta que seduziu o líder do Talking Heads. Relançou discos, agradou crítica e público, fez turnês que se estenderam, depois, à Inglaterra e à França. Pode-se dizer: um sucesso internacional, uma nova referência da cultura brasileira no exterior. E, assim, o Brasil redescobriu Tom Zé, que retomou carreira e fez crescer a sua discografia. Um infarto após um festival de rock em Olinda, em 2002, quase atrapalhou, mas uma angioplastia refez o estrago no coração. Só as dores da alma permaneceram e continuam se manifestando na poesia aguda e no jogo de palavras em canções criadas para provocar, denunciar e protestar."
04/04/2005,Tom Zé,8,Tom Zé,"“Se você já sabe / Quem vendeu / Aquela bomba para o Iraque, / Desembuche: / Eu desconfio que foi o Bush.”"
04/04/2005,Tom Zé,9,Valéria Grillo,"Agora, ele protesta contra a segregação da mulher."
04/04/2005,Tom Zé,10,Tom Zé,"“Dizia meu avô: mulher assim é o diabo, é o demônio, é um pecado!”"
04/04/2005,Tom Zé,11,Valéria Grillo,"O novo CD é uma investigação sobre o pagode, com enredo feminino e supervisão de dois jovens para evitar que ele complicasse demais as músicas."
04/04/2005,Tom Zé,12,Tom Zé,"Tanto o Pedro quanto a Fernanda são meus amigos e vizinhos. Eu instituí com eles a combinação deles me proibirem de fazer a música difícil, para eu não ficar muito fazendo a elucubração."
04/04/2005,Tom Zé,13,Valéria Grillo,Tom Zé define o CD como uma opereta dramática que traz uma crítica ao homem e que reverencia e defende a mulher da velha opressão criada pela dominação masculina.
04/04/2005,Tom Zé,14,Tom Zé,"“O macho pela vida, se válida a molestar a mulher, se diverte, apavorada ela, que se pela, pouco pára de pé e padece...”"
04/04/2005,Tom Zé,15,[...],
04/04/2005,Tom Zé,16,Paulo Markun,"Para entrevistar Tom Zé, nós convidamos: Flávia Guerra, repórter do “Caderno Dois” do jornal O Estado de S. Paulo; Júlio Medaglia, maestro e responsável pelo programa Temas e variações da Rádio Cultura FM; Maria Amélia Rocha Lopes, jornalista e crítica de música; Tárik de Souza, crítico de música do Jornal do Brasil; Carlos Calado, jornalista, crítico de música e colaborador dos jornais Folha de S. Paulo e Valor Econômico; e Patrícia Palumbo, jornalista e apresentadora do programa Vozes do Brasil na Rádio Eldorado de São Paulo. O programa está também sendo acompanhado por vários convidados aqui em nossa platéia. Como você sabe, o Roda Viva é transmitido em rede nacional de tevê para todo o Brasil. Para participar, você pode fazer perguntas, críticas e sugestões pelo (011) 3252-6525, repetindo, (011) 3252-6525, ou pelo fax 3874-3454, ou ainda pelo endereço eletrônico do programa, que é rodaviva@tvcultura.com.br. Tom Zé, você bagunçou o coreto, aí! Virou uma salada, zoneou todo o cenário do nosso Aguilar, tudo que estava arrumadinho, fez um salseiro! O que é isso?"
04/04/2005,Tom Zé,17,Tom Zé,"Essa idéia toda é o trabalho do... a Trama tem um departamento de moda que a Malu, a Emanuela Carvalho, dirige e ela fez essa roupa linda de esmoler para mim, que é a situação em que o homem está hoje diante da mulher, não é?"
04/04/2005,Tom Zé,18,Paulo Markun,"Bom, mas se o homem está assim, a mulher está como?"
04/04/2005,Tom Zé,19,Tom Zé,"A mulher, no nosso show, está como a Suzana está hoje aqui: está bem vestida. O homem é que está na desgraça."
04/04/2005,Tom Zé,20,Paulo Markun,"Isso, você acha que - pulando um pouco da piada para a seriedade -, você acha que é fato? A situação da mulher é essa? O que a gente vê nas estatísticas e na realidade é o contrário: a mulher ganha menos, é discriminada, é segregada. Você acha que, ainda assim, o esmoler é o homem?"
04/04/2005,Tom Zé,21,Tom Zé,"O mundo está cheio desses segredos e dessas inversões. Na verdade, se trata do seguinte: a gente pensa que a gente tem o dinheiro, a gente pensa que a gente tem o poder; a gente conquista ou pela beleza, pelo charme, ou pela conta bancária, ou pelo casamento; conquista, ela vai lá, tira a roupa para você na cama, abre as pernas para você na cama. Mas aí vem onde está o mais importante: não abre o coração, porque ela não tem mais confiança. Depois de maltratada durante séculos e séculos, ela não tem mais confiança nesse inimigo em potencial. E, quando a mulher não abre o coração, tudo o mais é solidão, é uma tristeza mortal, é um desamparo em que o homem fica que é muito pior do que o que estou vestindo. O que eu estou vestindo é um símbolo bobo da tragédia da criatura masculina. Tanto, que é por isso que eu digo: este disco não é feminista, mulher não precisa de diabo de favor nenhum. Mulher já tem Dia das Mães, Dia da Sogra, Dia da Tia, Dia da Avó, Dia da Namorada, dia de não sei o quê; mulher já tem tudo, ela está cansada... E tudo isso é só para passar a mão na cabeça para no outro dia mandar a mão no rabo e “toma-lhe aí, filha da mãe, que tu não vale nada” e tal, que é o não-verbal das classes sociais mais finas e menos finas. Está sempre a mulher sendo agredida, violenta ou levemente. Ela pode levar para a Delegacia da Mulher ou não, mas ela só está tomando bucha."
04/04/2005,Tom Zé,22,Paulo Markun,"E o pagode não é a principal maneira de aplicar a bucha na mulher no que toca na música? O pagode, o ritmo do pagode...?"
04/04/2005,Tom Zé,23,Tom Zé,"E o pagode... Sim, correto, muito bem, perfeitamente! O pagode é, ao mesmo tempo, uma criatura tão segregada atualmente quanto a mulher. É claro que eu falo não é do gênero, que é realmente uma coisa, uma diluição trágica e tal, mas o que eu falo é que nós somos um povo... que nós temos que nos convencer de que nós temos 10% de ricos e 90% de pobres. E as últimas classes de pobres recebem de informação o menos possível, inclusive com uma cultura de massa desgraçada. E o que esse pessoal pode produzir? Bom, isso é a metade da pergunta; a outra, desculpe...?"
04/04/2005,Tom Zé,24,Paulo Markun,"Sim, se esse ritmo, que tem toda essa coisa da subalternidade, não acaba fazendo a apologia da mulher submissa."
04/04/2005,Tom Zé,25,Tom Zé,"E o pagode realmente é grosseirissímo com a mulher: “chega a bundinha para cá, chega a bundinha para lá”... Outro dia, quando o É o Tchan estava lançando o segundo disco - no tempo em que eles estavam vendendo o diabo; agora, eles estão, também, em uma fossazinha danada -, ligou uma moça toda cheia de briefs, de uma porção de palavras americanas - “Deus te abençoe, minha filha, muito obrigada por me chamar” -, me disse que a campanha tinha dinheiro para tirar o pagode da classe econômica e botar na classe executiva e queria que eu escrevesse. Eu, como não tenho, teoricamente, preconceito nem nada, pedi para ela mandar o disco. Quando eu vi, eu não consegui escrever. O disco é bem feito profissionalmente e tal, mas eu fiquei com vergonha daquele negócio de “chega a bundinha pra cá, chega a bundinha para lá”... Realmente, isso, eu não pude escrever. Então, Markun, finamente, resumindo: o pagode segrega a mulher e é segregado tanto quanto a mulher. Por isso que eu botei os dois no mesmo saco."
04/04/2005,Tom Zé,26,Patrícia Palumbo,"Mas a classe alta tem pesquisa, inclusive, dizendo isso, não é? Que as classes A e B consomem pagode muitíssimo. Eles compram isso que é uma barbaridade."
04/04/2005,Tom Zé,27,Tom Zé,"Eu moro em um prédio de classe média, mas do lado do meu prédio é classe... O Raí morou lá quando estava jogando aqui no São Paulo - você imagine a distinção. Embaixo, tem piscina de todo o tamanho, tanto que eu costumo dizer que o meu prédio é cheio de piscina - porque em São Paulo piscina é só para olhar, não é? Ninguém entra. E eu olho piscina todo o dia, piscina para todo o lado. E uma churrasqueira, uma churrasqueira. E eles, como são uns prédios enormes, fazem festas, quase todo o mês tem uma festa. E eu, morando lá há quatro anos, conforme disse ali no negócio do jardim, no preâmbulo do programa... Primeira festa: pagode; eu digo: “Nossa Senhora, esses ricos ai só tocam...” Segunda festa: pagode; eu falei: “Não pára mais...!” Terceira festa: pagode; quarta festa: um cantor de pagode; e eu digo: “Ainda chamam até os cantores!” Mas é, rico só consome pagode! E eu não sabia disso, Júlio! Os ricos só estão no pagode! E então, como eu dormia todo dia lá ninado pelo pagode, eu acabei tendo a idéia de juntar uma coisa com a outra."
04/04/2005,Tom Zé,28,Tárik de Souza,"Tom Zé, você, que pegou aquela fase áurea da música brasileira sendo exposta na televisão, você não acha que hoje está havendo uma analfabetização do país?"
04/04/2005,Tom Zé,29,Tom Zé,"É, a televisão, hoje, é uma..."
04/04/2005,Tom Zé,30,Tárik de Souza,Você tinha a chance de aparecer e ganhar um festival. Hoje em dia...
04/04/2005,Tom Zé,31,Tom Zé,"Hoje, ela é uma transmissora privilegiada da filosofia do apocalipse que Hollywood inventou. A coisa mais principal que a televisão transmite é crime e Hollywood. A coisa mais principal que a televisão ensina é crime e Hollywood."
04/04/2005,Tom Zé,32,Maria Amélia Rocha Lopes,"Tom Zé, deixa eu te perguntar: voltando um pouquinho à questão do pagode, outro dia eu li no “Painel do Leitor” da Folha de S. Paulo uma socióloga comentando sobre as suas opiniões sobre o pagode. Aí, eu até notei que ela dizia o seguinte: “A arte engajada sabe ser desagradável, enfadonha e pedante na maioria das vezes.” Sobre a sua opinião falando do pagode. Aí, ela diz o seguinte: “O povão vai continuar ouvindo Belo e Leci Brandão porque eles têm a linguagem do diálogo popular.” E que você teria dor-de-cotovelo. Aí, eu queria que você falasse sobre isso."
04/04/2005,Tom Zé,33,Júlio Medaglia,Quem foi essa idiota que falou?
04/04/2005,Tom Zé,34,Maria Amélia Rocha Lopes,Uma socióloga de Belo Horizonte.
04/04/2005,Tom Zé,35,Júlio Medaglia,"Ah, sim...!"
04/04/2005,Tom Zé,36,Tom Zé,"Com a licença do Júlio - está vendo como eu já ia lhe dessalvar, para você? - Com a licença..."
04/04/2005,Tom Zé,37,Júlio Medaglia,"Ela já foi internada, essa moça? Mandar ela para a universidade ou para algum curso..."
04/04/2005,Tom Zé,38,Maria Amélia Rocha Lopes,"É uma opinião, acho que é uma ótima oportunidade para a gente comentar."
04/04/2005,Tom Zé,39,Júlio Medaglia,"Ela também disse que Chico Buarque é um péssimo compositor, inclusive isso."
04/04/2005,Tom Zé,40,Tom Zé,É...
04/04/2005,Tom Zé,41,Flávia Guerra,"Mas Tom Zé até já se desculpou recentemente no UOL, que eu li, que você não quis ofender Belo e pagodeiros afins, não foi isso?"
04/04/2005,Tom Zé,42,Tom Zé,"É; inclusive eu... Por isso que eu vou dizer, com a licença do Júlio, eu aproveito o que disse dona Marilza Siléia de Almeida Jota, socióloga de Belo Horizonte: foi um engano meu, eu realmente disse essas palavras para o Calado. Só que o Calado botou logo no destaque e ele me perguntou sobre o Pagodinho."
04/04/2005,Tom Zé,43,Carlos Calado,O Zeca Pagodinho.
04/04/2005,Tom Zé,44,Tom Zé,"O Pagodinho é amigo do Elifas, que é meu capeiro de discos - o Elifas Andreato - e eu já conhecia alguma coisa do Pagodinho, que está mais ligado com os originais do pagode - todo mundo sabe que aquele nasceu dentro das escolas; depois dessa diluição desgraçada, é outra coisa. Enfim - depois, Júlio, eu sei que você tem muita coisa para falar sobre isso e eu mesmo quero ouvir -, mas eu queria pedir desculpas a Belo, eu ia pedir desculpas a, como é que chama o Rodrigues?"
04/04/2005,Tom Zé,45,Júlio Medaglia,Netinho?
04/04/2005,Tom Zé,46,Tom Zé,"Netinho, ao... Me ajudem, não tenho vergonha de não saber nome não, porque isso não é pecado."
04/04/2005,Tom Zé,47,[...],Alexandre Pires.
04/04/2005,Tom Zé,48,Tom Zé,"Alexandre Pires, eu queria pedir desculpas, eu estou pedindo desculpas, Alexandre - aonde é a câmera? Alexandre - arranja uma câmera aí - Alexandre, eu estou pedindo desculpa viu? A você, a Belo, a todo mundo, porque vocês... Não era eu aqui que iria ser metido a besta - porque eu sou uma boa de uma porcaria - para ir massacrar vocês, que já são massacrados por essa chamada democracia que bota a metade da população lá no Inferno e um milésimo lá no Paraíso; não era eu, que não sou autoridade para nada, nunca falei mal de ninguém."
04/04/2005,Tom Zé,49,Carlos Calado,"Tom Zé, desculpe, mas eu estou achando que, como você acabou de falar, você acabou de fazer, então, mais uma “inversão misteriosa”. Eu só queria te lembrar uma coisa: você está falando do pagode segregado; eu queria te lembrar que, pelo menos, durante os anos 90 inteiros, o pagode foi hegemônico, ele tomou conta das rádios. Todas essas pessoas a quem você pediu desculpas passaram uma década fazendo sambas pífios, encheram o bolso de dinheiro. Então, sinceramente, eu fico surpreso de ver você pedindo desculpas a eles. Eles é que têm que pedir desculpas a você, Tom Zé."
04/04/2005,Tom Zé,50,Tom Zé,"É, bom, como é que eu digo, o que eu faço..."
04/04/2005,Tom Zé,51,Júlio Medaglia,"Aliás, todo esse pagode junto não vale uma pausa de uma música do Cartola. Então... Mas, às vezes, a Polícia Federal tem as suas vantagens, eles não prendem..."
04/04/2005,Tom Zé,52,Paulo Markun,"Eu só fico... Tom Zé... Virou, virou! Eu fico pensando o seguinte: em duas ocasiões anteriores, você, de alguma forma, abordou outros gêneros musicais. Na música “Sabor de burrice” você fez uma espécie de desabafo à música caipira, não é isso?"
04/04/2005,Tom Zé,53,Tom Zé,Isso.
04/04/2005,Tom Zé,54,Paulo Markun,"E, em “O dia em que a bossa nova pariu o Brasil”, você transforma aquela música - que é do disco Vaia de bêbado não vale -, você transforma a bossa nova em uma espécie de parideira do Brasil, não é isso?"
04/04/2005,Tom Zé,55,Tom Zé,Sim.
04/04/2005,Tom Zé,56,Paulo Markun,"E, agora, você pega o pagode e, a gente ouvindo o seu último disco, a sensação que dá é que, ao mesmo tempo em que você faz uma crítica ao pagode, você o valoriza."
04/04/2005,Tom Zé,57,Tom Zé,"Não, veja bem."
04/04/2005,Tom Zé,58,Paulo Markun,Não é jogar nos dois campos ao mesmo tempo?
04/04/2005,Tom Zé,59,Tom Zé,"Veja bem, o Calado tem razão, o que o Júlio está dizendo tem razão; a posição em que eu tenho que me colocar, ela realmente é difícil: eu estou caminhado ali no fio da navalha entre o ridículo e o corajoso, não resta a menor dúvida. Eu estou dizendo que é claro, quando aparece a oportunidade de explorar, quando aparece a ocasião, todo mundo vira ladrão, é muito difícil uma pessoa ser budista. Se a gente não espera... De budismo, nenhum de nós, nenhum de nós... Qual foi o dia em que já me ofereceram um milhão de cruzeiros para eu trair minhas idéias? Nem eu sei se sou, conforme as pessoas gostam de dizer que eu sou, mas eles dizem sempre aquela palavra de que eu me esqueço, como é...?"
04/04/2005,Tom Zé,60,Maria Amélia Rocha Lopes,Íntegro.
04/04/2005,Tom Zé,61,Paulo Markun,Ético.
04/04/2005,Tom Zé,62,Tom Zé,É uma palavra que quer dizer que continuadamente eu ajo direito.
04/04/2005,Tom Zé,63,Patrícia Palumbo,Reto.
04/04/2005,Tom Zé,64,Júlio Medaglia,Perseverante.
04/04/2005,Tom Zé,65,Tom Zé,"Isso, certo."
04/04/2005,Tom Zé,66,Carlos Calado,O mais tropicalista dos tropicalistas e por aí afora.
04/04/2005,Tom Zé,67,Tom Zé,"É. Imagina, quem vive em um país em que a política é dessa maneira, quem vê, no maior país capitalista do mundo, o presidente fazer coisas que são só do interesse dele para a família dele ganhar dinheiro, vai exigir que uma pessoa seja um budista que só opta por um caminho? Qual é a coisa do primeiro budismo, filha? A primeira, como é? A profissão..."
04/04/2005,Tom Zé,68,Neuza Martins,O reto pensamento.
04/04/2005,Tom Zé,69,Tom Zé,"Fale alto, por favor."
04/04/2005,Tom Zé,70,Neuza Martins,O reto pensamento.
04/04/2005,Tom Zé,71,Tom Zé,O reto pensamento. E a segunda?
04/04/2005,Tom Zé,72,Neuza Martins,A reta concepção.
04/04/2005,Tom Zé,73,Tom Zé,"A reta concepção, o reto meio de ganhar a vida; quem é que vai esperar que pessoas tão... Bom, eu preciso ouvir também, um pouco. Julio, pode meter fogo."
04/04/2005,Tom Zé,74,Carlos Calado,Tom Zé. Eu só queria...
04/04/2005,Tom Zé,75,Tom Zé,Você se lembra de quando o menino dirigia o programa Quem tem medo da verdade?
04/04/2005,Tom Zé,76,Júlio Medaglia,"É, disso eu lembro..."
04/04/2005,Tom Zé,77,Tom Zé,"Pode meter fogo, não tenha pena de mim."
04/04/2005,Tom Zé,78,Carlos Calado,"Eu só queria dar um exemplo aqui, que pode isso claro. Tom Zé, tem uma música no seu disco que você... ela é chamada - na verdade, é um pagode que você chama de “pagodenúncia” -, se chama “Mulher navio negreiro”. Acho que é uma das músicas até mais, vamos dizer, fortes do disco. Tem os seguintes versos, se referindo à mulher, à exploração da mulher: “Filé mignon - púbis, traseiro - alcatra / Banca de revista - Açougue informal”. Você acha que Belo e Netinho gravariam esse pagode, Tom Zé?"
04/04/2005,Tom Zé,79,Tom Zé,"Mas é claro que não! E é claro que você tem razão também, quando você diz: “Ah, esse daí nunca será um pagodeiro!” Quando eu fiz o Estudando samba, também era gozado: eu nunca virei um sambista e nem tive a honra de ser chamado assim. Um disco que ganhou até como melhor disco da década, bababá, bababá, todo esse blá, blá, blá..."
04/04/2005,Tom Zé,80,Maria Amélia Rocha Lopes,"Ô Tom Zé, Estudando samba, o David Byrne descobriu e sua vida virou do avesso..."
04/04/2005,Tom Zé,81,Tom Zé,Isso.
04/04/2005,Tom Zé,82,Maria Amélia Rocha Lopes,O que você espera que aconteça agora com o Estudando o pagode?
04/04/2005,Tom Zé,83,Tom Zé,"Olhe, está acontecendo uma coisa formidável: nós estamos aqui tratando dele!"
04/04/2005,Tom Zé,84,Paulo Markun,Está virando do direito.
04/04/2005,Tom Zé,85,Tárik de Souza,"Tom Zé, você está muito ligado ao samba. Quer dizer, aquela música “Se o caso é chorar” foi um sucesso seu; Estudando samba foi o disco que te colocou para a frente - embora você dissesse que não é samba, ele é samba; inclusive, tem parceria com Elton Medeiros, que é um sambista acima de qualquer dúvida. E, agora, você fez o disco do pagode. Qual é essa sua ligação com o samba? Você ter nascido em Irará, na Bahia... Você ouvia muito samba? Por que você faz tanta coisa ligada ao samba?"
04/04/2005,Tom Zé,86,Tom Zé,"Para não tentar fazer teoria, porque é difícil, deixa eu descomplicar. Rogério Duprat, em 1974, virou e me disse o seguinte: “Tom Zé, você está vendo como o samba está horroroso? Todo mundo só faz porcaria! Mas, rapaz, se a gente pensar só na estrutura do funcionamento daquela cozinha, ela é tão sofisticada!” E isso ficou martelando na minha cabeça. E por isso que eu tentei fazer uma coisa... Eu não tenho muito a ver com aquilo e, ao mesmo tempo, tenho muito a ver com o samba. Eu não tenho muito a ver com nada porque eu sou ruim! É preciso entender isso. Se eu fosse bom - aí entra o negócio, Júlio, eu não posso me gabar de nada, porque, se eu fosse bom, quem sabe se eu não estaria fazendo boa música caipira aí - boa música... quer dizer, péssima música caipira - para ir morar na Riviera Francesa, para estar comprando avião e o diabo? Eu sou é ruim mesmo, por isso que eu só faço assim."
04/04/2005,Tom Zé,87,Júlio Medaglia,E é por isso que você está aqui.
04/04/2005,Tom Zé,88,Tom Zé,E é por isso que eu estou aqui.
04/04/2005,Tom Zé,89,[...],
04/04/2005,Tom Zé,90,Paulo Markun,"Tom Zé, pela internet, chega a pergunta de Tiago Alexandre, de Goiânia, que diz o seguinte: “Na sua visão, o mundo tem espaço para uma nova década de 60?” Que, aliás, foi quando você entrou no jogo, né? - digamos, da cultura de massa."
04/04/2005,Tom Zé,91,Tom Zé,"É... Júlio, diga aí. O que é que você acha?"
04/04/2005,Tom Zé,92,Júlio Medaglia,É isso que eu ia perguntar para você: se há possibilidade de a gente rever um dia a música inteligente nos meios de comunicação?
04/04/2005,Tom Zé,93,Tom Zé,"Ah, nos meios de comunicação... Mas logo eu...?"
04/04/2005,Tom Zé,94,Júlio Medaglia,Ver outra vez a música inteligente.
04/04/2005,Tom Zé,95,Paulo Markun,"Sim, porque eu acho que é isso: uma das características desse período da década de 60 foi esse. A gente via Caetano Veloso, tropicalistas ali no programa do Chacrinha não é? E não precisava ir lá para fazer essa sua vida, como é hoje em dia."
04/04/2005,Tom Zé,96,Tom Zé,É.
04/04/2005,Tom Zé,97,Flávia Guerra,"Eu queria completar, Tom Zé: não sei se seria este o termo, mas você acha que existe saída para o pagode dito vulgar, o pagode vulgar, que você até chegou a comentar... Você acha que tem uma saída? Ouvir outras coisas, fazer de uma forma nova? Porque o popular não necessariamente... né...?"
