DATA,ENTREVISTA,ORDEM,LOCUTOR,FALA
04/04/2005,Tom Zé,300,Tom Zé,"Foi fazer a... Como é que chama...? A masterização - dizem: “Ali não tem nada que mexer!” Mentira! A máquina que faz a masterização, bota presença, eco, chama igreja, aquele negócio que fica aquela coisa que ninguém mais é humano. É impressionante! Olha, vocês, cantores... cadê a câmera? É aqui? Vocês, cantores, vocês estão sendo enganados por um negócio criminoso! Vocês não fazem mais nada, vocês são botados dentro de uma caixa e postos na loja para vender! Vocês se transformam em todos iguais, parecendo uma série de fotografias iguais, aquilo que McLuhan chamou “o efeito da imprensa na cabeça do mundo”, sei lá o quê, porque eu não sou intelectual para saber disso - agora devia ter aqui até um intelectual para me ajudar. Porque vocês precisam de socorro, vocês estão lenhados!"
04/04/2005,Tom Zé,301,Carlos Calado,"Tom Zé, essa sua urgência de dizer coisas - quer dizer, estou querendo ligar algumas coisas. Por exemplo, esse seu trabalho, esse seu disco, na verdade, são dois projetos em um. Você não ficou satisfeito em fazer uma retomada disso tudo no samba, fazendo um projeto, dissecando o pagode, refazendo o pagode; ao mesmo tempo, você embute nesse projeto uma opereta que fala da discriminação da mulher, você denuncia essa segregação... E outra coisa: cada vez mais, eu tenho visto você nas entrevistas falando: “Pô, eu já tenho 68 anos! Eu já tenho 68 anos!” Você está querendo recuperar o tempo perdido naqueles 15 anos de ostracismo? Você está achando que o seu tempo não é suficiente? Você está querendo tirar o atraso?"
04/04/2005,Tom Zé,302,Tom Zé,Tomara que eu consiga responder markunianamente essa...
04/04/2005,Tom Zé,303,Paulo Markun,"Eu vou virar o corpo caloso desse programa, pelo amor de Deus! Eu falei para Neuza, sua mulher, que eu ia trazer a minha porção mulher para o programa. Eu trouxe e ela está quietinha aqui do meu lado, não conseguiu falar nada até agora!"
04/04/2005,Tom Zé,304,Tom Zé,Desculpe...?
04/04/2005,Tom Zé,305,Carlos Calado,"Você está querendo tirar o atraso, com todos esses projetos ao mesmo tempo, essa urgência, essas denúncias?"
04/04/2005,Tom Zé,306,Tom Zé,"Não, não, não. Aconteceu o seguinte."
04/04/2005,Tom Zé,307,Carlos Calado,Você está querendo tirar os 15 anos de atraso do ostracismo?
04/04/2005,Tom Zé,308,Tom Zé,"Não. Aconteceu o seguinte. Aquela dificuldade toda, aquele super-mundo, digamos, do Euclides da Cunha, para poder - eu, com minha mísera inteligência - reduzir ele a um canal, demorou muito. Agora, eu acho que eu cheguei a uma certa organização. É claro que eu nunca vou ser popular, mas eu estou satisfeito com a quantidade de público que me compra. Eu tenho bastante idéia... Como eu só depois de velho consegui formular uma solução para fazer... Meu Deus, se eu pudesse pegar Paulinho Lepetit, Rodrigo Santos, Marcos Ivo, Jair Rodrigues, prender eles dentro de um estúdio para trabalhar dia e noite... Porque eu e minha mulher, agora, só trabalhamos com música. Ela faz, coitada, a parte mais dura, que é a parte do empresariamento, da negociação, da coisa, e eu faço a parte mais gostosa, que é aquilo de estar... Eu me lembro de uma coisa que me dá... Quando eu fiz aquele tipo de música em que cada pequena célula girava em torno de si mesma e como cada célula tinha um tamanho diferente, nunca tinha verticalmente o mesmo acorde, que é o Estudando samba, eu me lembrei de uma coisa que é igual, que é o Alexander Calder, que é igual. Depois, depois; eu não me lembrei antes que é igual. Se lembrasse antes, também era ótimo: quem tem idéia, a gente copia as idéias. É, agora, de vez em quando, me ocorre uma idéia, porque eu cheguei em uma fase... Então, eu, com 68 anos, estou como se tivesse, digamos, trinta. Não estou querendo me gabar de nada, não. Porque eu não tive, não consegui fazer, não consegui estudar direito naquele tempo... Agora, eu..."
04/04/2005,Tom Zé,309,Maria Amélia Rocha Lopes,Tom Zé.
04/04/2005,Tom Zé,310,Tom Zé,"Sim. E agora que eu não tenho mais nada para... Meu tempo é só para fazer música, então... O Alexander das Caldas tem uma coisa que ele conta assim: “Dia de domingo, eu ficava fazendo brinquedos para as crianças.” Agora imagina o brinquedo que o Alexander fazia para os sobrinhos e netos dele! Então, eu vivo mais ou menos assim, com essa grande... Nesse paraíso. Ah, outra coisa: eu tenho um emprego formal. Desculpe, não é uma pergunta, mas eu vou responder: eu tenho um emprego formal. Minha vida está boa, eu tenho um emprego formal. É assim: eu trabalho para quarenta mil pessoas, de cada... eles não são exigentes, eu não sei fazer um disco por ano, porque eu não sou gerente, não sou nem compositor, nem gerente. De quatro em quatro anos, eu faço uma coisa. E eles me respondem pelo “se compram”, “se eu estou trabalhando direito para eles”. Eu tenho um emprego formal, formalizado. Aí, eu ganho para ter aquela casa, aquela vida, graças a Deus, com um casamento que me deu muita sorte. Uma moça disse que as mulheres não precisam de mim. Com toda razão: eu é que preciso das mulheres, tanto que sou casado com uma há 35 anos."
04/04/2005,Tom Zé,311,Paulo Markun,"Só que ela é a funcionária e você é o bailarino, é isso?"
04/04/2005,Tom Zé,312,Tom Zé,Correto.
04/04/2005,Tom Zé,313,Júlio Medaglia,"Tom Zé, daqui pra diante..."
04/04/2005,Tom Zé,314,Maria Amélia Rocha Lopes,Deixa eu te fazer...
04/04/2005,Tom Zé,315,Júlio Medaglia,"Daqui pra diante, agora; o que vai acontecer daqui para diante?"
04/04/2005,Tom Zé,316,Paulo Markun,Tem um telespectador aqui que pergunta se você vai fazer o “Estudando o rap”.
04/04/2005,Tom Zé,317,Tom Zé,"“Estudando o rap”? Não sei, não sei; eu acho que não."
04/04/2005,Tom Zé,318,Paulo Markun,"Espera aí, eu vou localizar o nome dele aqui já, já."
04/04/2005,Tom Zé,319,Tom Zé,"Não, eu acho que não, porque, aí, vai ficar malandragem, vai ficar, como é, Duro de matar 1, Duro de matar 2, Duro de matar 3... Aí, vira malandragem."
04/04/2005,Tom Zé,320,Maria Amélia Rocha Lopes,"Tom Zé, deixa eu fazer uma brincadeirinha com você, rápida. Seu disco chegando à loja, onde você acha que ele deveria estar? No escaninho do pagode, no escaninho da MPB, onde você acha que ele deveria estar exposto para ser vendido?"
04/04/2005,Tom Zé,321,Tárik de Souza,"Você não acha que corre o risco de um cara que gosta de pagode levar seu disco para casa e, chegando em casa, tomar um susto danado?"
04/04/2005,Tom Zé,322,Tom Zé,"Corre, corre; ele falou isso."
04/04/2005,Tom Zé,323,Maria Amélia Rocha Lopes,E o que gosta de ópera?
04/04/2005,Tom Zé,324,Tom Zé,"O Calado falou nisso. Que, na hora em que o pessoal do pagode ouvir, vai dizer: “Que diabo é isso?!” Realmente. Júlio, você sabe - é claro que não é o meu caso, eu sou um simplório, mas uma pessoa lá que tenha capacidade de tudo, dessas coisas todas que a gente sabe de música, pode pegar... Bártok! Bártok pegou aquelas musiquinhas do folclore húngaro, harmonizou de acordo com as próprias notas, fez uma obra genial. Então, qualquer “Meu limão, meu limoeiro” pode virar uma obra genial. Eu trabalhei no pagode por isso, porque eu achava qualquer música... E eu tentei fazer música simples. Teve momentos, Júlio, em que eu fiquei com vergonha de botar na praça essas músicas. Quem deu dignidade a elas foi Jair... Jair..."
04/04/2005,Tom Zé,325,[vários ao mesmo tempo],Oliveira.
04/04/2005,Tom Zé,326,Tom Zé,"...Oliveira, que é um moleque formado lá em..."
04/04/2005,Tom Zé,327,Tárik de Souza,Berkeley.
04/04/2005,Tom Zé,328,Tom Zé,"...Berkeley e que aprendeu alguma coisa lá. Ele estava meio perdido aqui, está meio perdido aqui, mas ele sabe! Aquele moleque sabe alguma coisa!"
04/04/2005,Tom Zé,329,Paulo Markun,"Tom Zé, só para registrar, a pergunta se você vai gravar “Estudando rap” é do Henrique Vanucci. E a Patrícia tem uma pergunta."
04/04/2005,Tom Zé,330,Patrícia Palumbo,"Eu quero retomar essa sua bandeira, aí, do amor gay para falar um pouco de amor com você. Porque toda essa sua opereta tem um final, não é? E, nesse final, você apresenta uma solução amorosa para a história toda. A Neuza, ainda há pouco, falou dessa coisa da retidão zen-budista e tudo mais. E eu queria que você falasse agora, aqui para a gente, como é que é o amor para você, já que você canta ele tão bem, mesmo dizendo que você faz música ruim etc e tudo. Mas você tem “O amor é velho-menina”, que é uma linda canção, tem “Menina amanhã de manhã”, tem outras tantas que falam do amor de um jeito muito particular e muito especial."
04/04/2005,Tom Zé,331,Tom Zé,"Ó, eu acabei de fazer o show do Sesc e você falou em retidão e amor. Não sei por que, reverberou na minha cabeça: “Que diabo faz aquele diabo daquele Sesc lidar com tanto dinheiro e fazer sempre coisas que são irrepreensíveis!” É bom lembrar isso em um país onde isso é uma exceção única!"
04/04/2005,Tom Zé,332,Paulo Markun,"E registre-se: ao Sesc de São Paulo, não são todos os Sesc do Brasil."
04/04/2005,Tom Zé,333,Tom Zé,"É verdade, é. Muito bem, que o Miranda está lá firme feito boi. É o seguinte, querida. Convenhamos, o tom que eu fiz com o “Menina amanhã de manhã”... mas algumas canções de amor minhas ficam ali na tentativa... Desculpe, eu canto o amor assim... como é que eu canto...? É difícil como o diabo! Espera aí. Mas eu vou tentar falar!"
04/04/2005,Tom Zé,334,Carlos Calado,Posso te ajudar? Posso te ajudar?
04/04/2005,Tom Zé,335,Tom Zé,"Pode, pode, pode."
04/04/2005,Tom Zé,336,Carlos Calado,"Só queria dar um exemplo desse disco: uma música chamada “O Amor é um rock”. Tom Zé diz o seguinte: “Sem alma, cruel, cretino, descarado, filho da mãe: o amor é um rock e a personalidade dele é um pagode.”"
04/04/2005,Tom Zé,337,Tom Zé,"É, está bom, e eu ainda digo uma coisa melhor."
04/04/2005,Tom Zé,338,Patrícia Palumbo,"E é egoísta, sim."
04/04/2005,Tom Zé,339,Tom Zé,"Esta música é bonita, esta música é bonita. Fala assim: “Se você está procurando amor, deixe a gratidão de lado, o amor é egoísta” - e, aí, entra como se entrasse o coro da Capela Sistina: “Sim, sim, sim, tem que ser assim!” Esse canto sobre o amor é bonito. Inclusive, lembra o nosso amigo Platão que, lá no Banquete, bota Diotima de Mantiméia para dar conselhos a Sócrates e a ele e Diotima de Mantiméia diz assim: “O Amor é filho da Pobreza” - porque foi no aniversário de... Como é o nome da deusa do amor? Vênus eu não gosto de falar...?"
04/04/2005,Tom Zé,340,[...],Afrodite.
04/04/2005,Tom Zé,341,Tom Zé,"Afrodite. Foi num aniversário de Afrodite que a Pobreza foi esmolar e ficou deitada lá. O Recurso, que tinha tomado muito - diz que não tinha vinho ainda; muito daquele outro negócio que os deuses bebiam, lá, também não eram deuses -, deitou embriagado. E Pobreza chegou junto dele e se deitou. Dessa... e geraram um filho chamado Amor. Então, o Amor é filho da Pobreza e do Recurso. O Recurso é filho de Prudência, não é? O Recurso é filho de Prudência. E dizem, então, que o Amor, por isso que não é bonito, nem é belo; ao contrário: ele é feio, grosseiro, está sempre nos cantos e... Isso, pelo lado da mãe. E, pelo lado do pai, que é o Recurso, ele é sempre maquinador de soluções, ele é sempre o Don Giovanni do Mozart, ele é sempre o super-malandro, a superacuidade, a rapidez mental, a coisa que acaba conquistando o lado Pobreza dele mesmo. E eu sempre cantei um amor que é parecido."
04/04/2005,Tom Zé,342,Paulo Markun,Filho da Pobreza com o Recurso.
04/04/2005,Tom Zé,343,Tom Zé,Da Pobreza com...?
04/04/2005,Tom Zé,344,Paulo Markun,Um amor filho da Pobreza com o Recurso.
04/04/2005,Tom Zé,345,Tom Zé,"Um amor filho da Pobreza com o Recurso. Que sou um pouco eu mesmo, não é? Mulher, filho da Pobreza com o Recurso..."
04/04/2005,Tom Zé,346,Paulo Markun,"Tom Zé, eu queria agradecer muito pela sua entrevista, agradecer aos nossos entrevistadores e convidar a todos para estarem aqui na próxima segunda-feira, às dez e meia da noite, quando o nosso entrevistado será Arnaldo Jabor. Uma ótima semana e até segunda."
04/04/2005,Tom Zé,347,[...],
