DATA,ENTREVISTA,ORDEM,LOCUTOR,FALA
04/04/2005,Tom Zé,188,Carlos Calado,"Tom Zé, tem uma sacada interessante nesse seu disco. Na verdade, acho que foi uma estratégia que você inventou, de consultar esses dois adolescentes - que, inclusive, estão aqui na bancada - e você deu, inclusive, a eles, o direito até de vetar algumas músicas..."
04/04/2005,Tom Zé,189,Tom Zé,Sim.
04/04/2005,Tom Zé,190,Carlos Calado,"...na medida em que eles não sentissem que essa música poderia agradar outros jovens e tal. Então, na verdade, eu queria te perguntar se, realmente, eles chegaram mesmo a vetar alguma de suas músicas e se você concordou com eles. E, na verdade, eu iria um pouquinho mais adiante: eu queria saber se você realmente acha, mesmo fazendo isso, que a sua música está ficando mais clara ou mais fácil de ser assimilada. Eu, sinceramente, acho que ela está cada vez ficando mais complexa, mais criativa - e tome isso como elogio. Agora, eu quero saber a sua opinião."
04/04/2005,Tom Zé,191,Tom Zé,"Sim, sim, sim! Olha, veja, eles são meus vizinhos, meus amigos, a Fernanda Dellomo e o Pedro Luiz Gonzaga. Esse diabo da tal liberdade de criação, isso é uma boa de uma banana, isso é uma boa de uma banana, isso não é nada, Júlio. Liberdade de criação: boa... boa... não falo palavra feia para não dizer que eu estou esculhambando o programa da santa Cultura. Eu, mesmo, nunca gostei de liberdade, só fez me atrapalhar. Eu tive a liberdade de fazer tudo a vida toda; por que não fiz a Décima Sinfonia? Por que não fiz? Que diabo de liberdade e tal? Então, eu precisava do seguinte: eu precisava, eu tinha o sonho de que um menino tímido, como eu fui aos 16 anos, pudesse tocar uma canção fácil e que, ao mesmo tempo, não fosse estúpida, claro - porque eu não sei fazer uma estupidez! A Neuza teve muito medo. Eles dois faziam um crivo da possibilidade dos jovens tocarem, a Neuza fazia o crivo do respeito estético. Ela dizia: “Isso não é digno de você!” Várias vezes, ela disse. Na Semana Santa do ano passado, a canção chamada “Vou pensar” - que fica, na estrutura, naquela hora em que o rapaz faz uma proposta de novo amor à moça, e a moça, diz: “Espera aí, não se dá um 'sim' assim, à toa! Deixa eu pensar nisso” e tal -, eu fiz a música cinco vezes. Na quinta-feira de noite, mostrei à Neuza e ela achou muito complicada. Na quinta-feira de madrugada, eu fiz, mostrei à Neuza de manhã e ela disse que, agora, estava muito boba. Na quinta-feira de tarde, eu fiz outra, chamei os meninos, eles disseram que estava muito difícil. A música era assim: “Vou pensar, rapaz, um pouco mais, não se dá um 'sim' assim, à toa“. E isso, com um ritmo muito sofisticado, daquela coisa, ”qué-tch-cum-tá cô-tch...“; se tivesse um violão aqui, eu mostrava. E eles chegaram e disseram: ”Isso não dá certo.” E a música acabou ficando com a letra parecida, mas: “Quero pensar, meu bom rapaz / Numa boa: / Não se dá um 'sim' assim à toa (...) E de chinela / Só de chinela, de só de chinela / Vou pensar com meus anéis”, com alguma malandragem carioca - meio apanhada, porque eu não sou carioca e nem nada -, e aí eles aprovaram. Só para dar um exemplo. Mas a função deles foi muito mais importante do que saiu nos jornais. Eles eram chamados no começo. Eu não queria liberdade, eu queria uma cerca, aquela de arame farpado, conforme já tem na capa do disco em volta de mim."
04/04/2005,Tom Zé,192,Paulo Markun,"Mas, Tom Zé, esse seu disco é muito mais complicado do que São São Paulo, meu amor. Muito mais complicado, não dá para cantar a música."
04/04/2005,Tom Zé,193,Patrícia Palumbo,"No entanto a platéia estava cheia de jovens, Markun. A platéia do show neste final de semana estava cheia de jovens."
04/04/2005,Tom Zé,194,Paulo Markun,...eu quero saber se alguém vai cantar.
04/04/2005,Tom Zé,195,Tom Zé,"O problema que ele está trazendo é outro. Eu tenho que correr esse risco. Porque, Júlio, eu fiz todas as... Você ouviu o disco? Eu sei que você não ouve..."
04/04/2005,Tom Zé,196,Júlio Medaglia,"Ouvi, sim."
04/04/2005,Tom Zé,197,Tom Zé,"Você não tem saco mais para ouvir. Mas, assim: eu ainda fiz outra ousadia. Eu fiz todas as canções com duas horas. E não tem essas paralelas de música caipira; em duas horas contrapontísticas, por exemplo..."
04/04/2005,Tom Zé,198,Paulo Markun,É um diálogo.
04/04/2005,Tom Zé,199,Tom Zé,"...o homem dá um tom e a mulher dá outro, propondo que o jovem chame a moça e que eles tentem cantar. Ora, está bom, isso é difícil, estou de acordo com todos vocês, mas o sonho é livre e, daqui a pouco, alguém lá do interior dá na telha de querer fazer justamente... Porque é um pouco diferente... Deus nos salve!"
04/04/2005,Tom Zé,200,Paulo Markun,"E você, afinal, encontrou a tal canção das lavadeiras, da fonte da nação de Irará aonde você diz que... porque é aquilo que perpassa o começo do disco."
04/04/2005,Tom Zé,201,Tom Zé,"É, é."
04/04/2005,Tom Zé,202,Paulo Markun,Porque é uma coisa que parece canção de lavadeira.
04/04/2005,Tom Zé,203,Tom Zé,"Quem sabe? Pode ser que, no futuro, tenha um povo que não queira fazer nada, tenha uma classe numerosa, ou de baixo ou de cima - nessa hora ninguém sabe nem o que está por baixo, nem o que está por cima, como diz a teosofia, porque a primeira coisa da teosofia é que ninguém sabe o que está por baixo, o que está por cima -, e que tenha um grupo de pessoas que se interessem por isso, os mestres de banda do interior, que são muito bem capazes de ensinar os jovens até a compor com contrapontos - até as três vozes eles fazem bem; quando Koellreuter chegou com quatro vozes na Bahia, foi o que rodou a cabeça deles - e que isso forme um grupo de pessoas que se interessem e voltem a ter um espaço na televisão. Porque é lindo! Eu queria que pudesse tocar em um show para aquelas pessoas que... É o tal negócio: está muito bem, eu sou complicado; mas, quando eu toquei no Abril para o rock, em 1998, 8500 pessoas, às oito horas da noite, em um show que ia até a meia-noite e começou às seis - quer dizer, eu era nada, oito horas, o que toca não é nada - e, quando eu toquei, não mandou trocar a platéia 8500 pessoas – “sai os analfabetos, vem os cultos, os inteligentes, que o Tom Zé vai cantar”. Não mandaram fazer nada disso, ficou o mesmo público. E fez um sucesso tão filho da mãe que o show quase que não pôde continuar! A imprensa toda estava lá, do Brasil, e viu. Tem hora que o diabo vira..."
04/04/2005,Tom Zé,204,Maria Amélia Rocha Lopes,"Tom Zé, é verdade essa história - eu tomei um susto quando eu li - de que você jamais recebeu um prêmio por “São São Paulo meu amor”?"
04/04/2005,Tom Zé,205,Júlio Medaglia,A grana?
04/04/2005,Tom Zé,206,Maria Amélia Rocha Lopes,A grana?
04/04/2005,Tom Zé,207,Tom Zé,"É, é, a Record...."
04/04/2005,Tom Zé,208,Maria Amélia Rocha Lopes,"Isso valia, na época, três fuscas."
04/04/2005,Tom Zé,209,Tom Zé,"A Record pagou e o turismo da Prefeitura... Foi assim, foi até engraçado: o secretário meu..."
04/04/2005,Tom Zé,210,Júlio Medaglia,Eu que entreguei o prêmio!
04/04/2005,Tom Zé,211,Tom Zé,"Aí, correto! O Júlio que me deu o cheque da Record, eu tenho um retrato dele..."
04/04/2005,Tom Zé,212,Tárik de Souza,"O símbolo, não é? O símbolo, o símbolo, não a grana."
04/04/2005,Tom Zé,213,Tom Zé,"Eu tenho um retrato com o Júlio, lindo. Mas ali, Júlio, ali aconteceu o seguinte, o secretário..."
04/04/2005,Tom Zé,214,Júlio Medaglia,O cheque era frio? Foi eu que te entreguei o cheque!
04/04/2005,Tom Zé,215,Tom Zé,"É, o cheque da Record, com a metade do prêmio! A Prefeitura, que ia pagar a outra metade, e o secretário estavam ali e lá já tinham me dado até uma parte do prêmio da Prefeitura, que era o Sabiá de Prata. Ele, aí, me chamou no fundo e disse: “Tom Zé, eu vou fazer uma festa para te dar o dinheiro e esse Sabiá... Dê cá o Sabiá.”"
04/04/2005,Tom Zé,216,Paulo Markun,Tomou o Sabiá?
04/04/2005,Tom Zé,217,Tom Zé,Perdi tudo! Antes um Sabiá na mão do que dois voando. Nunca mais recebi nada!
04/04/2005,Tom Zé,218,Júlio Medaglia,"Quarenta anos depois de “São São Paulo Meu Amor”, se fosse fazer hoje uma... Eu acho que o verdadeiro hino a São Paulo foi esse que você fez, não é?"
04/04/2005,Tom Zé,219,Tom Zé,Certo.
04/04/2005,Tom Zé,220,Júlio Medaglia,"Tem todas as loucuras da cidade. Você faria como hoje o hino da cidade? Seria igual, seria diferente ou não faria?"
04/04/2005,Tom Zé,221,Tom Zé,"Ah, eu acho difícil. Eu fiz... Você sabe, depois, eu fiz “Augusta, Angélica e Consolação”... Eu fiz, agora, uma música com os personagens de Adoniran, que está no disco. É... como é que é...? “De ferro e bronze, o trem das onze voltará...”"
04/04/2005,Tom Zé,222,Paulo Markun,Que é a música mais popular do disco. Essa toca e nego canta.
04/04/2005,Tom Zé,223,Tom Zé,"É, essa pode até tocar, tem a ver. “De ferro e bronze / O trem das onze voltará / Em Jaçanã bem de manhã / Apitará / Comemoremos Matogrosso, eu e Joca / com Iracema e o Arnesto na maloca.” Sim, mas “São Paulo”, não sei, Julio... Se tivesse um desafio, eu não sei como iria fazer. Naquele tempo, tinha uma contradição, era como no tempo de Ésquilo, Sófocles e Eurípides: tinha uma grande contradição moral. Todo mundo vinha para São Paulo ganhar a vida com a música popular e todo mundo falava mal de São Paulo. E eu, que sou repórter, não sou músico, cheguei e disse: “Que coisa engraçada” e tal. Aí, fiz uma letra, como você bem disse, falando tudo que São Paulo tem de ruim. No fim: “Porém, com todos os defeitos / te carrego no meu peito / São São Paulo, meu amor / São São Paulo plantador” - como, novamente, armei uma malandragem cartesiana."
04/04/2005,Tom Zé,224,Maria Amélia Rocha Lopes,Tom Zé.
04/04/2005,Tom Zé,225,Tom Zé,Sim.
04/04/2005,Tom Zé,226,Maria Amélia Rocha Lopes,"Você falou que faz reportagem e, na época em que você fez “São São Paulo meu amor”, tinha Adoniran, tinha tudo isso; e a São Paulo de hoje, pelo menos a São Paulo do Centro, tem muita rapaziada fazendo rap, que é uma forma de reportagem, também, do cotidiano deles e tudo."
04/04/2005,Tom Zé,227,Tom Zé,É.
04/04/2005,Tom Zé,228,Maria Amélia Rocha Lopes,Eu queria saber se você ouve e o que você acha disso.
04/04/2005,Tom Zé,229,Tom Zé,"Olha, eu vou confessar uma coisa a vocês: eu não ouço música. Eu sou como o Júlio: eu não ouço desgraça de música nenhuma, Deus me perdoe..."
04/04/2005,Tom Zé,230,Júlio Medaglia,"Tem a vantagem que você não precisa ouvir o rap, assim, também."
04/04/2005,Tom Zé,231,Tom Zé,Eu tenho ódio de música...
04/04/2005,Tom Zé,232,Maria Amélia Rocha Lopes,Eu tinha a certeza que o maestro iria fazer um “porém”...
04/04/2005,Tom Zé,233,Júlio Medaglia,"Não precisa ouvir o Belo, também, o rap..."
04/04/2005,Tom Zé,234,Tom Zé,"Eu tenho ódio de música. Agora, eu preciso saber o porquê. Que quem é gênio, tem inspiração, faz, toca no rádio; então, pode ouvir. Quando eu vou ouvir rádio, eu só sinto tristeza! Porque eu nunca toco no rádio... Não, isso também é exagero: no ano passado, tocaram quatro músicas minhas. A... como é o nome dela...?"
04/04/2005,Tom Zé,235,Carlos Calado,Mônica Salmaso.
04/04/2005,Tom Zé,236,Tom Zé,"Mônica Salmaso gravou “Menina amanhã de manhã”, Zélia Duncan gravou “Tô”, Adriana Maciel gravou “Solidão”..."
04/04/2005,Tom Zé,237,Carlos Calado,Jussara Silveira...
04/04/2005,Tom Zé,238,Tom Zé,... e Jussara Silveira gravou...
04/04/2005,Tom Zé,239,Maria Amélia Rocha Lopes,“A Volta...”
04/04/2005,Tom Zé,240,Tom Zé,“A volta de Xanduzinha”. Que foram as músicas delas que tocaram no rádio.
04/04/2005,Tom Zé,241,Paulo Markun,"Aliás, o Rogério Augusto Oliveira quer saber, pegando uma carona nisso, como é que você explica o fato de ter várias mulheres interpretando as suas músicas como Mônica, Zélia, Adriana e Rebeca Matta."
04/04/2005,Tom Zé,242,Tom Zé,"É inexplicável! Um disco que foi feito em 76, que foi descoberto em 90, 14 anos depois, agora em 2004, 14 anos depois, as moças todas gravam...! Vamos ver..."
04/04/2005,Tom Zé,243,Júlio Medaglia,"É o orgasmo depois de 14 anos, viu?"
04/04/2005,Tom Zé,244,Tom Zé,É uma...
04/04/2005,Tom Zé,245,Paulo Markun,Mas você não...
04/04/2005,Tom Zé,246,Júlio Medaglia,É um orgasmo depois de 14 anos.
04/04/2005,Tom Zé,247,Tom Zé,É um orgasmo de 14 em 14 anos.
04/04/2005,Tom Zé,248,Paulo Markun,"Mas você não respondeu a pergunta da Maria Amélia: o que você acha do rap? Quer dizer, você não ouve......acha?"
04/04/2005,Tom Zé,249,Maria Amélia Rocha Lopes,...o que você acha?
04/04/2005,Tom Zé,250,Tom Zé,"Chico Buarque tem razão, é uma forma de expressão; é, talvez... Agora, essa reportagem que o Pedro Alexandre..."
04/04/2005,Tom Zé,251,Maria Amélia Rocha Lopes,O Chico Buarque acha que a canção acabou e que agora é o rap.
04/04/2005,Tom Zé,252,Tom Zé,"É, essa reportagem que o Pedro Alexandre fez na Carta Capital sobre a violência e os ricos indo lá cantar com os pobres, essas maluquices todas, que isso acaba sendo uma maneira de escapar, senão esse mundo explodia... Eu não sei... Por exemplo, quando eu era comunista, eu estava doido que o mundo explodisse; agora, acabou o comunismo, não sei mais o que é que eu estou doido... Essas... É interessante você ouvir uma ou duas vezes; quando chega na terceira e quarta, você começa a ouvir um cansaço, que é a repetição, e fica um pouco..."
04/04/2005,Tom Zé,253,Maria Amélia Rocha Lopes,"Então, você ouve?"
04/04/2005,Tom Zé,254,Tom Zé,"Eu já ouvi, eu sou curioso! Eu sou curioso. Tem disco no Brasil que eu ouço: Cabruêra, Barbatuque, muitos outros que eu vou esquecer aqui."
04/04/2005,Tom Zé,255,Maria Amélia Rocha Lopes,"Você já ouviu Sabotage, você já ouviu..."
04/04/2005,Tom Zé,256,Tom Zé,"Sabotage, eu soube que eles cantaram uma música minha, “O Lixote”, do Globo..."
04/04/2005,Tom Zé,257,Paulo Markun,Globo News.
04/04/2005,Tom Zé,258,Tom Zé,"Isso, do Globo da internet. Mandou me falar, mandou um disco, eu ouvi... Agora, o David Byrne, quando eu chego lá, às vezes, ele me mostra uma coisa que ele acha especial e eu olho, sento e ouço com toda a dedicação. Mas eu tenho ódio à música, Markun, eu tenho ódio à música, porque eu não sou dos que tocam, então eu fico..."
04/04/2005,Tom Zé,259,Paulo Markun,"O Carlos José dos Santos Filho, do bairro do Piquiri, aqui em São Paulo, que é bancário, pergunta que análise você faz do rock nacional atual de nomes como Detonautas, Charlie Brown Júnior e CPM22, se dá para fazer uma comparação entre esse rock de hoje e a música dos Mutantes, por exemplo."
04/04/2005,Tom Zé,260,Tom Zé,"Ah, não!"
04/04/2005,Tom Zé,261,[...],
04/04/2005,Tom Zé,262,Tom Zé,"Aí, não... Mutantes era uma coisa sofisticada, timbrística, ouvido aberto para tudo que se oferecia... Mas eu também não falo mal de ninguém: eu não conheço - porque eu sou analfabeto, não é porque eles não merecem que eu não conheça, não."
04/04/2005,Tom Zé,263,Flávia Guerra,Pegando carona na pergunta da Maria Amélia...
04/04/2005,Tom Zé,264,Tárik de Souza,"Tom Zé, deixa eu te perguntar uma coisa, você falou várias vezes que você é da mesma escola do Júlio Medaglia e você citou o Koellreuter. E eu queria que você dissesse: o Koellreuter, o Ernst Widmer e o Smetak, no que eles contribuíram para a sua música?"
04/04/2005,Tom Zé,265,Paulo Markun,"Que foram os seus professores na Universidade Federal da Bahia, não é?"
04/04/2005,Tom Zé,266,Tom Zé,"Federal da Bahia. Olhe: o Ricu. O Ricu. O sanfoneiro, os violeiros, aqueles instrumentos desgraçados do Nordeste desafinado, as segundas menores, as oitavas confusas, aquilo tudo estava no meu ouvido. Tinha um sanfoneiro em Irará - é pena que não tem um violão aqui - que gostava de dizer assim: “Você quer ver que eu canto num tom e acompanho no outro?” “Brincadeira!” É gozado: então, ele fazia dó, fá, sol, dó e tocava uma música qualquer de folclore; aí, botava em um tom de sol e começava a cantar em sol. E você ouvia. Era uma coisa gozada isso, eu não sei se alguém de nós já teve o capricho de ver: quando você faz uma tônica, mesmo que você não esteja cantando naquele tom, mas esteja cantando em outro tom vizinho, faz a dominante e volta para a tônica, parece que as duas coisas convivem em uma outra espécie de politonalidade. Agora, veja a cabeça de um sertanejo filho da mãe! Então, onde eu encontrei essa coisa foi naquele braço da Escola de Viena que foi para a Bahia, aquele rigor. Koellreuter tinha um negócio admirável: era o jeito que ele tratava pedante. Pedante, gente metida a besta que ia lá falar de coisa com ele... Aquele personagem de que ele é... Outra coisa gozada que ele tinha: quando ele entrava na sala, aquelas meninas, filhas de rico na Bahia, todas faziam um... um... como é que chama...? Um trêmulo de terça maior, as partes inteiras, as partes principais. Ele era um encanto. Comeu as menina da Bahia todas, as ricas todas. Todo mundo sabia. E, quando eu fui brincar com ele agora, da última vez que eu encontrei ele, ele se lembrou e disse: “É; e depois eu fui para a Índia, que também tinha mulher de sobra!”"
04/04/2005,Tom Zé,267,Paulo Markun,Flávia Guerra.
04/04/2005,Tom Zé,268,Flávia Guerra,"Eu queria pegar carona na pergunta da Maria Amélia. E o pagode, você ouviu? Eu sei que você ouviu um disco do Belo aqui, emprestou até do seu porteiro..."
04/04/2005,Tom Zé,269,Tom Zé,"É, eu ouvi, porque tocava no prédio..."
04/04/2005,Tom Zé,270,Flávia Guerra,O que você ouviu?
04/04/2005,Tom Zé,271,Tom Zé,"E, aí, o que aconteceu foi o seguinte. Eu não vou mentir, dizer isso nem aquilo. Realmente, é uma coisa bastante diluída, bastante fraca e tal, que é o que as classes mais humildes agora estão... como é que diz? Educadas..."
04/04/2005,Tom Zé,272,Flávia Guerra,Massacradas.
04/04/2005,Tom Zé,273,Tom Zé,"Tudo bem, tudo bem. Mas, aí, aconteceu o seguinte. Por que foi que eu vim a me interessar? Primeiro, pela solidariedade com o desgraçado, que é a mulher e o pagode. Segundo, porque eu ouvia toda noite na hora de dormir - e, uma noite, eu ouvi um pagode do Belo, ouvi um pagode que eu não sabia de quem era, que me lembrou uma música minha, “Se o caso é chorar”: “Amor, deixei sangrar o meu peito...”, que foi sucesso, primeiro lugar nas paradas nos anos 70. E, aí, eu disse assim: “Mas que diabo, essa música...” Aí, perguntei ao zelador: “Uma música que fala tais e tais palavras, o que é?” O Chico, o meu zelador lá, o Assis, ele disse: “É do Belo.” E eu falei: “Tu me empresta o disco?” Ele, aí, me emprestou. Eu cheguei e botei a música. Aí, eu vi que os produtores do pagode, na diluição que o gênero já sofria, na baixa das vendas - já estava vendendo pouco - eles procuravam ir por todos os lados que o samba andou e tal e coisa. Aí, eu falei: “Pô, se eles podem fazer isso, eu também posso.” É isso o que eu pus."
04/04/2005,Tom Zé,274,Carlos Calado,"Tom Zé, já que o assunto é pagode, eu queria fazer um comentário que eu acho interessante. Eu estava lendo uma entrevista que você deu há pouco tempo na revista V e a razão disso é a seguinte: eu confesso que fiquei realmente surpreso quando vi você na TV UOL, como você repetiu aqui, pedindo desculpas aos pagodeiros, como se você tivesse feito alguma coisa de errado, e dizendo que, inclusive, o seu disco é uma homenagem ao pagode. Então, na verdade, eu acho que essa foi mais uma de suas inversões misteriosas, como você se referiu no começo do programa. Nessa entrevista, te perguntaram sobre aquele caso da coleção de moda, a chamada “Coleção São Tomé”, que aquele estilista de Belo Horizonte, o Ronaldo Fraga, fez, dizendo que era uma homenagem a você - e que você, na entrevista, estava contando que você, quando ouviu falar naquela homenagem, você ficou tremendo, porque era assim, abre aspas: “Já que em toda homenagem a gente acaba sendo lesado”. Então, por aí, eu comecei a entender por que você diz que você fez uma homenagem ao pagode."
04/04/2005,Tom Zé,275,Tom Zé,
04/04/2005,Tom Zé,276,Carlos Calado,Foi mais ou menos isso.
04/04/2005,Tom Zé,277,Tom Zé,"Olha, eu não faço nem comentários."
04/04/2005,Tom Zé,278,Carlos Calado,Eu entendi a homenagem.
04/04/2005,Tom Zé,279,Tom Zé,"Ah, bandido! Belo texto, viu, bandido? Assino aí, tá bom!"
04/04/2005,Tom Zé,280,[inserção de clipe musical],“A Iracema em Jaçanã / a esperança parece vã / mas lá na maloca Adoniran / já se reforça com tapioca / e convoca a tropa”
04/04/2005,Tom Zé,281,Paulo Markun,"Tom Zé, estamos de volta com o Roda Viva. Aqui, a pergunta do Gerald Thomas, que diz o seguinte: “Oi, Tom Zé, queridíssimo! Faz um tempo, você deve lembrar: depois de uns encontros que tivemos no Sesc, aqui no Rio, acabei escrevendo um insight a respeito de Darmstadt, da Alemanha, cidade conhecida pela sua música serialista, atonal, experimental” - espero que eu tenha acertado a pronúncia aqui - “com seus CDs debaixo do braço” - diz o Gerald Thomas - “todos os assim chamados compositores de ópera séria ficaram boquiabertos com o seu trabalho.” Aí, a pergunta dele não tem nada a ver com isso. Ele pergunta o seguinte: “O Brasil mudou um bom bocado desde esse dia: Gilberto Gil virou ministro da Cultura, ou seja, ministro de si mesmo, matou o teatro; já tem ignorado você há um bom tempo. Me diga: o que você acha de Gil no poder?” É a mesma pergunta de Rian Júnior, de Lorena, músico: quer saber o que você acha do ministro da Cultura ser músico, já que a Ordem dos Músicos está há mais de vinte anos no poder e nada muda. E, finalmente, para botar mais uma na roda, Nelson Pascareli Filho, da Mooca, pergunta: “Caso fosse convidado, você aceitaria ser ministro da Cultura?”"
04/04/2005,Tom Zé,282,Tom Zé,Ministro da Cultura? Primeiro...
04/04/2005,Tom Zé,283,Júlio Medaglia,"Seria maravilhoso, maravilhoso."
04/04/2005,Tom Zé,284,Tom Zé,"Primeiro, a resposta sobre Gil. Olha aqui, ó: O cara tem dinheiro, fama, família, Grammy, o diabo, o cara vai dar a cara para bater lá, para ser ministro de um diabo de ministério que não tem dinheiro nenhum porque ele mesmo tem que inventar onde arranjar dinheiro, ele tem vocação para se sacrificar. Encerrei."
04/04/2005,Tom Zé,285,Paulo Markun,Você aceitaria ser ministro da Cultura?
04/04/2005,Tom Zé,286,Tom Zé,Se eu...?
04/04/2005,Tom Zé,287,Paulo Markun,Você aceitaria ser ministro da Cultura?
04/04/2005,Tom Zé,288,Tom Zé,"Eu?! Ave Maria, eu não sei... Olha, a secretária que fica na porta do ministério me passava a perna e me botava no chão. Eu não sei tratar com coisa difícil. Aquilo ali é um... Como é que chama a casa do Minotauro?"
04/04/2005,Tom Zé,289,Maria Amélia Rocha Lopes,Labirinto.
04/04/2005,Tom Zé,290,Tom Zé,"Aquilo é um labirinto, política é um labirinto. Sabe o Marcos Eagle? Foi seu sonoplasta em uma novela da Globo que você fez. Eu queria dizer que ele me ajudou muito a fazer o disco, assim como Jair Oliveira, assim como Rodrigo Sanches, que foi técnico de som, a coisa..."
04/04/2005,Tom Zé,291,[...],Tom Zé...
04/04/2005,Tom Zé,292,Tom Zé,"Desculpa, deixa eu terminar de contar esse negócio aqui. Júlio, é uma coisa difícil da desgraça você convencer a um estúdio que você não quer eco, que você não quer efeito na voz, que você quer fazer o disco com uma voz normal para parecer diferente do conjunto das coisas! As máquinas já têm um..."
04/04/2005,Tom Zé,293,Júlio Medaglia,"Você não percebeu que a música no Brasil saiu da mão dos criadores e passou para os produtores, agora? Por isso é que está essa porcaria aí. Quando voltar para a gente..."
04/04/2005,Tom Zé,294,Tárik de Souza,"Nem para os produtores, para os marqueteiros."
04/04/2005,Tom Zé,295,Júlio Medaglia,"Marqueteiros, né..."
04/04/2005,Tom Zé,296,Tom Zé,"E outra coisa curiosa - e isso eu realmente sou linha dura aí; sou, sou, sou - quem faz um disco é o cara da mesa!"
04/04/2005,Tom Zé,297,Júlio Medaglia,É.
04/04/2005,Tom Zé,298,Tom Zé,"Você não... Olha, eu garanto a vocês que a coisa, a matéria musical, aquilo que se plasma - veja bem, eu não faço música, eu não sou artista, todo mundo aí sabe; eu faço canção popular, uma coisa bobagem e tal - o “com que se plasma” a música é com o som, o timbre, a diferença. Todos os discos do Brasil são iguais! A máquina já está pronta para gravar assim, que é a moda! Imagina que coisa sufocante! Então, Rodrigo Santos, coitado, ele tinha que ir lá, ele fotografava a máquina do jeito que a gente gravava para, no outro dia, poder repetir. Até isso! “Não, eu tenho a fotografia do que eu fiz.” Era um sacrifício. Na hora do Marcos Ivo, que foi seu sonoplasta - e eu sei que você ama os sonoplastas brasileiros e tal..."
04/04/2005,Tom Zé,299,Júlio Medaglia,É verdade.
