DATA|ENTREVISTA|ORDEM|LOCUTOR|FALA
26/06/1995|Dercy Gonçalves|175|Matinas Suzuki Jr.|[fala como se fosse a Dercy] “Com toda a moral para falar do assunto eu acho”. [risos]
26/06/1995|Dercy Gonçalves|176|Dercy Gonçalves|Eu acho! E eu falei a ele... Ele disse: “você me acha imoral?”, [eu disse] “acho”. Eu tenho moral. [risos]
26/06/1995|Dercy Gonçalves|177|Maria Cristina Poli|Dercy, o dinheiro que você ganha - estou vendo aí você toda caprichada com jóias e tudo mais - você gasta com o quê?
26/06/1995|Dercy Gonçalves|178|Dercy Gonçalves|Eu tenho uma família que sustento. Tenho uma família que sustento não [se corrige]: eu ajudo minha família. Tenho uma porrada de gente que está debaixo das minhas asas. Agora, não faço promoção. Nem peço subvenção. Nunca ganhei um vintém de ninguém. Então, o meu dinheiro eu não conto, não digo, não falo o que faço. Porque é ganho suado, não tem moleza, não ganho dinheiro de ninguém. Nunca ganhei uma subvenção, nunca tive [...]. O único dinheiro mole que ganhei foi a Antarctica [empresa de bebidas] que me pagou para dizer: “falou!”. [risos]
26/06/1995|Dercy Gonçalves|179|Maria Cristina Poli|E essas jóias lindas?
26/06/1995|Dercy Gonçalves|180|Dercy Gonçalves|Essas jóias aqui quase tudo foi o Faustão [Fausto Silva] que me deu. Tudo isso foi o Faustão que me deu nos meus aniversários. Esse aqui ele me deu ontem, esse aqui me deu o ano passado. Ele é meu amante. Espiritual! [risos] Ele e o Boni. São duas pessoas muito queridas para mim, que tudo que eu quero - eu não abuso nem de um, nem de outro... Que são pessoas que me amam de graça. E eu sei disso, então não abuso.
26/06/1995|Dercy Gonçalves|181|Matinas Suzuki Jr.|Dercy, nós temos que fazer um intervalinho e voltamos já com o Roda Viva, que está entrevistando, esta noite, a atriz Dercy Gonçalves.
26/06/1995|Dercy Gonçalves|182|Dercy Gonçalves|É que está quase morrendo a Roda Viva. [risos]
26/06/1995|Dercy Gonçalves|183|Matinas Suzuki Jr.|Imagina, está mais viva do que nunca e a gente volta daqui a um pouco.
26/06/1995|Dercy Gonçalves|184|[intervalo]|intervalo]
26/06/1995|Dercy Gonçalves|185|Matinas Suzuki Jr.|Bem, nós voltamos com o Roda Viva que, esta noite, entrevista a atriz Dercy Gonçalves. Nós lembramos a você que este programa foi gravado, por isso nós não estamos recebendo as perguntas por fax ou por telefone. Dercy, no intervalo você falava de um encontro com a primeira dama, Ruth Cardoso [(1930-2008) antropóloga, casada com Fernando Henrique Cardoso, presidente do Brasil entre 1995 e 2003, criou e atuou no programa Comunidade Solidária, de combate à exclusão social e à pobreza, dando novo formato a essa questão no país]. Você podia contar para o telespectador o que você contou aqui para a gente?
26/06/1995|Dercy Gonçalves|186|Dercy Gonçalves|Mas já contei!
26/06/1995|Dercy Gonçalves|187|Matinas Suzuki Jr.|Mas só entre nós aqui... Como foi o seu encontro com a primeira dama?
26/06/1995|Dercy Gonçalves|188|Dercy Gonçalves|É porque eu pensava que era Ruth Escobar [atriz e produtora de teatro portuguesa].
26/06/1995|Dercy Gonçalves|189|Maria Cristina Poli|Onde você estava, Dercy?
26/06/1995|Dercy Gonçalves|190|Dercy Gonçalves|Estava no Palácio [do Itamaraty], lá no Palácio. E ela estava dentro de um quarto todo fechado. E o presidente estava recebendo a comitiva estrangeira. Eu estava aflita [por]que queria ir embora, [mas] eu queria falar com a Ruth. Aí desci até a Ruth, que foi a Ruth até que me envolveu na... ela que lançou o Fernando Henrique [Fernando Henrique Cardoso] aqui em São Paulo na presidência. Eu aí falei: “eu queria falar com a Ruth!”. Aí o polícia lá falou assim: “ela está lá dentro”. “Está difícil”, eu pensei. “Porra, mas a Ruth conseguiu isso?". [risos] "Então fala com ela que eu estou aqui, se ela quer falar comigo...”. “Tá bom”. Ele disse que ia falar com ela. Eu no vidro. Ele chegou fez assim, me chamou que a Ruth queria falar comigo. [Falei]: “então abre lá que eu já vou!”. Abriu a porta e eu fui, mas lá estava meio escuro eu toco a procurar a Ruth [faz gestos como se procurasse]... [Falei]: “cadê a Ruth?”. [Ela falou]: “estou aqui!”. Falei: “porra! Mas não é você! [risos] Não é você, nega!”. [risos] Eu não sabia nem quem era, que ela se chamava Ruth. Aí ficou assim. Ela riu, foi muito gentil...
26/06/1995|Dercy Gonçalves|191|Maria Cristina Poli|Vocês conversaram alguma coisa assim?
26/06/1995|Dercy Gonçalves|192|Dercy Gonçalves|Não, eu falei com ela, falei nos ouvidos dela: “olha, eu vim aqui para deixar um recado, uma mensagem [por]que eu vou-me embora e eu tenho certeza [de] que eu não vou falar com o presidente. Então, como ele agora é nosso presidente, eu queria que ele não desse dinheiro para artista nenhum [que] fizesse teatro. [risos]. Não desse dinheiro para essa gente ficar satisfazendo o ego. Porque o teatro, em todo lugar, está muito ruim, está muito difícil. E a gente indo aos lugares é muito agradável. Facilite a vida da gente para ir no lugares e faça teatro, mas não dê dinheiro para ninguém! Porque essa gente não sabe fazer teatro sem o dinheiro do governo”.
26/06/1995|Dercy Gonçalves|193|Matinas Suzuki Jr.|Pelo jeito ele te ouviu, não é, Dercy?
26/06/1995|Dercy Gonçalves|194|Dercy Gonçalves|Pois é. [risos] Acho que está fazendo muito bem. Acho que ficar dando dinheiro à toa... Tantas companhias que tem aí... Você forma com o que você tem. Para quê colocar peças estrangeiras extraordinárias? Se é a sua cultura... A minha cultura é essa! A minha cultura é essa eu estou mostrando para todo o mundo, cada um mostre a sua.
26/06/1995|Dercy Gonçalves|195|Matinas Suzuki Jr.|Dercy, tem algum político por quem você tenha admiração?
26/06/1995|Dercy Gonçalves|196|Dercy Gonçalves|Não tenho assim nenhum privilegiado, não. Aprecio o presidente [Fernando Henrique Cardoso], aprecio. Acho que... Espero, estou esperando com muita boa vontade, que ele resolva o problema. Tenho certeza. Tem que dar um tempo, não pode ser em cima, “pé na tábua” conforme estão fazendo... Ele é um grande democrata, a gente vê que é. [O] que é erro aqui no Brasil. Não pode ter essa democracia, porque é um povo ainda muito incivilizado, muito sem... Ainda é submundo!
26/06/1995|Dercy Gonçalves|197|Matinas Suzuki Jr.|Tá, mas você acha que a democracia ajuda, atrapalha o país a crescer nesse...?
26/06/1995|Dercy Gonçalves|198|Dercy Gonçalves|É porque não tem ordem, fica todo mundo mandando... Fica virando “cu da mãe Joana”.
26/06/1995|Dercy Gonçalves|199|[...]|Você é a favor de quem, então?
26/06/1995|Dercy Gonçalves|200|Dercy Gonçalves|Eu sou a favor de uma ordem, de uma disciplina. Não pode ser é esculhambação.
26/06/1995|Dercy Gonçalves|201|Matinas Suzuki Jr.|Mas, Dercy, você não acha que no tempo que houve muita disciplina, por exemplo...
26/06/1995|Dercy Gonçalves|202|Dercy Gonçalves|Nunca houve disciplina. O roubo começou, meu filho; a roubalheira começou quando fizeram Brasília. Foi onde começaram as empreiteiras. O Brasil não tinha nada, o Brasil... A gente falava assim: “o meu contrato é esse; é um fio de bigode”, acabou. Era um fio de bigode, não havia nada. Então o Brasil começou a se desenvolver, o Brasil começou a ter contratos, leis trabalhistas... As leis eram contra todo mundo. E agora... As leis eram contra os empresários, agora estão sacaneando os empresários e os contratados. Aqui você não tem mais nada! Você não tem mais hospital, você não tem mais colégio. Eu estudei... Na minha terra tinham duas escolas públicas, três escolas particulares e um ginásio. Pô! Hoje não tem! Tem o Cieps [Centros Integrados de Educação Pública] que eles querem jogar fora. Fizeram Ciep, fizeram Ciep... Olha que tem Ciep pra caçamba por aí afora e agora querem tirar o Ciep fora! Onde é que se viu isso? Isso é uma esculhambação.
26/06/1995|Dercy Gonçalves|203|Matinas Suzuki Jr.|E teve algum político que você se decepcionou muito com ele?
26/06/1995|Dercy Gonçalves|204|Dercy Gonçalves|Com todos. [Com] todos eu me decepcionei, porque como eles têm uma facilidade de prometer... Como não têm vergonha de dizer que não podem fazer? Então fica muito ruim.
26/06/1995|Dercy Gonçalves|205|Matinas Suzuki Jr.|Agora, Dercy, voltando só um pouquinho ao negócio da ordem, você não acha que quando tem... [Quando] se excede na ordem - na tentativa de fazer ordem - dá coisa como a censura, por exemplo? Porque você sofreu muito com a censura...?
26/06/1995|Dercy Gonçalves|206|Dercy Gonçalves|Não, censura não pode haver num país... Num país deste, que ninguém tem moral para censura, ninguém porra! Ninguém tem censura, moral pra te dizer para fazer aquilo [...]. Minha mão era censurada, diziam que minha mão era pornográfica.
26/06/1995|Dercy Gonçalves|207|Flávio de Souza|Isso na televisão, não é?
26/06/1995|Dercy Gonçalves|208|Dercy Gonçalves|Na televisão. Minha mão era pornográfica, eu fazia assim ou eu fazia... [risos] Então a minha mão era pornográfica. Isso é coisa que se faça? Agora, você... Haver um pouco de respeito na vida pública, na vida da presidência... Eu acho que não devia de esculhambar tanto porque se eu esculhambo você, seu filho não te respeita. E seu filho vê eu te respeitar. Então eu acho que a gente precisa ter um respeito. Eu cumpro o meu dever. Olha, falam para não jogar papel na rua, eu fico com o papelzinho na mão. Quando eu vejo que ninguém viu, aí eu jogo.
26/06/1995|Dercy Gonçalves|209|[risos]|risos]
26/06/1995|Dercy Gonçalves|210|Marta Góes|Dercy, por que você quis escrever um livro?
26/06/1995|Dercy Gonçalves|211|Dercy Gonçalves|Eu não quis escrever, minha filha. Eu... Tudo na minha vida foi necessidade. Eu fiz esse livro... Falei assim, disse... Bom, eu pensei que livro dava para comer [risos], não dá nem para beber água [risos]. E então falei assim: “vou escrever um livro. Estou com 88 anos, vou escrever a minha vida. Quem quiser comprar, compra”. Não pensei que sairia um livro tão bom. Porque tive a sorte de encontrar a Maria Adelaide. Maria Adelaide é um gênio! O livro é mais dela do que meu, porque ela é que fez o livro. Gostei tanto do livro, me senti tão gloriosa, me senti tão realizada. Para mim foi a maior realização! A Viradouro [escola de samba do Rio de Janeiro], o samba: “Obrigado Dercy, Mercy! Dercy!” [canta]. Pô, aquilo para mim foi... Quando toca meu coração bate! Então Viradouro e meu livro. Eu fiz o livro, falei: “bom, vou ajudar minha filha, depois, a viver”, porque sou contratada da Globo, mas pela minha empresa. Não vou deixar rastro. Não deixo nada para a minha filha. Eu sou aposentada, não vou deixar nada para a minha filha. O que a minha filha ganha... ajuda, é o meu salário e é a minha aposentadoria. Não tenho nada para deixar para ela. Deixei o apartamento [em] que ela mora e mais algumas coisas, que eu estou feliz. Sou rica porque tenho tudo isso. Não tinha nada. Então eu digo: “vou fazer um livro [por]que, pelo menos, ela não precisa - com sessenta anos que ela já está - ser obrigada a se humilhar”. O livro dá 10%, 10% da renda. Então... Mas assim mesmo já vendeu, já está na sétima edição.
26/06/1995|Dercy Gonçalves|212|Marta Góes|Não te dá prazer que conheçam a sua história?
26/06/1995|Dercy Gonçalves|213|Dercy Gonçalves|Não, a minha história não pensei que desse prazer. Eu pensei que desse prazer a mim [risos] e fiquei me conhecendo também, porque não me conhecia.
26/06/1995|Dercy Gonçalves|214|Flávio de Souza|Você lembrou de coisas que você já tinha esquecido por causa...
26/06/1995|Dercy Gonçalves|215|Dercy Gonçalves|Não, eu nunca esqueci de nada meu. Mas não dava o valor... É aquele negócio, eu nunca fui convencida [de que]: “o que é meu é o que é bom”. Não, o que é meu é igual ao de todo mundo. É que as minhas coisas foram contadas com muita sinceridade, não foram contadas com invenção, nem com adendos para dar desfecho. O desfecho é exatamente o que era. Ela copiou tudo o que eu disse.
26/06/1995|Dercy Gonçalves|216|Matinas Suzuki Jr.|Dercy, você tem boa memória para o teatro, para a memorização dos textos? Como é que é?
26/06/1995|Dercy Gonçalves|217|Dercy Gonçalves|Não, eu tenho. Tenho... Eu faço textos, eu faço um texto de uma hora e vinte.
26/06/1995|Dercy Gonçalves|218|Matinas Suzuki Jr.|Você mesmo escreve texto hoje?
26/06/1995|Dercy Gonçalves|219|Dercy Gonçalves|Eu mesma escrevo... Eu não escrevo nada, [por]que eu não sei escrever. Eu dito [risos], eu não leio.
26/06/1995|Dercy Gonçalves|220|Matinas Suzuki Jr.|E depois você ouve e vai memorizando?
26/06/1995|Dercy Gonçalves|221|Dercy Gonçalves|Só ouvindo, eu ouço melhor do que leio. Ler, eu leio mal e me distraio. Eu estou assim: “padre nosso que estais no céu... Meu Deus, tenho que ir amanhã a São Paulo fazer...”. [risos] Embrulho tudo, não tenho persistência em concentração.
26/06/1995|Dercy Gonçalves|222|Matinas Suzuki Jr.|E durante a apresentação você muda o texto, esquece?
26/06/1995|Dercy Gonçalves|223|Dercy Gonçalves|Olha, que você sabe que durante a apresentação eu sou tomada. Eu sou tomada por um efeito qualquer que eu não sei o que é, não sou eu.
26/06/1995|Dercy Gonçalves|224|Zeca Camargo|Mas o que dá isso em você? É a risada do público? Você fala assim: “estou agradando, vou em frente!”?
26/06/1995|Dercy Gonçalves|225|Dercy Gonçalves|Não, quando ele não quer rir é que eu gosto. [risos] Aí eu vou fazer, eu vou fazer ele rir!
26/06/1995|Dercy Gonçalves|226|[risos]|risos]
26/06/1995|Dercy Gonçalves|227|Iara Jamra|Você quer fazer eles rirem!
26/06/1995|Dercy Gonçalves|228|Dercy Gonçalves|Eu faço eles rirem. Aí vou a fundo mesmo! Vou a fundo, com mais garra ainda! Eu sou terrível mesmo.
26/06/1995|Dercy Gonçalves|229|Maria Cristina Poli|Quando é que você mostra o teu corpo, assim... Que você se exibe...?
26/06/1995|Dercy Gonçalves|230|Dercy Gonçalves|Eu não! Eu quis mostrar! Mas aquela [revista] do coelhinho falou que não queria [risos]! Eu quis mostrar, [por]que ela me convidou... A... Como é que ela chama?
26/06/1995|Dercy Gonçalves|231|Matinas Suzuki Jr.|Revista Playboy.
26/06/1995|Dercy Gonçalves|232|Dercy Gonçalves|Playboy me convidou para fazer! Tenho retratos lindos, menina. Posso fazer um nu artístico lindo sem mostrar... Sem indecência e posso fazer com 88 anos. Vou tirar agora um book, eu mesma. Vou fazer um book no meu banheiro, nua no banheiro. Mas as necessidades a gente mostra, as infelicidades você não mostra, não mostra [risos].
26/06/1995|Dercy Gonçalves|233|Maria Cristina Poli|Você se acha sensual, Dercy?
26/06/1995|Dercy Gonçalves|234|Dercy Gonçalves|Não sei o que é isso. Nunca provoquei isso para ninguém, não. Sensual... Eu sou uma mulher esperta. Não sou burra. Agora, sensual...? Sensual, porra?
26/06/1995|Dercy Gonçalves|235|Zeca Camargo|Eu estou vendo você falar assim, das atrizes novas, que são muito bonitas e não estão lembrando que um dia vão ficar velhas. Você lembrava disso quando você era mais moça? Falava assim: “isso aqui vai acabar”, chegou a ser esperta?
26/06/1995|Dercy Gonçalves|236|Dercy Gonçalves|Nunca pensei em ficar velha. Nunca pensei. Por isso que eu digo: a gente não pensa que vai ficar velha. A gente, quando vai fazer quarenta anos, pensa que já esta acabando. Pensa que já está acabando: “já estou velha”. Pô, entra nos cinqüenta: “porra, já estou velha!”. Não está! Agora você imagina eu, com 88... Eu não me acho velha!
26/06/1995|Dercy Gonçalves|237|Marta Góes|Dercy, tem alguma coisa que você acha que não pode mais fazer?
26/06/1995|Dercy Gonçalves|238|Dercy Gonçalves|Tudo eu posso fazer. Não há nada que eu não possa fazer. Eu tenho cabeça, raciocínio, equilíbrio, inteligência.
26/06/1995|Dercy Gonçalves|239|Marta Góes|O físico está bom?
26/06/1995|Dercy Gonçalves|240|Dercy Gonçalves|Eu tenho memória ótima. Então tudo eu posso fazer. Não há nada que eu não possa fazer. Agora tem a discriminação dos sabidos - dos grandes astros da Globo, principalmente - que acham que a gente não pode fazer.
26/06/1995|Dercy Gonçalves|241|Sérgio Roveri|Quem que te ajuda hoje, Dercy? Você tem um empresário, uma secretária, alguém que...?
26/06/1995|Dercy Gonçalves|242|Dercy Gonçalves|Não, eu tenho quatro pessoas que me acompanham. Eu tenho a Elma, que é uma artista que quando eu mudo de roupa ela embroma. E tenho um secretário que passa para mim: “olha! Tenho um espetáculo lá no Brás de Pina você vai?”. [Eu digo]: “vou. Quanto é que ele cobra? Quanto que é? Quantas cadeiras tem?”. [Ele diz]: “tem seissentas”. [Pergunto]: “quanto é que ele vai cobrar?”. [Diz]: “vinte mil”. [Pergunto]: “quanto dá?”. [Ele diz]: “casa lotada. Dá seis milhões”. [Então eu digo]: “faz por três [milhões]”. [risos] É assim que eu vivo!
26/06/1995|Dercy Gonçalves|243|Iara Jamra|Dercy, o que você acha que é preciso para ser uma mulher de peito?
26/06/1995|Dercy Gonçalves|244|Dercy Gonçalves|De peito?
26/06/1995|Dercy Gonçalves|245|Iara Jamra|É, qualquer peito.
26/06/1995|Dercy Gonçalves|246|[risos]|risos]
26/06/1995|Dercy Gonçalves|247|Dercy Gonçalves|Não sei... Você, pra ser uma mulher de peito. É primeiro... Você precisa ter dignidade, isso é a primeira coisa. Dignidade no que você fala, você [precisa] se respeitar, não se avacalhar, não fazer mutreta, não fazer coisa que te envergonhe, se amar. [Fazendo] isso tudo, você chega a ser uma mulher de peito.
26/06/1995|Dercy Gonçalves|248|João Wady Cury|O que te levou, em uma época da tua vida, a fazer análise?
26/06/1995|Dercy Gonçalves|249|Dercy Gonçalves|Foi meu marido.
26/06/1995|Dercy Gonçalves|250|João Wady Cury|Porque a gente que te conhece, que te vê na televisão, no teatro; a gente fala: “como é que essa mulher deita num divã?”. Como é que foi? Você deitou no divã mesmo...?
26/06/1995|Dercy Gonçalves|251|Dercy Gonçalves|Não, não consegui [risos]. Eu virava com ele de frente, tinha medo dele.
26/06/1995|Dercy Gonçalves|252|João Wady Cury|Não, mas como é que começou? O que te levou a um analista?
26/06/1995|Dercy Gonçalves|253|Dercy Gonçalves|Quem me levou foi meu marido, porque o meu marido teve uma mãe que era doida. A mãe dele era doida. O pai levou ela ao doutor Henrique [Brito de Belford] Roxo [(1877-1969) psiquiatra], que era outro doido. Aí ele... Eu estava muito... Na menopausa eu fiquei muito... Uma vida tão tumultuada, como eu levei... Eu fiquei, na menopausa, muito perdida, muito atribulada, muito cheia de complexos de inferioridade com o que eu já tive. Não tive mãe, fui criada na rua, fui criada menina de rua, uma porrada de coisas... Eu não queria, brigava, xingava, tinha ciúmes, tinha ciúmes mórbidos, doentios, porra! Inveja, eu tinha tudo. Ele disse: “vai fazer análise”. [Perguntei]: “o que é isso, análise? O que é isso?”. [Ele disse]: “é análise”. [Pensei]: “porra! Não sei o que é isso, como é que eu vou fazer?”.
26/06/1995|Dercy Gonçalves|254|João Wady Cury|Você nunca tinha ouvido falar?
26/06/1995|Dercy Gonçalves|255|Dercy Gonçalves|Eu não! [Pensava]: "isso me cura? Então eu vou, quem eu vou? Doutor Henrique Roxo". Fui lá. Então falei para o doutor Henrique Roxo: “eu tenho isso, eu tenho aquilo”. [Ele diagnosticou] : “você tem complexo de reação”. Fiquei pior do que fui lá. [risos] Fiquei pior do que fui. Complexo de reação... Falei: “Danilo [Danilo Bastos, foi marido de Dercy], ele disse que eu tenho complexo de reação, o que é isso?”. [Ele respondeu]: “é... Você reage antes do tempo”. Ele me deu uma explicação... Eu fiquei me observando, só que eu tinha... Eu observei que eu tinha um bocadinho disso e até hoje eu tenho, porque ainda não saiu. Aí eu falei: “vou chamar outro”. Chamei doutor Geraldo Jucá [analista que mantinha consultório em sua casa no Leblon, segundo consta no livro de Dercy de cabo a rabo]. Fiz a... Aí é que foi a merda, aí é que eu fiz a transferência toda para ele, comecei a amar o cara... Puta merda!
26/06/1995|Dercy Gonçalves|256|Matinas Suzuki Jr.|Ficou apaixonada por ele?
26/06/1995|Dercy Gonçalves|257|Dercy Gonçalves|Mas apaixonada [faz cara de apaixonada, falando devagar]... Mas eu sonhava... Eu vinha do Rio Grande do Sul no meu dia marcado para fazer análise com ele.
26/06/1995|Dercy Gonçalves|258|Iara Jamra|Apaixonada!
26/06/1995|Dercy Gonçalves|259|Dercy Gonçalves|Fiquei, né?
26/06/1995|Dercy Gonçalves|260|João Wady Cury|Quanto tempo você fez análise com o doutor Jucá?
26/06/1995|Dercy Gonçalves|261|Dercy Gonçalves|Nove anos. Eu fiz nove anos. Não, fiz uns cinco anos com ele. Aí, um dia, tive uma crise - tudo mentira! [risos] [Falei]: “chame o médico para mim”. Armei a cama, botei luzes... O cara foi lá, sentou e me desmascarou. Olha... Fiquei com tanta vergonha! [Ele falou]: “você esta apaixonada por mim!”. [Respondi]: “eu?...”. Olha, eu senti falta de ar. Ele falou aquilo, eu fiquei numa vergonha...
26/06/1995|Dercy Gonçalves|262|Maria Cristina Poli|Aí começou a passar mal mesmo! [risos]
26/06/1995|Dercy Gonçalves|263|Dercy Gonçalves|Passei mal mesmo...
26/06/1995|Dercy Gonçalves|264|João Wady Cury|Mas não aconteceu nada entre vocês?
26/06/1995|Dercy Gonçalves|265|Dercy Gonçalves|Não. Ele era um cara bom!
26/06/1995|Dercy Gonçalves|266|Matinas Suzuki Jr.|Dercy, você diz no livro que tem duas coisas que valem a pena: a psicanálise e fazer plástica...
26/06/1995|Dercy Gonçalves|267|João Wady Cury|Tem alguma ordem de prioridade nisso?
26/06/1995|Dercy Gonçalves|268|[risos]|risos]
26/06/1995|Dercy Gonçalves|269|Dercy Gonçalves|Não... Eu acho que a plástica é uma necessidade. Você tem um vestido que você lava muito ele faz ponta, você tem que consertar, senão vão te chamar de relaxada. [Vão dizer]: “você é uma relaxada! Você não tem vaidade, porra!”. Se você pode tirar... Se a tecnologia te dá esse direito, faça! Fique linda sempre! Não é bonito você se olhar...? O diabo é que está todo mundo com a mesma cara! [risos] Parece que eu estou no Japão! [Estica o rosto com as mãos]
26/06/1995|Dercy Gonçalves|270|Iara Jamra|É o cirurgião que está na moda!
26/06/1995|Dercy Gonçalves|271|Dercy Gonçalves|Pode? Não pode.
26/06/1995|Dercy Gonçalves|272|Marta Góes|Dercy, além de plástica o que mais você faz para ter esse pique?
26/06/1995|Dercy Gonçalves|273|Dercy Gonçalves|Não faço mais nada. Eu fiz plástica a última vez eu tinha... Eu estava na Bandeirantes. Na Bandeirantes... ou na Record [ambas emissoras de TV]? Na Bandeirantes... Sei lá, na Record. Não sei bem... É um programa que eu fiz aí, que eu tinha... Quando eu saí da Globo fiquei meio perdida, andando por aí afora. Fiz e estava, mais ou menos, com setenta e poucos anos... 72, 73 anos, por aí. Nunca mais fiz. Agora quero assumir a minha idade. Acho linda a minha idade. Acho que eu, com 88 anos, sou espetacular [enfatiza] porque sou mulher que cruza pernas, sou mulher que tem umas pernas perfeitas, sou uma mulher que ainda é “comível” para quem gosta de comer com pimenta!
26/06/1995|Dercy Gonçalves|274|[risos]|risos]
26/06/1995|Dercy Gonçalves|275|Zeca Camargo|Alguma época da sua vida você não achou que você era uma mulher legal assim?
26/06/1995|Dercy Gonçalves|276|Dercy Gonçalves|Não, aos quarenta e poucos anos eu me senti uma bosta, me senti quando meu marido me disse: “você está velha! Você está velha. Tem que dar chance aos jovens”. Foi quando ele fez Society em baby-doll [(1957) peça de Henrique Ponguetti, cuja principal atriz era a belíssima Odette Lara] e não me botou... Eu não entrei. Eu dei a chance de entrar a Odette Lara [(1929) atriz, cantora e escritora.Seu nome é Odete Righi, mas adotou o nome artístico de Odette Lara. Participou do programa TV de vanguarda da TV Tupi e de novelas como A volta de Beto Rockfeller. Fez parte do Teatro Brasileiro de Comédia e estreou na peça dirigida por Adolfo Celi, Santa Marta Fabril S/A. Além da televisão, participou de algumas produções cinematográficas como Dona Violante Miranda e de espetáculos musicais de Vinícius], as mulheres bonitas daquela época. E fiquei olhando, fui fazer plástica. Enquanto elas estavam levando Society em baby-doll, que a empresa era do meu marido. E ali ele se apaixonou por uma delas, pela Odete. Não sei se a Odete gostou dele, mas ele se apaixonou por ela... Andei fazendo uns “esporrozinhos”, comecei a perceber que o caminho não era largar, era enfrentar. E a Clô Prado [atriz do Teatro Brasileiro de Comédia e diretora de teatro] também me ajudou muito. Pensei besteira... A Carla Civelli [(1921-1977) italiana radicada no Brasil, dirigiu espetáculos teatrais como O prazer da honestidade (1955) do Teatro de Arena. Também adaptou e traduziu peças como Electra e os fantasmas e A ronda dos malandros e, posteriormente, dirigiu filmes como É um caso de polícia (1959) e programas de televisão. Além disso, era casada com Ruggero Jacobbi, diretor, autor e cenógrafo italiano que foi de fundamental importância para o teatro brasileiro], também muito minha amiga [dizia]: “Dercy! Deixa de ser boba, teu marido é um pilantra!”. E eu comecei a ver, falei: “eu quero ir para o teatro de novo”. Aí botei ele para correr. Era o Teatro Cultura [construído em São Paulo no final da década de 1940 e inaugurado em 1950, com concertos de Heitor Villa-Lobos e Camardo Guarnieri], que era meu. Tive o Teatro Cultura dez anos nas minhas mãos.
