DATA|ENTREVISTA|ORDEM|LOCUTOR|FALA
26/06/1995|Dercy Gonçalves|1|[Programa gravado não permitindo a participação do telespectador]|Programa gravado não permitindo a participação do telespectador]
26/06/1995|Dercy Gonçalves|2|Matinas Suzuki Jr.|Boa noite! Ela é a dama das comédias do mais verdadeiro teatro brasileiro. Oficialmente, ela acaba de completar 88 anos mas contesta essa data no papel e na vida. “Não sou velha e estou uma beleza”, diz. No palco iluminado do Roda Viva de hoje está Dolores Gonçalves Costa, a nossa Dercy Gonçalves. O Roda Viva agradece a Rede Globo pela presença da Dercy Gonçalves esta noite no nosso programa. Para entrevistar a atriz Dercy Gonçalves nós convidamos esta noite o escritor e dramaturgo Flávio de Souza; Maria Cristina Poli, apresentadora do programa Vitrine da Rede Cultura; o repórter do jornal O Globo, João Wady Cury; Marta Góes, redatora-chefe da revista Cláudia; Zeca Camargo, editor da Folha Ilustrada da Folha de S. Paulo; o repórter Sérgio Roveri, do Jornal da Tarde; e a atriz Iara Jamra. O Roda Viva é transmitido em rede nacional por outras trinta emissoras de sul a norte do Brasil. Como este programa foi gravado, nós não recebemos perguntas dos telespectadores por telefone ou por fax. Boa noite, Dercy Gonçalves!
26/06/1995|Dercy Gonçalves|3|Dercy Gonçalves|Boa noite!
26/06/1995|Dercy Gonçalves|4|Matinas Suzuki Jr.|Você está muito elegante.
26/06/1995|Dercy Gonçalves|5|Dercy Gonçalves|É! Eu sempre fui de apurar bem a minha idade, a minha personalidade. Sempre fui muito vaidosa e não gosto de deixar a peteca cair. Eu já estava falando para as meninas aí: a mocidade de hoje não liga quando elas são jovens, pensam que nunca vão ficar velhas, então estão ficando feias. Feias agora, quando ficarem velhas vão botar chapéu verde na cabeça pra ficarem bonitas.
26/06/1995|Dercy Gonçalves|6|[risos]|risos]
26/06/1995|Dercy Gonçalves|7|Matinas Suzuki Jr.|Dercy, você está fazendo, agora, no Teatro João Caetano no Rio de Janeiro um novo espetáculo chamado Dercy Gonçalves: uma história, uma vida. Como é que é esse espetáculo?
26/06/1995|Dercy Gonçalves|8|Dercy Gonçalves|Não é nada de novo [risos]. É um espetáculo que eu tenho, esse espetáculo, há dez anos. Eu modifico... É como a Coppélia [ballet baseado na obra O homem de areia publicada por Ernst Theodor Wilhelm Hoffman (mais conhecido por E.T.A. Hoffman) em 1815. Estreou na Ópera de Paris em 1870 e foi o espetáculo mais representado na cidade], como A viúva alegre [a opereta mais famosa do mundo, cujo texto é de autoria de Viktor Leon e Leo Stein e as músicas, de Franz Lehár. Estreou em Viena em 1905 e, além de várias adaptações, foi transformada em filme em 1952], a Traviata [ópera italiana La Traviata de Giuseppe Verdi]... É a mesma coisa. É um espetáculo que você vai, olha e morre de rir e diz “nunca vi tão engraçado”. E você já assistiu muitas vezes. Esse é o meu espetáculo! Porque, do contrário, eu não levaria o espetáculo tantos anos se o espetáculo não fosse um [enfatiza] sucesso. Porque eu - com esta idade - não iria estar blefando ninguém, nesta idade não estaria fazendo picaretagem, nem chantagem com os meus companheiros, meus brasileiros. E eles vão e me aplaudem na entrada e na saída. Então, eu sou muito orgulhosa do meu espetáculo.
26/06/1995|Dercy Gonçalves|9|Matinas Suzuki Jr.|Dercy, você, nesse espetáculo, faz uma homenagem também a toda a sua carreira e às pessoas que trabalharam com você, essa coisa toda. Tem algum papel que você gostaria de fazer e que não fez?
26/06/1995|Dercy Gonçalves|10|Dercy Gonçalves|Não, eu não tenho papel nenhum! Eu não penso em nada, eu gostaria de trabalhar. Que é o mal que tem o brasileiro - eu não sei por que. Ele encosta um artista - [o] bom encosta - e começa a fabricar artista, como agora estão fabricando na Globo mesmo, em todo lugar. “É o maior! É não sei o quê!”... A tal de Babalu [refere-se à Letícia Spiller, que interpretou a personagem Babalu na novela Quatro por quatro em 1994, na Rede Globo]... Eu nem sei se aquela mulher é artista. Eu acho ela uma mulher linda! Aquela puta mulher. Mas não pode dar adjetivos [como os] que você está usando agora comigo. Ah, eu me sinto a Babalu! Então eu não gosto. Dê oportunidade aos novos, mas não ilumine tanto [por] que eles caem em borra lá de cima, né? Porque ficam convencidos, ficam impossibilitados de aceitar um negócio menor. Não estou falando para esculhambar - porque eu nada faço para esculhambar ninguém - faço para construir, faço para que eles entendam que estão maltratando os artistas que estão começando. Você primeiro aprende a engatinhar, primeiro aprende a andar de carrinho, depois anda com suas pernas. Não! “Ainda bem começou engatinhar! É o maior! Super! Hiper! Caceta, faz tudo!”. É um horror!
26/06/1995|Dercy Gonçalves|11|[risos]|risos]
26/06/1995|Dercy Gonçalves|12|Matinas Suzuki Jr.|Ô Dercy, como é que você começou? Como é que foi?
26/06/1995|Dercy Gonçalves|13|Dercy Gonçalves|O meu começo foi muito simples, muito humilde, como sou até hoje. O meu sucesso termina ali. Eu não sou... Se eu fosse uma convencida nessa turma que anda aí... Pô! Andaria dando gritos por todo lado, porque o meu espetáculo é um sucesso. O meu espetáculo é um achado. Mas sou uma pessoa que acha que amanhã é outro dia. Não sei se amanhã ainda estou viva, se amanhã eles ainda me querem, porque nada... Todo mundo, tudo é descartável.
26/06/1995|Dercy Gonçalves|14|Maria Cristina Poli|Dercy, desse pessoal novo que apareceu nessas últimas décadas, qual deles que te faz rir?
26/06/1995|Dercy Gonçalves|15|Dercy Gonçalves|Eu não acho graça em ninguém, porra! Eu acho tudo tão superficial. Eles querem a comédia, vão fazer comédia... Pensam que sair vestido de mulher, de veado, ficar dando porrada um no outro, que isso é comédia. Comédia não é isso!
26/06/1995|Dercy Gonçalves|16|Maria Cristina Poli|Mas não surgiu nenhuma boa comediante?
26/06/1995|Dercy Gonçalves|17|Dercy Gonçalves|Não! Tem muita gente boa, tem muita gente boa. Muita gente nova até que não é... Que não tem “confete” em cima, mas tem muita gente nova muito boa.
26/06/1995|Dercy Gonçalves|18|Sérgio Roveri|Dercy, se você fosse chamada para fazer, por exemplo, um programa tipo A escolinha da professora Dercy [refere-se ao programa Escolinha do professor Raimundo, que era interpretado pelo comediante Chico Anysio e tinha outros humoristas como alunos], quem que você...
26/06/1995|Dercy Gonçalves|19|Dercy Gonçalves|Eu não gosto de escolinha! Eu não gosto de ensinar nada a ninguém! Eu não sou professora! Gosto muito que me dêem um texto que eu possa desenvolver à vontade. Agora, porque o Chico Anysio tem uma escolinha, então começa essa porrada de escolinha em todo o lugar! É uma falta de imaginação danada das televisões do Brasil, das pessoas, dos diretores do Brasil! É uma falta de imaginação! Não criam nada, só copiam! É uma vergonha, sabe? Então, pára!!! Não fala mais em escolinha que me irrita. [risos]
26/06/1995|Dercy Gonçalves|20|Sérgio Roveri|Complementando a pergunta da Maria Cristina... Comediantes novos... Você gostaria de trabalhar com algum?
26/06/1995|Dercy Gonçalves|21|Dercy Gonçalves|Eu não tenho nada com isso, eu não vou dar opinião. Fica mal pra mim se eu esculhambar uma. Eu falo da Babalu, mas é porque a Babalu está começando hoje... Ela nem sabe [mas] eu estou dando cartaz a ela, estou dando cartaz a Babalu. Eu acho ela é uma gracinha de menina, mas pô... Eu falo Babalu porque Babalu é um nome engraçado. Podia ser uma Babacachu [risos]. Podia ser, mas Babalu é engraçadinho. Eu falo dela porque o nome é engraçado, mas não que eu discrimine. [Como dizem]: “essa vai matar a Dercy”; “essa acabou com a Dercy”; “ah... agora a Dercy se fodeu”. [risos]
26/06/1995|Dercy Gonçalves|22|Marta Góes|Mas, Dercy, tem muitas atrizes que se orgulham de dizer que são da sua linhagem.
26/06/1995|Dercy Gonçalves|23|Dercy Gonçalves|Ah, mas tem que se orgulhar! Porque o meu estilo eu criei, permaneceu e é o que está comandando... Porque o estilo não era esse não, meu bem. Eu duvido que a dona... uma atriz qualquer dessas aí "classudas", que não assoam o nariz... Como é que é? [Duvido] que elas aceitassem levar um pastelão na cara. Não, não aceitava! Dar uma gargalhada, levantar as pernas, deitar na cama de mau jeito a não ser com tudo... Eu duvido. Esse é o meu gênero: é um gênero irreverente, é um gênero que lancei e que tenho muito orgulho de ser a professora desse gênero no meu país.
26/06/1995|Dercy Gonçalves|24|Marta Góes|Você reconhece alguma herdeira, digamos assim, do seu estilo?
26/06/1995|Dercy Gonçalves|25|Dercy Gonçalves|Não, não tem! Herdeira igual a mim não tem, igual Pelé não tem, igual ao Einstein não tem. Não tem! Mas podem fazer o gênero. Todas elas todas, todas... Atores, Nanini [Marco Nanini], todos eles estão fazendo o meu gênero. Estão fazendo aquilo que Dercy Gonçalves fazia e que era recriminada, que chamavam de puta, [e diziam] “bota essa mulher na cadeia!”. Porque os meus filmes eram assim... Quando saía um filme meu, eu tinha até medo de sair na rua. Porque [diziam] : “bota ela na cadeia!”. A imprensa [dizia]: “não presta! É uma merda! Pa-ta-ti...”. E hoje é cultura essa porra toda.
26/06/1995|Dercy Gonçalves|26|Matinas Suzuki Jr.|Ô Dercy, há uma passagem em seu livro - Dercy de cabo a rabo - que me chamou particularmente a atenção, que é a seguinte: que essa imagem que você criou da mulher aberta, que fala o que pensa, que fala...
26/06/1995|Dercy Gonçalves|27|Dercy Gonçalves|[Interrompe] Eu não sou aberta, eu sou fechada.
26/06/1995|Dercy Gonçalves|28|Matinas Suzuki Jr.|Exato, e que você... Com os homens, você tinha um comportamento que era um comportamento tímido.
26/06/1995|Dercy Gonçalves|29|Dercy Gonçalves|Ninguém sabe como é que eu estava com os homens, porque eu não fazia público. Como é que eles inventam? Eu falei no livro? Não, o livro...
26/06/1995|Dercy Gonçalves|30|Matinas Suzuki Jr.|Que você era tímida.
26/06/1995|Dercy Gonçalves|31|Dercy Gonçalves|Eu sempre fui, porque, meu filho, minha vida foi na Praça Tiradentes [centro do Rio de Janeiro]. Então ali, na Praça Tiradentes, sabe como é que eu fazia? Levantava da cama para tomar meu café e ia para o botequim da Praça Tiradentes. Ficava sentada ali até aparecer um que pagasse.
26/06/1995|Dercy Gonçalves|32|Matinas Suzuki Jr.|Você tinha quantos anos?
26/06/1995|Dercy Gonçalves|33|Dercy Gonçalves|Minha juventude, minha mocidade, até entrar no esquema da Praça Tiradentes. Aí fui para o Teatro São José [Teatro Municipal de São Paulo. Esteve instalado em diversas regiões da cidade e era obrigado a se mudar constantemente por questões políticas. Em 1898, o teatro estava no Largo Municipal, foi incendiado e, depois disso, instalado em seu local definitivo, no centro da cidade, próximo ao Viaduto do Chá]... Teatro São José, perdi... Ali no Teatro São José fiz uma temporada de sucesso... [Diziam]: “Dercy Gonçalves. Quem é essa menina?”. Era cantora. [Diziam]: “quem é essa menina?”. Só que depois fiquei tuberculosa, fui para o sanatório e ninguém mais me quis, ninguém mais me quis! Trabalhava no circo, trabalhava em parque, trabalhava em tudo, levantava a minha saia, mostrava as minhas pernas... São boas, eu tenho as pernas boas para trabalhar! [Mas] não queriam! Até que eu resolvi casar. Casei com um jornalista, peguei um otário [risos]. Casei com um jornalista... Eu disse: “porra, mas o que é casar com um jornalista? Porque [é] ele que comanda essa porra toda... Então eu vou casar”. Aceitei. [Ele disse]: “ah, vamos trepar?”. [Respondi]: “não, senhor! Não trepo, só caso.” [risos] Casei no dia 31 de dezembro de 1942.
26/06/1995|Dercy Gonçalves|34|Matinas Suzuki Jr.|E aí começou a mudar?
26/06/1995|Dercy Gonçalves|35|Dercy Gonçalves|Fui a pé para o escrivão, lá na rua Dom Manoel [centro do Rio de Janeiro], voltei a pé, fomos comer uma feijoada, na Praça Tiradentes. Foi o casamento. Eu não fiz casamento, fiz um arranjo, um negócio para a minha vida.
26/06/1995|Dercy Gonçalves|36|Matinas Suzuki Jr.|Foi aí que você mudou o nome, você já usava Dercy Gonçalves?
26/06/1995|Dercy Gonçalves|37|Dercy Gonçalves|Eu sempre usei Dercy Gonçalves, desde que sai da minha terra. Porque, em primeiro lugar, tinha medo do meu pai. Do meu pai não deixar, do meu pai não querer... Porque era ser puta, ser artista. Mas eu, então, tirei logo o meu nome. Botei Dercy porque a Dona Darcy Vargas era uma mulher muito importante na época, muito importante mesmo, como sempre foi e eu gostava do nome dela. Aí Dona Maria [...] disse bota Darcy, mas já tem o Darcy... Tinha um Darcy Casarré. “Ah, bota Der...”. Eu queria ficar no “Dar” ou no “Der”. [risos] E fiquei!
26/06/1995|Dercy Gonçalves|38|Maria Cristina Poli|Você rompeu com a sua família, Dercy?
26/06/1995|Dercy Gonçalves|39|Dercy Gonçalves|Eu não rompi, eu não tinha família! Meu pai... eu tinha medo dele porque ele sempre dava muita porrada, me bateu muito. Ele sempre foi muito severo... Na época... Isso tem setenta anos.
26/06/1995|Dercy Gonçalves|40|Sérgio Roveri|Ô, Dercy... Essa maneira como as garotas, as atrizes da época eram vistas pela sociedade, isso mudava com o sucesso ou não? Depois que você passou a fazer sucesso...
26/06/1995|Dercy Gonçalves|41|Dercy Gonçalves|[Interrompe] Mas eu não sei o que é sucesso. Eu não sei o que é fracasso, eu não sei o que é sucesso. O fracasso é quando você morre de fome, você vai para um asilo, você começa a pedir. E sucesso é aquilo: você [se] asfixia com tanta mordomia e depois tira. Não tive nem uma coisa, nem outra, tudo meu foi brando. Tenho minhas coisas, eu não tenho nada demais, não sou rica, não sou remediada, não sou porra nenhuma. Eu sou... Eu tenho para viver... vivo com o que tenho. O negócio é você viver com o que tem. Então é um sucesso a sua vida! A minha vida é um sucesso por que se eu tinha pão com feijão, eu gostava, eu estava feliz. Se não tinha, se comia [...]. Mas também nunca fui muito... Eu gosto! Até hoje a minha comida é angu, carne seca, feijão e arroz.
26/06/1995|Dercy Gonçalves|42|Sérgio Roveri|A qualquer hora, né?
26/06/1995|Dercy Gonçalves|43|Zeca Camargo|Para falar um pouquinho de costumes, assim... há pouco tempo tínhamos uma mini-série de TV, chamada Engraçadinha [baseada na obra de Nelson Rodrigues e exibida pela Rede Globo em 1995], onde você via que tinha muita malandragem, muita sacanagem de algumas décadas.
26/06/1995|Dercy Gonçalves|44|Dercy Gonçalves|A Malandrinha [confunde o nome] era do Nelson Rodrigues, que ele fez na minha época. Ele fez na minha época essa Malandrinha. E eles agora estão botando... Exagerando um pouco.
26/06/1995|Dercy Gonçalves|45|Zeca Camargo|Isso é o que eu quero saber, não era daquele jeito?
26/06/1995|Dercy Gonçalves|46|Dercy Gonçalves|Não sei, porque eu não li.
26/06/1995|Dercy Gonçalves|47|Zeca Camargo|Você viveu aquela época. Naquela época...
26/06/1995|Dercy Gonçalves|48|Dercy Gonçalves|Mas era natural ser puta! Qualquer uma era puta! A gente era puta [...]. Não queria ser puta-puta [prostituta], eu era puta de teatro. De teatro eu tinha carteira, carteira da censura, carteira da polícia.
26/06/1995|Dercy Gonçalves|49|Zeca Camargo|E hoje em dia, aquela carteirinha significa a mesma coisa?
26/06/1995|Dercy Gonçalves|50|Dercy Gonçalves|Não sei... Hoje não! Hoje a gente nem tem censura. Hoje eles não têm moral para chamar a gente, “não pode fazer isso”. Pode é mandar proibir, mandar metralhar, mas não pode proibir de dizer palavrão. Eles são o próprio palavrão. Nunca tive medo deles, nunca tive medo de ninguém, não.
26/06/1995|Dercy Gonçalves|51|Flávio de Souza|E quando você descobriu que você era engraçada, Dercy?
26/06/1995|Dercy Gonçalves|52|Dercy Gonçalves|Eu não descobri. Foi sem querer... A necessidade, meu filho. A necessidade estava por lá, jogou a água e pulou. Então, o que aconteceu comigo, eu estava na Casa de caboclo [casa de espetáculos fundada em 1931 pela dupla Jararaca e Ratinho, Dercy Gonçalves, Duque e Pixinguinha] - conto no livro - quando fui fazer... Eu era cantora de igreja [enfatiza]. Era cantora séria, porra! Fiquei puta quando o Duque [Antônio Lopes de Amorim Diniz Miranda, dentista de formação dedicou-se à dança e criou coreografias e compôs canções que ficaram famosas, como o maxixe "Cristo nasceu na Bahia"] me chamou para substituir a Durvalina [Duarte, era uma das estrelas que atuava na Casa de caboclo] para fazer um “papelzinho” para dar entrada aos grandes atores [na verdade cantores e compositores] que eram Jararaca e Ratinho [Jararaca, José Luís Rodrigues Calazans, e Ratinho, Severino Rangel de Carvalho, formavam uma dupla de música caipira autores de sucessos de difusão na Rádio Nacional: Passarinho verde, Alma de tupi e Caboclo de raça]. Porra! Eu fiquei puta da vida! Ah, é... Eu acho um desaforo! Eu já era estrela, já sai da minha casa estrela! Nunca fui pilantra... Não aceito, não aceito! Até na Globo [enfatiza] se me mandam um papel que eu não gosto, devolvo! Enfia no cu [por] que não quero isso. [risos]
26/06/1995|Dercy Gonçalves|53|Iara Jamra|Você acha que quando uma mulher é engraçada... Você é uma mulher engraçada...
26/06/1995|Dercy Gonçalves|54|Dercy Gonçalves|[Interrompe] Eu sou uma mulher engraçada!
26/06/1995|Dercy Gonçalves|55|Iara Jamra|Graças a Deus, porque eu te adoro! Você acha que uma mulher, quando ela é engraçada, ela conquista os homens ou afasta os homens? Na hora de namorar...
26/06/1995|Dercy Gonçalves|56|Dercy Gonçalves|Não... Você sabe que o homem... eles têm um desprezo danado pela cômica, sabe? A mulher cômica é muito discriminada. Eles gostam mais do homem, não gostam muito de mulher cômica.
26/06/1995|Dercy Gonçalves|57|Iara Jamra|O homem engraçado é atraente. E a mulher?
26/06/1995|Dercy Gonçalves|58|Dercy Gonçalves|É atraente... [Com] A mulher cômica eles têm uma discriminação. Mas eu como nunca andei atrás de homem - porque pra mim eles não me fazem falta nenhuma, nunca me fizeram...
26/06/1995|Dercy Gonçalves|59|Maria Cristina Poli|[Interrompe] Nunca fizeram?
26/06/1995|Dercy Gonçalves|60|Dercy Gonçalves|Nunca me fez falta. Eu nunca dei importância a isso não. Mas que tem discriminação, tem. Para qualquer negócio não chamam mulher, chamam homem. Só quando não tem mais nada a fazer, então eles chamam. Eles têm coragem de chamar o homem para fazer veado, fazer bicha, fazer travesti, mas não chamam a gente nem para merchandising, nem para determinados negócios... Não chamam mulher cômica.
26/06/1995|Dercy Gonçalves|61|Marta Góes|Se você fosse homem, sua vida teria sido mais fácil, Dercy?
26/06/1995|Dercy Gonçalves|62|Dercy Gonçalves|Se eu fosse homem, odiaria. Adoro ser mulher! Adoro ser mulher! Sou uma feminista nata e sem título, porque gosto de ser mulher, aprecio a minha atitude, gosto de ser vaidosa. Imagina se fosse homem? Podia botar colar? Podia botar brinco? Ficariam todos discriminando. Podia botar a perninha de fora? Podia botar meia de seda? Como é lindo ser mulher! Mulher que pare. Não tem coisa mais linda que você ser criadora do mundo. É mulher! Mulher tem um valor espetacular. Como é que eu vou querer ser homem? Porra! Que enfia aquela banana e não faz mais nada?! [risos] Puta que pariu!
26/06/1995|Dercy Gonçalves|63|Matinas Suzuki Jr.|O que você acha das feministas?
26/06/1995|Dercy Gonçalves|64|Dercy Gonçalves|Eu acho elas umas babacas, porque as feministas ficam com um idealismo falso. Elas não enfrentam... Tudo tem marido, tudo tem.. [São] cortejadas, resguardadas. Vai enfrentar a vida como enfrentei: sozinha no mundo, sem mãe, sem pai! Estive um ano, quase, no sanatório. Só recebia visita do homem que foi o pai da minha filha, que me visitava. [Ele] me dava um beijinho, pagava as minhas contas. Esse homem - um homem só - que foi um santo. Sou uma mulher de muita sorte, tive esse homem. Agora, pô! Pra quê? Pra quê?
26/06/1995|Dercy Gonçalves|65|Maria Cristina Poli|Mas você foi apaixonada por ele, Dercy?
26/06/1995|Dercy Gonçalves|66|Dercy Gonçalves|Não, não fui! Mas, porra... O homem que te dá isso você não respeita profundamente? Ele foi o pai da minha filha. Depois que eu fiquei boa, ele veio me trazer e disse: “agora você vai viver a sua vida”. E me fez um pouco de carinho... Eu já estava acostumada, mas aí ele já queria trepar. Dei... Dava tudo que ele quisesse!
26/06/1995|Dercy Gonçalves|67|Maria Cristina Poli|Mas algum homem te virou a cabeça?
26/06/1995|Dercy Gonçalves|68|Dercy Gonçalves|Não, ninguém vira a minha cabeça. Eu nunca me virei. Eu enganei eles como eles me enganaram [risos]. Fui na onda, eles me enganaram, eu enganei. Ele trepou, eu trepei eles, foi tudo assim.
26/06/1995|Dercy Gonçalves|69|João Wady Cury|Os homens têm medo de você, você acha?
26/06/1995|Dercy Gonçalves|70|Dercy Gonçalves|Não sei se têm medo... Eu não me queixo se ele gosta ou se ele não gosta. Estou contando a ela o que sou. Eu acho o homem maravilhoso. Gosto de homem. Gostaria de ter um homem. Gostaria de ter um homem. Aquele homem que me respeitasse, aquele senhor [enfatiza] ao meu lado. Não cheio de asma como estou hoje! Cheio de gosma, não! Mas aquele homem que [dissesse]: “vamos fazer um passeio?”; “vamos fazer uma viagem?”; “vamos...”. [Que] eu chegasse para chorar as minhas mágoas perto dele. Às vezes até fingir, fazer charme, [por] que é bom ser gata, né? De vez em quando, enroscar é muito bom. Eu gostaria muito de [um] homem, acho homem um negócio muito [enfatiza] lindo, mas eu não quero.
26/06/1995|Dercy Gonçalves|71|Zeca Camargo|Mas esse homem existe? Que você está procurando... Para encostar e tudo...
26/06/1995|Dercy Gonçalves|72|Dercy Gonçalves|Existe, existe homem de todas as espécies. Homem bom, mau, grosseiro, delicado, meigo, chato, o homem que não é homem, que finge de homem, que toma no cu e finge que ele bota. Então essas coisas não me agradam.
26/06/1995|Dercy Gonçalves|73|[...]|Que tipo deles você encontrou mais, Dercy? Ou todos?
26/06/1995|Dercy Gonçalves|74|Dercy Gonçalves|Eu encontrei todos, encontrei quase tudo igual... Engraçado... Encontrei esse pai da minha filha. Primeiro porque fugi de casa... Era um homem garanhão. Mas ele já estava doente. Tanto era garanhão que ele me pegou. Sem responsabilidade nenhuma. Era um garanhão porque, pela lógica, ele não poderia me aceitar. Primeiro [por]que ele não sabia quem eu era: se era uma menina, puta, escrota, mau-caráter. Ele me pegou. Me aceitou, porra. Então ele era um garanhão sem conseqüência, mas teve consciência. Não foi um perverso comigo. Ele, naturalmente, viu a facilidade... Ele veio fazer sexo comigo. Estava pensando que eu já era treinada naquilo. Eu não sabia que aquilo existia, eu não sabia. Abre, abre, fecha, fecha, lambe, lambe, fica, fica. [risos]
26/06/1995|Dercy Gonçalves|75|Sérgio Roveri|Isso foi em Madalena [Santa Maria Madalena, sua cidade natal] ainda ou já foi no Rio [de Janeiro]?
26/06/1995|Dercy Gonçalves|76|Dercy Gonçalves|Não, já foi na estrada. Já foi na estrada. Não foi nem em Madalena e nem no Rio. Foi em Leopoldina. Fiquei com muito medo quando ele me enfia um negócio, que eu tive a impressão [de] que era um facão. Aquela dor... “Sentei o pé” e sai correndo pelo hotel afora. Fui parar na polícia. Eu e ele. Chegando lá a gente contou a história. Mas não era para ir preso nem para bater nele. Não queria mais aquilo e nunca mais tive nada com ele. Dormia com ele, comia com ele... Vivemos cinco anos até ele morrer. É, eu sou paciente! [risos]
26/06/1995|Dercy Gonçalves|77|Matinas Suzuki Jr.|Dercy, voltando um pouco ao seu casamento... Você disse que quando casou, a partir daí a sua vida começou a mudar. E como é que foi, então?
26/06/1995|Dercy Gonçalves|78|Dercy Gonçalves|Mudou de sociedade, porque eu era uma pilantrazinha da Praça Tiradentes, que trabalhava... Era pilantra num modo geral, mas nunca fui. Nunca fui. Era aquela pilantra que saia de casa... Aquela menina sem governo, sem ninguém que mandasse, sem orientação... Sentava no café, batia papo com um, batia papo com outro, pagava almoço... Um pagava o almoço, outro pagava o café e eu ia tirando a minha féria ali, quando eu não tinha dinheiro... Quando tinha, eu ficava um pouco no quarto. De noite lá, [se corrige] ali se faziam negócios, ali se contratava para circo, para show, para viajar para o interior. Era ali. Eu tinha que estar ali, não podia perder uma vez. Então ali eu acertei... [se corrige] Acertava a minha vida. Então... O que você perguntou?
26/06/1995|Dercy Gonçalves|79|Matinas Suzuki Jr.|Eu perguntei como é que começou, depois do casamento, como é que você começou a carreira artística?
