DATA|ENTREVISTA|ORDEM|LOCUTOR|FALA
28/11/2005|Eduardo Gianetti|143|Eduardo Giannetti| Eu jamais reduziria a riqueza da experiência religiosa a essa dimensão que eu estou destacando para análise no meu trabalho. Agora, esta dimensão está presente, e ela é muito usada como incentivo para sacrifícios no presente. As pessoas, realmente... os primeiros missionários cristãos que vieram aqui para a América do Sul usavam exatamente isso. Os índios tinham medo da morte e eles prometiam, inclusive, a vida eterna se eles acatassem a religião e vivessem como a religião ensinava. Essa era a moeda de troca. Os índios não ficaram muito convencidos, não é? O padre Antônio Vieira [(1608-1697), escritor e missionário jesuíta no Brasil, conhecido pelos seus sermões de alta qualidade literária] tem uma passagem memorável, dizendo que os "brasis" são muito incrédulos, porque, mesmo depois de crer, eles não crêem.
28/11/2005|Eduardo Gianetti|144|[risos]|[risos]
28/11/2005|Eduardo Gianetti|145|Gustavo Ioschpe| Quando você fala desses fatores estruturais históricos que criam o imediatismo de uma sociedade - no caso específico, eu acho que é a sociedade brasileira -, para que nós não fiquemos deprimidos, achando que essa é uma situação sem saída, há exemplos de países que tinham uma mentalidade imediatista e, talvez, até traduzida em juros altos e, depois, evoluíram e passaram para uma mentalidade mais ponderada e, conseqüentemente, para juros mais baixos? Talvez, até citando o exemplo dos escravos americanos: hoje, esses mesmos escravos não tomam juros nesse valor, mesmo já tendo acabado há muito tempo.
28/11/2005|Eduardo Gianetti|146|José Paulo Kupfer| Não em Nova Orleans, como a gente viu agora, mas...[referência aos efeitos do furacão Katrina, que devastou Nova Orleans, nos EUA, em 29 de agosto de 2005, e matou mais de 1400 pessoas; a população negra, mais pobre (e que perfazia três quatros da população da cidade), foi a mais atingida]
28/11/2005|Eduardo Gianetti|147|Eduardo Giannetti| Essas coisas mudam no tempo. Você pega o caso do Império Romano. A decadência do Império Romano levou a um aumento brutal de juros e a um imediatismo alucinado. O Brutus [(81-43 a.C.), general e político romano, foi governador de uma das províncias de Roma (a Gália Cisalpina, no norte da atual Itália); conhecido por ter assassinado Júlio César; Brutus, na verdade, viveu antes do início do Império] cobrava juros de 40, 60% ao ano, parece o Brasil. As pessoas começaram a roubar as pedras dos monumentos e das obras públicas para usar em casa. Não tinha mais nenhuma perspectiva de futuro. Os nobres romanos pararam de ter filhos, porque queriam de forma tão egoísta desfrutar o presente, que não tinham mais disposição para investir nas gerações futuras. Teve que ter uma lei dando incentivos econômicos a quem tivesse filhos em Roma.
28/11/2005|Eduardo Gianetti|148|Gustavo Ioschpe| Mas essa é uma mudança para pior.
28/11/2005|Eduardo Gianetti|149|Eduardo Giannetti| Para pior.
28/11/2005|Eduardo Gianetti|150|Gustavo Ioschpe| Você tem exemplos de mudanças para melhor?
28/11/2005|Eduardo Gianetti|151|Eduardo Giannetti| Eu tenho exemplo para melhor. Tenho o caso que eu peguei no livro, é o caso da Coréia [do Sul] no início do século XX. Tinha juros como o nosso, de 5%, 7% ao mês.
28/11/2005|Eduardo Gianetti|152|Gustavo Ioschpe| Onde é que se dá a mudança? Como mudar?
28/11/2005|Eduardo Gianetti|153|Eduardo Giannetti| No caso coreano, a Justiça - eles realmente deram uma reforma profunda no sistema judiciário, que era um dos grandes problemas de incerteza no mercado de crédito - e houve um fantástico investimento em educação e formação de capital humano, que a Coréia fez a partir dos anos 60. Então, realmente, um país como a Coréia mostra que, em um curto espaço de tempo, as coisas podem mudar. Agora, eu acho que cada cultura tem o seu próprio centro de gravidade e tem que encontrar o seu próprio termo de troca entre o presente e o futuro. Eu acho que a nossa cultura ainda não encontrou, mas eu não vejo o Brasil com uma vocação de sacrificar tanto o presente em nome de um futuro melhor quanto é o padrão asiático, por muitas razões. Agora, eu acho que nós ainda estamos devendo, realmente, em criar condições para que possamos afirmar a nossa diferença e os nossos valores. Eu acho que, até agora, nós não criamos realmente um espaço em que a escolha seja efetiva e não apenas a imposição de um passado de tolhimento, de falta de oportunidades de desenvolver talentos e competências.
28/11/2005|Eduardo Gianetti|154|[inserção de vídeo]|[inserção de vídeo]
28/11/2005|Eduardo Gianetti|155|Sérgio Lamucci [do jornal Valor Econômico]| Muitos economistas brasileiros são entusiastas do modelo asiático, baseado em juros baixos e câmbio desvalorizado, o oposto do que o Brasil vem fazendo nos últimos anos. É possível adaptar esse modelo para o Brasil tão facilmente como sugerem esses analistas ou eles subestimam alguns custos nessa transição, principalmente em termos de inflação? Outro ponto: a situação fiscal desse país não é muito mais confortável do que a brasileira, o que também ajuda a explicar por que eles crescem a taxas tão mais elevadas?
28/11/2005|Eduardo Gianetti|156|[fim da inserção de vídeo]|[fim da inserção de vídeo]
28/11/2005|Eduardo Gianetti|157|Eduardo Giannetti| As diferenças são muitas. Primeiro: eles têm capital humano; fizeram muito mais do que nós na acumulação desse ativo fundamental. Segundo: eles têm poupança. Esses países poupam 30%, 35% - no caso da China, até 40% da renda nacional -; nós poupamos 19%. E esses países tem instituições do lado jurídico, do marco jurídico legal, muito mais confiáveis e previsíveis que as nossas.
28/11/2005|Eduardo Gianetti|158|José Paulo Kupfer| A China tem marco jurídico melhor do que o nosso, Eduardo?
28/11/2005|Eduardo Gianetti|159|Eduardo Giannetti| Não, não, eu estou me reportando aos Tigres Asiáticos [países e territórios do Extremo Oriente com industrialização muito rápida desde a década de 1960, como Coréia do Sul, Taiwan, Cingapura e Hong Kong]. Mas a China poupa 40% do PIB.
28/11/2005|Eduardo Gianetti|160|[no trecho a seguir, as vozes de Eduardo Giannetti e José Paulo Kupfer se superpõem]|[no trecho a seguir, as vozes de Eduardo Giannetti e José Paulo Kupfer se superpõem]
28/11/2005|Eduardo Gianetti|161|José Paulo Kupfer| Os Tigres Asiáticos, também: você acha que a Coréia é uma democracia plena, clara, transparente?
28/11/2005|Eduardo Gianetti|162|Eduardo Giannetti| Tem estabilidade monetária...
28/11/2005|Eduardo Gianetti|163|José Paulo Kupfer| Você acha?
28/11/2005|Eduardo Gianetti|164|Eduardo Giannetti| ...tem estabilidade monetária, tem responsabilidade fiscal...
28/11/2005|Eduardo Gianetti|165|José Paulo Kupfer| Não, mas você acha que é uma democracia política plena?
28/11/2005|Eduardo Gianetti|166|Eduardo Giannetti| Não, não é!
28/11/2005|Eduardo Gianetti|167|José Paulo Kupfer| Claro que não é, claro que não é!...
28/11/2005|Eduardo Gianetti|168|Eduardo Giannetti| Eu acho que, em termos...
28/11/2005|Eduardo Gianetti|169|José Paulo Kupfer| É uma outra cultura...
28/11/2005|Eduardo Gianetti|170|Eduardo Giannetti| Concordo; eu acho...
28/11/2005|Eduardo Gianetti|171|José Paulo Kupfer| ...é quase uma ditadura, é ligeiramente diferente disso.
28/11/2005|Eduardo Gianetti|172|[fim do trecho com superposição de vozes]|[fim do trecho com superposição de vozes]
28/11/2005|Eduardo Gianetti|173|Eduardo Giannetti| Eu acho que a China tem um grande problema, que... em algum momento, eles vão ter que liberalizar o sistema político.
28/11/2005|Eduardo Gianetti|174|José Paulo Kupfer| Sem dúvida, sem dúvida...
28/11/2005|Eduardo Gianetti|175|Eduardo Giannetti| Na medida em que a população for se tornando próspera e demandar direitos civis e liberdade, eles vão ter que rever profundamente. Ninguém sabe como a China reage.
28/11/2005|Eduardo Gianetti|176|José Paulo Kupfer| Mas todo mundo investe lá um monte de dinheiro.
28/11/2005|Eduardo Gianetti|177|Eduardo Giannetti| Provavelmente vai ter crise sobre-investimento. É exatamente o contrário do nosso problema, que é subinvestimento. Está se criando muito mais capacidade de produção lá do que vai se mostrar rentável no futuro.
28/11/2005|Eduardo Gianetti|178|José Paulo Kupfer| E sem marco certo nenhum.
28/11/2005|Eduardo Gianetti|179|Gustavo Ioschpe| Não, o marco, quem garante é o governo totalitário. Você não precisa de instituições, não é?
28/11/2005|Eduardo Gianetti|180|Paulo Markun| Pergunta de Eduardo Guimarães, comerciante de São Paulo, que diz o seguinte: [lendo] “Ao mencionar sociedades extremamente injustas como a brasileira, você vê a possibilidade de haver uma mudança de mentalidade, devido à compreensão dos males que a injustiça social gera?” E ele menciona que os males a que ele se refere são, entre outros, a violência e a criminalidade, que não param de crescer. Quer dizer, a simples compreensão desses males pode gerar essa mudança?
28/11/2005|Eduardo Gianetti|181|Eduardo Giannetti| Eu diria que a experiência das dificuldades e a percepção de que áreas da nossa convivência estão se deteriorando tendem a gerar, na sociedade, forças de reação e de cobrança para que mude. E a democracia, felizmente, permite que esse processo se dê de uma forma natural, porque ela está calcada no princípio da renovação periódica dos governantes. [Na] União, Estados e Municípios, periodicamente, nós renovamos o nossos governantes.
28/11/2005|Eduardo Gianetti|182|Paulo Markun| Por falar em governantes, o atual governo federal - e o presidente [Luís Inácio] Lula [da Silva, presidente de 2003 a 2010], notadamente -, tem, digamos, incorporado ao seu discurso alguns argumentos que ele não utilizava no passado. Se você examinar a história dele enquanto líder de oposição, ele jamais mencionou o fato de que certas questões são demandas de gerações e que é preciso tempo, que é preciso paciência e que, ao chegar ao governo, ele se deu conta disso. Você acha que isso é positivo para a sociedade brasileira ou é apenas a tradicional reviravolta que acontece quando um político chega ao poder?
28/11/2005|Eduardo Gianetti|183|Eduardo Giannetti| É tão espantoso isso, não é? Como as pessoas mudam de percepção quando saem da oposição e se tornam situação. Coisas que elas negavam frontalmente e, de repente, passam a ser parte do seu discurso - e de uma forma espontânea. Eu não acho que isso é feito de forma deliberada ou com algum tipo de má consciência. É porque, realmente, a posição que se ocupa determina muito aquilo em que se acredita. O governo Lula mostra isso de uma maneira notável. Depois de décadas e décadas dizendo que seria muito fácil mudar o sistema...
28/11/2005|Eduardo Gianetti|184|Paulo Markun| Basta vontade política...
28/11/2005|Eduardo Gianetti|185|Eduardo Giannetti| ...[que] basta vontade política e tudo se transformará. Você o vê, hoje, falando coisas muito parecidas e muitas coisas que se falava no Brasil há tanto tempo.
28/11/2005|Eduardo Gianetti|186|Marcio Aith| Eduardo, qual é o significado, no seu ponto de vista das trocas intertemporais - você acabou de mencionar o presidente Lula -, dessa inovação do crédito consignado? O Reinaldo até mencionou o crédito consignado; acho que foram concedidos trinta milhões de reais, já. Isso, à primeira vista, parece um grande avanço - porque os juros foram reduzidos para 2% ao mês, o que, para os padrões brasileiros é fantástico -, mas, considerando os ex-escravos americanos, que foram protegidos na pátria do capitalismo, e um ex-sindicalista aqui no Brasil, [que] deu esse presente fantástico... Como é que, sem querer vitimizar as pessoas que tomam crédito - certamente sabem o que estão fazendo -, mas qual é o significado do crédito popular no Brasil, do crédito consignado, sob o ponto de vista da visão de futuro da troca intertemporal?
28/11/2005|Eduardo Gianetti|187|Eduardo Giannetti| Eu acho incrivelmente alto o juro que está se cobrando nesse crédito em que o risco é tão baixo.
28/11/2005|Eduardo Gianetti|188|[...]| É quase zero.
28/11/2005|Eduardo Gianetti|189|Eduardo Giannetti| É quase zero, é muito pequeno, o risco. 2 a 3% ao mês de juros é um juro anual em um país civilizado; aqui se paga ao mês! As pessoas, eu acho que não se dão conta. É uma conta simples: [com] 3,5% de juros ao mês, a dívida dobra em vinte meses. Se você pegar [emprestado] cem [reais] pagando 3,5% ao mês, daqui a vinte meses será uma dívida de duzentos. Eu temo que essa questão do crédito consignado, especialmente na modalidade INSS [Instituto Nacional do Seguro Social], vai gerar enormes conflitos no sistema judiciário, na Justiça.
28/11/2005|Eduardo Gianetti|190|[sobreposição de vozes]|[sobreposição de vozes]
28/11/2005|Eduardo Gianetti|191|Reinaldo Azevedo| Já há problemas...
28/11/2005|Eduardo Gianetti|192|Eduardo Giannetti| Pois é.
28/11/2005|Eduardo Gianetti|193|Reinaldo Azevedo| ...já há estudos sobre inadimplência, que vai se...
28/11/2005|Eduardo Gianetti|194|Eduardo Giannetti| Imagine a hora em que um idoso perceber que ele gastou renda futura e, muitas vezes pressionado pelos familiares - porque é uma relação muito delicada; imagine os familiares, o neto precisando de um carro, a filha precisando de uma plástica, sei lá -, a hora em que estiver cobrando os juros e o principal dessa dívida direto na folha do INSS - o cidadão nem tem liberdade de escolher se paga ou não – e começar a faltar dinheiro para o remédio. Vai dar problema!
28/11/2005|Eduardo Gianetti|195|Reinaldo Azevedo| Eduardo, você faz uma metáfora no seu livro entre... Cita a miopia e a hipermetropia. É claro que o bom é enxergar bem - eu que o diga, eu que não enxergo...
28/11/2005|Eduardo Gianetti|196|Eduardo Giannetti| [risos] Eu, também. [ambos usam óculos]
28/11/2005|Eduardo Gianetti|197|Reinaldo Azevedo| É. Então, no caso do míope, do apressadinho, a imagem formando antes da retina; e, daquele que tem hipermetropia, depois da retina. O míope, querendo ter todos os prazeres já; e, aquele que tem hipermetropia - o hipermétrope, não é? -, no caso, não conseguindo gozar nunca; como diria o Tomás Antônio Gonzaga [poeta e ativista político luso-brasileiro, autor de Marília de Dirceu], “as glórias que vêm tarde, já vêm frias”.
28/11/2005|Eduardo Gianetti|198|Eduardo Giannetti| [risos]
28/11/2005|Eduardo Gianetti|199|Reinaldo Azevedo| [consultando anotações] O Brasil, em doze meses, cada meio ponto de juro custa 2,6 bilhões. Até outubro, a gente pagou 95,055 bilhões de juros - eu trouxe os números aqui, eu trouxe a minha colinha...
28/11/2005|Eduardo Gianetti|200|José Paulo Kupfer| Reinaldo, é 133. E noventa e tanto, foi o superavit fiscal.
28/11/2005|Eduardo Gianetti|201|Reinaldo Azevedo| Exatamente, exatamente, o superavit foi...
28/11/2005|Eduardo Gianetti|202|José Paulo Kupfer| De juros, foram 133 [bilhões].
28/11/2005|Eduardo Gianetti|203|Reinaldo Azevedo| Exatamente: superavit 95, pagou-se 133. Fez-se um superavit gigantesco, que é de 5,97% [do PIB], certo, Kupfer?
28/11/2005|Eduardo Gianetti|204|José Paulo Kupfer| 6% do PIB.
28/11/2005|Eduardo Gianetti|205|Reinaldo Azevedo| 6%, e não se pagou nem a conta dos juros. Por mais que eu concorde com o [Antônio] Palocci [ministro da Economia de 2003 a 2006] e também seja contra a ministra Dilma [Rousseff, ministra das Minas e Energia de 2003 a 2005 e depois ministra-chefe da Casa Civil] – ficar enfiando a mão no Tesouro, como os paloccistas dizem, para fazer a reeleição do presidente Lula -, a verdade é que há um problema aí. É miopia, é hipermetropia, é presbiopia, é tudo junto, é absoluta falta do que fazer de proposta; porque aqui há uma outra coisa: [consultando anotações] em 2003, em que a economia cresceu meio pontinho, a dívida era de 57,2% do PIB; em 2004, em que cresceu quase 5%, era 51,7%; em 2005 - talvez cresça 3% ou um pouquinho menos - está em 51,5%. O esforço é gigantesco...
28/11/2005|Eduardo Gianetti|206|Eduardo Giannetti| Os juros não se pagam.
28/11/2005|Eduardo Gianetti|207|Reinaldo Azevedo| ...os juros não se pagam, o ministro é míope...
28/11/2005|Eduardo Gianetti|208|Eduardo Giannetti| Vamos por partes, Reinaldo. Você está levantando muitas questões, eu queria pegar algumas. Vamos lá. Primeiro, essa definição de que o superavit primário é o dinheiro que o governo economiza para pagar juros não faz sentido. Na verdade, o superavit primário é o resultado que o governo obtém para impedir que a dívida continue crescendo. O dinheiro não é carimbado. Você podia descrever o superavit primário como o dinheiro que o governo economiza para pagar o deficit da Previdência. Por que isolar o juro e achar que o juro é o grande pepino? É, também...
28/11/2005|Eduardo Gianetti|209|[...]| Mas, na prática, não é a mesma coisa?
28/11/2005|Eduardo Gianetti|210|Eduardo Giannetti| Não, não, é diferente. O importante, do ponto de vista de finanças públicas, é saber se o grau de endividamento do Estado brasileiro cresce, está estável, ou declina.
28/11/2005|Eduardo Gianetti|211|Reinaldo Azevedo| Mas, Giannetti, não tem um problema...
28/11/2005|Eduardo Gianetti|212|Eduardo Giannetti| Agora, nós vimos a questão dos juros; deixa eu completar, porque tem mais um ponto. Tem duas correntes de opinião no Brasil sobre a questão dos juros primários. Nós não estamos falando dos juros no mercado de crédito livre.
28/11/2005|Eduardo Gianetti|213|Reinaldo Azevedo| Não, não.
28/11/2005|Eduardo Gianetti|214|Eduardo Giannetti| Estamos falando dos juros primários, vamos demarcar. Tem duas correntes de opinião. Primeira: os juros altos são a causa dos nossos males; eles representam ou uma grande barbeiragem do Banco Central ou, então, o fato de que os banqueiros estão dando as cartas e capturaram o governo, o governo está vendido para os banqueiros, facilitando a vida...
28/11/2005|Eduardo Gianetti|215|Reinaldo Azevedo| É possível ser mais um pouquinho sofisticado. Giannetti...
28/11/2005|Eduardo Gianetti|216|Eduardo Giannetti| ...ou, então, o Banco Central é sádico...
28/11/2005|Eduardo Gianetti|217|Reinaldo Azevedo| ...sabe o que é? Não, não, não, espere aí...
28/11/2005|Eduardo Gianetti|218|Eduardo Giannetti| Não, deixe eu completar, deixe eu terminar. Essa é a primeira corrente. Tem várias interpretações, mas a idéia é a seguinte: o problema, a causa dos nossos problemas, são os juros. A outra corrente...
28/11/2005|Eduardo Gianetti|219|Reinaldo Azevedo| Mas assim não se banaliza um pouco a crítica? Porque...
28/11/2005|Eduardo Gianetti|220|Eduardo Giannetti| A outra corrente - deixe-me dizer a outra -, a outra corrente é o seguinte: os juros são altos e isso é sintoma de outros desequilíbrios, que terão de ser corrigido para que nós possamos baixá-los de forma consistente, sem aceleração inflacionária.
28/11/2005|Eduardo Gianetti|221|Reinaldo Azevedo| Os juros não podem ser altos porque se aplica mal, por exemplo, o sistema de metas de inflação?
28/11/2005|Eduardo Gianetti|222|Eduardo Giannetti| Bom, se você mudar a meta de inflação...
28/11/2005|Eduardo Gianetti|223|Reinaldo Azevedo| Porque esse meio ponto custa tão caro...
28/11/2005|Eduardo Gianetti|224|Eduardo Giannetti| Se você mudar a meta de inflação para... está em 5%, 4,5%; se você aumentar para 12%...
28/11/2005|Eduardo Gianetti|225|Reinaldo Azevedo| Já está descendo.
28/11/2005|Eduardo Gianetti|226|Eduardo Giannetti| ...as expectativas de inflação futura vão rapidamente se acomodar a isso e você só retrocedeu. É como uma guerra de trincheira, em que a guerra está muito complicada, está muito apertada: em uma linha, você fala “não, vou retroceder!”; aí você retrocede para uma trincheira mais atrás; depois de algum tempinho, a guerra continua exatamente a mesma, com a única diferença que você retrocedeu. O que nós temos que entender é o seguinte: por que é que o juro neutro no Brasil é tão alto.
28/11/2005|Eduardo Gianetti|227|Reinaldo Azevedo| Por que está tão alto?
28/11/2005|Eduardo Gianetti|228|Eduardo Giannetti| Porque tem outros desequilíbrios. A causa original desse problema não é o juro, o juro é um sintoma de outros desequilíbrios. Nós temos um Estado que arrecada, por baixo, 37% do PIB, que não tem nenhuma capacidade de investimento e, ainda por cima, tem um deficit nominal, em um ano normal, de 2,5% a 3% do PIB, um Estado pelo qual transitam 40% da renda nacional brasileira e, ainda por cima, não consegue atender as demandas de políticas públicas nas áreas mais fundamentais. Você tem um problema enorme aí: a poupança do setor privado, que poderia estar financiando crescimento, que poderia estar financiando crédito para investimentos, está sendo deslocada para financiar gastos correntes do setor público. O setor público, endividado, tem uma péssima reputação de pagador, porque já deu todo o tipo de calote e tramóia para mudar a correção monetária etc. Então, se nós não resolvermos esse problema do deslocamento, da drenagem de recursos da sociedade, do setor privado, para financiar gastos correntes do setor público, vai continuar um sistema muito [inaudível].
28/11/2005|Eduardo Gianetti|229|Paulo Markun| E isso é gastar menos, o setor público gastar melhor...?
28/11/2005|Eduardo Gianetti|230|Eduardo Giannetti| Pelo menos gastar melhor, pelo menos gastar melhor. Eu acho que, realmente, deveríamos caminhar para gastar menos.
28/11/2005|Eduardo Gianetti|231|José Paulo Kupfer| [inaudível; fala junto com Giannetti] ...é cortar a Previdência? Que é uma coisa enorme...
28/11/2005|Eduardo Gianetti|232|Eduardo Giannetti| Qual é a [...] de cortar a Previdência?
28/11/2005|Eduardo Gianetti|233|José Paulo Kupfer| ...é metade da conta de juros.
28/11/2005|Eduardo Gianetti|234|Eduardo Giannetti| Nós temos um sistema de Previdência de um país demograficamente maduro, sendo que nós não o somos, e, ainda por cima, não financiamos a Previdência adequadamente. Por quê? Porque a informalidade no setor privado... boa parte das contribuições que deveriam estar financiando o nosso sistema, no caso do INSS, não estão.
28/11/2005|Eduardo Gianetti|235|José Paulo Kupfer| Eduardo, por que é que a gente fala tanto, e os economistas mais liberais falam tão mais, que a carga tributária é muito elevada - e é mesmo - e a discussão da qualidade dessa carga, ou seja, da regressividade estúpida dessa carga, que reduz renda disponível lá em baixo - você pede que as pessoas poupem, não conseguem; estão sendo regressivamente, quer dizer, injustamente taxadas, se taxa mais aqui o pobre do que o rico [palavra inaudível] -, por que é que não se discute isso, Eduardo?
28/11/2005|Eduardo Gianetti|236|Eduardo Giannetti| Eu acho que tem que se discutir, você tem toda a razão.
28/11/2005|Eduardo Gianetti|237|José Paulo Kupfer| Mas por que só se fala nos 37, nos 40%? Por que esta questão, [de] que poucos pagam, e pagam até muito, e a maioria, sem saber, paga excessivamente sem poder pagar?...
28/11/2005|Eduardo Gianetti|238|Eduardo Giannetti| Eu acho que seria muito interessante explicitar...
28/11/2005|Eduardo Gianetti|239|José Paulo Kupfer| ...Por que é que isso não é uma questão mais...
28/11/2005|Eduardo Gianetti|240|Eduardo Giannetti| ...é uma questão muito pedagógica explicitar para a população quanto ela está pagando de impostos a cada operação de compra que faz.
28/11/2005|Eduardo Gianetti|241|Paulo Markun| Há algumas tentativas do tipo: Feira do Imposto do Sebrae [Serviço de Apoio às Micro e Pequenas Empresas], das Federações de Juros.
28/11/2005|Eduardo Gianetti|242|Eduardo Giannetti| É, em conta de telefone está discriminado, mas é muito... Seria muito interessante, para as pessoas, saberem.
28/11/2005|Eduardo Gianetti|243|José Paulo Kupfer| Todos os países com os quais são feitas comparações de carga tributária, ou coisa e tal, funcionam exatamente na contramão do que nós funcionamos: têm impostos diretos, imposto de renda e tudo mais.
28/11/2005|Eduardo Gianetti|244|Eduardo Giannetti| Tem muito.
28/11/2005|Eduardo Gianetti|245|José Paulo Kupfer| ...muito mais alto que... enfim, arrecadam muito mais do que os indiretos. Aqui é tudo ao contrário.
28/11/2005|Eduardo Gianetti|246|Eduardo Giannetti| [inaudível; fala junto com Kupfer] ...o sistema tributário tem componentes de regressividade. Eles agravam a distribuição de renda. E o gasto público, na outra ponta, também é regressivo: 20% do orçamento de educação no Brasil, do setor público, vai para os ricos, nas escolas superiores, supostamente gratuitas.
28/11/2005|Eduardo Gianetti|247|Mara Luquet| Eduardo, a gente não está colocando, aqui, elementos que que montam uma “bomba” para o futuro? Quando a gente junta esses elementos do juro pago pelo governo, do juro pago pelo consumidor, de uma sociedade educada - porque nós não estamos falando de miseráveis, nós estamos falando da classe média que se endivida a 150% no cheque especial para fazer compras, para comprar um carro financiado, um carro [pelo qual] ela abre mão da independência financeira dela, uma classe média que vai viver mais e que não vai ter um Estado para bancar isso -, a gente não está formando uma coisa meio perigosa para o futuro, um cenário sombrio?
