DATA|ENTREVISTA|ORDEM|LOCUTOR|FALA
28/11/2005|Eduardo Gianetti|248|Eduardo Giannetti| É, vai ser um processo de aprendizado doloroso. As pessoas que estão tomando crédito afoitamente - e houve um “bum” de crédito no Brasil nos últimos dois anos; é crescente o grau de endividamento com esses juros -, eu acho que vão aprender que estão gastando renda futura. É um processo doloroso.
28/11/2005|Eduardo Gianetti|249|Mara Luquet| E o governo não vai ter também, não vai ter...
28/11/2005|Eduardo Gianetti|250|Eduardo Giannetti| O governo, a duras penas, está fazendo o superavit primário, está com o juro ainda muito elevado para manter a dívida simplesmente equilibrada, para não crescer mais. A estabilização monetária, no Brasil, é incompleta, ainda, por incrível que pareça. Tantos anos se passaram e nós ainda estamos pendurados em juros primários muito elevados, porque, se o governo, intempestivamente, baixar os juros...
28/11/2005|Eduardo Gianetti|251|Paulo Markun| Desanda.
28/11/2005|Eduardo Gianetti|252|Eduardo Giannetti| ...ou nós temos inflação ou nós temos crise no balanço de pagamentos. Então, nós vamos ter que criar condições... Eu não sou tão fatalista e tão pessimista quanto você; agora, eu acho que, aos poucos, as coisas vão ter que se encontrar e vão ter que começar a se corrigir. Porque, de fato, você tem aspectos preocupantes em relação ao futuro no Brasil.
28/11/2005|Eduardo Gianetti|253|Paulo Markun| Eduardo...
28/11/2005|Eduardo Gianetti|254|Eduardo Giannetti| E não é à toa que eu me interessei por esse assunto. Eu fui por esse assunto porque eu também me preocupo. Eu compartilho... veja, nós estamos no século XXI com um terço dos domicílios no Brasil sem saneamento. É quase espantoso que isso tenha acontecido. O Brasil fez opções de construir uma nova capital, de fazer programa nuclear e não resolveu problemas elementares de saneamento básico: 31% dos domicílios, na última Pnad [Pesquisa Nacional por Amostra de Domicílios], que saiu essa semana, não têm saneamento. Isso, num país que desconta o futuro e que vive um imediatismo, é muito preocupante. É uma questão de saúde pública, antes de mais nada, a questão de saneamento.
28/11/2005|Eduardo Gianetti|255|Paulo Markun| Eduardo, eu fico pensando o seguinte: eu sempre fui daqueles que atuaram mais; eu era uma “formiga cigarrante”, talvez, quer dizer, trabalhava que nem formiga, mas jamais pensei que um dia ia passar dos 50; já passei. Mas eu penso o seguinte: uma boa parte da sociedade brasileira que tem condições de organizar o seu futuro, de pensar no amanhã etc e que não pensou, deve passar pela cabeça dessas pessoas a mesma coisa que eu: será que adianta de alguma coisa você organizar o seu departamento se o departamento do país não está organizado? Ou seja, determinadas questões não dependem muito mais de decisões coletivas, de decisões governamentais? Porque, está bem, eu posso resolver o meu pequeno mundo, mas terá que ser com carro blindado, morando provavelmente em um apartamento cheio de segurança, botando os filhos para estudar no exterior, como muita gente da alta classe média faz. Tem como resolver essas questões?
28/11/2005|Eduardo Gianetti|256|Eduardo Giannetti| Eu acho que, em parte, você tem toda a razão: existem muitas questões que o cidadão, isoladamente, não tem como resolver. Agora, eu não generalizaria “tudo ou nada”. Há muitas coisas que, ao cidadão e à sua família e à sua perspectiva, permitem adequadamente transferir recursos do presente para o futuro. Aí, depende da questão.
28/11/2005|Eduardo Gianetti|257|Paulo Markun| Mas, de alguma forma, você não vai estar colaborando em uma vírgula para resolver o problema do país, porque certamente você vai ser mais um rentista que vai viver de juros.
28/11/2005|Eduardo Gianetti|258|Eduardo Giannetti| Mas você poupou, você está cedendo recursos para que a sociedade utilize. O poupador, na verdade, está abrindo mão de coisas que ele poderia estar queimando no presente para melhorar o seu futuro. E a sociedade atribui um valor a isso, tanto que paga. Então, o processo é esse.
28/11/2005|Eduardo Gianetti|259|Paulo Markun| Quer dizer, carimbar o rentista de mau brasileiro não é um bom negócio, não está certo?
28/11/2005|Eduardo Gianetti|260|Eduardo Giannetti| Se o dinheiro for obtido legitimamente pelo trabalho, uma pessoa que poupou e preparou um pé de meia para poder viver com mais conforto na velhice, eu não vejo o que ela pode estar fazendo de errado. Eu acho que essa pessoa mostrou grande capacidade de planejamento e, socialmente, ela está contribuindo, na medida em que ela cede recursos, dos quais ela poderia desfrutar instantaneamente, para que a sociedade financie outros projetos. Agora, aí começam os problemas: no Brasil não tem poupança de longo prazo denominada em real. As pessoas não confiam ainda na nossa moeda para fazer compromissos de longo prazo em ativos, em real.
28/11/2005|Eduardo Gianetti|261|Paulo Markun| Há vagas tentativas agora, com algumas coisas...
28/11/2005|Eduardo Gianetti|262|Eduardo Giannetti| É, o poupador brasileiro, ele...
28/11/2005|Eduardo Gianetti|263|Paulo Markun| BNDES [Banco Nacional de Desenvolvimento Econômico e Social]...
28/11/2005|Eduardo Gianetti|264|Eduardo Giannetti| Não, mas, aí, é um crédito livre, é um crédito... o fundo do BNDES é compulsório, é o FAT [Fundo de Amparo ao Trabalhador] - aliás, muito mal remunerado - e o empréstimo do BNDES não é um contrato de mercado livre.
28/11/2005|Eduardo Gianetti|265|Paulo Markun| Ah, não, mas o BNDES, se não me falha a memória, tem agora um esquema de você tornar-se cotista, acionista...
28/11/2005|Eduardo Gianetti|266|Eduardo Giannetti| Ah bom, você está pensando das ações, está certo. Mas o poupador brasileiro - só para completar -, o poupador brasileiro ainda está com a psicologia que é, mais ou menos, a seguinte: “A festa está boa, mas é bom ficar perto da porta.” Ninguém quer entrar muito lá no fundo, ou seja, ter poupança em reais com ativos em longo prazo.
28/11/2005|Eduardo Gianetti|267|José Paulo Kupfer| Eduardo...
28/11/2005|Eduardo Gianetti|268|Eduardo Giannetti| As pessoas evitam isso e estão ressabiadas, ainda.
28/11/2005|Eduardo Gianetti|269|Paulo Markun| Com motivos, com motivos.
28/11/2005|Eduardo Gianetti|270|José Paulo Kupfer| Aquele exemplo que você deu para o próprio Gustavo, aqui, na Folha, no domingo: [olhando suas anotações] você propõe um exercício, para se ver se a melhor resposta aos que vêem nos juros primários muito elevados como uma conspiração das elites é convidá-los a um pequeno experimento mental: se o Banco Central reduzisse a taxa de juros a 6% reais, o que ocorreria em seguida? Infelizmente, você não responde aqui, mas eu quero te propor esse exercício em uma situação em que você tem capacidade ociosa, uma situação não tão óbvia, que você vai dizer: vai dar inflação. Será que não dá para a gente experimentar isso aqui, não?
28/11/2005|Eduardo Gianetti|271|Eduardo Giannetti| Vamos olhar um pouquinho para trás, José Paulo: 2004. O Brasil viveu uma recuperação cíclica, a terceira desde o início do Plano Real.
28/11/2005|Eduardo Gianetti|272|José Paulo Kupfer| Sim, sim.
28/11/2005|Eduardo Gianetti|273|Eduardo Giannetti| O que ocorreu em outubro, a partir do final do ano? Ficou claro que a meta de inflação em 2005 estava correndo um sério risco de não ser cumprida. O Banco Central do Brasil fez exatamente o que um ex-presidente do Federal Reserve Bank americano [o Fed] dizia que é o papel do Banco Central, que não é uma coisa agradável: o papel do Banco Central é tirar o barril de chopp quando a festa começa a ficar animada. Porque, se continuar rolando - e alguns nessa altura, propunham trocar o barril de chopp pelo barril de pinga; por exemplo, o nosso vice-presidente da República -, a festa vai degringolar e depois vai vir uma ressaca monumental. Nós estaríamos fazendo o Roda Viva, aqui, sobre um novo plano de estabilização.
28/11/2005|Eduardo Gianetti|274|José Paulo Kupfer| Se baixar os juros para 6% reais.
28/11/2005|Eduardo Gianetti|275|Eduardo Giannetti| Porque a festa... na recuperação cíclica de 2004, a demanda começou a crescer em um ritmo [ao qual] não tem capacidade de oferta na economia para atender. Se o Banco Central não esfria a economia - e ele esfria a economia aumentando os juros e, por tabela, apreciando o real, que é uma outra conseqüência desse movimento -, nós estaríamos hoje com a meta de inflação totalmente estourada, a aceleração em forte expansão da inflação e estaríamos discutindo um novo plano de estabilização.
28/11/2005|Eduardo Gianetti|276|José Paulo Kupfer| Não tenho certeza disso, não, Eduardo.
28/11/2005|Eduardo Gianetti|277|Eduardo Giannetti| Eu só queria...
28/11/2005|Eduardo Gianetti|278|José Paulo Kupfer| Eu não tenho certeza disso, não.
28/11/2005|Eduardo Gianetti|279|Eduardo Giannetti| Bom, nós vamos ter outra chance.
28/11/2005|Eduardo Gianetti|280|José Paulo Kupfer| Talvez a meta esteve um pouco...
28/11/2005|Eduardo Gianetti|281|Eduardo Giannetti| Em 2006, vai ser um ano...
28/11/2005|Eduardo Gianetti|282|José Paulo Kupfer| ...esteve um pouco ambiciosa, você não acha?
28/11/2005|Eduardo Gianetti|283|Eduardo Giannetti| Está tudo no lugar para que 2006 seja, talvez pela primeira vez, desde o início do real, um ano em que nós vamos testar até onde que se pode cair o juro primário sem que a expectativa de inflação futura volte a se acelerar.
28/11/2005|Eduardo Gianetti|284|[...]| Em um ano eleitoral, Eduardo?
28/11/2005|Eduardo Gianetti|285|Eduardo Giannetti| Eu acho que sim. Eu acho que sim, porque tem uma razão técnica, que é a seguinte.
28/11/2005|Eduardo Gianetti|286|José Paulo Kupfer| Explica melhor isso aí.
28/11/2005|Eduardo Gianetti|287|Eduardo Giannetti| O IPCA [Índice de Preços ao Consumidor Amplo], um terço do IPCA, 30% do IPCA são preços administrados. Preços administrados são corrigidos por um índice de preços do passado, especialmente o IGP [Índice Geral de Preços], que vai ter um valor acumulado em 2005 muito baixo, vai ficar entre 1 e 1,5%.
28/11/2005|Eduardo Gianetti|288|José Paulo Kupfer| Por causa do dólar, obviamente.
28/11/2005|Eduardo Gianetti|289|Eduardo Giannetti| Então, você já está contratado para 30% do IPCA. É uma inflação muito baixa [a do] ano que vem. O Banco Central vai ter espaço para redução do juro primário como nunca teve antes, porque você já está em um horizonte muito melhor de expectativa de inflação para 2005.
28/11/2005|Eduardo Gianetti|290|Reinaldo Azevedo| Agora, para te dar a chance, inclusive, de ouvir, com o brilho que você tem, sobre a questão do preço de juros... porque, quando você falou “os juros vêm do quê?”, há a leitura que diz que vem da maldade dos banqueiros e tal; essa leitura, que você faz como caricatura e que era a leitura do PT [Partido dos Trabalhadores]: no último debate na Rede Globo, entre o então candidato Lula e o então candidato [José] Serra, o então candidato Lula acusou o governo Fernando Henrique de elevar juro apenas para enriquecer banqueiro. Essa era a visão que eles tinham. Estão vendo que não é bem assim, as coisas são um pouco mais complicadas.
28/11/2005|Eduardo Gianetti|291|José Paulo Kupfer| Embora [...] o banqueiro, não é? [risos]
28/11/2005|Eduardo Gianetti|292|Reinaldo Azevedo| Agora, isso não significa que não enriqueça, e é o ponto que eu quero chegar na pergunta, basta ver o lucro dos bancos: será que é só crédito?
28/11/2005|Eduardo Gianetti|293|José Paulo Kupfer| Não.
28/11/2005|Eduardo Gianetti|294|Reinaldo Azevedo| Não é, mesmo.
28/11/2005|Eduardo Gianetti|295|Eduardo Giannetti| Mas é, também.
28/11/2005|Eduardo Gianetti|296|Reinaldo Azevedo| Também é crédito, mas, em boa parte, não. Agora, como é que pode um Banco Central... e isso nós todos sabemos, certamente havia espaço para arbitrar uma queda maior de juros. Agora, se você faz a tal pesquisa Focus [feita pelo Banco Central com agentes do mercado] e você telefona para as pessoas e pergunta “quanto você acha que o juro deve cair?”, você, usando a expressão, em um outro sentido, você está agindo, digamos, “marcado a mercado”, não é isso? Você liga e pergunta: “Quanto?” “Ah, meio [por cento] está bom”. Deu sorte, [porque], quando caiu meio, todo mundo sabia que era meio, estava todo mundo posicionado para a queda de meio.
28/11/2005|Eduardo Gianetti|297|Eduardo Giannetti| Vamos separar duas questões. Eu acho que o Banco Central, em outubro, quando ele fez o aperto monetário, ele acertou na direção do movimento. Ele tinha que fazer isso. Eu acho que nenhum economista em sã consciência pode achar que, naquele momento, o Banco Central devia assistir sentado uma aceleração de inflação que ia comprometer seriamente a meta em 2005. Eu acho que esse ponto é pacífico. O que nós podemos discutir - aí eu acho que você tem razão - é se o Banco Central do Brasil não errou na dosagem. Se ele poderia ter obtido o mesmo resultado importante que obteve - que foi uma vitória, ele reconquistou o cumprimento da meta de inflação de 2005 -, talvez ele pudesse ter obtido o mesmo resultado com um aperto menor do juro.
28/11/2005|Eduardo Gianetti|298|Reinaldo Azevedo| Eu já faço acordo com a dosagem. [risos]
28/11/2005|Eduardo Gianetti|299|Eduardo Giannetti| Agora, aí houve um problema, que é o seguinte: o governo do Lula, nesse 2005, na verdade, pisou no acelerador e no freio ao mesmo tempo, porque ele permitiu uma expansão muito forte do crédito ao consumidor, até por conta do crédito consignado, que veio prematuramente – e talvez fosse indesejável em qualquer circunstância -, mas, certamente, você não expande o crédito à pessoa física em um momento em que o Banco Central está aumentando o juro para controlar uma expectativa de inflação que se descolou da meta. Então, teve que aumentar mais o juro, porque o próprio governo, na outra ponta, estava jogando chopp ou pinga na festa.
28/11/2005|Eduardo Gianetti|300|Ricardo Arnt| Eduardo, se o chopp ou a pinga rola do jeito que rola e se não fosse o esforço de estabilização fiscal não se completou e se o juro é sintoma, mas não é causa, na verdade não tem aí por trás um segredo meio escondido de que a estabilização fiscal vai demorar uma extensão de tempo político no Brasil enorme ainda pela frente, [com ênfase] enorme, uma coisa de vinte anos, ou coisa que seja, [e] que isso fica plenamente sonegado à discussão?
28/11/2005|Eduardo Gianetti|301|Eduardo Giannetti| Eu tenho a esperança de que, no início do mandato do novo governo, existam condições políticas, uma janela de oportunidades para uma iniciativa de reforma fiscal mais contundente. Agora, eu acho que, aí, é coisa para início de mandato. O próximo governo, no primeiro ano do mandato, vai ter uma situação de poder, um capital político que permitirá a ele avançar em uma reforma fiscal corajosa, tanto no sistema tributário quanto no gasto público.
28/11/2005|Eduardo Gianetti|302|Ricardo Arnt| Mas vai demorar, não vai?
28/11/2005|Eduardo Gianetti|303|Eduardo Giannetti| Mas, aí, as expectativas... a economia funciona muito na base de expectativa. Se houver uma expectativa afirmada de que a dívida pública está controlada e tende a declinar, isso, imediatamente, traz enorme alívio no curto prazo, mesmo que o horizonte seja um pouco longo. Agora, tem que ser crível, tem que haver credibilidade.
28/11/2005|Eduardo Gianetti|304|Gustavo Ioschpe| Eduardo, quando você falava dessa questão do superavit não sendo os recursos poupados para se pagar os juros, mas usados para pagar qualquer coisa - quer dizer, os recursos são indiferentes -, não tem uma diferença...? Os gastos sociais, os outros gastos do governo são contingenciáveis, são “diminuíveis”, e a despesa com o juro é sempre inegociável, ela virou quase que um fetiche. Eu te pergunto como follow up: não tem hoje uma obsessão excessiva, no Brasil, de controlar a inflação e de controlar o mercado de crédito só com a taxa de juros, especialmente com a taxa de juros primária? A gente não poderia estar pensando em outros mecanismos de contenção de crédito que tivessem menor impacto para a relação, por exemplo, de dívida pública do Brasil ou com, por exemplo, mexer no [depósito] compulsório dos bancos - enfim, outros fatores?
28/11/2005|Eduardo Gianetti|305|Eduardo Giannetti| O compulsório é um fator, é a chamada “parte da cunha fiscal”, que aumenta o juro em um mercado livre de crédito de pessoa física e de pessoa jurídica. Olha, o instrumento para controlar a inflação no mundo inteiro é a política monetária.
28/11/2005|Eduardo Gianetti|306|Marcio Aith| Mas, Eduardo, tem um...
28/11/2005|Eduardo Gianetti|307|Eduardo Giannetti| É assim que se faz.
28/11/2005|Eduardo Gianetti|308|Marcio Aith| Sim, mas, há... no caso específico, sabe-se que as taxas primárias influenciam acho que 60% do crédito, mas sobem 40%, como o Gustavo disse, de crédito carimbado, mais o crédito consignado que está sendo distribuído... eu acho que há uma ênfase nesse debate sobre juros primários e pouco trabalho, inclusive dos economistas, sobre o que se pode fazer. No caso específico do FAT, dos empréstimos do BNDES, são quase como um tabu, não é?
28/11/2005|Eduardo Gianetti|309|Eduardo Giannetti| Sem dúvida.
28/11/2005|Eduardo Gianetti|310|Marcio Aith| Ninguém sabe exatamente quem são os tomadores, se precisam realmente tomar esse dinheiro, se o custo desse dinheiro...
28/11/2005|Eduardo Gianetti|311|Eduardo Giannetti| É incrível que o Brasil se considera uma economia de mercado, uma economia capitalista e não existe mercado de crédito para financiamento livre, financiamento de novos investimentos. A razão de ser dos bancos, em uma economia de mercado, é fazer a ligação entre as poupanças das famílias e os investimentos e a formação de capital do setor privado. Os bancos no Brasil, na verdade, não cumprem esse papel. Eles emprestam para o governo ou eles emprestam para pessoa física; são as duas modalidades principais. A única modalidade de financiamento para o investimento do setor produtivo de formação de capital é o que você falou, é o crédito direcionado do BNDES. Mas, aí, são os eleitos dos amigos do rei: o BNDES escolhe aqueles que ele resolve premiar, com um juro altamente subsidiado, 9,75% ao ano, enquanto ele paga 6% para o trabalhador, cujo fundo compulsório é o FAT que está lá. E o mesmo governo que cede para esses empresários a 9,75% ao ano se endivida no mercado por 18,5% ao ano.
28/11/2005|Eduardo Gianetti|312|Mara Luquet| O mercado de capitais, no caso...?
28/11/2005|Eduardo Gianetti|313|Eduardo Giannetti| Sem dúvida. Também, o nosso mercado de capitais ainda não funciona como deveria de fato em uma economia de mercado organizada. Ou seja, o empresário que tem um bom projeto de investimento vai ao mercado de capitais, oferece o projeto e obtém um financiamento a um preço razoável, compatível com a taxa de retorno do projeto. Eu acho que nós estamos caminhando, as reformas no mercado de capitais no Brasil estão caminhando na direção certa, mas tem muito chão, ainda, para nós chegarmos a uma situação dessas, em que o mercado acionário seja, de fato, um instrumento para mobilizar recursos visando à formação de capital. Ele ainda é, muito, um mercado especulativo, com movimentos abruptos de curto prazo.
28/11/2005|Eduardo Gianetti|314|Paulo Markun| Eduardo, o nosso programa acabou, tenho uma última pergunta rápida e rasteira. Nessa dicotomia, cigarra e formiga, você tem algum departamento cigarra, você tem algum lado cigarra?
28/11/2005|Eduardo Gianetti|315|Eduardo Giannetti| Não há a menor dúvida, todos nós estamos negociando valores presentes e futuros ao longo da vida e quase a cada momento. Eu acho que é parte da vida e do mistério da vida você estar sempre repensando, em diferentes circunstâncias, se você vai desfrutar o momento ou cuidar do amanhã. É lógico que eu tenho. [risos]
28/11/2005|Eduardo Gianetti|316|Paulo Markun| Está certo. Muito obrigado pela sua entrevista, obrigado aos nossos entrevistadores e a você que está em casa. E, na próxima segunda-feira, dez e meia da noite, o Roda Viva com o ministro das Comunicações, Hélio Costa, para discutir a digitalização da televisão. Nós voltamos na segunda que vem. Até lá!
