DATA|ENTREVISTA|ORDEM|LOCUTOR|FALA
02/10/1995|Gal Costa|76|Gal Costa|Tenho, eu tenho trabalhado e tenho pensado muito nisso, porque, na verdade, você cantar no palco é uma coisa meio complicada, porque você tem mil interferências externas. Quer dizer, quando você entra no palco já tem o público, que é um tipo de interferência, depois tem o som, que é eletrificado, então às vezes você quer ouvir mais um violão do que um baixo ou um outro instrumento... Então são coisas que, na verdade, perturbam a integridade do canto. Eu acho que isso também tem muito a ver com maturidade, com serenidade e com descoberta mesmo. Eu acho que ao longo da minha carreira eu fui descobrindo essa tendência, que na verdade é uma tendência minha. A minha história pela música brasileira é rica, está ligada ao Tropicalismo. A época que eu fiquei aqui, durante o exílio de Caetano e Gil, defendendo o Tropicalismo, como na verdade, segurando a bandeira, mantendo viva a ideologia do Tropicalismo. Embora eu tenha consciência de que nessa época eu não tinha, talvez, consciência da grandeza política que tinha, do peso político que tinha a minha postura de estar ali defendendo. Mas é como eu disse para Caetano uma vez, eu fazia aquilo com amor no coração, com sofrimento, porque eles estavam exilados, quer dizer, tudo o que foi minha história, quer dizer, minha história é rica de comportamentos, de atitudes, mas, na verdade, a minha essência é o som e a música. Isso, na verdade, é o que eu procuro. Talvez todas essas mudanças, em alguns momentos até radicais, da minha carreira, tenham sido coisas para eu buscar dados novos e crescer dentro do meu trabalho. Mas, na verdade, a minha essência é o show, é a música, e nesse espetáculo - Mina d' água do meu canto - especialmente eu busco isso. Eu me comporto no espetáculo como uma concertista, eu pouco me movimento no palco e eu quero centralizar as atenções na minha voz, na música. É um espetáculo muito musical, onde os arranjos são muito bonitos, são do Jaques Morelembau [violoncelista e arranjador], e os músicos têm uma performance cada um, quer dizer, eles têm a sua presença no palco, eles têm o seu momento de solo, todos eles, então é um espetáculo de música. Foi isso o que eu quis fazer. É uma coisa bacana que eu sinto é que ele é um espetáculo meio que educa as pessoas a assistirem o espetáculo. É um espetáculo que você vai para assistir, não um espetáculo energético. Não é para dançar. Entendeu? É para você ouvir. Se quiser fechar os olhos, até pode. E ficar ouvindo o espetáculo. E um espetáculo suave, tranqüilo e centrado na voz. Eu sinto ali na frente, onde eu posso ver a cara das pessoas, eu sinto que as pessoas ficam hipnotizadas pela coisa da voz e do canto. E como eu estou muito tranqüila e muito serena no palco, cantando, e querendo estar inteira, buscar um canto mesmo da minha alma, do meu coração, tranqüilo, relaxado, sem nenhuma interferência externa. E é uma coisa que eu trabalhei e que eu acho que consegui nesse espetáculo. Tem algumas pessoas que até dizem: "ah, o espetáculo é assim"... Hoje estavam me falando, a Marina, que é minha assessora de imprensa, que um jornalista comentou com ela que o espetáculo é muito quieto, é muito parado. Se eu faço um espetáculo cantando frevo, neguinho reclama [risos]. Então, o espetáculo é música, é um espetáculo sofisticadíssimo, com um grupo de músicos maravilhosos, extraordinários músicos, com arranjos lindos, e eu estou cantando muito bem. Pelo menos eu estou procurando cantar melhor do que nunca eu cantei.
02/10/1995|Gal Costa|77|Matinas Suzuki|Aliás eu acho que a nossa produção foi bastante feliz, porque esse é um dos momentos, no meu modo de entender, mais altos do show, que é essa música de fundo.
02/10/1995|Gal Costa|78|Gal Costa|É um espetáculo denso, é um espetáculo adulto. É um espetáculo que acho que as pessoas que gostam de música e que admiram meu canto, gostariam de ver. Acho que ali está uma coisa que todas as pessoas que gostam de mim, gostariam de ouvir.
02/10/1995|Gal Costa|79|Matinas Suzuki|Agora, Gal, você sente o crescimento, eu fiquei muito impressionado com o crítico do New York Times, que colocou você como uma das grandes cantoras que o mundo tem hoje e da maneira categórica como ele dizia isso. Você sente o crescimento da sua voz, você trabalhou, você estudou, como é que foi? Você tem falado muito que essa serenidade, essa postura de vida tem ajudado no seu canto, mas houve um outro trabalho?
02/10/1995|Gal Costa|80|Gal Costa|Não, outro trabalho técnico, eu nunca estudei canto. Eu nunca estudei impostação de voz, eu sempre tive uma inteligência naturalmente voltada para isso. O uso do diafragma, o lado rítmico do canto, a coisa da harmonia, enfim, a divisão, o vibrato [técnica vocal que consiste em fazer a voz vibrar ao cantar], isso tudo são coisas que eu sempre, desde que comecei a cantar, tive uma inteligência voltada para isso e eu sabia, eu conhecia que isso eram elementos que um cantor tem que usar no seu trabalho. Agora, eu não fiz nenhum trabalho ao longo desses anos.
02/10/1995|Gal Costa|81|Matinas Suzuki|Nenhum "trabalhinho"? [risos]
02/10/1995|Gal Costa|82|Gal Costa|Nenhum trabalhinho. Foi experiência de palco mesmo e eu sou muito exigente comigo mesma. Então, foi uma coisa de dedicação mesmo, de eu me dedicar, de eu querer crescer, de eu me dedicar ao meu trabalho. Com amor, com paixão, fundamentalmente foi isso.
02/10/1995|Gal Costa|83|Lorena Calábria|E, Gal, antes do show, como é que é a preparação? Você, sendo uma pessoa mística e tendo todos esses cuidados, isso foi mudando com o passar do tempo? Você antes fazia um tipo de ritual ou de preparação antes de no palco e agora você faz outro? Como é que é você antes de pisar no palco?
02/10/1995|Gal Costa|84|Gal Costa|Olha, eu já tive várias fases. No início da minha carreira eu não fazia ritual nenhum, depois passei a fazer ritual. Hoje em dia, o ritual que eu faço, é claro, é pedir aos orixás que me dêem luz, me dêem força, me dêem tranqüilidade, serenidade para estar no palco, inteira, para que eu possa cantar bem e eu faço o esquentamento de voz. Isso eu faço.
02/10/1995|Gal Costa|85|Lorena Calábria|Mas você está sozinha no camarim? Você pede para todo mundo sair?
02/10/1995|Gal Costa|86|Gal Costa|Não, teve uma época que eu gostava de ficar só. ["Ficar em silêncio?", interpõe-se Calabria]. Não queria ninguém. Faltando 20, 15 minutos pra entrar em cena, eu gostava de ficar só, recolhida, comigo mesma. Hoje não. Hoje, nesse show, nesse espetáculo, por exemplo, meus amigos ficam ali comigo, conversando.
02/10/1995|Gal Costa|87|Nizan Guanaes|Agora, Gal, nós temos uma indústria musical potente, nós temos talentos fenomenais, o próprio Matinas disse que o crítico do New York Times disse que você é uma das maiores cantoras do mundo, atualmente. Por que, então, a música popular brasileira não acontece no exterior como ela deveria? Quer dizer, eu sinto, eu viajo, eu levo discos seus, discos do Caetano e de tantos outros talentos da música popular... Por que a gente não é uma indústria bem sucedida em escala? Eu não falo em prestígio...
02/10/1995|Gal Costa|88|Gal Costa|Porque a gente não fala espanhol [risos].
02/10/1995|Gal Costa|89|[entrevistador não identificado]|Posso emendar uma pergunta?
02/10/1995|Gal Costa|90|Nizan Guanaes|Mas o Caetano gravou Fina estampa em espanhol e não estoura como poderia, quer dizer, - claro que vende, é um disco fenomenal - as gravadoras não sabem trabalhar? Porque o Fina estampa é fenomenal.
02/10/1995|Gal Costa|91|Gal Costa|Eu acho que as gravadoras não se empenham. Elas não investem dinheiro nos nossos discos fora do Brasil. E eu acho que a música brasileira tem crescido sim. Hoje, um público muito maior gosta de música brasileira. Eu fiz uma turnê pela Europa esse ano e eu vi uma quantidade de gente enorme que fala português por causa de música brasileira, porque gosta de Chico, porque gosta de Caetano, porque gosta de Gil, enfim, e fala mesmo, fala legal, fala bem. E eu disse até em Portugal, numa entrevista coletiva, sem querer ser agressiva, porque eu acho que é verdade, que eu acho que a música brasileira é responsável, será no futuro responsável, pela difusão da língua portuguesa no mundo, [por]que não se fala português em muitos lugares. Então, eu acho que a música brasileira será responsável pela difusão da língua portuguesa.
02/10/1995|Gal Costa|92|Marcos Augusto Gonçalves|Emendando a pergunta, uma pergunta fofoqueira na verdade, que o Nelsinho falou aqui, que ele vê como a única cantora, talvez não a única, mas a com mais possibilidades de vir a fazer uma carreira internacional do Brasil, a Marisa Monte. Ao passo, que você também tem uma grande... enfim, você é uma cantora conhecida na Europa, conhecida nos Estados Unidos. O que você acha que é necessário para que se possa ter uma carreira internacional, além de .....[incompreensível]?
02/10/1995|Gal Costa|93|Gal Costa|Bom, eu acho que para você ter uma carreira internacional, nos Estados Unidos, tem que ficar lá. Tem que morar, tem que gravar, tem que dar entrevista, tem que estar na televisão, tem que falar inglês, tem que cantar em inglês. Eu canto bem em inglês, eu gosto de cantar em inglês, muito.
02/10/1995|Gal Costa|94|Matinas Suzuki|Aliás, você está nos devendo um disco só com canções em inglês.
02/10/1995|Gal Costa|95|Gal Costa|Eu quero fazer esse disco. Eu quero fazer e vou fazer. Eu gosto muito de cantar em inglês, eu tenho um acento bom. Eu gosto de falar em inglês. Eu falo pouco inglês, entendo um pouquinho. Eu pretendo, inclusive, aprender inglês. Não tenho intenção de fazer carreira nos Estados Unidos, nada disso, mas eu acho que para você fazer carreira lá, você tem que morar lá, tem que ficar, quer dizer, recomeçar tudo de novo, um trabalho exaustivo e eu não vou fazer isso. Eu vou fazer shows, quando chamarem.
02/10/1995|Gal Costa|96|Matinas Suzuki|Agora, Gal, você, a sua carreira, como você a vê daqui para a frente? Você vai fazer os discos que você quer fazer, os shows que você quer fazer e só? Ou você ainda pensa em fazer, por exemplo, um trajeto cada vez maior em todos os anos para aumentar esse circuito internacional? Você tem uma idéia de que para que lado você vai caminhar?
02/10/1995|Gal Costa|97|Gal Costa|Eu pretendo, eu pretendo. Eu tenho algumas idéias de projeto, eu quero fazer um disco com músicas do Paulinho da Viola, porque eu acho que eu devo isso ao Paulinho, eu acho Paulinho um extraordinário compositor. E Paulinho não grava há muitos anos, não está aí. Eu acho que quero trazer de volta, quero trazer à tona de novo o Paulinho da Viola, que eu acho extraordinário. E, segundo, eu tenho esse projeto de fazer esse disco com os hispanos-americanos, eu quero gravar esse disco e quero fazer turnês fora do Brasil também. Eu quero fazer turnês pela Europa, continuar esse esquema. Eu não quero mais fazer as turnês de verão, são muito cansativas. E às vezes, em algumas cidades, se apresenta mais de um grupo, então é tudo corrido, às vezes fica, às coisas ficam mal feitas e eu não quero. Eu acho que vou fazer os festivais de outono, que são festivais, são espetáculos em teatro, onde, enfim, você tem mais conforto para fazer o seu trabalho. Mas eu quero continuar a fazer coisas lá fora, porque é bom, eu gosto de cantar fora do Brasil.
02/10/1995|Gal Costa|98|Matinas Suzuki|A propósito do seu futuro, de projetos, etc, nosso Dancan Lins, lá de Cuiabá, quem diria, diz que ficou sabendo que você foi convidada para fazer o Kaiser Music, no Rio de Janeiro, cantando as músicas do Tom Jobim, com orquestra sinfônica, no começo do ano que vem. Ele pergunta quais são as canções dele que mais lhe dão alegria de cantar? Dele, Tom Jobim, não dele, Dancan. [risos]
02/10/1995|Gal Costa|99|Gal Costa|Esse projeto é verdade, deverá acontecer em janeiro, no Rio, eu espero que aconteça, porque vai ser bonito, com a orquestra sinfônica, composições do Tom. Aliás, eu tinha que ter feito esse disco com o Tom, não fiz, mas quero fazer mesmo sem o Tom. E acho que as músicas que me dão mais prazer de cantar são todas, porque são todas lindas. Eu estou cantando agora no show Janelas abertas, que é um momento que eu adoro cantar. Eu adoro cantar essa canção e hoje eu estive, por acaso, com Paulinho Jobim, que a orquestra sinfônica do Rio de Janeiro vai fazer um disco só com músicas do Tom Jobim e o Paulinho me pediu para cantar algumas músicas e eu vou cantar quatro canções. Uma delas é Insensatez, que eu adoro e Um grande amor também, que eu vou gravar. São todas lindas. Eu adoro cantar tudo do Tom, é impossível saber qual é a mais bonita.
02/10/1995|Gal Costa|100|Tarik de Souza|Gal, você tocou num ponto aí interessante, já que a gente está fazendo uma espécie de reconstituição histórica. Você lembrou que aquele período que o Caetano e o Gil ficaram exilados, você ficou quase sozinha com Macalé e mais poucas pessoas defendendo a bandeira do Tropicalismo. Agora, você foi incomodada também pela polícia, você foi interrogada, te mandaram algum recado tipo "se comporte, senão você também vai em cana, também vai ter que sair"? 
02/10/1995|Gal Costa|101|Gal Costa|Não, eu nunca fui interrogada. Eu tive um problema no LP Índia, que é um LP que tinha uma capa na qual eu estava vestida de índia, com o seio à mostra, e foi proibida naquela época. Então, a gravadora teve que vender o disco dentro de um envelope preto, negro. Foi o único problema que eu tive. E com uma música do [Luiz] Melodia também.
02/10/1995|Gal Costa|102|Tarik de Souza|Qual foi a música?
02/10/1995|Gal Costa|103|Gal Costa|Esqueci o nome agora. Me falhou a memória.
02/10/1995|Gal Costa|104|Tarik de Souza|Eles te chamaram por causa da música, mandaram cortar a música?
02/10/1995|Gal Costa|105|Gal Costa|É. Teve problema....[diz algo incompreensível] Só.
02/10/1995|Gal Costa|106|Tarik de Souza|Agora, a que você atribui isso, quer dizer, Caetano e Gil foram presos e você, que estava dentro do movimento, ninguém falou nada, e você continuou cantando o mesmo tipo de música, com o mesmo tipo de comportamento e não aconteceu nada?
02/10/1995|Gal Costa|107|Gal Costa|Olha, eu não sei. Quando o Caetano e Gil foram presos e exilados, eu, na verdade, estava começando uma carreira. Eu tinha feito, ou ainda não tinha feito, não me lembro, o primeiro espetáculo com a banda, que foi feito no Teatro de Arena, que foi logo depois do Divino maravilhoso. E aí eles foram, quando eu estava para estrear, ou estreei, não lembro, eles foram presos e eu fui para o Rio. Eu acho que a minha história, o sucesso daquela época, estava muito ligado... Eu acho que as pessoas prestavam mais atenção à coisa política mais do que a própria coisa da cantora que eu era. Eu acho que a minha figura era muito ligada à figura do Caetano, à imagem da figura dele. E, tanto que Caetano quando voltou do exílio, não sei se vocês lembram, ele fez um espetáculo no teatro João Caetano, onde ele usou um colete que eu usava, que eu vestia nos shows e ele pôs batom vermelho. Foi como se dissesse assim: "Eu estou aqui tomando o bastão".
02/10/1995|Gal Costa|108|Matinas Suzuki|Tinha um cabelo parecido com o seu.
02/10/1995|Gal Costa|109|Gal Costa|Sim. Eu acho que as pessoas se ligavam mais, quer dizer, a minha presença estava mais ligada a essa coisa política, à postura política, à atitude política, estar ali, o Tropicalismo, sabe, era como se fosse uma espécie de complô, porque era um público muito especial que gostava do meu trabalho.
02/10/1995|Gal Costa|110|Tarik de Souza|E você, em nenhum momento, temeu que sobrasse para você, por estar mantendo essa postura? Porque você também participou do Divino maravilhoso, aquele programa da [TV] Tupi, não participou?
02/10/1995|Gal Costa|111|Gal Costa|Participei, participei.
02/10/1995|Gal Costa|112|Tarik de Souza|Então, e aquele programa foi considerado uma coisa muito agressiva na época.
02/10/1995|Gal Costa|113|Gal Costa|Medo a gente tinha, mas não vai deixar de fazer por causa disso. Eu fiz corajosamente e como eu te disse, na época, talvez eu não tivesse a consciência da grandeza política que tinha...
02/10/1995|Gal Costa|114|Tarik de Souza|E nem do perigo.
02/10/1995|Gal Costa|115|Gal Costa|Talvez até nem do perigo também.
02/10/1995|Gal Costa|116|Matinas Suzuki|Eu sou de uma geração, isso já deve ter sido falado para você milhares de vezes, que foi o show Fatal é um acontecimento existencial muito importante. Não só musical, porque era um show maravilhoso, virou um disco maravilhoso, mas era uma espécie de catalisador, de respiradouro para quem pode ficar aqui. O show Fatal você tinha dimensão dessa importância, que ele tinha naquele momento e que ele adquiriu posteriormente?
02/10/1995|Gal Costa|117|Gal Costa|Tinha, tinha. Tanto que, eu acho que a dimensão política do Fatal é muito mais, para mim, é muito mais grandiosa, muito mais importante do que a dimensão musical. Porque eu ouço as pessoas dizerem "o Fatal é lindo, eu adoro o Fatal". Mas tem coisas no Fatal que, musicalmente, eu não gosto.
02/10/1995|Gal Costa|118|Matinas Suzuki|O quê, por exemplo?
02/10/1995|Gal Costa|119|Gal Costa|Sei lá, eu não me lembro, mas tem coisas que me incomodam, algum jeito de cantar uma canção ou outra. Tem alguma coisa, eu não sei, porque também eu ouço, às vezes, discos do passado, que eu faço críticas, tem coisas que eu cantaria diferente, é claro. Hoje eu tenho uma visão, eu canto diferente, sou outra pessoa. Então, eu tenho uma visão crítica, uma distância para poder criticar. Mas eu acho que a dimensão política dele é muito mais grandiosa do que a coisa musical. Se bem que tinham grandes músicos, tinha o Leni, tinha um repertório maravilhoso. Eu acho Fatal um show espetacular.
02/10/1995|Gal Costa|120|João Marcelo Bôscoli|Apesar de você ter uma ligação muito forte com o Gil, com o Caetano, com o Chico, com o Tom, você sempre, ainda mais olhando essa pesquisa que a gente recebeu, você sempre gravou muita gente. Depois de Djavan, que acho que é indiscutível o talento dele, qual compositor que te chamou a atenção ou qual é o grupo de compositores que te chamou a atenção, você que conviveu a vida inteira com gênios. Caetano sempre foi o Caetano. O Chico, desde a primeira música é o Chico. Depois do Djavan, quem é que você destacaria ou um grupo de pessoas ou uma pessoa especialmente?
02/10/1995|Gal Costa|121|Gal Costa|Olha, eu confesso que dessa geração pós Os [Novos] baianos, Djavan é o compositor que eu mais gosto. E eu gosto dele como cantor também... não sei.
02/10/1995|Gal Costa|122|João Marcelo Bôscoli|Tem gente que ainda está se desenvolvendo, né? Tem alguma pessoa... É porque, realmente, é o que o Nizan estava falando, não sei se a gente está muito próximo, mas a envergadura, o tamanho do Gil, do Caetano, do seu, a gente ainda não consegue enxergar nos novos. Eu queria saber se você, como cantora, que está acostumada a ver matéria-prima ali crua, se tem alguém que te chamou muita a atenção?
02/10/1995|Gal Costa|123|Gal Costa|Eu acho que o Djavan é o que eu mais gosto desta geração, que não é tão nova. [alguém faz algum comentário incompreensível sobre o que Gal acabou de falar]
02/10/1995|Gal Costa|124|João Marcelo Bôscoli|Ele joga bola que nem um louco [respondendo ao comentário do outro entrevistador].
02/10/1995|Gal Costa|125|Gal Costa|Ele vai ficar puto comigo porque eu falei isso. [risos]
02/10/1995|Gal Costa|126|Matinas Suzuki|Gal, você recebe muitas fitas, muitos pedidos, muitas solicitações, compositores mandam...Como é esse contato com o pessoal mais jovem?
02/10/1995|Gal Costa|127|Gal Costa|Recebo, recebo muita fita. Esses últimos anos eu não tenho recebido não, porque eu tenho feito projetos, teve o Sorriso do gato de Alice, que foi um projeto de cantar os quatro compositores. Em seguida, eu fiz esse disco cantando Chico e Caetano...eram projetos pensados. Então eu não tenho, ultimamente, recebido muita coisa. Mas eu sempre recebo, volta e meia, durante o show, no hotel, às vezes eu recebo uma fita ou outra, mas nada me interesse muito, que eu tenha gostado.
02/10/1995|Gal Costa|128|Matinas Suzuki|Nós vamos fazer agora um rápido intervalo e a gente volta daqui a pouquinho com o segundo tempo da entrevista de Gal Costa. Até já.
02/10/1995|Gal Costa|129|[Intervalo]|Intervalo]
02/10/1995|Gal Costa|130|Matinas Suzuki|Bem, nós voltamos com o Roda Viva que esta noite tem a honra de entrevistar a cantora Gal Costa. Gal, nós estávamos falando de você cantar em inglês e um pouco sobre o início de sua carreira. Nós temos mais algumas imagens, creio que dos anos 70, vamos revê-las e depois a gente continua a conversar. 
02/10/1995|Gal Costa|131|[vídeo com Gal]|vídeo com Gal]
02/10/1995|Gal Costa|132|Gal Costa|Sabe que essa música é minha. Eu fiz essa música com Leni e Macalé. Brincando, em casa, curtindo um som. Eu sou compositora dessa música [risos].
02/10/1995|Gal Costa|133|Matinas Suzuki|Gal, já que estamos nessa praia, Billie [Holiday], Ella [Fitzgerald], ou Sarah [Vaughan]? [cantoras estadunidenses de jazz, consideradas como as melhores vozes femininas nesse gênero musical] 
02/10/1995|Gal Costa|134|Gal Costa|As três. É difícil eleger apenas uma. A Sarah eu adoro o timbre da voz dela e o jeito que ela divide. A Ella é superelegante, chique, tem uma coisa mais de negro, de improviso, de tribal mesmo, aquela coisa do crioulo, né. E a Billy Holyday é aquele canto doce e ao mesmo tempo amargurado, timbre rascante da voz que ela tinha, que ela tem. Eu gosto das três, eu não elejo uma. Cada uma de um jeito diferente.
02/10/1995|Gal Costa|135|Matinas Suzuki|Agora, tirando as três, quais são as cantoras que você ouve, que admira, que você gosta bastante? Não vale Maria Callas [cantora lírica soprano de ascendência grega, considerada uma das melhores do período pós-guerra] [risos].
02/10/1995|Gal Costa|136|Gal Costa|Bom, eu ouço muito essas três cantoras. Eu tenho ouvido muito. E, o que eu ouço mais? Na verdade, eu acho que eu ouço, eu tenho ouvido muito João Gilberto de novo, tenho ouvido muito Chet Baker [trompetista estadunidense, amante do jazz], que eu adoro. Eu tenho ouvido Fina estampa [disco de Caetano Veloso], eu tenho ouvido mais cantores homens que mulheres.
02/10/1995|Gal Costa|137|Matinas Suzuki|A esse propósito, está acontecendo um fenômeno no Brasil, que nós temos poucos cantores e mais cantoras. Estão minguando os cantores. Você teria uma explicação para isso ou é só uma constatação?
02/10/1995|Gal Costa|138|Gal Costa|Eu não sei, realmente tem surgido muita cantora, virou moda ser cantora [risos]. Agora, os compositores, eles cantam bem. Eles cantam as suas coisas. Caetano canta bem, Gil canta bem. Chico, eu gosto do jeito que Chico canta, acho que ele tem um charme especial. Mas, realmente, tem muita cantora. Eu não sei explicar por que razão.
02/10/1995|Gal Costa|139|Matinas Suzuki|Marcos, você estava querendo fazer uma pergunta... 
02/10/1995|Gal Costa|140|Marcos Augusto Gonçalves|Na verdade eu vou retornar porque...Quando você estava falando do show do Caetano, na volta... Caetano teve até essa polêmica com o correspondente do New York Times, que ele nunca usou vestido, etc, enfim, mas o fato é que houve naquele momento, por uma questão de época, e houve por parte dele, da sua parte, enfim, de todos que estavam envolvidos naquele clima do Tropicalismo e depois da contracultura, uma atitude política que era muito mais, na verdade, ligada ao comportamento do que à política propriamente dita, sentido estrito. E estavam sendo temas culturais ali presentes, como a bissexualidade, que é uma coisa que o Caetano reforçava muito, o próprio Ali, você também, enfim, todos ali envolvidos com isso. Hoje em dia, esse tipo de relação com a questão do comportamento parece que ficou um pouco estetizada, um pouco comercializada, como no caso da Madonna, por exemplo. Como é que você vê, especialmente no seu meio, hoje em dia, a questão, é um meio menos ou mais liberal, menos ou mais preocupado com a questão da liberdade sexual, com esse tipo de coisa? Você acha que esse é um tema que saiu de pauta?
