DATA|ENTREVISTA|ORDEM|LOCUTOR|FALA
02/10/1995|Gal Costa|141|Gal Costa|Eu acho que a minha geração é uma geração que viveu isso, quer dizer, viveu intensamente isso, quer dizer, não tem mais o que contestar. E foi uma época que passou. Não tem que se ter mais nenhuma postura, nem atitude. Você tocou na questão da Madonna e do Michael Jackson, eu acho, quer dizer, eu particularmente não gosto da Madonna como cantora, nem gosto, não ouço os discos dela, não gosto do timbre da voz, não gosto da música que ela grava, nem dos arranjos, eu não gosto de nada, mas eu gosto da postura da atitude dela. Eu acho ela uma mulher inteligente. Acho que ela faz aquilo verdadeiramente, isso que eu admiro. Já, diferentemente do Michael Jackson, que passa uma figura andrógina, é uma figura estranha, já é uma coisa meio... Outro dia eu estava vendo o Michael Jackson na televisão e eu estava vendo que atrás daquela pureza artificial, daquela figura E.T esquisita que ele acabou se tornando, tinha uma coisa muito mais, terrivelmente assim, da sexualidade... Não sei, não sou a rainha da oratória, não estou conseguindo explicar, mas Michael Jackson tem essa coisa, quer dizer, que está escondido, a coisa da tara. E a Madonna passa uma coisa mais verdadeira, mais natural. E a nossa geração viveu isso, quer dizer, não tem o que contestar, não tem mais o que brigar. E depois nós estamos numa época difícil, quer dizer, a Aids está aí para castrar, cortar a liberdade sexual dos jovens, que estão começando a sua sexualidade, a descobrir a sua sexualidade. É uma coisa complicada.
02/10/1995|Gal Costa|142|Tarik de Souza|Emendando ali com que falou o João Marcelo, sobre os novos compositores, eu queria saber se você conhece a obra do Guinga [Carlos Althier de Souza Lemos Escobar, compositor e violinista carioca], se você já tomou conhecimento?
02/10/1995|Gal Costa|143|Gal Costa|Não, eu não conheço a obra do Guinga. Eu vi a matéria do Mauro outro dia no [O] Estado [de S. Paulo] e li, uma matéria bem empolgada, assim apaixonada. Eu tenho muita curiosidade de ouvir as coisas do Guinga. Eu nunca ouvi o Guinga tocar, não conheço o trabalho dele, e eu quero conhecer.
02/10/1995|Gal Costa|144|Tarik de Souza|E a Marisa Monte como compositora, você gravaria uma música dela?
02/10/1995|Gal Costa|145|Gal Costa|Não sei. Se ela der uma música bonita para mim, eu gravo [risos].
02/10/1995|Gal Costa|146|Matinas Suzuki|Gal, a esse propósito, a [nome incompreensível] Leonel aqui de São Paulo e a Silmara Bedac perguntam por que você não compôs mais?
02/10/1995|Gal Costa|147|Gal Costa|Porque, olha, eu não sou compositora, eu sou cantora, é o que eu faço bem, com competência, então eu prefiro centrar minha coisa no canto. E, na verdade, quando eu componho uma música ou quando eu canto uma música, eu estou dando a minha visão daquela, colocando a minha marca naquela canção. Então, eu acho que isso é uma forma de compor. Eu, na verdade, tomo para mim, quando eu pego uma música para cantar, eu tomo para mim e dou a minha versão. É uma forma de compor também. Eu não sei se eu seria uma boa compositora, então eu prefiro cantar muito bem, que eu sei que eu faço, canto bem, do que compor mais ou menos.
02/10/1995|Gal Costa|148|Lorena Calábria|Bom, já que o assunto está esquentando, já falamos de liberação sexual, a temperatura também, eu queria voltar a um tempo atrás, ao show dirigido pelo Gerald Thomas [dramaturgo brasileiro polêmico e ousado]. Eu queria saber, Gal, se você chegou a se arrepender em algum momento e por quê? E se você não chegou a se arrepender, se aquilo te incomodou muito, principalmente a reação da crítica e do público?
02/10/1995|Gal Costa|149|Gal Costa|Não me arrependi em nenhum momento de ter feito o espetáculo com Gerald Thomas [referindo-se a O sorriso do gato de Alice, espetáculo dirigido por Gerald Thomas, em 1994, no qual Gal causou polêmica ao mostrar os seios nus]. Era o que eu queria. Acho que eu tenho muita honra e muito orgulho de ter feito esse espetáculo. Acho que era um espetáculo belíssimo, cenicamente era lindo, era uma espetáculo bem acabado, que eu acho o Gerald Thomas talvez o melhor encenador - estou falando encenador - brasileiro. A luz era deslumbrante, o cenário era lindo. Eu não me arrependo em nenhum segundo. Eu fazia o espetáculo com o maior prazer, não me sentia oprimida, como a imprensa falou, que o Gerald me oprimiu, não me oprimiu, porque eu fiz aquilo que eu quis. Eu só faço aquilo que eu quero. E eu me sentia bem e acho que faz parte da minha história. Quem conhece a minha história sabe que eu sou ousada e que eu faço essas coisas. Eu sei que elas têm um preço, mas eu encaro.
02/10/1995|Gal Costa|150|Lorena Calábria|Inclusive peitar.
02/10/1995|Gal Costa|151|Gal Costa|Inclusive peitar [risos]. Peitei mesmo.
02/10/1995|Gal Costa|152|Lorena Calábria|Mas você sabia, tinha idéia...
02/10/1995|Gal Costa|153|Gal Costa|Aliás, eu fiz um espetáculo em 70...
02/10/1995|Gal Costa|154|Lorena Calábria|Isso passava pela sua cabeça, quando vocês estavam conversando como é que ia ser o show, você tinha idéia que isso ia chocar, que as pessoas iam reagir dessa maneira? Mesmo sabendo que você tem essa trajetória, de buscar coisas novas, experimentar.
02/10/1995|Gal Costa|155|Gal Costa|Eu, na verdade, eu fiquei um pouco surpresa. Eu sabia que algumas pessoas iriam se chocar com essa atitude. Eu fiquei impressionada com a quantidade, com o número de pessoas que se chocaram por ver um peito de uma mulher de fora, num palco. Eu acho que aquilo era colocado de uma maneira tão digna, era um momento tão importante, quer dizer, no momento em que eu cantava Tropicália, era um momento que estava ligado à história do Tropicalismo, à história dessa irreverência, dessa coisa que ele falou, de comportamento. Estava ligado a isso. Na verdade, aquilo era um pouco uma retomada da minha carreira. Eu cantei coisas do início da minha carreira, gravações. E a atitude também de entrar no palco, a atitude inusitada de entrar no palco como uma gata, não entrar como uma estrela, é engraçado como isso também incomodou as pessoas. E as pessoas reclamam, reclamam que a gente é igual. O que eu tenho medo é de me estagnar, de ficar igual. Podia entrar no palco, ao som de uma banda, com um vestido lindo, uma mulher bonita, e pronto...cantar, mas não é isso que eu quero. Eu prefiro, entendeu, ir por caminhos mais difíceis até porque eu sei que essas coisas provocam reação, provocam polêmica, mas para mim são mais enriquecedoras, porque me dão coisas novas, à minha personalidade.
02/10/1995|Gal Costa|156|Mauro Dias|Você sentiu essa reação no público? Eu sei que houve um espanto na imprensa. Pelo que eu me lembro, de assistir o show, o público se comportou muito bem e gostou.
02/10/1995|Gal Costa|157|Lorena Calábria|Mas não em relação ao Gerald, né?
02/10/1995|Gal Costa|158|Gal Costa|É, o Gerald é polêmico, as pessoas não gostam dele...
02/10/1995|Gal Costa|159|Mauro Dias|Mas você sentiu o choque na platéia?
02/10/1995|Gal Costa|160|Gal Costa|Não. Não. As pessoas até iam ao show e diziam assim: "Puxa, eu não vi nada demais. Não vi nem o peito. É tão normal"!
02/10/1995|Gal Costa|161|Nizan Guanaes|Mas isso, então, aconteceu por quê? Porque a imprensa implica, porque a imprensa cultua o fracasso, porque a imprensa é careta? Aconteceu por quê? Quer dizer, eu também tive lá e também tive a mesma sensação, disso que você está falando.
02/10/1995|Gal Costa|162|Gal Costa|Eu acho que isso aconteceu porque ninguém gosta do Gerald [ri ao mesmo tempo que fala]. Aconteceu muito por causa dele, bronca dele. Eu acho que foi uma pena, porque acho que a imprensa até atrapalhou um pouco a carreira do espetáculo, porque muita gente que deixou de ver o espetáculo por causa da imprensa, que acontece, isso tem, gente que não vai...
02/10/1995|Gal Costa|163|Matinas Suzuki|Você acredita mesmo nesse poder da imprensa?
02/10/1995|Gal Costa|164|Gal Costa|Eu acho que, de certa forma, tem um pouco.
02/10/1995|Gal Costa|165|Matinas Suzuki|Eu com 15 anos de jornalismo, eu tenho muitas dúvidas com relação a isso. Senão Roberto Carlos não venderia a quantidade de discos que ele vende, e todo ano a crítica fala mal do disco do Roberto Carlos.
02/10/1995|Gal Costa|166|Gal Costa|Mas é diferente nesse caso, né?
02/10/1995|Gal Costa|167|Matinas Suzuki|Talvez a polêmica tenha até criado um interesse maior pelo show, você não acha?
02/10/1995|Gal Costa|168|Gal Costa|Não, não é que o espetáculo não tivesse tido uma carreira boa, teve sim. Mas imagino que algumas pessoas possam não ter ido ao espetáculo por causa disso. Perderam um espetáculo maravilhoso, porque, para mim, foi um dos shows mais bonitos que a história da MPB teve nesse país. É a minha opinião. Eu me orgulho muito de ter feito esse espetáculo.
02/10/1995|Gal Costa|169|Marcos Augusto Gonçalves|Houve muita reação também não só na imprensa. O meio musical, especialmente no Rio de Janeiro, que foi onde estreou, os produtores, os tradicionais produtores de música...
02/10/1995|Gal Costa|170|Gal Costa|[interrompendo Marcos Augusto] Até algumas pessoas de música e de teatro também.
02/10/1995|Gal Costa|171|Marcos Augusto Gonçalves|Exatamente. Houve uma reação grande ali daquelas pessoas, não necessariamente da crítica, pelo menos do que eu li...
02/10/1995|Gal Costa|172|Gal Costa|[interpondo-se à fala de Marcos Augusto] É...[faz algum comentário incompreensível]
02/10/1995|Gal Costa|173|Lorena Calábria|A frase mais citada foi a "Gal não precisava fazer isso".
02/10/1995|Gal Costa|174|Gal Costa|[fala ao mesmo tempo que Lorena Calábria] Tem gente que achava que eu devia....
02/10/1995|Gal Costa|175|Marcos Augusto Gonçalves|Eu não fui ...[incompreensível] essa história que o Ezequiel detestou, falou não sei que.... [outros falam ao mesmo tempo]
02/10/1995|Gal Costa|176|Gal Costa|Eu faço o que eu quero, pô!
02/10/1995|Gal Costa|177|Matinas Suzuki|Agora, Gal, você trabalhou com diretores polêmicos, diretores ousados, caso do Gerald, caso do Wally Salomão [compositor e poeta baiano], também trabalhou com Nelsinho Motta [jornalista, compositor, escritor, roteirista, produtor musical e letrista brasileiro]. Como é essa relação da cantora com o diretor, como é que você trabalha com o diretor? Em geral, você está com uma idéia e localiza um diretor ou, às vezes, você senta antes com o diretor para falar "puxa, vamos desenvolver um trabalho para um show", como é isso?
02/10/1995|Gal Costa|178|Gal Costa|Olha, geralmente, todos os diretores que dirigiram os meus espetáculos, eles, na verdade, nunca me dirigiram cenicamente. Porque eu tenho uma noção de palco intuitiva, natural, que eu domino. Eu sei o momento que eu tenho que ir para lá, que eu tenho que ir para cá, que eu tenho que ficar. Então, é uma coisa que é natural. Só roteiro normalmente o diretor faz, às vezes, de uma maneira geral comigo, enfim, ou algum roteirista que ajude. O único diretor realmente que me dirigiu cenicamente foi o Gerald. Inclusive foi muito bom ter trabalhado com ele, porque eu descobri o tempo do teatro, coisa que eu não sabia, não tinha consciência. Eu descobri isso. O tempo de você estar no palco, você vai fazer um gesto, sabe, tudo, essa coisa, essa magia da coisa do ator, eu aprendi com o Gerald. Ele me dirigia...
02/10/1995|Gal Costa|179| Matinas Suzuki|[interrompendo Gal] Gal, esse show era o show do...
02/10/1995|Gal Costa|180|Gal Costa|O sorriso do gato de Alice. Foi maravilhoso porque...
02/10/1995|Gal Costa|181|Matinas Suzuki|[interrompendo Gal] Eu estou perguntando isso, porque o Zeca Abud, lá de Belo Horizonte, que está nos vendo, enviou aqui um fax dizendo que "o show O sorriso do gato da Alice foi o melhor que já assisti. Gostaria de saber se tem algum projeto de gravar esse show em vídeo ou em CD".
02/10/1995|Gal Costa|182|Gal Costa|Olha, eu gostaria muito de ter gravado esse espetáculo em vídeo, mas eu não consegui patrocínio, por incrível que pareça. Não foi possível gravar, eu tentei, o Gerald também, porque eu achava que esse show merecia ser registrado, mas não consegui. E agora não é mais possível, porque já passou. Então, eu fico contente de ouvir esse fax.
02/10/1995|Gal Costa|183|João Marcelo Bôscoli|Gal, você falou duas vezes "eu só faço o que eu quero". Sempre foi assim ou você teve que, no começo da carreira, brigar muito para conseguir fazer o que você quer com relação à gravadora, principalmente?
02/10/1995|Gal Costa|184|Gal Costa|Não, não tive que brigar. Nunca precisei. Sempre foi tranqüilo....
02/10/1995|Gal Costa|185|João Marcelo Bôscoli|Você me passa a impressão de uma pessoa muito forte quando você fala da crítica, não da crítica especializada, mas da crítica de uma maneira geral. Eu sempre vejo você muito forte. Em algum momento da sua carreira, você se abateu com alguma crítica que te pegou assim muito intimamente, a ponto de você se desmontar? Porque aparentemente as críticas não te atingem, o que eu acho louvável.
02/10/1995|Gal Costa|186|Gal Costa|Eu não vou dizer que eu não leio crítica, [por]que artista que disser que não lê crítica é algo que eu não acredito, [por]que lê. E não vou dizer que eu nunca me chateei com crítica, claro que já me chateei com crítica. Mas eu confesso que hoje eu tenho uma serenidade em relação a isso tão grande, uma determinação e uma consciência daquilo que eu quero, com serenidade, que uma crítica negativa, a coisa do Gerald, do espetáculo do Gerald, por exemplo, foi uma enxurrada de críticas contra o espetáculo. Não contra mim, pessoalmente, isso eu não tenho nenhuma reclamação, mas contra o espetáculo e contra o Gerald. Porque, se está contra o Gerald, contra o espetáculo, fatalmente está contra mim. E aquele espetáculo fui eu que escolhi fazer. Aquele diretor fui eu que escolhi chamar. Então, eu recebi aquilo como uma guerreira. Eu vi que eu tinha que lutar contra aquilo, que defender daquilo. Primeiro, porque eu gostava daquilo que eu estava fazendo, acreditava e era meu filho predileto, mas porque essa coisa de polêmica é muito cansativa. Eu não sei como o Gerald agüenta [risos].
02/10/1995|Gal Costa|187|Lorena Calábria|Você já tinha assistido, Gal, alguma peça dele? Por que você escolheu o Gerald?
02/10/1995|Gal Costa|188|Gal Costa|Já, já tinha assistido. Eu acho ele um encenador maravilhoso. Acho a luz dele magnífica, bem feita, bem acabada. Acho os espetáculos dele bem acabados.
02/10/1995|Gal Costa|189|Marcos Augusto Gonçalves|Você já conhecia ele há muito tempo, não?
02/10/1995|Gal Costa|190|Matinas Suzuki|Gal, é verdade que ele chegou para você e falou: "Eu não conheço nenhuma música brasileira. Você que vai ter que escolher o repertório" [risos]. "E esse negócio de banda no palco não é comigo, esconde a banda".
02/10/1995|Gal Costa|191|Tarik de Souza|Gal, o Caetano gravou agora esse repertório latino de boleros e guarânias e foi uma das maiores vendagens da carreira dele, 250 mil discos. A Bethânia gravou Roberto Carlos e passou dos 800 mil. Você se sente um pouco injustiçada de vender muito menos com o repertório ultra-selecionado que você tem gravado?
02/10/1995|Gal Costa|192|Gal Costa|Não, não me sinto não. Eu adoro esse disco que eu fiz. E esse disco, já ganhei disco de ouro com ele, vendeu 130 mil. E vai caminhar para 250, segundo a BMG [gravadora].
02/10/1995|Gal Costa|193|João Marcelo Bôscoli|Se um cantor brasileiro faz música brasileira e por algum momento da carreira dele, ele resolve, para que possa crescer internacionalmente, ele resolve cantar em espanhol, embora ele faça música brasileira, e vamos supor que ele estoure no mundo inteiro. É legítimo dizer que essa música é brasileira ou você acha que tem que ter a língua portuguesa na canção para se caracterizar que seja música brasileira?
02/10/1995|Gal Costa|194|Gal Costa|Não, eu acho que é legítimo você dizer que é brasileira, porque na verdade, o Caetano, ele fez o Fina estampa, mas na verdade é um ponto de vista brasileiro. Então, eu acho que é brasileira.
02/10/1995|Gal Costa|195|Lorena Calábria|Numa entrevista recente ao Metrópolis, a nossa repórter, Lilia Amarante, comentou que você estava muito zen. E você falou: "eu sempre fui zen, estou mais zen do que nunca". Gal, quando você não está concentrada na música, qual o seu outro interesse? Eu li alguma coisa a respeito de fotografia. É verdade isso?
02/10/1995|Gal Costa|196|Gal Costa|Olha, eu sempre tive interesse por fotografia. Eu tinha, na década de 70, eu tinha uma máquina fotográfica com todas as lentes, máquina profissional, eu gostava e tirava muita fotografia. Tanto que eu tenho toda a .... tenho muita foto dos meus discos, dos meus shows, das exposições.
02/10/1995|Gal Costa|197|Lorena Calábria|O que você gostava de fotografar? Pessoas?
02/10/1995|Gal Costa|198|Gal Costa|Pessoas na rua. Tenho uma infinidade de slides, feira de Caruaru [Pernambuco], figuras estranhas, figuras de povo. E eu voltei a esse interesse. Eu abandonei isso durante um tempo e agora voltei a esse interesse. Comprei uma máquina fotográfica. Comprei alguns livros também, agora em Barcelona, sobre fotografia e quero, assim que terminar esse ciclo de A mina d'água do meu canto, eu vou aquietar e vou começar a ler e vou estudar um pouco fotografia.
02/10/1995|Gal Costa|199|Lorena Calábria|Parte técnica? Tem algum fotógrafo predileto?
02/10/1995|Gal Costa|200|Gal Costa|Parte técnica. Eu tenho, eu gosto muito de fotografia tipo reportagem, fotografia....Gosto muito daquele fotógrafo que vive nos Estados Unidos...
02/10/1995|Gal Costa|201|Lorena Calábria|Sebastião Salgado?
02/10/1995|Gal Costa|202|Gal Costa|Exatamente. Salgado para mim é o maior fotógrafo do mundo.
02/10/1995|Gal Costa|203|Matinas Suzuki|Gal, como nós estamos com um acúmulo muito grande aqui de fax e perguntas por telefone, eu vou pedir licença um pouquinho à mesa e fazer um ping-pong com você. Vamos ver se a gente pode responder meio rapidinho aos nossos telespectadores. O Pacinatam, aqui de Higienópolis, pergunta se você pretende gravar alguma coisa do Cazuza? Você já gravou. Aliás, perguntando se você tinha gravado pessoas mais novas, além do Cazuza, Arnaldo Antunes, etc. Você pretende gravar alguma outra coisa do Cazuza?
02/10/1995|Gal Costa|204|Gal Costa|Não no momento. Eu tenho o projeto de gravar o Paulinho da Viola e depois esse disco de músicas hispano-americanas e não sei, para frente eu não sei.
02/10/1995|Gal Costa|205|Matinas Suzuki|O Eduardo Almeida Wolf, da Liberdade, pergunta que influência a sua religião, o candomblé, tem na sua carreira e na sua vida pessoal?
02/10/1995|Gal Costa|206|Gal Costa|Tem uma influência muito grande, porque me dá serenidade, me dá energia, me dá força, me dá tranqüilidade.
02/10/1995|Gal Costa|207|Matinas Suzuki|A Gilka Maria Morais, lá de Belo Horizonte, pergunta se você é casada, tem filhos e, se não, se pretende ter no futuro?
02/10/1995|Gal Costa|208|Gal Costa|Não. Já tive vontade de ter filho, mas não tive. E agora também não quero mais. Não, não sou casada.
02/10/1995|Gal Costa|209|Matinas Suzuki|O Marcelo Mott, que é professor em Jaú, pergunta pra você se existe alguma música que você gostaria de gravar e não grava porque acha que já existe uma interpretação definitiva daquela música?
02/10/1995|Gal Costa|210|Gal Costa|Houve época em que eu pensava assim. Hoje em dia não, eu acho que posso gravar qualquer música.
02/10/1995|Gal Costa|211|Matinas Suzuki|Depois de gravar João Gilberto, uma música cantada por João Gilberto, por exemplo....
02/10/1995|Gal Costa|212|Gal Costa|Bom, eu já gravei música cantada pelo Gilberto, imagine só...
02/10/1995|Gal Costa|213|Matinas Suzuki|E a Silvana Regina, de Campinas, pergunta se você já se arrependeu de ter gravado alguma música?
02/10/1995|Gal Costa|214|Gal Costa|Não.
02/10/1995|Gal Costa|215|Matinas Suzuki|O Artur Leandro Lopes, de Araçatuba, interior do estado de São Paulo, pergunta se você tem alguma cantora nacional que gostaria de dividir o palco com ela, teria prazer em dividir? Existe alguma no momento?
02/10/1995|Gal Costa|216|Gal Costa|Não, eu já dividi palco com Bethânia, com Elis [Regina], aliás eu tive a alegria de ter feito isso, ter sido a cantora brasileira que convidou Elis para participar do especial que eu fiz na Globo. E logo depois ela veio a falecer e, na época, algumas pessoas que não gostavam muito da Elis, no Rio, e até foram contra e tal... Mas eu queria muito, porque eu admirava Elis e depois que ela foi embora, então, eu tive mais certeza de que foi uma atitude muito certa.
02/10/1995|Gal Costa|217|Matinas Suzuki|A esse propósito, com relação ao tema Elis Regina, tem aqui vários faxes. O Marcelo Jabara, do Brooklyn, pergunta como foi para você quando cantou com a Elis Regina num especial para a TV Globo. O Paulo Freitas, do Tatuapé, pergunta como foi a sua relação com Elis Regina e como foi tê-la como convidada. Jorge Luis, da Vila Mariana, pergunta o que você sentiu com a perda da Elis Regina. O Gilberto Amaral, de Santo Amaro, pergunta também sobre o especial e quais comentários você teria sobre a Elis Regina?
02/10/1995|Gal Costa|218|Gal Costa|Bom, a minha relação com a Elis, eu não tinha uma relação assim muito próxima, mas a gente se falava por telefone, ela me ligava, me procurava, eu ligava para ela. Ela era muito carinhosa comigo e ela ia ver os meus shows, eu ia assistir shows dela e eu sei que ela gostava muito de mim e a gente tinha uma relação assim, quer dizer, era uma coisa meio de flerte à distância. E quando eu fiz o especial na Globo, que eu falei para o Daniel que eu queria convidar a Elis, ele falou assim: "Ela não vem, não convide que ela não vem". E eu falei: "Ela vem". Ela estava em Los Angeles, foi logo depois da morte do John Lennon. Então, nós ligamos para Los Angeles e falamos com Elis. Eu falei com a Elis, ela disse: "Eu estou indo rápido". E ainda perguntou assim: "Vamos cantar uma coisa do John Lennon, vamos cantar uma coisa em inglês"?. Eu disse: "Vem para cá, que aqui a gente decide o que fazer". Ela veio, foi para o Rio, a gente ensaiou e fez o programa e eu tinha admiração por ela. Inclusive, naquela época, o último disco dela eu estava ouvindo muito, até falei muito pro Caetano que eu estava ouvindo ela muito, aquele último disco dela. E eu a admirava como cantora, achava que ela era extremamente musical, ficava muito impressionada com a musicalidade dela e com a técnica dela. Eu gostava muito dela, nossa relação era legal.
02/10/1995|Gal Costa|219|João Marcelo Bôscoli|Em casa, para não deixar nenhuma dúvida, ela dizia que a Gal era a maior cantora do Brasil, sempre falou. E ela ouvia, um pouquinho antes de morrer, em dezembro, janeiro, novembro, ela ouviu Meu bem, meu mal, exaustivamente.
02/10/1995|Gal Costa|220|Gal Costa|Eu sabia que ela queria gravar essa música.
02/10/1995|Gal Costa|221|João Marcelo Bôscoli|Ela falava assim: "Desgraçada, gravou essa música". [risos]
02/10/1995|Gal Costa|222|Matinas Suzuki|Para esclarecer o nosso telespectador, o João Marcelo, que nos honra aqui com a presença hoje, é filho de Elis Regina.
02/10/1995|Gal Costa|223|Nizan Guanaes|Gal, mudando de um pólo ao outro completamente, hoje, a cidadã Gal Costa se sente como no Brasil? Quer dizer, você votou em quem nas últimas eleições, está feliz com o seu voto?
02/10/1995|Gal Costa|224|Gal Costa|Eu votei em Fernando Henrique. Eu ia votar no Lula, mas depois optei por Fernando Henrique. Eu ia votar no Lula pelo seguinte: porque eu achava que o Brasil tinha que passar por uma radicalização. Eu não sei se o PT seria, eu não entendo de política, vou aqui dizer o que me ocorreu na época. Eu não sei se o PT tinha capacidade ou consistência para governar o país, mas eu achava que o Brasil tinha que passar por um abismo, sei lá! Por um processo radical, talvez o PT fosse o abismo naquele momento e daí como se passasse por uma limpeza geral e recomeçar num fôlego novo. Mas eu acabei votando no Fernando Henrique. Não votei no Lula.
02/10/1995|Gal Costa|225|Matinas Suzuki|O Gil e o Chico foram mais fortes ["eles votaram no PT"..., diz Gal] no poder de convencimento? [risos]
02/10/1995|Gal Costa|226|Nizan Guanaes|O Chico não.
02/10/1995|Gal Costa|227|Matinas Suzuki|Desculpe, o Gil, o Chico apoiava o Lula.
02/10/1995|Gal Costa|228|Gal Costa|O Chico votou no PT.
02/10/1995|Gal Costa|229|Matinas Suzuki|Mas, Gal, você acha que o Brasil melhorou, você está satisfeita, acha que tem um caminho, estamos num caminho ou não estamos, ainda falta muito que fazer?
02/10/1995|Gal Costa|230|Gal Costa|Acho que o Brasil está melhor. Eu acho que tem muitas dificuldades, mas eu acho que está melhor. Eu acho que o povo hoje é mais consciente, e de certa forma, hoje eu acho que as pessoas podem se programar, coisa que não acontecia na época da alta inflação. Quer dizer, você tem um dinheiro, você pode se programar.
02/10/1995|Gal Costa|231|Matinas Suzuki|Por falar em dinheiro, tem um fax que eu não estou achando aqui, peço desculpas ao telespectador que enviou. Você tinha dinheiro no [banco] Econômico [em 1995, o 8º maior banco privado brasileiro, sofreu intervenção do Banco Central, o que o levou, mais tarde, à sua extinção] Gal?
