DATA|ENTREVISTA|ORDEM|LOCUTOR|FALA
23/10/1995|Paulo Maluf|201|Paulo Salim Maluf|Veja, ele, depois do túnel Ayrton Senna... Eu dei para ele, naquele sábado - porque nós tínhamos o feriado do meio da semana, no dia 12, que era na quarta feira - para ele passar quatro dias fora, segunda, terça, quinta e sexta. Bom, e quero dizer o seguinte para você e vou ser muito claro: Reynaldo de Barros [secretário de Serviço e Obras e Vias Públicas da gestão Paulo Maluf (1993-1996), foi acusado de corrupção pela construção do Complexo Viário Ayrton Senna], que já foi prefeito [entre 1979 e 1982], um grande prefeito, que tem uma vida pública inatacável, um homem de bem, honrado e pode ser que seja meu candidato. Mas hoje, eu acho que a minha postura é de continuar trabalhando administrativamente. Ele pode ser meu candidato, é um grande candidato, o Pitta pode ser meu candidato, tem outros nomes que não estão no partido, mas estão sondando entrar no partido. Eu só digo o seguinte: hoje é cedo para você batizar um candidato e começar a campanha. Queremos continuar administrando esta cidade, porque eu fui eleito por quatro anos e não por três.
23/10/1995|Paulo Maluf|202|Josemar Gimenez|Agora, prefeito, além do doutor Pitta e do Reynaldo de Barros, o senhor disse quatro, quais são os outros dois?
23/10/1995|Paulo Maluf|203|Paulo Salim Maluf|Bem, é porque um está aqui e outro ele citou.
23/10/1995|Paulo Maluf|204|Josemar Gimenez|Tá, o senhor falou que tem quatro. Quais são os outros dois?
23/10/1995|Paulo Maluf|205|Paulo Salim Maluf|São dois também de mais alta respeitabilidade.
23/10/1995|Paulo Maluf|206|Josemar Gimenez|São secretários também? Porque o que se comenta [por] aí é que os secretários do senhor tem...
23/10/1995|Paulo Maluf|207|Paulo Salim Maluf|[Interrompendo] Não, não são secretários.
23/10/1995|Paulo Maluf|208|Nirvano Beirão|Prefeito, e o doutor Olavo Setúbal [(1923-2008) engenheiro, banqueiro, foi prefeito da capital paulista, indicado pelo governador Paulo Egydio Martins de 1975 a 1979]? O senhor não esteve com ele? O senhor não propôs nada a ele? Quer dizer, toda essa tranqüilidade que o senhor está demonstrando e tudo, nesse caso, não pararia tudo e seria o doutor Olavo?
23/10/1995|Paulo Maluf|209|Paulo Salim Maluf|Doutor Olavo Setúbal foi um grande prefeito desta cidade.
23/10/1995|Paulo Maluf|210|Nirlando Beirão|O senhor o procurou?
23/10/1995|Paulo Maluf|211|Paulo Salim Maluf|Ele? Procurei, almocei com ele junto com o doutor Roberto Paulo Richter e a razão do almoço com ele foi a seguinte: existe uma polêmica muito grande sobre a reurbanização da Avenida Paulista. E o Banco Itaú, do qual ele é presidente, fez uma campanha exatamente escolhendo a Avenida Paulista como símbolo da cidade de São Paulo. Então, disse o seguinte: "doutor Olavo, você foi um grande prefeito, um grande homem público, eu acho que você poderia ser o presidente da Associação Avenida Paulista Viva, e eu lhe dou todas as prerrogativas de ser o prefeito da Avenida Paulista. Você reúne quem você quiser: arquitetos, engenheiros, empresários, diga o projeto que você quer fazer e eu assino [embaixo]." Ele aceitou. E, depois de amanhã, eu estou muito honrado, muito feliz que um homem do nome de Olavo Egydio Setúbal vai tomar posse da presidência dessa comissão e prestar mais esse serviço para São Paulo. Agora, se ele aceitar a ser candidato a prefeito, quero dizer que ele é um forte candidato à vitória.
23/10/1995|Paulo Maluf|212|Josemar Gimenez|É um dos quatro, prefeito?
23/10/1995|Paulo Maluf|213|Paulo Salim Maluf|Eu não conversei com ele, e vocês me deixariam muito constrangido em fazer um convite para alguém pela televisão, isso, no mínimo, seria uma deselegância total. Quero dizer o seguinte: ele já foi um grande prefeito, ele seria grande em tudo neste país, grande ministro da Fazenda, grande presidente da República, grande governador de São Paulo, agora, é um problema pessoal dele saber se entra de novo na vida pública.
23/10/1995|Paulo Maluf|214|Matinas Suzuki|Agora prefeito, o senhor tem fama...
23/10/1995|Paulo Maluf|215|Paulo Salim Maluf|[Interrompendo] Agora, se ele entrar na vida pública, quero dizer muito claro: São Paulo se enriquece com isso.
23/10/1995|Paulo Maluf|216|Matinas Suzuki|O senhor tem fama de não transferir voto, o senhor acha que isso é um mito?
23/10/1995|Paulo Maluf|217|Paulo Salim Maluf|Olha, Matinas, realmente, a transferência de votos não é uma coisa que a população brasileira aceite muito. Veja, no auge da popularidade do Juscelino [Kubitschek], tem uma derrota tão grande com o [Marechal] Lott [Teixeira Lott]. Você vê, no caso das prefeituras de São Paulo, por exemplo, nunca ninguém elegeu o seu sucessor, então, é uma coisa relativa. Eu tenho uma pesquisa que pode ser válida que diz o contrário, que 25% da população gostaria de votar num candidato apoiado por mim, porque o próprio Data Folha, o último, indica o seguinte: 40% da população acha Maluf ótimo e bom e 41% regulável, ou seja, tem 81% de aprovação quando, Jânio Quadros no fim dos quatro anos teve 61%, e Luiza Erundina, no fim dos quatro anos, teve 67%. Então, eu estou feliz que eu estou com 81% e não completei ainda três anos, vou tentar conquistar até um pouquinho mais. Agora, se isso a gente vai transferir ou não para o meu candidato, eu não sei, mas que eu gostaria, Matinas, que o futuro prefeito de São Paulo continuasse o Cingapura, o PAS, as laqueaduras e a vasectomia; que continuasse com o projeto São Paulo Cidade Saudável, os projetos sociais e os projetos urbanistícos. Eu gostaria que o meu sucessor fosse alguém que não jogasse tudo na lata do lixo como fizeram e pararam as obras, e que continuasse essa obra que está sendo feita. Eu gostaria que o meu sucessor continuasse a minha obra.
23/10/1995|Paulo Maluf|218|Matinas Suzuki|Prefeito, nós temos que fazer agora um breve intervalinho e voltaremos daqui a pouco com o segundo tempo da entrevista com o prefeito Paulo Maluf, até já.
23/10/1995|Paulo Maluf|219|[intervalo]|intervalo]
23/10/1995|Paulo Maluf|220|Matinas Suzuki|Bem, nós voltamos com o Roda Viva, que está entrevistando esta noite o prefeito Paulo Salim Maluf [...] Prefeito, o senhor também organizou, ou melhor, a prefeitura organizou uma maratona recentemente e há uma contestação, com relação a essa maratona, de que o senhor teria pago um milhão e duzentos mil dólares à Rede Globo de Televisão pela realização dessa maratona, quando em qualquer outro evento esportivo é a emissora que paga pela transmissão e não o contrário. Como o senhor responde essa questão?
23/10/1995|Paulo Maluf|221|Paulo Salim Maluf|Bom, [em] primeiro lugar, eu não paguei. Quem pagou foi a prefeitura, em segundo lugar, não foi pago pela transmissão, foi pago conforme... inclusive, a Rede Globo...
23/10/1995|Paulo Maluf|222|Marcelo Beraba|Desculpe prefeito.
23/10/1995|Paulo Maluf|223|Paulo Salim Maluf|Espera. Espera.
23/10/1995|Paulo Maluf|224|Marcelo Beraba|[Interrompendo] Desculpe. O contrato não diz isso. O contrato diz [que pagou] pela transmissão. O senhor... Estou lhe mostrando o contrato aqui [mostra o contrato]
23/10/1995|Paulo Maluf|225|Paulo Salim Maluf|[Interrompendo] Espera um pouquinho. Se você não me deixa terminar de falar...
23/10/1995|Paulo Maluf|226|Marcelo Beraba|Não. Eu entendi que o senhor tinha sido claro.
23/10/1995|Paulo Maluf|227|Paulo Salim Maluf|Eu vou ser muito claro.
23/10/1995|Paulo Maluf|228|Marcelo Beraba|[Interrompendo] Que o senhor não pagou pela transmissão.
23/10/1995|Paulo Maluf|229|Paulo Salim Maluf|Você acha que a Rede Globo... que dez minutos, que custa um milhão e duzentos [dólares], que a Rede Globo vai fazer três ou quatro horas de transmissão por um milhão e duzentos [dólares]?
23/10/1995|Paulo Maluf|230|[Sobreposição de vozes]|Sobreposição de vozes]
23/10/1995|Paulo Maluf|231|Paulo Salim Maluf|Perdão, um milhão e duzentos foi pago pela organização, e, evidentemente, como foi pago pela organização, eles tinham que transmitir. Eles iriam pagar pela transmissão e não iriam transmitir? É lógico, ora!
23/10/1995|Paulo Maluf|232|[Sobreposição de vozes]|Sobreposição de vozes]
23/10/1995|Paulo Maluf|233|Marcelo Beraba|Então, por que colocar isso no contrato, prefeito?
23/10/1995|Paulo Maluf|234|Paulo Salim Maluf|Espera. Espera um pouquinho.
23/10/1995|Paulo Maluf|235|Marcelo Beraba|Se é uma coisa tão óbvia, então por que colocar isso no...
23/10/1995|Paulo Maluf|236|Paulo Salim Maluf|[Interrompendo] Óbvia porque é o seguinte: veio uma corredora russa, alguém pagou a passagem dela e ela não chegou no dia, ela veio quinze dias antes, treinou, alguém pagou hotel e o restaurante. Vieram corredores americanos, vieram corredores do Brasil inteiro, vieram corredores da Ásia, ou seja, tinha mais de cinco mil corredores. Perdão, [sobreposição de vozes] a pergunta foi feita por ele, eu estou aqui até às três da manhã, me deixa responder ao Matinas, em seguida você pode interromper, está bom?
23/10/1995|Paulo Maluf|237|Marcelo Beraba|Por favor.
23/10/1995|Paulo Maluf|238|Paulo Salim Maluf|Eu nunca te interrompi. Então, foram pagos para cinco mil corredores, alguns que vieram do outro lado do Brasil, e tivemos que pagar, evidentemente, a estadia, outros vieram de outras partes do mundo, tivemos que pagar a passagem e a estadia. O primeiro lugar brasileiro ganhou um automóvel, a primeira colocada brasileira ganhou também um carro, então, a organização, conforme matéria paga pela Globo, essa organização custou um milhão e duzentos [dólares] e eles tinham a obrigação de transmitir. Agora, veja o seguinte: as maratonas do mundo, a de Nova Iorque, a de Boston, as maratonas européias... Esta maratona promoveu como jamais a cidade de São Paulo foi promovida para o resto do Brasil, com toda a sua beleza, com seus encantos.
23/10/1995|Paulo Maluf|239|Matinas Suzuki|É muito questionável, não é prefeito?
23/10/1995|Paulo Maluf|240|Paulo Salim Maluf|São Paulo hoje, Matinas, você sabe que vive...
23/10/1995|Paulo Maluf|241|Matinas Suzuki|[Interrompendo] Passou nas obras que o senhor inaugurou.
23/10/1995|Paulo Maluf|242|Paulo Salim Maluf|Ah sim. Eu já vou te falar, já chego lá também. [São Paulo] vive de turismo. Turismo de quê? Turismo de negócios, turismo de quem vem ver as feiras do Anhembi, turismo universitário, turismo de compras. São Paulo não é mais o maior centro industrial da América Latina, ele tem ainda uma indústria muito importante, as indústrias pequenas, as indústrias, por exemplo, elétricas, eletrônicas, mecânicas, pequenos artesanatos, pequenas indústrias têxteis, enfim, São Paulo vive basicamente desse turismo, tanto é que você vê... Quantos novos hotéis estão sendo construídos em São Paulo?
23/10/1995|Paulo Maluf|243|Matinas Suzuki|[Interrompendo] Existe uma corrida tradicional, em São Paulo, que é a corrida de São Silvestre. Esta sim é tradicional, promovida durante anos pela Gazeta Esportiva. Por que a prefeitura não fez com a Gazeta a corrida de São Silvestre? Não deu um milhão e duzentos mil dólares para a Gazeta? Por que a Gazeta não vincula nacionalmente?
23/10/1995|Paulo Maluf|244|Paulo Salim Maluf|Bom, em primeiro lugar, é evidente que, para a cidade de São Paulo, a mídia interessa.
23/10/1995|Paulo Maluf|245|Matinas Suzuki|Então, o senhor está pagando vinculação de um milhão e duzentos.
23/10/1995|Paulo Maluf|246|Paulo Salim Maluf|Não senhor [sobreposição de vozes]. A Globo aceitou fazer nacionalmente por quatro horas, e aquilo que foi pago foi ínfimo em relação, inclusive, à corrida de Fórmula I, onde vocês nunca reclamaram.
23/10/1995|Paulo Maluf|247|Marcelo Beraba|O SBT disse claramente que não cobraria.
23/10/1995|Paulo Maluf|248|Paulo Salim Maluf|O SBT não disse que não cobraria. Não disse. Porque o doutor Roberto Paulo Richter ligou para o Guilherme Stoliar, ele disse que aquela declaração ele nunca deu.
23/10/1995|Paulo Maluf|249|Marcelo Beraba|Imagina.
23/10/1995|Paulo Maluf|250|Paulo Salim Maluf|[Interrompendo] Dá licença. Então, você está autorizado a falar com o SBT.
23/10/1995|Paulo Maluf|251|Marcelo Beraba|Não tenho dúvida.
23/10/1995|Paulo Maluf|252|Paulo Salim Maluf|Espera um pouquinho. Para que ele transmita a próxima e pague toda a organização gratuitamente. Está certo?
23/10/1995|Paulo Maluf|253|Marcelo Beraba|Não tenho dúvida, agora, posso me colocar, prefeito, posso falar?
23/10/1995|Paulo Maluf|254|Paulo Salim Maluf|Perdão, eu ainda não respondi ao Matinas. Você perguntou se passou sobre obras?
23/10/1995|Paulo Maluf|255|Matinas Suzuki|Não... Porque no trajeto evidente que passou...
23/10/1995|Paulo Maluf|256|[sobreposição de vozes]|sobreposição de vozes]
23/10/1995|Paulo Maluf|257|Paulo Salim Maluf|Eu quero dizer a você o seguinte: eu não fiz o trajeto e, evidentemente, vocês hão de acreditar que não é função do prefeito. Foi feito pela Globo com a Secretaria de Esportes, agora, eu não fiquei triste [risos] eu fiquei muito alegre que passou no túnel Ayrton Senna.
23/10/1995|Paulo Maluf|258|Matinas Suzuki|Coincidência, não é prefeito?
23/10/1995|Paulo Maluf|259|[Risos]|Risos]
23/10/1995|Paulo Maluf|260|Paulo Salim Maluf|Fiquei muito alegre, e ainda hoje como disse, almoçando na [revista] Veja me fizeram a mesma pergunta, e eu disse o seguinte: se passar aqui em frente à Veja, na [avenida] Marginal iria ter que passar numa obra minha, porque essa obra fui eu que fiz quando fui prefeito da outra vez. Então, se você andar quarenta quilômetros na cidade de São Paulo, você vai passar em algumas dezenas ou centenas de obras minhas. E eu me orgulho disso, que São Paulo tem obra para mostrar, graças a Deus.
23/10/1995|Paulo Maluf|261|Marcelo Beraba|Desculpe prefeito. O juiz Wilson Gomes de Melo, da quarta Vara da Fazenda Pública, determinou que o senhor devolva aos cofres públicos todo esse dinheiro. O senhor vai devolver? É uma liminar, é Justiça!
23/10/1995|Paulo Maluf|262|Paulo Salim Maluf|E eu vou te perguntar, você entende alguma coisa de direito?
23/10/1995|Paulo Maluf|263|Marcelo Beraba|Alguma coisa.
23/10/1995|Paulo Maluf|264|Paulo Salim Maluf|Eu quero dizer, então, claro para você, como chama esse juiz?
23/10/1995|Paulo Maluf|265|Marcelo Beraba|Chama-se Wilson Gomes de Melo, da quarta Vara.
23/10/1995|Paulo Maluf|266|Paulo Salim Maluf|Eu tenho todo o respeito pela Justiça. Já tive sete desembargadores trabalhando comigo nos meus governos, mas se eu fosse um examinador de uma banca para juiz, com essa tese, ele seria reprovado, porque não tem liminar onde o indivíduo...
23/10/1995|Paulo Maluf|267|Marcelo Beraba|[Interrompendo] A liminar só é boa quando favorece o senhor. A Justiça é boa quando ele favorece...
23/10/1995|Paulo Maluf|268|Paulo Salim Maluf|[Interrompendo] Mas o que eu digo eu mantenho. Não tem liminar que possa entrar no mérito e obrigar uma ação. Ele poderia obrigar a devolver, no final da ação popular, depois de transitado e julgado. Eu tinha direito a ir ao Superior Tribunal da Justiça e direito de ir até o Supremo, como foi no caso dos automóveis, está certo? Então, quero dizer o seguinte: essa sentença é absurda. É absurdo ele dizer o seguinte: "pagou tem que devolver", antes de entrar no mérito de uma liminar. Não tenho nem uma dúvida que esta liminar vai cair, porque ela é absolutamente ilegal.
23/10/1995|Paulo Maluf|269|Marcelo Beraba|Sim, mas não caiu. Da mesma maneira que não caiu o cigarro ainda, e o senhor insiste em ser Justiça, acima da Justiça.
23/10/1995|Paulo Maluf|270|Paulo Salim Maluf|[Interrompendo] Essa liminar eu lhe digo que é ilegal. Eu lhe digo o seguinte: é uma pena que você não concorde comigo, não sei por quê. Numa liminar, o juiz não pode entrar no mérito e decidir, não pode. Ele errou. O juiz errou e sabe que errou, e eu li na Folha de S.Paulo que o jurista Ives Gandra da Silva Martins, que você deve ter lido, disse também que o juiz errou, não disse?
23/10/1995|Paulo Maluf|271|Marcelo Beraba|O senhor vai devolver o dinheiro?
23/10/1995|Paulo Maluf|272|Paulo Salim Maluf|Você leu ou não leu?
23/10/1995|Paulo Maluf|273|Marcelo Beraba|Eu li. O senhor vai devolver ou não? Bom, e outros dizem que não.
23/10/1995|Paulo Maluf|274|Paulo Salim Maluf|Essa decisão é absolutamente ilegal. Em primeiro lugar, não foi eu que assinei o contrato, quem assinou o contrato foi o secretário de Esportes, que assumiu toda a responsabilidade pelo contrato. Segundo lugar, eu l i na Folha de S.Paulo, que você deve ler...
23/10/1995|Paulo Maluf|275|Marcelo Beraba|[Interrompendo] Uma das opiniões.
23/10/1995|Paulo Maluf|276|Paulo Salim Maluf|Que o jurista Ives Gandra Martins disse que essa decisão é ilegal.
23/10/1995|Paulo Maluf|277|Marcelo Beraba|[Ele] Não é juiz, é um jurista. Ele não decide.
23/10/1995|Paulo Maluf|278|Paulo Salim Maluf|[Interrompendo] Mas se ele teve coragem de dizer...
23/10/1995|Paulo Maluf|279|Marcelo Beraba|Assim como se ouvem outros, prefeito, que dizem ao contrário. Esse é o papel da imprensa.
23/10/1995|Paulo Maluf|280|Paulo Salim Maluf|[Interrompendo] Se ele teve coragem de dizer que essa decisão era ilegal, não vale então...
23/10/1995|Paulo Maluf|281|Marcelo Beraba|Esse é o papel da imprensa, é ouvir vários lados. Talvez seja difícil para o senhor entender, mas esse é o papel.
23/10/1995|Paulo Maluf|282|Paulo Salim Maluf|[Interrompendo] Então me faça o favor, se esse é o papel da imprensa me ouça amanhã outros dez juristas que me digam que, se em uma liminar de mandato de segurança, ele pode entrar no mérito e mandar devolver o dinheiro.
23/10/1995|Paulo Maluf|283|Marcelo Parada|Agora, prefeito, os juristas também se posicionam contra isso que o Marcelo Beraba está falando. Posicionam-se contra essa medida do cigarro e o senhor não demonstra essa mesma veemência contra os juristas. Quer dizer, fica a sensação de que a Justiça, quando vai a seu favor é...
23/10/1995|Paulo Maluf|284|Paulo Salim Maluf|[Interrompendo] Essa decisão é ilegal, e quando existe uma decisão do presidente do Tribunal de Justiça que diz que é legal, para mim, o que eu fico é com a decisão da Justiça.
23/10/1995|Paulo Maluf|285|Marcelo Parada|Prefeito, agora, independente da discussão jurídica, para qualquer cidadão com o mínimo de bom senso, ficou absolutamente evidente que a transmissão daquela maratona tinha uma finalidade da propaganda da administração do senhor, mesmo que diga o contrário. Mas o senhor pode fazer uma pesquisa aí, com qualquer pessoa que assistiu a maratona, para ver se aquilo lá teve ou não a finalidade de pura propaganda.
23/10/1995|Paulo Maluf|286|Marcelo Beraba|Tanto que a comparação que o senhor faz é essa, o que ganhou com a transmissão da [Rede] Globo, essa é a comparação que o senhor faz.
23/10/1995|Paulo Maluf|287|Paulo Salim Maluf|Eu me sinto muito honrado.
23/10/1995|Paulo Maluf|288|Marcelo Beraba|Não duvido.
23/10/1995|Paulo Maluf|289|Paulo Salim Maluf|E me sentiria envergonhado se qualquer maratona nesta cidade não tivesse uma obra minha. Se você andar nas marginais Pinheiros e Tietê, são obras do Paulo Maluf. E o seu jornal disse há vinte e cinco anos que eram obras faraônicas. Se você andar no Minhocão, que foi tão criticado, é obra sim do Paulo Maluf. Se você entrar na Estação Rodoviária do Tietê, que diziam que era faraônica, hoje ficou pequena. Se você vier de avião pelo aeroporto de Cumbica, de Guarulhos, que todo mundo dizia que era faraônica, também é obra do Paulo Maluf junto com a aeronáutica. Se você andou no metrô...
23/10/1995|Paulo Maluf|290|Luciano Suassuna|[Interrompendo] Se investigar a Paulipetro, não se descobriu uma gota de petróleo nesse estado, não é prefeito? Pelo amor de Deus.
23/10/1995|Paulo Maluf|291|Paulo Salim Maluf|Perdão! Estamos falando por enquanto da maratona, já respondo para você. Se você andar de metrô na cidade de São Paulo; você lembra quando [José Vicente] Faria Lima e, em seguida, eu começamos o metrô no Jabaquara e em Santana? Todo mundo criticava o metrô de São Paulo, dizendo que não precisava do metrô. No entanto, estão aí dizendo agora, por que não aumenta um pouco mais o metrô? Então, eu me orgulho muito viu, Marcelo, mas muito, de tudo aquilo que fiz nesta cidade. Eu amo São Paulo, eu adoro São Paulo. E se eu tenho um arrependimento é pelas obras que eu ainda não fiz. Vou continuar trabalhando 16 horas por dia para fazer mais túnel, viadutos, Cingapura, obras sociais, saúde pública, educação. Amanhã estou no Jabaquara, inaugurando uma creche com mais [programa] Leve Leite. Enfim, eu amo esta cidade e vou continuar trabalhando por ela. Agora, se uma maratona mostrou essas obras é porque elas existem.
23/10/1995|Paulo Maluf|292|Pedro Cafardo|Senhor prefeito, eu gostaria então de falar a respeito de uma obra. Me parece que a maratona não passou no Minhocão, o senhor citou o Minhocão aqui, e para quem não é de São Paulo, Minhocão é um elevado, o elevado Costa e Silva, que atravessa o centro da cidade e tem uns três quilômetros mais ou menos, e que deteriorou uma área central de São Paulo, construída pelo senhor Paulo Maluf em 1970. O senhor se arrependeu de fazer o Minhocão?
23/10/1995|Paulo Maluf|293|Paulo Salim Maluf|Não. Porque em primeiro lugar, a Avenida São João, você sabe muito bem, já era uma área, há vinte e cinco anos, que não era das melhores para você morar. Em segundo lugar, se você hoje chega a Londres, você sai do aeroporto de Heathrow, e vai até o centro de Londres por um Minhocão que passa ao lado de prédios. Se você chega a Buenos Aires, você sai do [aeroporto] Ezeiza até o centro de Buenos Aires num Minhocão. Se você vai na Périphérique [Via perimetral] de Paris, que são as suas marginais, todas elas por minhocões, e não são de quatro fachos de tráfico não....
23/10/1995|Paulo Maluf|294|Pedro Cafardo|[Interrompendo] Mas nenhuma dessas obras, prefeito, fecham à noite.
23/10/1995|Paulo Maluf|295|Paulo Salim Maluf|Perdão. São de oito fachos de tráfego ao lado de prédios e apartamentos. Se você vai a Nova Iorque, desde o tempo do [aeroporto] La Guardia, antes da Segunda Grande Guerra, no Hudson River e no East River, tem minhocões em volta da cidade ao lado de prédios de apartamentos. Então, quero dizer para você que a solução adotada em São Paulo não foi nada diferente da solução que foi adotada em outros países. Mas, eu chego agora no Japão, em Tóquio onde exatamente é um lugar muito espremido, porque o Japão tem 120 milhões de habitantes num território menor do que o estado de Minas Gerais. Pois bem, nós temos em Tóquio lugares onde tem sete andares de minhocões. Tem três abaixo, onde você tem dois metrôs e um trem de subúrbio. Você tem um no térreo e tem mais três acima. Então, Tóquio, porque é uma cidade exatamente onde não tem território, tem lugar que tem sete minhocões. É uma solução que, eu quero dizer para vocês muito claramente, tomei a melhor solução, e se vocês quiserem ver as conseqüências da não existência do Minhocão, respondendo a você, eu peço a você que lute, no seu jornal, para fechar o Minhocão por uma semana, aí você vai ver a utilidade que ele tem.
23/10/1995|Paulo Maluf|296|Matinas Suzuki|Agora prefeito, Minhocão, túnel, marginais são só obras para [meios de] transportes individuais e para quem tem acesso ao carro.
23/10/1995|Paulo Maluf|297|Paulo Salim Maluf|[Interrompendo] Não senhor, onde o transporte individual vai mais rápido o transporte coletivo também vai mais rápido.
23/10/1995|Paulo Maluf|298|Matinas Suzuki|Há um conceito, quase que um consenso hoje universal, que a política tem que ser política de transportes coletivos, coisa que o senhor, aparentemente, investe menos do que nas obras para carros particulares.
23/10/1995|Paulo Maluf|299|Paulo Salim Maluf|Não é verdade, Matinas. Quem instalou os trens de subúrbio na cidade de São Paulo...
23/10/1995|Paulo Maluf|300|Matinas Suzuki|[Interrompendo] Mas o que está sendo feito agora quanto a isso para aumentar...
23/10/1995|Paulo Maluf|301|Paulo Salim Maluf|[Interrompendo] Perdão. Você tem que colocar na minha vida pública, quem instalou os trens de subúrbio da Fepasa foi o Paulo Maluf, que hoje transporta mais de um milhão de passageiros. Contra tudo e contra todos, quando nós compramos os trens novos tivemos todo tipo de oposição contra aquele projeto, porque nós mudamos a bitola da antiga [empresa ferroviária] Sorocabana, de um metro para um 1,70m para poder dar interpenetração na antiga Central do Brasil e na antiga Santos/Jundiaí. E se hoje nós temos um transporte só, reunificado na bitola de 1,70m, foi graças ao nosso projeto. Sobre o metrô: 50% do metrô de São Paulo foram construídos quando Paulo Maluf foi prefeito e Paulo Maluf foi governador, e se hoje....
23/10/1995|Paulo Maluf|302|Matinas Suzuki|[Interrompendo] Prefeito. Com tanto dinheiro que o senhor tem, por que não faz um acordo com o governo estadual para construir metrô em vez de..
23/10/1995|Paulo Maluf|303|Paulo Salim Maluf|[Interrompendo] Então, vou fazer agora aqui um compromisso público.
23/10/1995|Paulo Maluf|304|Matinas Suzuki|O senhor poderia financiar o governo, se o seu espírito é tão público; o senhor poderia financiar para o estado, podia estar...
