DATA|ENTREVISTA|ORDEM|LOCUTOR|FALA
23/10/1995|Paulo Maluf|305|Paulo Salim Maluf|[Interrompendo] Eu agradeço esse elogio, porque a prefeitura de São Paulo, que tem um orçamento que é um quarto do orçamento do governo do estado, financiar o governo, quer dizer: é um banquinho pequenininho financiando o Banco do Brasil. Eu agradeço esse elogio e faço aqui um compromisso público: se o governador Mario Covas me procurar, de maneira séria, e quiser um programa em conjunto para a cidade de São Paulo que tenha como escopo metrô mais o grande anel. Se ele quiser fazer um acordo de conjunto, eu faço um convênio com ele e pago [sobreposição de vozes].
23/10/1995|Paulo Maluf|306|Josemar Gimenez|O governo do estado disse que já procurou o senhor, prefeito, está esperando uma resposta, o governador Covas, sobre o metrô agora...
23/10/1995|Paulo Maluf|307|Paulo Salim Maluf|Você publicou no seu jornal?
23/10/1995|Paulo Maluf|308|Josemar Gimenez|Não. O governo do estado disse.
23/10/1995|Paulo Maluf|309|Paulo Salim Maluf|Se você não publicou no seu jornal não existiu essa notícia.
23/10/1995|Paulo Maluf|310|[Risos]|Risos]
23/10/1995|Paulo Maluf|311|Josemar Gimenez|Mas o governo estadual disse que está esperando essa resposta do senhor, para ver se dá para trabalhar em conjunto com relação a isso.
23/10/1995|Paulo Maluf|312|Paulo Salim Maluf|O meu telefone é 225-9077.
23/10/1995|Paulo Maluf|313|Pedro Cafardo|O governador [Mario] Covas nunca conversou com o senhor sobre isso?
23/10/1995|Paulo Maluf|314|Paulo Salim Maluf|De maneira absolutamente concreta não.
23/10/1995|Paulo Maluf|315|Pedro Cafardo|Ele disse que já conversou.
23/10/1995|Paulo Maluf|316|Pedro Cafardo|Quais são as condições que o senhor impôs?
23/10/1995|Paulo Maluf|317|Paulo Salim Maluf|Eu não impus condição nenhuma. Não conversamos que condição se impõe?
23/10/1995|Paulo Maluf|318|Marcelo Beraba|Não. O senhor falou que tiveram uma conversa.
23/10/1995|Paulo Maluf|319|Paulo Salim Maluf|Não. [Em] Primeiro lugar é o seguinte, a solução do problema das marginais de São Paulo não é, como muita gente diz, construir viadutos por cima. Nada disso. Você veja o absurdo que existe. No limite, vamos raciocinar: um caminhão, que venha de Belém do Pará, e ele se destine a Porto Alegre, por que razão ele tem que passar dentro da cidade de São Paulo? Essa é a pergunta que se faz: ele tem que passar dentro da cidade de São Paulo? Um caminhão que vem de Belo Horizonte em direção, por exemplo, a Curitiba, tem que passar dentro da cidade de São Paulo. Então, a solução para o problema de poluição nas marginais e o problema de trânsito de transporte coletivo é o "grande anel". É um anel a trinta quilômetros de distância das atuais marginais que, por exemplo: quem vem do Rio de Janeiro para Santos, quando chegar à altura de Arujá, ele já pode entrar para cima da serra para chegar à serra onde estaria a via Anchieta ou a rodovia dos Imigrantes. Unir a rodovia dos Imigrantes em continuação até chegar à Raposo Tavares, à BR 116, à Castelo Branco, à Anhanguera, à Bandeirantes, à Fernão Dias e até chegar, novamente, ao viaduto. Então, se você tiver um grande anel por fora, esses caminhões seriam todos desviados dentro do trânsito da cidade de São Paulo. Ou seja, essa é uma obra para o governo do estado, porque a prefeitura de São Paulo não pode realizar obras em outros municípios, eu só posso realizar dentro. Mas eu estou disposto, até não sei se é deselegante eu fazer uma proposta ao governador de maneira pública, mas eu quero dizer o seguinte: eu nasci para trabalhar, governo não foi feito para reclamar, foi feito para resolver.
23/10/1995|Paulo Maluf|320|Nirlando Beirão|O senhor está falando do governador Mario Covas?
23/10/1995|Paulo Maluf|321|Paulo Salim Maluf|Eu estou dizendo que governo não foi feito para reclamar, foi feito para resolver, e é assim que eu estou aqui, neste desafio, dizendo o seguinte: eu sento com o governador e faço um pacote para a cidade de São Paulo, ele faz a parte dele e a parte dele dentro da cidade de São Paulo, que ele não pode fazer, eu ajudo.
23/10/1995|Paulo Maluf|322|Marcelo Parada|Agora prefeito, o senhor fala da cidade limpa, fala do transporte público...
23/10/1995|Paulo Maluf|323|Paulo Salim Maluf|[Interrompendo] Agora, alguém fez uma pergunta aqui que eu não respondi. Perdão, eu quero responder a todos pela ordem.
23/10/1995|Paulo Maluf|324|Luciano Suassuna|Sobre a Paulipetro. Sobre a exploração de petróleo, Paulipetro.
23/10/1995|Paulo Maluf|325|Paulo Salim Maluf|Pois muito bem, eu estou hoje muito alegre e muito feliz, mas numa alegria brutal...
23/10/1995|Paulo Maluf|326|Luciano Suassuna|[Interrompendo] Quanto o senhor gastou na Paulipetro?
23/10/1995|Paulo Maluf|327|Paulo Salim Maluf|Perdão, eu quero dizer a você que eu estou alegre e muito feliz, numa alegria brutal, porque há dezesseis anos eu tentei flexibilizar o monopólio do petróleo, fui criticado por gregos e troianos, quem mais me criticou foi o governador que me sucedeu, Franco Montoro [(1916-1999) eleito governador do estado de São Paulo, em 1982, na primeira eleição direta para o cargo desde 1965, com 5,5 milhões de votos. Ver entrevista com Montoro no Roda Viva]. E eu vejo que, depois de dezesseis anos, quem lutou pela flexibilização foi Fernando Henrique Cardoso, tucano, companheiro de Franco Montoro, e ele montou agora a flexibilização. Então, eu acho que, com dezesseis anos de diferença, eu estava certo.
23/10/1995|Paulo Maluf|328|Marcelo Beraba|Prefeito, ninguém discutia flexibilização, discutia?
23/10/1995|Paulo Maluf|329|Paulo Salim Maluf|E o que era a Paulipetro, senão a flexibilização?
23/10/1995|Paulo Maluf|330|Marcelo Beraba|Não senhor. Era gastar dinheiro onde se sabia que não iria ter nada.
23/10/1995|Paulo Maluf|331|Paulo Salim Maluf|Não senhor, não senhor.
23/10/1995|Paulo Maluf|332|[Sobreposição de vozes]|Sobreposição de vozes]
23/10/1995|Paulo Maluf|333|Paulo Salim Maluf|Não senhor. Não era essa discussão, não era essa a discussão, tanto que na bacia do [rio] Paraná...
23/10/1995|Paulo Maluf|334|Marcelo Beraba|É sim senhor. O senhor pode fazer, pode dar um "chantili" na história, mas não era essa a questão que está em jogo.
23/10/1995|Paulo Maluf|335|[Sobreposição de vozes]|Sobreposição de vozes]
23/10/1995|Paulo Maluf|336|Paulo Salim Maluf|Eu estou disposto a responder a todos. Vamos falar cada um no seu ponto.
23/10/1995|Paulo Maluf|337|Matinas Suzuki|Prefeito, eu quero que o senhor responda mais uma também. O senhor fez grande declaração de amor a São Paulo. Por que queria levar a capital, então, para o interior? [risos] Foi...
23/10/1995|Paulo Maluf|338|Paulo Salim Maluf|[Interrompendo] Dá licença. Eu amo São Paulo e adoro São Paulo, mas é evidente que você não pode dizer que você gosta da poluição de São Paulo. Não pode dizer que você gosta das favelas de São Paulo, e que tem problemas na cidade de São Paulo, que tem hoje dez milhões de habitantes, há problemas na sua região metropolitana de 17 milhões de habitantes, e problemas em Santo André, São Bernardo, São Caetano, Diadema, Mauá, Ribeirão Pires, Osasco e Guarulhos, que não existiriam se a grande São Paulo em vez de 17 milhões tivesse 15, 14, e se tivesse outro pólo de desenvolvimento com dois milhões de habitantes, quem sabe se teria evitado muita gente nessa periferia que não encontra emprego. Agora, sobre a Paulipetro, sobre a exploração de petróleo...
23/10/1995|Paulo Maluf|339|Luciano Suassuna|[Interrompendo] Para começar. Quanto o senhor gastou?
23/10/1995|Paulo Maluf|340|Paulo Salim Maluf|Em termo de petróleo, ínfimo. Quando você fala em trezentos milhões de dólares e você vê, por exemplo, que desde que foi fundada....
23/10/1995|Paulo Maluf|341|Luciano Suassuna|[Interrompendo] Não. Nós estamos falando de dinheiro público.
23/10/1995|Paulo Maluf|342|Paulo Salim Maluf|A Petrobras gastou vinte bilhões de dólares em projetos que não deram petróleo. Eu pergunto o seguinte: eu tive dois anos para pesquisar, a Petrobras foi fundada em 1954...
23/10/1995|Paulo Maluf|343|Marcelo Beraba|[Interrompendo] O senhor torrou 15% em dois anos.
23/10/1995|Paulo Maluf|344|Paulo Salim Maluf|Como?
23/10/1995|Paulo Maluf|345|Marcelo Beraba|Torrou 15% do que a Petrobras levou anos para gastar, o senhor torrou em dois anos.
23/10/1995|Paulo Maluf|346|Paulo Salim Maluf|15% de quê?
23/10/1995|Paulo Maluf|347|Marcelo Beraba|Ué! Do que a Petrobras gastou.
23/10/1995|Paulo Maluf|348|Paulo Salim Maluf|Quer dizer, um e meio.
23/10/1995|Paulo Maluf|349|Marcelo Beraba|Não. Por que um e meio?
23/10/1995|Paulo Maluf|350|Paulo Salim Maluf|De vinte bilhões, trezentos é 1,5 bilhão.
23/10/1995|Paulo Maluf|351|Paulo Salim Maluf|Não. Quinze tira três bilhões de dólares. Você errou na matemática me desculpe, é um e meio. Eu gastei um e meio, está certo? E eles gastaram 98 bilhões, eles pesquisaram na Amazônia, não encontraram, e em diversos lugares. Essa área da Bacia do Paraná, quem colocou em concorrência pública não foi a Paulipetro mas a Petrobras. Nós entramos numa concorrência pública com outras empresas. Agora, eu quero perguntar para vocês o seguinte: do lado de lá do rio [Paraná], na Argentina, tem gás, por que no lado de cá em Santa Catarina, Paraná e nós, São Paulo, não temos? Do lado de lá, na Bolívia, tem gás, por que Mato Grosso não tem? Na Amazônia Peruana, tiram cem mil barris dia, por que na Amazônia brasileira não tem? Então, será possível que Deus fez a fronteira geográfica do Brasil com os países latinos americanos, igualzinha a fronteira geológica? Ou seja, do lado de lá tem e do outro não tem. Eu vou dizer por que o lado de cá não tem. Porque enquanto os Estados Unidos perfuram sessenta mil poços por ano - os Estados Unidos é o mesmo tempo maior produtor do mundo, o maior consumidor e o maior importador - enquanto eles perfuram sessenta mil poços por ano, o Brasil até há pouco perfurava trezentos poços por ano. Então, evidente que estatisticamente eles encontram muito mais. Eu acho o seguinte: que a Petrobras pode continuar o seu papel, pois é uma grande empresa. Agora, por que outras empresas nacionais e estrangeiras não podem ajudar o Brasil a ser auto-suficiente? E é nisso onde o presidente Fernando Henrique Cardoso merece todo nosso apoio e nosso aplauso, porque ele mudou completamente a sua posição estatizante de anos atrás...
23/10/1995|Paulo Maluf|352|Matinas Suzuki|[Interrompendo] Mas o senhor não está querendo dizer, com isso, que o presidente apoiaria a criação da Paulipetro, que seria mais uma estatal nesse mundo de estatais, não é prefeito?
23/10/1995|Paulo Maluf|353|Paulo Salim Maluf|Eu quero dizer para você o seguinte, sobre a flexibilização: vão surgir inúmeras empresas estatais, paraestatais ou de economia mista com participação estatal minoritária ou majoritária. Vão surgir, se Deus quiser, porque é o seguinte: o problema de tornar o Brasil auto-suficiente em petróleo, eu acho que é um problema estratégico que todos nós temos que dar nossa contribuição. Não é monopólio da Petrobras...
23/10/1995|Paulo Maluf|354|Matinas Suzuki|[Interrompendo] O senhor concorda com o PT nessa questão então? Porque petróleo é questão estratégica.
23/10/1995|Paulo Maluf|355|Paulo Salim Maluf|Mas é lógico que é estratégica, mas ele só será nosso se for encontrado aqui dentro, se ele não for encontrado aqui dentro ele continuará sendo dos árabes e pago com dinheiro que nós não temos.
23/10/1995|Paulo Maluf|356|Matinas Suzuki|Prefeito, o Marcelo Parada, que nós interrompemos, peço a delicadeza da gente voltar.
23/10/1995|Paulo Maluf|357|Marcelo Parada|Prefeito. O senhor estava falando da cidade limpa e do transporte coletivo. Agora, a sua administração consagrou em São Paulo a proliferação indiscriminada do ônibus clandestino que polui adoidado, que transporta passageiros sem a menor segurança e, no entanto, há uma verdadeira complacência da sua administração na fiscalização desses ônibus, que além de sujar o ar da cidade de São Paulo, talvez de uma forma muito mais nociva que os cigarros nos restaurantes, transportam contingentes de paulistanos numa situação de insegurança absoluta.
23/10/1995|Paulo Maluf|358|Paulo Salim Maluf|Bom, eu acho que você se enganou com a sua palavra, não existe complacência.
23/10/1995|Paulo Maluf|359|Marcelo Parada|Como não, prefeito?
23/10/1995|Paulo Maluf|360|Paulo Salim Maluf|Não. Ao contrário, é aprovação.
23/10/1995|Paulo Maluf|361|Marcelo Parada|Certo.
23/10/1995|Paulo Maluf|362|Paulo Salim Maluf|Não é complacência, é aprovação. Porque na gestão passada eles eram perseguidos e todo o indivíduo que tem um emprego honesto, que você tira o seu emprego dele, ele vai se tornar bandido, pode lhe assaltar amanhã. Então, quando você tem um trabalhador que ganha sua vida honestamente, você tem que verificar como pode compatibilizar o trabalho dele com a legalidade. Então, o que é que nós fizemos? Eles eram clandestinos, hoje a palavra clandestino não tem mais conosco, são ônibus alternativos. O que eles fazem? [risos] Sim, esse é o nome. Basicamente o que eles fazem? Eles fazem o transporte bairro a bairro que as linhas regulares não fazem. Por quê?
23/10/1995|Paulo Maluf|363|Marcelo Parada|Vá até o corredor [da Avenida] Nove de Julho e vê se o senhor acha um?
23/10/1995|Paulo Maluf|364|Paulo Salim Maluf|De vez em quando eles aparecem lá sim.
23/10/1995|Paulo Maluf|365|[Risos]|Risos]
23/10/1995|Paulo Maluf|366|Marcelo Parada|De vez em quando não. Todos ao dias eles estão lá.
23/10/1995|Paulo Maluf|367|Paulo Salim Maluf|Sim, eles aparecem [por] lá. Mas o que eu quero dizer para você é muito claro: onde eu vir um trabalhador, eu não vou, em hipótese nenhuma perseguir um trabalhador. Eles foram regularizados, hoje nós sabemos quem são os proprietários dos ônibus e os motoristas, eles tem um custo muito mais barato do que das empresas e eles não tem cobrador. Eles fazem na sua maioria o transporte de bairro a bairro que as empresas não querem fazer, e eu acho que, ao contrário, não tem complacência não, tem aprovação.
23/10/1995|Paulo Maluf|368|Marcelo Parada|O senhor acha que...
23/10/1995|Paulo Maluf|369|Paulo Salim Maluf|Os ônibus alternativos estão sendo úteis à população. E tem mais, vou lhe dar uma informação: eles que usavam ônibus velhos, caindo os pedaços, eles estão ganhando dinheiro, cada um deles está se tornando um pequeno empresário e o Morelli, que é o presidente do sindicato, esteve comigo recentemente na prefeitura e me disse o seguinte, espero que ele não esteja mentindo, que eles vão comprar mil ônibus novos, os alternativos. Então, são empresários, que se formaram empresários a custa do seu próprio trabalho...
23/10/1995|Paulo Maluf|370|Marcelo Parada|Prefeito, eu, da minha parte, não entro em um ônibus clandestino nem que me paguem, eu morreria de medo e tenho pena do paulistano que tem que andar no transporte coletivo, acho que eles circulam numa condição de insegurança e, para a coletividade, a poluição que gera na cidade é uma coisa muito...
23/10/1995|Paulo Maluf|371|Paulo Salim Maluf|[Interrompendo] Eu te informo que não tem insegurança, porque todos os ônibus alternativos que eram clandestinos antes, e que hoje são alternativos, eles são fiscalizados regularmente nas oficinas da prefeitura.
23/10/1995|Paulo Maluf|372|Nirlando Beirão|Eu estou um pouco aflito aqui porque o tempo está passando e a gente...
23/10/1995|Paulo Maluf|373|Paulo Salim Maluf|Bem, eu não tenho problema de limite. Eu fico aqui até as três da manhã.
23/10/1995|Paulo Maluf|374|Matinas Suzuki|Nós temos.
23/10/1995|Paulo Maluf|375|Nirlando Beirão|O Matinas tem. Ele nos expulsa daqui. É nós não estamos falando de política, eu acho que a gente pode estar aqui participando de um, digamos, de um primeiro ato de uma campanha eleitoral. É visível, é óbvio isso, e nós não temos falado nesse assunto. Eu li hoje a manchete da Folha de S.Paulo, que o senador Antônio Carlos Magalhães, veio com uma idéia um pouco estranha e extravagante, de que deve haver reeleição para o Fernando Henrique, mas que esta questão só deve ser colocada depois que os atuais prefeitos tiverem deixado o seu cargo. O que o senhor acha da idéia do seu amigo Antônio Carlos Magalhães?
23/10/1995|Paulo Maluf|376|Paulo Salim Maluf|Bom, em primeiro lugar ele não diz que o presidente Fernando Henrique deve ser reeleito. Ele diz que o presidente Fernando Henrique deve ter o direito de se candidatar de novo. Se a população gostar dele, vai reelegê-lo, senão gostar dele não vai reelegê-lo, ou seja...
23/10/1995|Paulo Maluf|377|Nirlando Beirão|[Interrompendo] Quer dizer, o senhor poderia eventualmente ser um adversário do Fernando Henrique numa campanha?
23/10/1995|Paulo Maluf|378|Paulo Salim Maluf|Bom, eu tenho mais de 18 anos de idade, sou eleitor inscrito, sei ler e escrever, nada me impede. Agora eu acho que o Fernando Henrique...
23/10/1995|Paulo Maluf|379|Marcelo Beraba|[Com] a premissa dele, o senhor concorda?
23/10/1995|Paulo Maluf|380|Paulo Salim Maluf|Perdão, a premissa da reeleição, sim.
23/10/1995|Paulo Maluf|381|Marcelo Beraba|Para o Fernando Henrique, na sequência?
23/10/1995|Paulo Maluf|382|Paulo Salim Maluf|[Sobre] a pergunta: a premissa da reeleição, sim, pronto. Em primeiro lugar, eu explico: todos os países do Primeiro Mundo tem, ou no sistema presidencialista ou no parlamentarista, eles tem o preceito da reeleição. Por quê? É muito mais lógico, lícito, honesto e válido, você julgar o executivo depois que ele cumpriu o seu mandato, do que antes, quando ele era somente uma esperança. Então, eu posso lhe garantir o seguinte: muito governante brasileiro, e tome isso muito a sério, se soubesse que poderia passar pelo crivo de um segundo julgamento de uma eleição, ele seria mais correto, honesto, austero e tomaria um pouco mais de cuidado. Então, o instituto da reeleição existe nos Estados Unidos que é um país presidencialista, na França com sete anos, quer dizer, o François Miterrand teve 14, se não estivesse doente poderia ter 21, foi quase um reinado. Mas quem decide se ele vai ser reeleito ou não é o povo. Por isso a palavra reeleição está um pouco errada, deveria ser, sim, nova apresentação. Então, eu defendo isso sim, mas não vou mexer uma palha para que esse instituto me proteja eventualmente, não. Eu acho que deve ser aprovada a reeleição para todos os cargos do executivo, e que eu não devo mexer uma palha para o meu caso... [Em 1995, o então presidente Fernando Henrique Cardoso enviou ao Congresso uma série de emendas constitucionais, entre as quais a proposta de reeleição presidencial, aprovada no ano seguinte, em primeira votação]
23/10/1995|Paulo Maluf|383|Luciano Suassuna|Prefeito, no artigo da [revista] Isto É, o governador de Mato Grosso, Dante de Oliveira, defendeu a idéia da reeleição, mas disse que deve ser feito com plebiscito.
23/10/1995|Paulo Maluf|384|Paulo Salim Maluf|Não, ele acha que...
23/10/1995|Paulo Maluf|385|Luciano Suassuna|[Interrompendo] Ele acha que um plebiscito deve definir a reeleição.
23/10/1995|Paulo Maluf|386|Paulo Salim Maluf|Bom, plebiscito é uma das formas. Pode ser por plebiscito ou pelo próprio Congresso. O Congresso foi eleito para votar sim ou não, então, pode ser pelo Congresso. Pelo plebiscito é um pouco de zelo a mais. Eu acho o seguinte: que o Brasil tem muito a ganhar se os homens públicos do executivo souberem que vão ter que, no fim de seu mandato, prestar contas ao povo. É o povo que vai reeleger ou vai mandar o camarada para a sua casa, numa sanção social pior que a derrota.
23/10/1995|Paulo Maluf|387|Luciano Suassuna|Nessa área política, prefeito, o senhor trocou, quer dizer, mudou recentemente a sigla do seu partido de PPR para PPB com incorporação de alguns parlamentares do PP, e o presidente do seu partido, o senador Esperidião Amin, disse que, na verdade, foi trocado seis por meia dúzia, quer dizer só serviu para trocar siglas. O senhor concorda com isso?
23/10/1995|Paulo Maluf|388|Paulo Salim Maluf|Não. Acontece o seguinte: que eu sou contra... e vocês estão vendo eu não tenho nenhuma dificuldade em aprovar os bons projetos na Câmara Municipal, nunca aliciei ninguém, ao contrário, até perdi alguns vereadores. Então, nós também, no plano federal, fizemos a primeira fusão com o PDC [Partido Democrata Cristão], fundando o PPR, e agora fizeram uma fusão com o PP, porque é muito mais lícito, lógico e correto, você diminuir o número de partidos. E, veja, de três partidos que tínhamos, hoje somos um. No mínimo, a população ganha, pois a cada semestre dois [partidos] enchem a paciência, que é aquela uma hora a que o partido tem direito de horário gratuito. Eu acho que, no Brasil, cabem cinco partidos, o resto são legendas de aluguel.
23/10/1995|Paulo Maluf|389|Marcelo Beraba|[Interrompendo] Qual é o leque?
23/10/1995|Paulo Maluf|390|Paulo Salim Maluf|Cinco é o seguinte: é o nosso PPB [Partido Progressista Brasileiro] que tem 83 deputados, o PMDB que tem...
23/10/1995|Paulo Maluf|391|Marcelo Beraba|[Interrompendo] O PPB está na ponta direita ali, ou não?
23/10/1995|Paulo Maluf|392|Paulo Salim Maluf|Não. Eu coloquei o meu primeiro, é lógico, eu acho que o meu é melhor. Você acha que eu vou achar algum outro melhor? O meu é o melhor mesmo, tem o Roberto Campos, Delfim Netto, Francisco Dornelles, Esperidião Amin, Jarbas Passarinho; o nosso produto é bom pela qualidade, inclusive, o nosso PPB; PMDB, que tem 101, 102 deputados; o PFL que tem 89, noventa deputados; o PSDB que está também com oitenta e poucos deputados e o PT ideológico. Acho que esses cinco partidos têm condições de existir. Agora, partido que tem um deputado...
23/10/1995|Paulo Maluf|393|Marcelo Beraba|[Interrompendo] E o PDT?
23/10/1995|Paulo Maluf|394|Paulo Salim Maluf|O PDT tem vinte e poucos, quer dizer, eu acho que ou ele cresce, ou ele fica um partido carioca.
23/10/1995|Paulo Maluf|395|Josemar Gimenez|Agora, prefeito, jogando a questão um pouco mais para frente. Uma vez o senhor disse que...
23/10/1995|Paulo Maluf|396|Paulo Salim Maluf|[Interrompendo] Agora, espera um pouquinho. Eu quero frisar isso aqui: são dezenove partidos que tem representação no Congresso, alguns com um deputado. Quer dizer, o partido com um deputado tem o direito de ter uma hora em cadeia nacional duas vezes por ano. Isso é um abuso para o telespectador e é um abuso para todo o contribuinte, porque o dinheiro dessa hora, você sabe, a empresa de televisão pode deduzir no imposto de renda. Então, todos nós estamos pagando para aquele indivíduo que fez um partido com um deputado e teve direito a duas horas em cadeia nacional. Isto é um abuso e tem, no meu entender, que ser revogado.
23/10/1995|Paulo Maluf|397|Josemar Gimenez|Jogando a questão um pouco mais para frente, uma vez, o senhor disse que...
23/10/1995|Paulo Maluf|398|Paulo Salim Maluf|[Interrompendo] Agora, a gente tem que ter coragem, entendeu? Tem que ter coragem para dizer essas coisas, porque todo mundo fica fazendo média com todo mundo. Partido de um deputado é legenda de aluguel, uma legenda mercenária que não poderia nem deveria existir no Brasil, como não existe em lugar nenhum no mundo. Veja, nos Estados Unidos é democrata ou republicano. A Inglaterra é conservadora ou trabalhista. Na França é gaulista ou socialista. A Alemanha é social democrata ou conservador. O Japão é liberal democrata ou socialista. É só no Brasil que nós temos dezenove partidos, que é essa salada russa.
23/10/1995|Paulo Maluf|399|Matinas Suzuki|Pensando nessa...[falando ao mesmo tempo que Paulo Maluf]. É que ele me concedeu a palavra democraticamente.
23/10/1995|Paulo Maluf|400|Paulo Salim Maluf|Pois não, desculpe.
23/10/1995|Paulo Maluf|401|Matinas Suzuki|...pensando nessa conjuntura nacional, é que o senhor tem aparecido muito na TV Manchete?
23/10/1995|Paulo Maluf|402|Paulo Salim Maluf|Eu apareço aqui, na televisão Cultura, tive até a gratidão de vocês...
23/10/1995|Paulo Maluf|403|Matinas Suzuki|Quando o senhor é notícia prefeito, aparece aqui.
23/10/1995|Paulo Maluf|404|Paulo Salim Maluf|Colocaram-me inaugurando a [Avenida] Faria Lima. Eu tenho aparecido na Globo, na Manchete, no SBT, na Bandeirantes. Eu apareço em todas as televisões, e, olha, quando vocês me puserem mais de uma vez também, eu não faço questão de não aparecer.
23/10/1995|Paulo Maluf|405|Matinas Suzuki|Mas o senhor na TV Manchete, tem aparecido um pouquinho mais. Por quê?
23/10/1995|Paulo Maluf|406|Paulo Salim Maluf|Não. Todo mundo reclama e eu sei do quê, reclama do Jornal de Domingo. Até um dia, um juiz estava conversando comigo: "puxa eles te elogiaram!" Eu perguntei: "quer dizer então que a televisão só existe para 'meter o pau'? Quando a televisão 'mete o pau' é uma televisão decente? Quando a televisão é imparcial e mostra o fato..."
23/10/1995|Paulo Maluf|407|[Risos]|Risos]
23/10/1995|Paulo Maluf|408|Josemar Gimenez|Voltando um pouquinho sobre sucessão, o senhor, uma vez, me disse que - não sei se a palavra certa seria um sonho - tinha um sonho, que era disputar uma eleição de segundo turno para presidente com o Lula. O senhor ainda pensa isso? O senhor ainda imagina travar uma disputa com o Lula num segundo turno?
