DATA|ENTREVISTA|ORDEM|LOCUTOR|FALA
30/05/1988|Thomas Skidmore|188|Rodolfo Konder| Era o grande mudo, como o senhor lembrou.
30/05/1988|Thomas Skidmore|189|Thomas Skidmore| É. O grande mudo. De modo que é um sinal, talvez, da falta de memória. Também a situação aqui era partidária, quer dizer, houve uma divisão entre os candidatos e ele se elegeu com 33%. Mas a renúncia foi um soco [faz o gesto do soco e sorri] no estômago do brasileiro.
30/05/1988|Thomas Skidmore|190|André Singer| Professor, eu gostaria de saber se o senhor concorda com a tese de que a renúncia do Jânio era a tentativa de um golpe, pelo menos de um golpe que daria poderes, ao estilo De Gaulle para fazer a Quinta República na França. Eu queria saber o que o senhor acha dessa tese que, em seu livro, o senhor passa por ela, mas não deixa muito claro qual é o seu entendimento desse episódio.
30/05/1988|Thomas Skidmore|191|Thomas Skidmore| Ninguém sabe. O fato é que ninguém sabe, porque ele viajou imediatamente de Brasília e não deixou contatos. Quer dizer, foi impossível, logo depois da renúncia, entrar em contato com ele, praticamente. Falava-se na época disso: que ele queria mais poderes. Decreto-lei, coisa a que ele chegou. [Thomas sorri]
30/05/1988|Thomas Skidmore|192|André Singer| É o precursor.
30/05/1988|Thomas Skidmore|193|Thomas Skidmore| [Risos] É o precursor.
30/05/1988|Thomas Skidmore|194|Augusto Nunes| Professor, nós vamos fazer agora um pequeno intervalo. O programa Roda Viva com o brasilianista Thomas Skidmore volta já, já.
30/05/1988|Thomas Skidmore|195|[intervalo]|[intervalo]
30/05/1988|Thomas Skidmore|196|Augusto Nunes| Retomamos aqui nossa conversa com o brasilianista Thomas Skidmore. Skidmore é professor de história do Brasil e história da América Latina na Universidade de Wisconsin, e autor de dois livros: Brasil: de Getúlio a Castelo, e outro que está sendo lançado agora Brasil: de Castelo a Tancredo. Professor Thomas Skidmore, a Francisca de Castro Moura, da cidade de Rio Claro, interior de São Paulo, gostaria de saber do senhor se é verdade que os Estados Unidos teriam patrocinado o golpe militar de [19]64. O Roberto Soares, de Pinheiros, que leu o seu livro [Brasil:] de Getúlio a Castelo, disse que nesse livro o senhor nega a participação dos Estados Unidos no golpe de [19]64. Ele pergunta se, diante das revelações contidas em arquivos americanos recentemente divulgados, o senhor manteria a sua opinião. Em seguida, a pergunta do Luciano Ornellas. Professor Skidmore [aponta para ele].
30/05/1988|Thomas Skidmore|197|Thomas Skidmore| Pois não. Eu acho que... eu pus um apêndice no meu livro: “o papel dos agentes nos arquivos João Goulart ”. No primeiro livro, Brasil: de Getúlio a Castelo. Naquela época não houve a documentação do arquivo do Johnson [Lindon Johnson, sucessor da presidência dos Estados Unidos, depois da morte de John Fitzgerald Kennedy, em 1963], em Texas. O que foi revelado naquela documentação e foi publicado em livro aqui no Brasil, também, de Phyllis Parker [Parker, Phyllis R. 1964: O papel dos Estados Unidos no golpe de Estado de 31 de março. Rio de Janeiro: Civilização Brasileira, 1977], mostra que houve uma preocupação grande do governo americano. Além disso, houve... o governo americano tinha mandado uma frota para o Brasil de dois petroleiros, com a idéia de que, com as forças rebeldes, ia faltar petróleo para eles.
30/05/1988|Thomas Skidmore|198|Augusto Nunes| Iam decretar um território livre.
30/05/1988|Thomas Skidmore|199|Thomas Skidmore| Exatamente. Exatamente. Os Estados Unidos iriam fornecer petróleo, combustível para eles. Aconteceu que a resistência contra o golpe foi muito fraca, quase não houve. De modo que não houve necessidade de pedir aos americanos para fornecerem combustível. Nesse aspecto, não houve participação. Mas o fato é que a posição do governo americano foi claríssima. Não tenho a menor dúvida de que o papel do embaixador americano Lincoln Gordon [(1913-), nova iorquino nomeado embaixador no Brasil em agosto de 1961, cuja efetivação foi adiada pelo governo norte-americano até a solução da crise causada pela renúncia do presidente Jânio Quadros - em agosto de 1961 - e pela recusa dos ministros militares em permitir a posse do vice-presidente João Goulart, então em visita à China. Goulart foi empossado em 7 de setembro de 1961 e no mês seguinte Gordon tornou-se embaixador efetivo] era o de apoiar os governadores da oposição, como, por exemplo, o governador Lacerda, que foi muito bem financiado para as obras públicas do estado de Guanabara. Além disso, houve... provavelmente houve financiamento para políticos brasileiros, que é muito comum com a CIA [Central Intelligence Agency; serviço de inteligência dos Estados Unidos da América cujas atribuições são: coletar informações de fontes humanas; correlacionar e avaliar inteligência ou informações relativas à segurança nacional americana, divulgando-as de forma apropriada; fazer outras funções de inteligência (informações e contra-informações) ligadas à segurança nacional que o presidente decidir] Já foi feito... O Gordon, ele confessou isso nas eleições de [19]62. Financiamento americano. Mas eu acho que participação direta não houve. O importante é reconhecer que houve um golpe militar brasileiro [enfatiza] com o apoio civil. Muito importante. Quer dizer, muito bem preparado.
30/05/1988|Thomas Skidmore|200|Augusto Nunes| Luciano Ornellas.
30/05/1988|Thomas Skidmore|201|Luciano Ornellas| Professor, como estudioso das coisas brasileiras, relembrando o passado recente e o presente, o senhor vê alguma diferença entre o PDS do regime militar e o PMDB da Nova República?
30/05/1988|Thomas Skidmore|202|Thomas Skidmore| [Risos] Acho que sim. Espero que sim. O PDS era sustentado, completamente, pelos militares, e sem o apoio militar não teria sido possível, realmente, [se] eleger. A prova disso foi a eleição de [19]70. Na eleição de [19]70, o governo ganhou muito bem no Brasil. Aconteceu que, na véspera da eleição de [19]70, houve, pelo menos, cinco mil prisões. De modo que saiu tudo bem. Aqui no Brasil, também, alguns diplomatas estrangeiros diziam: “Não. O Médici, o presidente Médici [Emílio Garrastazu Médici foi presidente do Brasil de 1969 a 1974. Seu governo ficou conhecido como "os anos de chumbo da ditadura", período de forte repressão policial aos movimentos estudantil e sindical, em que se deram muitos desaparecimentos políticos e práticas de tortura nos DOI-CODIs, órgãos governamentais de repressão política], tem tudo aqui na mão, não tem problema nenhum.” Em [19]74, quando o Geisel [Ernesto Geisel, presidente da República a partir de março de 1974, representando o triunfo dos castelistas, que queriam redemocratizar o Brasil gradativamente. Seu governo se estendeu até março de 1979 e foi marcado pelo fim do chamado milagre econômico e pela forte e crescente insatisfação popular com o regime militar] deixou o pessoal da oposição chegar à televisão, foi o contrário, completamente. De modo que eu acho que realmente o PMDB é o herdeiro desse papel da oposição. O problema é que fica agora na ambigüidade: está no poder ou não está no poder.
30/05/1988|Thomas Skidmore|203|Paulo Sérgio Pinheiro| [Interrompendo] Só insistindo nessa pergunta do Luciano. Você acha que o procedimento do PMDB no governo, por exemplo, no governo federal, você acha que o fisiologismo do PMDB foi diferente do fisiologismo do PDS?
30/05/1988|Thomas Skidmore|204|Thomas Skidmore| São políticos pegando dinheiro dentro [faz gesto de pegar], favores, influências. Isso é...
30/05/1988|Thomas Skidmore|205|Pedro Del Picchia| Fisiologismo de esquerda.
30/05/1988|Thomas Skidmore|206|[Sobreposição de vozes e risos]|[Sobreposição de vozes e risos]
30/05/1988|Thomas Skidmore|207|Thomas Skidmore| O problema é que com a democracia todo mundo sabe, e com o regime militar ninguém sabe, porque tem censura.
30/05/1988|Thomas Skidmore|208|Augusto Nunes| [Interrompendo] Desculpe-me, professor, antes de passar ao Pedro Del Picchia, por falar em pegar dinheiro, já se sabe hoje, com as revelações ligadas à época, que muitos políticos brasileiros receberam dinheiro da CIA. Hoje, o senhor acredita que essas contribuições continuam?
30/05/1988|Thomas Skidmore|209|Thomas Skidmore| Não sei. É bem possível.
30/05/1988|Thomas Skidmore|210|Augusto Nunes| Pedro Del Picchia.
30/05/1988|Thomas Skidmore|211|Pedro Del Picchia| Queria voltar...
30/05/1988|Thomas Skidmore|212|Thomas Skidmore| [Interrompendo] Só um minuto. Houve aqui um empresário americano, muito famoso, que construiu a estrada de ferro na Amazônia: [Percival] Farquhar [(1864-1953) explorou diversos empreendimentos ferroviários no Brasil, sobretudo no sul do país; também construiu o porto de Belém. Atuou com empreendimentos em outras partes do mundo], o nome dele, muito famoso. Ele se queixou que aqui no Brasil você dá dinheiro para o político brasileiro e ele não entrega, quer dizer, ele trai. [muitos risos]
30/05/1988|Thomas Skidmore|213|Thomas Skidmore| Muitas vezes, o político não é honesto.
30/05/1988|Thomas Skidmore|214|Augusto Nunes| [Interrompendo] É que eles são independentes. [risos] Nem sempre é dando que se recebe, às vezes, só recebe e não dá.
30/05/1988|Thomas Skidmore|215|[Sobreposição de vozes e risos gerais]|[Sobreposição de vozes e risos gerais]
30/05/1988|Thomas Skidmore|216|Thomas Skidmore| O corrupto não tem, quer dizer, ele fica lá sem graça...
30/05/1988|Thomas Skidmore|217|Pedro Del Picchia| O senhor me permite, eu queria voltar um pouquinho para trás. O senhor estava falando aí do período da revolução, do movimento de 1964, que teve apoio popular, em sua opinião.
30/05/1988|Thomas Skidmore|218|Thomas Skidmore| Apoio civil.
30/05/1988|Thomas Skidmore|219|Pedro Del Picchia| Apoio civil. Teve apoio civil. E que os Estados Unidos não tiveram uma participação direta. O argumento que se usou, a justificativa que foi usada na ocasião é que o governo João Goulart estava conduzindo o Brasil para o comunismo. Pergunto ao senhor: o senhor acha que se não tivesse havido o golpe de [19]64 e João Goulart, se ele tivesse concluído o seu mandato, nós teríamos ido para um regime comunista?
30/05/1988|Thomas Skidmore|220|Thomas Skidmore| [Silencia alguns instantes e diz:] Ah... isso eu duvido.
30/05/1988|Thomas Skidmore|221|Pedro Del Picchia| Seria a eleição?
30/05/1988|Thomas Skidmore|222|Thomas Skidmore| A política não. Ninguém estava preparado para isso, nem o Partidão [Partido Comunista Brasileiro]. Ninguém.
30/05/1988|Thomas Skidmore|223|Pedro Del Picchia| Haveria eleição, portanto?
30/05/1988|Thomas Skidmore|224|Thomas Skidmore| Bom, isso é especulação. Mas o comunismo era quase ridículo, na época, com as divisões tremendas. Inclusive o Partidão não estava em condições, era muito cauteloso com o governo Goulart. Houve aquela euforia na esquerda: os populistas, o pessoal da Igreja [Católica]. Mas não... acho que não houve... Para o americano, para o governo americano é outra coisa; falar em comunismo quer dizer um governo que vai escapar do controle ou vai criar núcleos de resistência na América Latina às políticas norte-americanas. Mas a fumaça [passa as mãos em círculos diante de si, aludindo à fumaça] é sempre sobre o comunismo.
30/05/1988|Thomas Skidmore|225|[Sobreposição de vozes chamando o professor Thomas Skidmore]|[Sobreposição de vozes chamando o professor Thomas Skidmore]
30/05/1988|Thomas Skidmore|226|Augusto Nunes| Professor, o João Luis Batista, do Ipiranga, relembra uma velha bandeira das esquerdas brasileiras, hoje um tanto em desuso, mas que fez muito barulho há alguns anos, que é do imperialismo americano. E ele pergunta ao senhor: "De que forma o imperialismo americano atinge, se manifestou ou se manifesta no Brasil?". Faz sentido essa bandeira do ponto de vista da esquerda?
30/05/1988|Thomas Skidmore|227|Thomas Skidmore| Bom, isso foi, para muitos brasileiros, sinônimo de presença econômica. Você vai para o Citibank... Houve aquele panfleto muito famoso, faz vinte e cinco anos, Um dia na vida do brasileiro: que acorda e pega a...
30/05/1988|Thomas Skidmore|228|Augusto Nunes| Um dia na vida do brasileiro.
30/05/1988|Thomas Skidmore|229|Thomas Skidmore| ... pasta dental, que é a Colgate, depois come flocos Kellogs's, e depois anda no Volkswagen, aquela coisa toda que é a presença estrangeira na economia. Bom, tem que analisar isso: o que é e o que dá conseqüências boas para o Brasil, e não o que não dá, nao é? Tem que analisar friamente. Outra coisa é a pressão americana ou de outro país na política externa, e o Brasil já sofreu isso muitas vezes. Neste assunto o Brasil está em melhores condições agora de articular uma política externa que não seja subordinada aos Estados Unidos. Um país muito mais maduro, inclusive quanto às condições econômicas. A política externa é muito mais diversificada agora e, muitas vezes, simplesmente não responde aos Estados Unidos.
30/05/1988|Thomas Skidmore|230|André Singer| Professor, voltando, ainda, a [19]64, eu me surpreendi que no seu livro o senhor trata o movimento militar por revolução, que é o nome que esse movimento se "auto-deu". As revoluções, normalmente, são entendidas como processos de mudanças culturais...
30/05/1988|Thomas Skidmore|231|Thomas Skidmore| [Interrompendo] Mudanças sociais.
30/05/1988|Thomas Skidmore|232|André Singer| Mudanças culturais na sociedade. O senhor acha que, de fato, o movimento militar de 1964 foi [realmente] uma revolução?
30/05/1988|Thomas Skidmore|233|Thomas Skidmore| Não, em termos de mudanças sociais obviamente não. Obviamente não. Mas não houve simplesmente um golpe de um grupo de oficiais, aquilo foi articulado lá atrás. O movimento militar era um movimento de uma grande parte da burguesia. Mostrou isso no livro o René Dreyfuss [(1905-1993) cientista político PhD pela universidade de Oxford, autor de numerosas obras, entre as quais 1964: a conquista do Estado. Foi professor do Departamento de Ciência Política da UFRJ (Universidade Federal do Rio de Janeiro)], que realizou a articulação. Eu tive uma entrevista, foi no ano passado - eu acho - com o Golbery. Ele falou sobre a rede de legalidade de [19]61, a tentativa de evitar a sucessão de Jango, mas com aquela mobilização com o Brizola que montou muito bem aquela coisa toda, o Terceiro Exército, não foi possível. O Golbery disse: “Bom, nós tínhamos aprendido muito com isso”. Exatamente a mobilização civil para apoiar. Mas não foi uma revolução em termos sociais, como em Cuba, e mesmo, obviamente, como na Rússia ou na China.
30/05/1988|Thomas Skidmore|234|André Singer| O senhor distingue o movimento militar de [19]64, aqui no Brasil, dos outros golpes militares na América Latina, professor? O senhor acha que tem um caráter inteiramente diferente do que houve na Argentina, no Uruguai e do que houve no Chile?
30/05/1988|Thomas Skidmore|235|Thomas Skidmore| Não inteiramente, mas tem algumas semelhanças entre... Tem semelhanças. Tem uma onda aqui [na América Latina] de golpes: na Argentina, no Uruguai... No Chile foi o mais dramático, o país mais democrático da América Latina foi o último a sair do sistema autoritário. O Brasil, em certo sentido, conseguiu alguma coisa. Em termos, vamos dizer, da tecnocracia. Diversificaram as exportações, por exemplo. A coisa do "leão" no Brasil: em 1961, o imposto de renda foi uma piada aqui no Brasil. Ninguém ligava, como na Itália, na França, não é? [Dizia-se:] "A Gina Lollobrigida [(1927-) atriz de cinema e fotógrafa italiana, famosa por seus papéis sensuais no cinema, ganhou o título de "a mulher mais bela do mundo" após interpretar a cantora lírica Lina Cavalieri no filme La donna più bella del mondo, em 1955], ela não paga a multa.", aquela coisa toda. Mas uma coisa que funciona aqui no Brasil, é impressionante, é o "leão".
30/05/1988|Thomas Skidmore|236|Pedro Del Picchia| [Interrompendo] Professor, amanhã, nós vamos...
30/05/1988|Thomas Skidmore|237|[Sobreposição de vozes]|[Sobreposição de vozes]
30/05/1988|Thomas Skidmore|238|Thomas Skidmore| Pois é, pois é. Isso é a coisa menos brasileira que eu vi. Isso é conseqüência, pelo menos, do governo tecnocrata.
30/05/1988|Thomas Skidmore|239|Rodolfo Konder| Só uma caroninha na pergunta do André.
30/05/1988|Thomas Skidmore|240|Augusto Nunes| Em seguinda, Ricardo Noblat. Rodolfo Konder.
30/05/1988|Thomas Skidmore|241|Rodolfo Konder| O senhor falou das semelhanças entre esses golpes: no Brasil, Argentina, Chile, e todos eles se dão na década de [19]60 e começo da década de [19]70, talvez como uma resposta à Revolução Cubana de 1959 [movimento de guerrilha iniciado em 1956, liderado pelo advogado Fidel Castro, contra o ditador de Cuba, Fulgêncio Batista, a revolução culminaria com a destituição do ditador em 1959. Seus objetivos eram conduzir Cuba à democracia, à libertação social e à autonomia nacional. Com o tempo, Fidel deu à revolução uma orientação marcante de socialismo de Estado].
30/05/1988|Thomas Skidmore|242|Thomas Skidmore| Sem dúvidas. Sem dúvida nenhuma.
30/05/1988|Thomas Skidmore|243|Paulo Sérgio Pinheiro| Só uma notinha de rodapé. Outra personagem muito querida nesse período é o atual embaixador na ONU, o general Vernon Walters [ex-embaixador dos Estados Unidos na ONU e um dos expoentes da política e diplomacia norte-americana no século 20].
30/05/1988|Thomas Skidmore|244|Thomas Skidmore| [Interrompendo] O nosso amigo. [risos]
30/05/1988|Thomas Skidmore|245|Paulo Sérgio Pinheiro| É, o nosso amigo.
30/05/1988|Thomas Skidmore|246|Thomas Skidmore| Tem que aparecer.
30/05/1988|Thomas Skidmore|247|Paulo Sérgio Pinheiro| Ele escreveu as memórias, que você conhece, As missões silenciosas, imagina o falastrão.
30/05/1988|Thomas Skidmore|248|Thomas Skidmore| Fala demais.
30/05/1988|Thomas Skidmore|249|Paulo Sérgio Pinheiro| Você acha que ele fala demais ou que, efetivamente, ele teve um papel importante na articulação, na interligação entre os golpistas de [19]64?
30/05/1988|Thomas Skidmore|250|Thomas Skidmore| Tem a ver. Não há duvidas que ele estava articulando isso. Ele já conhecia o general Castelo Branco da Itália, e o papel dele era exatamente o de informar o governo americano sobre isso. Mas ele não mandou. Não tenho a menor dúvida de quem mandou foi o grupo de conspiradores militares brasileiros. Mas ele alertou o Gordon. O Gordon tinha um problema para viajar, naquela época, e ele tinha dito para o Walters: "I dont want any surprises.", “Não quero nenhuma surpresa!” [risos]
30/05/1988|Thomas Skidmore|251|Paulo Sérgio Pinheiro| [Interrompendo] Não é pra já! O golpe não é logo.
30/05/1988|Thomas Skidmore|252|[Risos]|[Risos]
30/05/1988|Thomas Skidmore|253|Thomas Skidmore| “Você fala para mim”, ele falou. De modo que ele foi muito bem informado, e isso eu falei lá. Obviamente a indicação era a tremenda ajuda econômica dos Estados Unidos, que veio logo do USAID [Agência dos Estados Unidos para o Desenvolvimento Internacional]. [Foram] 100 milhões de dólares no primeiro ano. Sustentou muito o governo.
30/05/1988|Thomas Skidmore|254|[Sobreposição de vozes]|[Sobreposição de vozes]
30/05/1988|Thomas Skidmore|255|Augusto Nunes| Depois, eu queria assegurar a palavra, aqui, do...
30/05/1988|Thomas Skidmore|256|Rodolfo Konder| O senhor estava falando do Citibank e interrompeu. O Citibank teve, também, um papel nisso?
30/05/1988|Thomas Skidmore|257|Thomas Skidmore| O Citibank? No golpe?
30/05/1988|Thomas Skidmore|258|Rodolfo Konder| Nessa ajuda financeira aos elementos que conspiraram.
30/05/1988|Thomas Skidmore|259|Thomas Skidmore| Não. Eu acho muito pouco para a época. Os bancos comerciais, naquela época, não tinham nada para [...]. Isso é uma coisa posterior. Muito posterior.
30/05/1988|Thomas Skidmore|260|Ricardo Noblat| Professor, em resposta à uma pergunta anterior, o senhor descartou, praticamente, o risco de que caminhávamos para um regime comunista ou quase isso...
30/05/1988|Thomas Skidmore|261|Thomas Skidmore| Em [19]64.
30/05/1988|Thomas Skidmore|262|Ricardo Noblat| É. Em [19]64. A seu ver, quais as verdadeiras causas do golpe militar de 1964?
30/05/1988|Thomas Skidmore|263|Thomas Skidmore| Falou muito bem...
30/05/1988|Thomas Skidmore|264|Augusto Nunes| [Interrompendo] Aliás, desculpe professor, ...
30/05/1988|Thomas Skidmore|265|Thomas Skidmore| Pois não.
30/05/1988|Thomas Skidmore|266|Augusto Nunes| Só para incorporar à pergunta do Noblat, a preocupação do José Antônio Rodrigues, do Ipiranga, que diz o seguinte: “O senhor afirma que os americanos não tiveram influência direta no movimento militar de [19]64. Então, como é que o senhor explica a seqüência de movimentos semelhantes em outros países como Uruguai, Argentina, Chile?”. O senhor identifica as origens às quais se referem o Noblat, e em seguida responde a essa pergunta.
30/05/1988|Thomas Skidmore|267|Thomas Skidmore| Sim. Bom, o que houve? Depois da Revolução Cubana houve uma preocupação muito grande nos Estados Unidos com a possibilidade de uma onda comunista na América Latina. Todo mundo falava: “A revolução vem aí”, aquela coisa toda. Então, os exércitos latino-americanos notaram que a primeira instituição liquidada em Cuba foi o exército, não é? E, também, o governo americano começou a dar ajuda no treinamento. O Brasil já tinha ligações antigas vindas desde a Segunda Guerra Mundial. Treinamento no Panamá. Inclusive, um programa chamado de segurança pública. A idéia era, na época do Kennedy, “vamos com a Aliança para o Progresso” [programa, criado por Kennedy, de ajuda norte-americana aos países da América Latina, objetivando alcançar uma situação de desenvolvimento econômico, social e político que se contraporia às "vantagens" do comunismo] quer dizer: crescimento econômico, reforma social, democracia. Só isso. Se não der certo, nós temos aqui as boininhas verdes [refere-se aos boinas verdes, forças especiais do Exército dos Estados Unidos], que é outra resposta ao problema, quer dizer, contra a insurgência. O que predominou nos exércitos latino-americanos e em alguns setores civis, também, era a preocupação com a necessidade de [se ter] uma resposta militar, de modo que os reacionários trabalharam muito bem com isso, em todos os países. De modo que o golpe militar era a resposta às crises econômicas.
30/05/1988|Thomas Skidmore|268|Ricardo Carvalho| Mas o senhor acha que se os Estados Unidos não tivessem dado o apoio, talvez não muito explícito, mas implícito, aos golpistas, os golpes existiriam?
30/05/1988|Thomas Skidmore|269|Thomas Skidmore| Não. Isso tinha um papel importante.
30/05/1988|Thomas Skidmore|270|Ricardo Carvalho| O apoio dos Estados Unidos.
30/05/1988|Thomas Skidmore|271|Thomas Skidmore| O apoio. O apoio implícito que era financeiro. Tremendo. E também técnico. Eles mandaram para cá, por exemplo, o [Dan] Mitrioni [agente da CIA (o serviço secreto americano), que durante três anos organizou os cursos de inteligência e técnicas de interrogatório a policiais civis e militares no comando da Polícia Militar, acusado de incluir a tortura em suas aulas, Dan Mitrioni, dava nome a uma rua no Bairro Industrial, em Belo Horizonte, até 1983], que foi morto no Uruguai. Toda a tecnologia, a segurança pública [...].
30/05/1988|Thomas Skidmore|272|Ricardo Carvalho| Quer dizer, os Estados Unidos não colocaram os marines aqui, mas o apoio houve, com certeza, em todos os países. E sem o apoio não haveria golpe?
30/05/1988|Thomas Skidmore|273|Thomas Skidmore| Não. Ironicamente não houve nenhum [sorrindo] movimento guerrilheiro no Brasil. Precisava criar depois.
30/05/1988|Thomas Skidmore|274|Ricardo Carvalho| Mas eu digo do Cone Sul: Chile, Argentina, Uruguai e Brasil.
30/05/1988|Thomas Skidmore|275|Thomas Skidmore| É, mas foi necessário justificar depois, [porque] o golpe no Brasil foi o primeiro, o precedente da América Latina e, os Estados Unidos apoiando, obviamente, era a indicação para os outros. Eu acho que houve, depois, uma certa desilusão. A Revolução Cubana não espalhou. Tem a Nicarágua, que não é uma coisa muito parecida. O fato é que os comunistas não estão aqui batendo às portas. A coisa é muito mais complicada. O general agora, que era o capitão, o major antigamente, ele não acha mais que o pessoal do PC do B vai tomar conta do país, que é coisa de louco. Mas é uma visão um pouco mais sofisticada da democracia. De modo que [é] outro momento. Mas a orientação anticomunista era conseqüência, também, da influência americana que marchava com a idéia da “Aliança para o Progresso”.
30/05/1988|Thomas Skidmore|276|Augusto Nunes| Pedro Del Pichia.
30/05/1988|Thomas Skidmore|277|Pedro Del Picchia| Quando o senhor falou que não havia guerrilha antes de [19]64, depois o senhor...
30/05/1988|Thomas Skidmore|278|Thomas Skidmore| Aqui, no Brasil.
30/05/1988|Thomas Skidmore|279|Pedro Del Picchia| ... foi necessário justificar depois. O que quer dizer exatamente isso? O senhor acha que, de alguma forma, a extrema direita contribuiu para que se instaurasse a guerrilha no Brasil, depois?
