DATA|ENTREVISTA|ORDEM|LOCUTOR|FALA
30/05/1988|Thomas Skidmore|280|Thomas Skidmore| Não. Estou dizendo que a segunda seção do exército, que é uma coisa de inteligência... eles fizeram "batidas", e não houve nenhum... [sorrindo] Eram muito poucas armas no Brasil. No Nordeste tem ligas camponesas, mas não armadas. Tem pouca coisa. Foi difícil para eles justificar a coisa. Quer dizer, tinha que superestimar o movimento... Inclusive, todo mundo na época esperava pelos IPMs [Inquérito Policial Militar, mecanismo de poder destinado a operacionalizar a Grande Estratégia da Doutrina de Segurança Nacional. Comissões especiais de inquérito foram criadas em todos os níveis de governo, em todos os ministérios, empresas estatais, universidades federais e em entidades ligadas ao governo federal, com o objetivo de identificar e expurgar da estrutura governamental as pessoas identificadas como "subversivas"] Eu tenho os IPMs que foram publicados, pouca coisa. E começaram a falar em corrupção. Outra coisa é o Juscelino, de modo que foi difícil. Veio depois o movimento guerrilheiro que justifica a repressão, mas a repressão chegou primeiro.
30/05/1988|Thomas Skidmore|281|André Singer| Professor, eu queria perguntar ainda sobre esse período - é rápido. Se na sua interpretação desse período o presidente João Goulart estava disposto a alimentar a idéia de um golpe militar, não de uma sublevação civil, não de uma sublevação social, mas de um golpe militar com os eventuais apoios que ele tivesse. Essa é uma das versões que o golpe de [19]64 teria sido um golpe preventivo contra um golpe em andamento do próprio João Goulart.
30/05/1988|Thomas Skidmore|282|Thomas Skidmore| Sim, sim.
30/05/1988|Thomas Skidmore|283|André Singer| Qual é o seu entendimento desse episódio?
30/05/1988|Thomas Skidmore|284|Thomas Skidmore| Eu acho que ele tinha razão, porque o presidente Goulart estava promovendo generais fora do lugar. Ele estava tentando criar um "generalato" favorável à política dele. Isso foi bem notado no Exército, de modo que, também, houve o incidente de novembro de [19]63, uma mobilizaçãozinha, a tentativa de um golpe, talvez, do governo contra... quer dizer, criar um tipo de regime militar com o Jango como presidente. Eu acho que entra aqui também a ameaça à hierarquia das Forças Armadas. É que tem, talvez...
30/05/1988|Thomas Skidmore|285|Fernando Mitre| [Interrompendo] A própria rebelião dos marinheiros.
30/05/1988|Thomas Skidmore|286|Thomas Skidmore| Talvez a pessoa mais interessante do que os outros seja o próprio cabo Anselmo [José Anselmo dos Santos (1942-), conhecido por cabo Anselmo, ex-militar brasileiro líder do episódio conhecido por "revolta dos marinheiros", em 1964. Expulso da Marinha, entrou na clandestinidade, sendo preso pelo Dops, em 1971. Logo depois trocou de lado e começou a colaborar com a represssão, denunciando muitos companheiros da luta armada contra a ditadura militar].
30/05/1988|Thomas Skidmore|287|Fernando Mitre| Não sei se o senhor leu tudo, mas esta semana saiu uma crítica numa revista de São Paulo, a Veja, dizendo que o senhor não tratou adequadamente a questão da revolta dos marinheiros.
30/05/1988|Thomas Skidmore|288|Thomas Skidmore| Sim.
30/05/1988|Thomas Skidmore|289|[Sobreposição de vozes]|[Sobreposição de vozes]
30/05/1988|Thomas Skidmore|290|Fernando Mitre| O senhor passou ao largo daquela questão como causa desencadeante, mas não fundamentou.
30/05/1988|Thomas Skidmore|291|Augusto Nunes| [Interrompendo] E mais ainda, professor, desculpe: como é que o senhor vê a figura do cabo Anselmo? Respondendo ao Mitre.
30/05/1988|Thomas Skidmore|292|Thomas Skidmore| Pois não. Primeiro, sobre a crítica na Veja, o problema é que eu já tinha publicado um livro sobre isso, [risos de Skidmore], que é outro livro. Não é justo pedir ao resenhista ler o outro livro. Mas o fato é que eu tratei muito do assunto naquele outro livro. Deixei ali por acidente. Um capítulo da introdução para explicar a origem. O cabo Anselmo: que caso curioso. Como é que um cabo vai chegar lá e vai montar o [...]? Como é? Aquela película da Revolução Russa? [Skidmore leva as mãos à cabeça, indigando] Um cabo arranjou isso? Não tinha vídeo, na época, como é que ele vai arranjar toda a película? Que coisa louca.
30/05/1988|Thomas Skidmore|293|Fernando Mitre| E depois, ele surgiu como um elemento ligado a CIA.
30/05/1988|Thomas Skidmore|294|Thomas Skidmore| [Interrompendo] E [inclusive] tem dois livros sobre ele. Que coisas incríveis! Eu acho que ele estava exagerando também...
30/05/1988|Thomas Skidmore|295|Fernando Mitre| [Interrompendo] Mas ele era um agente provocador, ou não?
30/05/1988|Thomas Skidmore|296|Thomas Skidmore| Pois é. Ele denunciou toda aquela gente em Pernambuco... liquidou a resistência. Ficou sinistro.
30/05/1988|Thomas Skidmore|297|Fernando Mitre| Ele era um agente provocador, professor?
30/05/1988|Thomas Skidmore|298|Thomas Skidmore| Em [19]64? Eu acho que talvez foi.
30/05/1988|Thomas Skidmore|299|Fernando Mitre| Quando ele levantou os marinheiros, ele estava a serviço de quem?
30/05/1988|Thomas Skidmore|300|Thomas Skidmore| Exatamente. Eu acho que...
30/05/1988|Thomas Skidmore|301|Rodolfo Konder| [Interrompendo] Ele diz que se tornou um agente depois.
30/05/1988|Thomas Skidmore|302|Thomas Skidmore| Depois. Em Cuba, em Cuba.
30/05/1988|Thomas Skidmore|303|Rodolfo Konder| Eu estive com o cabo Anselmo em 1964 na embaixada no México, e ele já tinha todas as características de um agente provocador.
30/05/1988|Thomas Skidmore|304|Fernando Mitre| [Interrompendo] Ele já estava envolvido com o...
30/05/1988|Thomas Skidmore|305|Thomas Skidmore| É. Exatamente.
30/05/1988|Thomas Skidmore|306|Augusto Nunes| Ricardo Carvalho.
30/05/1988|Thomas Skidmore|307|Ricardo Carvalho| Eu tenho uma curiosidade a respeito do papel do brasilianista. Durante um bom tempo os brasilianistas eram vistos como agentes infiltrados, se falava muito isso neste país. O senhor, como brasilianista, o senhor encontra dificuldades nas suas pesquisas? Já encontrou mais? O senhor, por acaso, não seria consultado pelo governo norte-americano que, todos sabemos, é muito cioso na coleta de informações sobre os países, particularmente, da América Latina. Além do Departamento do Estado, tem subsecretarias e todos aqueles outros departamentos. Como é o papel do brasilianista, e o que leva um... ?
30/05/1988|Thomas Skidmore|308|[Risos]|[Risos]
30/05/1988|Thomas Skidmore|309|Augusto Nunes| [Interrompendo] Aliás, professor, até antes de responder ao Ricardo, eu pediria que o senhor explicasse por que é que o senhor começou a se interessar pelo Brasil.
30/05/1988|Thomas Skidmore|310|Ricardo Carvalho| Exatamente. O que levou o professor a se interessar pelo Brasil e pela América Latina?
30/05/1988|Thomas Skidmore|311|Thomas Skidmore| Essa é uma velha história que eu contei várias vezes, inclusive a Veja não gostou.
30/05/1988|Thomas Skidmore|312|[Risos]|[Risos]
30/05/1988|Thomas Skidmore|313|Thomas Skidmore| Eu fiz uma conferência na UNB [Universidade de Brasília], eu acho que foi em [19]74, saiu uma reportagem na Veja: “Música na Unb”, porque era lá numa aula de música. Eu não sabia na época, mas era a primeira conferência geral permitida pelo reitor José Azevedo. Eu [já] contei essa história. Toda a minha orientação e formação era orientada para a Europa. [Eu] me formei em uma universidade em Ohio, que é meu estado natural, depois eu fui para a Inglaterra, para Oxford, obviamente tem aqui a [...], que é aquele charme, aquela atração. Fiquei lá estudando filosofia, que [não tem] nada a ver com nada. Eu me interessei pela Alemanha. Eu achava a Alemanha um país fascinante, porque você tem os altos e os baixos: você tem aqui o [...] e o [...]. Como enigma histórico é fascinante. Eu voltei para Harvard e fiz o meu doutoramento lá. Escrevi uma tese sobre um chanceller [alemão] que veio depois de Bismark [Otto von Bismarck, chamado de chanceler de ferro, é considerado o mais importante estadista da Alemanha do século XIX. Lançou as bases do II Reich (1871-1918), que levaram o país a superar a existência de mais de 300 entidades políticas diferentes e a instituir pela primeira vez um Estado Nacional único. Bismarck desprezou os recursos do liberalismo político, como o consenso ou o voto das maiorias, apostando numa política de força (dita de sangue e ferro) para moldar assim o novo Estado alemão dentro da blindagem do antigo sistema autoritário prussiano]. É um homem que ninguém conhece o nome dele. Ele merece ser completamente esquecido.
30/05/1988|Thomas Skidmore|314|Augusto Nunes| [Interrompendo] O senhor gosta de temas complicados.
30/05/1988|Thomas Skidmore|315|Thomas Skidmore| O nome dele é Caprivi [Leo von Caprivi (1831-1899), ocupou o cargo de chanceler alemão de 1890 a 1894] É. Essa tese fica lá numa estante em Harvard e ninguém a tocou. [risos] Nunca. [enfaticamente] Eu mesmo nunca reli a tese. Tudo bem. Mas era a formação indicada. Eu comecei a dar aulas em 1960. Acontece que houve um mau entendimento em Cuba. O Fidel [Castro, líder da revolução cubana, em 1959, governou o país até 2008. Ver entrevista com Castro no Roda Viva], estava tomando conta de tudo, inclusive do Jardim Botânico de Harvard. Isso é demais: um revolucionário vai pegar o nosso jardim?! Em Harvard tinha poucos professores na época fazendo especialidade na área da América Latina. Eles acharam que era necessário criar mais elementos. Mas como? Houve excedente [...] aqui da Alemanha e mudo para a América Latina, e eles me ofereceram uma bolsa de três anos.
30/05/1988|Thomas Skidmore|316|Ricardo Carvalho| Quem ofereceu?
30/05/1988|Thomas Skidmore|317|Thomas Skidmore| Harvard, na época. Salário e viagens. Eu não conhecia nada, nem português, nem espanhol, nada da América Latina. América Latina era o México, aquela coisa do bang-bang.
30/05/1988|Thomas Skidmore|318|Ricardo Carvalho| Mas o senhor sabia onde era o Brasil?
30/05/1988|Thomas Skidmore|319|Thomas Skidmore| Mais ou menos. Vagamente. [risos] Quer dizer, [sabia que era] ao sul do México [faz gesto de rebaixamento com as mãos].
30/05/1988|Thomas Skidmore|320|Ricardo Noblat| Como capital Buenos Aires.
30/05/1988|Thomas Skidmore|321|[Risos]|[Risos]
30/05/1988|Thomas Skidmore|322|Thomas Skidmore| Não. O problema era como começar. Na época, um professor de português, muito bom, ele me pegou e disse: “Skidmore, se você começar com o espanhol, o seu português vai ser ruim. Começando com o português, o espanhol depois vai ser razoável”. Tudo bem. Eu tinha que fazer um curso de verão em [19]61. A aula de espanhol era às oito [horas] da manhã; a aula de português, às onze. A combinação da teoria com a prática, obviamente, era em português. Na época, houve poucos especialistas no Brasil. Eu fiz uma viagem ao Brasil por dois meses, gostei tremendamente, e achava um país interessante...
30/05/1988|Thomas Skidmore|323|Augusto Nunes| [Interrompendo] Sobre a pergunta do Ricardo. Por favor, Pedro.
30/05/1988|Thomas Skidmore|324|[Sobreposição de vozes]|[Sobreposição de vozes]
30/05/1988|Thomas Skidmore|325|Ricardo Carvalho| Só complementando. Durante um bom tempo os brasilianistas foram muito mal vistos, até pelos intelectuais brasileiros, particularmente pela esquerda, obviamente.
30/05/1988|Thomas Skidmore|326|Thomas Skidmore| Sim, sim.
30/05/1988|Thomas Skidmore|327|Ricardo Carvalho| O senhor se sentiu, durante algum tempo [em que fazia] as suas pesquisas, olhado de soslaio, com desconfiança em relação ao senhor? E [sentiu] se o governo norte-americano do Departamento de Estado chega a consultar brasilianistas ou especialistas em América Latina?
30/05/1988|Thomas Skidmore|328|Thomas Skidmore| Muito pouco. Muito pouco. Eu tinha boas relações com o embaixador [James] Clement [Dunn] [(1890-1979) diplomata norte-americano que foi embaixador dos Estados Unidos na Itália, na França, na Espanha e no Brasil]. Na época, ele é que estava aqui e tinha boas relações com os brasilianistas. Mas, em geral, o governo americano não liga muito para os que estão fora. Muito pouco. Nessa pergunta sobre a situação de pesquisa no Brasil, não. Naquela época, o brasilianista tinha uma vantagem tremenda [por]que era financiado e também era livre, mais ou menos, para fazer o que quisesse. Se eu falasse uma gafe, iria viajar para a América do Norte. O brasileiro não, ele tem que ficar. Houve uma certa rivalidade: “Você tem dinheiro, você tem acesso, você tem tudo isso”. E eu acho isso completamente compreensível. Apesar disso, eu tinha, e tenho ainda, muitos amigos brasileiros que me ajudaram naquele tempo.
30/05/1988|Thomas Skidmore|329|Ricardo Carvalho| E na relação dos governos militares com as suas pesquisas, o senhor chegou a ser pressionado, houve algum fato [que o fez pensar em dizer]: “Até logo, vou para os Estados Unidos”, alguma coisa?
30/05/1988|Thomas Skidmore|330|Thomas Skidmore| Não. Mas houve um caso: Caio Prado Junior [(1907-1990) historiador, geógrafo, escritor e político brasileiro] ficou preso em [19]70, e eu assinei um manifesto, um protesto contra isso, que saiu no New York Review Books. No mesmo ano, a Unicamp [Universidade Estadual de Campinas] tinha me convidado para dar um seminário e o visto foi negado pelo governo brasileiro, sem explicação. Eu fiquei muito bem na minha [...] porque os alunos da esquerda diziam: “O Skidmore é perigoso. Que coisa! Nós achávamos que ele era um liberal, não é que não tem nada, deve ser outra coisa.”. Mas no ano seguinte, em [19]71, me convidaram para participar de um seminário em São Paulo, o governo de confissões. Obviamente eu fui seguido por aqui, aquela coisa toda, telefonemas e...
30/05/1988|Thomas Skidmore|331|Ricardo Carvalho| Ah! O senhor foi seguido?
30/05/1988|Thomas Skidmore|332|Thomas Skidmore| Sem dúvida nenhuma.
30/05/1988|Thomas Skidmore|333|Fernando Mitre| Professor, a verdade é que o senhor é uma obra do Fidel Castro, porque se não houvesse a revolução.
30/05/1988|Thomas Skidmore|334|Thomas Skidmore| Pois é! Eu sou filho [dele].
30/05/1988|Thomas Skidmore|335|[Risos]|[Risos]
30/05/1988|Thomas Skidmore|336|Fernando Mitre| Professor, o senhor se refere, nesse último livro, quando fala da questão agrária, sobre aquela teia de relações que existe... o senhor localizou nessa questão do campo - mas eu imagino que está em toda a sociedade brasileira - aquilo que amortece os conflitos de classe, quer dizer, o patrão é padrinho do empregado etc. O senhor diz até que esse retardamento de um movimento coletivista no campo se deve em parte a isso. Aqui na cidade, nas relações de classe entre... fora o ABC [região paulista, formada por cidades industriais e onde surgiu o moderno sindicalismo brasileiro que deu origem ao Partido dos Trabalhores e às centrais sindicais] que é uma exceção no Brasil, mas o senhor não acha que esse tipo de amortecimento tende a diminuir? Ou ele vai permear ainda essas relações...
30/05/1988|Thomas Skidmore|337|Thomas Skidmore| [Interrompendo] Existe ainda, mas eu acho que está atenuando nas grandes cidades. Isso é uma mudança importante. Mesmo durante o governo militar, essa mobilização da sociedade civil é importante. Não é uma coisa que vai dominar tudo, mas os CEBs [Comunidades Eclesiais de Base, da Igreja Católica], o novo sindicalismo, quer dizer, uma dinâmica que é mais autônoma.
30/05/1988|Thomas Skidmore|338|Fernando Mitre| Mas essa teia de relações tem ainda uma função por muito tempo?
30/05/1988|Thomas Skidmore|339|Thomas Skidmore| Tem. Eu acho, sem dúvida nenhuma.
30/05/1988|Thomas Skidmore|340|Augusto Nunes| Professor Skidmore, o Eduardo Cajias, da Chácara Santo Antonio e vários telespectadores fazem duas perguntas ao senhor: “Em quem o senhor votaria para presidente da República no Brasil, quem o senhor acha que seria um bom presidente para o Brasil? E em quem o senhor vai votar para presidente dos Estados Unidos, caso se mantenham as candidaturas do Bush [Geroge H. W. Bush (1924-), do Partido Republicano, fora o anterior vice-presidente dos Estados Unidos] e do Michael Dukakis [(1933-) do Partido Democrata]?”. [nessas eleições, realizadas em 8 de novembro de 1988, Bush venceu com maioria do voto popular e do colégio eleitoral]
30/05/1988|Thomas Skidmore|341|Thomas Skidmore| Tudo bem. No caso do Brasil não sou eleitor, não tenho cartão de eleitor. Nos Estados Unidos eu sou, nos nossos termos, um professor que é liberal, que é aquela coisa aqui do centro, um pouquinho para a esquerda. Um pouquinho. Para Dukakis, obviamente. Não tenho dúvida nenhuma.
30/05/1988|Thomas Skidmore|342|Paulo Sérgio Pinheiro| Professor, eu li o seu livro, e Rodolfo e eu estávamos conversando sobre isso. Você mostra um traço importante dessa nossa transição que é, apesar da tortura aos presos políticos ter terminado, mas a tortura e a violência - você mostra isso muito claramente - continuam em plena transição democrática. Na semana passada mesmo, o relatório do Americas Watch mostrava que em São Paulo e no Rio de Janeiro a tortura é uma prática endêmica nos distritos policiais do Rio e de São Paulo.
30/05/1988|Thomas Skidmore|343|Thomas Skidmore| Sim.
30/05/1988|Thomas Skidmore|344|Paulo Sérgio Pinheiro| Você acha que - nessa linha que o Mitre colocava - tanta violência é necessária por quê? Para manter esses 70% de miseráveis, pobres e indigentes ou porque a classe dominante, mesmo democrática, só sabe lidar através da violência com as classes populares? Como é que você explica esse traço que você mostra?
30/05/1988|Thomas Skidmore|345|Thomas Skidmore| Você aqui vai até o coração, quer dizer, até a essência da sociedade, falando sobre isso.
30/05/1988|Thomas Skidmore|346|Fernando Mitre| E, ao mesmo tempo, existe aquele mito da não-violência. Uma contradição.
30/05/1988|Thomas Skidmore|347|Thomas Skidmore| Pois é. Isso combina, isso é muito poderoso, Mitre. Primeiro, você tem em todos os países, inclusive no meu país, você tem sadistas que gostam de torturar. Aqueles que dizem: “Nós estamos ganhando muito pouco, mas, outra renda emocional é a oportunidade de bater no outro". Isso existe. Bom, a questão é o controle sobre isso, quem vai ser contratado. Sabe que eu não sei. Essa coisa da sociedade patriarcal: “sim senhor”, “não senhor”, isso é uma coisa que não temos. Hoje, falando com o presidente, eu não consegui falar "o senhor" [risos], falei você, e depois eu fiquei chateado. Não pode, [porque] é com o presidente. Mesmo na linguagem tem todo esse sistema nas esferas.
30/05/1988|Thomas Skidmore|348|Fernando Mitre| O professor Roberto Da Mata [autor de diversas obras de referência na antropologia, sociologia e ciência política, aborda a distinção entre indivíduo e pessoa em seu original trabalho sobre a pergunta: "Você sabe com quem está falando?"], que o senhor cita no começo do livro, ele cita esse tipo de relação...
30/05/1988|Thomas Skidmore|349|Thomas Skidmore| [Interrompendo] É. “Você sabe com quem está falando?”.
30/05/1988|Thomas Skidmore|350|Fernando Mitre| É. Exatamente.
30/05/1988|Thomas Skidmore|351|Thomas Skidmore| Provavelmente a violência ajuda. Porque todos nós sabemos, com a experiência do regime militar, sobre o medo que você pode impor... não reprimindo todo mundo, não é? Os torturados, quantos foram? Cinco, dez mil? E a população é de 120 milhões. O autocontrole é a coisa. Não sei se a violência é necessária para isso. Duvido. Mas o problema é democratizar a sociedade, incentivar a participação. Mas isso é muito conveniente para as classes dominantes.
30/05/1988|Thomas Skidmore|352|Rodolfo Konder| O senhor faz uma referência à experiência do José Carlos Dias [(1939-), advogado e político, foi secretário da Justiça de São Paulo no governo Franco Montoro e ministro da Justiça de Fernando Henrique Cardoso. Defendeu centenas de presos políticos nos anos de ditadura, tendo sido, ele mesmo, preso por três vezes], aqui da Secretaria da Justiça. Quais, em sua opinião, são os principais obstáculos que, no caso, levaram ao fracasso da tentativa do secretário José Carlos Dias de impor uma política mais humana ao pessoal do...
30/05/1988|Thomas Skidmore|353|Thomas Skidmore| [Interrompendo] Eu não conheço de perto a história, mas me parece que, primeiro: o José Carlos Dias era um dos poucos advogados que defendeu os presos políticos. Era um homem corajoso, e muito, porque na época foi muito perigoso; segundo: tem essa citação dentro das forças de segurança que é “Nós contra todo mundo”. Qualquer advogado que chega e vai mexer: “Ah! Isso não pode. Isso é nosso campo.”. Eles ficam acima da violência. Também, na repressão, é um tipo de uma tribo, quase, primitivo. Você tem o athos de iniciar, que é matar, bater, ou qualquer coisa. Fica aqui uma fraternidade e, quando entra o outro, especialmente um político que tem um passado de liberar os presos políticos, já é uma dificuldade muito grande. Também a sociedade não gosta de pensar sobre isso. Nós [os americanos] também. Temos casos tremendos sobre Attica [prisão nova iorquina onde ocorreu o maior e mais violento motim da história penitenciária dos Estados Unidos]: rebelião de prisão, o Tom Wicker [repórter que acompanhou os acontecimentos em Attica e escreveu um livro sobre o episódio] estava lá, os jornalistas, e eles não conseguiram evitar a invasão da polícia, e mataram muita gente. Por quê? Porque a pressão social foi grande. “Eles merecem ser esmagados, pois são os perdidos. Vamos!”. Essa reação, com a resistência das forças de segurança, é difícil. Houve rebelião, talvez, incentivada pelos guardas.
30/05/1988|Thomas Skidmore|354|Augusto Nunes| Professor, o Ismael Pfifer, do Butantã, depois de lembrar que o senhor admite que o movimento militar de 1[96]4 foi apoiado pelo governo norte-americano, pergunta se uma suposta eleição... de uma hipotética eleição do ex-governador Leonel Brizola, causaria alguma inquietação ao governo americano, hoje. O senhor acha que isso ocorreria?
30/05/1988|Thomas Skidmore|355|Thomas Skidmore| Ah, acho, sem a menor dúvida. Já deve ter alguns trabalhos no Departamento de Estado sobre isso. Por exemplo, o fato de o deputado Fernando Lyra [(1938-), um dos principais articuladores da candidatura de Tancredo Neves à presidência; foi ministro da Justica por onze meses, no governo Sarney. Em 1989 foi candidato a vice-presidente na chapa de Leonel Brizola] estar trabalhando, fazendo a articulação para o Brizola, é interessante, isso vai mudar um pouco o entendimento do Departamento de Estado, porque o Fernando Lyra é o ex-ministro da Justiça. Como pode?
30/05/1988|Thomas Skidmore|356|Fernando Mitre| Está procurando um tancredista para ser vice do Brizola.
30/05/1988|Thomas Skidmore|357|Thomas Skidmore| Pois é. Vai criar preocupações, sem a menor dúvida.
30/05/1988|Thomas Skidmore|358|Ricardo Carvalho| O senhor disse que já deve existir trabalhos no Departamento de Estado sobre isso. O que quer dizer isso? [sorri]
30/05/1988|Thomas Skidmore|359|Thomas Skidmore| Estou especulando.
30/05/1988|Thomas Skidmore|360|Ricardo Carvalho| Um tipo de estudo sobre isso?
30/05/1988|Thomas Skidmore|361|Thomas Skidmore| Claro.
30/05/1988|Thomas Skidmore|362|Ricardo Carvalho| E eles correspondem à realidade?
30/05/1988|Thomas Skidmore|363|Thomas Skidmore| Não sei. Não li. [Thomas ri discretamente]
30/05/1988|Thomas Skidmore|364|Ricardo Noblat| [Interrompendo] Por que essa preocupação com o Brizola, o que ele representa, visto de lá?
30/05/1988|Thomas Skidmore|365|Thomas Skidmore| A preocupação é aqui no Brasil, porque a preocupação é da imprensa com o Brizola, ou das classes dominantes com o Brizola. É a mesma coisa. É o "homem" que parece que é um líder. O único que é carismático, que tem a capacidade, no momento, de realmente de falar. Eu estive aqui no ano passado, participei aqui do Roda Viva com o Leonel Brizola, e foi impressionante a capacidade de se comunicar que ele tem. Em termos comparativos é impressionante.
30/05/1988|Thomas Skidmore|366|Paulo Sérgio Pinheiro| Mas [durante] todo o período que ele passou lá no Hotel Roosvelt, ele pareceu tão bonzinho, era uma pessoa tão simpática. Ele não virou social-democrata?
30/05/1988|Thomas Skidmore|367|Thomas Skidmore| Eu acho que essa é a posição dele.
30/05/1988|Thomas Skidmore|368|Paulo Sérgio Pinheiro| Mas isso ainda inquieta? Um social-democrata brasileiro ainda inquietará o Departamento de Estado, hoje, da administração de hoje?
30/05/1988|Thomas Skidmore|369|Thomas Skidmore| Mas tem aqui também o passado, a ficha dele.
30/05/1988|Thomas Skidmore|370|Paulo Sérgio Pinheiro| E o passado condena?
30/05/1988|Thomas Skidmore|371|Thomas Skidmore| Não, não. Eu estou explicando. Não sou um membro do Departamento de Estado. [risos] Não escrevi nada sobre isso, mas eu estou tentando explicar. [Paulo Sérgio ri]
30/05/1988|Thomas Skidmore|372|Paulo Sérgio Pinheiro| Você acha que o passado dele o condena?
30/05/1988|Thomas Skidmore|373|Thomas Skidmore| Não, condenar não, mas porque ele era...
30/05/1988|Thomas Skidmore|374|Paulo Sérgio Pinheiro| [Interrompendo] Na perspectiva do governo americano?
