DATA|ENTREVISTA|ORDEM|LOCUTOR|FALA
30/05/1988|Thomas Skidmore|97|Thomas Skidmore| Mas eu acho que o Brizola, a meu ver, é populista. Quer dizer, o governo dele, aqui no Rio, foi um governo mais ou menos populista. Quer dizer, ele jogou tudo em cima da educação, os "brizolões" aquela coisa toda, um pouco aquilo do “socialismo moreno” [conforme o respeitado cientista social e um dos dirigentes do PDT na década de 1980, Darcy Ribeiro, seria uma proposta de socialismo adaptada à realidade do Brasil e de seu povo moreno, conjugada com o trabalhismo varguista]. Mas foi um grito populista. E não acho que isso vá criar grandes problemas para os militares. Grandes problemas.
30/05/1988|Thomas Skidmore|98|Fernando Mitre| O senhor não acha que um confronto entre populistas, como Brizola e Jânio Quadros, poderia criar alguma situação muito complicada neste país?
30/05/1988|Thomas Skidmore|99|Thomas Skidmore| Pode.
30/05/1988|Thomas Skidmore|100|Fernando Mitre| Que complicações seriam essas?
30/05/1988|Thomas Skidmore|101|Thomas Skidmore| Bom, o problema é que a reação a Brizola é muito forte. Eu acho que isso melhorou um pouco, tem mais possibilidades de se pensar como presidente o Brizola. Porque o Brizola era o primeiro a criticar o Plano Cruzado. A posição dele, em termos da eleição presidencial, é uma posição boa. Ele pulou para o outro lado, ao começo do Plano Cruzado. E agora todo mundo está lembrando daquilo. Além disso, eu acho que o governo dele no Rio [de Janeiro] não foi um governo subversivo ou mesmo radical. Era aquela coisa de ser “tudo pelo social”, vamos dizer. A reação contra ele é o que a gente pergunta. Sobre a chance de o Brizola ganhar, isso é outra coisa. Outra coisa. Eu duvido, no segundo turno, que o Brizola ganharia.
30/05/1988|Thomas Skidmore|102|Fernando Mitre| [Interrompendo] O Jânio ganharia?
30/05/1988|Thomas Skidmore|103|Augusto Nunes| [Interrompendo] De quem?
30/05/1988|Thomas Skidmore|104|Ricardo Carvalho| [Interrompendo] De quem?
30/05/1988|Thomas Skidmore|105|Fernando Mitre| Entre o Jânio e o Brizola, o senhor acha que o Jânio ganharia? [rindo] Como é que o senhor vê essas possibilidades?
30/05/1988|Thomas Skidmore|106|Thomas Skidmore| Não estou falando sobre Jânio. Estou falando sobre...
30/05/1988|Thomas Skidmore|107|[Sobreposição de vozes, câmara focada em Thomas Skidmore]|[Sobreposição de vozes, câmara focada em Thomas Skidmore]
30/05/1988|Thomas Skidmore|108|Augusto Nunes| Brizola contra qualquer candidato.
30/05/1988|Thomas Skidmore|109|Ricardo Carvalho| Mas no segundo turno ele não ganharia, professor? Ou disputando com quem?
30/05/1988|Thomas Skidmore|110|Augusto Nunes| Contra qualquer candidato, presumo.
30/05/1988|Thomas Skidmore|111|Thomas Skidmore| Quércia.
30/05/1988|Thomas Skidmore|112|Ricardo Nunes| Quércia?
30/05/1988|Thomas Skidmore|113|Thomas Skidmore| [Com uma expressão de dúvida] Não sei. Mas eu estou dizendo que o Brizola tem a fortaleza dele no Rio Grande do Sul e Rio. Só. Foi muito votado como deputado federal nas eleições de [19]72, no Rio, não é? Duvido que o apoio dele...
30/05/1988|Thomas Skidmore|114|Augusto Nunes| [Interrompendo] [19]62.
30/05/1988|Thomas Skidmore|115|Thomas Skidmore| ... aqui em São Paulo é tão grande. Ele vem para cá a cada oportunidade para estimular a coisa. Em Minas Gerais, não tem...
30/05/1988|Thomas Skidmore|116|Augusto Nunes| [Interrompendo] Professor, vamos completar a roda. Luciano Ornellas, do jornal O Estado de S. Paulo.
30/05/1988|Thomas Skidmore|117|Luciano Ornellas| Professor, por analogia, para que o telespectador faça uma diferença entre o seu país e o nosso. O senhor não acha que se o caso de Watergate [o caso Watergate foi o escândalo político ocorrido na década de 1970 nos EUA que, ao vir à tona, acabou culminando na renúncia do presidente americano Richard Nixon. Watergate, de certo modo, tornou-se um caso paradigmático de corrupção] tivesse acontecido no Brasil, os jornalistas já estariam presos? 
30/05/1988|Thomas Skidmore|118|Thomas Skidmore| Como é?
30/05/1988|Thomas Skidmore|119|Luciano Ornellas| Os jornalistas aqui [no Brasil] já não estariam presos?
30/05/1988|Thomas Skidmore|120|Augusto Nunes| Se o caso... repete, acho que ele não ouviu a primeira parte.
30/05/1988|Thomas Skidmore|121|Luciano Ornellas| Se o caso de Watergate tivesse acontecido no Brasil, o senhor não acha que os jornalistas iriam pra cadeia?
30/05/1988|Thomas Skidmore|122|Augusto Nunes| Os jornalistas.
30/05/1988|Thomas Skidmore|123|Thomas Skidmore| Aqui no Brasil?
30/05/1988|Thomas Skidmore|124|Augusto Nunes| É.
30/05/1988|Thomas Skidmore|125|Thomas Skidmore| [Olha fixamente para Luciano Ornellas e sorri] Está com medo?
30/05/1988|Thomas Skidmore|126|[Risos e sobreposição de vozes]|[Risos e sobreposição de vozes]
30/05/1988|Thomas Skidmore|127|Augusto Nunes| Acho que vale a pena até a gente se estender sobre essa pergunta. O que existe, professor, é uma sensação de profundo desencanto em relação à disposição da máquina judiciária, ou da máquina do executivo em apurar casos de corrupção. Um caso desse tamanho - presumo que seja isso - envolvendo o governo brasileiro [enfatiza], o senhor acha que geraria as conseqüências que o caso Watergate gerou ou o tiro sairia pela culatra?
30/05/1988|Thomas Skidmore|128|Thomas Skidmore| Mas o jornalista dos Estados Unidos não foram para a cadeia.
30/05/1988|Thomas Skidmore|129|Augusto Nunes| Pois é, mas o Luciano está dizendo é que aqui o tiro sairia pela culatra, como dizem os brasileiros, os jornalistas é que iriam para a cadeia.
30/05/1988|Thomas Skidmore|130|Thomas Skidmore| Não sei. A tradição jornalística no Brasil é muito forte, tem muitos anos. Eu acho que mesmo durante o governo militar, essa tradição continuava. A minha impressão atual é que não tem essa tendência. Se houver emergência, alguém vai chamar para estado de sítio [suspensão temporária dos direitos e garantias constitucionais dos cidadãos acionada pelo chefe de Estado, mediante autorização do Congresso Nacional, em casos extremos, como: agressão por forças estrangeiras, grave ameaça à ordem constitucional democrática ou calamidade pública. Em estado de sítio, os poderes legislativo e judiciário submetem-se ao executivo], aquela coisa toda, é possível, claro. Inclusive gringos... [risos] Me chamaram [apontado para si] para a polícia uma vez...
30/05/1988|Thomas Skidmore|131|Augusto Nunes| Professor, eu vou insistir nesse filão que o Luciano Ornellas descobriu agora. O senhor certamente deve estar ouvindo muitos relatos sobre... envolvendo casos de corrupção, quase todos ligados a funcionários do governo. São casos de corrupção que envolvem grandes cifras, sobretudo para os padrões brasileiros. O senhor acha que, primeiro, o nível de corrupção é semelhante nos Estados Unidos e no Brasil? Segundo, a corrupção nos Estados Unidos é tão impune quanto parece ser aqui no Brasil?
30/05/1988|Thomas Skidmore|132|Thomas Skidmore| Isso é difícil de dizer. Eu não fiz pesquisa sobre isso, não é? Mas a impressão que eu tenho é que no Brasil as instituições não funcionam no mesmo nível do que nos Estados Unidos. Por exemplo, nós temos o General Accounting Office [Escritório Geral de Contabilidade dos Estados Unidos], que é, realmente, o centro onde eles fazem a contabilidade de todo o governo. É independente, subordinado ao Congresso e tem independência. E ninguém vai subornar o General Accounting Office. Tenho a impressão [de] que no Brasil isso não existe. Quer dizer, ainda tem muito para fazer nesse assunto.
30/05/1988|Thomas Skidmore|133|Augusto Nunes| Professor, antes de... Desculpe. Em seguida, Paulo Sérgio Pinheiro. Alguns telespectadores, entre os quais Vicente Bianchi, do Campo Limpo e César Brigante, desculpe, Sérgio Pinto Dias, de Alphaville, eles querem saber se o senhor acha que o Brasil...
30/05/1988|Thomas Skidmore|134|Thomas Skidmore| [Interrompendo] Só para fazer uma... Nós [Estados Unidos] temos também corrupção [risos]. Bastante.
30/05/1988|Thomas Skidmore|135|Augusto Nunes| Perfeito. Se o senhor acha que o Brasil, visto à distância, é um país sério? O senhor certamente sabe da frase que foi atribuída, parece, a Charles De Gaulle [(1890-1970) general e estadista francês que liderou as forças francesas livres durante a Segunda Guerra Mundial], segundo a qual o Brasil não seria um país sério. É?
30/05/1988|Thomas Skidmore|136|Thomas Skidmore| Eu acho que sim. Inclusive, nos meus cursos nos Estados Unidos, quando eu vou fazer conferência lá, tem muito interesse no Brasil. Geralmente começa com a música brasileira. Todo mundo conhece. Depois disso tem outras coisas, tem sobre a Amazônia, sobre o sistema político, sobre futebol, sobre samba, sobre... e depois a gente fica aqui com outras coisas. Mas eu acho que o Brasil é um país sério. Às vezes, o nosso país é sério demais.
30/05/1988|Thomas Skidmore|137|Paulo Sérgio Pinheiro| Voltando ainda a essa questão da corrupção. Graças ao que o Luciano lembrava, talvez a visibilidade da transição, nunca a corrupção foi tão explícita no país. Você, que conhece a longa duração republicana, por que essa resistência? Você já deu uma explicação, o problema das instituições.
30/05/1988|Thomas Skidmore|138|Thomas Skidmore| Sim.
30/05/1988|Thomas Skidmore|139|Paulo Sérgio Pinheiro| Mas você não acha que, numa transição política, esses temas da corrupção, que, evidentemente, interessam à população e aos eleitores, por que é que eles não têm uma conseqüência ao nível dos governantes?
30/05/1988|Thomas Skidmore|140|Thomas Skidmore| Eu acho que entra aqui também o sistema partidário. O sistema partidário, que está funcionando bem, quem controla, em certo sentido, é a oposição. Com esse sistema que não funciona bem, que alguém que está no governo não tem oposição realmente para criticar, isso só deixa a imprensa para fazer controle, para fazer investigação. Eu acho que isso seria melhor com um sistema partidário melhor organizado. Inclusive, muitas vezes, tem corrupção que é disciplinada pelos partidos. Corrupção é inevitável, muitas vezes. Porque o que um chama de corrupção, para outro é renda, porque, talvez, o salário dele seja muito baixo, e funciona, nessa base. Mas, precisa de um sistema que discipline. Quando não tem sistema partidário bem organizado, bem montado, eu acho que isso é maior. E também tem a mentalidade que "Vamos pegar o 'nosso' rapidamente, porque não tem mais chance.". É a nossa única oportunidade.
30/05/1988|Thomas Skidmore|141|André Singer| Professor, eu gostaria de perguntar justamente sobre o sistema partidário, que o senhor levantou. O regime militar instaurou um bipartidarismo seguindo o modelo norte-americano. Esse bipartidarismo...
30/05/1988|Thomas Skidmore|142|Thomas Skidmore| [Interrompendo] Pensando que foi.
30/05/1988|Thomas Skidmore|143|André Singer| Pois é. Mas esse bipartidarismo sobreviveu durante algum tempo e depois se desfez numa certa etapa da transição. Hoje o senhor está assinalando que há um sistema partidário pouco estruturado. Eu gostaria de saber a sua opinião. Se num país como o Brasil a tendência é o sistema partidário se estruturar ao redor de dois grandes partidos - um do governo e outro da oposição - ou o multipartidarismo e esse certo esfacelamento partidário que está ocorrendo hoje é a tendência natural? E, gostaria, também, de agregar a isso a observação feita pelo próprio presidente Sarney, de que não existem partidos nacionais, nós temos partidos por Estado. E mencionar que a Assembléia Constituinte aprovou novamente o voto proporcional e não o voto distrital. Quer dizer, o senhor acha que o sistema partidário brasileiro tende a se estruturar por onde? Qual é o modelo que o senhor enxerga?
30/05/1988|Thomas Skidmore|144|Thomas Skidmore| Bom, o experimento com o bipartidarismo, a meu ver, foi ingenuidade do presidente Castelo Branco. Ele achava que o segredo da democracia americana, e também a inglesa, era o bipartidarismo. O fato é que bipartidarismo é um mito. No nosso país sempre houve alguns outros partidos. Também na Inglaterra. Agora, por exemplo, a Tatcher [Margaret Thatcher] tem a maioria tremenda, mas a votação dela, popular, é menos do que 50%. De modo que não é verdade que eles precisam... a verdade histórica é que sempre houve mais partidos, conosco também.
30/05/1988|Thomas Skidmore|145|André Singer| Mas nos Estados Unidos, predominantemente, há dois partidos, não é?
30/05/1988|Thomas Skidmore|146|Thomas Skidmore| Predominante, é. Às vezes tem variações. Ao meu ver, seria melhor para o Brasil - especulação minha - ter o sistema de voto distrital em termos de fortalecer os partidos e com isso articular partidos nacionais, que precisam, que vai distribuir. Quer dizer, tem a máquina governamental que cresceu tremendamente durante o governo militar, não é? É um monstro que fica lá dividindo as coisas, seguindo a opinião dos tecnocratas, sem a influência ou pouca influência dos políticos. O que precisa é articular os partidos com o poder, com o governo central e também descentralizar bastante, para os estados. E eu acho que isso estimularia muito o sistema político brasileiro. O fato é que você vai ter conflitos setoriais, ou de classe, isso é inevitável. Mas com partidos bem articulados, nacionais, tem a possibilidade de negociar, negociar o acordo, coisa que agora não tem.
30/05/1988|Thomas Skidmore|147|Fernando Mitre| Professor, o senhor se refere no seu livro ao enorme talento que as nossas elites têm para passar ao largo das questões fundamentais relativas à justiça social e econômica, como o senhor diz. E ainda com relação ao quadro partidário, o nosso quadro partidário não é nitidamente ideológico. Então, o eleitor quando vota não sabe muito bem em que programa ele está votando. Agora, o senhor acha possível, num país com as diferenças sociais do Brasil, se aplicar eficientemente uma democracia política sem cuidar da democracia social? Quer dizer, com essas disparidades?
30/05/1988|Thomas Skidmore|148|Thomas Skidmore| [Interrompendo] Eu acho que não. Eu acho que não é possível.
30/05/1988|Thomas Skidmore|149|Fernando Mitre| Não é possível. Então, podemos concluir que nós estamos ainda praticamente na estaca zero na construção da democracia. Porque estamos cuidando de problemas institucionais ainda. E o problema social, este está distante, muito longe ainda. Seria isso? Estamos tão longe assim então de uma democracia plena?
30/05/1988|Thomas Skidmore|150|Thomas Skidmore| Bastante distante. Bom, primeiro, os fatos políticos ainda são fatos vindos do sistema militar, do governo militar. O que houve durante o governo militar? Dois partidos: um partido do governo, que tinha que ganhar, e a oposição, que não podia ganhar. E o governo militar manipulou o sistema. O que aconteceu? O MDB [Movimento Democrático Brasileiro] se tornou o grande partido do Brasil. E a bandeira era, exatamente, liberdade contra a repressão e também justiça social. Isso fica muito claro nos manifestos. Em [19]82, nas campanhas para governadores, foi muito bem articulado lá, e também quando o presidente Sarney convidou o Hélio Jaguaribe [(1923-) sociólogo, cientista político e escritor. Durante o governo de Sarney, em 1985, coordenou o Projeto Brasil 2000, que resultou em livro intitulado Brasil 2000: para um novo pacto social. Em 1988, o segundo volume do projeto foi publicado - Brasil: reforma ou caos - e Jaguaribe auxiliou a fundação do PSDB (Partido da Social Democracia Brasileira)], sociólogo, para fazer aquele estudo sobre o Brasil democrático e os seus problemas, estava tudo lá, uma radiografia do problema social no Brasil, sem dúvida nenhuma.
30/05/1988|Thomas Skidmore|151|Paulo Sérgio Pinheiro| Mas o presidente não fez nada, ele preferiu jogar no lixo. [Thomas ri]
30/05/1988|Thomas Skidmore|152|[...]| Professor, ...
30/05/1988|Thomas Skidmore|153|Thomas Skidmore| Mas eu acho que é essencial fazer isso. Não tenho a menor dúvida. O Brasil tem essa divisão que é muito grande. É a preocupação com mudanças institucionais...
30/05/1988|Thomas Skidmore|154|Fernando Mitre| [Interrompendo] O senhor acha que a Nova República não caminhou nessa direção por enquanto?
30/05/1988|Thomas Skidmore|155|Thomas Skidmore| Muito pouco.
30/05/1988|Thomas Skidmore|156|Fernando Mitre| Quer dizer, o “tudo pelo social” do Sarney é mais uma frase?
30/05/1988|Thomas Skidmore|157|Thomas Skidmore| Eu não conheço profundamente o orçamento, mas duvido [sorri].
30/05/1988|Thomas Skidmore|158|Fernando Mitre| Então quer dizer que o PMDB...
30/05/1988|Thomas Skidmore|159|Augusto Nunes| Cláudio, ...
30/05/1988|Thomas Skidmore|160|Thomas Skidmore| Houve uma coisa que era o Plano Cruzado... quando começou o Plano Cruzado
30/05/1988|Thomas Skidmore|161|Fernando Mitre| Mas que não era também para distribuir renda. Aquilo foi...
30/05/1988|Thomas Skidmore|162|Thomas Skidmore| [Interrompendo] Foi no começo. Eles aumentaram os salários, houve um rush, uma euforia de prosperidade, muita gente de baixo... Lembro-me muito bem o Pazzianotto [Almir Pazzianotto Pinto (1936-) foi ministro do Trabalho no Brasil, de 1985 a 1988. Depois de promulgada a Constituição de 1988, Pazzianotto foi indicado pelo presidente Sarney para o Tribunal Superior do Trabalho, do qual foi ministro vitalício até 2002, quando se aposentou] dizendo: "Mal dá para o operário aqui comprar um par de sapatos".
30/05/1988|Thomas Skidmore|163|Fernando Mitre| Naquele momento, trinta milhões de brasileiros que não conheciam o mercado de consumo chegaram lá, mas parece que já voltaram.
30/05/1988|Thomas Skidmore|164|[Sobreposição de vozes]|[Sobreposição de vozes]
30/05/1988|Thomas Skidmore|165|Augusto Nunes| Professor, só pra estabelecer um pouco de ordem...
30/05/1988|Thomas Skidmore|166|Thomas Skidmore| Pois não.
30/05/1988|Thomas Skidmore|167|Augusto Nunes| É o Paulo Sérgio, depois o Rodolfo, depois o Luciano Ornellas.
30/05/1988|Thomas Skidmore|168|Thomas Skidmore| Ok.
30/05/1988|Thomas Skidmore|169|Paulo Sérgio Pinheiro| Voltando a essa questão dos partidos, você acha que o poder fez mal ao PMDB, quer dizer, essa degenerescência que hoje nós assistimos ocorrer no PMDB, você acredita que, mal ou bem, eles estiveram no poder, apesar dessa Nova República vir sendo governada por decreto-lei? [risos] Você sabe, o presidente Sarney só governa por decreto-lei. Você acha que o poder fez mal ao PMDB, a todas essas bandeiras que você se referia: da liberdade, da democracia, do projeto social?
30/05/1988|Thomas Skidmore|170|Thomas Skidmore| O problema é que o Tancredo teria sido a ponte entre o sistema antigo e os problemas atuais, não é?
30/05/1988|Thomas Skidmore|171|Augusto Nunes| [Interrompendo] Aliás, professor...
30/05/1988|Thomas Skidmore|172|Thomas Skidmore| Pois não.
30/05/1988|Thomas Skidmore|173|Augusto Nunes| Desculpe interromper, eu quero aproveitar esse assunto levantado pelo Paulo Sérgio para dizer o seguinte: vários telespectadores têm muita curiosidade em saber que tipo de paralelo o senhor estabelece entre o Sarney e o Tancredo. Então, por exemplo, o Rui Santana, que é meu conterrâneo, de Taquaritinga, pergunta se, levando em conta que o Tancredo sequer tomou posse, se é legal ou legítima a situação do presidente José Sarney. O José Augusto de Vasconcelos, de Campinas, ele entende que a maior obra do governo Sarney, até agora, foi a própria consolidação do seu governo, porque ele acha que isso configura uma guinada conservadora, na medida em que provocou um desvencilhamento progressivo dos compromissos que Tancredo Neves havia assumido com setores progressistas. Ele pergunta como é que o senhor vê esse período do governo Sarney. César Brigante, de São Carlos, interior de São Paulo, ele acha que com o Tancredo no governo a transição estaria encerrada... aliás, ele pergunta ao senhor se com o Tancredo no governo a transição estaria encerrada em quatro anos e se o PMDB estaria no poder. Eu queria que o senhor juntasse a pergunta do Paulo Sérgio, que fala do PMDB, também, e essas perguntas dos telespectadores que estão curiosos quanto a uma comparação entre o Tancredo e o Sarney, que o senhor falasse desse assunto.
30/05/1988|Thomas Skidmore|174|André Singer| Augusto, eu poderia tomar uma carona e acrescentar só mais uma coisinha? O senhor, no seu livro, se refere ao Tancredo como um peessedista.
30/05/1988|Thomas Skidmore|175|Thomas Skidmore| Mas, você já leu o livro? [risos]
30/05/1988|Thomas Skidmore|176|André Singer| [Rindo] Eu li partes do livro. O senhor se refere ao Tancredo Neves como um peessedista de centro-esquerda.
30/05/1988|Thomas Skidmore|177|Thomas Skidmore| [Interrompendo] Em [19]85.
30/05/1988|Thomas Skidmore|178|André Singer| Eu gostaria de perguntar se o senhor acha que realmente esse era o perfil dele, porque muitos o vêem como um homem de centro e até como um conservador e, também, num outro momento do seu livro, o senhor diz que o presidente Tancredo eleito era o presidente que teve maior legitimidade de todos os presidentes [que já foram] eleitos. Eu lhe pergunto se isso não é um pouco contraditório com o fato de que, apesar de ele ter sido eleito com certo apoio popular, ele foi eleito por um colégio eleitoral limitado, que era determinado pela constituição militar, do regime militar [Thomas assente com a cabeça]. Enquanto houve na história do país alguns presidentes eleitos diretamente pelo voto. Essa atribuição de presidente com maior legitimidade de todos os presidentes eleitos no país, não seria contraditória com esse fato?
30/05/1988|Thomas Skidmore|179|Thomas Skidmore| É possível. É possível, mas a votação foi espantosa. Bom, o Tancredo tinha uma posição contraditória, porque o primeiro ministro da Fazenda que ele escolheu era o Dornelles [Francisco Dornelles, sobrinho de Tancredo Neves, foi ministro da Fazenda entre março e agosto de 1985], que é um homem da política bastante ortodoxa, não muita coisa de justiça social. Aconteceu que houve, durante os dois primeiros anos do governo Sarney, que o crescimento econômico foi bastante bom, cresceu bastante a economia, coisa que o governo não notou quando começou em março, de modo que houve muitas contribuições nas posições do Tancredo. Mas naquele momento, o espírito, o apoio, o alívio emocional foi uma coisa incrível! Quando ele morreu o luto foi uma coisa incrível. Em certo sentido, ele também tinha a vantagem da reação contra o outro candidato presidencial naquela época, que era o governador Paulo Maluf, uma reação tremenda contra ele. A meu ver, um pouco da reação contra o Maluf era um pouco contra as Forças Armadas, mas ele era o bode expiatório, em certo sentido. De modo que o Sarney está enfrentando as dificuldades que também o Tancredo teria encontrado, sem a menor dúvida. O problema é que o Sarney representa outra tradição, que é a do Nordeste, que é a do bastião [fortaleza, bastião do coronelismo político] do eleitorado durante o governo militar. [Já] O Tancredo tinha outras ligações, por isso que foi mais difícil para o Sarney. Mas também o Tancredo é do PMDB, e se tornou o representante do partido que era de grande oposição ao governo.
30/05/1988|Thomas Skidmore|180|[Sobreposição de vozes]|[Sobreposição de vozes]
30/05/1988|Thomas Skidmore|181|Augusto Nunes| Rodolfo Konder.
30/05/1988|Thomas Skidmore|182|Rodolfo Konder| É sempre bom lembrar, professor, que, apesar de todos esses rótulos - isso é só para deixar um registro -, o Tancredo nunca esteve do lado do "cabo do chicote", em mais de cinqüenta anos de vida pública. Isso eu sempre gosto de recordar.
30/05/1988|Thomas Skidmore|183|Thomas Skidmore| Sim.
30/05/1988|Thomas Skidmore|184|Rodolfo Konder| Inclusive, a alguns amigos meus de esquerda que gostavam de criticar o Tancredo, eu sempre gosto de lembrar que o Tancredo nunca esteve do lado da repressão. Agora, a minha... eu queria também trazer o senhor para uma questão que nos envolve mais diretamente aqui em São Paulo. O senhor disse que todo historiador é um mau profeta, então eu gostaria de aproveitar o seu conhecimento na avaliação do passado, já que em relação ao futuro o senhor é muito cauteloso...
30/05/1988|Thomas Skidmore|185|[Risos gerais]|[Risos gerais]
30/05/1988|Thomas Skidmore|186|Rodolfo Konder| ... mesmo com essa sua irreverência. [Thomas põe as mãos na cabeça e ri] A idéia... veja bem... O senhor falou da candidatura Jânio Quadros e esse é um problema que nos aturde a todos. Eu gostaria que o senhor relembrasse um pouco para este país, para os nossos telespectadores que vivem num país de memória curta, quem é o senhor Jânio Quadros e o episódio da renúncia. Que papel ele desempenhou no episódio da renúncia, que é uma coisa que as pessoas parecem que já se esqueceram.
30/05/1988|Thomas Skidmore|187|Thomas Skidmore| É... Não, eu me lembro muito bem. Eu cheguei no Brasil, a primeira vez foi em [19]61, dois meses depois da renúncia de Jânio. Era uma desilusão tremenda, um desalento, um repúdio aos políticos, em geral. Entre [19]61 e [19]64, muitas vezes, eu encontrei pessoas e conversávamos sobre o golpe de [19]64, e “o culpado”, muitas vezes o brasileiro diz: “Foi o Jânio”, porque ele renunciou ao mandato que não foi cumprido. Houve aqui falta de compreensão, [porque] o Jânio tinha prometido explicar toda a coisa. Muitas vezes. Eu tenho em casa milhares de recortes sobre as explicações, que nunca chegaram.
