DATA|ENTREVISTA|ORDEM|LOCUTOR|FALA
28/02/2005|Dom Tomás Balduíno|129|Dom Tomás Balduíno|Nós somos contra essa transposição. Primeiro por achar que é um projeto faraônico, um projeto que demanda muito investimento - parece que irá durar vinte anos para concluir. E há duas pontas que conflitam com a aceitação desse projeto: uma é o próprio rio São Francisco - um rio doente, um rio que perdeu muitas nascentes, falam de mil e tantos pequenos afluentes do São Francisco que desapareceram com o plantio da monocultura de eucalipto. Sem falar da poluição -  virou esgoto de muitas cidades pelas quais ele passa –  do assoreamento - é um rio cujo estuário a entrada da água salgada já penetra cinqüenta quilômetros. Quer dizer, o rio morre muito antes do mar - o mar é mais forte. Antigamente se via até o sinal da água turva do rio invadindo o mar - como acontece no Amazonas. Agora é o contrário. Para concluir a parte de reforma agrária: falam muito em desapropriar as terras... 
28/02/2005|Dom Tomás Balduíno|130|Paulo Markun|... Inclusive há reserva das áreas próximas ao rio e aos canais, não é?
28/02/2005|Dom Tomás Balduíno|131|Dom Tomás Balduíno|Mas 90% daquela área por onde vai passar a tubulação não vai nem saber que o rio passa por ali. Quer dizer, no semi-árido - na região do pessoal que precisa de água - tendo essa transposição  não vai se beneficiar. O que vai beneficiar mesmo são as cidades e os projetos de plantio de frutas para a exportação.
28/02/2005|Dom Tomás Balduíno|132|Francisco Leali|Dom Tomás, a CPT está na vanguarda - e o senhor também - de vários movimentos. Eu queria saber qual a opinião do senhor sobre três temas polêmicos - alguns estão para entrar no Congresso e outros não -, que são: experiência com célula-tronco, ampliação das possibilidades de aborto, e casamento de homossexuais. Qual é a posição do senhor sobre esses três pontos?
28/02/2005|Dom Tomás Balduíno|133|Dom Tomás Balduíno|Outro assunto polêmico que você me mete dentro.  Com relação às células entro nesse assunto pela questão da medicina ampliá-las. São células que podem ser aproveitadas na medula ou de cordão umbilical.
28/02/2005|Dom Tomás Balduíno|134|Francisco Leali|E o embrião?
28/02/2005|Dom Tomás Balduíno|135|Dom Tomás Balduíno|O problema do embrião é que é mais polêmico, porque - isso na nossa concepção eclesial -, a sua evolução é uma evolução direta - pessoa humana. Aí entra o problema do respeito . É tão sagrada a pessoa... É tão importante isso,  como coisa única no Universo, então... 
28/02/2005|Dom Tomás Balduíno|136|Paulo Markun|Dom Tomás, é melhor que  vá para o lixo? Eu não consigo entender. O embrião de que se fala é o embrião que é utilizado em experimentos em fertilização in vitro - que vai para o lixo. Melhor que vá para o lixo?
28/02/2005|Dom Tomás Balduíno|137|Dom Tomás Balduíno|Não deveria ir. Não cheguei a essa conclusão. A proposta, ao menos para a Igreja, se coloca do ponto de vista do cuidado que deve presidir a tudo aquilo que se refere ao embrião, desde que fecundado, e então essa cadeia termina na pessoa.
28/02/2005|Dom Tomás Balduíno|138|Francisco Leali|Faltou  o aborto. Por exemplo, no caso do aborto, o que está se discutindo é a possibilidade de ampliar o aborto em caso de feto com anencefalia . Parece-me que a Igreja também não aceita  nesse tipo de situação.
28/02/2005|Dom Tomás Balduíno|139|Dom Tomás Balduíno|Atualmente a legislação da Igreja é pelo direito canônico, mas durante o concílio se discutiu a possibilidade de isso ser deixado ao critério das conferências episcopais ou dos próprios bispos  pastores poderem decidir.
28/02/2005|Dom Tomás Balduíno|140|Francisco Leali|Qual a posição do senhor sobre isso?
28/02/2005|Dom Tomás Balduíno|141|Dom Tomás Balduíno|Eu sou pela posição do respeito à vida. Não  duramente , como no caso dessa... 
28/02/2005|Dom Tomás Balduíno|142|Francisco Leali|... do feto sem cérebro?
28/02/2005|Dom Tomás Balduíno|143|Dom Tomás Balduíno|Eu respeito a vida pelo seguinte: tudo o que se refere ao aborto e a facilitação do aborto vai na linha da exclusão. É como mais uma  exclusão. E  programada.
28/02/2005|Dom Tomás Balduíno|144|Francisco Leali|Mesmo nesse caso do feto  que não vai durar nem dois minutos depois que nascer?
28/02/2005|Dom Tomás Balduíno|145|Dom Tomás Balduíno|Eu não seria de uma posição rígida, se fosse o caso de eu poder julgar. Mas isso é um caso pessoal meu. Acho que do ponto de vista eclesial o que salva a posição da Igreja é esse respeito pela vida.
28/02/2005|Dom Tomás Balduíno|146|Francisco Leali|E  o terceiro ? Só ficou faltando o casamento de homossexuais.
28/02/2005|Dom Tomás Balduíno|147|Dom Tomás Balduíno|Acho que a questão do homossexualismo é uma questão de cultura, de evolução. A moral não é uma ciência dada - como um dogma para sempre -, ela evolui com a evolução das consciências, com a evolução das pessoas. Nesse sentido a gente vê que a sociedade se torna mais aberta, mais compreensiva. E eu acho que a moral também deve adotar o mesmo caminho.
28/02/2005|Dom Tomás Balduíno|148|Gilberto Nascimento|Dom Tomás, a pergunta que eu queria fazer - só complementando -: o senhor não acha que a Igreja de maneira geral tinha que modernizar suas relações com a sociedade? Ela não está muito distante hoje de o que a população vive e pensa de maneira geral, por manter estas posições a respeito da camisinha  sexo antes do casamento? Pregam-se práticas que a quase totalidade dos católicos não exercem.
28/02/2005|Dom Tomás Balduíno|149|Dom Tomás Balduíno|Eu creio que em um momento como esse, de uma Igreja mais centralizada, talvez esses problemas fiquem mais crispados. Com relação, por exemplo, à utilização da camisinha já há pronunciamento até de grandes figuras da Igreja - por exemplo, o cardeal Danillis - que acham isso normal, uma vez que é a defesa da vida. Proibir isso  é favorecer a morte, e  vem a morte.
28/02/2005|Dom Tomás Balduíno|150|Gilberto Nascimento|O senhor concorda com ele nesse pensamento?
28/02/2005|Dom Tomás Balduíno|151|Dom Tomás Balduíno|Eu concordo, eu acho que...  Houve uma declaração do cardeal Trujillo  condenando, dizendo que era cientificamente provado que  não funcionava. Então esse Papa João Paulo II teve um pronunciamento que diz que não cabe à Igreja tomar decisões científicas. Então nós não podemos tomar o lugar dos cientistas. Se eles acham que têm garantia, então a gente respeita.
28/02/2005|Dom Tomás Balduíno|152|Ariovaldo Umbelino de Oliveira|Dom Tomás, eu queria voltar a uma questão da vida dos vivos, dos que estão na terra.
28/02/2005|Dom Tomás Balduíno|153|Dom Tomás Balduíno| melhor. 
28/02/2005|Dom Tomás Balduíno|154|Ariovaldo Umbelino de Oliveira|A reforma agrária no Nordeste é uma questão histórica e já centenária. Há necessidade dessa reforma agrária. Gradativamente a CPT e a Igreja foram juntando ao debate da reforma agrária a questão da água. Quando o senhor comentava a pergunta a respeito da transposição, parece-me  há uma diferença entre a concepção que a CPT defende - da convivência com a seca e do aproveitamento da quantidade de água, a qual existe no Nordeste mesmo em uma situação de seca - e as ações das grandes obras, como o senhor comentou. A campanha da fraternidade no ano passado tratou da temática da água. Como é que hoje a CPT consegue - na formação dos seus quadros, na formação das suas ações no interior do sertão nordestino - trabalhar essa idéia junto ao sertanejo, da necessidade do convívio com a seca?
28/02/2005|Dom Tomás Balduíno|155|Dom Tomás Balduíno|Primeiramente, com relação à água  geral: a lei dos recursos hídricos - a gente lamenta que a lei seja sobre recursos, logo entra a parte de mercado, que é a água - deveria ser a lei do patrimônio hídrico. Mas essa lei dos recursos hídricos tem uma vantagem, porque disciplina e abre para uma discussão mais democrática - de consulta às comunidades. Eu acho que a sua pergunta aponta para um ponto que eu acho importantíssimo - uma região onde foram derramados rios de dinheiro  foram parar no bolso das oligarquias rurais e urbanas pela Sudene . Foi o povo pobre que descobriu a solução: na água de chuva e na convivência com o semi-árido. O semi-árido não é nenhum inferno a ser abandonado para ir para São Paulo. É uma riqueza enorme - e há animais já de milênios convivendo com aquilo, e vegetação . E a água de chuva é uma solução espetacular, porque é mais pura do que a água nas garrafas de água vendidas pela Nestlé e Coca-Cola.
28/02/2005|Dom Tomás Balduíno|156|Leonardo Sakamoto|Mas a cisterna garantiria a viabilidade econômica para o sertanejo produzir? Criação de cabra até sim. Mas,  alternativas?
28/02/2005|Dom Tomás Balduíno|157|Dom Tomás Balduíno|Sim,  até  irrigação,  as mandalas - que são os tanques - muitos deles cobertos por causa... 
28/02/2005|Dom Tomás Balduíno|158|Leonardo Sakamoto|... da evaporação.
28/02/2005|Dom Tomás Balduíno|159|Dom Tomás Balduíno|... evaporação - e  “bombinha” solar .
28/02/2005|Dom Tomás Balduíno|160|Paulo Markun|Mas o governo federal - se não me falha a memória - está envolvido em um grande projeto, que envolve também  iniciativa privada, chamado projeto ASA, que é Associação dos Semi-Áridos, com o objetivo de colocar uma quantidade imensa de cisternas... 
28/02/2005|Dom Tomás Balduíno|161|Dom Tomás Balduíno|Eles falam em milhões de cisternas.
28/02/2005|Dom Tomás Balduíno|162|Paulo Markun|Exatamente um milhão de cisternas. Isso não resolve?
28/02/2005|Dom Tomás Balduíno|163|Dom Tomás Balduíno|Eu acho que resolve, porque eu conheço um bispo espanhol  é do Nordeste,  ele fala: “Na minha terra, na Espanha, o pessoal vive bem e chove muito menos de que no Nordeste”.
28/02/2005|Dom Tomás Balduíno|164|[...]|Chove a metade  na Espanha.
28/02/2005|Dom Tomás Balduíno|165|Dom Tomás Balduíno|Então é mesmo uma questão de orientação geral de política, ao invés de transformar aquilo  na indústria da seca - e esse projeto faraônico de transposição do rio São Francisco - Lula me desculpe, mas - está na linha da indústria da seca.
28/02/2005|Dom Tomás Balduíno|166|Paulo Markun|Dom Tomás, eu vou tirar o crachá de mediador - às vezes eu consigo fazer isso -, para relatar uma experiência pessoal. Eu tenho um envolvimento com um pequeno grupo de produtores  agricultores familiares da região da serra de Santa Catarina, onde o grande problema - são 26 agroindústrias de agricultores familiares organizados trabalhando em rede há 12 anos - o problema desses agricultores é que há pouco negócio. Tem “agro” demais e “negócio” de menos - e eu explicarei em que sentido . Cada vez que se vai, por exemplo, ao Banco do Brasil há uma enorme dificuldade - ainda no atual governo - para convencer o banco de que uma cooperativa desse tipo não pode ter todas as regras e os preceitos que há em uma grande indústria, ou uma fumageira , ou uma empresa que produz frango ou produz outro tipo de aves. É um sistema de envolvimento dos pequenos produtores, mas que tomam o dinheiro em nome da grande empresa, e é difícil  convencer  disso. Eu pergunto se a CPT tem esse tipo de visão, porque a sensação que me deu do discurso do senhor, do raciocínio do senhor, é que toda a produção agrícola que envolva o objetivo de ganhar dinheiro é mau negócio para o mundo, negócio no sentido de...  ... é um mau objetivo. O senhor imagina que há saída para o campo? Para ser bem objetivo:  seja dentro do capitalismo?
28/02/2005|Dom Tomás Balduíno|167|Dom Tomás Balduíno|Há  O próprio socialismo tem capitalismo, só que é dividido, é partilhado, não visa só o lucro nem visa a concentração na mão de um só. Os grupos hegemônicos...  - a água no mundo está na mão de sete,  a oligarquia das águas, isso é um mal terrível. E com relação ao banco, o próprio Lula vive se queixando, todos nós nos queixamos. O pessoal pequeno vai lá e não acha ; os papéis  não conferem. Há burocracia. Precisaria haver um Banco do Brasil do povo, e acabar com esse Banco do Brasil.
28/02/2005|Dom Tomás Balduíno|168|Roldão Arruda|O senhor é um socialista? Sua concepção do uso da terra é do socialismo?
28/02/2005|Dom Tomás Balduíno|169|Dom Tomás Balduíno|Sou socialista. Eu acho que é a visão cristã da sociedade. O que é o socialismo? Socialismo não é o socialismo histórico, esse que a gente viu, que caiu e tal.
28/02/2005|Dom Tomás Balduíno|170|Roldão Arruda|O socialismo real.
28/02/2005|Dom Tomás Balduíno|171|Dom Tomás Balduíno|Sim, o  real. O socialismo é um caminho que valoriza a pessoa humana – socios, a sociedade. E o capitalismo valoriza a coisa, a moeda, a política monetarista,  fiscal, o que faz render o capital como capital - e não como instrumento de produção. Isso é o capitalismo.
28/02/2005|Dom Tomás Balduíno|172|Sérgio Lírio|Mas, dom Tomás, não há uma contradição aí? Ao fazer a reforma agrária e ao se distribuir terra, a pessoa que passa a deter a terra, a ser detentor de um pedaço de terra. Ele não tende a se transformar em um conservador ou em o que se chamava de burguês?
28/02/2005|Dom Tomás Balduíno|173|Dom Tomás Balduíno|É um grande risco.
28/02/2005|Dom Tomás Balduíno|174|Sérgio Lírio|Mas isso não é o caminho natural?
28/02/2005|Dom Tomás Balduíno|175|Dom Tomás Balduíno|Não é  pequeno não. Dali a pouco aquele que lutou, que viveu debaixo da lona, que está ali e tal...  Faço um convite a vocês da imprensa para ajudar esse pessoal a não se individualizar e não se julgar um fazendeirinho ou um potencial “fazendeirão”.
28/02/2005|Dom Tomás Balduíno|176|Roldão Arruda|Às vezes eu fico imaginando se não existe dentro do Cimi, da CPT, uma visão meio idealizada. Por exemplo, em relação aos índios,  do bom selvagem, o retorno a uma coisa primitiva, ao uso coletivo da terra. O senhor acha que isso é possível ainda nos dias de hoje?
28/02/2005|Dom Tomás Balduíno|177|Dom Tomás Balduíno|É preciso acompanhar a história dos povos indígenas que estão aí para dizer. Eles caminham com as próprias pernas, pensam com a própria cabeça - aliás, o apoio que a gente deu como CPT aos camponeses e como Cimi aos povos indígenas não foi de se colocar no lugar deles, nem das organizações deles, mas  eles caminharem e lutarem. É o sucesso, é a solução, e é o único caminho que eu acredito válido. Eu desejaria que isso contagiasse toda a “massa” - mesmo essa massa que vê televisão e acha  aquilo  bom -  não tem alternativa. Nós precisamos entrar em um processo educacional de formação que consiga resgatar isso para acontecer como aconteceu na Bolívia, onde o pessoal botou fora a  Vivendi, que tinha privatizado as águas em Cochabamba. Botou para correr - é a força das bases populares dos campesinos.
28/02/2005|Dom Tomás Balduíno|178|Paulo Markun|Dom Tomás, nosso tempo está acabando e a pergunta final é de Zalmur Vida, de Curitiba, no Paraná, para o senhor responder curtinho - e eu sei que o senhor saberá fazê-lo: “Quantos alqueires de terra a Igreja tem no Brasil? Por que ela não distribui suas propriedades para o MST?”
28/02/2005|Dom Tomás Balduíno|179|Dom Tomás Balduíno|A resposta rápida é 650 a 700 mil hectares. Isso foi feito  um levantamento, ajudado pelo IBGE  e pelo Incra. Porque o pessoal jogava isso na  cara: “Faça reforma agrária das suas terras!”. As terras da Igreja têm dioceses que estão aqui desde o Brasil colônia - nasceram com o Brasil. Eu tenho a minha diocese de Goiás - tem mais de 200 anos,  é contemporânea de Mariana, de São Paulo e de Cuiabá. Nós temos um alqueire de terra ocupada com seminário. Essas terras da Igreja - é preciso dizer isso também, porque no levantamento são terras que não são ociosas - são terras de universidades, são terras de seminários, de creches, de serviços de menores, etc. Como era uma assembléia de bispos na qual foi feita a apresentação - foi dom Demétrio que apresentou -, então os bispos se comprometeram: “Bispo que tiver terra disponível para a reforma agrária: não espere que seja pedido. Entregue-a”.
28/02/2005|Dom Tomás Balduíno|180|Paulo Markun|Dom Tomás, muito obrigado pela sua entrevista. Obrigado aos nossos entrevistadores, e a você que está em casa. Nós estaremos de volta segunda-feira, dez e meia da noite com mais um Roda Viva. Uma ótima semana e até segunda.
