DATA|ENTREVISTA|ORDEM|LOCUTOR|FALA
28/02/2005|Dom Tomás Balduíno|1|Paulo Markun|Boa noite. O Roda Viva amplia o debate sobre a questão agrária brasileira - o problema que se arrasta não por décadas, mas por séculos,  está se tornando um desafio cada vez maior. A crise de violência na luta pela posse da terra - que atinge proporções alarmantes no Pará, mas que também é grave em outras regiões do país - expõe governos e deixa claro que a falta de políticas para o campo é uma das componentes desse conflito. Nós retomamos o tema hoje com o representante de um setor que tem participação forte e polêmica na questão. Nosso entrevistado é o bispo dom Tomás Balduíno, bispo emérito de Goiânia e presidente da Comissão Pastoral da Terra , entidade que há quase trinta anos atua na defesa do trabalhar rural.
28/02/2005|Dom Tomás Balduíno|2|[Comentarista]|Goiano, 82 anos de idade, filósofo e teólogo com pós-graduação em antropologia e lingüística, dom Tomás Balduíno foi bispo da cidade de Goiás por 31 anos. Entre 1965 e 1967 cuidou do prelado de Conceição do Araguaia, no Pará, tornando-se ainda mais conhecido por seu trabalho em defesa de índios e de trabalhadores sem-terra. Um dos fundadores da Comissão Pastoral da Terra, em 1975, dom Tomás está na presidência da entidade desde 1999, quando a luta pela posse da terra começou a se intensificar em todo país. O site da CPT na internet conta que a comissão foi criada em plena ditadura militar como resposta à grave situação vivida por índios, posseiros e trabalhadores rurais, especialmente na Amazônia. O vínculo da Comissão com a Conferência Nacional dos Bispos do Brasil ajudou a CPT a realizar e a expandir seu trabalho por quase todo o Brasil. Com o tempo incorporou outras igrejas cristãs e levou agentes pastorais a todas as áreas de conflito no país. Nas duas últimas décadas a Comissão Pastoral da Terra tornou-se a principal fonte de denúncias da crescente violência em torno da luta pela posse da terra no país. Emitiu relatórios, levantamentos, criticou governos por omissão e lentidão na implantação da reforma agrária, acusou a Justiça de parcialidade e cobrou mais atuação dos juízes contra a impunidade. Crítico - mas também alvo de críticas por apoiar o movimento de invasão de terras no país -, dom Tomás tem se colocado no meio da polêmica agrária. No recente episódio do assassinato da freira americana Dorothy Stang em Anapu, no Pará, dom Tomás criticou o governo federal por falta de ação. O bispo, que já havia provocado polêmica ao apontar o agronegócio e o poder judiciário como os responsáveis pela violência, acusou o governo do Pará de estar envolvido com os crimes ocorridos no estado. Os acontecimentos deste mês de fevereiro no Pará levaram a Comissão Pastoral da Terra a divulgar, de novo, um balanço que apontou 161 ameaças de morte no país em 2004 em decorrência de conflitos agrários. Só no Pará chegava a quarenta a lista de pessoas ameaçadas - entre elas, segundo levantamento da Comissão Pastoral da Terra, estava a freira Dorothy Stang.
28/02/2005|Dom Tomás Balduíno|3|Paulo Markun|Para entrevistar dom Tomás Balduíno, que é bispo emérito de Goiás - e não de Goiânia como eu disse -, e também presidente da Comissão Pastoral da Terra, nós convidamos: Gilberto Nascimento, editor especial da revista Isto É; Roldão Arruda, repórter da editoria de política do jornal O Estado de S. Paulo; Francisco Leali, coordenador de  nacional da sucursal de Brasília do jornal O Globo; Sérgio Lírio, editor da revista Carta Capital; Ariovaldo Umbelino de Oliveira, professor titular do Departamento de Geografia da Faculdade de Filosofia, Letras e Ciências Humanas da USP ; e Leonardo Sakamoto, cientista político, jornalista e articulista da agência de notícias Carta Maior. Acompanham a entrevista em nossa platéia aqui no estúdio os seguintes convidados: Jurandir Siridiwê Xavante, presidente do Ideti, Instituto das Tradições Indígenas; Laura Graham, antropóloga da Universidade de Iowa, nos Estados Unidos; Regina Célia Arruda Bonomo, assessora de imprensa do Itesp, Instituto de Terras de São Paulo; Alessandro Octaviani, advogado, pesquisador da escola de direito da Fundação Getúlio Vargas de São Paulo e do Cebrap - Centro Brasileiro de Análise e Planejamento; Gustavo Garde, jornalista e assessor de imprensa do MST, Movimento dos Trabalhadores Rurais Sem-Terra; Nílton Viana, editor-chefe do jornal Brasil de Fato; Edmilson Vitorino de Lima, assessor do Instituto de Terras de São Paulo; Antônio Funari Filho, vice-presidente da Comissão de Justiça e Paz da arquidiocese de São Paulo; Karen Sanches de Moraes, colaboradora do Instituto das Tradições Indígenas; José Carlos Cordeiro, ouvidor do Instituto de Terras de São Paulo; Hipãridi Top´tiro, presidente da Associação Xavante Warã; e Pedro Barros Mercadante Oliva, estudante da faculdade de economia e administração da Universidade de São Paulo.  Boa noite, dom Tomás.
28/02/2005|Dom Tomás Balduíno|4|Dom Tomás Balduíno|Boa noite, Paulo.
28/02/2005|Dom Tomás Balduíno|5|Paulo Markun|Hoje à noite – aliás, hoje à tarde -, o Fogoió , que é a pessoa que assumiu a responsabilidade pela morte da irmã Dorothy, deu um depoimento diante dos senadores e incluiu de alguma maneira o nome do prefeito de Anapu entre os participantes do consórcio que teria sido formado para conseguir os recursos necessários para pagar a morte da irmã Dorothy. Eu queria aproveitar isso para perguntar se o senhor imagina que esse caso está solucionado.
28/02/2005|Dom Tomás Balduíno|6|Dom Tomás Balduíno|Do ponto de vista policial, pode ser - e a gente achava mesmo, isso já declaramos na nota da CPT, por ocasião desse assassinato, que rapidamente se chegaria a elucidar o caso. De fato, menos de duas semanas estão os indiciados. Agora, a questão é que é apenas uma ponta do iceberg, há algo mais grave por trás - que nem Fogoió talvez saiba.
28/02/2005|Dom Tomás Balduíno|7|Paulo Markun|O que é?
28/02/2005|Dom Tomás Balduíno|8|Dom Tomás Balduíno|É o crime organizado. É o pessoal que de longa data no estado do Pará vem grilando a terra, invadindo. Agora a corrida é muito mais forte - ela é “concorrentista” -, de maneira em que vem os crimes  vem a eliminação daqueles que não valorizam talvez a terra como o grileiro quer, que são os pobres - são os detentores daqueles lotes dos quais cuidava a irmã Dorothy. E um crime que envolve, para dizer a verdade, autoridades do governo, a Polícia Civil, a Polícia Militar, por isso mesmo o padre Henri , que está ameaçado de morte, não queria ser escoltado pela polícia militar.
28/02/2005|Dom Tomás Balduíno|9|Paulo Markun|O governo federal mencionou a hipótese de que o assassinato da irmã Dorothy fosse uma reação à ação do governo federal no sentido de titular as terras, de botar ordem naquela região. O senhor concorda com essa interpretação?
28/02/2005|Dom Tomás Balduíno|10|Dom Tomás Balduíno|Concordo, porque toda a ação no sentido de botar ordem na terra - que é uma desordem total, é uma desordem provocada - e, sobretudo, se o governo fizer reforma agrária - porque essas medidas, decretos, isentar áreas, isolar ou fazer com que determinadas áreas sejam consideradas reservas, isso nós consideramos como um paliativo. O pessoal nem reage diante disso, não houve reação nenhuma. O pessoal vai reagir na hora em que o governo fizer reforma agrária para valer naquela região.
28/02/2005|Dom Tomás Balduíno|11|Paulo Markun|O senhor acha que essa hora vai chegar?
28/02/2005|Dom Tomás Balduíno|12|Dom Tomás Balduíno|Eu acho que é a hora, eu acho que a hora chegou. Eu comparo muito esse momento atual ao momento do massacre de Eldorado do Carajás, em que a população brasileira, na proporção de 80% da população, queria reforma agrária. E o que fez Fernando Henrique Cardoso ? Criou o MDA, Ministério do Desenvolvimento Agrário, como uma medida compensatória, tanto que o Jungman  chegou a me dizer: “Eu sou ministro de 19 cadáveres”. E ficou nisso. O Incra  ficou do mesmo tamanho - até mais sucateado. Então não houve reforma agrária, apenas  de acudir incêndios daqui e de acolá, o que nós chamamos  uma reforma agrária compensatória. Lula incorreria no mesmo erro se ficasse nesses pacotes, mesmo criando certa base - como estão criando - para dar sustentação aos pacotes. A reforma agrária é a resposta. E eu acredito que, assim como naquele tempo, no tempo de Eldorado do Carajás, hoje com a morte de Dorothy, com o massacre de Felisburgo , e tantos marcados para morrer, a população brasileira sente isso na pele, está querendo uma solução a fundo. Uma solução constitucional.
28/02/2005|Dom Tomás Balduíno|13|Sérgio Lírio|A solução seria esse projeto - que o governo prometeu no ano passado de cumprir,  que não é nem a metade de um milhão de assentamentos de o que se imaginou que os movimentos ligados à terra tinham pedido - esses 450 mil  que o governo prometeu, e que no ano passado não cumpriu nem a meta do ano? Essa seria a reforma agrária que teria que se fazer no momento? Se fizesse isso, resultaria em quê? Melhoraria a situação  é pouco ainda?
28/02/2005|Dom Tomás Balduíno|14|Dom Tomás Balduíno|Se  fizesse aquilo que foi programado - que é a metade do plano inicial proposto pelo Plínio de Arruda Sampaio  - a pedido do governo reduziram para 450 mil aquilo que era um milhão. Se  fizesse esses 450 mil... O que foi assentado esse ano  ano passado? Quarenta . Pelos cálculos das entidades quarenta mil... 
28/02/2005|Dom Tomás Balduíno|15|Sérgio Lírio|O governo fala em oitenta ...
28/02/2005|Dom Tomás Balduíno|16|Dom Tomás Balduíno|Fala em oitenta,  é a metade. A gente precisaria entender bem . Eu acho que isso já seria um caminho. Nessa semana que passou nós estivemos fazendo uma romaria com o Plínio  com o pessoal do Fórum Nacional pela Reforma Agrária aos três poderes: ao Lula, ao Supremo Tribunal Federal e ao Congresso. No Supremo não fomos recebidos. A diretora se propôs a receber - porque o  Jobim estava viajando  -, mas acabou não recebendo. Ao Lula foi entregue uma proposta - já é a segunda vez, um mês atrás já foi entregue e não houve resposta -, uma proposta simples - devido à intuição do nosso amigo Plínio de Arruda Sampaio - de atualizar os índices de julgamento da produtividade da terra em vista do assentamento. Os índices são de 1975, tem trinta anos de atraso, então o que evoluiu... 
28/02/2005|Dom Tomás Balduíno|17|Roldão Arruda|Dom Tomás, sobre a pressão dos 19 cadáveres de Eldorado do Carajás - a repercussão internacional que teve, a pressão interna que teve -, o governo Fernando Henrique criou um ministério e iniciou um processo de assentamento bastante grande, e inclusive concentrou uma boa parte desses assentamentos no Pará. O próprio Incra constatou que em alguns desses assentamentos na região de Marabá, mais de metade dos lotes foram vendidos de forma irregular, foram repassados para frente. O Greenpeace   o Ibama  constatam que - por exemplo, a gente fala em destruição da Amazônia, da madeira e tal - entre os grandes derrubadores de mata de forma ilegal estão os assentados. Muitos assentamentos estão isolados, sem estrada, sem nenhum modo nem de escoar a produção e nem nada. O que o senhor acha? Que compensa continuar assentando em larga escala para ter esse quadro que ficou do governo Fernando Henrique?
28/02/2005|Dom Tomás Balduíno|18|Dom Tomás Balduíno|A reforma agrária não é só assentamento. Ela inclui a reforma agrícola - que é o acompanhamento técnico, a educação, a infra-estrutura, saúde, escola, etc, e mesmo o ordenamento da área, porque há um empobrecimento total daqueles assentamentos feitos "a toque de caixa". A gente não é por uma reforma agrária desse tipo. A reforma agrária, segundo a Constituição, tem condições para  implantação - senão seria leviano. E não pensem que são esses pobres que mais destroem.
28/02/2005|Dom Tomás Balduíno|19|Leonardo Sakamoto|Aí  que eu iria tocar, dom Tomás. Cerca de 75% da Amazônia que foi desmatada se transformou em pasto, em pastagem e de latifúndio. Muitas vezes esses pecuaristas se aliam com madeireiros - que vão e derrubam a área, vendem a madeira, pegam o dinheiro.  compram gado, colocam a cerca, depois muitos deles “esquentam”  a terra e a vendem mais para frente para sojicultores e cotonicultores - de algodão. O governo falou que vai por um fim às madeireiras fora da lei. Porém, um entrave maior na Amazônia gera uma dúvida: é possível frear o agronegócio fora da lei? Porque de certa forma a carne, algodão e a soja que são plantados nesses locais desmatados têm ajudado a manter a política econômica do governo - a política neoliberal do governo -, gerando divisas para pagar a dívida externa. O senhor acha que o governo vai enfrentar, vai bater de frente com o agronegócio e a bancada ruralista para proteger a Amazônia?
28/02/2005|Dom Tomás Balduíno|20|Dom Tomás Balduíno|Não vai. Essa é justamente a queixa. A maior queixa nossa é que o agronegócio - esse que arrebenta, esse que desertifica, que tem arrasado o cerrado - 90% da soja vem do cerrado com apoio financeiro . O Plano Safra  iria todo para eles, ultimamente é que a gente começou a salvar um pequeno percentual - não chega nem  10% - para a agricultura familiar.
28/02/2005|Dom Tomás Balduíno|21|Paulo Markun|Dom Tomás, eu queria que o senhor esclarecesse melhor - porque eu creio que essa talvez seja, das declarações polêmicas que o senhor costumar dar, esta é a mais polêmica: dizer que o agronegócio é responsável pela violência na terra eu imagino  assusta o sujeito que tenha uma fazenda e produz soja, que produz algodão, seja essa fazenda na Amazônia ou no estado de São Paulo. Eu queria entender o seguinte: é o agronegócio ou é a máfia da terra, o crime organizado? Ou o senhor acha que há um conluio entre as duas coisas?
28/02/2005|Dom Tomás Balduíno|22|Dom Tomás Balduíno|Nós temos estudos da CPT: Caderno de Conflitos - eu até trouxe e posso depois lhe passar um exemplar -, em que é estudado o conflito nas áreas do agronegócio e foi constatado que - isso em estudo do Carlos Walter  - onde floresce o agronegócio, é maior o conflito. A gente não está inventando, não está pichando, é a constatação da realidade. E nessa hora não é o Pará que é o maior conflituoso: é Mato Grosso, é o Centro Oeste, sobra até para São Paulo. Então o agronegócio não é aquele santo que está sendo propalado. A grande imprensa eleva  o mais que pode e, ao mesmo tempo, picha as organizações populares do campo.
28/02/2005|Dom Tomás Balduíno|23|Roldão Arruda|O termo  é muito vasto. Por exemplo,  o pessoal de Chapecó: pequenos produtores que produzem para uma companhia da Sadia, Perdigão, sei lá quem. É agronegócio, aquilo também é agronegócio. Chama-se agronegócio essa cadeia que se forma de negócios e tal. Quando o senhor fala: “O agronegócio é responsável”, o que o senhor está dizendo? O senhor está dizendo  o grande empresário rural, o latifúndio? O que o senhor está definindo nesse caso?
28/02/2005|Dom Tomás Balduíno|24|Dom Tomás Balduíno|Sobretudo o grande empresário rural, porque há um levantamento de dados constatados. No caso do Pará, quem é o agronegócio lá? São as madeireiras...
28/02/2005|Dom Tomás Balduíno|25|[...]|... Pecuária...
28/02/2005|Dom Tomás Balduíno|26|Dom Tomás Balduíno|...Pecuaristas, os fazendeiros. E  reagem de uma forma violenta. Eles não bloquearam a estrada colocando cinco mil bois? E nessa hora  a interligação em todo país: gente que vai daqui para dar apoio lá, a fim de pressionar o governo naquela... 
28/02/2005|Dom Tomás Balduíno|27|Paulo Markun|Dom Tomás, eu vou usar uma expressão que não é muito apropriada em um programa entrevistando um bispo como o senhor. Mas, fazendo o papel do advogado do diabo,  eu gostaria de questionar o seguinte: boa parte desses produtores rurais alega que a violência começa quando o MST invade , quando as organizações populares do campo que o senhor menciona se dispõem inclusive a invadir propriedades produtivas. O senhor já apoiou esse tipo de iniciativa como, por exemplo, a questão da  propriedades de eucalipto no Espírito Santo - ou na Bahia, eu não me recordo agora qual foi o estado...
28/02/2005|Dom Tomás Balduíno|28|[...]|Na Bahia.
28/02/2005|Dom Tomás Balduíno|29|Paulo Markun|Na Bahia, não é? Fazendo isso, como é que o senhor responde a essa idéia de que na verdade o mal está nas organizações populares?
28/02/2005|Dom Tomás Balduíno|30|Dom Tomás Balduíno|Eu acho que essas organizações populares, inclusive o MST, são a salvação para o nosso país. O que seria do nosso país se nós não tivéssemos esses camponeses organizados como estão organizados no campo? Teriam a mesma sorte dos quilombolas, que foram massacrados; dos índios. Agora não : os índios começaram a se organizar, os quilombolas começaram a se organizar. Eu estava contando há pouco a história de um quilombo em Minas Gerais que conseguiu a terra comprando-a, fazendo economia - negro fazendo economia no passado, anos passados, no interior, no século passado. Como eram negros, vieram os fazendeiros, deram em cima com polícias e pistoleiros. E agora esses mesmos negros foram atrás do MST - lá é MLST  - para ocupar aquela terra,  que eles  ajudariam. Eles preferem dividir  com os companheiros camponeses a vê-la usufruída apenas pelos grandes que a tomaram violentamente.
28/02/2005|Dom Tomás Balduíno|31|Paulo Markun|Paulo Afonso, aqui do bairro da Bela Vista de São Paulo, pergunta: “Por que as autoridades brasileiras, mais especificamente do Pará, não tomaram e não tomam medidas preventivas no conflito agrário?” E pergunta: “Quantas mortes mais será preciso para que alguma medida seja tomada?”
28/02/2005|Dom Tomás Balduíno|32|Gilberto Nascimento|Markun, posso complementar sua pergunta? No começo dom Tomás falou que o crime da irmã Dorothy, o assassinato, teve a participação de autoridades. Quem são essas autoridades?
28/02/2005|Dom Tomás Balduíno|33|Dom Tomás Balduíno|Nós sabemos que as autoridades são do legislativo, do judiciário e do executivo - eu não digo no crime especificamente, naquela ação -, no envolvimento nessa situação criminosa, nessa situação que gera violência e que tira partido mesmo da violência. É uma violência contra as pessoas e, sobretudo contra os mais fracos. É sabido, há mesmo nomes de pessoas - não preciso decliná-las - do executivo, do legislativo e do judiciário.
28/02/2005|Dom Tomás Balduíno|34|Francisco Leali|O senhor acha que o governo federal tem alguma parcela de culpa? Semana passada o Stédile do MST  falou que por conta da lentidão do governo Lula a irmã Dorothy morreu. Qual é a parcela de culpa, e como é que o senhor está vendo a atuação do governo Lula? Ele está refém do agronegócio? Está do lado dos movimentos sociais? De que lado que o governo está?
28/02/2005|Dom Tomás Balduíno|35|Dom Tomás Balduíno|A gente tem que reconhecer que o governo Lula é favorável aos movimentos sociais - não reprime, por exemplo. Ajudou a quebrar a espinha dorsal do trabalho escravo com a sua erradicação. Está caminhando satisfatoriamente... 
28/02/2005|Dom Tomás Balduíno|36|Francisco Leali|Mas com que velocidade?
28/02/2005|Dom Tomás Balduíno|37|Dom Tomás Balduíno|É lento, é extremamente lento em fazer a reforma agrária nesse bendito país.
28/02/2005|Dom Tomás Balduíno|38|Sérgio Lírio|Dom Tomás, só uma questão rápida sobre esse ponto. Eu queria que o senhor fizesse uma avaliação: como é que o senhor vê hoje o grau de tensão no campo nesse período do governo Lula? Teve essa morte  - obviamente causa uma comoção -, mas eu queria saber o seguinte: porque, sempre  se anuncia um “abril vermelho” do MST, um “setembro vermelho” - todo mês é vermelho -, é como se houvesse um clima de guerra para acontecer, mas  os movimentos sociais têm apostado ainda no governo Lula. Estão de certa forma domesticados, em relação a períodos de outros governos? Então eu queria saber o seguinte: qual é a situação real hoje do campo nesse período do governo Lula? A tensão está pior? Pode acontecer uma tragédia como ocorreu em Carajás? E, se está pior, por que piorou?
28/02/2005|Dom Tomás Balduíno|39|Dom Tomás Balduíno|A temperatura subiu muito em 2003 - era o começo do governo Lula. A explicação que a gente costuma dar a isso, é  que o pessoal dizia: “Agora é Lula, agora a terra é nossa”. E aí  73 assassinatos naquele ano, porque a UDR  - o pessoal do agronegócio - se armou. Foram muitas prisões, muitos despejos - cerca de 35 mil despejos judiciários,  judiciário –  também prisão pelo judiciário. Ainda mais naquele momento em que havia uma tensão entre o executivo e o judiciário por causa de problemas da Previdência - eu não sei se vocês se lembram.  O pessoal do campo penou. No ano passado arrefeceu um pouco. E a gente esperava que a coisa ia caminhando, quando este ano novamente explode. E aí vem a descoberta do iceberg. 
28/02/2005|Dom Tomás Balduíno|40|Paulo Markun|Eu queria que dom Tomás respondesse a pergunta do Paulo Afonso, que perguntou: “Por que as autoridades não tomam medidas preventivas?”
28/02/2005|Dom Tomás Balduíno|41|Dom Tomás Balduíno| preciso dizer isso: as medidas preventivas seriam as mais eficazes, ao invés de chegar para acalmar os ânimos depois do conflito armado. Mas isso supõe uma política radical de desapropriação da terra e de prioridade à reforma agrária. Talvez seja preciso a gente enfocar mais esse ponto que não tem sido uma prioridade para o governo.
28/02/2005|Dom Tomás Balduíno|42|Paulo Markun|Ariovaldo.
28/02/2005|Dom Tomás Balduíno|43|Ariovaldo Umbelino de Oliveira|Dom Tomás, me parece que no centro daquela questão que envolve os conflitos do campo, particularmente a Amazônia, está no fato de que o Brasil tem 200 milhões de hectares de terras devolutas - ou seja, terras que não estão tituladas e que pela legislação brasileira são terras públicas que pertencem ao Estado. Somente o Incra tem 59 milhões de hectares de terra na Amazônia. Então me parece  há na realidade uma corrida por parte dos empresários - e evidente que eles são os diretamente interessados na questão - na apropriação dessa terra pública existente na Amazônia. Como o senhor vê - nessa corrida que esses grupos e que esses empresários fazem para se apropriar das terras públicas - como ficam os índios? - as populações indígenas que têm tido uma participação no cenário político nos últimos tempos bastante comedida?
28/02/2005|Dom Tomás Balduíno|44|Dom Tomás Balduíno|Completamente desprotegidos. Se há uma coisa falha - eu falo que a reforma agrária é falha no governo Lula - talvez falte vontade de enfrentar uma situação assim, que mexa até com as diversas alianças , isso é confuso. Mas ninguém busca priorizar  índio, ninguém. Se os índios não se organizam, como agora os Xavantes se organizam - foram andando eles mesmos, enfrentando a poeira, enfrentando as ameaças dos fazendeiros da Suiamissu, eles não chegariam lá nunca. Nunca haveria uma decisão: “Essa terra é terra tradicional de vocês, está aqui”. Então  são os mais prejudicados, eu acho. E a questão da demarcação das terras indígenas é uma grande dívida deste governo Lula para com a história dos povos indígenas.
28/02/2005|Dom Tomás Balduíno|45|Roldão Arruda|Dom Tomás, o Conselho Indigenista Missionário, o Cimi - também vinculado à CNBB  - disse que este governo na questão indígena tem sido pior que o governo anterior. O senhor está dizendo que este governo é lento na questão da reforma agrária. Esse governo é um governo  PT . O PT nasceu embalado, em grande parte, pelas comunidades eclesiais de base das quais o senhor sempre fez parte, o senhor sempre apoiou. O senhor está decepcionado com este governo? O PT - que vocês ajudaram a construir - está no poder. O senhor está decepcionado com ele?
28/02/2005|Dom Tomás Balduíno|46|Dom Tomás Balduíno|Com  parte do PT sim. Como a gente vive nas bases, vê o outro lado do PT, que a gente espera que não se corrompa pelo poder. Porque há muita resistência - há alguns que até queriam deixar  -, mas refletindo bem não querem jogar fora vinte, trinta anos de investimentos. Então é uma reserva histórica importante, e que eu reconheço. Agora, o PT que está envolvido com o poder é responsável por tudo isso que nós estamos levantando.
28/02/2005|Dom Tomás Balduíno|47|Gilberto Nascimento|Mas pelo que o senhor está falando, que espera que uma parte não se corrompa, o senhor está dando a entender que uma parte já teria se corrompido. É isso?
28/02/2005|Dom Tomás Balduíno|48|Dom Tomás Balduíno|Sim.
28/02/2005|Dom Tomás Balduíno|49|Gilberto Nascimento|De que forma exatamente?
28/02/2005|Dom Tomás Balduíno|50|Dom Tomás Balduíno|No envolvimento com as diversas alianças que acabam nivelando tudo . Porque nós sabemos, por exemplo, com relação ao Congresso, que há uma decepção muito grande por parte da população, e o pessoal chega a dizer que não há mais diferença entre PT e PMDB , ou outro partido.
28/02/2005|Dom Tomás Balduíno|51|Gilberto Nascimento|E por exemplo que postura o senhor, a igreja progressista, ou esses setores, daqui para frente pretendem adotar diante dessa constatação?
28/02/2005|Dom Tomás Balduíno|52|Dom Tomás Balduíno|A gente tem uma postura radical...
