DATA|ENTREVISTA|ORDEM|LOCUTOR|FALA
28/02/2005|Dom Tomás Balduíno|53|Gilberto Nascimento|
28/02/2005|Dom Tomás Balduíno|54|Dom Tomás Balduíno|Para dizer a verdade, como caminhada de igreja, de comunidades eclesiais de base, a postura radical é de reforçar a sociedade civil. A gente ficou muito dependente do Estado, e  um pouco faz parte da nossa história. “O Estado é tudo”, “O Estado é o chefe”. Isso é um erro tremendo.
28/02/2005|Dom Tomás Balduíno|55|Paulo Markun|Mas não é o Estado que decide o orçamento? Não é o Estado que determina aonde a polícia vai atuar? Não é o Estado que regulamenta, por exemplo, que terra pode invadir e que terra não pode? Defender a sociedade civil tudo bem, mas a pergunta é: há como substituir o Estado?
28/02/2005|Dom Tomás Balduíno|56|Dom Tomás Balduíno|Não se trata de substituir o Estado. Trata-se de não colocar o Estado acima do que ele é.  tem o seu lugar e, sobretudo o Estado tem o seu limite, pois é uma criação da elite.
28/02/2005|Dom Tomás Balduíno|57|Paulo Markun|O senhor é a favor de que as terras produtivas possam ser desapropriadas para fins da reforma agrária?
28/02/2005|Dom Tomás Balduíno|58|Dom Tomás Balduíno|No momento não precisa, mas sou a favor com o tempo. Imagine o Brasil daqui cem anos: toda terra será produtiva, e não haverá possibilidade de desapropriação. Isso já foi publicado sobre o limite da propriedade. Eu seria por uma reforma constitucional ou uma PEC , porque... 
28/02/2005|Dom Tomás Balduíno|59|Paulo Markun|Limitar o tamanho?
28/02/2005|Dom Tomás Balduíno|60|Dom Tomás Balduíno|Eu falo em 35 módulos fiscais, que variam de acordo com a região. Mas é um critério, é o legislador que deve considerar. Na atual legislação, por exemplo, você pode ficar dono do Brasil inteiro sem nenhuma contestação, e isso é uma anomalia terrível.
28/02/2005|Dom Tomás Balduíno|61|[Módulo fiscal é uma unidade de medida expressa em hectares, fixada para cada município, considerando os seguintes fatores|tipo de atividade (e sua renda) predominante no município; renda obtida; outras atividades que sejam significativas em função da renda ou da área utilizada; e o conceito de propriedade familiar]
28/02/2005|Dom Tomás Balduíno|62|Leonardo Sakamoto|Dom Tomás, o senhor falou do legislador, das decisões judiciárias e citou o Congresso. Inocêncio de Oliveira, deputado federal; João Ribeiro, senador da República; temos Jorge Sayad Picciani, presidente da Assembléia Legislativa do Rio de Janeiro - estou citando só três casos -; sem falar do nosso atual presidente da Câmara dos Deputados , que citou em  discurso no ano passado: “Que o combate ao trabalho escravo estava indo mal, de que estava incomodando muitos os fazendeiros, e que deixemos o agronegócio em paz”. O que acontece é o seguinte: esse é o pessoal que de certa forma vai finalmente decidir se vai ser votada ou não, em segundo turno, a proposta de emenda constitucional que prevê a expropriação de terras onde for encontrado trabalho escravo - aquela emenda constitucional do confisco da terra. Como há outras leis também que poderão ajudar no combate ao trabalho escravo. O senhor acredita, com essa bancada ruralista, com essa força da bancada ruralista - acho que até está mais forte agora no governo Lula do que no governo Fernando Henrique -, o senhor acha que uma proposta como essa que ajudaria erradicar o trabalho escravo no Brasil será aprovada? Vale ressaltar que ela está há dez anos tramitando na Câmara?
28/02/2005|Dom Tomás Balduíno|63|Dom Tomás Balduíno|Há dez anos... Eu acho que, pela Câmara ser o que ela é...  - inclusive o Severino Cavalcanti chegou a dizer que essa história de penalizar ou de confiscar a terra tem que ir para o lixo; a PEC é destinada ao lixo. Certamente está interessado também ele em proteger algum trabalho escravo.
28/02/2005|Dom Tomás Balduíno|64|Francisco Leali|Então o Severino, que é um católico praticante, não está entre os aliados da CPT?
28/02/2005|Dom Tomás Balduíno|65|Dom Tomás Balduíno|Não sei qual é o Deus dele. 
28/02/2005|Dom Tomás Balduíno|66|Leonardo Sakamoto|Mas o senhor acredita na aprovação da emenda no Congresso, ou não?
28/02/2005|Dom Tomás Balduíno|67|Dom Tomás Balduíno|Neste Congresso eu não acredito, mas nem por isso , porque o Congresso se renova, e a sociedade toma consciência de que Congresso nós temos. Então essa contradição e essa mútua influência é que talvez gere a mudança com o tempo.
28/02/2005|Dom Tomás Balduíno|68|Paulo Markun|José Luiz Vavassoli, de Paragominas, no Pará, diz o seguinte: “Da forma como o senhor fala parece que todos os camponeses são pessoas de bem”. José Luiz disse: “Eu digo que a maioria não merece um palmo de terra. Coloco a minha fazenda para o senhor visitar: ela foi invadida há nove anos, acabaram com tudo e venderam toda a madeira que lá existia. É o maior crime ambiental. Eu corro...”, diz o José Luiz, “... risco de vida por andar na minha própria terra”. Isso acontece?
28/02/2005|Dom Tomás Balduíno|69|Dom Tomás Balduíno|Acontece. Eu não falei que eles todos são santos, nem quero canonizar o pessoal camponês, nem... 
28/02/2005|Dom Tomás Balduíno|70|Paulo Markun|A recíproca não é verdadeira? - só para continuar insistindo na minha tese aqui - Se todos os camponeses não são santos - e eu imagino que não são -, nem todos os agroindustriais ou agroempresários são bandidos...
28/02/2005|Dom Tomás Balduíno|71|Dom Tomás Balduíno|Não.  nem condeno o agronegócio em si... 
28/02/2005|Dom Tomás Balduíno|72|Paulo Markun|Mas o senhor condenou aqui expressamente. O senhor classificou que o agronegócio é o responsável pela violência no campo; que o agronegócio está casado com a máfia da terra e provocando toda violência. Foi o que o senhor disse.
28/02/2005|Dom Tomás Balduíno|73|Dom Tomás Balduíno|Quero dizer que o agronegócio é contraditório. Ele tem isso, tem isso e eu sustento. Nós todos estamos acompanhando isso de muito perto, mas ao mesmo tempo você não pode condenar o agronegócio como um negócio da terra, sobretudo se ele obedece, por exemplo, o respeito ao meio ambiente –  que não está respeitando em grande parte. A maneira como é levada , o modo como  o agronegócio, a corrida à produção pela produção. E aí entra também o “hidronegócio”, que invade a água - água para irrigação, que é 70% da água; água para as hidrelétricas, que afugentam os moradores dos ribeirinhos... Isso de onde vem? É o agronegócio.
28/02/2005|Dom Tomás Balduíno|74|Roldão Arruda|Dom Tomás, o senhor tem feito muita crítica ao judiciário. Tem dito, por exemplo, que ele é muito ágil na hora de conceder a expulsão dos invasores da terra, e muito lento na hora de julgar as questões de desapropriação para efeito da reforma agrária. Entre outras coisas  o senhor tem criticado, o senhor também disse agora há pouco que  pode estar envolvido com crimes diretamente. O que o senhor acha dessa proposta do ministro Edson Vidigal, do Superior Tribunal de Justiça, de federalizar essa questão dos crimes agrários, do julgamento dessas questões do campo, da desapropriação? O senhor acha que pode ser uma saída ou é uma bobagem?
28/02/2005|Dom Tomás Balduíno|75|Dom Tomás Balduíno|Acho que é uma saída, porque os crimes contra os direitos humanos já vêm de mais tempo. Isso não apareceu agora pela morte da Dorothy. 
28/02/2005|Dom Tomás Balduíno|76|Roldão Arruda|Mas  as varas agrárias federais - para questões agrárias específicas -, o senhor acha que pode ajudar?
28/02/2005|Dom Tomás Balduíno|77|Dom Tomás Balduíno|A gente tem receio das varas agrárias, porque podem ser varas com sentido único, no sentido de punir, por exemplo, o pequeno que demanda a terra, o pobre que procura a terra de viver e trabalhar, e favorecer . Quando você  perguntou  federalização do crime, eu entendi que era o crime contra os direitos humanos... 
28/02/2005|Dom Tomás Balduíno|78|Roldão Arruda|Não, desculpe-me. Eu acho que me expressei mal, eu queria  desses conflitos agrários, dessa questão agrária.
28/02/2005|Dom Tomás Balduíno|79|Dom Tomás Balduíno|É a criação de varas agrárias... 
28/02/2005|Dom Tomás Balduíno|80|Roldão Arruda|Porque, por exemplo, há uma acusação, um raciocínio do MST de que os juízes locais às vezes são tão envolvidos com fazendeiros, com grandes proprietários rurais, que eles sempre vão dar ganho de causa para eles. Essa idéia de criar uma justiça um pouco mais distante poderia ser favorável?
28/02/2005|Dom Tomás Balduíno|81|Dom Tomás Balduíno|Sempre ajuda, mas a vara agrária é localizada.
28/02/2005|Dom Tomás Balduíno|82|Roldão Arruda|Hoje ?
28/02/2005|Dom Tomás Balduíno|83|Dom Tomás Balduíno|E mesmo a criação de varas especializadas em problemáticas agrárias são localizadas... 
28/02/2005|Dom Tomás Balduíno|84|[...]|O senhor acha que devia ser como?
28/02/2005|Dom Tomás Balduíno|85|Dom Tomás Balduíno|... E o receio que a gente tem é daquele juiz ter um posicionamento mais dirigido contra a reforma agrária.
28/02/2005|Dom Tomás Balduíno|86|Roldão Arruda|O senhor acha que os juízes não entenderam até hoje a questão do sentido social da terra? Acham que a propriedade é o direito supremo?
28/02/2005|Dom Tomás Balduíno|87|Dom Tomás Balduíno|Essa é a grande questão, porque  é recente - apareceu mais fortemente na Constituição de 1988. Não deu para todo esse pessoal assimilar a função social da propriedade, que são exigências constitucionais.
28/02/2005|Dom Tomás Balduíno|88|Paulo Markun|Dom Tomás, pergunta de Maria Lúcia Penteado Aranha, tradutora, que mora em Florianópolis. Ela pergunta o seguinte: “Os soldados que foram mortos e sofreram agressões em Pernambuco não merecem o mesmo respeito e atenção quanto à barbárie da morte da missionária Dorothy Stang?” 
28/02/2005|Dom Tomás Balduíno|89|Dom Tomás Balduíno|Merecem sim, cabe a quem de direito apelar. Quando a gente trabalha no campo - nós trabalhamos como CPT a serviço do pessoal do campo, dos pobres da terra - e eles precisam desse apoio, um apoio samaritano -, não se escandalizem quando a gente luta pelos direitos desses pobres. Não quer dizer que os outros não tenham também seus direitos e mereçam seus protetores. Isso não infirma  a missão profética da CPT...
28/02/2005|Dom Tomás Balduíno|90|Paulo Markun|Quantos agentes a CPT tem?
28/02/2005|Dom Tomás Balduíno|91|Dom Tomás Balduíno|Digamos uns 400, 500 - a grande maioria  voluntários em todo o país.
28/02/2005|Dom Tomás Balduíno|92|Paulo Markun|E como que é a comunicação? A gente, que é leigo, desconhece às vezes como é que funciona.
28/02/2005|Dom Tomás Balduíno|93|Dom Tomás Balduíno|A CPT tem uma sede, que é em Goiânia. É em Goiânia por causa do dom Fernando Gomes dos Santos - o arcebispo já falecido - que apoiou muito esses momentos: apoiou a pastoral indigenista, o Cimi nasceu também ali.  um lugar sagrado para a CPT, marcado pela presença profética daquele homem. E há 21, 22 regionais espalhadas em todo o país - todo o país coberto com a presença da CPT. Nas dioceses chama-se CPT diocesana. Congregando as diversas CPTs há uma regional - apenas um órgão articulador.
28/02/2005|Dom Tomás Balduíno|94|Gilberto Nascimento|Dom Tomás, o senhor sempre foi um dos principais expoentes da igreja progressista no Brasil, um dos ícones da chamada Teologia da Libertação . Mas o Vaticano nos últimos anos veio progressivamente substituindo os bispos mais da esquerda - mais progressistas - por bispos conservadores. Aqui em São Paulo, por exemplo, se dividiu a arquidiocese de São Paulo: tirou-se o poder do dom Paulo Evaristo Arns , foram removidos os bispos mais progressistas, e também não se ouviu falar mais da Teologia da Libertação - Leonardo Boff  saiu da Igreja, e tal. A Teologia da Libertação acabou, não existe mais, não deu certo, ela só teve força e hegemonia durante um período? O que foi exatamente que aconteceu?
28/02/2005|Dom Tomás Balduíno|95|Dom Tomás Balduíno|Você está querendo me comprometer? 
28/02/2005|Dom Tomás Balduíno|96|Gilberto Nascimento|Não, só estou fazendo uma pergunta.
28/02/2005|Dom Tomás Balduíno|97|Paulo Markun| está só perguntando.
28/02/2005|Dom Tomás Balduíno|98|Dom Tomás Balduíno|Na realidade houve mesmo  - nesse papado de João Paulo II - esse refluxo daquilo que o  Vaticano II tinha aberto, proposto como: povo de Deus, colegialidade, reforço às igrejas particulares, às comunidades eclesiais de base. Foi pouco a pouco desaparecendo, hoje não se fala mais em povo de Deus, fala-se mais na hierarquia, no reforço do poder eclesiástico, clerical - masculino de preferência -, e ortodoxo. De maneira que a teologia foi muito visada, rodeada de críticas da própria Sé apostólica, da cúria romana, e as comunidades  um pouco deixadas , houve desconfiança ... Esse ano nós vamos ter um décimo encontro intereclesial das comunidades eclesiais de base em Minas. Vai ser um momento em que o pessoal vai clamar por um lugar, um espaço na Igreja - que foi tomada por movimentos eclesiásticos... 
28/02/2005|Dom Tomás Balduíno|99|Gilberto Nascimento|... Carismáticos , inclusive. Houve todo um reforço, um apoio do Vaticano para os movimentos... 
28/02/2005|Dom Tomás Balduíno|100|Roldão Arruda|Dom Tomás, o senhor não acha que esse refluxo da Igreja não deixou alguns órfãos? Por exemplo, eu acho que a Dorothy é uma órfã da Teologia da Libertação no seguinte sentido: ela faz parte daquele momento da Igreja dos anos 1960, 1970 quando a Igreja se abriu para os pobres, fez a sua opção preferencial. Um monte de freiras que trabalhavam na educação de famílias ricas deixou esse trabalho  foram trabalhar para os pobres. Nós temos gente na periferia... 
28/02/2005|Dom Tomás Balduíno|101|Dom Tomás Balduíno|Inclusive para os índios.
28/02/2005|Dom Tomás Balduíno|102|Roldão Arruda|... aqui de São Paulo, trabalhando com os sem-terras pelo Brasil inteiro. Há freiras na idade da Dorothy,  muitas se julgam órfãs da Teologia da Libertação. Elas foram atiradas em uma direção, a Igreja refluiu em outra direção, e elas ficaram lá - algumas onde o bispo nem paga o aluguel de suas casas,  isso agora é outro . “Ou vocês voltam ou nós não temos mais relação”.
28/02/2005|Dom Tomás Balduíno|103|Dom Tomás Balduíno|Não sei se órfãs da teologia, ou órfãs da própria estrutura eclesiástica. Por que  da teologia? Teologia é a reflexão que esses bispos engajados nessa luta pela justiça e pela paz em todo o mundo, sobretudo aqui na América Latina em que a Igreja se abriu. Ao se abrir para o nosso mundo, encontrou o mundo de baixo: o mundo dos índios, dos negros, dos sem-terra. E  foi a eles, com opção preferencial evangélica pelos pobres. Então a Teologia  é justamente a maneira de sistematizar isso de uma forma científica, a partir do dado da fé, do dado da revelação bíblica. É isso que é a Teologia, de maneira de a Dorothy não estava órfã. Ela mesma fazia a sua Teologia da Libertação.
28/02/2005|Dom Tomás Balduíno|104|Sérgio Lírio|O senhor acha que esse movimento conservador é um erro para a própria existência da Igreja? Isso vai influir no futuro da Igreja Católica - que, ao fazer esse movimento achou que talvez conseguisse recuperar um pouco da sua freqüência?
28/02/2005|Dom Tomás Balduíno|105|Dom Tomás Balduíno|Eu creio que é um movimento pendular. É como o pêndulo, uma hora ele está à direita, e outra hora ele está à esquerda... 
28/02/2005|Dom Tomás Balduíno|106|Roldão Arruda|Então o próximo papa vai ser progressista? Depois desse movimento pendular ,  o pêndulo lá , nós tivemos um Papa mais conservador...
28/02/2005|Dom Tomás Balduíno|107|Dom Tomás Balduíno|Você não pense que o pêndulo demore só alguns aninhos... 
28/02/2005|Dom Tomás Balduíno|108|Roldão Arruda|Ele pode ir mais para lá. 
28/02/2005|Dom Tomás Balduíno|109|Dom Tomás Balduíno|Pode ser, pode ser mais demorado,  depois  desprende e vem para cá .
28/02/2005|Dom Tomás Balduíno|110|Ariovaldo Umbelino de Oliveira|Dom Tomás, eu queria voltar à questão das terras indígenas e às questões que envolvem as questões indígenas no governo Lula. Nós sabemos que há uma terra indígena dos Xavantes na  Suriamissu e que os posseiros até agora não foram retirados da terra indígena - terra que o grupo multinacional Agip entregou aos índios. Portanto, se trata de uma coincidência histórica: é a primeira propriedade privada de um povo indígena, já que essa terra tinha passado pelo Estatuto da Propriedade Privada. Na questão da terra indígena do Baú, no Pará, a pressão que ocorreu por parte dos madeireiros levou os índios a aceitarem diminuir a demarcação das terras na reserva do Baú. Em Roraima, a  Raposa continua parada, e o agronegócio está lá a pressionar o governo para não permitir que as terras indígenas sejam demarcadas. Da mesma forma é o agronegócio que pressiona a pecuária de corte, que pressiona os Xavantes a não permitir que eles recuperem as terras na Suiramissu. Os Xavantes não podem ampliar suas terras, e precisam ampliá-las, porque se tornaram ilhas no meio da produção de soja no Mato Grosso. Qual é a sua posição a respeito da política indígena no governo Lula?
28/02/2005|Dom Tomás Balduíno|111|Dom Tomás Balduíno|No caso específico da Suriamissu você fala que há ocupantes lá. Há também pequenos , além de grandes fazendeiros - porque ali foi a terra do  Ometto. Qual é a posição da CPT? Porque a CPT se ocuparia daqueles posseiros pequenos - é o nosso universo. A gente tem um entendimento com o Cimi em pressionar o governo, Funai  e Incra, no sentido de atender aos dois , sem nenhuma contemplação pelos grandes fazendeiros. Mas  ter outra terra  os pequenos - que precisam da terra para sobreviver. O Incra é que não pode , porque aquela terra é deles  - ali estão enterrados os seus avós, os seus ancestrais. Aliás, foi  o motivo da jornada deles , porque os velhos falaram: “Nós queremos ser enterrados na terra dos nossos antepassados”. Então não pode uma área indígena ser negociada assim,  jogada aqui e lá,  a parte sertaneja pode .
28/02/2005|Dom Tomás Balduíno|112|Francisco Leali|O senhor acha que o governo Lula tem vontade de fazer isso? Semana passada o Cimi soltou uma nota em que vai até além do discurso do senhor. Ele não chama o Lula de lento. Lendo a expressão : “O Lula deixou de lado o discurso enganoso de aliado da causa indígena”. É isso mesmo? E para a questão agrária ele  só é lento?
28/02/2005|Dom Tomás Balduíno|113|Dom Tomás Balduíno|O pessoal do Cimi tem críticas severas ao governo Lula. Eu acredito que deve haver uma amarração muito forte, porque do ponto de vista de intenção, ele seria favorável a ajudar os povos indígenas.  caso de Raposa  do Sol quem está amarrando nem é o Lula, é o Supremo .
28/02/2005|Dom Tomás Balduíno|114|Francisco Leali|Mas é ele quem tem de assinar lá o decreto.
28/02/2005|Dom Tomás Balduíno|115|Dom Tomás Balduíno|Ali  está líquido e certo, mas o Supremo aceitou uma liminar jogada pelo agronegócio - com o perdão d a palavra  -, e está amarrando a Raposa  do Sol. Vai depender de o Supremo compreender que aquilo ali está solucionado!
28/02/2005|Dom Tomás Balduíno|116|Francisco Leali|Mas antes dessas liminares o governo já poderia ter assinado esse decreto. Aí vieram as liminares, e o governo: “Há a decisão da justiça, então vamos esperar a justiça”.
28/02/2005|Dom Tomás Balduíno|117|Dom Tomás Balduíno|Houve perda de tempo, não digo de prazo, mas de tempo útil.  questão política.
28/02/2005|Dom Tomás Balduíno|118|Francisco Leali|Mais uma vez são as alianças do Lula?
28/02/2005|Dom Tomás Balduíno|119|Dom Tomás Balduíno|Não há dúvida. Nós julgamos assim até que provem o contrário.
28/02/2005|Dom Tomás Balduíno|120|Leonardo Sakamoto|Dom Tomás, uma pergunta. Existem – o senhor falou do setor da imprensa no início da sua exposição - existem muitos fazendeiros de grandes extensões de terras nessa região que o senhor está falando - nesse eixo Norte e Nordeste -, que por acaso também são donos de rádios, concessões de televisão, jornais, sites e todos os meios de veículos de comunicação possíveis. Como é que os movimentos sociais podem enfrentar e conseguir alguma coisa junto à opinião pública dessa região em um contexto como esse? É um fato que você pode checar. Por exemplo,  você pegar o estado de Roraima, ou mesmo o sul do Pará, boa parte da população é a favor do agronegócio, é até a favor de expulsar as aldeias indígenas. Como fazer essa batalha, se o pessoal detém os instrumentos?
28/02/2005|Dom Tomás Balduíno|121|Dom Tomás Balduíno|É um processo contraditório mesmo. Na medida em que você se aproxima da área indígena, muitas vezes a reação da população não é favorável. Essa é a minha experiência - trabalhei muito tempo, fui presidente do Conselho Indigenista -, tentando fazer negociações e acordos. É muito difícil, sobretudo quando os meios de comunicação vão instilando a ojeriza  os preconceitos contra os povos indígenas, chamando-os de violentos, de traiçoeiros, de perigosos, de tudo, quando na realidade Darcy Ribeiro  fez um estudo mostrando que certos grupos indígenas estavam desenvolvendo técnicas de amansar o branco.  Eles achavam que o bicho branco era muito bravo, esquisito, e  desenvolvendo técnicas para poder amansá-los. Eles , que são chamados de bravos.
28/02/2005|Dom Tomás Balduíno|122|Roldão Arruda|O senhor não acha que existe um contexto muito mais complicado do que parece? Por exemplo, às vezes no Mato Grosso o que está se tentando é expulsar um sujeito que era filho de um camponês no Rio Grande do Sul cuja terra não dava mais para a família inteira. Ele migra e vai para uma  terra. De repente se descobre que aquela terra era uma terra indígena. E ele fica revoltado mesmo: “Porque eu já fiz um grande trabalho”. Lá na região da madeira, o pessoal que muitas vezes toma o partido do grileiro, do latifundiário, é um sujeito que já está migrando pelo Brasil inteiro, e descobriu que lá ele ganha um salário razoável de 800 reais para derrubar a madeira. E ele já rodou metade do Brasil, ou seja, está se tentando...  O senhor está defendendo um grupo, mas o outro grupo também já está meio que no limite dele. O senhor não acha que existe uma tensão social muito maior do que parece?
28/02/2005|Dom Tomás Balduíno|123|Dom Tomás Balduíno|Mas qual é o grupo mais frágil? Tomemos o caso da aldeia indígena: saindo dali eles não têm mais para onde ir. O jeito é ir  a favela - como acontece na Amazônia. A favela de Manaus tem povos indígenas. Ou então, no caso de Campo Grande, onde os índios Guarani-caiowá estão confinados em quintais.
28/02/2005|Dom Tomás Balduíno|124|Paulo Markun| os  Pankararu aqui , na favela do Real Parque.
28/02/2005|Dom Tomás Balduíno|125|Dom Tomás Balduíno| não podem ser desenraizados dali e passados para outra terra.  esse tal que está precisando de trabalho - cidadão nosso - é pessoa que as autoridades devem levar em conta. Como dizia Jesus: “Isso convém fazer, e aquilo não omitir”.
28/02/2005|Dom Tomás Balduíno|126|Paulo Markun|Dom Tomás, mas não há nesse caso só uma diferença? No fundo o que difere é a etnia: o fato de ser índio de o fato de não ser índio - que seria a essência da questão.
28/02/2005|Dom Tomás Balduíno|127|Dom Tomás Balduíno|Não, porque eles  são ligados à terra de uma maneira diferente, muito mais profundamente do que qualquer sertanejo - mesmo sertanejo nascido naquele chão. A gente sabe que  tem uma ligação . Por exemplo, eu falo do pessoal do semi-árido, da minha terra, nas cercanias de Posses - onde eu nasci. É terra seca, que vem em regime de chuva difícil. O Incra chegou lá e falou para os assentados: “Vocês não querem mudar daqui para outra área? Há outra área lá no centro-oeste”. “Não, essa aqui é a melhor terra para nós”. Imagine então a condição dos povos indígenas, imagine um Carajá, cujo mito de origem é ligado ao próprio  Araguaia. Agora vão transformar o Araguaia em uma hidrovia para favorecer o tal do agronegócio , para transportar soja - que vai para alimentar o gado do europeu ou do japonês, e tiram o índio dali. É uma violência estrutural, uma violência inaceitável, e fere direitos internacionais.
28/02/2005|Dom Tomás Balduíno|128|Paulo Markun|Dom Tomás,  a pergunta de Alexandre Pires, que é de Pernambuco e é biólogo.  quer saber qual é a visão da Comissão Pastoral da Terra em relação à transposição das águas do rio São Francisco - já que um dos argumentos do governo é que isso ajudaria na reforma agrária no Nordeste.
