DATA|ENTREVISTA|ORDEM|LOCUTOR|FALA
13/06/2005|Jorge Viana|151|Jorge Viana|Se não mudar, nós vamos continuar os casos Roberto Jefferson. Mais do que “mensalão”, é um problema de financiamento de campanha. É, provavelmente, dívida que tem, reclamando que acordos que teriam sido feitos antes da eleição não foram cumpridos. Então, aí vem e faz um “denuncião” desses.
13/06/2005|Jorge Viana|152|Alexandre Machado|Governador, dentro dessa discussão, tempos atrás nós fizemos um plebiscito, entre presidencialismo e parlamentarismo. Não seria a hora de começar a reconversar sobre o parlamentarismo, aquele embate, já, uma série de correções nesses problemas? Inclusive, com a proposta do voto distrital misto, que poderia recolocar a questão da proporcionalidade do voto, criar regras mais precisas para evitar o troca-troca de partidário, ou seja, não está no parlamentarismo um pouco da resposta dessa confusão toda?
13/06/2005|Jorge Viana|153|Jorge Viana|Eu queria dizer – eu falava com o Tião, com o meu irmão senador, ele está preocupado com isso –, primeiro, que uma mexida grande nisso – o Fernando Rodriguez tem razão –, ela vai demorar. Mas ela pode ser pautada agora, estabelecer prazos, se pactuar isso para valer. Já, já é outubro, e aí você não pode mudar as regras dentro do período eleitoral. Você não pode fazer isso. Mas você pode preparar o país, porque se tivéssemos feito isso há dez anos ou há vinte anos, a situação era outra, hoje. Não foi feito. O Tião mesmo, com o Marco Maciel, como senador, eles estão trabalhando numa proposta de mexer no regimento interno do Senado e da Câmara, na qual fica valendo a composição partidária, a representação partidária, do dia da posse. Uma decisão dessas, de mexer no regimento, pode entrar em vigor imediatamente, e já nessa eleição, agora. Isso já muda, já colabora muito para não ter o troca-troca partidário.
13/06/2005|Jorge Viana|154|Paulo Markun|Só para explicar, governador, ou seja, o partido não pode mudar de partido porque o partido “xis” vai ter tantos...
13/06/2005|Jorge Viana|155|Jorge Viana|Ele até pode mudar, porque aí, o regimento não pode impedir. Mas para a composição das comissões, para a representatividade, não muda. E aí, fica inviável a mudança. Você vai querer mudar para quê? Então, são medidas que eu diria até razoavelmente simples e a gente pergunta: “por que não se adotou isso?”. Então aí, estão se juntando um senador do PT, que é o Tião Viana, com um ex-vice-presidente, o Marco Maciel, que é um estudioso do assunto. O Congresso tem propostas. O que eu acho que teria que fazer é o seguinte: quais delas são possíveis de implantação a curto prazo? Agora, essa coisa que você colocou, do parlamentarismo, no Brasil, tem uma dubiedade. Porque nós estamos num regime presidencialista, que aparentemente tem toda uma força, mas em tudo depende do Congresso, aí vêm as medidas provisórias ... no fundo, era melhor ter resolvido isso, porque nós temos uma espécie de parlamentarismo sem primeiro ministro.
13/06/2005|Jorge Viana|156|Paulo Markun|É porque fizeram a constituição parlamentarista, achando que o parlamentarismo ia passar, e aí...
13/06/2005|Jorge Viana|157|Jorge Viana|Eu acho que nós temos, na prática, um parlamentarismo sem primeiro ministro. Aí o presidente Lula fica lá – ele que anda esse país, que tem acumulado um sonho de mudança –, num impasse danado: “tudo depende”. E aí, isso às vezes, incomoda muito.
13/06/2005|Jorge Viana|158|Oswaldo Buarim|O senhor não acha que faltou ao presidente, também nesse tempo, partir mais para esse corpo a corpo institucional, com os partidos políticos, impor limites aos aliados...?
13/06/2005|Jorge Viana|159|Helena Chagas [interrompendo]|Ele não subestimou a política? O que muita gente diz é que o presidente Lula é um grande líder de massas, tem grande empatia com a população, mas que ele não gosta da política parlamentar. É até um direito dele, mas que aí, o governo nessa linha subestimou um pouco a negociação parlamentar, a política parlamentar. A articulação, ele deixou “solto” demais.
13/06/2005|Jorge Viana|160|Jorge Viana|Eu falei outro dia, numa entrevista, mais ou menos isso. Eu falei que nós estamos gastando pouco tempo com a política, e as conseqüências são essas. Então, acho que do presidente ao governo em si, nós não podemos querer que a política fique na mão de uma coordenação política. Ou mesmo numa Casa Civil. Isso não funciona para um Congresso com essa pluralidade que tem hoje. Dentro de um partido, você tem várias possibilidades. Então, tinha que ser mais o governo trabalhando a política, porque não funciona coordenador nenhum. O meu partido estava errado quando estava querendo de volta a coordenação política, na minha opinião, do Aldo Rebelo. O Aldo é uma grande figura, está trabalhando, mas não dá conta. Não se trata de trocar o Aldo por outro. É que nós teríamos que mudar, inclusive, a agenda do presidente, construir mais, agora nós. O presidente sempre fez coisas com muita paixão. Ele está muito animado em governar. Quem chega perto dele, quem sabe, está animado, acredita e sabe que os resultados vão ser bons. Mas quando a gente vê a política que a gente tem hoje, essa nossa política tem que melhorar. Não é senso comum de reclamar. Sabe, a política é uma coisa bonita. Quando ela é feita com paixão, com ética. Mas a nossa política está necessitando de uma grande reforma. O Estado também. Mas mais a política.
13/06/2005|Jorge Viana|161|Paulo Markun|O senhor enfrentou, lá no Acre, um momento difícil que foi o período em que o crime organizado estava, inclusive, ameaçando sua vida. Como é que o senhor saiu dessa e dá para tirar algum tipo de lição daquela experiência para essa história de crise? Até porque, essa história de “crise é oportunidade” é uma frase que tem tudo a ver com o fato de que em japonês, ou em chinês, os ideogramas são iguais, não sei. Em português, não soa muito igual.
13/06/2005|Jorge Viana|162|Jorge Viana|Mas quando a gente põe o tempo, soa bem. Graças a Deus, nós superamos coisas difíceis no Acre, mas tivemos que ter tempo. Eu não tenho dúvida de que o presidente Lula também vai superar essas dificuldades, mas se a gente tiver um tempo. O problema é o que fazer agora. Quando a gente não tem tempo, e esse tempo ainda não passou. Lá no Acre, graças a Deus, nós saímos da página policial, em que a gente estava metido há muitos anos, para a página de opinião. Agora se discute, se debate a diminuição do desmatamento, do crescimento da economia florestal, os indicadores econômicos do governo mudaram muito, graças a Deus. Assim, a gente, eu fico vendo um estado grande, Minas Gerais apareceu assim: “déficit zero em Minas Gerais”; mas nós conseguimos isso no primeiro ano! Aí, no Rio de Janeiro, falaram assim: “daqui a dois anos, não haverá presos em delegacias”; nós estamos há quatro anos sem presos em delegacias. Nós somos um estado pobre e pagamos o melhor salário para professor do Brasil. Pagamos o melhor salário de policial do Brasil, e é um estado que não tem maiores posses. Mas se organizou, planejou e está executando o planejado. E aí eu pergunto: como é que a gente paga 1400 reais para um professor inicial, e um estado como o Rio de Janeiro, como São Paulo, que está há tanto tempo no mesmo partido, como o PSDB, governando há tanto tempo, não paga um salário igual ao que o Acre paga? Isso é uma coisa que não dá! Então, que mudança pode vir, se educação não for prioridade? Se a gente não fizer? Então, lá no Acre, você tinha assim, como tradição, seis meses de salário atrasado. Eu fui prefeito quatro anos, estou no governo há sete, nunca paguei ninguém no dia primeiro. Paga-se antes. Porque você tem que honrar o funcionário público. Ele é sua equipe. Agora, isso tudo só foi possível porque também nós, lá, conseguimos nos preparar para governar. O próprio presidente Lula foi que me ajudou na minha formação. Mandou-me para fazer alguns cursos. Eu ganhei bolsa do PT, eu fiz cota, tudo, curso de planejamento. Governar não cai do céu! E eu acho de baixíssima responsabilidade um sistema de governo no nosso continente, aqui na América do Sul. Eu tive um professor que foi ministro do Allende , ele dizia que isso é uma loucura. São formas de governo de baixa responsabilidade, os gabinetes são frágeis. Ele fala sempre da teoria de triângulo de governo , tem que ter um projeto para governar, seja o que for. Você tem que ter capacidade de governo, e tem que ter governabilidade. Eu acredito que nós temos um projeto.
13/06/2005|Jorge Viana|163|Fernando Rodriguez|O pessoal do Palácio  não fez esse curso lá, com o senhor? 
13/06/2005|Jorge Viana|164|Jorge Viana|Não  ... muitas pessoas... porque eu aprendi dentro do PT, foi lá que eu tive a oportunidade! Mas eu acho que há alguns companheiros nossos que não dão muita importância para o planejamento. E, sinceramente, como é que você vai governar...
13/06/2005|Jorge Viana|165|Fernando Rodriguez|O presidente Lula não está vendo isso? Ele não mandou o senhor, lá, fazer esses cursos, ele não estava vendo isso aí, dois anos e meio de governo já, governador?
13/06/2005|Jorge Viana|166|Jorge Viana|Tanto sabe que o presidente Lula é um exemplo. O que é que o Lula fez quando estava fora do governo? Ele montou grupos, ele chamou os melhores especialistas, ele reunia equipes técnicas de várias áreas e montava "projetinhos", lá. De educação, de várias áreas. O presidente Lula fez o dever de casa. Mas nós temos, agora, uma dificuldade para que o nosso governo...
13/06/2005|Jorge Viana|167|Fernando Rodriguez|Demitiu o Cristovam Buarque , disse que o Cristovam Buarque, eu li numa entrevista do Gabeira, só foi recebido uma vez pelo Lula.
13/06/2005|Jorge Viana|168|Jorge Viana|Não, mas o Cristovam, eu fui um torcedor para ele ser ministro da Educação. Era o sonho dele.
13/06/2005|Jorge Viana|169|Fernando Rodriguez|“Ministro da Educação foi recebido só uma vez durante um ano” . Recebeu uma vez! Está certo que são 36 ministros, não dá para receber toda hora, mas o ministro da Educação deveria ser prioridade, não é?
13/06/2005|Jorge Viana|170|Jorge Viana|Não, mas o Gabeira está, agora, naquela “parte dele”, que eu pensei que ele já tinha largado. Eu prefiro o Gabeira meu amigo e companheiro, o da causa ambiental e da causa humana, que não é das páginas amarelas da Veja . Mas o ministro Cristovam é um grande quadro, eu acho que aí tivemos um problema, mesmo, o que eu acho que não foi uma boa solução, porque na área da Educação, acho que nós estamos ainda devendo. Nós do PT, o nosso governo, estamos devendo. Aliás, os tucanos  – eu tenho que ser justo –, eles criaram uma estabilidade, lá, criaram alguns programas que foram importantes. Eu convivi como prefeito, como governador. Não posso escamotear isso. Meu vice-governador é secretário de Educação desde a prefeitura, o Binho . E ele sente isso. E se ele sente, eu também sinto, a gente dialoga muito. Agora, eu não tenho nenhuma dúvida, o presidente Lula, também, em breve, deve ter grandes mudanças na educação. Uma das revoluções que nós vamos fazer, eu acho que é a criação do Fundeb , que deve estar na agenda do país nos próximos dias. É esse tipo de governo, esse tipo de proposta, que eu acho que o país está esperando. Que realmente mudam agora e constroem um país diferente no futuro, como quer o Lula, e todos nós esperamos.
13/06/2005|Jorge Viana|171|Maurício Stycer|Governador, o senhor não quis falar, aí, dos seus planos para 2005 ainda...
13/06/2005|Jorge Viana|172|Jorge Viana|Para 2006? 
13/06/2005|Jorge Viana|173|Maurício Stycer|Para 2005. O senhor não quis falar, mas o senhor poderia falar dos seus planos para 2006, então?
13/06/2005|Jorge Viana|174|Jorge Viana|Eu só não quero me aposentar. Porque eu, assim, a gente está fazendo uma coisa muito boa lá no Acre, eu estou muito animado, as pessoas falam até: “parece que você está começando o governo agora”. Mas é que as coisas deram certo. A gente está tendo uma boa ajuda do governo federal. Para vocês terem uma idéia, ninguém fala muito, o repasse para os estados e municípios, que é feito pela União, outro dia, eu reclamei com o ministro Palocci, lá no Palácio do Planalto, eu chego e digo: “ministro, esse número aqui – porque eu acompanho cada número do estado–, esse número aqui está errado, está demais”. Existe um repasse no mês de junho, um fundo, os recursos que são recolhidos pelo Fundo de Participação do Estado , que era grande no mês de junho, que é sempre um mês de baixa. Mas esse ano, agora, está 16% maior o repasse para os estados e municípios que o mesmo período no ano passado. Isso é dinheiro federal, é resultado do governo do presidente Lula, que está chegando nos municípios e nos estados. Então, eu estou animado.
13/06/2005|Jorge Viana|175|Paulo Markun|Governador, queria agradecer sua entrevista, desejar boa sorte e que esse ânimo persista, e nós estaremos aqui na próxima segunda feira, dez e meia da noite, com mais um Roda Viva. Uma ótima semana e até segunda!
