DATA|ENTREVISTA|ORDEM|LOCUTOR|FALA
13/06/2005|Jorge Viana|92|[VT com Aloísio Mercadante]|Se tiver alguém envolvido, será terminantemente punido, como a lei estabelece. E se não houver, o deputado Roberto Jefferson terá que prestar contas sobre as suas afirmações. 
13/06/2005|Jorge Viana|93|[VT com Severino Cavalcanti]|Isso é uma ignomínia. Naturalmente, o deputado Jefferson, como está nesse desespero, ele está jogando pedra em todos os setores.
13/06/2005|Jorge Viana|94|[VT com Valdemar Costa Neto]|Não é justo que um chantagista acuse o partido dessa maneira.
13/06/2005|Jorge Viana|95|[VT com Geraldo Alckmin]|Eu acho que tudo isso deve ser apurado com serenidade, com isenção, na busca da verdade, da justiça, e todos nós aguardamos a palavra do presidente Lula. Certamente, ele vai dar as devidas explicações. 
13/06/2005|Jorge Viana|96|[VT com José Serra]|A entrevista revela fatos graves, que devem ser rigorosamente investigados. Agora, eu acho que a oposição deve atuar nesse episódio com responsabilidade. 
13/06/2005|Jorge Viana|97|[Paulo Markun em off]|No Palácio do Planalto, depois de várias reuniões entre o presidente da República e ministros, veio a primeira reação do governo. O presidente Lula tomou os cargos de toda a diretoria dos Correios e também do IRB, o Instituto de Resseguros do Brasil. Todos indicados pelo Partido Trabalhista Brasileiro, de Roberto Jefferson. A segunda reação veio depois, durante a participação do presidente no Fórum Global de Combate à Corrupção, que acontecia em Brasília.
13/06/2005|Jorge Viana|98|[VT com o presidente Lula]|Digo que cortaremos na própria carne, se necessário. Sem pré-julgar ninguém. E respeitando o direito a defender-se que todo cidadão ou cidadã possui, não vamos vacilar um segundo na defesa do interesse da coisa pública.
13/06/2005|Jorge Viana|99|Paulo Markun|Governador, o senhor já imaginou se o PT estivesse na oposição? E esse escândalo fosse com o outro governo?
13/06/2005|Jorge Viana|100|Jorge Viana|Eu falei outro dia que o PSDB e outros partidos não têm o direito de atuar como nós atuamos em algum momento. Porque eu falei ainda há pouco, aqui no programa, que nós éramos bons na política ou éramos tidos como muito bons na política, mas para fazer oposição. E acho que a realidade de ser governo nos ensinou muito, me ensinou no Acre, está ensinando a todos nós, agora, no governo federal. E, aliás, eu queria dizer que eu, particularmente, acho que a oposição tem cumprido um papel importante. Primeiro, o de ser a oposição, que é de cobrar, de exigir. Mas tem tido responsabilidade. E nós, que ficamos um pouco atordoados no começo, eu acho que o presidente do partido, hoje, inclusive, acho que nós estamos acertando o tom de como enfrentar esse assunto. É obvio que nós demoramos um pouco. E criou esse ambiente, até, de uma certa dúvida. Mas eu acho que aqui fica claro. Não dá para ter dúvidas sobre a postura do PT. Eu falei ainda há pouco. Foi com o PT que a gente aprendeu a combater, como essência para ação política, a corrupção. Então, o PT não vai conviver – não convive e não vai conviver – com a corrupção. E a gente acredita que agora tem uma crise que é uma oportunidade, também, que nós temos, de melhorar o nosso governo. Mas, essencialmente, sair melhor como país do que entramos nessa crise.
13/06/2005|Jorge Viana|101|Maurício Stycer|Governador, queria retomar a sua tese em relação ao esgotamento desse modelo – vamos chamar assim do “presidencialismo à brasileira” – e desse modelo que o governo está adotando. O senhor falou brevemente em alianças pontuais, temáticas. Mas como é possível governar assim, com esse ministério que está aí?
13/06/2005|Jorge Viana|102|Jorge Viana|Olha, eu acho que é. Eu acho que a gente pode governar com esse governo que está aí, mas eu não tenho dúvidas de que o presidente Lula vai fazer a tão esperada mexida no governo, e vai fazer por necessidade do próprio período que ele já viveu. Ele viveu dois anos e meio. Ele, com certeza, sabe o que está funcionando. Quem conhece bem ele e aquilo que ele pensa, acha que ele não está andando bem. Não é por conta da crise. Todo mundo tem cobrado do presidente Lula mudanças, desde o período pós-eleitoral, e de algum jeito, até, eu fico aliviado, porque eu digo: “olha, ainda bem que ele não fez, senão teria que estar fazendo mais uma outra”. Ou alguém ia dizer que é por causa da crise. Mas quem conhece o presidente Lula sabe que ele está determinado a fazer uma mexida para concluir essa etapa do governo dele. E eu acredito que se ele fizer essa mexida, se estabelecer uma nova agenda para o país, se fugir dessa armadilha de ficar preso àquelas emergências do dia-a-dia...
13/06/2005|Jorge Viana|103|Maurício Stycer|O que é essa “mexida”, governador? Que mexida? O que ele teria que fazer? Demitir ministros? Trocar ministros?
13/06/2005|Jorge Viana|104|Jorge Viana|Não, diante do que está acontecendo, eu acho que tem que tomar atitudes.
13/06/2005|Jorge Viana|105|Maurício Stycer|Trocar ministros?
13/06/2005|Jorge Viana|106|Jorge Viana|Pode ser trocar ministros, pode ser mexer em cargos comissionados, criar novos critérios. Uma crise é uma oportunidade também de se sair melhor. Eu não tenho dúvida disso. Quando eu falo assim, dessa agenda da Praça dos Três Poderes , eu acho que nós estamos vivendo assim, uma agenda de emergências. Surge lá e vai tratando. Mas aquilo nem sempre é importante. No primeiro ano, acho que nós fizemos uma coisa muito interessante: o presidente Lula, o nosso governo, estabeleceu uma agenda com governadores, com prefeitos, com o Congresso, e a coisa andava. Nós tínhamos votos do PSDB, tínhamos voto do PFL e da base aliada. No segundo ano, isso ficou embaçado pela eleição. E no terceiro ano, nós não encontramos o ponto ainda.
13/06/2005|Jorge Viana|107|Oswaldo Boarim|O que o senhor acha que sai errado na política, governador? Na relação com os partidos, por exemplo, o senhor é favorável à partilha do poder no estilo “porteira fechada” do ministério, ou isso que está acontecendo, agora, que o Roberto Jefferson fala que “o PT fica com a cabeça e loteia embaixo”?
13/06/2005|Jorge Viana|108|Jorge Viana|Eu sou um aliancista, estabeleci alianças amplas no Acre, com onze partidos, e eu acho que os partidos que estão na aliança têm de se ver no governo. Agora, a maneira deles se verem no governo... eu acho que é um equívoco que vem desde lá de trás, com essa história de porteira fechada. Os secretários do meu governo, fui eu quem convidou. Eu conversei com os partidos, discuti, inclusive, nomes dos partidos; mas eu convidei. E não chegar lá e dizer: “olha, vocês se reúnam aí, decidam quem vai ser o ministro de tal área, ou secretário de tal área”. Isso é um erro. Porque você vai fazer um governo dentro do outro governo – quando isso dá certo! –, e quando isso não dá certo, eu tenho falado também que nós estamos sofrendo uma espécie de "peemedebização"  dos partidos. Que você tem várias correntes dentro do partido que não têm um interlocutor. Mais: os líderes dos partidos estão bastante fragilizados, hoje, no Congresso. Você não tem mais um espaço onde as lideranças decidem a própria agenda; você tem uma reunião com 50 pessoas decidindo como vai ser a pauta de votação da câmara. Isso não é bom. Isso não é força. Ao contrário, bom é quando tem líder que tem autoridade de falar. Então, eu não acredito nesse modelo.
13/06/2005|Jorge Viana|109|Mauro Vítor|Por falar em Câmara, por favor, nós estamos vivendo um momento sensível da vida nacional, não é? E o Parlamento, quer queira, quer não, está maculado. Nós sabemos, aí – e se admite – que talvez 100 parlamentares funcionam, aí, à base do “mensalão”. Outros dizem outros números, mas a verdade é que se questiona a legitimidade desse Parlamento. Nós temos, agora, no Parlamento, a discussão de um projeto importantíssimo que diz respeito a nossa área florestal, que é o PL da gestão de florestas públicas , que entrega as florestas nacionais para a exploração de terceiros. Pois bem, é um projeto que eu sei que o senhor é a favor, não é? É um projeto que já passou pelos continentes de Ásia, África, por onde ele passou, ele apenas destruiu a natureza, aviltou o homem, não produziu riqueza, produziu corrupção e tudo mais. E isso é uma triste trajetória que existe e é um fato. Bom, esse projeto está há alguns meses na Câmara e recebeu 300 emendas. Então, veja bem, é um projeto polêmico, um projeto complicado, há pessoas que dizem que vulnerabiliza o nosso território, atenta contra a soberania nacional e tudo mais. Por uma questão de decoro, de prudência, de ética, não seria bom o governo recuar e, até, que o governo e o Parlamento fossem, vamos dizer, saneados, não seria bom que saísse de pauta momentaneamente? Por que um Congresso votar uma matéria dessa magnitude – eu sei que o senhor é a favor desse PL, não é? –, mas me parece que não é de bom tom. Por uma questão de ética, de moral, de prudência, mesmo, não caberia aguardar um pouco até que esse Congresso fosse saneado?
13/06/2005|Jorge Viana|110|Jorge Viana|Eu acho que não. Porque senão, a tese que eu estou defendendo, de temas importantes para que o Congresso, independentemente de partido, mais por aquele tema atender um interesse nacional, ser a agenda do nosso povo, ser discutido. Eu acho que não. Esse ongresso que está aí é o nosso Congresso. Foi eleito pelo voto livre do nosso povo, com as influências do dinheiro, com as ingerências que, obviamente, acontecem. É que o nosso país está ainda num processo muito novo, de consolidação desse regime democrático. E hoje, está em cheque a essência do nosso regime democrático, que é a representação. Eu acho, inclusive, antes de votar no PL, que nesse assunto do Roberto Jefferson vai terminar sendo discutido financiamento de campanha. Porque eu acho que vão pular do “mensalão” para o que, quando ele fala, fala “lá atrás”. E eu acho que deve estar tendo muita confusão entre possibilidade de se pagar uma mesada versus dinheiro de campanha para financiar a eleição de 2004. Mas indo para...
13/06/2005|Jorge Viana|111|Fernando Rodriguez|Antes fosse só isso.
13/06/2005|Jorge Viana|112|Jorge Viana|Bom, eu estou te falando que deve chegar nisso . Indo para a idéia do PL, primeiro, o senhor é uma autoridade no assunto , mas eu queria dizer que a experiência que nós estamos tentando fazer no Acre é uma experiência exitosa de tentar sair de uma situação de “ou preserva a floresta toda ou tira a floresta toda”. Nós fomos construir uma alternativa. Esse PL, com toda a sinceridade, ele não reproduz o que aconteceu na Ásia. Ele é uma possibilidade concreta da gente não ter a Amazônia privatizada, porque chegaram a dizer que iria privatizar. Ao contrário. Passam a ser as florestas, públicas, como nós estamos criando no Acre. Nós criamos a primeira floresta pública no Acre em 87. É uma experiência nova. Esse projeto está inspirado, um pouco, no que nós estamos fazendo. Então, eu acredito nele porque também nós vamos deixar de fazer unidades de conservação ou unidades de preservação lá nos rincões, na fronteira. A idéia da ministra – está escrito como propósito – é trabalhar na 163 , é trabalhar ao longo das rodovias, próximo dos centros urbanos. E eu queria dizer que tem uma coisa muito bonita nesse PL, por ser polêmico, e assim que é bom. Nós tivemos debate em cada estado. Teve, lá no Acre, gente que rasgou a proposta. Mas a grande maioria das pessoas, dos seringueiros, dos índios, dos extrativistas, apoiou a proposta. Então, eu acredito, do jeito que ele foi debatido e discutido, e tendo a ministra Marina à frente, que nós vamos ter até, quem sabe, um exemplo. Agora, não impede – não impede, com toda a sinceridade – da gente pôr um problema: a estrutura de controle, fiscalização, nossa, de comando e controle, ela é muito deficitária. E aí é um ponto que cabe a gente ver. Porque se o Ministério do Meio Ambiente continuar ficando na vala comum, com corte orçamentário todo ano, sendo tratado como “mais um ministério”, quanto custa a repercussão negativa para o nosso país lá no Independent, que é um dos grandes jornais do mundo? Quanto custa? E aquilo não é invenção, é verdade!
13/06/2005|Jorge Viana|113|Oswaldo Boarim|Em 2003, o presidente Lula anunciou um bilhão para os governadores da Amazônia, da região Norte.
13/06/2005|Jorge Viana|114|Jorge Viana|Um bilhão...
13/06/2005|Jorge Viana|115|Oswaldo Boarim|Você diz que o ministro da Fazenda nunca foi lá.
13/06/2005|Jorge Viana|116|Jorge Viana|Que dinheiro foi esse? Me fale mais dele!
13/06/2005|Jorge Viana|117|Oswaldo Boarim|Um bilhão do BNDES . Em 2003, em uma reunião que ele fez com vários governadores do norte. Eram duzentos e tantos milhões, imediatamente, e um bilhão. O ministro não foi. E o dinheiro? Chegou lá?
13/06/2005|Jorge Viana|118|Jorge Viana|Não, mas aí eu teria que entender melhor que...
13/06/2005|Jorge Viana|119|Oswaldo Boarim|Naquela série de reuniões que o presidente fez no início do mandato, com governadores, houve uma reunião com governadores da região Norte. E o presidente anunciou investimentos na região Norte, no valor de um bilhão. Esse investimento chegou lá?
13/06/2005|Jorge Viana|120|Jorge Viana|Olha, os investimentos que estão acontecendo na Amazônia, de fato, estão muito significativos. Para você ter uma idéia, o Banco da Amazônia, que antes era chamado de Baza, emprestava algo como 600 milhões por ano. Agora, está emprestando dois bilhões. Isso, aplicando os recursos no Fundo Constitucional  do Norte. Por exemplo, nós temos programas, no caso do governo do Acre, junto com o BNDES. Acabei de assinar um contrato, agora, na semana passada. Nós estamos pegando um financiamento para desenvolver programas sustentáveis. Porque nós acreditamos que é um bom negócio o manejo da floresta, o uso dos recursos. Aliás, para a gente poder sair de uma coisa louca, que é você ter miséria numa das regiões mais ricas do planeta! Quem anda na Amazônia – eu até falava com um amigo que está aqui no programa, ainda há pouco – que o presidente anda muito no Brasil. Anda muito, vai aos lugares, pena que agora, como presidente, tem uma formalidade. Mas o nosso governo precisa andar mais. Para ver esse choque todo. Mas eu diria que os investimentos, hoje, na Amazônia, são muito grandes. O presidente Lula está implantando, por exemplo, o gasoduto de Coari-Manaus , o presidente Lula prorrogou o período da Zona Franca de Manaus , que é uma atividade que não traz desmatamento. Foi o presidente Lula que fez isso, e nós temos quase 100 mil empregos lá.
13/06/2005|Jorge Viana|121|Oswaldo Boarim|O gasoduto para Porto Velho e para Rio Branco está parado .
13/06/2005|Jorge Viana|122|Jorge Viana|Não, esse não saiu. Nós estamos discutindo, agora, a hidroelétrica do Madeira , e nós queremos também que se encerre um ciclo, onde Brasília decidia grandes investimentos na Amazônia, os governadores não participavam, os prefeitos e a sociedade não participavam. Eu não aceito, eu já falei que sou contra, a princípio, discutir hidrovia do Madeira se nós não tivermos uma participação para poder sentar com a visão e – inclusive, se possível, se for ter o negócio –, a gente ter participação nisso. As populações locais. Porque vão usar um recurso que é da nossa região, que é do nosso povo, dos 20 milhões de brasileiros que vivem na Amazônia, e a gente não participa. Como é que se faz a extração que se faz no Pará? E as populações de lá participam como? Você está pegando matéria-prima, exportando, tem um incentivo à exportação, não arrecada nem ICMS , e você tem a violência como resultado no Pará, a grilagem de terras como resultado no Pará, e uma grande riqueza nossa indo embora, fazendo uma reprodução do que acontece em Minas Gerais há 500 anos. Pegar matéria-prima e mandar para atender o mundo. Isso não é política adequada para o país.
13/06/2005|Jorge Viana|123|Helena Chagas|Posso voltar um pouquinho para trás? O senhor falou tanto aí no ex-presidente Fernando Henrique Cardoso, que inclusive o senhor tinha um relacionamento ótimo com ele quando o senhor era governador no governo dele, também no seu primeiro mandato. O que o senhor está pensando do comportamento do Fernando Henrique na oposição? Como é que o senhor vê uma certa agressividade?
13/06/2005|Jorge Viana|124|Jorge Viana|Primeiro, eu tenho que ser justo. O presidente Fernando Henrique é, para mim, um grande brasileiro. Ele foi muito correto comigo, e eu fiz uma inauguração com ele 20 dias antes dele entregar o mandato. É um governo do PT fazendo isso, e eu primeiro liguei para o presidente Lula, e o presidente Lula me estimulou que fizesse. Aliás, sempre teve esse caminho. O que eu acho... outro dia, eu fiquei animado quando o Arthur Virgílio  – parece que numa conversa com o senador  Mercadante –, estava apresentando ou recolocando na agenda do país uma idéia de como criar uma condição para que os ex-presidentes participem da vida pública. Eu acho que uma figura como o presidente Fernando Henrique não pode estar cumprindo um papel de ficar discutindo o “peru bêbado” ou coisa parecida. Isso é papel de militante. Uma figura como ele, que tem uma experiência de oito anos governando o Brasil, que superou três grandes crises – a gente mesmo acusou de ele ser o causador da crise –, mas o certo é que ele conseguiu e tem um acúmulo, uma história, uma biografia que é muito importante, da qual o Brasil não pode abrir mão. O que eu tenho defendido é que uma figura como ele tem que ser uma voz da experiência, uma voz da razão, porque agora, ele já está livre da militância partidária...
13/06/2005|Jorge Viana|125|Maurício Stycer|Não a voz de um candidato, não é?
13/06/2005|Jorge Viana|126|Jorge Viana|Não. A voz de um militante! Porque como candidato... às vezes, é meio militante. Ele sempre foi um provocador, ele é um gozador, uma pessoa interessante.
13/06/2005|Jorge Viana|127|Maurício Stycer|O senhor é a favor de um mandato vitalício de senador?
13/06/2005|Jorge Viana|128|Jorge Viana|É, aquela tese, por exemplo, acho que poderia ser mais bem discutida. Mas trazer – em vez de deportar o presidente Itamar lá para Itália –, traz ele e põe no Congresso, para ficar junto com a gente, como senador. Fica melhor.
13/06/2005|Jorge Viana|129|Paulo Markun|Nós vamos fazer mais um rápido intervalo no Roda Viva, que tem esta noite, aqui na platéia, também o fotógrafo Pedro Martinelli, Adilson Gomes, coordenador ambiental e Beto Ricardo, diretor executivo do ISA, Instituto Sócioambiental.
13/06/2005|Jorge Viana|130|[intervalo]|intervalo]
13/06/2005|Jorge Viana|131|[Paulo Markun em off]|Os jornais expostos nas ruas já se tornaram um painel quase permanente dos escândalos e denúncias que têm agitado a vida nacional e indignado muita gente, como agora: “Absurdo, estou revoltadíssima” / “Está demais a corrupção, nunca vai acabar, né?” / “Se a lei fosse mais pesada, acho que não haveria tanta falcatrua por aí, certo?” . As análises sobre os escândalos no país, em geral, apontam a impunidade como fator principal que estimula a corrupção. Mas há quem considere que o problema também está nas falhas do nosso próprio sistema político.
13/06/2005|Jorge Viana|132|[VT com Fernando Abrúcio, cientista político]|A primeira é o excessivo número de cargos em comissão. Nós precisaríamos, mais, profissionalizar a burocracia brasileira. A segunda brecha é o troca-troca partidário, quer dizer: isso transforma a relação entre o executivo-legislativo, em boa medida, numa grande chantagem. A terceira brecha, que também é bastante importante, é a fragilidade dos órgãos de controle, sobretudo, o Tribunal de Contas da União. E a quarta brecha é a lentidão do judiciário.
13/06/2005|Jorge Viana|133|[Paulo Markun em off]|As mudanças que poderiam vir com uma reforma política e com o aperfeiçoamento administrativo dependem do mesmo congresso que, hoje, se debate em meio à crise e aos conflitos de interesses. Mas na opinião do historiador Carlos Guilherme Motta, do Instituto de Estudos Avançados da USP, também depende do próprio presidente da República.
13/06/2005|Jorge Viana|134|[VT com Carlos G.Motta, cientista político]|Em primeiro lugar: a presidência tem que negociar menos. Não negociar mais. Que o presidente instigue, coloque, equacione melhor e pressione até mesmo o Congresso naqueles setores que se consideram os “setores podres”.
13/06/2005|Jorge Viana|135|[VT com Fernando Abrúcio]|Se não fizermos nada, no próximo governo, a novela que estamos vendo com o PT será vista com outro partido.
13/06/2005|Jorge Viana|136|Paulo Markun|Governador, mas dá para pressionar o Congresso? Dá para ter presidente dizendo: “olha, Cngresso, é assim que vocês vão fazer”?
13/06/2005|Jorge Viana|137|Jorge Viana|Eu acho que o presidente deverá tomar essa iniciativa de dialogar, não diria só com o Congresso, mas com os que representam as instituições, hoje, do nosso país, e propor uma agenda, que possa dar algumas respostas. O que foi colocado aqui, aliás – eu queria fazer só um reparo –, a gente vê hoje a discussão sobre a reforma política, você vê que são os cientistas políticos, isto tem um lado muito bom, que fazem nos canais de televisão, essa semana foi em todo o canto, mas você não tem os políticos fazendo isso. Existe uma certa carência de excepcionalidade de quadros no nosso Congresso. Mas isso não é proibitivo de nós fazermos. Nós não temos um ministro Jobim , lá, que agora está como presidente do Supremo, que é um expert em assuntos como esse, tão importante. O presidente Lula pode fazer essa junção de congressistas com representantes de instituições e estabelecer uma pauta. Eu acho que ele vai fazer isso, porque o momento requer atitudes. Se a gente continuar com essa coisa que estamos tendo, de troca-troca de partido, que é uma vergonha isso...
13/06/2005|Jorge Viana|138|Fernando Rodriguez|Mas o PT ajudou a insuflar...
13/06/2005|Jorge Viana|139|Jorge Viana|Pois é, mas o PT errou nisso. Nós podíamos ter apresentado uma proposta no começo do governo do presidente Lula, dizendo o seguinte: a reforma política é fundamental.
13/06/2005|Jorge Viana|140|Fernando Rodriguez|Por que o presidente Lula não fez isso?
13/06/2005|Jorge Viana|141|Jorge Viana|Eu acho que porque ele achou que dava um jeito de encontrar uma maneira de conviver com essa situação. Os aliados disponíveis se colocaram imediatamente contra isso.
13/06/2005|Jorge Viana|142|Fernando Rodriguez|Mas agora, a proposta que o presidente defende – a única efetivamente que ele defendeu e mandou seus interlocutores dizerem para a imprensa – é que ele, agora, é a favor do fim da verticalização , esse, um item da reforma política. O que para muitas pessoas é até um retrocesso. O senhor concorda com isso?
13/06/2005|Jorge Viana|143|Jorge Viana|Pois é, mas eu acho que esse assunto da verticalização, ele estava até bem antes, mas agora, eu acho que mudou todo o quadro. Eu não tenho nenhuma dúvida de que não tem jeito de não discutir financiamento de campanha, não tem jeito de não discutir, por exemplo, nomeações entre pessoas de carreira.
13/06/2005|Jorge Viana|144|Fernando Rodriguez|Governador, sobre os financiamentos de campanha serem quase 850 milhões de reais por ano – abstraindo o fato de que, em tese, no mundo ideal, seria bom que o dinheiro fosse público, que não fosse esse regateado por debaixo do pano –, o senhor acha que há clima para a população brasileira aceitar 850 milhões de reais para os políticos fazerem campanha?
13/06/2005|Jorge Viana|145|Jorge Viana|Eu não diria para os políticos fazerem campanha, mas eu diria para o nosso país ter representação. Agora, qualquer coisa é melhor que o sistema que nós temos hoje. Com toda a sinceridade. Eu queria só, assim, não tem sentido nenhum...
13/06/2005|Jorge Viana|146|Fernando Rodriguez|O senhor teria coragem de defender em público 850 milhões de reais a mais para gastar nas campanhas dos políticos e dos partidos em ano eleitoral?
13/06/2005|Jorge Viana|147|Jorge Viana|Olha, Fernando Rodriguez, tem uma coisa que eu acho que o nosso país lamentavelmente está vivendo: a gente está vivendo uma grande hipocrisia, quando trata desse assunto. Porque o país gasta muito mais do que isso nas campanhas. Qualquer uma delas.
13/06/2005|Jorge Viana|148|Fernando Rodriguez|O senhor acha que gastaria menos, daí?
13/06/2005|Jorge Viana|149|Jorge Viana|Eu acho que gastaria menos, porque nós fizemos a reeleição, e eu diria, na parte da fiscalização – eu fui candidato à reeleição – “mas o que é que mudou? O que é que se ampliou quando você aprovou a reeleição?”. Não se ampliou nada. Aliás, nem inelegibilidade foi mudada. Você criou a reeleição, mas não mudou o controle, não mudou a fiscalização, não há transparência nas eleições.
13/06/2005|Jorge Viana|150|Fernando Rodriguez|Mas não vai mudar, também. Vai continuar a haver o caixa dois . Vai haver um dinheiro a mais...
