DATA|ENTREVISTA|ORDEM|LOCUTOR|FALA
13/06/2005|Jorge Viana|39|[Paulo Markun em off durante exibição de imagens]|Jorge Viana já foi prefeito de Rio Branco, e governa o Acre desde 99. Uma de suas primeiras ações, com o apoio do governo federal, foi fechar o cerco contra o crime organizado no Acre. As operações com a Polícia Federal resultaram, entre outras, na prisão do ex-deputado federal Hildebrando Pascoal e quase uma centena de pessoas ligadas ao narcotráfico e a grupos de extermínio. O governador recebeu três ameaças de morte, que atribuiu ao crime organizado no estado. Petista de carteirinha, Jorge Viana construiu uma forte ligação com o presidente Lula, de quem é amigo pessoal e confidente. Por isso tem acompanhado de perto a crise criada a partir da denúncia do esquema de corrupção nos Correios. Maurício Marinho, indicado pelo presidente do PTB , deputado Roberto Jefferson , para o cargo de administrador de material dos Correios, foi flagrado em vídeo recebendo suposta propina. Marinho explicou que eles eram três, “trabalhando fechado”. E que os três eram designados pelo PTB, pelo Roberto Jefferson. O deputado, que em troca de apoio ao governo havia indicado vários nomes para cargos de direção em estatais, se defendeu na Câmara, negando envolvimento no escândalo. O caso cresceu, e Jefferson começou a atirar. Denunciou na Folha de S.Paulo que o PT pagava mesada de 30 mil reais a deputados do PP  e do PL , em troca de apoio no Congresso. E que o “mensalão” era entregue pelo tesoureiro do PT, Delúbio Soares. Roberto Jefferson disse ter revelado o caso no ano passado aos ministros José Dirceu, da Casa Civil, e Antônio Palocci, da Fazenda, e que o esquema só parou depois que o deputado do PTB contou ao presidente Lula, que segundo Jefferson, teria chorado ao saber da história. A denúncia criou clima de crise política com troca de acusações e uma turbulenta discussão em torno da CPI dos Correios, que acabou sendo criada, mas ainda não decolou por falta de acordo sobre quem comandará a comissão.
13/06/2005|Jorge Viana|40|Paulo Markun|Governador, hoje, da tribuna do Senado, o irmão do senhor  defendeu a idéia de que os ministros do PT, e aliás todos os cargos de comissão, deveriam entregar seus cargos para que o presidente Lula ficasse à vontade para virar o jogo. Como é que o senhor encara essa proposta?
13/06/2005|Jorge Viana|41|Jorge Viana|Eu acho que depois desse episódio nas duas últimas semanas, todos em Brasília estão meio atordoados. Com toda a sinceridade. Não é para menos, porque você tem uma pessoa que tem seis mandatos, que estabeleceu relações – eu acho que as únicas leais que ele manteve até agora foram com o ex-presidente Collor –, viveu esse período todo da República e hoje saiu de uma situação de acusado, vira acusador, e ameaça, todo dia, fazer novas acusações. Isso criou um ambiente muito difícil. E termina que eu acho que o que o Tião está sugerindo é – independentemente da assertiva da tese dele –, facilitar um pouco para o presidente. Mas se eu conheço bem o presidente – independentemente de qualquer facilidade ou não –, eu acho que ele está bem determinado a promover as mexidas que forem necessárias, seja no governo, ou tomar as medidas necessárias para conduzir esse assunto com a firmeza necessária. Agora, problema é oportunidade. Como é que você fica? Você vai tomar uma atitude hoje; amanhã, surge uma outra informação, como essa, de dizer que o PT paga “mensalão”. Eu, particularmente, queria rebater isso. Sem nenhuma dúvida, eu acho que tem que ficar claro: o PT não paga “mensalão”. O Partido dos Trabalhadores está vivendo uma fase difícil, que eu acho que é mudar, é uma fase nova daqui para frente, pelo fato de ser governo. Pelo fato de ter uma denúncia com essa gravidade, que não tem que ficar dando volta, tem que assumir: tem uma denúncia contra o PT, que afeta o governo. Em vez de ficar jogando, põe essa denúncia de frente e começa a tratar esse negócio.
13/06/2005|Jorge Viana|42|Helena Chagas|O senhor não acha que os ministros citados deveriam se afastar do governo, pelo menos temporariamente, até que as investigações fossem concluídas, como algumas pessoas no seu próprio partido defendem?
13/06/2005|Jorge Viana|43|Jorge Viana|Olha, eu acho assim, nós já tivemos casos assim, que foram exemplares. Vou pegar um caso do presidente Itamar, que foi muito interessante. O chefe da Casa Civil, o ministro Hargreaves , teve uma denúncia, se afastou, depois voltou. Inclusive, foi para Minas Gerais, continua a vida pública normalmente. Mas eu acho que aí depende da denúncia, depende da situação, das circunstâncias. Eu acho que é um recurso que pode ser usado. Pode ser usado e até deve ser usado em alguns momentos. Agora, nós estamos vivendo uma situação que é diferente. Você tem um fato concreto, que é a corrupção dentro dos Correios, que para mim se configurava até como um caso de polícia. Eu não sei por que esse cidadão ainda não está preso. Fato concreto: por que ele não está preso? Recebeu dinheiro, estava dentro do órgão público: como é que fica isso? Ou então, está pedindo emprestado? Se era corrupção e tem quatro presos, eu não sei porque...
13/06/2005|Jorge Viana|44|Helena Chagas|O senhor está dizendo que o governo está ineficaz, então, nesse caso?
13/06/2005|Jorge Viana|45|Jorge Viana|Eu não sei quem está ineficaz.
13/06/2005|Jorge Viana|46|Helena Chagas|Só pode ser o governo.
13/06/2005|Jorge Viana|47|Jorge Viana|Não é o governo. O governo não prende.
13/06/2005|Jorge Viana|48|Helena Chagas|A Polícia Federal obedece às ordens do ministro da Justiça.
13/06/2005|Jorge Viana|49|Jorge Viana|A Polícia Federal. Mas aí, os órgãos de segurança deles atuam normalmente para prender fora de flagrante, com a ação da Justiça. Eu não conheço de perto o processo a quantas anda. Eu só estranho isso. Para mim, esse cidadão poderia estar preso. Aí, depois, em cima disso, vem uma denúncia do presidente do PTB - como eu falei ainda pouco, que não é qualquer pessoa –, ele vem e faz uma denúncia...
13/06/2005|Jorge Viana|50|Helena Chagas|Exatamente. O presidente do PTB era da base petista e recebido e chamado de “parceiro” pelo presidente da República. No momento em que uma pessoa dessas faz uma denúncia dessas, qual foi o problema: o presidente escolheu errado seus parceiros?
13/06/2005|Jorge Viana|51|Jorge Viana|Eu não sei...
13/06/2005|Jorge Viana|52|Alexandre Machado|O senhor é partidário da tese das “más companhias” ?
13/06/2005|Jorge Viana|53|Jorge Viana|Não. Eu não acho que é tão simples assim. Tem um modelo que está em funcionamento no país, que começou com o presidente Sarney , depois passou para o presidente Itamar, e ficou mais visível no governo do presidente Fernando Henrique , que era de estabelecer uma governabilidade ou uma maioria estável a partir de alianças com partidos, que levavam ministérios. Eu falei isso para o presidente Fernando Henrique, que sempre foi uma pessoa que me teve atenção, e por quem eu sempre tive muito carinho, e respeito. E o governo dele até trabalhou muito bem comigo, eu tenho que agradecer. Eu falava para ele: “presidente, esse negócio não funciona. Porque o ministério passa a ser do partido e aí, depois, quando o primeiro problema surgir, a pessoa vai procurar o partido, não vai procurar o senhor”. Esse negócio não funciona. Houve um período em que o presidente Fernando Henrique teve que pedir quase uma renúncia coletiva de todos, para reassumir o comando de tudo. E quando funciona, quando esse sistema funciona, de dividir ministérios para cada partido, levam-se ou escolhem quem ocupa. Ainda é pior: quando ele dá certo, fica governo dentro de governo. Quer dizer, cada ministério vira um governo à parte, que vai um para cada lado. Quando não funciona, como está sendo o nosso caso, você tem uma crise, na qual ninguém se sente contemplado. Eu queria concluir, dizendo o seguinte: eu acho que se esgotou esse modelo. Esse modelo de fazer, construir maioria estável, dessa maneira. Eu acho que é uma bela oportunidade que nós do PT temos, sem ter que ficar chutando quem é aliado. Dentro do PTB há figuras: o ministro Mares Guia  é uma figura que todo mundo quer ter. Dentro do PTB tem um monte de gente, dentro do PL – está aí o nosso vice-presidente –. Mas sim construir, talvez, uma agenda para o país, fazer alianças pontuais, porque nas reformas que nós votamos no primeiro ano, nós tínhamos voto do PSDB , tínhamos voto do PFL. Quem sabe se não era o momento da gente mudar esse ciclo, que se esgotou completamente?
13/06/2005|Jorge Viana|54|Alexandre Machado|Mas o senhor acredita numa reflexão complexa como essa, de se mudar tudo, fazer uma reforma política? Porque no meio do tumulto que nós vamos ver, nós estamos entrando numa fase de turbulência. Se fosse um avião, o “cara” avisava para “botar o cinto, porque vai tremer”, não é isso? O senhor acredita que seja possível? Porque, por exemplo, essa questão da renúncia dos ministros petistas, que foi sugerido pelo senador Tião Viana, ela é um assunto que gira em torno de uma questão, que é o ministro José Dirceu. Ora se diz que o ministro José Dirceu vai ser sacado do governo, ora se diz que, então, todos os ministros petistas sairiam, que seria uma forma dele não sair com a culpa de uma situação. E inclusive hoje, dois jornais publicaram a especulação de que o senhor seria o novo ministro da Casa Civil. O senhor acredita que, no meio dessa confusão, é possível construir esse novo modelo, ou esse momento é propício para uma grande discussão, que vai levar no momento seguinte à busca de um novo modelo?
13/06/2005|Jorge Viana|55|Jorge Viana|Eu já estou me achando complicado, aqui no meio desta arena, imagine em Brasília!  Está mais quente ainda! Não, mas, primeiro, eu queria dizer que o ministro José Dirceu – até por uma questão de justiça – ele cumpriu sempre um papel muito forte de estruturar o PT, de coordenar uma campanha que fez do presidente Lula o vitorioso que foi. E eu acho que ele tem cumprido um papel, dentro do governo, fundamental. Eu até brinco às vezes, digo: “ele é o nosso melhor guerrilheiro”. Para que ele cumpra esse papel, que é muito difícil, ele teve que se expor, ele teve que pagar as contas que, às vezes, não foram dele, não são dele. Eu estava falando: mesmo, esse programa, esse plano de combate ao desmatamento, um tema que a gente tratou ainda há pouco, é um plano que foi gestado com ele, tem sido conduzido com ele, e a ministra Marina ali, e esse crédito não chega nem a ele e, às vezes, nem à ministra Marina.
13/06/2005|Jorge Viana|56|Alexandre Machado|É um dos planos que estão na “banheira”  dele? 
13/06/2005|Jorge Viana|57|Jorge Viana|Pois é... , o Gabeira, eu tenho o maior carinho por ele, mas eu acho que ele foi injusto. De certa forma, ele não foi honesto nem com a Marina, nem com a causa ambiental, nem com o nosso governo, com o nosso presidente. Porque o Gabeira é uma pessoa do bem. Eu fiquei muito triste quando ele saiu do PT. Ele deveria fazer o que a Marina fez quando estava no governo do presidente Fernando Henrique. A Marina chegava a se expor, quando o pessoal do PSDB não se expunha. Porque se vale o que a ministra Marina disse, “ele é da causa”, ele é uma figura boa. E eu não entendi essa agressividade na última entrevista. Parece que ele voltou àquele tempo que ele já tinha deixado de lado. De agressividade, de acreditar em outras coisas. Então, tomara que ele reveja um pouco esse posicionamento.
13/06/2005|Jorge Viana|58|Mario Andrada e Silva|Governador, nós falamos de desmatamento da floresta, e parece que agora a gente está falando de desmatamento da reputação do PT. E o senhor citou que várias pessoas do governo e do partido ficaram atordoadas. Eu queria saber se o senhor acha que o governo já se recuperou, já saiu das cordas, e já está começando a achar o caminho de uma reação, ou o senhor ainda acha que está todo mundo meio atordoado?
13/06/2005|Jorge Viana|59|Jorge Viana|Ainda está um pouco. Porque, no fundo, quando você vê uma pessoa sendo acusada, e daqui a pouco, sem mais nem menos – estou no senso comum - ele resolve fazer o que fez. Eu fiquei estarrecido com a cena do champanhe ! Quando eu vi aquilo, estava lá no interior do Acre, eu falei: “o que está acontecendo?”. Jornalistas recusaram, mas aquilo parecia que era um brinde para o tamanho da confusão que ele  imaginava, criaria no país, ou para o tanto de pauta que ele passaria para a imprensa a partir daquele momento. E agora, fico também estarrecido quando eu vejo a televisão “focando ele” cantando. E o país não pode ficar meio preso nesse ciclo. Acho que o patrimônio do PT sempre foi a coisa mais cara: nós aprendemos a combater a corrupção dentro do PT!
13/06/2005|Jorge Viana|60|Paulo Markun|Mas a falta de reação do governo não é exatamente um sintoma, ou o maior sintoma, de que essa acusação bateu em algum calo? Eu penso o seguinte, a sensação que me dá é a seguinte: a principal demonstração de que existe alguma coisa de errado é a reação do governo, completamente desencontrado, ministros de um lado falando do outro, coordenadores de política falando para outro lado, um diz que conversou, outro diz que não conversou, outro vai lá pedir pelo amor de Deus para o deputado não falar... quer dizer...
13/06/2005|Jorge Viana|61|Jorge Viana|Não, o que eu vejo é o seguinte: quando eu falo “ficamos atordoados”, é diante do quê fazer. O PTB é um partido que tem pessoas muito boas. Mas o seu presidente faz o que fez. Agride outros partidos que estão procurando criar esse ambiente...
13/06/2005|Jorge Viana|62|Fernando Rodriguez|É uma pessoa boa, o presidente do PTB?
13/06/2005|Jorge Viana|63|Jorge Viana|Como?
13/06/2005|Jorge Viana|64|Fernando Rodriguez|O senhor disse que o PTB tem pessoas boas. O senhor está incluindo aí o presidente do PTB, também, nesse rol de pessoas boas?
13/06/2005|Jorge Viana|65|Jorge Viana|Eu não posso incluí-lo, depois do que ele fez. Eu não tenho intimidades com ele, nenhuma. Mas eu acho que...
13/06/2005|Jorge Viana|66|Fernando Rodriguez|No mínimo, dizer que...  que o presidente da República tem. O presidente da República foi jantar no apartamento do Roberto Jefferson, onde hoje ele fica cantando pela janela. Disse que daria a ele um cheque em branco assinado e dormiria tranqüilo, chamou-o de parceiro após esse sujeito, na televisão, que a gente vê recebendo três mil reais e colocando no bolso do paletó. Daí, o presidente continua a dar crédito a ele. Daí, então, o presidente foi enganado, ele foi ingênuo, é isso?
13/06/2005|Jorge Viana|67|Jorge Viana|Eu acho que não diria ingênuo, mas o presidente Lula é uma figura de bom coração. E eu não estou falando isso para diminuir nada...
13/06/2005|Jorge Viana|68|Alexandre Machado|Mas o presidente da República toma certas atitudes...
13/06/2005|Jorge Viana|69|Jorge Viana|Não, mas é verdade. Agora, ele não pode pôr sob suspeição o presidente de um partido. Quem escolhe o presidente do PTB não é o presidente Lula. É o PTB. E como ele está estabelecendo uma relação política com esse partido para dar suporte no Congresso ao projeto de governo dele, como é que ele vai, agora, fazer pré-julgamento? Ele tem que cumprir. Agora, eu queria ressaltar para ti, o presidente Lula não fez nenhum tratamento de tapete vermelho para o deputado Roberto Jefferson. Tanto é que ele passou quase dois anos lamentando, falando em todo canto, que não era recebido. Ele foi recebido uma vez pelo presidente Lula no Palácio . Obviamente que em encontros sociais, o presidente Lula, com os partidos, tem aberto mais espaço. Mas uma pessoa que é recebida uma única vez pelo presidente Lula não pode ser nenhuma referência para o presidente Lula. Isso, como presidente de um partido que tinha em torno de...
13/06/2005|Jorge Viana|70|Fernando Rodriguez|Ele foi jantar no apartamento dele.
13/06/2005|Jorge Viana|71|Jorge Viana|Pois é! Mas aí, encontros sociais são outra coisa.
13/06/2005|Jorge Viana|72|Fernando Rodriguez|Para o social reservado. Não era de muita gente. Eram seis pessoas.
13/06/2005|Jorge Viana|73|Jorge Viana|Pois é, mas aí, é um dirigente de um partido, com ministro daquele partido que compõe o governo, e eu acho que nós não devemos ficar fazendo um pré-julgamento. O deputado Roberto Jefferson estabeleceu uma relação com o governo, colocou-se como um aliado. Nós tivemos, eu acho, que a origem desses problemas, eles começaram depois do primeiro ano, mais vinculado à eleição de prefeitos, o descontentamento do que nós chamamos de “base aliada” foi se ampliando. Agora, o que eu queria dizer para o Markun - assim, eu não estranho muito –, porque a imprensa, neste ano e no ano passado, ficou cobrando do nosso governo, dizendo que é um governo incompetente, que o PT estava incompetente nas relações de aliança. Então, nós estamos perdendo votações. O PT não estava ganhando. Quer dizer, se tivesse a história de “mensalão”, aí, eu pergunto, então: “que diacho de coisa é essa?”. Porque nunca nós fomos tão criticados por não sabermos fazer aquilo que, aliás, nós achávamos que éramos muito bons! Porque nós sempre nos tivemos assim como os bons na política, e eu acho que tem que diminuir esse salto alto, porque nós podemos ser muito bons para fazer oposição na política, mas na hora de governar, nós estamos aprendendo. E a gente tem que ter essa humildade de colocar isso. Mas sinceramente, nós estamos há um ano e meio num fogo cruzado, que é justo, pela imprensa, dizendo: “olha a incompetência, não consegue montar a base tal”. Um partido e um governo que faz isso não está fazendo “mensalão”. Com toda a sinceridade.
13/06/2005|Jorge Viana|74|Helena Chagas|Mas governador, por que o PT optou por essa base? E agora, como é que ele vai continuar sobrevivendo politicamente? Com esses mesmos aliados ou ele vai – é a cruz e a caldeirinha – ou ele vai aceitar o oferecimento do PSDB de garantir a governabilidade para ele poder se livrar dos indesejáveis?
13/06/2005|Jorge Viana|75|Jorge Viana|Olha, eu queria colaborar com uma tese, que é um pouco do que eu falei ainda há pouco. Eu acho que esse modelo está esgotado. Ou alguém aqui acha que... veja o que aconteceu – não vamos falar dos partidos que são aliados, agora, nossos, o PTB, o PP, que estamos discutindo –, vamos falar do PC do B . Nós entregamos dois ministérios para o PC do B nessa lógica. Não é verdade? Para nos ajudar, que, aliás, no Acre, o PC do B tem sido meu líder, o mesmo líder há sete anos. O PC do B tem muito me ajudado, o Edvaldo . Mas nós passamos dois ministérios para o PC do B, que tem nove deputados e, na hora de votar com a gente, se divide. Então, se isso não estiver falido, esse modelo, não tem jeito. Agora, foi adotado. Por que foi adotado isso? Nós estamos disputando com o PSDB. Eu sempre defendi uma tese de que nós deveríamos procurar um diálogo diferenciado com o PSDB. Com toda a sinceridade, estou pondo isso. Agora, essa disputa aqui de São Paulo, ferrenha, porque nós ganhamos do PSDB no plano nacional, mas aqui em São Paulo, nós não ganhamos. Aliás, perdemos a prefeitura que nós tínhamos. Isso tem contaminado, de certa forma, na minha opinião, o trato das questões políticas em Brasília. Aí ficamos nós nos confrontando com o PSDB, e vamos reproduzir o que o presidente Fernando Henrique fazia. Ele entrou, era um homem de esquerda, um grande intelectual, um grande quadro da política brasileira; chegou lá, aliança, primeiro o vice com o PFL, e foi com essa base que ele governou. O PT chega no governo, não tem diálogo com o PSDB, não tem com o PMDB, e vai buscar uma base de sustentação nessas forças políticas. Por isso que eu estou propondo uma inversão, quem sabe se a gente volta agora para construir uma base pontual, em alguns momentos, dependendo dos temas, mudando a agenda do país, você coloca assuntos. Por exemplo, se for reforma política, um grande conhecedor desse Congresso que nós temos hoje é o Marco Maciel . Qual é o problema da gente pegar e ver com o ex-vice-presidente e senador Marco Maciel dele trabalhar nesse grupo?
13/06/2005|Jorge Viana|76|Helena Chagas|Mas o partido dele, o PFL está querendo acabar com o governo na CPI, lá. Como é que faz?
13/06/2005|Jorge Viana|77|Jorge Viana|Pois é, mas isso não pode ser contaminado, porque se for esse processo partidário, o país vai parar de andar, aliás, o presidente Lula falou comigo, ele disse: “Olha eu estou muito preocupado, acho que a CPI tem que andar, tem que apurar”. Agora, vamos ver se acerta com o Congresso um horário para essa CPI funcionar, para que o Congresso possa votar e discutir o que tem que discutir.
13/06/2005|Jorge Viana|78|Helena Chagas|Como funcionaria o modelo que o senhor está sugerindo num ano eleitoral, que todo mundo quer ganhar o seu?
13/06/2005|Jorge Viana|79|Jorge Viana|Pois é! Aí, entra uma coisa: eu, quando conversei com o presidente, algum tempo atrás, até brincando, eu falo assim – ele que fala –: “Jorge, a nossa experiência mais longa, que nós temos de governo, é a tua, da turma nossa, lá no Acre. Por conta da gente na prefeitura, depois sete anos já no governo, e a prefeitura, com o nosso prefeito de Rio Branco, o Angelim. É o lugar que está indo mais longe”. E eu falava para ele: “Presidente Lula, o terceiro ano é o melhor ano para o governo. Porque ele não tem eleição. O primeiro ano é um ano em que o crédito é total para o governo, mas não tem como fazer tanta coisa, algumas mudanças acontecem. O segundo ano, de algum jeito, as pessoas param de cobrar, alguns já não acreditando tanto, e no terceiro, você começa a colher o que plantou.
13/06/2005|Jorge Viana|80|Alexandre Machado|Esse é o terceiro ano do governo Lula.
13/06/2005|Jorge Viana|81|Jorge Viana|Pois é. O terceiro ano era um ano que não podia ser contaminado por temas... por uma agenda tão pesada como esta. Isso é lamentável!
13/06/2005|Jorge Viana|82|Alexandre Machado|O presidente Fernando Henrique, ele me disse, ele até escreveu em determinado artigo, que ele acha que o próximo presidente, o próximo candidato, os candidatos à Presidência deveriam apresentar um programa de reforma política e ficar combinado, desde a campanha, que, sendo eleito, entregaria esse projeto a um referendo popular. Para não ter que fazer a negociação dentro do Congresso. O senhor acha que essa seria uma saída possível?
13/06/2005|Jorge Viana|83|Jorge Viana|Saída a médio e longo prazo, sim. Mas o que fazer agora? Agora nós temos que mexer em algumas coisas... nós temos que tomar atitude diante dessa realidade. Porque independentemente da veracidade ou não, de como a coisa está... o governo vai ter que tomar algumas atitudes na própria estrutura de Estado, e eu acho que não tem como adiar mais esse tema da reforma política. Isso, eu dei uma entrevista há duas semanas para a  Isto É, antes da crise, que quando eu dei, não estava, e já era necessário. Agora, mais do que nunca!
13/06/2005|Jorge Viana|84|Paulo Markun|Vamos fazer mais um intervalo. Queria lembrar a você que está em casa, que você pode encomendar o programa de hoje ou qualquer outro programa Roda Viva, a partir de amanhã, pelo site www.culturamarcas.com.br ou pelo telefone zero, operadora, onze, 3081-3000, e registrar a presença aqui na nossa platéia, esta noite, de Suli de Moura, publicitária, Aníbal Diniz, assessor de comunicação, Camila Issa, estudante de geografia, e Gustavo Conti, estudante de história.
13/06/2005|Jorge Viana|85|[intervalo]|intervalo]
13/06/2005|Jorge Viana|86|[Paulo Markun em off]|A denúncia do “mensalão” parou o Congresso, desencadeando reações de todo tipo. No governo, o ministro José Dirceu, que estava em Madri, não confirmou ter sido informado por Roberto Jefferson, e Antônio Palocci, em nota oficial, disse que nunca foi procurado por Jefferson para falar do assunto. Aldo Rebelo , da coordenação política, confirmou que ele e o presidente Lula souberam do caso. E que apesar de não haver referência a fatos e pessoas, o presidente pediu que a Câmara investigasse. Mas não foram encontradas provas. Aldo Rebelo considerou que o escândalo não afeta o governo.
13/06/2005|Jorge Viana|87|[ VT com Aldo Rebelo]|Não há uma acusação contra o governo. O que há é uma denúncia envolvendo o pagamento de um partido a outros partidos.
13/06/2005|Jorge Viana|88|[Paulo Markun em off]|No olho do furacão, o PT se reuniu em São Paulo, onde divulgou nota repudiando as acusações. Chamou a imprensa para as explicações de Delúbio Soares, o tesoureiro  acusado de pagar o “mensalão”.
13/06/2005|Jorge Viana|89|[VT com Delúbio Soares]|O PT não participa de compra de votos de deputados. O PT não participa de compra de apoio de deputados.
13/06/2005|Jorge Viana|90|[VT com José Genoíno]|Diante das mentiras que estão sendo colocadas, hora a hora e diariamente contra o PT, nós vamos para a ofensiva e essa ofensiva é em vários terrenos. Vamos para a ofensiva, seja na CPI dos Correios, vamos para a ofensiva na base do partido e vamos para a ofensiva no enfrentamento político. 
13/06/2005|Jorge Viana|91|[VT com Olívio Dutra]|Nós estamos pagando um preço pelas más companhias que tivemos que ter em razão de que o presidente Lula não foi eleito com maioria no Congresso. Então, a gente tem que se cuidar das más companhias, né?
