|DATA|ENTREVISTA|ORDEM|LOCUTOR|FALA
180|29/09/2008|Wagner Moura|181|Wagner Moura| O Cacá foi muito importante na minha vida, Deus é brasileiro foi o primeiro filme que eu protagonizei. Ele me deu uma oportunidade... eu era um cara desconhecido, era o Selton que ia fazer esse filme e, por uma questão de agenda, não conseguiu. O Cacá Diegues apostou em mim, é um homem e um diretor que eu gosto muito, me ensinou muita coisa em cinema, é um pensador muito lúcido da cultura brasileira. As coisas que ele escreve, gosto muito de conversar com ele, é um grande amigo. Agora, eu trabalhei com o Waltinho Salles , um sujeito, um príncipe incrível. O Zé Padilha é uma parceria que eu estou fechando forte, o Vicente Amorim é um diretor que eu adorei trabalhar. O Sérgio Machado também, que dirigiu Cidade baixa ... É bem difícil!
181|29/09/2008|Wagner Moura|182|Mônica Bergamo| Você vai para um novo filme, vai ser lançado?
182|29/09/2008|Wagner Moura|183|Wagner Moura| Vai ter uma estréia agora no Festival do Rio e acredito que no final do ano, em novembro.
183|29/09/2008|Wagner Moura|184|Lillian Witte Fibe| Qual é o filme, quais são os filmes?
184|29/09/2008|Wagner Moura|185|Wagner Moura| Amanhã no Festival do Rio tem a exibição de um filme em que eu fiz a narração. É um documentário sobre o assassinato da Irmã Dorothy . Esse é um assunto que me inquieta muito: a violência agrária, principalmente no norte do Brasil, no Pará. Tem a morte de Chico Mendes, a morte da Irmã Dorothy... E esse filme vai ajudar na discussão sobre o assunto.
185|29/09/2008|Wagner Moura|186|Lillian Witte Fibe| De quem é o documentário?
186|29/09/2008|Wagner Moura|187|Wagner Moura| De um americano chamado Daniel .
187|29/09/2008|Wagner Moura|188|Lillian Witte Fibe| E você narra?
188|29/09/2008|Wagner Moura|189|Wagner Moura| É, ele lançou nos Estados Unidos e no Brasil e quis um narrador brasileiro. Como ele sabia que eu já tinha feito declarações a esse respeito... Eu tenho muito interesse nesse assunto, porque se a Justiça é terrível aqui nas grandes cidades, no norte do Brasil é ainda mais assustadora. Lá, geralmente, quem detém o poder são os grandes latifundiários, os prefeitos que comandam politicamente as grandes cidades. E tem toda a história de assassinatos... nenhum mandante de assassinato de trabalhador rural, nem de ativista de direitos humanos, está preso no Brasil. Zero. Há alguns pistoleiros presos, mas nenhum mandante foi preso. E esse caso da Dorothy é muito impactante porque o Bida, um dos ma
