|DATA|ENTREVISTA|ORDEM|LOCUTOR|FALA
0|29/09/2008|Wagner Moura|1|[programa ao vivo, permitindo a participação dos telespectadores]|
1|29/09/2008|Wagner Moura|2|Lillian Witte Fibe| Boa noite. Aos 32 anos, ele é um ator consagrado. Tanto a crítica quanto o público se desmancham em elogios para esse rapaz baiano que rouba a cena, seja no cinema, fazendo um traficante ou um policial honesto e linha dura, seja no palco, no papel do vingativo príncipe Hamlet , de Shakespeare, que lota um teatro de quinhentos lugares há mais de três meses. O Roda Viva recebe Wagner Moura, formado, veja só, em jornalismo. A gente volta em trinta segundos com o Roda Viva, que esta noite faz aniversário: 22 anos desde a primeira exibição. Até já.
2|29/09/2008|Wagner Moura|3|[intervalo]|
3|29/09/2008|Wagner Moura|4|Lillian Witte Fibe| Pode-se dizer que ele estourou há cinco anos, com trabalhos muito elogiados no cinema. Não demorou muito para que ele aparecesse na tela da  Globo. Mas a paixão é mesmo o teatro, onde ele descobriu a vocação, ainda adolescente, na cidade onde nasceu.
4|29/09/2008|Wagner Moura|5|[Comentarista]| O baiano Wagner Maniçoba Moura nasceu em Salvador, há 32 anos. O pai, militar, serviu em várias cidades, e ele passou grande parte da infância na cidade de Rodelas, no interior da Bahia. Preocupada com a criação do filho, a família retornou à capital baiana. A proximidade com tudo que a cidade grande oferecia deu um novo impulso para Wagner Moura. Com 15 anos de idade, começou sua carreira nos palcos da capital baiana, primeiro para ficar perto de garotas, mas logo se encantou em fazer uma coisa prazeirosa e ainda ganhar algum dinheiro. Nessa mesma época também tocava em uma banda de rock. Mas, no começo da carreira profissional, Wagner Moura chegou a balançar entre o jornalismo, com trabalhos em jornal e assessoria de imprensa, e as artes cênicas. Abortou a carreira jornalística depois de prejuízos e calotes e seguiu firme como ator. De 1992 a 1999, fez teatro em Salvador até seguir para o Rio de Janeiro, onde encenou a peça A máquina , de João Falcão. Na época, morou com o conterrâneo Lázaro Ramos . Na TV, fez seriados, a minissérie JK  e ganhou fama de galã depois das novelas da Globo A lua me disse  e Paraíso tropical . No cinema, deu os primeiros passos em 2000, no filme Sabor da paixão , ao lado de Murilo Benício e da espanhola Penélope Cruz. Já no cinema nacional, Wagner Moura participou de produções importantes, como Abril despedaçado, de Walter Salles, em 2000. Em 2003, Wagner Moura participou do muito comentado Carandiru . Nesse mesmo ano, trabalhou  O caminho das nuvens, e  Deus é brasileiro . No ano passado, fez outros longas: em Ó pai ó  contracenou no cenário que tanto conhece, Salvador, ao lado do também baiano Lázaro Ramos.  2007 foi um ano cheio de atividade no cinema. Por conta do filme Tropa de elite, seu rosto foi um dos mais vistos nas telas grandes e nos DVDs, sejam originais ou piratas. Como Capitão Nascimento, um herói para uns e anti-herói para outros, ganhou simpatia e reconhecimento do grande público. O filme traz, como Wagner Moura mesmo classifica, um ponto de vista fundamental para se entender e discutir a segurança pública: o olhar policial. Depois de três anos afastados do teatro, atualmente ele voltou aos palcos, onde encena Hamlet, de William Shakespeare, personagem por qual se declara apaixonado desde a juventude. Wagner Moura é casado com a fotógrafa Sandra Delgado e tem um filho de dois anos de idade.
5|29/09/2008|Wagner Moura|6|Lillian Witte Fibe|" Para entrevistar o ator Wagner Moura a gente convidou: Cristina Padiglione, editora do suplemento ""TV & Lazer"" e colunista do ""Caderno Dois"" do jornal O Estado de S. Paulo; Mônica Bergamo, colunista do jornal Folha de S.Paulo; Jefferson Del Rios, crítico de teatro do programa Metrópolis, da TV Cultura; Nina Lemos, repórter especial da revista TPM; Laila Dawa, repórter daqui da TV Cultura, que vai trazer para a entrevista as perguntas enviadas por telespectadores através do telefone: (11) 3677-1310 ou também pelo site www.tvcultura.com.br/rodaviva. Com a gente, claro, o cartunista Paulo Caruso, que dispensa apresentações. A gente tem também a colaboração de três usuários do comunicador Twitter, que permite a troca de pequenas mensagens via celular e e-mail. Eles vão colocar na internet as impressões sobre a entrevista de hoje. E para ver o que eles estão escrevendo, basta acessar os endereços que aparecem na tela. O Roda Viva também está no Twitter. Para seguir a gente, é só clicar ""follow"" no endereço twitter.com/rodaviva. Boa noite, Wagner Moura. Obrigada pela sua entrevista. Eu acho que hoje o programa vai ser de tietagem explícita, deixa eu avisar logo."
6|29/09/2008|Wagner Moura|7|[risos]|
7|29/09/2008|Wagner Moura|8|Lillian Witte Fibe| Wagner, me diga uma coisa, eu pensei que, diante de tanta discussão sobre o futuro das mídias, a queda mundial de bilheteria, discussão sobre equipamento digital mais leve, surgimento de telas pequenas, o sucesso de Hamlet é uma coisa paradoxal e a prova de que uma das mais antigas artes cênicas não está em discussão. Ela não vai acabar e está lotando teatros, com uma cadeira apertadinha que a gente não consegue pôr o joelho, um sucesso incrível.
8|29/09/2008|Wagner Moura|9|Wagner Moura| Não vai acabar nunca. Eu acho que as mídias se alimentam muito... as pessoas vão buscar no teatro o que elas não vêem no cinema, na televisão, na internet. Não acaba nunca, é uma arte milenar. E Shakespeare está vivo até hoje, vai enterrar a gente, nossos tataranetos também vão ver Shakespeare.
9|29/09/2008|Wagner Moura|10|Lillian Witte Fibe| Todo mundo está rediscutindo televisão, imprensa escrita, cinema. E o teatro está um sucesso.
10|29/09/2008|Wagner Moura|11|Wagner Moura| O teatro está aí, não acaba nunca.
11|29/09/2008|Wagner Moura|12|Lillian Witte Fibe| Há chances de estender  além de 2 de novembro?
12|29/09/2008|Wagner Moura|13|Wagner Moura| Já estendemos, vamos até fevereiro.
13|29/09/2008|Wagner Moura|14|Cristina Padiglione| Com relação a usar uma mídia que completa a outra, vocês usam a câmera . De quem partiu a idéia?
14|29/09/2008|Wagner Moura|15|Wagner Moura| Engraçado, porque o Aderbal Freire-Filho , diretor da peça, é totalmente avesso a essas coisas tecnológicas em espetáculos. E vocês viram os espetáculos dele, são sempre muito básicos, atores ali e pronto. E ele é que veio com essa história da câmera.
15|29/09/2008|Wagner Moura|16|Cristina Padiglione| E é um teatro com closes.
16|29/09/2008|Wagner Moura|17|Wagner Moura| Engraçado você falar isso, porque uma vez Jorge Furtado  me disse que não faz teatro porque teatro não tem close, só tem plano aberto. E não é verdade. Mas o teatro é tão lindo e tão poderoso porque o ator chama o close, não é? O ator chama para o close de uma mão, um rosto. Por isso que eu até fico meio assim de falar porque... eu acho o teatro uma arte muito poderosa e mais poderosa do que essas todas. E não é à toa que está vivo até hoje. E não morre nunca.
17|29/09/2008|Wagner Moura|18|Cristina Padiglione| A idéia não é tua?
18|29/09/2008|Wagner Moura|19|Wagner Moura| A idéia da câmera foi do Aderbal. E tem disso também: reforçar essa idéia de que enquanto está acontecendo uma coisa aqui, ver o outro lado. Uma das partes que eu gosto muito é quando Ophelia e Hamlet se encontram, e o Claudius e Polonius estão observando escondidos. A câmera mostra isso e o público está vendo alí atrás os dois personagens. Então, o público está vendo realmente, estão observando um close grande. É legal, mas não acho que é o mais interessante.
19|29/09/2008|Wagner Moura|20|Cristina Padiglione| Não digo isso, mas que é engraçado é.
20|29/09/2008|Wagner Moura|21|Wagner Moura| Eu acho que funciona bem, que é harmônico.
21|29/09/2008|Wagner Moura|22|Cristina Padiglione| Senti um pouco de temor, em um momento, quando estava prestando atenção na imagem e a cena que está se passando no palco, a principal, era outra, desviando o foco de atenção. Mas, enfim, num mundo em que você faz quase tudo ao mesmo tempo talvez funcione legal.
22|29/09/2008|Wagner Moura|23|Jefferson Del Rios| Wagner, em primeiro lugar queria te cumprimentar pela beleza de apresentação do seu Hamlet. Aliás, se a minha modesta opinião de crítico vale, eu recomendo a você, telespectador. Se não viu, vá lá correndo, porque é um grande trabalho, está na melhor linhagem dos grandes intérpretes brasileiros. Você honra o Sérgio Cardoso .
23|29/09/2008|Wagner Moura|24|Wagner Moura| Puxa vida!
24|29/09/2008|Wagner Moura|25|Lillian Witte Fibe| Fazendo um apêndice, tem que comprar com antecedência, porque lota. Eu estou telefonando para a bilheteria, por curiosidade, para saber. Quase que eu não consigo ver, quando vi que ia entrevistá-lo fui comprar o ingresso. E lota.
25|29/09/2008|Wagner Moura|26|Jefferson Del Rios| Eu sou curioso sobre atores que saem da província. Salvador é uma cidade meio africana, não é bem o interior da Bahia. E grandes atores brasileiros como o nosso maravilhoso Othon Bastos é um baiano de Tucano, o Tom Zé  é de Irará. E você teve a infância na cidade de Rodelas. Eu soube que nessa cidade tem muito mármore...
26|29/09/2008|Wagner Moura|27|Wagner Moura| Não, é uma cidade  ribeirinha. O que tem de interesse em Rodelas - e eu acompanhei isso quando criança, na beira do rio São Francisco, era lindo demais aquele rio que corria ali - é que ela se transformou numa nova cidade, fez parte daquelas que foram inundadas pela barragem Itaparica. Isso foi uma coisa muito interessante, porque a cidade inteira se mudou para alguns quilômetros à frente e se transformou em outra completamente diferente do que era antes. Mas a minha infância foi alí, à beira desse rio.
27|29/09/2008|Wagner Moura|28|Jefferson Del Rios| Você ficou lá até os 15 anos, não é?
28|29/09/2008|Wagner Moura|29|Laila Dawa| E por falar em Rodelas, a gente já tem a pergunta de um dos telespectadores: durante esse período em que você esteve no sertão da Bahia, quais os traços culturais que você percebeu lá que diferenciam esse lugar do resto do país? O que mais te marcou? O que você observa de diferente no resto do país e por outros lugares por onde andou? Pergunta de Alman Alves da Costa, de Sergipe.
29|29/09/2008|Wagner Moura|30|Wagner Moura|" É difícil falar isso. Eu sou muito esse homem que é fruto desse lugar, tanto que em Deus é brasileiro, quando eu li o roteiro, falei: ""eu sei que posso fazer isso bem, porque eu conheço muito aquilo, esse universo"" O que diferencia... Eu não sei... Está meio explícito, o sertão tem uma cultura popular muito forte, muito... Eu me lembro que a religiosidade é muito forte. Quando houve essa mudança de uma cidade para outra, me lembro que foi transportada uma imagem que eu não esqueço nunca mais. Havia uma imagem de Santo Antônio, padroeiro da cidade, feita de pedra pelos índios dali da região de Rodelas, e ele foi transportado de uma cidade para a outra. E a comoção causada nas pessoas por essa passagem desse santo de um lugar ao outro é uma coisa que eu não esqueço nunca mais. Eu lembro, como se fosse hoje, que uma hora que o santo bambeou, ele quase cai, as mulheres começaram a gritar. Então, tem um lado de cultura popular e de religiosidade entranhada dentro da alma das pessoas, mas eu acho que é superficializar dizer o que é um sertanejo. Guimarães Rosa falou muito melhor do que eu!"
30|29/09/2008|Wagner Moura|31|Mônica Bergamo| Eu queria voltar para o assunto de teatro. Existe uma discussão no Brasil, hoje, sobre o financiamento do teatro. Imagino que você participe dela, já ouvi algumas opiniões suas. Recentemente, o ministro da Cultura  fez um diagnóstico que, resumidamente, é o seguinte: antes da Lei Rouanet, o teatro tinha de seis a oito sessões por semana, as temporadas eram mais longas. E com a lei Rouanet, mais dinheiro colocado no teatro, no entanto, hoje são duas a três sessões por semana e, de acordo com o diagnóstico dele, isso acontece porque o lucro não vem mais da bilheteria, vem do dinheiro que você vai captar com a Lei Rouanet; quer dizer, o produtor vai lá, capta o dinheiro, garante seu lucro e a bilheteria passa a não ser importante. Em conseqüência, de acordo com ele, o público também passa a não ser mais tão importante, a não ser para a vaidade do ator, não mais para o empresário. Então, eu queria perguntar várias coisas: como é o financiamento da sua peça, quanto custa o ingresso, como você lucra com isso, se o lucro vem da bilheteria ou não, e  que você comentasse um pouco sobre as propostas feitas por eles  para mudar esse financiamento.
31|29/09/2008|Wagner Moura|32|Wagner Moura| De fato, o nosso lucro é... Primeiro, é preciso que se diga uma coisa: realmente, antes da lei Rouanet era muito mais difícil fazer teatro. Hoje em dia, os atores de teatro têm uma dignidade financeira que eles não tinham antes.
32|29/09/2008|Wagner Moura|33|Mônica Bergamo|"  O Juca Ferreira, numa entrevista, falou o seguinte: “Só quem consegue dinheiro por essa lei são os atores Juca de Oliveira, Tony Ramos e a Fernanda Montenegro"". E agora eu acrescento o Wagner Moura. Todos os atores têm essa dignidade?"
33|29/09/2008|Wagner Moura|34|Wagner Moura| Na minha peça há dez atores de teatro. Com exceção do Tonico Pereira, que faz TV, todos os outros estão tendo oportunidade de ter essa dignidade. Sem dúvida, fui beneficiado por isso porque sou um ator popular, não tenho a menor dúvida disso. E essa é uma das situações que eu acho que precisam ser resolvidas.
34|29/09/2008|Wagner Moura|35|Mônica Bergamo| Essa peça é toda financiada pela...
35|29/09/2008|Wagner Moura|36|Wagner Moura| Minha peça é toda financiada pela Lei Rouanet, com o patrocínio do  Bradesco.
36|29/09/2008|Wagner Moura|37|Mônica Bergamo| Ela está paga. Se não for ninguém no teatro...
37|29/09/2008|Wagner Moura|38|Wagner Moura| Não, não. Nós tivemos um dinheiro para estrear a peça, e esse dinheiro acabou. E aí está a distorção: com os 30% que temos reservados para a produção nós não conseguimos manter a peça com o ingresso a oitenta reais. Então, de fato, alguma coisa está errada nisso. Precisamos captar mais para poder manter os dez atores aqui, todos em um hotel, em quarto individual, passagens aéreas... Porque a gente não tem dinheiro para financiamento para passagem aérea e nem patrocínio de hotel. Então, sem dúvida, há uma distorção nisso, quando você não precisa mais do dinheiro do público para... O que eu faço, da minha parte, é tentar manter o espetáculo vivo o máximo de tempo possível. O meu dinheiro acabou, eu tive que captar mais, mas o que eu puder fazer para manter... É por isso que os oitenta reais de ingresso, não é caro, porque com isso não consigo manter.
38|29/09/2008|Wagner Moura|39|Lillian Witte Fibe|: Quanto custa uma peça?
39|29/09/2008|Wagner Moura|40|Wagner Moura| Olha, depende muito.
40|29/09/2008|Wagner Moura|41|Lillian Witte Fibe| Hamlet, por exemplo?
41|29/09/2008|Wagner Moura|42|Wagner Moura| Levantamos minha peça com oitocentos mil reais e eu botei meu dinheiro para ela poder estrear.
42|29/09/2008|Wagner Moura|43|Lillian Witte Fibe| Muito?
43|29/09/2008|Wagner Moura|44|Wagner Moura| Eu botei uns cinquenta mil  e o Serginho , meu parceiro, botou mais... Fechamos em mais ou menos um milhão.
44|29/09/2008|Wagner Moura|45|Lillian Witte Fibe| Dura quanto tempo esse dinheiro?
45|29/09/2008|Wagner Moura|46|Wagner Moura| No terceiro mês de temporada, o dinheiro acabou e a gente teve que captar mais. Agora, eu acredito que se a gente estivesse no Rio de Janeiro, sem ter que pagar passagem, hospedagem para manter os atores, em um teatro maior, como o Teatro Casa Grande, onde ficaremos, acho que daria. Mas tudo isso é, sem dúvida, uma distorção, precisa ser revisto.
46|29/09/2008|Wagner Moura|47|Nina Lemos| Você acha bom que alguém que não conheça Shakespeare tome conhecimento da obra dele porque é seu fã, porque acompanha você da televisão? Você percebe que isso acontece?
47|29/09/2008|Wagner Moura|48|Wagner Moura| Eu acho ótimo, muita gente vai ver o Capitão Nascimento e volta com o Hamlet para casa. Eu acho ótimo, não posso reclamar disso. Eu tento botar pessoas que não podem pagar oitenta reais - minha meta é botar duas mil pessoas de escolas públicas, alunos que nunca viram Shakespeare - umas cinquenta  em um dia, de graça. Mas são coisas que eu faço porque quero, porque nossa arte é uma arte que tem que ser vendida. E o teatro é visto por uma minoria, embora o dinheiro seja público. Mas o que eu tento fazer, além disso, é manter o espetáculo vivo o mais tempo possível, eu só vou parar de fazer quando ninguém mais aguentar assistir, porque o que acho realmente estranho é você pegar o dinheiro do patrocínio, montar seu espetáculo em dois meses - você pode até botar de graça - as pessoas assistem a peça de graça e, em dois meses, sua peça acaba. Isso é condenável.
48|29/09/2008|Wagner Moura|49|Mônica Bergamo| O lucro acaba.
49|29/09/2008|Wagner Moura|50|Wagner Moura| Acaba. Então, eu prefiro cobrar oitenta reais e ficar dois anos, do que  dois meses de graça, acabar, captar mais, botar o dinheiro no bolso e fazer outro. Aí eu acho que é errado.
50|29/09/2008|Wagner Moura|51|Lillian Witte Fibe| Vamos fazer um intervalo. Voltamos num instante com o Roda Viva, que é acompanhado por três twitteiros que estão colocando na internet seus comentários sobre o programa. São eles: Larissa Menon, estudante de rádio e TV; Alexandre Fujita, blogueiro; Verônica Mambrini, colunista do site Digestivo Cultural. Até já.
51|29/09/2008|Wagner Moura|52|[intervalo]|
52|29/09/2008|Wagner Moura|53|[VT de um trecho do filme Tropa de elite]|
53|29/09/2008|Wagner Moura|54|Lillian Witte Fibe| Bom, trata-se de Tropa de elite, filme de José Padilha em que nosso entrevistado, Wagner Moura, arrebatou o Brasil no papel de um policial honesto no Rio de Janeiro, o Capitão Nascimento. Wagner, diante da repercussão de Tropa de elite, tudo que aconteceu, você, que é uma pessoa engajada socialmente, depois do filme, ficou com mais ou menos esperança no Rio de Janeiro em que o teu filho está crescendo?
54|29/09/2008|Wagner Moura|55|Wagner Moura| Essa pergunta é difícil. Eu não sei dizer se mais ou menos, mas eu tive um choque de realidade. É como se você...eu supunha que aquilo existisse, mas estar ali perto me comprovou que a coisa é muito grave, o tema segurança pública, a nossa situação, especialmente no Rio de Janeiro, é bastante grave. Então foi meio assustador. Mas eu sou uma pessoa otimista, gosto do fato do meu filho ser carioca. O Rio é uma cidade que eu gosto demais, me recebeu muito bem, passei um pedaço da minha infância lá, sou bastante otimista.
55|29/09/2008|Wagner Moura|56|Lillian Witte Fibe| Tem conserto?
56|29/09/2008|Wagner Moura|57|Wagner Moura| Eu acho que sim.
57|29/09/2008|Wagner Moura|58|Mônica Bergamo| Wagner, quando chamaram o filme de fascista você disse: ”Fascistas somos nós brasileiros, cidadãos carentes de uma política de segurança, que vemos naqueles policiais honestos, mas que desrespeitam os direitos humanos elementares, a solução para o caos em que estamos metidos”. Então, eu queria saber sua opinião à luz da sua frase e sobre a política de confronto adotada pelo governador Sérgio Cabral . O que você acha dela?
58|29/09/2008|Wagner Moura|59|Wagner Moura| Lamentável. Eu votei em Sérgio Cabral, ele é um político bem intencionado, eu gosto dele. Mas me parece óbvio que a política de confronto não é a melhor solução para resolver a questão da violência. Matar traficante não é - tem sido assim, inclusive através dos tempos. E está provado que não tem resultado. Esse fato de o Exército subir a favela até me soa meio ridículo, me parece meio trágico e patético aqueles soldados com fuzis nas favelas. Eu acho e vou continuar achando sempre que a principal solução para a violência é tirar a garotada do tráfico, dar uma possibilidade de o garoto não ir para o tráfico. Aquilo ali é um emprego para ele, é um cara que passa a vida ali vendo televisão, os tênis Nike na televisão, que mora na  Rocinha, do lado de São Conrado . Ele vê essa discrepância social absurda, que no Rio é exposta pela própria geografia carioca, e sem nenhuma perspectiva. Mora num lugar onde não tem saneamento básico, não tem biblioteca, não tem contato com a arte, não pode abastecer o espírito dele com leitura, com teatro, com revista, com a praça para jogar bola. Aí, em vez de você dar isso para o garoto, você manda a polícia lá?
59|29/09/2008|Wagner Moura|60|Mônica Bergamo| Você acha que existe uma tolerância dos governantes? A ONU  diz que, diante dessa política, há uma tolerância para a polícia matar no Brasil.
60|29/09/2008|Wagner Moura|61|Wagner Moura|" Sim, nós somos tolerantes com isso, a sociedade é tolerante com isso. Inclusive, quando eu digo que talvez fascistas estejamos nos tornando nós próprios é porque há uma parcela grande da sociedade que, quando vê Tropa de elite, por exemplo, acha que aquilo é isso mesmo, que o Capitão Nascimento é um herói. Ele é um homem incorruptível no sentido financeiro, na minha opinião, mas a corrupção moral é muito mais tenebrosa do que a corrupção financeira. Eles são moralmente corruptos porque torturam e matam, mas as pessoas vêem aquele homem como um salvador. E é terrível a gente pensar nisso. Não posso culpar essas pessoas por pensarem assim, são pessoas carentes de qualquer tipo de política de segurança pública. Então, quando ele vê o cara fortão, de preto, indo ali na favela e matando os bandidos, ele diz: ""É isso aí"". E você vê, o regime de força, o próprio fascismo surgiu dessa forma. A polícia brasileira mata muito mais do que a polícia norte-americana, que é conhecida como a polícia belicosa e armada."
61|29/09/2008|Wagner Moura|62|Laila Dawa| Wagner, a gente tem aqui a pergunta do Fábio Cortez, de São Paulo. Ele pergunta se você faria um possível Tropa de elite 2 e, emendando nessa pergunta, o Jaime Ramos, de Niterói, Rio de Janeiro, quer saber o que você gosta mais de fazer: cinema ou televisão.
62|29/09/2008|Wagner Moura|63|Wagner Moura| Olha, sobre o Tropa de elite 2, eu estabeleci uma relação muito boa com o Zé Padilha, foi um diretor com quem eu gostei muito de trabalhar, é uma pessoa muito interessante, é um homem que não filma de bobeira. Se você vir os filmes dele, tanto o Ônibus 174, quanto o Tropa de elite, quanto esse filme da fome, um documentário que ele acabou de fazer , você vai ver que os filmes dele não são feitos assim. Se um dia o Zé Padilha me disser que quer fazer um Tropa de elite 2 eu vou enxergar um motivo nele para isso. Se o Bráulio Mantovani  me disser que vai escrever o roteiro...
63|29/09/2008|Wagner Moura|64|Lillian Witte Fibe| E já falaram ou não?
64|29/09/2008|Wagner Moura|65|Wagner Moura| Não.
65|29/09/2008|Wagner Moura|66|Lillian Witte Fibe| Nenhum dos dois tocou no assunto?
66|29/09/2008|Wagner Moura|67|Wagner Moura| Não, mas eu sei que existe uma coisa assim, nesse sentido. É capaz, embora não seja para o ator a coisa mais interessante do mundo voltar a um personagem...
67|29/09/2008|Wagner Moura|68|Lillian Witte Fibe| Por quê?
68|29/09/2008|Wagner Moura|69|Wagner Moura| Porque é uma repetição. A gente está querendo sempre fazer uma coisa diferente.
69|29/09/2008|Wagner Moura|70|Cristina Padiglione| Eu me lembro de ter visto uma entrevista rápida sua na volta de Berlim. Assim que ganhou  Berlim  você disse que não queria voltar ao Capitão Nascimento.
70|29/09/2008|Wagner Moura|71|Wagner Moura| Eu tomei Capitão Nascimento na veia durante anos...
71|29/09/2008|Wagner Moura|72|Cristina Padiglione| E eu falei: “poxa, teve toda uma defesa de que não era fascista e tal, mas ele parece que não está conseguindo...”. Ou é o medo de ficar estereotipado?
72|29/09/2008|Wagner Moura|73|Wagner Moura| Não, sem falsa modéstia, eu tenho muita confiança que eu sou um ator que pode fazer outras coisas.
73|29/09/2008|Wagner Moura|74|Lillian Witte Fibe| Ah, pode, viu! Você pode!
74|29/09/2008|Wagner Moura|75|[risos]|
75|29/09/2008|Wagner Moura|76|Wagner Moura| E que não vou ficar restrito a um personagem.
76|29/09/2008|Wagner Moura|77|Cristina Padiglione| O Capitão Nascimento é o seu personagem mais famoso, mais do que Olavo, da novela das oito da Globo? 
77|29/09/2008|Wagner Moura|78|Wagner Moura| Eu acho que sim, mas aconteceu uma coisa muito louca. O Capitão Nascimento apareceu no momento em que o Olavo estava muito popular,  acabando Paraíso tropical. E eu fiquei muito conhecido de uma hora para outra. Mas eu acho que, ainda assim, o Capitão Nascimento ficou mais no imaginário.
78|29/09/2008|Wagner Moura|79|Cristina Padiglione| Você acha que é mais pela força do personagem ou pela audiência? Porque foi uma audiência de novela em função da pirataria...
79|29/09/2008|Wagner Moura|80|Wagner Moura| Pelas duas coisas.
80|29/09/2008|Wagner Moura|81|Lillian Witte Fibe| Eu estou preocupada com a segunda pergunta.
